id	area	title	year	x	y	ix
3390133	AI	evacuation simulation with limited capacity sinks - an evolutionary approach to solve the shelter allocation and capacity assignment problem in a multi-agent evacuation simulation	2010	-5.068309894721383	3.4529553093457865	3390160
3397946	AI	the use of a fuzzy multi-objective linear programming for solving a multi-objective single-machine scheduling problem	2010	-4.860515474010134	3.2050389637015066	3397973
3399016	AI	contingency-constrained unit commitment with post-contingency corrective recourse	2017	-4.7753081740327685	3.434687856758535	3399043
3399911	EDA	lp-based power grid enhancement methodology	2017	-4.488618545513356	3.0762059923399616	3399938
3401775	EDA	evolutionary generator maintenance scheduling in power systems	2007	-5.215444742530853	2.691816643734492	3401802
3402510	ML	a local relaxation approach for the siting of electrical substations	2006	-4.565699171676613	2.9983064534809296	3402537
3405941	Robotics	design and implementation of hydrological sensor web optimal deployment prototype system	2017	-4.642531434516429	3.3770985667029643	3405968
3406615	Robotics	algorithm based on simulated annealing for land-use allocation	2008	-5.101998169430103	3.093254382177617	3406642
3409735	Robotics	worldwide aeronautical route planner	1999	-4.6310580871577285	3.5426206389163637	3409762
3412035	NLP	scheduling alternatives with respect to fuzzy and preference modeling on time parameters	2017	-4.5590728551551685	3.2150302653721905	3412062
3414824	Robotics	two-stage robust optimization, state-space representable uncertainty and applications	2014	-5.0706304373348825	2.8518171370980587	3414851
3415040	Robotics	multiperiod coverage path planning and scheduling for airborne surveillance	2018	-5.184454950243353	3.4649434438469715	3415067
3415486	ML	new results about multi-band uncertainty in robust optimization	2012	-4.86291186811	2.844621762672837	3415513
3416363	AI	optimum allocation of centers in transportation networks by means of fuzzy graph bases	2013	-4.84263919683242	3.1481296826710032	3416390
3417167	ML	modeling optimal allocation centers in gis by fuzzy base set of fuzzy interval graph	2014	-4.8224133219899885	2.9798094322353457	3417194
3418639	Theory	emergence of new global airline networks and distributing loads in star airports	2013	-5.1603990317070965	3.372896063282912	3418666
3418711	ML	computational optimization of gas compressor stations: minlp models versus continuous reformulations	2016	-4.42944547738619	3.5977173776640248	3418738
3418740	EDA	reinforcing power grid transmission with facts devices	2013	-4.464346068606316	2.7170100783817737	3418767
3421263	AI	an improved simulated annealing technique for enhanced mobility in smart cities	2016	-4.993554175757326	3.5754662626099494	3421290
3424209	EDA	hybrid genetic algorithm applied to the determination of the optimal operation of hydrothermal systems	2006	-4.892478446148532	2.7426381941409046	3424236
3425892	AI	stackelberg strategies for wastewater management	2015	-4.365341605820692	2.7196070829346084	3425919
3427009	AI	route guidance system based on self adaptive multiagent algorithm	2011	-4.8331172551482116	3.5966374669138736	3427036
3431126	AI	classification of spatial properties for spatial allocation modeling	2005	-4.415053113075256	3.0910208430636232	3431153
3433235	AI	r2-ibmols applied to a practical case of the multiobjective knapsack problem	2017	-4.76074564472648	3.4464971618782383	3433262
3433585	AI	a framework to expedite joint energy-reserve payment cost minimization using a custom-designed method based on mixed integer genetic algorithm	2018	-5.140630472693455	3.345466832929749	3433612
3437276	Embedded	a multiobjective approach for finding equivalent inverse images of pareto-optimal objective vectors	2009	-4.771372406568448	2.7867768120061673	3437303
3439388	AI	multi-agent based petroleum supply chain coordination: a co-evolutionary particle swarm optimization approach	2009	-4.8269084438978185	3.3722552113723365	3439415
3443245	AI	memetic algorithm for solving the problem of social portfolio using outranking model	2013	-4.848272498281957	2.7783831337232874	3443272
3443902	AI	new optimisation model and fuzzy adaptive weighted genetic algorithm for hazardous material transportation	2012	-5.203459332229705	3.603456330906461	3443929
3448767	AI	fragmental optimization on the 2-machine bicriteria flowshop scheduling problem	2003	-5.036457195300894	2.6841470103915275	3448794
3452611	Robotics	multi constrained route optimization for electric vehicles using sime	2011	-5.2372591266289215	3.540162937879737	3452638
3454359	AI	"""erratum to """"interactive multiple criteria decision making based on preference driven evolutionary multiobjective optimization with controllable accuracy, european journal of operational research 216 (2012) 188-199"""""""	2013	-5.222525749098302	2.799881225072133	3454386
3458009	Robotics	limited multi-stage stochastic programming for managing water supply systems	2013	-4.520066604755352	2.894034408564195	3458036
3468270	Embedded	hybrid metaheuristic for annual hydropower generation optimization	2014	-4.752360300210689	2.744890151967257	3468297
3472423	HCI	optimal unit commitment in simulations of hydrothermal power systems: an augmented lagrangian approach	1994	-4.674780175962443	2.9977217781581325	3472450
3476313	AI	adaptive job-shop scheduling with routing and sequencing flexibility using expert knowledge and coloured petri nets	2000	-5.133917476667829	3.321329922139	3476340
3477954	DB	optimization of a corn-processing simulation model	1992	-4.396815013347758	3.551250856533474	3477981
3479636	Logic	dc programming and dca for portfolio optimization with linear and fixed transaction costs	2014	-4.954570995044553	2.880092743135314	3479663
3481010	AI	a multi-agent approach for solving optimization problems involving expensive resources	2005	-5.1359931934787415	3.2133909560466405	3481037
3481350	DB	application of pso and mpso in project scheduling of the first mining face in coal mining	2009	-4.46408413047476	3.0834283130990667	3481377
3483214	Robotics	a study of applying genetic network programming with reinforcement learning to elevator group supervisory control system	2006	-5.253964120949809	2.9354927447120787	3483241
3489958	Robotics	extrapolating from limited uncertain information in large-scale combinatorial optimization problems to obtain robust solutions	2016	-4.8197731861804325	2.8994501558788683	3489985
3490984	NLP	parallel genetic algorithm with fading selection	2014	-4.709420458568936	2.9318646949091867	3491011
3497337	SE	a simulation-based heuristic algorithm for disposition of direction finders	2008	-5.295520454013516	3.3340477113235245	3497364
3497637	Embedded	optimal gamma based fixed head hydrothermal scheduling using genetic algorithm	2010	-5.097349607460214	3.438268789677101	3497664
3498077	EDA	the multi-objective optimization algorithm to a simple model of urban transit routing problem	2010	-4.7185605434570865	3.566558644022572	3498104
3498414	Embedded	novel method for construction enterprise management based on improved aco	2009	-4.7088796557106205	3.0998551219124395	3498441
3500623	AI	source and transmission line maintenance outage scheduling in a power system using teaching learning based optimization algorithm	2014	-4.538548997026269	3.2223028692254467	3500650
3503351	AI	fuzzy flow-shop scheduling models based on credibility measure	2003	-4.70405859832225	3.554849822639817	3503378
3508105	AI	a fuzzy genetic algorithm for the dynamic cell formation problem	2007	-4.604349436851259	3.2523424080606165	3508132
3509722	Embedded	reliability-based operation of reservoirs: a hybrid genetic algorithm and cellular automata method	2018	-4.375251867032492	3.2481378526759417	3509749
3510521	AI	a hybrid genetic algorithm for a two-stage stochastic portfolio optimization with uncertain asset prices	2015	-4.554279526227823	3.1253469894176003	3510548
3512166	AI	genetic algorithm for regionalization problem with adaptive equity constraint	2015	-5.121060760954278	2.7666867776541646	3512193
3515036	AI	an approach based on the strength pareto evolutionary algorithm 2 for power distribution system planning	2005	-4.795472572085685	3.073017532613429	3515063
3519067	Embedded	towards real-time fleet-event-handling for the dynamic vehicle routing problem	2017	-5.244452035209557	3.38453892811876	3519094
3523516	AI	a genetic algorithm approach for solving the daily photograph selection problem of the spot5 satellite	2010	-5.2732781534390165	3.4391307448925463	3523543
3523935	EDA	network reliability optimization	2006	-5.135127411779886	3.2707052675728803	3523962
3524887	Metrics	a modified physarum-inspired model for the user equilibrium traffic assignment problem	2016	-4.667893694114142	3.57234130493249	3524914
3525198	AI	optimizing scheduling of refinery operations based on piecewise linear models	2015	-4.647876115273376	2.944315686147951	3525225
3530121	AI	synthesis of reuse water networks by pso approach	2012	-5.002802579721436	2.9105705252662832	3530148
3531861	AI	a multi-objective model for environmental investment decision making	2008	-4.463208055919504	2.825283054088603	3531888
3532491	ML	convex formulations of aggregate network air traffic flow optimization problems	2008	-4.590866070634678	3.2170654503374214	3532518
3533135	AI	unit commitment with valve-point loading effect	2013	-4.769164090184381	2.781855177932677	3533162
3533952	AI	heuristic methods for portfolio selection at the mexican stock exchange	2003	-4.965573269583142	2.8449484828995195	3533979
3534831	AI	trajectory-assisted municipal agent mobility: a sensor-driven smart waste management system	2018	-4.477954739740491	3.457081816255094	3534858
3535662	EDA	integrated approach to the design of wind farm infrastructure	2016	-4.45577838395168	2.9608733500893534	3535689
3535868	EDA	determining the cost optimum among a discrete set of building technologies to satisfy stringent energy targets	2015	-4.703847492246111	2.9146746147555205	3535895
3536868	DB	demand-driven optimization approach for biomass utilization networks	2012	-4.415998941683194	2.847606838188913	3536895
3548241	AI	heuristic algorithms for the portfolio selection problem with minimum transaction lots	1999	-5.1519603636262215	3.4891985504144536	3548268
3548714	Logic	solution of a multi-objective and multi-index real-life transportation problem using different fuzzy membership functions	2015	-4.484616776159863	3.459258349754857	3548741
3554119	EDA	decomposition-based global optimization for optimal design of power distribution systems	2016	-4.495786940441686	2.6795021466164424	3554146
3554485	EDA	system reliability optimization considering uncertainty: minimization of the coefficient of variation for series-parallel systems	2011	-4.395638089610173	3.338218494255917	3554512
3559030	Robotics	car navigation system based on hybrid genetic algorithm	2009	-5.263039938646534	3.3407655177843116	3559057
3561546	PL	optimization of a simple lng process using sequential quadratic programming	2013	-5.1179675579260655	3.5314853140980174	3561573
3564904	AI	a multi-criterion genetic algorithm for order distribution in a demand driven supply chain	2004	-4.433709771614859	3.3651801946589353	3564931
3566196	AI	a review on the application of hybrid artificial intelligence systems to optimization problems in operations management	2009	-5.190229709471945	3.3789311243228966	3566223
3566407	Robotics	a mixed-integer linear programming model for automatic routing decisions in oil production optimization	2013	-4.8497133126086345	3.2231008762218027	3566434
3569159	ML	mathematical programming bounds for large-scale unit commitment problems in medium-term energy system simulations	2014	-4.359475232663393	3.6041855928786113	3569186
3571081	DB	constrained evolutionary wind turbine placement with penalty functions	2016	-4.457880023443486	3.21909815223283	3571108
3571691	Logic	sensitivity analysis in optimization and reliability problems	2008	-4.8477197703232004	2.7276108726231945	3571718
3573869	Embedded	a hybrid meta-heuristic method for optimal allocation of upfcs	2009	-5.023586702317155	2.670930022757699	3573896
3577039	ML	meta heuristics for dependent portfolio selection problem considering risk	2011	-5.0801475694673535	3.2733771542387657	3577066
3577328	Theory	a nonlinear programming algorithm for hospital management	1995	-5.197387281372367	3.2707239091782623	3577355
3577488	Robotics	berth-crane allocation model and algorithm of container berths in the uncertain environment	2013	-4.726972212796541	3.2448136923038597	3577515
3577599	AI	an algorithm for minimization of pumping costs in water distribution systems using a novel approach to pump scheduling	2013	-4.453425250289294	3.1342849017872383	3577626
3578449	Logic	fuzzy integer transportation problem	1998	-4.7488073015055505	2.8604568072490872	3578476
3579106	AI	ant colony search algorithm for optimal strategical planning of electrical distribution systems expansion	2005	-4.91276082559701	3.0333919653713215	3579133
3581353	AI	hooke-jeeves' method applied to a new economic dispatch problem formulation	2008	-4.906073291744415	2.677726154155124	3581380
3586171	Metrics	estimation of dynamic origin–destination matrices using linear assignment matrix approximations	2013	-4.57579858917884	3.3427857242979977	3586198
3588667	Robotics	design of controllable batch processes in the presence of uncertainty	2004	-4.5261787069440285	3.5053121610556253	3588694
3590058	ML	optimal route selection based on monte carlo method and adaptive amoeba algorithm under uncertain environment	2018	-4.9655996518458965	2.6928098122088406	3590085
3593437	Robotics	research on multi-objective location-routing problem of reverse logistics based on gra with entropy weight	2011	-4.431984457084512	3.5862020320052768	3593464
3597156	Robotics	using pyomo and ipopt for optimization of reservoir flood control operation	2013	-4.475751903108393	2.90097819152378	3597183
3597904	Robotics	latent ringlike road traffic control system based on compound mechanism particle swarm optimisation algorithm	2013	-5.222193391961658	2.75729949417124	3597931
3603640	AI	partner selection model and soft computing approach for dynamic alliance of enterprises	2002	-4.368801149474109	3.5246467907883394	3603667
3614955	DB	real-time optimization of the pulp mill benchmark problem	2008	-4.574827323151839	2.7662649218336983	3614982
3617942	Robotics	a decomposition-coordination method for complex multi-objective systems	2009	-5.265275367295988	2.8007713470812785	3617969
3620912	AI	multi-agent modeling for solving profit based unit commitment problem	2013	-4.889568948640905	2.8887944222836155	3620939
3625606	Robotics	an effective chromosome representation for optimising product quality	2007	-4.862188549022206	3.559802427260084	3625633
3626048	Robotics	fuzzy goal programming model and algorithm for oilfield development	2009	-4.400004809153344	3.1242909481491017	3626075
3626348	Theory	modeling and optimizing traffic light settings in road networks	2015	-4.571375838560924	3.1934595572517437	3626375
3630680	EDA	a simulated annealing algorithm for transient optimization in gas networks	2007	-4.558661980037212	3.1723967042797048	3630707
3631623	Vision	parallel dynamic programming based on stage reconstruction and its application in reservoir operation	2014	-4.721789040482059	2.7435022681442978	3631650
3633522	Theory	solving the optimal trading trajectory problem using a quantum annealer	2016	-4.898317558338157	2.967779157389298	3633549
3635640	ML	new long-term production scheduling methodologies for open-pit mines	2017	-5.185775500406437	3.4627023365642273	3635667
3637238	DB	a modified t-f function method for resolving global optimisation in supply chain transportation	2016	-4.6202210551863585	3.3395376830557173	3637265
3639156	Arch	multiobjective optimization of process plant using genetic algorithm	2005	-5.018069830462598	2.7069131436548863	3639183
3639268	Robotics	optimal design of permeable pavement using harmony search algorithm with swmm	2015	-4.4305299592346366	2.849530705404724	3639295
3642016	AI	hydro plant dispatch using artificial neural network and genetic algorithm	2007	-4.544096091815984	2.701793115808912	3642043
3643718	EDA	a multi- area approach to the economic optimization of electric power system	1975	-4.336878030261384	2.6668346511867203	3643745
3648705	Robotics	inventory optimisation with an interval type-2 fuzzy model	2010	-4.438697311268228	3.076336972544904	3648732
3650471	SE	an eigenvalue based approach for assessing the decomposability of interdependent design project tasks	2009	-4.5202543390177565	3.230967922560281	3650498
3654299	Logic	disjunctive modeling for optimal control of hybrid systems	2008	-4.769027057723093	3.243536668149472	3654326
3654359	AI	logic hybrid simulation-optimization algorithm for distillation design	2015	-5.0145734314415895	3.0721056580507176	3654386
3655528	AI	an evolutionary algorithm with a new operator and an adaptive strategy for large-scale portfolio problems	2018	-4.770296158273881	2.7859785628768456	3655555
3658405	DB	practical optimization of complex chemical processes with tight constraints	2008	-4.682097078104113	2.8625630591846654	3658432
3663659	EDA	an improved integrated optimization model for the structural topology problems	2010	-5.009495771657795	2.893723255893184	3663686
3665996	ML	introduction to stochastic search and optimization: estimation, simulation, and control	2004	-4.632035289532236	3.2240541628083395	3666023
3667828	EDA	an approach of ship routing plan based on support vector machine	2016	-5.036995581675084	3.3472207555444338	3667855
3668534	AI	a hybrid genetic algorithm for solving the unsplittable multicommodity flow problem: the maritime surveillance case	2014	-5.146714546921293	3.4438390444799185	3668561
3670146	Robotics	dpso based on random particle priority value and decomposition procedure as a searching strategy for the evacuation vehicle routing problem	2012	-5.217310595723383	3.589146864929531	3670173
3671171	HCI	multi-objective location modeling of urban parks and open spaces: continuous optimization	2010	-4.627613058950545	3.134147812312809	3671198
3672751	Robotics	bi-objective combined facility location and network design	2006	-4.631021927861168	2.9535640716590303	3672778
3673640	Arch	looking for alternatives: optimization of energy supply systems without superstructure	2014	-4.704057138195969	3.4424493367352094	3673667
3674464	Robotics	optimal transmission line switching for large-scale power systems using the alternating direction method of multipliers	2014	-4.571952554211387	2.813652626327852	3674491
3677876	Robotics	the fuzzy ant system for the vehicle routing problem when demand at nodes is uncertain	2007	-5.030117331693995	3.4112151619906017	3677903
3679555	DB	evolutionary multiobjective optimization in engineering management: an empirical study on bridge deck rehabilitation	2005	-4.945014082285447	3.2067593520288464	3679582
3679794	AI	using evolutionary optimization techniques for scheduling water pipe renewal considering a short planning horizon	2008	-5.098270896637971	2.6633177790837443	3679821
3684150	EDA	short-term hydro -thermal scheduling with artificial bee colony	2012	-5.148404651666938	2.933552025401428	3684177
3684245	AI	an efficient fuzzy programming approach for the vehicle routing problem with soft time windows	2014	-5.242615900363474	3.5927768375876266	3684272
3684696	AI	a dc programming framework for portfolio selection by minimizing the transaction costs	2013	-4.882900182271589	2.8613132160007284	3684723
3685123	ML	moopps: an optimization system for multi objective scheduling	2008	-5.1192161931638065	3.069355365637871	3685150
3687206	AI	optimal maintenance scheduling of generators using multiple swarms-mdpso framework	2010	-4.601858744544266	2.8919213434822004	3687233
3687544	Robotics	a improved algorithm for fuzzy multistage portfolio optimization model	2016	-4.617960953668268	2.7902442602023645	3687571
3687938	HPC	a convex formulation of traffic dynamics on transportation networks	2017	-4.522528109980554	2.9134060318028485	3687965
3688687	Robotics	adaptive convex relaxations for gas pipeline network optimization	2017	-4.353253648974109	2.9458124335239826	3688714
3694901	AI	a novel milp-based objective reduction method for multi-objective optimization: application to environmental problems	2011	-4.731409168410977	2.8133633816491725	3694928
3695350	AI	modeling and solving the soft constraints for supply chain problems using the hybrid approach	2016	-5.007060541725597	2.853109279142322	3695377
3695903	AI	exploring a financial product model with a two-population genetic algorithm	2004	-4.923225985102964	3.079624655362488	3695930
3696199	AI	analysing the factors that influence the pareto frontier of a bi-objective supply chain design problem	2018	-4.860746995043848	2.6939859832660287	3696226
3696915	AI	short versus long-term urban planning using multi-objective optimization	2017	-4.4502938951249265	3.07415301745293	3696942
3701825	Robotics	designing self-sufficient floating neighborhoods using computational decision support	2015	-4.628302131334146	2.9051324014385047	3701852
3706263	AI	improving the search ability of tabu search in the distribution network reconfiguration problem	2013	-5.092304244902106	2.816670624844594	3706290
3706833	Embedded	optimal power flow with limited and discrete controls	2015	-4.5558045115641645	2.8462882001810024	3706860
3707566	Robotics	a new formulation for multi-modal shortest path problem with fuzzy arc travel times	2015	-4.760069887944464	3.376267411094988	3707593
3709998	Robotics	a note on a decision support system for multiobjective integer and mixed-integer programming problems	2004	-4.610051998688953	3.0831291394627063	3710025
3710297	AI	a constraint-based approach to the differential harvest problem	2015	-5.194355492518388	3.2655220445712887	3710324
3715751	Robotics	constraint-based charging scheduler design for electric vehicles	2012	-4.424743541405285	2.9669542812269003	3715778
3716323	ML	on the numerical solution of stochastic optimization problems	2005	-4.883074045728981	3.1493316103567386	3716350
3717301	AI	equity portfolio construction and selection using multiobjective mathematical programming	2010	-4.566404117731493	2.6661930571937886	3717328
3717757	Networks	study of correlation among several traffic parameters using evolutionary algorithms: traffic flow, greenhouse emissions and network occupancy	2007	-4.965092273874345	3.3897060563678045	3717784
3718910	AI	hybrid particle swarm optimization of electricity market participation portfolio	2017	-5.263790061280338	2.690146370285374	3718937
3718945	DB	economic optimization of non-sharp separation sequences by means of evolutionary algorithms	2008	-4.834999821004772	3.0516233853961117	3718972
3719857	Robotics	optimal sensor deployment for manufacturing process monitoring based on quantitative cause-effect graph	2016	-4.780850131495106	2.6814344480118417	3719884
3720804	DB	multiobjective groundwater management using evolutionary algorithms	2009	-4.403959263974615	2.818010836961062	3720831
3720951	HCI	optimization of air pollutant monitoring stations with constraints using genetic algorithm	2015	-4.465358135166147	3.2997088867932107	3720978
3722257	AI	new bounding and decomposition approaches for milp investment problems: multi-area transmission and generation planning under policy constraints	2016	-4.573674942371672	3.339590127694732	3722284
3722550	AI	a study on attribute selection for job shop scheduling problem	2017	-4.6963291360361525	3.322977155808124	3722577
3724310	AI	determining possible avenues of approach using ants	2003	-4.769819884447363	3.3856995520391866	3724337
3727762	Robotics	optimization of robotic assembly sequences using neural network	1993	-5.2102326515417055	3.455575907311587	3727789
3728990	AI	short term unit-commitment using genetic algorithms	1993	-4.469723415670399	2.7317381282550617	3729017
3730824	AI	optimizing operations of large water supply networks: a case study	2012	-4.532096656243515	3.2467575898463767	3730851
3733596	AI	a multi-criteria approach for hospital capacity analysis	2016	-5.084250777188187	3.1549831338027765	3733623
3735857	AI	hybrid solution framework for supply chain problems	2014	-4.9287005557223775	3.1551920044589568	3735884
3739304	AI	a conflict-congestion model for pedestrian-vehicle mixed evacuation based on discrete particle swarm optimization algorithm	2014	-5.098291176015068	3.5608578216017217	3739331
3739902	AI	a hybrid modified pso approach to var-based facility location problems with variable capacity in fuzzy random uncertainty	2012	-5.099532210804116	2.657002662769097	3739929
3740635	Vision	computation of capacity benefit margin using differential evolution	2010	-4.584519772263924	2.903914413880216	3740662
3743771	Theory	progressive hedging innovations for a class of stochastic mixed-integer resource allocation problems	2011	-4.975016780372166	3.1429198465233563	3743798
3746159	ML	an efficient algorithm for taxi system optimization	2014	-4.634178934879535	3.3381368912640337	3746186
3748997	AI	multiobjective evolutionary optimization of greenhouse vegetable crop distributions	2009	-4.612851635014728	2.7659111177317226	3749024
3750673	AI	dynamic resource allocation in conservation planning	2011	-4.427706320062716	3.0173654279929334	3750700
3755145	ECom	physarum polycephalum assignment: a new attempt for fuzzy user equilibrium	2018	-5.002396246304325	3.532505020121509	3755172
3755152	ML	heuristics for cardinality constrained portfolio optimisation	2000	-5.098271059149741	3.1800796225428813	3755179
