id	area	title	year	x	y	ix
3765633	EDA	an algorithm for the selection of planting lining technique towards optimizing land area: an algorithm for planting lining technique selection	2012	-4.965570118968702	3.024208300457316	3765660
3767116	AI	a particle swarm optimization-based approach to tackling simulation optimization of stochastic, large-scale and complex systems	2005	-4.41181575652974	3.190307656533715	3767143
3770813	AI	electric vehicle charging scheduling using an artificial bee colony algorithm	2017	-4.476032337232625	2.7097515309305944	3770840
3771466	Robotics	capacitated location-routing problem with time windows under uncertainty	2013	-4.982980794574132	3.5215342960585785	3771493
3772843	AI	distributed planning for the on-line dial-a-ride problem	2007	-4.919958141396013	3.5265144753851545	3772870
3772973	AI	addressing hard constraints in the air traffic problem through partitioning and difference rewards	2013	-4.545898940078693	3.1887885578016943	3773000
3774501	Robotics	integrating swarm intelligence in a multi-agent system for wastewater discharges management	2010	-4.651641367576318	2.9669541688902097	3774528
3790560	Logic	optimizing single-source capacitated flp in fuzzy decision systems	2011	-4.671186904564712	2.9939527971740825	3790587
3792031	Robotics	cgomfp: control genetic operators with management of the final population to optimize a multimodal transport moving	2004	-5.252093634737305	3.393204891401806	3792058
3793915	Robotics	optimization of air pollutant monitoring stations based on genetic algorithm	2013	-4.490628264564863	3.25213585700698	3793942
3798545	Theory	flexible time-varying optimization methodology for the solution of groundwater management problems	2007	-4.373504021440104	2.858901483827643	3798572
3798743	AI	on the application of multi-objective harmony search heuristics to the predictive deployment of firefighting aircrafts: a realistic case study	2015	-4.336473177986042	3.5177153964863397	3798770
3799054	AI	synthesis of multicomponent reuse water networks by pso approach	2014	-5.002544777521412	2.9393597542916896	3799081
3799390	Robotics	predictive control based framework for optimal scheduling of combined cycle gas turbines	2016	-4.495495973074088	3.1560224730267965	3799417
3800323	SE	identification of congestion by means of integer-valued data envelopment analysis	2016	-4.809499076172594	3.2826945847411784	3800350
3803899	AI	fuzzy constraints in job-shop scheduling	1995	-4.858500682381396	3.1087627124435326	3803926
3811326	Robotics	a new research of resource scheduling based on multi-agent manufacturing grid	2010	-4.9680393483354255	3.3518714660791624	3811353
3812205	AI	a hybrid optimization algorithm for water production and distribution operations in a large real-world water network	2015	-4.551886347214597	3.5165129619537097	3812232
3815196	HPC	genetic based distribution service restoration with minimum average energy not supplied	2007	-4.487968371473803	2.710814549817352	3815223
3816331	EDA	merging nash equilibrium solution with genetic algorithm : the game genetic algorithm	2010	-5.0966072423527935	2.8151471070473932	3816358
3827833	AI	preventive maintenance scheduling of power generating units	1993	-4.683751311894387	3.0307564391659287	3827860
3829231	AI	mehar's method to find exact fuzzy optimal solution of unbalanced fully fuzzy multi-objective transportation problems	2012	-5.158294493760487	2.8885468627957778	3829258
3830736	Theory	a linear bilevel programming algorithm based on bicriteria programming	1987	-4.872304669323486	2.8939076578877674	3830763
3830977	Vision	a hybrid method of pts and ordinal optimization for distribution system service restoration	2003	-5.247764413068136	2.7817267838145017	3831004
3832289	Theory	bilevel programming and price setting problems	2013	-5.231870140494673	2.8355004103734	3832316
3837655	Logic	solving the shortest path problem with interval arcs	2006	-4.801635647741693	2.9228028369295416	3837682
3841549	ML	parallel decomposition of large-scale stochastic nonlinear programs	1996	-4.345759776513372	3.113443962359017	3841576
3842262	Logic	lagrangean relaxation parallel method for optimizing of a hydroelectric generation system	2011	-4.826491542892164	3.419917885699741	3842289
3848917	AI	simplified representation of a large transmission network for use in long-term expansion planning	2014	-4.947122664405823	2.7076949569797115	3848944
3850823	SE	a multi-objective genetic algorithm for determining efficient risk-based inspection programs	2015	-4.41259512972858	3.2930733149339955	3850850
3852255	EDA	global optimization of multi-period optimal power flow	2013	-4.546662055448318	2.974211806996038	3852282
3852607	Theory	allocation problem in the presence of non-response: a mathematical programming approach	2018	-4.8224394837417	3.4278540342518897	3852634
3855604	EDA	supply-chain management using aco and beam-aco algorithms	2007	-5.115565731751695	3.185626118513628	3855631
3860264	EDA	deterministic global optimization in isothermal reactor network synthesis	2002	-4.4630915803892925	3.1205554215691045	3860291
3861255	DB	an interval-parameter fuzzy nonlinear optimization model for stream water quality management under uncertainty	2007	-4.4190159004618605	2.7143573573189967	3861282
3861899	ML	efficient algorithms for the cell based single destination system optimal dynamic traffic assignment problem	2009	-4.570080047123288	3.4415253082432127	3861926
3863587	DB	a systematic method for integrating product attributes within molecular synthesis	2009	-5.22611540607897	3.141273947492564	3863614
3865680	ML	on continuous-space embedding of discrete-parameter queuing systems	2016	-4.9802219783074095	2.7662765124043114	3865707
3867487	Vision	an interactive algorithm for multiple criteria constrained sorting problem	2018	-5.25052141370181	2.7226897244108392	3867514
3873952	EDA	algorithmic system design using scaling and affinity laws	2015	-4.931587373714257	2.9578525573216474	3873979
3874940	Embedded	unit commitment using particle swarm-based-simulated annealing optimization approach	2007	-4.436244732608283	2.8758735256727554	3874967
3875125	HPC	optimal power flow in tree networks	2013	-4.464163521126512	2.772170045273304	3875152
3879077	AI	solving fuzzy chance-constrained programming with ant colony optimization-based algorithms and application to fuzzy inventory model	2006	-4.835073731573104	2.7874717823260524	3879104
3879853	ML	design and analysis of optimization algorithms for multi-agent railway control system	2014	-5.112538162308028	3.1055975068226678	3879880
3880256	Robotics	fuzzy multi-objective evaluating method for hybrid assembly line design	2006	-4.785838646264644	2.6941815840121017	3880283
3883413	Robotics	distributed model predictive control for a class of hybrid system based on lagrangian relaxation	2012	-5.007124948663089	2.7504012293513798	3883440
3888366	EDA	evolutionary algorithm in the problem of so2 emission reduction	2006	-4.35360758413556	2.7997833014491147	3888393
3892825	Crypto	portfolio selection under piecewise affine transaction costs: an integer quadratic formulation	2008	-4.799206326350258	3.4028663673947257	3892852
3903774	AI	hierarchical planning method for product supply based on multi objective genetic algorithm	2010	-4.591319573089817	3.2963086427237296	3903801
3904022	Robotics	a cooperative coevolutionary algorithm for design of platform-based mass customized products	2008	-5.269378878038056	3.51127863667005	3904049
3904195	SE	searching for risk in large complex spaces	2014	-4.703436062057672	3.502297963212927	3904222
3909247	DB	three new stochastic local search metaheuristics for the annual crop planning problem based on a new irrigation scheme	2013	-5.2931715302601114	2.986960261208609	3909274
3910202	Theory	application of goal programming in a multi-objective reservoir operation model in tunisia	2001	-4.37281479128533	2.8642263087074253	3910229
3915044	EDA	sensor placement for fault isolability using low complexity dynamic programming	2015	-4.579765323625724	2.8105804646777415	3915071
3916917	ML	intelligent inventory control via ruminative reinforcement learning	2014	-4.699856643862597	3.1282283551534236	3916944
3918492	EDA	robust scheduling method based on workflow simulation model and biological immune principle	2007	-5.057274769211997	3.38723074858221	3918519
3920248	AI	dynamic integrated algorithm for production scheduling based on iterative search	2010	-5.11826395696991	3.463524267733498	3920275
3920541	ML	accelerated particle swarm optimization and support vector machine for business optimization and applications	2011	-4.944167982392148	3.0215753990917964	3920568
3925921	EDA	simulation of mixed discrete and continuous systems: an iron ore terminal example	2013	-4.364530937886133	3.4759215542480133	3925948
3926538	Embedded	a hybrid optimization algorithm for energy efficient train operation	2015	-4.882447682465133	2.694111963083353	3926565
3927764	AI	a novel multi-objective evolutionary algorithm solving portfolio problem	2014	-4.896545829836092	3.109227081889576	3927791
3929571	ML	discussion of cross docking design in modern logistics systems	2009	-4.715072638422684	3.5947609953110016	3929598
3930329	Robotics	a genetic algorithm to solve the static transmission system expansion planning	2011	-5.112294771928434	2.6951722417019486	3930356
3931766	AI	using memetic algorithms to improve portfolio performance in static and dynamic trading scenarios	2009	-4.983355396470481	2.848222996035723	3931793
3933799	ML	a descent framework for linked signal system with network flows	2007	-4.561617732724134	3.5048531761903416	3933826
3934470	AI	an mcdm approach to portfolio optimization	2004	-5.183576533124675	2.760875887768196	3934497
3938756	Robotics	derivation of near-optimal pump schedules for water distribution by simulated annealing	2004	-4.835948629021549	3.284121655221943	3938783
3942487	Embedded	evolutionary algorithms for bid-based dynamic economic load dispatch: a large-scale test case	2014	-4.997924651351703	3.0137480358789666	3942514
3944228	AI	four-layer framework for combinatorial optimization problems domain	2011	-4.839777572717296	2.985548565450962	3944255
3945920	AI	application of a hybrid genetic algorithm and neural network approach in activity-based costing	2003	-4.606751142479426	3.595414225012897	3945947
3947305	AI	an integrated three-stage maintenance scheduling model for unrelated parallel machines with aging effect and multi-maintenance activities	2015	-4.458242840246396	3.5960746843261093	3947332
3954837	Robotics	hybrid meta-heuristic applied to investments prioritization under budget uncertainty	2015	-4.759840906312479	3.594008755020616	3954864
3954904	Robotics	a hybrid intelligent algorithm for vehicle routing models with fuzzy travel times	2006	-4.5935959993406215	3.5565795352338845	3954931
3959288	Embedded	an admm algorithm for load shedding in electric power grids	2016	-4.413887553229704	2.6606514724212817	3959315
3961058	AI	hybrid learning method for discrete manufacturing control using knowledge based model	2006	-5.118128047613784	3.1457456363113425	3961085
3963059	Robotics	a survey of researches on uncertain project scheduling problems	2010	-4.337852300595788	3.5074659440425715	3963086
3963528	EDA	new rigorous one-step milp formulation for heat exchanger network synthesis	2005	-4.841809721471512	3.1098600045285285	3963555
3964471	SE	multi-objective optimization model for multi-project scheduling on critical chain	2014	-4.514647780471495	3.0524530825269824	3964498
3969057	AI	synthesis of multipass heat exchanger networks using genetic algorithms	2008	-5.282486603226298	3.4724486029200654	3969084
3976038	AI	fuzzy c-means clustering and particle swarm optimization based scheme for common service center location allocation	2017	-4.499048320311619	3.5992631792561807	3976065
3980768	AI	hybrid algorithm performance with varying population size for multi-objective optimisation of in-situ bioremediation of groundwater	2013	-5.131974158053038	2.6726111070688434	3980795
3990222	Theory	a mixed-integer linear programming model to optimize the vertical alignment considering blocks and side-slopes in road construction	2015	-4.795022889830821	3.467000417662384	3990249
3996692	Networks	swarm theory applied to air traffic flow management	2012	-4.696378433917086	3.414268380914228	3996719
4000290	Robotics	a multiobjective evolutionary algorithm with node-depth encoding for energy restoration	2008	-4.992948922303757	2.662924146174974	4000317
4008235	AI	partitioning agents and shaping their evaluation functions in air traffic problems with hard constraints	2013	-4.622090926730123	3.2691967018940766	4008262
4009960	AI	a multi-agent based self-adaptive genetic algorithm for the long-term car pooling problem	2013	-5.284667303451287	3.516608183074649	4009987
4012443	AI	a new efficient algorithm for finding all d-minimal cuts in multi-state networks	2017	-4.79189520107197	2.8043658284369086	4012470
4013578	Theory	combinatorial algorithms for the minimum interval cost flow problem	2006	-4.712944819705341	3.449735768173701	4013605
4014781	AI	integrated fuzzy-hmh for project uncertainties in time-cost tradeoff problem	2014	-4.6367700755147805	3.415647637693016	4014808
4015406	AI	multi-objective optimization for massive pedestrian evacuation using ant colony algorithm	2010	-4.811814311942541	3.4610460782559063	4015433
4017191	EDA	assignment scheduling capability for unmanned aerial vehicles - a discrete event simulation with optimization in the loop approach to solving a scheduling problem	2006	-4.833065584099897	3.2916010007722614	4017218
4018319	AI	analysis of constraint-handling in metaheuristic approaches for the generation and transmission expansion planning problem with renewable energy	2018	-4.657936714935238	2.8327825985764785	4018346
4019361	Robotics	abcga algorithm for the two echelon vehicle routing problem	2017	-5.012237000070646	3.548575822207876	4019388
4022332	HCI	geometric programming	2008	-5.131032586841563	3.567148963276492	4022359
4023666	AI	combined land-use and water allocation planning	2014	-4.877991430103113	2.757428827122824	4023693
4026048	AI	a knapsack problem approach for optimal allocation of maintenance resources on electric power distribution networks	2012	-4.402945232437349	3.315558453161834	4026075
4026070	Theory	methods for a network design problem in solar power systems	1985	-4.581176822885214	3.308375569135468	4026097
4027447	AI	an efficient simulated annealing algorithm for regional wastewater system planning	2009	-4.411689208511981	3.2159736902525498	4027474
4033781	Robotics	transmission system expansion plans in view point of deterministic, probabilistic and security reliability criteria	2006	-4.364368083222908	3.149130710533563	4033808
4034696	AI	total time minimization of fuzzy transportation problem	2012	-4.773405148413371	2.8042290943508283	4034723
4036495	ML	station segmentation with an improved k-means algorithm for hangzhou public bicycle system	2013	-4.602003293206869	3.577774343603992	4036522
4039177	AI	alternative representations and formulations for the economic optimization of multicomponent distillation columns	2003	-4.865545800676786	2.7809072627245848	4039204
4041675	Robotics	transport infrastructure optimization method based on a memetic algorithm	2017	-5.134237901884042	3.5730514317426603	4041702
4043135	Robotics	fuzzy multiobjective nonlinear operation planning in district heating and cooling plants	2013	-4.498912877234009	2.8258226013835177	4043162
4045734	HCI	minnesota's nutrition coordinating center uses mathematical optimization to estimate food nutrient values	1998	-4.853838904123903	2.8569944048445537	4045761
4046889	HPC	suitability of a genetic algorithm for road traffic network division	2011	-4.843652048522559	3.2837335864733888	4046916
4048239	Robotics	an adaptation of dantzig-wolfe decomposition applied to fuzzy multicommodity flow problems	2012	-4.958090363814019	3.3855630367457703	4048266
4051321	ECom	optimizing an equilibrium supply chain network design problem by an improved hybrid biogeography based optimization algorithm	2017	-4.508627048083175	3.540197978384785	4051348
4053811	Robotics	a fuzzy logic expert system for the automated generation of roadmaps for automated guided vehicle systems	2016	-5.230294541550767	3.1728333829187263	4053838
4054395	AI	multi-objective route search for electric vehicles using ant colony optimization	2016	-4.4386572876872865	3.3844927787385126	4054422
4056677	EDA	an ac opf-based heuristic algorithm for optimal transmission switching	2014	-4.3730457706678765	2.7849556078776883	4056704
4057314	AI	an efficient envelope-based branch and bound algorithm for non-convex combined heat and power production planning	2007	-4.454224197519285	3.5587813155120736	4057341
4062901	AI	separation network design with mass and energy separating agents	2011	-4.927179053715322	3.1157650218001223	4062928
4065158	Robotics	an efficient milp framework for integrating nonlinear process dynamics and control in optimal production scheduling calculations	2018	-4.410433272746756	3.5784366907497307	4065185
4065416	ECom	multiobjective evolutionary optimization of traffic flow and pollution in montevideo, uruguay	2018	-4.483382964334855	3.3084266744327686	4065443
4069003	ML	decentralized routing on spatial networks with stochastic edge weights	2013	-4.571362857918854	3.6013633749431246	4069030
4069032	Robotics	human-machine interaction for real-time linear optimization	2012	-5.234602785730961	3.2959809801789315	4069059
4069594	SE	optimal design of cryogenic air separation columns under uncertainty	2010	-4.344230621600826	2.658476907202569	4069621
4069612	Vision	solving an integrated sales-leasing problem with remanufacturing and inventory shortage using differential evolution	2018	-4.6210843570542375	3.607638955757174	4069639
4072170	AI	probabilistic tourist trip-planning with time-dependent human and environmental factors	2016	-4.412711676575367	3.597608505420096	4072197
4079177	EDA	a bilevel optimization method for simultaneous synthesis of medium-scale heat exchanger networks based on grouping of process streams	2011	-5.107692093012388	3.2554715790417568	4079204
4090085	Theory	fully polynomial time approximation schemes for stochastic dynamic programs	2008	-4.56663503267247	3.2267932678119746	4090112
4091279	Robotics	a path-based algorithm for the cross-nested logit stochastic user equilibrium traffic assignment	2009	-5.13974709650476	3.186948008997724	4091306
4093012	Vision	density and flow reconstruction in urban traffic networks using heterogeneous data sources	2018	-4.649114245982911	3.1603425742661266	4093039
4094203	EDA	gpu-accelerated optimization of fuel treatments for mitigating wildfire hazard	2013	-4.993818674672847	2.6688341346489586	4094230
4094806	Metrics	multicriterion decision making in performance evaluation of an irrigation system	1999	-4.450610517357164	2.8237810593750066	4094833
4100775	ML	a study on decision model of bottleneck capacity expansion with fuzzy demand	2006	-4.603144839837154	3.037312366167189	4100802
4102360	Vision	a globally convergent mathematical model for synthesizing topologically constrained water recycle networks	2009	-5.175314574660996	3.3342519791025214	4102387
