id	area	title	year	x	y	ix
740733	Arch	identification of the best stimulation parameters to measure in situ the comunication between muscle and nerve in mouse tibialis muscle	2017	-4.388928495670185	-20.352950683131017	740760
740983	ML	changes in the spectral characteristics of plethysmographic waveforms due to paod	2014	-5.286510621096944	-20.17565324760497	741010
741226	Vision	cancer detection in histopathology whole-slide images using conditional random fields on deep embedded spaces	2018	-7.087159262701676	-22.170691115189392	741253
741451	ML	robust signal processing in living cells	2011	-3.4553697537225223	-22.943163271483392	741478
741715	Comp.	quantitative evaluation of mri and histological characteristics of the 5xfad alzheimer mouse brain	2013	-4.573979803478308	-21.284064175523962	741742
742301	Metrics	simulation of respiratory system under normal, hypoxia and hypercapnia conditions	2012	-5.212786883258575	-20.931901842452376	742328
742492	AI	an integrated feature ranking and selection framework for adhd characterization	2016	-4.02058486199944	-21.2730847633932	742519
743462	Vision	micro-electric imaging: inverse solution for localization of single neuron currents based on extracellular potential measurements	2011	-5.62718107764974	-19.543271302980628	743489
743567	AI	role of monocytes and macrophages in pathogenesis of sars	2007	-4.43816310242387	-22.916854637391936	743594
744481	Robotics	modeling instability in the control system for human respiration: applications to infant non-rem sleep	2000	-4.153851471551547	-21.127171862758207	744508
744501	ML	metabolic factors limiting performance in marathon runners	2010	-4.4751988188729195	-22.294185524289322	744528
744833	Robotics	flow pumping system for physiological waveforms	2009	-5.3745804656395455	-20.80530188353998	744860
744918	Visualization	emergence of multicellular organisms with dynamic differentiation and spatial pattern	1998	-4.513260663083862	-23.181433705624	744945
744989	ML	a transfer-learning approach for accelerated mri using deep neural networks.	2017	-6.960567712179378	-21.66522292710979	745016
745066	Web+IR	evaluating the validity of volume-based and surface-based brain image registration for developmental cognitive neuroscience studies in children 4 to 11<ce:hsp sp=0.25></ce:hsp>years of age	2010	-7.022530427931246	-20.302910714952162	745093
745219	ML	detecting glaucomatous change in visual fields: analysis with an optimization framework	2015	-7.141424057212067	-21.439752837450424	745246
745312	Visualization	phenotypes of myocardial blood perfusion related to the genetic variations of metalloproteinases 3 (mmp3) and 9 (mmp9)	2013	-3.806839898294515	-22.57132619532652	745339
745719	ML	development of the long-time observation system for bacterial motor	2013	-4.3897266991453145	-23.023292567427312	745746
745825	ML	method for patient-specific finite element modeling and simulation of deep brain stimulation	2008	-5.980977392027887	-20.58345202502806	745852
746020	ML	localizing epileptogenic regions in partial epilepsy using three-dimensional statistical parametric maps of background eeg source spectra	2008	-5.402007580684669	-20.425322640814358	746047
746031	ML	systems level circuit model of c. elegans undulatory locomotion: mathematical modeling and molecular genetics	2007	-4.717279844717115	-20.408641028318183	746058
746238	Graphics	a modeling environment with three-dimensional morphology, a-cell-3d, and ca2+ dynamics in a spine	2005	-4.721654799231675	-22.545493467728853	746265
746516	Vision	modelling and estimating dynamics of tumor shrinkage with blenx and kinfer	2011	-3.5489524821940264	-22.658747961233946	746543
746927	Security	vascular reactivity in small cerebral perforating arteries with 7 t phase contrast mri – a proof of concept study	2018	-5.649267443755049	-20.704857932657823	746954
746930	ML	a novel method and software for automatically classifying alzheimer's disease patients by magnetic resonance imaging analysis	2017	-6.646872516050062	-22.10388038597195	746957
747242	Vision	limited microstructural and connectivity deficits despite subcortical volume reductions in school-aged children born preterm with very low birth weight	2016	-3.7986484941398273	-21.315569563380173	747269
747567	Visualization	a simplified biophysical cell model for gastric slow wave entrainment simulation	2013	-4.9184348922250924	-20.55441781159383	747594
747577	ML	the timing and targeting of treatment in influenza pandemics influences the emergence of resistance in structured populations	2013	-4.302883562457707	-23.089482824939278	747604
747604	HCI	electrical and anatomical imaging of arrhythmogenic substrates for scar-related ventricular tachycardia	2017	-5.504162398378775	-20.523132304593503	747631
748071	HCI	development of an automaton model of rotational activity driving atrial fibrillation	2017	-5.2456162972834015	-20.328964278980585	748098
748681	ML	on feature relevance in image-based prediction models: an empirical study	2013	-6.115022589235978	-21.829448645500527	748708
748814	ML	ahp's, hap's and dap's: how potassium currents regulate the excitability of rat supraoptic neurones	2003	-4.571490178382514	-20.33370681337485	748841
749045	ML	end-to-end learning via a convolutional neural network for cancer cell line classification	2018	-6.9967771511078825	-22.512140742446856	749072
749965	Vision	homology modeling of a voltage-gated potassium channel (human kv7.1)	2007	-4.626500401432301	-21.082569592673877	749992
750073	HCI	neuroimaging of the philadelphia neurodevelopmental cohort	2014	-3.4683818843734087	-21.148909125370835	750100
750310	ML	passive models of neurons in the deep cerebellar nuclei: the effect of reconstruction errors	2004	-4.86881929024264	-19.96429754077666	750337
750427	Comp.	5-ht<ce:inf loc=post>1a</ce:inf> sex based differences in b<ce:inf loc=post>max</ce:inf>, in vivo k<ce:inf loc=post>d</ce:inf>, and bp<ce:inf loc=post>nd</ce:inf> in the nonhuman primate	2013	-3.4379819472273234	-21.477576787413373	750454
751016	HCI	prolonged qt interval in neurodevelopmental rat model of schizophrenia	2016	-3.5528178702060247	-21.479459197594885	751043
751991	HPC	personalization of fast conduction purkinje system in eikonal-based electrophysiological models with optical mapping data	2010	-5.857482653708385	-20.258168073758853	752018
752901	ML	circadian rhythm and cell population growth	2011	-4.868032412432044	-22.288565053531908	752928
753035	AI	recent human ventricular cell action potential models under varied ischaemic conditions	2013	-4.762144790365724	-20.887798362786654	753062
753630	Robotics	neuromodulation of the retina from the suprachoroidal space: the phoenix 99 implant	2014	-4.3604227042556545	-19.810243531713915	753657
753976	ML	genetic and environmental influences on cortical mean diffusivity	2017	-3.6729642413396815	-21.31475828683137	754003
754073	ML	extracellular potassium and seizures: excitation, inhibition and the role of ih	2016	-3.5673319564866803	-20.687441535245366	754100
754113	ML	an automated method for characterization of evoked single-trial local field potentials recorded from rat barrel cortex under mechanical whisker stimulation	2016	-3.57113449241912	-19.918247926631054	754140
754311	ML	global changes in the connectome in autism spectrum disorders	2013	-3.889937823575648	-21.17365411779335	754338
754865	ML	identification of hip fracture patients from radiographs using fourier analysis of the trabecular structure: a cross-sectional study	2004	-6.347471529913032	-21.261517411589487	754892
754899	ML	2d finite-element analysis of calcium distribution in oocytes	2018	-5.069902535175056	-21.940860574575662	754926
755275	HCI	efficacy of synaptic inhibition depends on multiple, dynamically interacting mechanisms implicated in chloride homeostasis	2011	-4.499117773969889	-23.18889874938489	755302
755440	Visualization	pressure in the cochlea during infrared irradiation	2016	-5.259969957780277	-20.13039134402087	755467
755441	HCI	tidal breathing model describing end-tidal, alveolar, arterial and mixed venous co2 and o2	2011	-5.1055168006500375	-21.085652057055395	755468
755890	ML	a dynamical model of cancer chemotherapy with disturbance	2012	-4.853663276296745	-22.498845607025274	755917
756051	ML	defining cortical sulcus patterns using partial clustering based on bootstrap and bagging	2008	-6.623368639323895	-20.049051994275626	756078
756277	Metrics	a low dimensional approximation for competence in bacillus subtilis	2016	-3.6361830953874583	-22.630092514889153	756304
756314	ML	a domain knowledge based approach for medical image retrieval	2010	-7.181878432201938	-21.311350448203093	756341
756335	Robotics	spatially-compressed cardiac myofilament models generate hysteresis that is not found in real muscle	2008	-4.790125830985745	-20.8649601031564	756362
756404	EDA	a discrete-event simulation approach to identify rules that govern arbor remodeling for branching cutaneous afferents in hairy skin	2017	-3.9185903328349356	-19.548527739397887	756431
756697	ML	implementing the cellular mechanisms of synaptic transmission in a neural mass model of the thalamo-cortical circuitry	2013	-4.022636646978317	-19.94461526705471	756724
757321	ML	three-dimensional reconstruction of myenteric neurons of the guinea pig	1994	-7.045955059263371	-19.61432464487094	757348
757554	Visualization	modulation of upper limb locomotor function via transcutaneous electrical stimulation of spinal cord nervous system	2017	-4.554546341662878	-20.03233090523706	757581
757623		modeling and simulation of developmental changes in contractile apparatus of ventricular cells	2015	-4.456623727559574	-23.212468532579752	757650
757743	HCI	improved longitudinal [<ce:sup loc=pre>18</ce:sup>f]-av45 amyloid pet by white matter reference and voi-based partial volume effect correction	2015	-5.914496780167153	-21.393189484306152	757770
757770	NLP	a stochastic branching model of the steady state growth of intestinal crypts	1990	-4.877902250985511	-22.621607946238232	757797
757863	ML	late gadolinium uptake demonstrated with magnetic resonance in patients where automated perfit analysis of myocardial spect suggests irreversible perfusion defect	2008	-6.8890275630264615	-21.33456593976884	757890
758117	HCI	mossy fiber sprouting in pilocarpine-induced status epilepticus rat hippocampus: a correlative study of diffusion spectrum imaging and histology	2008	-4.116872813428611	-21.139669588933746	758144
758183	AI	automated diagnosis of neural foraminal stenosis using synchronized superpixels representation	2016	-7.138604893448018	-22.137245774704514	758210
758260	Vision	rfdemons: resting fmri-based cortical surface registration using the brainsync transform	2018	-6.81209867249479	-19.9907207596345	758287
758983	Visualization	a 3d-continuum bidomain model of retinal electrical stimulation using an anatomically detailed mesh	2015	-5.1995362752093355	-20.105795095711752	759010
759101	ML	heterogeneous firing responses predict diverse couplings to presynaptic activity in mice layer v pyramidal neurons	2017	-4.165988368918049	-19.45964317299653	759128
759367	AI	groupwise spatial normalization of fmri data based on multi-range functional connectivity patterns	2013	-3.718345647009433	-20.689241785659345	759394
759615	NLP	stored-fluorography mode reduces radiation dose during cardiac catheterization measured with osld dosimeter	2015	-6.358050756165477	-21.09031008912421	759642
759691	Visualization	structural asymmetries of perisylvian regions in the preterm newborn	2010	-3.80719453326367	-21.176719162258536	759718
759850	Robotics	a combined process algebraic and stochastic approach to bone remodeling	2011	-4.879002621257558	-22.553215206396324	759877
759869	Vision	hippocampus segmentation and spharm coefficient selection are decisive for mci detection	2018	-7.091575034226862	-21.817602700750307	759896
760065	Visualization	creating virtual ards patients	2016	-5.162978623509461	-21.51651397170734	760092
760404	SE	a system for automated quantification of cutaneous electrogastrograms	2015	-5.460825194526672	-20.31882500771775	760431
760524	Visualization	quantifying white matter tract diffusion parameters in the presence of increased extra-fiber cellularity and vasogenic edema	2014	-5.204428123480835	-20.80835523731284	760551
760532	HCI	fractal dimension analysis of cerebellum in chiari malformation type i	2015	-6.282571327409147	-21.253779362218346	760559
761093	Comp.	complex automata as a novel conceptual framework for modeling biomedical phenomena	2012	-5.123759438718118	-22.76961820751524	761120
761123	Vision	a computational method for longitudinal mapping of orientation-specific expansion of cortical surface in infants	2018	-6.685331396039145	-19.93362439107671	761150
761817	Vision	ph-sensitive mri demarcates graded tissue acidification during acute stroke ― ph specificity enhancement with magnetization transfer and relaxation-normalized amide proton transfer (apt) mri	2016	-4.966115618421249	-21.083470194915265	761844
761957	Visualization	electrical field shaping techniques in a feline model of retinal degeneration	2018	-4.546743420181555	-20.46672061113146	761984
762005	Visualization	seamless lesion insertion for data augmentation in cad training	2017	-7.115514570958839	-22.046338165664025	762032
762024	ML	multi-dimensional gated recurrent units for the segmentation of biomedical 3d-data	2016	-6.976554972676754	-21.41133686923193	762051
762382	Visualization	three-dimensional angiogenesis modelling on the gpu	2014	-5.409816002905027	-22.261949911071138	762409
762539	HCI	characterization of abcb5 positive dermal multipotent mesenchymal stromal cells in healthy young and ageging skin	2016	-6.888855762258299	-20.163915246452962	762566
762667	HCI	brain injury differences in frontal impact crash using different simulation strategies	2015	-5.655716418157669	-20.133419215186933	762694
762883	Robotics	factors impacting accurate cole-impedance extractions from magnitude-only measurements	2016	-5.434271425922179	-19.60791658425966	762910
762890	Vision	computational retinal imaging via binocular coupling and indirect illumination	2012	-7.1733452351339135	-20.372087084062176	762917
762948	Vision	deep contextual networks for neuronal structure segmentation	2016	-6.907965530209537	-21.316417653781773	762975
763327	ML	graph modeling and mining methods for brain images	2016	-6.786272793974715	-21.15348113372117	763354
763336	Robotics	automatic scratching pattern detection for laboratory mice using high-speed video images	2008	-6.950895352103948	-19.595611395584747	763363
763423	ML	hydranet: data augmentation for regression neural networks	2018	-7.0852358533063065	-21.653161735897555	763450
763593	Vision	brain tumor segmention based on dilated convolution refine networks	2018	-7.21509223245126	-22.144114964343167	763620
763917	ML	reconstruction and visualization of large-scale volumetric models of neocortical circuits for physically-plausible in silico optical studies	2017	-6.767989407930178	-19.697935927782478	763944
763962	Robotics	a novel planar microelectrode array fabricated for brain slice electrophysiology	2013	-4.913119001814473	-20.00941693797332	763989
764045	Mobile	cardiac pacemaker and wireless capsule endoscopy interference: case report in a patient with gastric vascular ectasias	2010	-6.5768453019187625	-21.2947358497638	764072
764155	Visualization	design of a system for continuous intraocular pressure monitoring	2004	-5.703492181470884	-19.860951102786398	764182
764200	Robotics	preliminary study of non-invasive shock wave treatment of capsular contracture after breast implant: animal model	2013	-5.716855876791482	-20.316456890420454	764227
764276	ML	cell-based multi-parametric model of cleft progression during submandibular salivary gland branching morphogenesis	2013	-4.8179885024624	-23.030209738236852	764303
764484	ML	stability analysis of a model of atherosclerotic plaque growth	2015	-4.894947203788655	-22.50495190053171	764511
764509	ML	brain white matter damage in sca1 and sca2. an in vivo study using voxel-based morphometry, histogram analysis of mean diffusivity and tract-based spatial statistics	2008	-4.077842758544588	-21.247652443241552	764536
764734	ML	direct, intraoperative observation of ~<ce:hsp sp=0.10></ce:hsp>0.1<ce:hsp sp=0.25></ce:hsp>hz hemodynamic oscillations in awake human cortex: implications for fmri	2014	-3.3919623819626654	-20.777364423262206	764761
764761	AI	stable feature selection from brain smri	2015	-4.330186206717531	-21.288643971209048	764788
764767	Robotics	a numerical evaluation of state reconstruction methods for heterogeneous cell populations	2015	-4.793347066521051	-22.1951204846704	764794
764911	Comp.	a systems biology approach to analyse amplification in the jak2-stat5 signalling pathway	2008	-4.386283108907616	-20.281453401802608	764938
765773	Comp.	detecting critical state before phase transition of complex biological systems by hidden markov model	2016	-3.3732622192123163	-23.034574046096697	765800
765996	ML	fast eigenvector centrality mapping of voxel-wise connectivity in functional magnetic resonance imaging: implementation, validation, and interpretation	2012	-3.464001832925797	-20.52190692491871	766023
766173	Robotics	studies on rat brain phantoms for the development of near-infrared spectroscopy (nirs) system	2018	-5.424520807721552	-20.380840698462613	766200
766233	Vision	efficient multi-kernel multi-instance learning using weakly supervised and imbalanced data for diabetic retinopathy diagnosis	2018	-7.117382509882728	-22.594267778510197	766260
766690	Visualization	3d computational modeling of epiretinal prosthesis stimulation of the ganglion cell	2012	-4.825297140104484	-20.027130019515376	766717
767113	Visualization	fuzzy scaling analysis of a mouse mutant with brain morphological changes	2009	-6.3194447119518875	-20.899798055526315	767140
767270	HCI	neurite density index is sensitive to age related differences in the developing brain	2017	-4.080019475092215	-21.232544571308726	767297
767295	Visualization	application of an object-oriented programming paradigm in three-dimensional computer modeling of mechanically active gastrointestinal tissues	2000	-5.496263063943714	-20.13327563531866	767322
767900	ML	stability and bifurcation analysis of new coupled repressilators in genetic regulatory networks with delays	2014	-3.881202390826165	-22.966948377023787	767927
768253	Crypto	multi-map orbit hopping chaotic cipher	2008	-4.350952701387731	-23.047353333270816	768280
768342	Visualization	monitoring acute stroke in mouse model using laser speckle imaging-guided visible-light optical coherence tomography	2018	-5.745579205627067	-20.82046209622688	768369
768633	ML	meta-analysis of neuroimaging data: a comparison of image-based and coordinate-based pooling of studies	2009	-6.368602661044013	-20.463026670943954	768660
768796	Vision	classification of 3d multicellular organization in phase microscopy for high throughput screening of therapeutic targets	2015	-6.935816195353361	-20.862507866422078	768823
768963	AI	hcn and scn5a channel mutations: implications for impaired atrioventricular nodal conduction in a heterogeneous computer model of the whole mouse heart	2013	-4.983503467297378	-20.860821677093988	768990
769092	Comp.	cellline, a stochastic cell lineage simulator	2007	-3.8211651993212494	-23.19424735885265	769119
770101	HPC	use of a comprehensive numerical model to improve biventricular pacemaker temporization in patients affected by heart failure undergoing to crt-d therapy	2010	-5.5371000002303274	-20.833803146051565	770128
770417	Vision	kernel-based morphometry of diffusion tensor images	2014	-4.6091190494939385	-20.806240710280623	770444
770555	ML	alzheimer's disease neuroimaging initiative: a one-year follow up study using tensor-based morphometry correlating degenerative rates, biomarkers and cognition	2009	-6.262992242584887	-20.781740766679803	770582
770661	Vision	discriminative learning for automatic staging of placental maturity via multi-layer fisher vector	2015	-7.097010382543282	-22.038605491252167	770688
770707	ML	investigation of the influence of carbon dioxide concentrations on cerebral physiology by susceptibility-weighted magnetic resonance imaging (swi)	2008	-4.941012704306772	-20.8313938377732	770734
770983	Comp.	a hybrid-system model of the coagulation cascade: simulation, sensitivity, and validation	2013	-4.5048826760431275	-22.40092912046699	771010
771929	ML	signaling pathways involved in striatal synaptic plasticity are sensitive to temporal pattern and exhibit spatial specificity	2013	-3.941103518321901	-19.512506293062263	771956
772044	ML	classification of smri for ad diagnosis with convolutional neuronal networks: a pilot 2-d+ \epsilon study on adni	2017	-6.759826107625601	-22.02992317284137	772071
772168	Comp.	computational modelling of apoptosis in parkinson's disease using biochemical systems theory	2017	-4.021210310200175	-23.123321379138645	772195
772418	ML	anterior cingulate cortex: an mri-based parcellation method	2006	-3.72612968567018	-21.262584556547814	772445
772528	ML	combining mri and csf measures for classification of alzheimer's disease and prediction of mild cognitive impairment conversion	2012	-6.367141075278687	-22.131853348186173	772555
772780	ML	cortical thickness determination of the human brain using high resolution 3<ce:hsp sp=0.25></ce:hsp>t and 7<ce:hsp sp=0.25></ce:hsp>t mri data	2013	-6.356268268465787	-20.268346797224115	772807
772792	HCI	relax and tighten - a haptics-based approach to simulate sphincter tone assessment	2016	-5.468797974208615	-20.176982709443546	772819
772823	ML	early diagnosis of alzheimer's disease based on partial least squares, principal component analysis and support vector machine using segmented mri images	2015	-6.653790855594561	-22.296056611939225	772850
772987	ML	axtract: microstructure-driven tractography based on the ensemble average propagator	2015	-6.539319033902299	-20.059706009327225	773014
773031	ML	selective increase in posterior corpus callosum thickness between the age of 4 and 11<ce:hsp sp=0.25></ce:hsp>years	2016	-3.7464366021734095	-21.323429824521178	773058
773092	ML	motor cortex microcircuit simulation based on brain activity mapping	2014	-3.7260665002147983	-19.420696849822225	773119
773128	Graphics	age and treatment related local hippocampal changes in schizophrenia explained by a novel shape analysis method	2003	-6.526475719591054	-20.536568181427228	773155
773250	ML	cardiomyocyte lethality by multidirectional stimuli	2018	-4.846501374613938	-20.40797816624397	773277
773415	HCI	evaluation of voxel-based methods for the statistical analysis of pib pet amyloid imaging studies in alzheimer's disease	2006	-4.214227588979239	-21.269591462747034	773442
773571	ML	transition dynamics of a dentate gyrus-ca3 neuronal network during temporal lobe epilepsy	2017	-3.8957107998125666	-19.396298232507352	773598
773733	ML	whole brain magnetic resonance image atlases: a systematic review of existing atlases and caveats for use in population imaging	2017	-6.814103107982018	-20.697198723991846	773760
774142	AI	dynamics of hiv infection studied with cellular automata and conformon-p systems	2008	-4.401926471787188	-22.527715696805142	774169
774311	ML	spontaneous excitation patterns computed for axons with injury-like impairments of sodium channels and na/k pumps	2012	-4.366483662670176	-19.987324606967547	774338
774488	Visualization	resistivity profiles of wild-type, rd1, and rd10 mouse retina	2015	-5.318174960389138	-20.61864027732168	774515
774652	Vision	erratum to: multiscale modeling of skeletal muscle properties and experimental validations in isometric conditions	2011	-6.6251079085103575	-19.858214529095548	774679
774669	Robotics	relating discontinuous cardiac electrical activity to mesoscale tissue structures: detailed image based modeling	2007	-6.393251203336196	-20.44271393650333	774696
774707	Graphics	influence of anatomical, physical, and detection-system parameters on surface emg	2002	-5.546339390182572	-19.80203368563436	774734
774968	Visualization	boundary integral formulation for the electrical response of a nerve to an extracellular stimulation	2013	-5.1491558888551525	-19.930099646625163	774995
775191	HCI	body composition and solute kinetics in hemodialysis patients: a mathematical model	2012	-4.942293438947534	-21.669147919241052	775218
775345	AI	comparison of different methods for predicting customized drug dosage in superovulation stage of in-vitro fertilization	2014	-4.84654160029178	-22.48094457740168	775372
775348	ML	the effect of neuronal growth on synaptic integration	1994	-4.201143125717772	-19.42725162531752	775375
775430	ML	optimal-mass-transfer-based estimation of glymphatic transport in living brain	2015	-5.611934501654952	-21.12109453199202	775457
775853	ML	identifying critical regions for spike propagation in axon segments	2013	-5.344101508298113	-20.534288096293377	775880
776349	Robotics	model for post-occlusive reactive hyperemia as measured noninvasively with pressure pulse waveform	2011	-5.090978446754873	-20.51481468226174	776376
776712	Vision	multi-scale modeling and oxygen impact on tumor temporal evolution: application on rectal cancer during radiotherapy	2018	-6.261225051435679	-21.207125666661998	776739
776742		biological pacemakers based on i f	2006	-4.317079975076582	-22.85074115498809	776769
776796	Vision	clada: cortical longitudinal atrophy detection algorithm	2011	-7.029449825197894	-20.91463455935629	776823
777002	HCI	longitudinal assessment of white matter pathology in the injured mouse spinal cord through ultra-high field (16.4<ce:hsp sp=0.25></ce:hsp>t) in vivo diffusion tensor imaging	2013	-4.324719450641951	-21.129299418487197	777029
