id	area	title	year	x	y	ix
411470	Robotics	reinforcement learning-based control for combined infusion of sedatives and analgesics	2017	-4.665446348094495	-22.05301490901199	411497
411488	AI	a genetic algorithm approach to customizing a glucose model based on usual therapeutic parameters	2017	-4.776608157721715	-21.91640135263958	411515
411579	Vision	estimation of extraction fraction (ef) and glomerular filtration rate (gfr) using mri: considerations derived from a new gd-chelate biodistribution model simulation	2005	-5.654938920786847	-20.818106110761686	411606
411639	Robotics	brain tissue characterization via non-supervised one-dimensional kohonen networks	2009	-4.032204893706687	-19.71138420701985	411666
411793	HCI	brain extracellular space: a compartment for intercellular communication and drug delivery	2014	-5.685867994123978	-20.2247741794424	411820
412110	HCI	dynamic transmurality: cardiac optical mapping reveals waves travel across transmural ablation lines	2007	-5.080612910254997	-20.30133082229456	412137
412129	ML	a hemodynamic model for layered bold signals	2016	-3.9618959097829305	-20.064716414609112	412156
412194	ML	detection of postmortem human cerebellar cortex and white matter pathways using high angular resolution diffusion tractography: a feasibility study	2013	-4.271097095880212	-20.61356835502884	412221
412491	Robotics	robustness of complex feedback systems: application to oncological biochemical networks	2013	-4.066687035726623	-22.496533904364004	412518
412513	Vision	deep multiple instance learning for automatic detection of diabetic retinopathy in retinal images	2018	-7.1514709953137645	-22.363348584142102	412540
412600	Vision	classification of breast cancer histology images using alexnet	2018	-6.8251503189916765	-21.8378333464262	412627
412951	Visualization	design and control of a demand flow system assuring spontaneous breathing of a patient connected to an hfo ventilator	2011	-4.976055354771317	-21.046715474798194	412978
413189	ML	stochastic amplification of calcium-activated potassium currents in ca2+ microdomains	2011	-4.37584724120062	-19.614034328041452	413216
413266	Vision	distribution of collateral fibers in the monkey cervical spinal cord detected with diffusion-weighted magnetic resonance imaging	2011	-5.352743550775856	-20.573099279301506	413293
413680	ML	semi-automatic classification of lesion patterns in patients with clinically isolated syndrome	2013	-6.680703678143394	-21.363996102394108	413707
414651	ML	spatial resolution enhancement using sensitivity-encoded echo-planar imaging at 3 t in a typical motor paradigm	2007	-4.177466945378619	-20.354425268369496	414678
414655	Comp.	noise suppression in auto-regulatory gene networks	2008	-3.8288960524091977	-23.195095229136786	414682
415008	Robotics	computational modeling of phagocyte transmigration during biomaterial-mediated foreign body responses	2010	-4.925497502546825	-22.175831288371715	415035
415023	HCI	dual-sided mapping during global stretch using a custom miniaturized endocardial balloon with a multipurpose multichannel acquisition system for preclinical electrophysiological studies	2017	-4.85030575036403	-20.361360686832164	415050
415386	Robotics	glucose-insulin model of glucose metabolism in acute diabetic swine based on luenberger observer	2012	-4.881268925024486	-21.925802533534217	415413
415500	Vision	the influence of complex white matter architecture on the mean diffusivity in diffusion tensor mri of the human brain	2012	-5.931017443143432	-20.314825220629285	415527
415952	Vision	brain morphometry by probabilistic latent semantic analysis	2010	-6.996684580192922	-22.071175189654006	415979
416045	ML	cancer metastasis detection with neural conditional random field	2018	-7.087774150945742	-21.945426525193373	416072
416167	Robotics	impedance based automatic electrode positioning	2015	-5.202666102873113	-19.803133961341004	416194
416259	Visualization	micropatterning c2c12 myotubes for orderly recording of intracellular calcium transients	2013	-4.966415616835556	-22.94746756836672	416286
416673	Visualization	correspondence between the location of evoked potential generators and sites of maximal sensitivity to stimulation	2005	-4.86504287312971	-19.91906234050501	416700
416760	Visualization	injury potentials of spinal cord in ex vivo compression injury model	2015	-5.1419725453085565	-21.387988460124273	416787
416782	ML	imaging glutamate redistribution after acute n-acetylcysteine administration: a simultaneous pet/mr study	2019	-3.4269670348317263	-21.415973307834932	416809
416877	ML	in vivo microscopy for real-time structural and functional cellular imaging	2007	-5.687268467953897	-21.447717845393274	416904
417232	Comp.	pet radiotracers for molecular imaging in the brain: past, present and future	2012	-4.427360054887988	-21.59585209116861	417259
417339	Robotics	alterations in cardiovascular system under artificially simulated microgravity: preliminary study	2016	-5.367507260851096	-20.168408291949085	417366
417637	AI	automated neural foraminal stenosis grading via task-aware structural representation learning	2018	-7.191025829882807	-22.322830758387767	417664
417716	ML	in vivo parametric t1 maps correlate with structural and molecular characteristics of focal fibrosis	2017	-5.881920178957208	-20.850991709070534	417743
417823	ML	intravascular photothermal strain imaging for lipid detection	2018	-6.485755091403638	-20.807354733490005	417850
418214	Robotics	in vivo manganese-enhanced mri for visuotopic brain mapping	2012	-3.7848011642165353	-21.100847335394818	418241
418224	ML	sampleboost for capsule endoscopy categorization and abnormality detection	2012	-6.727507333672322	-22.564099684928564	418251
418434	Comp.	glucose metabolism of the midline nuclei raphe in the brainstem observed by pet–mri fusion imaging	2012	-4.366463556622538	-21.23906489597136	418461
419052	HCI	a mathematical model of myelodysplastic syndromes: the effect of stem cell niches	2010	-4.444843660137057	-22.663338394366374	419079
419317	Theory	a metaphor of complex automata in modeling biological phenomena	2012	-5.136577226262792	-22.368295344220677	419344
419613	ML	a population level computational model of the basal ganglia that generates parkinsonian local field potential activity	2009	-3.4802118813908254	-20.67939356186246	419640
419632	Vision	adversarial neural networks for basal membrane segmentation of microinvasive cervix carcinoma in histopathology images	2017	-7.2055641028669735	-21.99827332300201	419659
419640	Arch	hyperkalemia vs. ischemia effects in fast or unstable pacing: a cardiac simulation study	2009	-4.8865073684428815	-20.60514676113258	419667
419858	Vision	fusing heterogeneous features from stacked sparse autoencoder for histopathological image analysis	2016	-7.137900792614674	-22.261649823954965	419885
419904	HCI	<ce:italic>in vivo</ce:italic> mri tracking of exogenous monocytes/macrophages targeting brain tumors in a rat model of glioma	2007	-5.626782779515004	-21.14160485359385	419931
420015	AI	infant brain development prediction with latent partial multi-view representation learning	2018	-4.11894788715474	-21.37113508979407	420042
420385	AI	the role of extracellular potassium transport in computer models of the ischemic zone	2007	-5.786824729336077	-21.178577093182664	420412
420674	ML	a composite multivariate polygenic and neuroimaging score for prediction of conversion to alzheimer's disease	2012	-3.623586440620593	-21.49175913273005	420701
421077	Embedded	optimal control drug scheduling of cancer chemotherapy	1992	-4.9319188224679325	-22.494293556888124	421104
421172	HPC	mri simulation-based evaluation of ecv calculation using molli t1 maps	2015	-6.088273789295073	-20.81870828332897	421199
421544	Visualization	a comparative study of graph-based, eikonal, and monodomain simulations for the estimation of cardiac activation times	2012	-6.714371938818635	-19.656179172738696	421571
421545	Logic	variety behavior in the piece-wise linear model of the p53-regulatory module	2017	-3.7881001894492816	-23.07891160427661	421572
421726	Robotics	a new deep brain stimulation waveform based on pwm	2011	-4.301049023859403	-20.00146127465016	421753
421899	HCI	application of multiscale entropy in assessing plantar skin blood flow dynamics in diabetics with peripheral neuropathy	2018	-5.13003255203224	-20.496357021568986	421926
422128	HCI	differential functional benefits of ultra highfield mr systems within the language network	2014	-3.5875664396809865	-20.478379998016525	422155
422636	Comp.	mapping of brain macromolecules and their use for spectral processing of 1h-mrsi data with an ultra-short acquisition delay at 7t	2015	-5.096585059400057	-20.817330420364858	422663
423083	Visualization	visualization of confocal microscopic biomolecular data	2005	-6.91390181050982	-19.462867768580672	423110
423189	ML	detection of glands and villi by collaboration of domain knowledge and deep learning	2015	-7.207837650440648	-21.66209773954805	423216
423865	Visualization	automated effect-specific mammographic pattern measures	2008	-5.256685043590516	-22.100877946046534	423892
423991	Comp.	model-based therapeutic correction of hypothalamic-pituitary-adrenal axis dysfunction	2009	-4.381243392224623	-22.302904293582788	424018
424109	Graphics	"""numerical simulation of solid tumor blood perfusion and drug delivery during the """"vascular normalization window"""" with antiangiogenic therapy"""	2011	-5.8982052063858434	-21.288902236339325	424136
424142	Visualization	10/20, 10/10, and 10/5 systems revisited: their validity as relative head-surface-based positioning systems	2007	-6.412837160796603	-20.507108365044612	424169
424228	ML	gaba estimation in the brains of children on the autism spectrum: measurement precision and regional cortical variation	2014	-3.5380730419942514	-21.282583791745036	424255
424347	Vision	asd detection in males using mri- an age-group based study	2015	-4.816004505772702	-21.56312813706429	424374
424616	HCI	harmonizing dti measurements across scanners to examine the development of white matter microstructure in 803 adolescents of the ncanda study	2016	-4.698929258550264	-21.245221065057407	424643
424820	ML	elevated [<ce:sup loc=post>18</ce:sup>f]fdopa utilization in the periaqueductal gray and medial nucleus accumbens of patients with early parkinson's disease	2010	-3.6551778574447074	-21.305861059690443	424847
425034	Robotics	a new formula for noninvasive determination of cardiac output by bioadmittance signal processing	2017	-5.2733827338606885	-20.484384773788182	425061
425079	ML	bifurcation analysis of “synchronization fluctuation”: a diagnostic measure of brain epileptic states	2014	-3.4983645464405204	-19.704226956888586	425106
425340	Visualization	whole-brain mapping of venous vessel size in humans using the hypercapnia-induced bold effect	2010	-5.948240223758645	-20.946644883964986	425367
425482	Vision	nonlinear model for offline correction of pulmonary waveform generators	2002	-5.6377836792609965	-19.701481974414676	425509
425622	ML	a probabilistic framework for region-specific remodeling of dendrites in three-dimensional neuronal reconstructions	2005	-4.2030429554567235	-20.348030708232574	425649
425801	Comp.	metrics for assessing cytoskeletal orientational correlations and consistency	2015	-6.441457342173607	-20.261129816778016	425828
425995	Vision	gray matter surface based spatial statistics (gs-bss) in diffusion microstructure	2017	-4.778893048100109	-20.920350218206934	426022
426045	ML	electrical stimulation-induced cell clustering in cultured neural networks	2007	-4.189918433087175	-19.888699941726852	426072
426084	Visualization	population based mri and dti templates of the adult ferret brain and tools for voxelwise analysis	2017	-6.880958381769418	-20.546828897376454	426111
426379	ML	lesion spectra: radiation signatures and biological gateways	1994	-4.7818995531944015	-22.63607089203824	426406
426631	Vision	unregistered multiview mammogram analysis with pre-trained deep learning models	2015	-7.16184780904575	-22.423922264730724	426658
427371	ML	feature importance in nonlinear embeddings (fine): applications in digital pathology	2016	-6.3913513806939815	-22.509305661986236	427398
427515	HCI	simulation of kcnj2-linked short qt syndrome in human ventricular tissue	2013	-4.814684777348996	-21.117965675279887	427542
427796	ML	coupled cell model of border zone arrhythmias	2005	-4.887769434372434	-20.602943178737974	427823
427978	Robotics	an integrative dynamic model of brain energy metabolism using in vivo neurochemical measurements	2009	-4.373078499349166	-21.835940234491478	428005
427993	AI	examination of the role of detritus food quality, phytoplankton intracellular storage capacity, and zooplankton stoichiometry on planktonic dynamics	2012	-4.316870843475093	-22.636773866228875	428020
428172	Vision	interactive cell segmentation based on active and semi-supervised learning	2016	-7.090097934783056	-19.432610537027266	428199
428173	Robotics	closed loop control of blood glucose level with neural network predictor for diabetic patients	2017	-4.89803562061888	-21.91732841608272	428200
428658	HPC	optimizing chemoradiotherapy to target metastatic disease and tumor growth	2018	-4.848001742646133	-22.528364964126176	428685
428741	Arch	molecule gradient formation by mobile bio-nanomachines	2017	-4.546109772778614	-22.994888866773586	428768
428845	ML	topographic organization of the cerebral cortex and brain cartography	2018	-3.3863848144825934	-20.27530434657171	428872
429499	ML	neural responses in rat brain during acute immobilization stress: a [f-18]fdg micro pet imaging study	2009	-3.6635713771232687	-21.06780253909284	429526
429660	Visualization	template based rotation: a method for functional connectivity analysis with a priori templates	2014	-6.821590255151628	-20.12774657328306	429687
429962	Metrics	a cell population balance model describing positive feedback loop expression dynamics	2005	-3.8430935402720334	-23.033710715542803	429989
429992	ML	cell-type-specific neuroanatomy of cliques of autism-related genes in the mouse brain	2015	-3.4239157910540086	-21.64130893209981	430019
430013	Vision	identifying synapses using deep and wide multiscale recursive networks.	2014	-7.03952298210255	-19.755550478325752	430040
430066	ML	calibrated fmri in the medial temporal lobe during a memory-encoding task	2008	-3.3989363241600223	-20.880934716360922	430093
430644	ML	retrospective harmonization of multi-site diffusion mri data acquired with different acquisition parameters	2019	-4.65905653576489	-21.105806358679853	430671
431066	EDA	implantable microdevice with integrated wireless power transfer for thermal neuromodulation applications	2016	-5.058840843862511	-19.697831631607038	431093
431326	NLP	an inception-like cnn architecture for gi disease and anatomical landmark classification	2017	-6.918271710374035	-21.79699777911713	431353
431331	ML	fuzzy region growing of fmri activation areas	2003	-3.6302625549917265	-20.540101231686762	431358
431483	Vision	frats: functional regression analysis of dti tract statistics	2010	-4.763047824046322	-20.780981934223963	431510
431597	ML	implementation of a new parcellation of the orbitofrontal cortex in the automated anatomical labeling atlas	2015	-4.05652212150308	-20.67448593132907	431624
431695	Theory	functional brain atlas construction for brain network analysis	2013	-3.485360817202498	-20.760670203448477	431722
431714	Vision	independent component analysis-support vector machine-based computer-aided diagnosis system for alzheimer's with visual support	2017	-6.7592027024881665	-22.344406156281835	431741
431924	Comp.	a comprehensive review on the utility of capsule endoscopy in coeliac disease: from computational analysis to the bedside	2018	-6.725570682065361	-21.425009551086873	431951
431980	Metrics	meanfield modeling of propofol-induced changes in spontaneous eeg rhythms	2012	-3.540387032349949	-19.709463460728873	432007
432085	Visualization	an ultrasound wearable system for the monitoring and acceleration of fracture healing in long bones	2005	-5.710959344665612	-19.561204032962838	432112
432120	Robotics	a precise grading method for glioma based on radiomics	2017	-6.933712869347447	-22.673398917531767	432147
432318	ML	the lattice boltzmann method and computational analysis of bone dynamics-i	2017	-5.277263438462287	-22.825620254058183	432345
432343	Comp.	simulating growth dynamics and radiation response of avascular tumour spheroids - model validation in the case of an emt6/ro multicellular spheroid	2004	-5.184809877607287	-22.395939141552816	432370
432418	ML	mechanisms of seizure propagation in a cortical model	2006	-3.8505454118306615	-19.90587559329861	432445
432509	AI	recurrent neural networks for classifying human embryonic stem cell-derived cardiomyocytes	2018	-6.373611223499485	-21.290701853043632	432536
432877	Vision	intraoperative dynamic susceptibility contrast weighted magnetic resonance imaging (idsc-mri) — technical considerations and feasibility	2009	-6.395016700721543	-20.876529028437236	432904
433310	Vision	causality in atrial fibrillation determined by transfer entropy	2015	-5.360898736508371	-20.35746781794564	433337
433444	SE	self-destruction dynamics of hiv-1 quasi-species population in the presence of mutagenic activities	2013	-4.3905109853505735	-23.108118757154546	433471
433736	ML	definition of dlpfc and m1 according to anatomical landmarks for navigated brain stimulation: inter-rater reliability, accuracy, and influence of gender and age	2013	-4.379215092193805	-21.04322818810376	433763
434060	Crypto	the modelling of glaucoma progression through the use of cellular automata	2013	-5.882925031761151	-21.392038261152948	434087
434063	Metrics	the tuebingen scotopic threshold test (tstt)	2018	-5.906027349704202	-20.042079369240998	434090
434337	Robotics	a geometric analysis of bang-bang extremals in optimal control problems for combination cancer chemotherapy	2012	-4.930148727109359	-22.544758901376625	434364
434347	ML	error corrective boosting for learning fully convolutional networks with limited data	2017	-7.139845660677407	-21.77982544975404	434374
434390	ML	three-category classification of magnetic resonance hearing loss images based on deep autoencoder	2017	-6.908457289279788	-22.336815227956663	434417
434497	Robotics	petri-net modeling of bio-signal networks	2005	-5.827373196906907	-19.43402839519106	434524
434835	AI	investigation of normal colonic crypt behaviors through agent-based simulations	2013	-4.413499704049955	-22.797081453643365	434862
435366	Robotics	computer modelling of beat-to-beat repolarization heterogeneity in human cardiac ventricles	2014	-4.541130804623373	-20.561566364988984	435393
435457	ML	independent component analysis of intracellular calcium spike data	1998	-4.06496784764918	-19.444130174073404	435484
435653	ML	brainsegnet : a segmentation network for human brain fiber tractography data into anatomically meaningful clusters	2017	-6.902387030998236	-20.587590875514415	435680
436278	ML	synthesizing missing pet from mri with cycle-consistent generative adversarial networks for alzheimer’s disease diagnosis	2018	-5.862557022023907	-21.773622069994136	436305
436823	Vision	single-view 2d cnns with fully automatic non-nodule categorization for false positive reduction in pulmonary nodule detection	2018	-6.786731215862204	-22.35078148317357	436850
436965	Web+IR	differential roles of sleep spindles and sleep slow oscillations in memory consolidation	2018	-3.491522013397381	-19.4512561335972	436992
437128	Graphics	modeling of solid tumor progression thresholds using a complex adaptive system approach	2009	-4.360269817070075	-22.80333990997849	437155
437223	Crypto	segmentation and classification of normal-appearing brain: how much is enough?	2002	-7.057045954272108	-21.83022839617342	437250
437564	Vision	anatomical landmark detection in medical applications driven by synthetic data	2015	-7.084456243952575	-21.795419983388435	437591
437600	NLP	fully convolutional neural networks for polyp segmentation in colonoscopy	2017	-7.1592523096737875	-22.370518545423764	437627
437732	ML	multinuclear cell analysis using laplacian of gaussian and delaunay graphs	2013	-7.201000349064503	-20.7751565062848	437759
438226	ML	a new ensemble classification system for fracture zone prediction using imbalanced micro-ct bone morphometrical data	2018	-6.920837220337431	-22.632755544638254	438253
438351	HCI	less head motion during mri under task than resting-state conditions	2017	-3.6714955242672116	-21.162595613018464	438378
438367	ML	false positives in imaging genetics	2008	-3.719222709163617	-21.26272747402438	438394
438427	ML	dynamics of cellular responses to radiation	2014	-4.413044002993397	-22.87275806184596	438454
439176	Embedded	development of fmri techniques for planning in functional neurosurgery for parkinson’s disease	2008	-6.0009894405690165	-20.629386672773727	439203
439781	ML	calcium ion fluctuations alter channel gating in a stochastic luminal calcium release site model	2015	-4.052827635896193	-22.677459217094068	439808
439863	HCI	early breast milk exposure modifies brain connectivity in preterm infants	2018	-3.870477557409112	-21.312090121433727	439890
439976	ML	communication structure of cortical networks	2011	-3.5803035091021336	-19.64618044335207	440003
440556	Robotics	nonlinear adaptive control method for treatment of uncertain hepatitis b virus infection	2017	-4.875520736217501	-22.342408292353934	440583
441159	Visualization	regional brain atrophy in children with multiple sclerosis	2011	-5.259397640357332	-21.082654602818828	441186
441165	NLP	dynamics in the neural network of an in vitro epilepsy model	2017	-3.367605887791535	-19.89949934814184	441192
441919	ML	a three-dimensional digital neurological atlas of the mustached bat (<ce:italic>pteronotus parnellii</ce:italic>)	2018	-6.415262081145003	-20.298426677669234	441946
442063	Visualization	modelling drug response and resistance in cancer: opportunities and challenges	2016	-3.856117940097385	-22.951589226121627	442090
442390	Robotics	mapping of complex fractionated atrial electrograms as target sites for af ablation	2011	-4.903062691610337	-20.800350184646405	442417
442424	Visualization	a proposal on anticancer therapy based on reversal of entropy flow through magnetic field	2008	-5.129574440101805	-21.8107796378538	442451
442524	Visualization	identification of ion currents components generating field potential recorded in mea from hipsc-cm	2018	-4.382839431923847	-22.81464237995117	442551
442918	AI	the design of supervisory rule-based control in the operating theatre via an anaesthesia simulator	2002	-4.80108958945844	-21.709161617975607	442945
443212	Web+IR	the gray mouse lemur: a model for studies of primate metabolic rate depression	2015	-4.1902303174977735	-22.038837229709053	443239
443747	ML	mri with and without a high-density eeg cap—what makes the difference?	2015	-4.526764145556212	-20.757697141439863	443774
443802	SE	multiscale analysis of simultaneous uptake of two reactive gases in the human lungs and its application to methemoglobin anemia	2013	-5.098845118716435	-21.267473972711198	443829
444023	ML	micromagnetic stimulation of the mouse auditory cortex in vivo using an implantable solenoid system	2018	-4.854232251203272	-20.06509586959191	444050
444095	Comp.	comparison of functional thalamic segmentation from seed-based analysis and ica	2015	-3.496619169697045	-20.92595235029533	444122
444167	Robotics	detecting failures of the glucose sensor-insulin pump system: improved overnight safety monitoring for type-1 diabetes	2011	-4.836736680373948	-21.814149305872927	444194
444521	ML	a cell signaling model as a trainable neural nanonetwork	2012	-3.5469554703775388	-22.829559192358683	444548
444670	Visualization	3d high-speed multifocal multiphoton microscopy in muscle and wavelet analysis of fast elementary calcium release events	2006	-6.224722719390097	-19.840365038026928	444697
444812	ML	spike-timing-dependent plasticity, learning rules	2014	-3.816266070075695	-19.40284658339785	444839
445336	HCI	diffusion tensor mri-based estimation of the influence of brain tissue anisotropy on the effects of transcranial magnetic stimulation	2007	-5.3183882883696345	-20.36323419153685	445363
445362	Comp.	a viability approach for robustness measurement, organizational autopoiesis, and cell turnover in a multicellular system	2016	-4.1546858320100375	-22.961705916453706	445389
445510	Visualization	a directed particle system for optimised visualization of blood flow in complex networks	2013	-6.07261548380432	-20.1812078973	445537
445619	EDA	are multi-electrode arrays able to differentiate anatomical from functional reentries in an excitable sheet?	2015	-5.589824998350163	-20.27603206368368	445646
445780	Vision	mri tumor segmentation with densely connected 3d cnn	2018	-7.1299221002825215	-21.947039531341204	445807
445832	Vision	learning deep representations of medical images using siamese cnns with application to content-based image retrieval	2017	-6.787215676370421	-22.315326070745222	445859
445910	Robotics	effects of high frequency electrical stimulation on nerve's conduction of action potentials	2011	-4.809814529325728	-20.289006421593694	445937
445962	EDA	brain sources estimation based on eeg and computer simulation technology (cst)	2018	-5.630030636747997	-19.922539369139262	445989
445989	Comp.	the optimization of combination chemotherapy schedules in the presence of drug resistance	2019	-4.876947180577333	-22.620275753149066	446016
446155	Visualization	early artery blood flow is more prognostic in rodent model of middle cerebral artery occlusion	2014	-6.135901771796463	-21.121083739806103	446182
