id	area	title	year	x	y	ix
1063345	ML	[<ce:sup loc=pre>123</ce:sup>i]epidepride binding to cerebellar dopamine d<ce:inf loc=post>2</ce:inf>/d<ce:inf loc=post>3</ce:inf> receptors is displaceable: implications for the use of cerebellum as a reference region	2007	-4.050258536008267	-21.51404653146343	1063372
1063450	HCI	effects of tissue susceptibility on brain temperature mapping	2017	-4.952350390216815	-20.83352230085203	1063477
1063530	AI	computer assisted instruction in the diagnosis of cardiac arrhythmias	1969	-5.076645676014449	-20.61760156421486	1063557
1063585	Robotics	transfer representation learning using inception-v3 for the detection of masses in mammography	2018	-7.119797121161826	-22.35311854878821	1063612
1063937	Robotics	influence of ionotropic receptors localization on glutamatergic synaptic response to paired-pulse stimulation protocol	2013	-4.008090017319649	-19.776557945135504	1063964
1064141	Robotics	detection of nuclei in h&e stained sections using convolutional neural networks	2017	-7.154017028986733	-21.309024423519922	1064168
1064262	Visualization	lethal effect of electric fields on isolated ventricular myocytes	2008	-4.9066652171828915	-20.45778050255425	1064289
1064575	Comp.	discrete modeling of biochemical signaling with memory enhancement	2009	-3.743950065449575	-22.704454905759878	1064602
1064626	ML	local mri analysis approach in the diagnosis of early and prodromal alzheimer's disease	2011	-6.536145217908326	-21.657655492748276	1064653
1064652	ML	dynamics of excitatory networks of bursting pacemaking neurons: modeling and experimental studies of the respiratory central pattern generator	2000	-3.8765601923007753	-19.414486507327002	1064679
1064817	Visualization	computational study on the thermal effects of implantable magnetic stimulation based on planar coils	2016	-5.334531514701979	-20.050549531682453	1064844
1064897	Visualization	key clinical benefits of neuroimaging at 7 t	2018	-6.637031985357826	-20.573536241693468	1064924
1065044	Vision	deep learning based automatic diagnoses of attention deficit hyperactive disorder	2017	-6.718062393669799	-21.82973481022745	1065071
1065513	Vision	influence of normalization on the analysis of electroanatomical maps with manifold harmonics	2016	-6.1762985205867125	-19.425272666314	1065540
1065707	Vision	on the influence of a volume conductor on the orientation of currents in a thin cardiac tissue	2003	-5.716136357700735	-20.159243205453027	1065734
1066144	Visualization	imagesurfer: a tool for visualizing correlations between two volume scalar fields	2004	-7.158447908378557	-19.50900865918084	1066171
1066243	ML	early identification of mild cognitive impairment using incomplete random forest-robust support vector machine and fdg-pet imaging	2017	-5.440621871451801	-21.740547599729506	1066270
1066786	Vision	incorporating outlier detection and replacement into a non-parametric framework for movement and distortion correction of diffusion mr images	2016	-3.7131464351993615	-20.570908868522665	1066813
1066821	Visualization	inverse modeling supports quantification of pressure and time depending effects in ards patients	2011	-5.274275376233727	-21.014410676461694	1066848
1066886	ML	mitosis detection in breast cancer histology images with deep neural networks	2013	-7.167533075270325	-22.299863021772104	1066913
1067179	Arch	selection of kinematic requirements for rfpt-based adaptive anaesthesia control	2016	-4.904951748505983	-21.952872309296247	1067206
1067282	Vision	leveraging disease progression learning for medical image recognition	2018	-6.987908087691451	-21.89183895374991	1067309
1067455	ML	determinants of synaptic integration and heterogeneity in rebound firing explored with data-driven models of deep cerebellar nucleus cells	2010	-4.089845595451238	-19.572987966368427	1067482
1067924	ML	challenges in reproducibility, replicability, and comparability of computational models and tools for neuronal and glial networks, cells, and subcellular structures	2018	-3.5334701408673443	-19.947934514987136	1067951
1067954	ML	segmentation of the hippocampus by transferring algorithmic knowledge for large cohort processing	2018	-3.8220281648127914	-20.80236368124697	1067981
1068505	Vision	simultaneous monitoring of intracellular ph changes and hemodynamic response during cortical spreading depression by fluorescence-corrected multimodal optical imaging	2011	-4.903313395077198	-20.61469749836253	1068532
1068519	ML	multi-task sparse low-rank learning for multi-classification of parkinson's disease	2018	-4.237926628617372	-21.367563583968142	1068546
1069651	Vision	joint sequence learning and cross-modality convolution for 3d biomedical segmentation	2017	-6.980255693311743	-21.47184326920133	1069678
1069870	Visualization	evaluating descriptors for the lateral translocation of membrane proteins	2011	-6.824850836796474	-20.611078700450513	1069897
1070680	ML	deep convolutional neural networks for endotracheal tube position and x-ray image classification: challenges and opportunities	2017	-7.214692335452713	-22.601495375769648	1070707
1071706	Visualization	a new lumped-parameter model of cerebrospinal hydrodynamics during the cardiac cycle in healthy volunteers	2007	-5.942235946384304	-20.642409284877807	1071733
1071949	Vision	segmentation of multiple structures in chest radiographs using multi-task fully convolutional networks	2017	-7.203198449135559	-21.653570399876152	1071976
1072719	ML	aspergillus fumigatus branching complexity in vitro: 2d images and dynamic modeling	2018	-4.85629247465725	-22.526471633417522	1072746
1073130	ML	cluster-extent based thresholding in fmri analyses: pitfalls and recommendations	2014	-3.8557083530271754	-21.14577564950681	1073157
1073268	ML	a model of dopamine modulated cortical activation	2003	-3.810491739515767	-19.58375635052944	1073295
1073376	ML	neurodegenerative disease diagnosis using incomplete multi-modality data via matrix shrinkage and completion	2014	-4.661529029533748	-21.80852599967072	1073403
1073475	NLP	a multi-scale computational investigation of cardiac electrophysiology and arrhythmias in acute ischaemia	2014	-4.728226553508353	-21.23214410112321	1073502
1073548	Robotics	fusing fuzzy and probabilistic memberships for white matter lesion detection in mri of the brain	2010	-7.174797727007902	-21.601726159762865	1073575
1073702	Visualization	designing synthetic biological systems by multiple time scale networks	2004	-3.889957815690325	-22.77661065974098	1073729
1073810	SE	an axonal model for analysis of ionic concentration alterations induced by high frequency electrical stimulations	2016	-4.6443222790042284	-20.11407092885411	1073837
1073827	ML	3 t mri relaxometry detects t2 prolongation in the cerebral normal-appearing white matter in multiple sclerosis	2009	-4.174485425489752	-21.267566304852508	1073854
1073842	SE	evaluating epicardial mapping electrogram by the method of dominant frequency and lorenz plot	2013	-4.615334326035531	-20.48426875394404	1073869
1074177	ML	geometric convolutional neural network for analyzing surface-based neuroimaging data	2018	-6.595506327624189	-21.101104423448245	1074204
1075544	EDA	accelerometry to quantify frequency-dependence of surgical energy-induced neuromuscular stimulation	2014	-5.56567282833274	-19.925346870903017	1075571
1075701	ML	what can we learn from t<ce:inf loc=post>2</ce:inf>* maps of the cortex?	2014	-5.799508368267838	-20.276581543920265	1075728
1075708	ML	mathematical model of glucose metabolism by symbolic regression \alpha \beta	2016	-4.292645987306862	-22.248444439782947	1075735
1075825	Visualization	the effect of mechanical strain on proliferation of lung cancer a549 cells and squamous carcinoma of tongue tca8113 cells	2011	-5.010115223780341	-21.91080649573164	1075852
1075840	Visualization	robustness of the p-u and lnd-u loop wave speed estimation methods: effects of the diastolic pressure decay and vessel wall non-linearities	2011	-4.917245069459611	-20.021298430940305	1075867
1076153	Robotics	[regular paper] model predictive and proportional integral control of blood clotting speed using warfarin when data are missing	2018	-4.847566109830293	-21.91131055111351	1076180
1076231	NLP	anfis based model for bispectral index prediction	2014	-4.628153748404888	-21.675289072958897	1076258
1076594	Vision	assessment of intraoperative brain deformation using interventional mr imaging	1999	-6.256711833971544	-20.761944837586018	1076621
1076659	ML	structural feature selection for connectivity network-based mci diagnosis	2012	-3.835027020788427	-21.18808040597739	1076686
1076927	ML	remote sites of structural atrophy predict later amyloid formation in a mouse model of alzheimer's disease	2010	-3.9550467420585895	-21.208111600518293	1076954
1077004	Vision	fine-grained classification of cervical cells using morphological and appearance based convolutional neural networks	2018	-7.199920652069305	-22.50884248457264	1077031
1077098	Comp.	polymeric nanoparticles for targeted delivery of therapeutic vaccines to dendritic cells	2003	-4.229005566910429	-23.000759319579092	1077125
1077178	ML	accurate hep-2 cell classification based on sparse bag of words coding	2017	-7.054363706351285	-22.42519123418575	1077205
1077249	DB	3d axonal network coupled to microelectrode arrays: a simulation model to study neuronal dynamics	2015	-4.466942059387466	-19.667720842897452	1077276
1077613	HCI	a study of the reproducibility and etiology of diffusion anisotropy differences in developmental stuttering: a potential role for impaired myelination	2010	-3.574648411701274	-21.29518177354936	1077640
1078028	ML	scalable biomedical image synthesis with gan	2018	-6.959292340790294	-21.842048588546266	1078055
1078566	ML	bias in tensor based morphometry stat-roi measures may result in unrealistic power estimates	2011	-3.923228955715353	-21.097939925805075	1078593
1078677	Comp.	contrast-to-noise ratios for indices of anisotropy obtained from diffusion mri: a study with standard clinical b-values at 3<ce:hsp sp=0.25></ce:hsp>t	2011	-7.029054454120089	-20.137993949231518	1078704
1078826	Vision	triple-crossing 2.5d convolutional neural network for detecting neuronal arbours in 3d microscopic images	2017	-7.135164837042948	-19.903857167231635	1078853
1079030	Visualization	entropy of ultrasound-contrast-agent velocity fields for angiogenesis imaging in prostate cancer	2017	-7.137907197301396	-20.935213351483053	1079057
1079605	Robotics	analysis of the mechanism of action of deep brain stimulation using the concepts of dither injection and the equivalent nonlinearity	2009	-3.783520273546055	-19.67058500454749	1079632
1079611	AI	incidental finding of cardiac hydatid cysts, report of two cases	2018	-6.951281688605085	-21.87255008759995	1079638
1079717	Visualization	unsupervised segmentation of cell nuclei using geometric models	2008	-7.1102658492521575	-20.066775956705932	1079744
1079806	Metrics	bonenet: a network model of bone microstructure and dynamics	2013	-5.682739138847919	-21.769077756104927	1079833
1080028	EDA	iterative electrodes increase neural recruitment for deep brain stimulation	2015	-5.0689596637128345	-20.159120957740253	1080055
1080325	NLP	three aspects on using convolutional neural networks for computer-aided detection in medical imaging	2017	-6.917828043506428	-22.41876329983797	1080352
1080443	ML	short- and long-range correlations in beat rate variability of human pluripotent-stem-cell-derived cardiomyocytes	2017	-4.337574474297144	-20.86947716690135	1080470
1081105	Robotics	pancreas modeling from ivgtt data using a deterministic optimal search method	2009	-4.832128096123054	-22.270015631036628	1081132
1081328	HCI	functional near-infrared sensing (fnir) and environmental control applications	2010	-4.498659608840879	-19.836606962077923	1081355
1081404	Vision	spectral clustering as a diagnostic tool in cross-sectional mr studies: an application to mild dementia	2008	-6.841382978298182	-21.848987802755747	1081431
1081624	ML	integrating reinforcement learning to self training for pulmonary nodule segmentation in chest x-rays	2018	-6.995503023480957	-22.10466900463481	1081651
1081806	ML	efficient active learning for image classification and segmentation using a sample selection and conditional generative adversarial network	2018	-7.0716834407791245	-21.923361927455016	1081833
1081817	ML	the impact of cell crowding and active cell movement on vascular tumour growth	2006	-4.863945698098958	-22.86645909480421	1081844
1081893	ML	optimization of multifocal transcranial current stimulation for weighted cortical pattern targeting from realistic modeling of electric fields	2014	-5.0331572611522075	-20.395855070945405	1081920
1082153	Comp.	an extended cellular space method for simulating autocatalytic oligonucleotides	1994	-3.620069526501609	-23.07767917390053	1082180
1082188	HCI	mri assessment of aortic flow in patients with pulmonary arterial hypertension in response to exercise	2018	-5.6961317381638015	-20.90767574686357	1082215
1082278	Vision	effects of tractography approach on consistency between anatomical and functional connectivity estimates	2014	-3.824842967239507	-20.60807019812664	1082305
1082282	Vision	deeply learnt hashing forests for content based image retrieval in prostate mr images	2016	-6.8145715703530945	-22.473213002555596	1082309
1082352	Visualization	prediction of visual field deficits by diffusion tensor imaging in temporal lobe epilepsy surgery	2009	-6.1798430476920885	-20.948417420046248	1082379
1082425	Metrics	electrophysiological and theoretical analysis of depolarization-dependent outward currents in the dendritic membrane of an identified nonspiking interneuron in crayfish	2000	-4.564605020073317	-20.013731554907718	1082452
1082785	ML	a consistent and efficient graphical analysis method to improve the quantification of reversible tracer binding in radioligand receptor dynamic pet studies	2009	-6.287187736186186	-20.680782139821762	1082812
1083019	Visualization	microcomputers and neurobiology: a short review	1985	-5.326833763002261	-19.447385471053533	1083046
1083268	Robotics	a control system for mechanical ventilation of passive and active subjects	2013	-4.949628226933345	-21.488319742702075	1083295
1083335	HPC	mapping brains on grids of features for schizophrenia analysis	2014	-7.100350179349804	-20.485549419942046	1083362
1083447	HCI	experimental studies of g-ratio mri in ex vivo mouse brain	2018	-5.295915108683867	-20.66341049110797	1083474
1083674	Vision	characterizing brain anatomical connections using diffusion weighted mri and graph theory	2007	-4.064993593717826	-20.86575364007661	1083701
1083956	Visualization	hippocampal surface mapping of genetic risk factors in ad via sparse learning models	2011	-3.5270654879881373	-21.12841337136522	1083983
1084051	Vision	finding frequent approximate subgraphs in medical image database	2015	-6.918391466602918	-21.151137626913663	1084078
1084158	Robotics	presynaptic control of efficacy of gabaergic synapses in the hippocampus	2001	-4.024403425138853	-19.54009835522054	1084185
1084548	ML	statistical methods for analyzing tissue microarray images - algorithmic scoring and co-training	2011	-7.223126682748914	-22.503823810256108	1084575
1084745	SE	early development of arterial spin labeling to measure regional brain blood flow by mri	2012	-5.208803906678893	-20.769801308905052	1084772
1084766	ML	evaluation of highly accelerated simultaneous multi-slice epi for fmri	2015	-3.884234942576237	-20.419176898527446	1084793
1084791	AI	low-power microvrms noise neural spike detector for implantable interface microsystem device	2015	-6.514380621114452	-21.369800903072324	1084818
1084934	AI	piecewise nonlinear mixed-effects models for modeling cardiac function and assessing treatment effects	2013	-3.8854473137918895	-22.172080969220207	1084961
1085009	EDA	on sustaining robustness of molecular pathway circuits of the hsr network of e. coli under spatial configuration	2012	-3.65710079032735	-22.890602555395827	1085036
1085217	SE	the significance of lpv modeling of a widely used t1dm model	2013	-4.726142271149818	-22.010896485030077	1085244
1085448	ML	mathematical modeling of biofilm structures using comstat data	2017	-4.879490759989885	-22.710837036395606	1085475
1085581	Vision	a multivariate statistical analysis of the developing human brain in preterm infants	2007	-6.658565961781077	-21.019726418539747	1085608
1085784	HCI	a multi-method approach towards understanding the pathophysiology of aortic dissections: the complementary role of in-silico, in-vitro and in-vivo information	2010	-5.87240887326913	-21.330414078303573	1085811
1086118	Visualization	mapping of change in cerebral glucose utilization using fluorine-18 fluorodeoxyglucose double injection and the constrained weighted-integration method	1996	-3.654252468326432	-21.072471278309454	1086145
1086393	ML	preictal short-term plasticity induced by intracerebral 1 hz stimulation	2008	-3.5581764492024512	-19.898993607974447	1086420
1086575	AI	bayesian population approaches to the analysis of dose escalation studies	2012	-4.663275740319404	-22.074269119733227	1086602
1086705	Comp.	multiobjective optimization based-approach for discovering novel cancer therapies	2012	-4.565007693658384	-22.9516381969593	1086732
1086744	ML	optimizations for neuron time warp(ntw) for stochastic reaction-diffusion models of neurons	2017	-3.8820383999641788	-22.702987352876068	1086771
1086747	Comp.	discrete nondeterministic modeling of the fas pathway	2008	-3.7549526228689873	-22.881666327156548	1086774
1087018	ML	simultaneous recording of ecog and intracortical neuronal activity using a flexible multichannel electrode-mesh in visual cortex	2011	-4.75483956677801	-20.119566331713376	1087045
1087278	Visualization	a physiologic model of capillary-tissue exchange for dynamic contrast-enhanced imaging of tumor microcirculation	2003	-6.772902120234248	-20.655263422064696	1087305
1087374	Vision	decompose to manipulate: manipulable object synthesis in 3d medical images with structured image decomposition	2018	-7.04970786963776	-22.10643430441248	1087401
1087386	HCI	energy minimization during transcutaneous electrical stimulation by charge efficient stimulation pulses - benefits of using short duration and high amplitude stimulation pulses	2016	-4.850944227928087	-19.928132689363704	1087413
1087440	Vision	alzheimer's disease diagnostics by a deeply supervised adaptable 3d convolutional network	2016	-6.886723051881157	-21.821681706455326	1087467
1087444	Networks	modelling dynamic changes in blood flow and volume in the cerebral vasculature	2018	-5.962125554437137	-20.406424968791285	1087471
1087730	Robotics	multimodal therapy for complete regression of malignant melanoma using constrained nonlinear optimal dynamic inversion	2014	-4.845043516874183	-22.307461994566182	1087757
1087970	ML	calcium dynamics and generation of propagating waves in a coupled ensemble of neurons with random connection strengths	2003	-4.094367164538206	-19.438878554197085	1087997
1088095	AI	modeling the influence of ion channels on neuron dynamics in drosophila	2015	-4.406705255895178	-19.860516020361345	1088122
1089014	AI	dermatologist-level classification of skin cancer with deep neural networks	2017	-7.21732773183782	-22.678289506583845	1089041
1089205	ML	emergence of physiological oscillation frequencies in a computer model of neocortex	2011	-3.6553335493824433	-19.554485139646328	1089232
1089241	EDA	biomagnetic measurement system for supine subjects with expanded sensor array and real-time noise reduction	2015	-5.212473927858569	-19.642176468910986	1089268
1089273	HCI	increased oxygen consumption in the somatosensory cortex of α-chloralose anesthetized rats during forepaw stimulation determined using mrs at 11.7 tesla	2006	-4.35369157780912	-20.93553005864432	1089300
1089747	Comp.	the impacts of geometry and binding on camkii diffusion and retention in dendritic spines	2010	-4.4609751099567365	-20.19508910929462	1089774
1089970	ML	brain perfusion heterogeneity measurement based on random walk algorithm: choice and influence of inner parameters	2010	-6.733653482730848	-20.65831995267034	1089997
1090050	ML	a dynamical modeling approach for analysis of longitudinal clinical trials in the presence of missing endpoints	2017	-4.864593747686102	-21.762021143079167	1090077
1090077	Comp.	engineering virtual cardiac tissue	2001	-4.671477610025697	-22.78303325311873	1090104
1090945	Comp.	increased computational accuracy in multi-compartmental cable models by a novel approach for precise point process localization	2005	-5.731303002000197	-20.30219814689016	1090972
1091045	Vision	sparse representation based facial expression classification for pain assessment in neonates	2016	-7.137811834177273	-22.99696222989148	1091072
1091127	Robotics	a resting-state fmri study of patients with hiv infection based on regional homogeneity method	2011	-3.4479555585018016	-21.26922830807849	1091154
1091243	HCI	changes in the initial slope of the qrs in ischemic patients and normal subjects undergoing scintigraphy withdipyridamole	2010	-5.626453681589895	-20.595492072969826	1091270
1091727	ML	signal enhancement in the output stage of the basal ganglia by synaptic short-term plasticity in the direct, indirect, and hyperdirect pathways	2013	-4.0602451021905885	-19.580030650553574	1091754
1092162	Visualization	a standardized blood sampling scheme in quantitative fdg-pet studies	1999	-5.6254271901862625	-20.869304118162592	1092189
1092324	ML	virtual electrode recording tool for extracellular potentials (vertex): comparing multi-electrode recordings from simulated and biological mammalian cortical tissue	2014	-5.355546843884231	-20.257553185030154	1092351
1092461	ML	is there a correlation between hippocampus and amygdala volume and olfactory function in healthy subjects?	2012	-3.4974388723124057	-21.341089093678388	1092488
1092557	Robotics	discrimination of the micro electrode recordings for stn localization during dbs surgery in parkinson's patients	2013	-6.32961763787045	-20.670492876692464	1092584
1092986	ML	a flowgraph model for bladder carcinoma	2013	-5.769991816178105	-21.905356814332567	1093013
1093309	ML	quantitation of glutamate mglur5 receptor with 18f-fpeb pet in humans	2010	-4.508679364648906	-21.315987102092702	1093336
1093466	Robotics	cardiovascular system identification: simulation study using arterial and central venous pressures	2015	-4.926022458957164	-21.297693678972585	1093493
1093851	Robotics	a histology-based model of quantitative t1 contrast for in-vivo cortical parcellation of high-resolution 7 tesla brain mr images	2013	-6.885389768233483	-20.023720268447786	1093878
1094614	Vision	subcellular localization algorithm based on fluorescence microscopy images	2013	-6.977536891395188	-19.894711296778752	1094641
1094828	Vision	coarse-to-fine multi-task training of convolutional neural networks for automated information extraction from cancer pathology reports	2018	-6.972059753741008	-22.381178738655134	1094855
1095141	ML	die informationsübertragung im afferenten visuellen system	1962	-3.5837790172416124	-19.627900468472713	1095168
1095146	Embedded	a modeling and simulation language for biological cells with coupled mechanical and chemical processes	2017	-5.081711028264876	-22.474845590817548	1095173
1095446	ML	traveling waves of a go-or-grow model of glioma growth	2018	-4.75097882185763	-22.75172534414203	1095473
1095764	Robotics	an integrated device for simultaneously monitoring electrocorticography and cerebral blood flow in rat's brain	2014	-3.7965154392131777	-20.31424260766852	1095791
1096024	ML	functional modeling of astrocytes in epilepsy: a feedback system perspective	2010	-3.764067644208637	-19.73511238309268	1096051
1096095	HPC	stochastical analysis of finite point sampling of 3d chromatin fiber in interphase cell nuclei	2007	-7.019619137919454	-19.455166287370318	1096122
1096177	HCI	a watershed-based algorithm to segment and classify cells in fluorescence microscopy images	2017	-7.08882364093384	-19.63058528847381	1096204
1096193	Visualization	survival of rats with n29 brain tumours after irradiation with 5 or 15 gy and immunization with ifn-gamma secreting tumour cells	2008	-5.211813030395449	-21.439609072678174	1096220
1096244	HPC	automatic prediction of myocardial contractility improvement in stress mri using shape morphometrics with independent component analysis	2005	-6.422995894979932	-20.93691536972432	1096271
1096290	Robotics	estimation of pressure drop in pediatric endotracheal tubes during hfpv	2013	-5.516400386748253	-20.39205154338064	1096317
1096564	ML	wavelet bifurcation analysis of dynamical systems: a case study in oscillations of chara corallina transmembrane potential	2012	-4.5181863640691775	-19.646490911471762	1096591
1096932	Graphics	optimizing multi-dimensional terahertz imaging analysis for colon cancer diagnosis	2013	-7.025510569433884	-23.147182323004788	1096959
1097245	NLP	brain tumor segmentation and radiomics survival prediction: contribution to the brats 2017 challenge	2017	-7.199143711261555	-22.324186972161485	1097272
1097309	Mobile	wireless communications for optogenetics-based brain stimulation: present technology and future challenges	2018	-5.023392382149625	-19.733614343462623	1097336
1097432	Visualization	detection of cancer using advanced computerized analysis of infrared spectra of peripheral blood	2013	-7.181871929989972	-22.59444819049179	1097459
1097941	Visualization	a novel angiographic methodology for the quantification of angiogenesis	2008	-5.796583706603972	-21.34680168084999	1097968
1098139	Vision	observer-based efficiency enhancement in cell-cycle specific therapies	2016	-4.660001032395307	-22.37862833511497	1098166
