id	area	title	year	x	y	ix
1415303	Vision	siamese lstm based fiber structural similarity network (fs2net) for rotation invariant brain tractography segmentation	2017	-7.220014503685528	-21.1491067674442	1415330
1415410	HCI	fast parameters estimation in medication efficacy assessment model for heart failure treatment	2012	-4.874965800903712	-21.74965872781304	1415437
1415534	SE	activation induced changes in gaba: functional mrs at 7<ce:hsp sp=0.25></ce:hsp>t with mega-slaser	2017	-4.7707981113276094	-20.90388153388553	1415561
1415918	ML	using geometry to uncover relationships between isotropy, homogeneity, and modularity in cortical connectivity	2013	-6.99901461044013	-19.55510297272576	1415945
1416369	AI	on the use of process algebra techniques in computational modelling of cancer initiation and development	2008	-3.3889820464180422	-22.805282171204794	1416396
1416391	ML	impact of image acquisition on voxel-based-morphometry investigations of age-related structural brain changes	2014	-5.272233138711166	-20.982072199334226	1416418
1416419	AI	erythropoiesis-stimulating-agent dose optimization for anemia management in chronic kidney disease using recursive constrained modeling and zone model predictive control	2018	-4.747772008594958	-21.934793207055908	1416446
1416576	ML	antemortem mri based structural abnormality index (stand)-scores correlate with postmortem braak neurofibrillary tangle stage	2008	-6.13058807489787	-21.346385909788648	1416603
1416900	Vision	regions-of-interest based automated diagnosis of parkinson's disease using t1-weighted mri	2015	-6.4939166374826955	-22.032662519786964	1416927
1416903	Vision	automatic view classification for cardiac mri	2012	-7.188818943804621	-21.790836900028186	1416930
1417661	DB	moving picture experts group (mpeg)	2009	-5.759845588840008	-19.601894112778293	1417688
1417760	ML	perturbation of the bold response by a contrast agent and interpretation through a modified balloon model	2009	-4.455495528780019	-20.710570326367947	1417787
1417765	AI	optimising cancer chemotherapy using an estimation of distribution algorithm and genetic algorithms	2006	-4.987087623428018	-22.60763550309211	1417792
1417773	Embedded	identifying a central nervous system perturbation that explains peripheral hypocortisolism by modeling the hpa axis	2006	-4.360735917218063	-21.941206799797378	1417800
1418705	AI	mettle: a modelling-based learning environment for undergraduate engineering estimation problem solving	1982	-4.497036983474302	-19.63121502877952	1418732
1418741	Visualization	modulation of spiral-wave dynamics and spontaneous activity in a fibroblast/myocyte heterocellular tissue–-a computational study	2012	-4.417604647395437	-19.912910642458343	1418768
1418994	ML	spatial simulations of myxobacterial development	2010	-4.743288350916108	-23.175266755579692	1419021
1418995	Robotics	activation of immune response in disease dynamics via controlled drug scheduling	2009	-4.536533238510371	-22.52452042767669	1419022
1419027	ML	graph entropy-based clustering algorithm in medical brain image database	2016	-6.912063683925738	-21.21362006650417	1419054
1419035	HCI	approach for streamlining measurement of complex physiological phenotypes of upper airway collapsibility	2013	-5.9603760364615885	-21.036709325917816	1419062
1419208	ML	multimodal neuroimaging in schizophrenia: description and dissemination	2017	-3.4270382695255	-20.604677183914166	1419235
1419230	Robotics	development and validation of a tactile sensitivity scale for peripheral neuropathy screening	2014	-5.834066222756309	-20.141762940958817	1419257
1419353	Robotics	brain fiber architecture, genetics, and intelligence: a high angular resolution diffusion imaging (hardi) study	2008	-6.647507463676168	-19.893396177726192	1419380
1419586	ML	toward reliable characterization of functional homogeneity in the human brain: preprocessing, scan duration, imaging resolution and computational space	2013	-3.3670458337421456	-20.834605602052818	1419613
1419733	ML	computer modeling of ventricular rhythm during atrial fibrillation and ventricular pacing	2006	-4.308292054304872	-19.394133536629298	1419760
1419797	Robotics	effects of freezing brain tissue by a micro-cryoprobe on the neuronal / circulatory functions	2011	-5.5776646313964005	-20.987957237262425	1419824
1419802	ML	exploiting ecology in drug pulse sequences in favour of population reduction	2017	-4.426563750402286	-23.210180851628103	1419829
1420339	Robotics	individualized pid control of depth of anesthesia based on patient model identification during the induction phase of anesthesia	2011	-4.878694369052798	-21.80916270864907	1420366
1420364	HCI	age-associated reductions in cerebral blood flow are independent from regional atrophy	2011	-3.4324024482286686	-21.20484643088791	1420391
1420429	Visualization	feasibility of mapping the tissue mass corrected bioscale of cerebral metabolic rate of oxygen consumption using 17-oxygen and 23-sodium mr imaging in a human brain at 9.4<ce:hsp sp=0.25></ce:hsp>t	2010	-5.198591889704659	-21.216677303026067	1420456
1420601	ML	serotonin 2a receptor agonist binding in the human brain with [<ce:sup loc=pre>11</ce:sup>c]cimbi-36: test–retest reproducibility and head-to-head comparison with the antagonist [<ce:sup loc=pre>18</ce:sup>f]altanserin	2016	-4.690160272882267	-21.276789394241423	1420628
1420684	AI	an automatic method to calculate heart rate from zebrafish larval cardiac videos	2018	-7.0827523343833665	-19.742286039036145	1420711
1420733	ML	examining cortical dynamics and connectivity with simultaneous single-pulse transcranial magnetic stimulation and fast optical imaging	2012	-3.5230261933514	-20.61668926275177	1420760
1420803	Robotics	simulations of the cardiovascular system using the cardiovascular simulation toolbox	2014	-5.843579019039471	-20.26019659395314	1420830
1420912	Visualization	monte carlo simulations of diffusion weighted mri in myocardium: validation and sensitivity analysis	2017	-6.035998126215942	-20.409018600809556	1420939
1421180	ML	a regularized full reference tissue model for pet neuroreceptor mapping	2016	-6.280598358012463	-20.5048198978078	1421207
1421308	Robotics	tracking normal action potential based on the fhn model using adaptive feedback linearization technique	2010	-3.661773343826582	-19.511948862244637	1421335
1421482	Visualization	changes in fitness are associated with changes in hippocampal microstructure and hippocampal volume among older adults	2016	-3.6717826599902414	-21.309097637548	1421509
1421943	HCI	quantitative magnetization transfer imaging of human brain at 7<ce:hsp sp=0.25></ce:hsp>t	2013	-5.232238373686776	-20.739526637197013	1421970
1422199	Networks	mucus distribution model in a lung with cystic fibrosis	2012	-4.824902503725	-22.572963787586666	1422226
1422366	Embedded	spectral analysis of the flow in a glottal model	2011	-5.601994556004215	-20.243861626598846	1422393
1422486	HCI	interstitial insulin kinetic parameters for a 2-compartment insulin model with saturable clearance	2014	-4.882078205733214	-21.909445408008185	1422513
1422939	Visualization	accuracy of reflectance photoplethysmography on detecting cuff-induced vascular occlusions	2015	-5.623451458757362	-19.925175115847477	1422966
1422964	Vision	the cambridge mri database for animal models of huntington disease	2016	-7.026198912313235	-20.27727173842047	1422991
1423369	Vision	simultaneous imaging of multiple neurotransmitters and neuroactive substances in the brain by desorption electrospray ionization mass spectrometry	2016	-5.412133545126491	-21.763486766323556	1423396
1423758	HCI	functional magnetic resonance imaging networks induced by intracranial stimulation may help defining the epileptogenic zone	2014	-3.8213814370581702	-20.861073430487316	1423785
1423860	Comp.	parameter synthesis in nonlinear dynamical systems: application to systems biology	2009	-3.50899227120761	-22.661947036928105	1423887
1423998	ML	breast cancer cell nuclei classification in histopathology images using deep neural networks	2017	-6.835552388155218	-22.19225196860449	1424025
1424016	Visualization	pro-arrhythmic effect of heart rate variability during periodic pacing	2016	-4.890913431778256	-20.973947047842678	1424043
1424367	Vision	wanted dead or alive? the tradeoff between in-vivo versus ex-vivo mr brain imaging in the mouse	2012	-3.4806889316417586	-20.533530217384783	1424394
1424453	ML	cerebral cortical folding analysis with multivariate modeling and testing: studies on gender differences and neonatal development	2010	-6.7545332121044375	-20.21553795452033	1424480
1424767	ML	neuronal calcium wave propagation varies with changes in endoplasmic reticulum parameters: a computer model	2015	-4.464216174860142	-20.11312269554566	1424794
1424813	Visualization	random walk model based on dti for predicting the microscopic spread of gliomas	2008	-5.829527361297775	-20.871069141302442	1424840
1425124	Visualization	microfabrication- and microfluidics-based patterning of cultured neuronal network	2011	-4.866712024850398	-20.29624509177472	1425151
1425153	Visualization	modeling study of the light stimulation of a neuron cell with channelrhodopsin-2 mutants	2011	-4.235696135152162	-19.542201673965273	1425180
1425622	SE	modeling of tumor growth undergoing virotherapy	2011	-5.1783095801374115	-22.462632979429664	1425649
1425779	ML	numerical investigation into blood clotting at the bone-dental implant interface in the presence of an electrical stimulus	2013	-5.032130916430117	-20.815670666773126	1425806
1426091	ML	mapping glucose-mediated gut-to-brain signalling pathways in humans☆	2014	-3.3828108902212266	-21.34670042973668	1426118
1426106	ML	bihormonal glucose control using a continuous insulin pump and a glucagon-pen	2016	-4.844270107129971	-21.93507421665497	1426133
1426608	ML	quantification of the glycine transporter 1 in rhesus monkey brain using [<ce:sup loc=pre>18</ce:sup>f]mk-6577 and a model-based input function	2012	-4.6175840695657415	-21.357365981983012	1426635
1426710	AI	breast cancer discriminant feature analysis for diagnosis via jointly sparse learning	2016	-4.723737471890899	-21.668380791386628	1426737
1426735	SE	senescence-associated ß-galactosidase as a senescence biomarker showed in rat hippocampus	2008	-3.5291125160855223	-21.256461172461094	1426762
1426813	ML	layer-dependent bold and cbv-weighted fmri responses in the rat olfactory bulb	2014	-4.497724836414707	-20.67709337221172	1426840
1426901	AI	a modified deep convolutional neural network for abnormal brain image classification	2019	-7.071617971334724	-21.98803950743498	1426928
1427160		genetic influences on brain asymmetry: a dti study of 374 twins and siblings	2010	-3.6137362181215638	-21.285260277049655	1427187
1427174	Vision	minimal neighborhood redundancy maximal relevance: application to the diagnosis of alzheimer's disease	2015	-6.147806777354544	-21.452813100535746	1427201
1427207	NLP	particle based model of tumor progression stimulated by the process of angiogenesis	2008	-5.049008327536666	-22.78195822972323	1427234
1427406	ML	biophysical modeling of high field diffusion mri demonstrates micro-structural aberration in chronic mild stress rat brain	2016	-4.211792602309386	-21.228676622730184	1427433
1427622	ML	electrophysiology of heart failure using a rabbit model: from the failing myocyte to ventricular fibrillation	2016	-4.9630989674178885	-20.86269233641765	1427649
1427633	Graphics	quantitative image processing of 3d biological structures	2002	-6.9329405647083036	-20.342357202719814	1427660
1428029	ML	model-based estimation of microscopic anisotropy in macroscopically isotropic substrates using diffusion mri	2015	-6.816641191958108	-19.938033291814968	1428056
1428394	ML	changes in white matter microstructure during adolescence	2008	-3.8054577873473217	-21.211568540507127	1428421
1428731	Visualization	investigation of atrial vulnerability by analysis of the sinus node eg from atrial fibrillation models using a phase synchronization method	2012	-4.080833118597535	-20.85512936921483	1428758
1429131	Visualization	flexible epineural strip electrode for recording in fine nerves	2016	-5.029740856133972	-19.89981089158321	1429158
1429187	Visualization	a high-level 3d visualization api for java and imagej	2010	-7.144353171485897	-19.4966054943822	1429214
1429316	ML	a complex system model of glucose regulatory metabolism	2006	-4.260028315596377	-22.620807546880624	1429343
1429423	ML	computing lfp from biophysical models of neurons and neural microcircuits	2016	-4.013137558562734	-19.470239744237233	1429450
1429867	Robotics	a pilot study of planar coil based magnetic stimulation using acute hippocampal slice in mice	2017	-5.011676191870016	-20.089840443215813	1429894
1430194	Visualization	analysis of relative errors and bounds in localization of dipoles in various ellipsoidal brain models in encephalography	2013	-4.77281741531301	-19.93365043616178	1430221
1430841	AI	a semantic modeling approach for medical image semantic retrieval using hybrid bayesian networks	2006	-6.996727728672688	-22.292568251785763	1430868
1431198	Vision	learning-based segmentation framework for tissue images containing gene expression data	2007	-7.1956987641819525	-20.165516515701515	1431225
1431246	Vision	deep dense multi-path neural network for prostate segmentation in magnetic resonance imaging	2018	-7.226522765119678	-21.72238929710048	1431273
1431309	Arch	classification of amnestic mild cognitive impairment using fmri	2014	-5.558955368423028	-21.748931854318815	1431336
1431794	HCI	using sulcal and gyral measures of brain structure to investigate benefits of an active lifestyle	2014	-3.5667017543419037	-21.315788107674337	1431821
1431939	Robotics	the strength-interval curve in cardiac tissue	2013	-5.112690787079294	-20.130220485241736	1431966
1432401	AI	max-margin based learning for discriminative bayesian network from neuroimaging data	2014	-3.7922010221927382	-21.069496863353024	1432428
1432742	AI	tversky loss function for image segmentation using 3d fully convolutional deep networks	2017	-7.137188542500562	-22.07408936181416	1432769
1433002	AI	evolving novel and effective treatment plans in the context of infection dynamics models: illustrated with hiv and haart therapy	2006	-4.240863992915654	-23.086202485519113	1433029
1433122	Visualization	magnetic resonance virtual histology for embryos: 3d atlases for automated high-throughput phenotyping	2011	-7.012601462072553	-20.50473717703937	1433149
1434130	HCI	finite difference and lead field methods in designing implantable ecg monitor	2006	-5.572463759314506	-20.25456727116821	1434157
1434710	Web+IR	t<ce:inf loc=post>2</ce:inf>* mapping and b<ce:inf loc=post>0</ce:inf> orientation-dependence at 7<ce:hsp sp=0.25></ce:hsp>t reveal cyto- and myeloarchitecture organization of the human cortex	2012	-4.087161143326834	-20.800726178414624	1434737
1434941	Visualization	effect of cell geometry on conduction velocity in a subcellular model of myocardium	2010	-5.5571585028104105	-20.31546992808792	1434968
1435017	AI	a computer-based bioelectrical impedance spectroscopic system for noninvasive assessment of compartmental fluid redistribution	1990	-5.238118276911961	-20.269137326223444	1435044
1435078	Vision	isointense infant brain mri segmentation with a dilated convolutional neural network	2017	-7.221352347625058	-21.787180258811542	1435105
1435123	Visualization	modeling spatial population dynamics of stem cell lineage in wound healing and cancerogenesis	2013	-4.613814337032624	-23.032430803172574	1435150
1435158	Robotics	application of meg coherence in lateralization of mtle	2016	-3.4187399097081403	-21.152642728508415	1435185
1435229	ML	computational consequences of temporally asymmetric learning rules: ii. sensory image cancellation	2000	-3.574801632962312	-19.442251128197157	1435256
1435514	Visualization	estimation of the va/(q+vtis) distribution from single-breath alkane uptake	2001	-5.221211686322135	-21.257893981590996	1435541
1435553	Vision	clinical application of surface plasmon resonance-based biosensors for fetal fibronectin detection	2012	-5.4830333541432665	-21.572769559469165	1435580
1435701	ML	multi-task learning with weak class labels: leveraging ieeg to detect cortical lesions in cryptogenic epilepsy	2016	-5.805622462437879	-21.808393892208727	1435728
1435852	Robotics	searching for a new non-invasive method of blood circulation system diagnostics	2008	-5.9205822086736974	-19.999150045088648	1435879
1435974	ML	local cortical injections of glutamate and noradrenaline alter high-frequency (245 hz) neuronal activity in rat cortex	1999	-3.527457378768703	-19.732899387771823	1436001
1436114	Visualization	aortic dissection maps: comprehensive visualization of aortic dissections for risk assessment	2016	-6.360712739606142	-21.282343960104345	1436141
1436206	Vision	connectivity-based parcellation of the postcentral gyrus using a spectral approach	2013	-7.12838556984776	-19.83709234276904	1436233
1436509	Comp.	hybrid models of the cell cycle molecular machinery	2012	-3.718964706211714	-22.76835469012693	1436536
1436584	HCI	load-dependency in mechanical properties of subepicardial and subendocardial cardiomyocytes	2015	-5.351281692582144	-20.77713942018284	1436611
1436766	Comp.	a dynamic view to the modulation of phosphorylation and o-glcnacylation by inhibition of o-glcnacase	2013	-4.293858406030523	-22.435772908634874	1436793
1436879	ML	impact of time-of-day on brain morphometric measures derived from t<ce:inf loc=post>1</ce:inf>-weighted magnetic resonance imaging	2016	-3.750248692774492	-21.20088488967212	1436906
1437132	ML	quantitative examination of a novel clustering method using magnetic resonance diffusion tensor tractography	2009	-6.830304698742577	-20.734696603335163	1437159
1437415	ML	two-term asymptotic approximation of a cardiac restitution curve	2006	-4.78520865461371	-19.99799751952066	1437442
1437629	Robotics	a three dimensional ventricular e-cell (3dv e-cell) with stochastic intracellular ca 2 +  handling	2007	-5.140144545383411	-22.048805448414093	1437656
1439018	Robotics	preferred patterns of diastolic timed vibrations for pre-hospitalization treatment of acute coronary ischemia	2011	-5.428216130617251	-20.32708476314572	1439045
1439111	HCI	a case of multiple hepatic angiomyolipomas with high 18 f-fluorodeoxyglucose uptake	2014	-6.947040555874151	-21.729242094031715	1439138
1439431	Comp.	an image score inference system for rnai genome-wide screening based on fuzzy mixture regression modeling	2009	-7.012134007529662	-20.99852328610652	1439458
1439561	ML	aro: a machine learning approach to identifying single molecules and estimating classification error in fluorescence microscopy images	2015	-7.151103940260844	-19.70174136065834	1439588
1439680	Visualization	linear least squares compartmental-model-independent parameter identification in pet	1997	-6.410932872276051	-20.37440628151237	1439707
1439836	ML	parahippocampal and entorhinal resection extent predicts verbal memory decline in an epilepsy surgery cohort	2017	-3.5265445031369254	-21.366187639738506	1439863
1439936	Robotics	regional conduction velocity calculation based on local activation times: a simulation study on clinical geometries	2016	-7.206176062970919	-20.522895749949306	1439963
1439996	Vision	uncertainty modeling and interpretability in convolutional neural networks for polyp segmentation	2018	-6.929515591097423	-21.82437556238833	1440023
1440367	ML	burst detection algorithms for the analysis of spatio-temporal patterns in cortical networks of neurons	2005	-3.5472924341636687	-19.51931181425254	1440394
1440465	Vision	spatial resolution dependence of dti tractography in human occipito-callosal region	2006	-4.1804638498095485	-20.59881008280802	1440492
1441082	Comp.	numerical simulation of stochastic gene circuits	2005	-3.800322698350036	-22.838918597386755	1441109
1441332	Vision	tractographic reconstruction protocol optimization in the rat brain in-vivo: towards a normal atlas	2011	-6.4457833883619005	-21.03004196912011	1441359
1441388	Visualization	dynamic ventilation $^3$he mri for the quantification of disease in the rat lung	2012	-6.416449350582528	-20.83303787927461	1441415
1441535	Visualization	a discrete-time control algorithm applied to closed-loop pacing of hl-1 cardiomyocytes	2008	-4.11883084258641	-22.541839161710488	1441562
1441540	HCI	unbiased average age-appropriate atlases for pediatric studies	2011	-7.123431911364131	-20.56212130718608	1441567
1441560	ML	heritability and reliability of automatically segmented human hippocampal formation subregions	2016	-3.648040936504648	-21.343208728597123	1441587
1442368	Visualization	motion tracking of the outer tips of microtubules	2008	-7.061441528646209	-19.603946221511517	1442395
1442851	ML	shape analysis and classification of lgl-type and wild-type neurons	2010	-6.610660385720164	-20.825439300741127	1442878
1442941	Vision	lvq-svm based cad tool applied to structural mri for the diagnosis of the alzheimer's disease	2013	-7.062680031761155	-22.25206340812313	1442968
1443375	Visualization	spatiotemporal visualization of cell membrane dynamics and protein colocalization reveals correlation between membrane dynamics and metastatic invasion	2015	-5.106225912097772	-22.49061847325116	1443402
1443436	HPC	effect of rotator cuff dysfunction on the initial mechanical stability of cementless glenoid components	2009	-5.429721434069536	-20.205003749025124	1443463
1443605	ML	artificial neural networks for closed loop control of in silico and ad hoc type 1 diabetes	2012	-4.890296936592646	-21.838399704158736	1443632
1443729	Arch	a method for quantification of calponin expression in myoepithelial cells in immunohistochemical images of ductal carcinoma in situ	2018	-5.655351605125515	-21.769235186497777	1443756
1444028	Vision	parallel deep solutions for image retrieval from imbalanced medical imaging archives	2018	-6.799841170481713	-22.7332878701469	1444055
1444185	Vision	supervised parametric and non-parametric classification of chromosome images	2005	-7.169460396946484	-20.341106919403426	1444212
1445290	Comp.	erratum to: ‘conditional robustness analysis for fragility discovery and target identification in biochemical networks and in cancer systems biology’	2015	-3.5098892779612023	-22.72195482214139	1445317
1445490	ML	the connectivity of the brain: multi-level quantitative analysis	1995	-4.411479479206256	-19.53581304494943	1445517
1445729	ML	astroglial networks and implications for therapeutic neuromodulation of epilepsy	2012	-3.406821021464329	-20.74767157216789	1445756
1446057	Robotics	fine granularity parcellation of gyrus via fiber shape and connectivity based features	2011	-3.749382223767926	-20.750120431571702	1446084
1446339	Robotics	mpc design for rapid pump-attenuation and expedited hyperglycemia response to treat t1dm with an artificial pancreas	2014	-4.88980646645044	-22.07351867459441	1446366
1447070	ML	orientation dependence of magnetization transfer parameters in human white matter	2015	-5.527087328196834	-20.45648299973476	1447097
1447460	Comp.	cell boundary detection for quantitative studies of the role of tetraspanin cd82 in cell-cell adhesion	2016	-7.045346545085442	-19.90106678999218	1447487
1447517	Robotics	time-varying pulse trains limit retinal desensitization caused by continuous electrical stimulation	2014	-4.036197903239603	-20.019775934928447	1447544
1447568	Comp.	parameter adaptations during phenotype transitions in progressive diseases	2011	-4.2777165783952436	-23.19320880702353	1447595
1448070	ML	grouping total variation and sparsity: statistical learning with segmenting penalties	2015	-6.258229655574003	-21.23155881925573	1448097
1448467	ML	supervoxel-based statistical analysis of diffusion tensor imaging in schizotypal personality disorder	2017	-6.138198971684639	-21.09572739001958	1448494
1448507	ML	pushing the limits of ultra-high resolution human brain imaging with sms-epi demonstrated for columnar level fmri	2018	-4.619816030548213	-20.175460658428193	1448534
1448512	ML	similarity based object retrieval of composite neuronal structures	2012	-5.387724013169817	-19.88490125876357	1448539
1448594	HCI	evaluation of activity-dependent functional ph and t<ce:inf loc=post>1ρ</ce:inf> response in the visual cortex	2014	-3.617112471782471	-20.65786969883006	1448621
1448629	Robotics	induction of variation in impedance of zebrafish embryos by explicit force feedback control	2009	-5.39153333045035	-22.33138711290504	1448656
1448700	Vision	unsupervised domain adaptation for medical imaging segmentation with self-ensembling	2018	-6.96817924102687	-21.689055083229146	1448727
1448772	ML	application of multiobjective neural predictive control to biventricular assistance using dual rotary blood pumps	2018	-5.069314019272396	-21.57267670728459	1448799
1448803	HCI	the influence of age and skull conductivity on surface and subdermal bipolar eeg leads	2010	-5.747697175063304	-20.25253116005259	1448830
1448815	Vision	development of cortical shape in the human brain from 6 to 24<ce:hsp sp=0.25></ce:hsp>months of age via a novel measure of shape complexity	2016	-4.054228338919679	-21.22247707792341	1448842
1449052	Vision	identification and characterisation of midbrain nuclei using optimised functional magnetic resonance imaging	2012	-6.416542799414351	-20.497627319792908	1449079
1449139	Robotics	modeling cell movement in anisotropic and heterogeneous network tissues	2007	-5.286698723397097	-22.779540115893248	1449166
1449202	ML	validation of a na + - ca ++ regulation model for high variations of the inner cell conditions	2001	-4.581612569165372	-22.875718196749677	1449229
1449687	ML	the model of glutamate-induced intracellular ca2+ oscillation and intercellular ca2+ wave in brain astrocytes	2004	-4.205421409335391	-19.727989255105147	1449714
