id	area	title	year	x	y	ix
3803382	NLP	research on expert search at enterprise track of trec 2005	2005	11.638377094100194	-14.307524594256913	3803409
3803839	Web+IR	exploring evidence aggregation methods and external expansion sources for medical record search	2012	11.60825808689755	-13.975122113670974	3803866
3805597	NLP	clef 2004: ad hoc track overview and results analysis	2004	11.895305596959519	-14.245048265376251	3805624
3808895	HCI	tuning topical queries through context vocabulary enrichment: a corpus-based approach	2008	11.418383826478909	-14.072947159128615	3808922
3809440	Web+IR	understanding the retrieval effectiveness of collaborative tags and author keywords in different retrieval environments: an experimental study on medical collections	2014	11.504466278922546	-13.867404789976515	3809467
3810446	Web+IR	answering natural language queries over linked data graphs: a distributional semantics approach	2013	12.089175176526435	-14.513699574489644	3810473
3816585	ML	medical documents processing for summary generation and keywords highlighting based on natural language processing and ontology graph descriptor approach	2017	12.060605898180631	-13.983132390634207	3816612
3817631	Web+IR	building a heterogeneous information retrieval collection of printed arabic documents	2006	11.437781114371033	-13.703263882828136	3817658
3819646	HCI	schnapper: a web toolkit for exploratory relation extraction	2015	11.439620039503989	-13.840542184300876	3819673
3822964	Web+IR	automatic building of new field association word candidates using search engine	2006	11.553342390216587	-13.93760217539199	3822991
3824524	SE	a comparison of local analysis, global analysis and ontology-based query expansion strategies for bio-medical literature search	2006	11.870289477006342	-14.482495833574855	3824551
3824910	Web+IR	design of new indexing techniques based on ontology for information retrieval systems	2010	11.654534513487794	-14.298031820399885	3824937
3827804	Web+IR	improving semantic search through entity-based document ranking	2015	11.394952316325588	-14.262050861214506	3827831
3828273	Web+IR	comparative evaluation of xml information retrieval systems, 5th international workshop of the initiative for the evaluation of xml retrieval, inex 2006, dagstuhl castle, germany, december 17-20, 2006, revised and selected papers	2007	11.827056411636805	-14.228181575235078	3828300
3831031	Web+IR	a model for ranking entities and its application to wikipedia	2008	11.144669803465565	-13.884839344261923	3831058
3832385	NLP	ocelot: a system for summarizing web pages	2000	11.503417075261302	-14.339184600418351	3832412
3833359	Web+IR	using bayesian network for conceptual indexing: application to medical document indexing with umls metathesaurus	2007	11.998789396251132	-14.498480969206744	3833386
3835229	Web+IR	exploring combinations of ontological features and keywords for text retrieval	2008	11.365760517901888	-14.160831381492224	3835256
3835831	AI	experiments with cited titles for automatic document indexing and similarity measure in a probabilistic context	1985	11.70508334770444	-14.253151616125125	3835858
3836886	NLP	finding co-occurring topics in wikipedia article segments	2014	11.434762969516951	-14.272100581783164	3836913
3837247	DB	dexter: large-scale discovery and extraction of product specifications on the web	2015	11.829554546167381	-14.129332734587667	3837274
3838701	Robotics	metadata extraction system for chinese books	2011	11.770574971475613	-14.121939381585197	3838728
3839144	DB	comparison of overlap detection techniques	2002	11.149081562447689	-14.0467221318425	3839171
3843039	Web+IR	structured document retrieval, multimedia retrieval, and entity ranking using pf/tijah	2007	11.300069444887304	-14.049700825479329	3843066
3843227	AI	knowledge representation learning: a quantitative review	2018	11.511255531215316	-14.465092393825508	3843254
3845723	Web+IR	indri at trec 2005: terabyte track	2005	11.517963462959804	-13.671242611853087	3845750
3846266	Web+IR	tianwang search engine at trec 2005: terabyte track	2005	12.06989202819364	-13.72419441021034	3846293
3847169	ML	semantic document classification and keyword spotting in digital repositories	2009	11.772711506424608	-13.989567298419892	3847196
3851264	NLP	mining nearness relations from an n-grams web corpus in geographical space	2016	11.987278835075937	-14.053794703429636	3851291
3852475	Web+IR	browsing search results via formal concept analysis: automatic selection of attributes	2004	11.359209317308753	-13.853756380711214	3852502
3853259	AI	gocsim: go context-driven similarity	2012	11.191618696468728	-14.45777026877114	3853286
3853727	ML	corder: community relation discovery by named entity recognition	2005	11.177644720228123	-14.349152108251385	3853754
3856994	NLP	few-exemplar information extraction for business documents	2014	11.848486934392355	-14.459180405223336	3857021
3857412	Web+IR	a hybrid cbr-ir approach to legal information retrieval	1995	11.334412520652197	-14.040258816891795	3857439
3860678	ML	citom: an incremental construction of multilingual topic maps	2012	11.934398706320302	-14.210403198562956	3860705
3860802	NLP	a replication study: understanding what drives the performance in wikimatch	2017	11.56537664218462	-14.056136758869982	3860829
3861488	Web+IR	overview of the topical classification task at ntcir-4 web	2004	11.374317368462211	-14.496940278775966	3861515
3861611	Web+IR	text categorization	2005	11.604608288382305	-14.334102171757937	3861638
3862059	AI	efficient wikipedia-based semantic interpreter by exploiting top-k processing	2010	11.34185127579116	-14.526041617457958	3862086
3863052	NLP	towards a framework design of a retrieval document system based on rhetorical structure theory and cue phrases	2003	11.503173757688346	-13.719966530838736	3863079
3865392	AI	bluefinder: recommending wikipedia links using dbpedia properties	2013	11.479945029286414	-14.010009689283152	3865419
3865617	ML	context sensitive search engine	2014	11.5389499327224	-14.545034597373911	3865644
3866757	NLP	lig at clef 2016 cultural microblog contextualization: timeline illustration based on microblogs	2016	11.579623172676268	-13.999662638498206	3866784
3867409	NLP	a semantic knowledge fusion method based on topic maps	2007	11.344281527817044	-14.286403993774838	3867436
3869169	Web+IR	emory university at trec liveqa 2016: combining crowdsourcing and learning-to-rank approaches for real-time complex question answering	2016	11.547932295567865	-14.371463744157774	3869196
3874659	Web+IR	an easter egg hunting approach to test collection building in dynamic domains	2016	12.086855355329284	-13.831414658877781	3874686
3876283	Vision	a web-based clir system with cross-lingual topical pseudo relevance feedback	2013	12.059980964950288	-14.174659915401966	3876310
3881392	SE	a chinese text classification approach based on semantic web	2008	11.76565303953779	-14.045200794428101	3881419
3881609	AI	image based gisting in clir	2004	11.788580240908393	-14.496285274025064	3881636
3882432	Web+IR	enriching taxonomies with functional domain knowledge	2018	11.687109079525321	-14.54295829257467	3882459
3885023	DB	mining term association rules for automatic global query expansion: methodology and preliminary results	2000	11.314258498038047	-14.07512342976794	3885050
3885720	SE	image/ video's automatic annotation considering semantics' tolerance relation	2008	11.499881863273073	-14.503557245504478	3885747
3888763	Web+IR	semantic query expansion for fuzzy proximity information retrieval model	2012	11.307737503998563	-14.118472677720511	3888790
3888907	AI	multi-search: a meta-search engine based on multiple ontologies	2010	11.600327425408258	-13.924830852818296	3888934
3889420	NLP	representing information need with semantic relations	1994	11.944768951312088	-14.258049787192867	3889447
3890342	Web+IR	semantic re-ranking in ad-hoc robust retrieval	2011	11.655556346582664	-14.495811068301848	3890369
3897552	NLP	hybridization of an index based on concept lattice with a terminology extraction model for semantic information retrieval guided by wordnet	2016	11.79554949729751	-14.366158246554642	3897579
3897804	AI	characterising emergent semantics in twitter lists	2012	11.842838328357413	-14.249268181270162	3897831
3900185	Web+IR	explicit query interpretation and diversification for context-driven concept search across ontologies	2016	11.619275902377336	-13.886629263285437	3900212
3900452	Web+IR	mias: math-aware retrieval in digital mathematical libraries	2018	12.04705233317234	-14.064092910347664	3900479
3900741	Web+IR	similarity of business process models: metrics and evaluation	2011	11.319082173691342	-14.489454769782226	3900768
3902647	NLP	experiments with interactive question-answering	2005	11.560635666891141	-14.076200541063859	3902674
3902664	Web+IR	geographic signatures for semantic retrieval	2010	12.033997166228414	-13.998154340236402	3902691
3902758	Web+IR	using structural representations of anomalous states of knowledge for choosing document retrieval strategies	1986	11.301765435460922	-13.833742401657164	3902785
3904672	Web+IR	integrating multiple document features in language models for expert finding	2009	11.824233809555759	-13.889563127414752	3904699
3906922	AI	beyond keyword and cue-phrase matching: a sentence-based abstraction technique for information extraction	2006	11.327738506106039	-13.918217655631187	3906949
3907891	Web+IR	snumedinfo at imageclef 2013: medical retrieval task	2013	12.08621552335716	-14.435196356244653	3907918
3910276	NLP	text summarization based on hanning window and dependency strucuture analysis	2001	11.496055031285227	-14.296946651100173	3910303
3913301	ML	a feasibility experiment on the application of predictive coding to instant messaging corpora	2017	11.268310632420327	-14.002909124829587	3913328
3915339	Web+IR	a comparison of interactive and ad-hoc relevance assessments	2007	11.738322739811435	-13.76687304906174	3915366
3916495	ML	ensm-se and ujm at inex 2010: scoring with proximity and tag weights	2010	11.402279512507533	-14.345322416997652	3916522
3918173	AI	mining for attributes and values in tables	2010	11.549485527422284	-13.643786987767127	3918200
3918856	Web+IR	question-answering by predictive annotation	2000	11.17102997282443	-14.302793743635249	3918883
3918877	Web+IR	fujitsu laboratories trec8 report - ad hoc, small web, and large web track.	1999	11.874372978105805	-14.019027338142404	3918904
3923765	DB	exploiting lists of names for named entity identification of financial institutions from unstructured documents	2016	11.436057939918015	-14.555992943169324	3923792
3924167	Web+IR	relevance odds of retrieval overlaps from seven search fields	1994	11.664337442586415	-14.17114539905436	3924194
3926970	ML	text mining from biomedical literature using term extraction and associations rule mining	2002	11.512144418984072	-14.525685418265414	3926997
3927561	Web+IR	web page retrieval by combining evidence	2005	11.292953586887545	-13.923862247953787	3927588
3928969	NLP	learning-to-rank and relevance feedback for literature appraisal in empirical medicine	2018	11.656173607512612	-14.305159410022654	3928996
3931019	Web+IR	mapping product descriptions to a large ontology	2005	11.564328111160885	-14.314914365287235	3931046
3931375	Web+IR	web-scale knowledge extraction from semi-structured tables	2010	11.683162209462699	-13.809370612525836	3931402
3933414	Web+IR	concept-based automatic amharic document categorization	2009	11.645374032991047	-14.490730512067685	3933441
3935903	Vision	pku at inex 2011 xml snippet track	2011	11.860306236083414	-13.905455856729507	3935930
3938248	DB	concept integration of document databases using different indexing languages	2006	11.172030589799583	-14.033401935558045	3938275
3938416	Web+IR	модель семантического поиска на базе тезауруса (the semantic search model based on the thesaurus)	2017	11.327481172444106	-13.909862657061035	3938443
3939103	Web+IR	geographic ir helped by structured geospatial knowledge resources	2006	11.965007318427505	-14.181860777885086	3939130
3939355	DB	building the concept semantic space for large text database	2015	11.363005370253909	-13.784975519274886	3939382
3943199	NLP	effectiveness of web page classification on finding list answers	2004	11.243607731136812	-14.105348740916483	3943226
3945038	NLP	ontology querying support in semantic annotation process	2012	11.199990613491767	-13.78257932656285	3945065
3945736	AI	wiicluster: a platform for wikipedia infobox generation	2014	11.82726761779896	-13.920175328090474	3945763
3948634	DB	exploring concept graphs for biomedical literature mining	2015	12.02841357972479	-14.183832430664012	3948661
3950780	Web+IR	using term-matching algorithms for the annotation of geo-services	2009	11.837364150026223	-14.207548437050592	3950807
3951932	ML	fastdocode: finding approximated segments of n-grams for document copy detection - lab report for pan at clef 2010	2010	11.414011768565766	-14.349878876548734	3951959
3952929	Web+IR	rmit @ trec 2016 dynamic domain track: exploiting passage representation for retrieval and relevance feedback	2016	11.534711777458279	-14.077360160635598	3952956
3953293	ML	hybrid.ai: a learning search engine for large-scale structured data	2018	11.173766452672348	-13.860696302661516	3953320
3953703	Web+IR	harvesting relational tables from lists on the web	2011	11.389949089849098	-14.056003545210473	3953730
3959114	NLP	efficiency/effectiveness trade-offs in query processing	1998	12.104079556700597	-14.035858508950096	3959141
3960692	Web+IR	the effect of structured queries and selective indexing on xml retrieval	2005	11.617655635225324	-13.965787430772696	3960719
3961029	Web+IR	a network model approach to retrieval in the semantic web	2008	11.858544786325538	-13.773679718249486	3961056
3961331	Web+IR	processing heterogeneous collections in xml information retrieval	2005	12.051931784289751	-13.938029152954883	3961358
3961343	ML	multidimensional text warehousing for automated text classification	2018	11.853625064027186	-14.131428958284598	3961370
3962101	Web+IR	on the history of evaluation in ir	2008	11.902111406744261	-13.659230166385644	3962128
3963916	Web+IR	opal: automated form understanding for the deep web	2012	11.549007049121888	-13.829268374534633	3963943
3968226	Robotics	a semantic coherence based intelligent search system	2013	11.58441134127311	-13.911200511787412	3968253
3972053	NLP	genre and domain processing in an information retrieval perspective	2003	11.507412543115974	-14.452145571682221	3972080
3976858	AI	semi-automatic terminology ontology learning based on topic modeling	2017	11.954032133773744	-13.94965740337363	3976885
3978055	Web+IR	ranking experts using author-document-topic graphs	2013	11.715485937626159	-13.73238642136634	3978082
3978169	SE	an automatic approach for duplicate bibliographic metadata identification using classification	2011	11.741929590850935	-13.730094680510554	3978196
3980490	Web+IR	dcu-tcd@logclef 2010: re-ranking document collections and query performance estimation	2010	11.958515292401508	-14.452084239635449	3980517
3982160	DB	a new hierarchical conceptual graph formalism adapted for chinese document retrieval	2007	11.872187305357645	-14.464652746356595	3982187
3983857	PL	ntcir-2 experiments using long gram based indices	2001	11.156057007644764	-14.324499747406955	3983884
3984711	Web+IR	information retrieval based upon latent class analysis	1962	12.011823639149394	-13.742600079170554	3984738
3987805	Web+IR	multiple sources of evidence for xml retrieval	2004	11.512260551076851	-13.768789150746839	3987832
3989127	AI	rdf snippets for semantic web search engines	2008	11.323394103713813	-13.860826283902625	3989154
3991310	Web+IR	ontology-based proximity search	2011	11.725161944105126	-14.412166762125207	3991337
3992868	Robotics	towards an automatic validation of answers in question answering	2007	11.648777516030204	-14.46300677070966	3992895
3993337	Web+IR	the combined use of bibliographic coupling and cocitation for document retrieval	1980	11.358084585943935	-13.705917347273596	3993364
3997904	SE	a hybrid method for retrieving medical documents with query expansion	2016	11.698668627711573	-13.897679749454634	3997931
4000089	Web+IR	an automatic email distribution by using text mining and reinforcement learning	2006	11.979266056282029	-13.76181094836682	4000116
4003755	AI	a clustering-based ontology matching technique using cognitive theory and concept importance	2016	11.298224229590463	-14.32635302086616	4003782
4004310	DB	construction of polysemy table and search engine based on inverted index	2012	11.450314484869823	-14.256867536161414	4004337
4004532	Vision	question-driven semantic filters for answer retrieval	2003	11.438869911656663	-14.480669684162814	4004559
4005396	NLP	presenting a new dataset for the timeline generation problem	2016	11.57963068194922	-14.071626576699016	4005423
4005658	Web+IR	information retrieval systems using an associative conceptual space	1999	11.330969486760353	-14.173259411665876	4005685
4005726	Vision	the architecture and algorithms of retrieval thesaurus on web	2008	11.904665564067384	-13.745438194797991	4005753
4009180	Vision	an ontology-based retrieval system using semantic indexing	2010	11.530101097632725	-13.697154968266812	4009207
4010921	Web+IR	improving vertical geo/geo disambiguation by increasing geographical feature weights of places	2012	12.09438721333635	-14.076105948251586	4010948
4013504	Web+IR	word indexing versus conceptual indexing in medical image retrieval.	2012	11.66257838268938	-14.441913787404578	4013531
4013570	DB	a block segmentation based approach for web information extraction	2010	11.842128205441774	-14.076416925629909	4013597
4013884	NLP	exploration of a text collection and identification of topics by clustering	2007	11.231194148639961	-13.846960887361902	4013911
4014885	NLP	answer summarization via term hierarchical structure	2010	11.210480497144797	-14.106576647170687	4014912
4014937	Web+IR	university of texas rio grande valley trec liveqa 2016: using topic modeling to answer complex questions	2016	11.91742420614196	-14.186919818600234	4014964
4015957	DB	towards extracting semantic information from texts	2011	11.641295245249056	-13.852915767420551	4015984
4019143	HCI	the design and completion of jiangsu tourism q&a system	2013	12.095174727855218	-14.33160615803754	4019170
4019962	NLP	ictnet at web track 2009 ad-hoc task	2009	12.003616172484618	-13.909246765637329	4019989
4020441	AI	forpm: boosting users' effect on ontology matching	2006	11.84921434727059	-14.484726263258569	4020468
4020601	Web+IR	managing content with automatic document classification	2004	11.75061190167751	-13.64678058165151	4020628
4027349	DB	when speed has a price: fast information extraction using approximate algorithms	2013	11.363356274286993	-13.896057657995815	4027376
4030505	Web+IR	the pareto principle is everywhere: finding informative sentences for opinion summarization through leader detection	2015	11.901176624559314	-14.150171469175316	4030532
4030707	Web+IR	rmit university at trec 2005: terabyte and robust track.	2005	11.800934915714807	-13.998433266415697	4030734
4031408	NLP	eequest: an event extraction and query system	2016	11.972551889542133	-14.08569813905349	4031435
4033853	Web+IR	column-specific context extraction for web tables	2015	11.21896975955749	-14.038281999550849	4033880
4034091	Web+IR	document structure analysis for the ntcir-5 patent retrieval task	2005	11.467807353875434	-14.469581984443865	4034118
4035144	Web+IR	query expansion using prf-cbd approach for documents retrieval	2013	11.289455470846965	-14.462314740246693	4035171
4038360	NLP	knowledge extraction in web media: at the frontier of nlp, machine learning and semantics	2016	11.53643459398905	-14.554043221980226	4038387
4039502	Web+IR	personal name matching: new test collections and a social network based approach.	2006	11.257962483831381	-14.251031971085279	4039529
4039542	NLP	where to stop reading a ranked list	2008	11.526734082028375	-14.046881737864188	4039569
4039549	Vision	canfind-a semantic image indexing and retrieval system	2003	11.313337033214914	-13.803462044768985	4039576
4040963	EDA	computer-aided summarisation - what the user really wants	2006	11.737492878625154	-14.102216992568328	4040990
4041345	Web+IR	query-based multidocument summarization for information retrieval	2004	11.723598810305262	-14.204718167855404	4041372
4041467	Web+IR	psm: a new re-ranking algorithm for named-page	2006	11.587850999580974	-13.877857985042846	4041494
4044247	NLP	entitytagger: automatically tagging entities with descriptive phrases	2011	11.662822535853545	-13.84753515360601	4044274
4044376	Logic	automatic identification of relations in quebec heritage data	2018	11.89313347713438	-14.44740559271297	4044403
4046025	Web+IR	the blogvox opinion retrieval system	2006	11.816023414266525	-14.051565846668911	4046052
4046454	Web+IR	oracle at trec 10: filtering and question-answering	2001	12.076533889423516	-14.407213568173015	4046481
4048125	DB	accessing deep web using automatic query translation technique	2008	11.901284443342693	-13.682226964777362	4048152
4048268	Web+IR	judging the spatial relevance of documents for gir	2006	11.54841630849338	-13.736886813512678	4048295
4049450	NLP	extracting descriptions of location relations from implicit textual networks	2017	11.9670945450036	-14.367212965035153	4049477
4050270	NLP	dublin city university at trecvid 2008	2008	11.448758367977087	-14.333152646550827	4050297
4050629	ML	automatic hypertext construction through a text mining approach by self-organizing maps	2001	11.25261050296129	-13.95351141386701	4050656
4057576	DB	web-scale extraction of structured data	2008	12.070246509986939	-14.012844091259005	4057603
4058374	NLP	spelling correction for search engine queries	2004	11.635378547226953	-13.642049613101952	4058401
4060259	Web+IR	report on the clef-ip 2011 experiments: exploring patent summarization	2011	11.967418739687488	-14.037867514234744	4060286
4061789	Web+IR	an approach to clustering abstracts	2005	12.051520141834388	-13.949522504841044	4061816
4063929	NLP	seeking for high level lexical association in texts	2013	11.2029267958111	-14.210910196958034	4063956
4063953	AI	on the reading of tables of contents	2008	11.488687896447773	-14.068099679361206	4063980
4066745	Web+IR	an association thesaurus for information retrieval	1994	11.946215705641013	-14.437669099911757	4066772
4071720	Web+IR	improved chaid algorithm for document structure modelling	2010	11.408471392579534	-14.058661672898236	4071747
4073131	Web+IR	iris at trec-8	1999	11.173323434411616	-13.825738487728016	4073158
4073919	Comp.	on the use of similarity search to detect fake scientific papers	2015	11.934179291494901	-13.950192124217367	4073946
4075756	NLP	bridging inference based sentence linking model for semantic coherence	2016	12.087310603665713	-13.82698237967943	4075783
4075830	Web+IR	on a model of distributed information retrieval systems based on thesauri	1984	11.262710804264472	-13.758308089399483	4075857
4077572	Web+IR	complex interactive question answering enhanced with wikipedia	2007	12.074795566513107	-13.923653518804185	4077599
4077788	Web+IR	leveraging interlingual classification to improve web search	2012	11.309889453209585	-14.098848772624912	4077815
4078438	Comp.	condensing biomedical journal texts through paragraph ranking	2011	11.865328331324141	-13.86828635320358	4078465
4080122	Web+IR	entity centric information retrieval	2016	11.416614009157374	-13.778309817242777	4080149
4082665	DB	acquisition of noncontiguous class attributes from web search queries	2014	11.671378631469748	-13.842259667113064	4082692
4082733	Web+IR	precision weighting - an effective automatic indexing method	1976	11.667222979618215	-14.051962474876952	4082760
4085311	DB	harvesting relational tables from lists on the web	2009	11.367792391924288	-14.018374935369632	4085338
4085602	AI	size matters: word count as a measure of quality on wikipedia	2008	11.437488374412187	-14.311803909151935	4085629
4085741	DB	facto: a fact lookup engine based on web tables	2011	11.855473394572515	-13.859841533101127	4085768
4088555	Robotics	a new extraction concept based on contextual clustering	2006	12.079905979661698	-14.080674450734007	4088582
4089473	NLP	intellix -- end-user trained information extraction for document archiving	2013	12.011450108302135	-14.395056813224564	4089500
4089747	Web+IR	a universal model for xml information retrieval	2004	11.433623672337994	-14.036449694040716	4089774
4090410	Web+IR	query based summary for assessing document relevance	2006	11.318489516200449	-13.842394456107586	4090437
4094804	Web+IR	profiling the potential of web tables for augmenting cross-domain knowledge bases	2016	11.514091745389953	-13.903389853086331	4094831
4096412	Web+IR	improving search engine retrieval using a compound splitter for swedish	2005	12.052409805756593	-14.027870914793086	4096439
4097693	Web+IR	document clustering of scientific texts using citation contexts	2009	11.708163814155618	-13.830520761288025	4097720
4097770	Web+IR	semantic document clustering on named entity features	2018	11.278831905567188	-14.058067131521357	4097797
4099003	Web+IR	using two-stage concept-based singular value decomposition technique as a query expansion strategy	2007	11.989618448479398	-14.270610612930454	4099030
4100690	Web+IR	hybrid acquisition of temporal scopes for rdf data	2014	12.047964687113526	-14.524062660425818	4100717
