id	area	title	year	x	y	ix
3222126	Web+IR	enhancing keyword search with a keyphrase index	2008	11.244163870041788	-13.785067990958176	3222153
3222820	Web+IR	a text mining approach on automatic generation of web directories and hierarchies	2003	11.99905994494374	-13.77459646851438	3222847
3223976	Web+IR	patent query formulation by synthesizing multiple sources of relevance evidence	2014	11.227070994795039	-14.381370370598415	3224003
3224845	Web+IR	bringing order to digital libraries: from keyphrase extraction to index term assignment	2013	11.584756307015374	-14.194276119677449	3224872
3225878	AI	grammatical evolution for identifying wikipedia taxonomies	2015	11.992937422096063	-13.849903834216494	3225905
3226905	NLP	evaluation of a video annotation tool based on the lscom ontology	2006	11.295918746862755	-13.813756795415244	3226932
3228257	Web+IR	math expression retrieval using an inverted index over symbol pairs	2015	11.372611596401114	-14.328724873091755	3228284
3231269	Web+IR	term extraction for user profiling: evaluation by the user	2013	11.218592195516047	-13.960684001614142	3231296
3232042	Web+IR	patterns of semantic relations to improve image content search	2007	11.231000339285774	-13.702732188511488	3232069
3235974	NLP	correlation distance based information extraction system at fire 2016 microblog track	2016	11.572613648225605	-13.999429854908955	3236001
3236289	Web+IR	challenges for indexing in gir	2011	11.942302236639705	-13.95823176148069	3236316
3236849	Web+IR	formal language models for finding groups of experts	2016	11.21482856306586	-14.35330852825034	3236876
3239205	Web+IR	structured data-based q&a system using surface patterns	2011	11.854657651315488	-13.691083295797313	3239232
3241644	DB	efs: expert finding system based on wikipedia link pattern analysis	2008	11.225759625778153	-13.711924734854875	3241671
3242609	AI	a genetic programming approach for learning semantic information extraction rules from news	2014	11.712062232559116	-14.28122341192731	3242636
3244820	DB	combining strategies for extracting relations from text collections	2000	11.366051444686846	-13.824652375000394	3244847
3245821	HCI	metacarta at geoclef 2005	2005	11.872933265818393	-14.076439072734676	3245848
3247404	NLP	reconstruction of itineraries from annotated text with an informed spanning tree algorithm	2016	11.995438988323778	-14.06674828126372	3247431
3248400	Web+IR	a method study of online publication time extraction for chinese web news	2017	11.153526113200568	-14.246354509687126	3248427
3248736	DB	thesaurus performance with information retrieval: schema matching as a case study	2013	11.58955907956682	-14.150504078456668	3248763
3249315	Visualization	a visual analytics approach to author name disambiguation	2016	12.043440958163547	-14.199699146039213	3249342
3253132	DB	exploiting wikipedia in query understanding systems	2010	11.964206014551964	-14.457545361571114	3253159
3253679	NLP	disambiguating author names using automatic relevance feedback	2011	11.185097714255617	-14.153183545487833	3253706
3257161	Web+IR	a case study in web search using trec algorithms	2001	11.53267038920512	-13.77413604751635	3257188
3257528	Web+IR	novel results and some answers - the university of iowa trec 11 results	2002	11.278962728278973	-14.23555680781416	3257555
3257760	NLP	trec 2007 ciqa task: university of maryland	2007	11.95735130914659	-14.357719910414904	3257787
3260832	Web+IR	linguistic model propositions for poetry retrieval in web search	2012	11.39609314839178	-14.395131759463872	3260859
3261001	ML	learning to rank experts using combination of multiple features of expertise	2014	11.518273878677654	-13.93234728565273	3261028
3261541	Web+IR	segmentation of on-line job advertisements.	2001	11.213110645434663	-14.113583488279453	3261568
3261968	Web+IR	two hierarchical text categorization approaches for bioasq semantic indexing challenge.	2013	11.300154410072818	-13.930624168581955	3261995
3264868	AI	learning constraints in spreadsheets and tabular data	2017	11.502795292556968	-14.162784258914053	3264895
3265215	Vision	laberinto at imageclef 2011 medical image retrieval task	2011	11.63868241632285	-14.213480540599505	3265242
3265867	DB	multi-source automatic annotation for deep web	2008	11.325449022508405	-13.6974611430345	3265894
3266171	DB	entity suggestion by example using a conceptual taxonomy	2015	11.206414490094296	-14.143690802893682	3266198
3271349	Web+IR	prior art retrieval using various patent document fields contents	2010	11.238798426196315	-13.779737541995154	3271376
3272188	NLP	kdd cup 2013: author disambiguation	2013	11.915288558005292	-14.34901488623577	3272215
3273457	Crypto	xml retrieval more efficient using double scoring scheme	2010	11.544729133140875	-14.334020013257177	3273484
3273701	NLP	improvement of terminology extraction method for specific patent search	2014	11.926858361962072	-14.489379185588454	3273728
3275569	NLP	statistical analysis of web documents: a proposal and a case study	2001	11.519926661693892	-13.89626935202154	3275596
3277083	NLP	the domain-specific track in clef 2004: overview of the results and remarks on the assessment process	2004	11.974038503255553	-14.271203873550927	3277110
3281911	Comp.	experiments in automatic library of congress classification	1992	12.080494387601789	-14.414655892851703	3281938
3282601	Web+IR	bit and purdue at trec-kba-ccr track 2014	2014	11.331872287098331	-14.464144052511813	3282628
3283135	Web+IR	query expansion through geographical feature types	2007	11.821343150308811	-13.854978686928012	3283162
3285062	Web+IR	end-to-end neural ranking for ecommerce product search: an application of task models and textual embeddings	2018	11.899956096056213	-13.942302417372307	3285089
3285902	NLP	towards a semantic linked data retrieval model	2014	11.78068058761524	-14.569131809678854	3285929
3286004	Web+IR	automatic classification and relationship extraction for multi-lingual and multi-granular events from wikipedia	2012	12.026742129033055	-14.15607841437016	3286031
3287481	Web+IR	mining acronym expansions and their meanings using query click log	2013	11.15148367094265	-14.002657896650074	3287508
3289916	Vision	evaluating the concept specialization distance from an end-user perspective: the case of agrovoc	2017	11.92777803961819	-14.455987071958685	3289943
3292607	Web+IR	advances in xml information retrieval and evaluation : 4th international workshop of the initiative for the evaluation of xml retrieval, inex 2005, dagstuhl castle, germany, november 28-30, 2005 : revised selected papers	2006	11.855121968248687	-14.067993323848587	3292634
3296931	Web+IR	combining text and formula queries in math information retrieval: evaluation of query results merging strategies	2015	11.23627281633068	-13.871511298061463	3296958
3297811	NLP	betterrelations: using a game to rate linked data triples	2011	11.328385910552598	-14.482724666695134	3297838
3300187	NLP	learning from message pairs for automatic email answering	2004	11.300926181977847	-13.761814165640242	3300214
3302784	Web+IR	construction of navigation map to retrieve semantically information from medical resources	2016	11.651237169232084	-13.93074413548913	3302811
3305453	AI	towards better understanding and utilizing relations in dbpedia	2012	11.372218748086235	-14.076238506984145	3305480
3307169	Web+IR	experiments with semantic-flavored query reformulation of geo-temporal queries	2010	11.670955187150819	-13.656710514200508	3307196
3307458	Web+IR	liberal relevance criteria of trec -: counting on negligible documents?	2002	11.195470365930973	-13.779499865498554	3307485
3308359	Web+IR	a knowledge-driven approach to biomedical document conceptualization	2010	12.09960876355889	-14.526876079278352	3308386
3308465	Web+IR	exploring probabilistic toponym resolution for geographical information retrieval	2006	11.684858217767331	-14.122482263594765	3308492
3312523	ML	the exploration of legal text corpora with hierarchical neural networks: a guided tour in public international law	1997	11.64560252665231	-13.769544794164775	3312550
3315919	Web+IR	visual document analysis: towards a semantic analysis of large document collections	2010	12.015281638372473	-13.98201609145034	3315946
3317355	ML	pattern mining with natural language processing: an exploratory approach	2009	11.903266978974738	-14.250742948252261	3317382
3317563	Vision	classification of documents by form and content	1997	12.029230429449248	-14.475087063735128	3317590
3319958	NLP	using a relevance propagation method for adhoc and heterogeneous tracks at inex 2004	2004	11.753880258940775	-13.888073703204913	3319985
3320197	Web+IR	dbpedia spotlight: shedding light on the web of documents	2011	12.055205216418265	-14.374633512374515	3320224
3320733	Web+IR	performance testing of a book and its index as an information retrieval system	1980	11.564209767702522	-14.128510671862411	3320760
3323250	HCI	integrated retrieval over structured and unstructured data	2012	12.065453238466096	-13.735674154945071	3323277
3323838	DB	automatic text decomposition and structuring	1994	11.498521726621306	-13.684175613248339	3323865
3324086	Web+IR	temporal information indexing model	2008	11.48403925855487	-14.228790314280277	3324113
3327137	DB	expanded semantic graph representation for matching related information of interest across free text documents	2012	11.676198580205819	-13.708767989771085	3327164
3327742	Web+IR	webis at trec 2013-session and web track	2013	11.5193912907705	-14.145692196549208	3327769
3331505	Web+IR	auto-grouping emails for faster e-discovery	2011	11.430284865605804	-13.979402658893086	3331532
3334650	Web+IR	geographic information retrieval involving temporal components	2010	11.866511564669207	-13.85705435946685	3334677
3334829	Web+IR	the university of amsterdam at trec 2010: session, entity, and relevance feedback	2010	11.839569480976305	-14.556244240143359	3334856
3335129	DB	enabling information extraction by inference of regular expressions from sample entities	2011	12.035157138464465	-14.477826498447303	3335156
3336015	Web+IR	bridging the gap - using external knowledge bases for context-aware document retrieval	2013	11.876169917044072	-14.364918167675507	3336042
3336058	Web+IR	www search engine for slovenian and english medical documents	1999	11.661110398612989	-14.08690819376436	3336085
3336753	Web+IR	knowledge retrieval for scientific literatures	2012	11.951608075234974	-13.991290644483076	3336780
3337027	AI	on the marriage of information retrieval and information extraction	1997	11.375158380833444	-14.090197959780502	3337054
3337567	SE	using structured queries for source code search	2014	11.678152493971627	-13.668124747106626	3337594
3338337	DB	unsupervised event exploration from social text streams	2017	11.169038666235595	-14.152856043672564	3338364
3339653	Web+IR	automatic profiling system for ranking candidates answers in human resources	2008	11.799898079624171	-14.546580969161147	3339680
3340114	Web+IR	thuir at ntcir-9 intent task	2011	11.144705259522633	-14.162862393852079	3340141
3341290	AI	irit at trec knowledge base acceleration 2013: cumulative citation recommendation task	2013	11.653970493939346	-14.198625422653034	3341317
3342501	NLP	relational model based annotation of the web data	2007	11.186006077747312	-13.703808936022927	3342528
3346675	DB	an unsupervised technical readability ranking model by building a conceptual terrain in lsi	2012	12.008121412709592	-13.802218738319715	3346702
3348159	Web+IR	comparing and benchmarking semantic measures using smcomp	2016	11.603552540100385	-13.961413081302393	3348186
3349304	Vision	mufin at imageclef 2011: success or failure?	2011	12.070177011023109	-14.447020160807188	3349331
3349947	Web+IR	traces through time: a case-study of applying statistical methods to refine algorithms for linking biographical data	2015	12.004536344174864	-14.062712118302894	3349974
3351475	NLP	learning to refine text based recommendations	2016	11.356406909192627	-14.247443605332288	3351502
3352841	ML	lia@replab 2014	2014	12.087492156410141	-14.223333946455035	3352868
3352936	OS	on fuzzy extensions to energy ontologies for text processing applications	2014	11.794533850839276	-14.02942169711126	3352963
3353848	Web+IR	query by analogical example: relational search using web search engine indices	2009	11.153848107827821	-13.711224447840307	3353875
3354586	Web+IR	cwi at inex 2002	2002	11.710761811129935	-14.041935595487454	3354613
3356994	Web+IR	extending an information retrieval system through time event extraction	2014	12.080135347942694	-13.780849427299286	3357021
3357457	DB	extracting biomedical concepts from fulltext by relative importance in a graph model	2011	11.911824358399324	-14.236046115576658	3357484
3358561	Web+IR	extending semantic similarity measurement with thematic roles	2005	11.82527636327754	-14.577518749028721	3358588
3359326	DB	geotagging with local lexicons to build indexes for textually-specified spatial data	2010	11.92766805606805	-13.677860261767053	3359353
3364538	Web+IR	relationships in structured text retrieval	2009	11.816846751420647	-14.301675820675333	3364565
3367672	DB	augmenting a characterization network with semantic information	1997	11.419756305350818	-14.55055561105235	3367699
3367871	Web+IR	qcri @ trec 2011: microblog track	2011	11.871583630232749	-14.132010274373028	3367898
3369568	NLP	embedding individual table columns for resilient sql chatbots	2018	11.458196723621642	-14.396067171799256	3369595
3374700	AI	using web-content for retrieving snippets	2007	11.594579459983494	-14.235314750583214	3374727
3375922	DB	evaluation of access methods to text documents in office systems	1984	11.278090026896214	-13.68373910745458	3375949
3376677	Web+IR	automatic construction of networks of concepts characterizing document databases	1992	11.2572061242116	-13.846092424239266	3376704
3379379	DB	compound document processing system	1991	11.968505271506206	-13.823274309346829	3379406
3380366	Web+IR	query and document models for enterprise search	2007	11.369300700628807	-13.929533810165127	3380393
3383371	Web+IR	experiments with geo-temporal expressions filtering and query expansion at document and phrase context resolution	2010	11.490894072486405	-14.1041456952398	3383398
3383543	DB	a concept-based information retrieval approach for engineering domain-specific technical documents	2012	11.511126864951734	-14.391025223387025	3383570
3387998	DB	rule management for information extraction from title pages of academic papers	2014	11.774627203863744	-14.111584004484724	3388025
3389388	Web+IR	hltcoe at trec 2014: microblog and clinical decision support	2014	11.59240407657976	-14.499053315264893	3389415
3394917	DB	interactive dynamic information extraction	2008	11.281629894419376	-13.889613218724518	3394944
3395767	Web+IR	combining fields for query expansion and adaptive query expansion	2007	11.321796756907544	-14.118744469040784	3395794
3399117	Web+IR	swoogle: a search and metadata engine for the semantic web	2004	11.347267455944953	-13.67707094277016	3399144
3399142	Web+IR	widit in trec 2005 hard, robust, and spam tracks	2005	11.789634198807207	-13.997139326236491	3399169
3400247	Web+IR	language models for xml element retrieval	2009	11.229612694180119	-14.014023329883678	3400274
3400468	EDA	ontology augmentation via attribute extraction from multiple types of sources	2015	11.963731493103671	-13.66293587007802	3400495
3403582	NLP	a useful method for producing competitive ad hoc task results	2010	11.803859622839234	-14.332270018182877	3403609
3406430	NLP	an approach for combining ontology learning and semantic tagging in the ontology development process: egovernment use case	2007	11.995224567333805	-13.903275969609792	3406457
3407407	Web+IR	white page construction from web pages for finding people on the internet	1998	11.675795053966091	-14.046395946753702	3407434
3407927	Web+IR	anu/acsys trec-5 experiments	1996	11.844243867957141	-14.255409970029092	3407954
3408108	DB	automatic condensation of electronic publications by sentence selection	1995	11.679087401178371	-13.952880545652548	3408135
3411756	AI	deepdive: web-scale knowledge-base construction using statistical learning and inference	2012	11.512211396097676	-14.474373827796596	3411783
3413549	Web+IR	experimental evaluation of passage-based document retrieval	2001	11.369052843335213	-14.361917063408079	3413576
3414031	NLP	semantic disambiguation in a social information discovery system	2015	11.511703958234275	-14.275646322815154	3414058
3415278	AI	an efficient method to measure the semantic similarity of ontologies	2010	11.7555393671136	-13.95683015559392	3415305
3415982	Web+IR	a semantic search framework for document retrievals (literature, art and history) based on thesaurus multiwordnet like	2011	12.049343086506104	-13.825328491891858	3416009
3419788	Web+IR	hierarchical fca-based conceptual model of text documents used in information retrieval system	2011	11.221923900534243	-13.698787707432931	3419815
3420699	Web+IR	entity name extraction from faculty directories	2018	11.703871111739115	-14.058954438398375	3420726
3421293	DB	naga: searching and ranking knowledge	2008	11.807687131252038	-14.015173270329704	3421320
3424105	Web+IR	the university of illinois' graduate school of library and information science at trec 2014	2011	12.048351239871677	-14.206607732959116	3424132
3425130	NLP	mining semantic relationships between concepts across documents incorporating wikipedia knowledge	2013	11.330379557281525	-14.5712026340983	3425157
3425367	NLP	straight to the point: discovering themes for summary generation	2003	11.14836175644309	-14.51317836502134	3425394
3426778	DB	publish-time data integration for open data platforms	2013	12.034332546161494	-14.232643377902631	3426805
3430218	AI	the adaptability of english based web search algorithms to chinese search engines	2006	11.668840778463476	-14.176148428529014	3430245
3430687	AI	crew: cross-modal resource searching by exploiting wikipedia	2010	11.891482990382357	-13.761264826738735	3430714
3433571	Web+IR	semantic search via xml fragments: a high-precision approach to ir	2006	11.808332163476287	-14.462758033979581	3433598
3434259	NLP	cognitive semiotic model for query expansion in question answering	2014	11.17997037166357	-13.882808714147105	3434286
3435832	NLP	acquiring ontological knowledge from query logs	2007	11.890431465019107	-14.589968302306314	3435859
3437825	Web+IR	combined structure-weight graph similarity and its application in e-health	2013	11.304633447080722	-13.688383620635353	3437852
3440475	Web+IR	(1+1)-evolutionary gradient strategy to evolve global term weights in information retrieval	2016	11.586169761634887	-14.425371343329706	3440502
3440756	Web+IR	a figure search engine architecture for a chemistry digital library	2013	12.048791213147831	-14.249820178270586	3440783
3443216	Web+IR	event digest: a holistic view on past events	2016	11.241470014605822	-14.100330100753741	3443243
3443875	Web+IR	text mining for indexing	2009	12.066966872512676	-14.243456570861394	3443902
3446301	NLP	summarizing multi-party argumentative conversations in reader comment on news	2016	11.515422070893226	-13.716484737327185	3446328
3446725	Theory	retrieval parameters in growing data bases	1972	11.542943744723544	-13.957979142657587	3446752
3447391	Web+IR	automatic topic ontology construction using semantic relations from wordnet and wikipedia	2013	11.951548890507267	-13.979500285332058	3447418
3448363	ML	opinion mining from noisy text data	2008	11.809630987824105	-13.992453175653038	3448390
3450047	Web+IR	relevance judgments between trec and non-trec assessors	2008	11.29043029319863	-13.85162780165996	3450074
3450457	Vision	experiments with clustering the collection at imageclef 2007	2007	11.663210165924628	-14.064217543765688	3450484
3450493	Web+IR	incorporating ad hoc phrases in lsi queries	2014	11.299809079555875	-13.81156424243138	3450520
3450771	Web+IR	multilingual keyword extraction for term suggestion	1998	11.319763762927535	-13.737208745615856	3450798
3451011	Web+IR	object-fuzzy concept network: an enrichment of ontologies in semantic information retrieval	2008	11.420849690010787	-14.084447417519884	3451038
3451122	ML	an effective relevance prediction algorithm based on hierarchical taxonomy for focused crawling	2008	11.152330681323123	-14.113869154769821	3451149
3452902	NLP	automatic summarization focusing on document genre and text structure	2005	11.300011495362847	-13.678891660475486	3452929
3459012	DB	expertseer: a keyphrase based expert recommender for digital libraries	2015	12.06157501431715	-14.051504414713664	3459039
3459274	Web+IR	using and detecting links in wikipedia	2007	11.561283448441436	-14.061242453761167	3459301
3460183	Web+IR	eprum metrics and inex 2005	2005	11.563156533842587	-14.124383939873136	3460210
3461338	NLP	incremental text structuring with online hierarchical ranking	2007	11.540742144764408	-14.28593905527756	3461365
3462744	Web+IR	the congruity between linkage-based factors and content-based clusters - an experimental study using multiple document corpora	2016	11.450593841885413	-13.726224138326035	3462771
3464272	DB	instance matching benchmark for spatial data: a challenge proposal to oaei	2016	11.985105370615466	-14.312671727589882	3464299
3467109	Web+IR	on ranking relevant entities in heterogeneous networks using a language-based model	2013	11.668873644897163	-14.291585415522068	3467136
3468340	Web+IR	ontology based query expansion using word sense disambiguation	2010	11.22161723019177	-13.700117804813885	3468367
3469930	Web+IR	trec chemical ir track 2009: a distributed dimensional indexing model for chemical patent search	2009	12.0721494610528	-14.17180960730026	3469957
3472119	ML	extracting entity-specific substructures for rdf graph embedding	2018	11.626711029158525	-14.380469402572933	3472146
3474964	Web+IR	personalized semantic based blog retrieval	2012	11.434275008254144	-14.368532267477296	3474991
3476743	NLP	co-author network analysis in dblp: classifying personal names	2008	11.821370707555714	-13.763276628777824	3476770
3481776	AI	leveraging distributed human computation and consensus partition for entity coreference	2014	11.167782583060694	-13.732723088467438	3481803
3483144	NLP	analysis of source identified text corpora: exploring the statistics of the reused text and authorship	2003	11.966985902389036	-13.89048973481912	3483171
3485506	ML	information extraction and classification from free text using a neural approach	2007	11.450924303326223	-14.063510928476116	3485533
3486023	Web+IR	exploiting semantic association to answer 'vague queries'	2006	11.544612850877723	-13.998109393183784	3486050
3489487	AI	review of intelligent microblog short text processing	2016	11.634448454124485	-13.73891306306911	3489514
3489586	SE	evaluating the use of project glossaries in automated trace retrieval	2008	12.031707700088965	-14.284764212700914	3489613
3490929	Web+IR	agdistis - agnostic disambiguation of named entities using linked open data	2014	11.827911418011976	-14.426393458417705	3490956
3493112	Web+IR	methods for precise named entity matching in digital collections	2003	12.018930309710662	-13.812444697897178	3493139
3495967	Vision	pattern-based image retrieval with constraints and preferences on imageclef 2004	2004	11.998068160012245	-14.382684614136545	3495994
3497264	EDA	a simple relevancy-ranking strategy for an interface to boolean opacs	2004	11.609267346065234	-14.0940162292638	3497291
3498012	Web+IR	an expert experience probabilistic model for enterprise expert finding	2007	11.168877601013394	-14.598406914417872	3498039
3499111	Web+IR	content-oriented xml retrieval with hyrex	2002	11.503642348657632	-13.679477615744975	3499138
3503160	AI	sinai at imagephoto 2009	2009	12.04090423279779	-14.386436359013883	3503187
3504511	Web+IR	semantic graph based pseudo relevance feedback for biomedical information retrieval	2016	11.219961633173435	-14.412997330475886	3504538
3506127	Web+IR	using document dimensions for enhanced information retrieval	2004	11.621722009019717	-14.497700193727946	3506154
3506402	NLP	unsupervised auto-tagging for learning object enrichment	2011	11.813982173671048	-13.772700487922016	3506429
3508090	Web+IR	nudtmdp at trec 2015 liveqa track	2015	11.97443583877152	-14.09641316715958	3508117
3508266	Web+IR	passage-based query refinement (multitext experiments for trec-6)	2000	11.565654136977663	-13.669985464853964	3508293
3509489	NLP	overview of the trec 2005 question answering track.	2005	11.52982944801356	-14.292760802169152	3509516
3509709	NLP	discovering taxonomies in wikipedia by means of grammatical evolution	2018	11.80856086945465	-13.840700465125598	3509736
3512230	AI	research of intelligent professional search engine based on agent	2018	11.280536490260914	-13.703667986975304	3512257
3513649	DB	expressing conceptual graph queries from patterns: how to take into account the relations	2011	11.626105753842412	-14.272262688992527	3513676
3514662	DB	negligence of phrase indexing in search engines	2009	11.763889479856319	-13.77659988667352	3514689
3514816	Vision	from web tables to concepts: a semantic normalization approach	2015	11.302944776700487	-13.646772064064768	3514843
3515910	NLP	text and citations based cluster analysis of legal judgments	2015	11.3560357483288	-13.810791614070627	3515937
3516896	NLP	automatic classification of book material represented by back‐of‐the‐book index	1985	11.699344219105074	-13.746578519864672	3516923
3517057	DB	an approach to the automatic construction of global thesauri	1990	11.989604362767418	-14.354623541721786	3517084
3517780	Web+IR	a cluster-based plagiarism detection method - lab report for pan at clef 2010	2010	12.03843028721825	-14.289665341946256	3517807
