id	area	title	year	x	y	ix
3517957	HCI	a visual analytics approach to finding factors improving automatic speaker identifications	2015	11.54487641988758	-14.180057299944426	3517984
3518846	Web+IR	method verb recommendation using association rule mining in a set of existing projects	2015	11.281666857594814	-14.178013440068192	3518873
3519631	Web+IR	stringsauto and mapsss results for oaei 2013	2013	11.730123838241242	-14.392713101051935	3519658
3523323	ML	automatic creation of mappings between classification systems for bibliographic data	2016	11.575700046438627	-14.231601504640276	3523350
3523799	Web+IR	knowledge acquisition from documents with both fixed and free formats	2003	11.782077344735349	-13.964686540901265	3523826
3524457	AI	using acm dl paper metadata as an auxiliary source for building educational collections	2014	11.772611577594235	-14.134654996575158	3524484
3524954	AI	scaling up high-value retrieval to medium-volume data	2010	11.27573549997266	-14.025352286197881	3524981
3527310	NLP	test collections for patent-to-patent retrieval and patent map generation in ntcir-4 workshop	2004	11.861288236089678	-14.067370563453098	3527337
3528291	Web+IR	explorative multilingual text retrieval based on fuzzy multilingual keyword classification	2000	11.797287189667854	-14.457276733659096	3528318
3529013	Web+IR	the essence of knowledge (bases) through entity rankings	2013	11.824214549732574	-14.422460870912484	3529040
3531099	Robotics	an execution mechanism for natural language tasks based on auxiliary decision database	2017	11.483420331004414	-13.895886992881177	3531126
3533813	NLP	usaar-chronos: crawling the web for temporal annotations	2015	11.412512815792766	-14.243171412521582	3533840
3536972	Web+IR	sirius xml ir system at inex 2006: approximate matching of structure and textual content	2006	12.01509140376672	-14.038893820332687	3536999
3537045	ML	mining the web for acronyms using the duality of patterns and relations	1999	11.490354633504085	-13.651676178376093	3537072
3537528	DB	automating the assignment of submitted manuscripts to reviewers	1992	11.735389252881275	-13.9059736422184	3537555
3538116	Web+IR	modeling document features for expert finding	2008	11.888728717671572	-13.764499953554386	3538143
3538991	Web+IR	sources of evidence for automatic indexing of political texts	2015	11.632925709945658	-14.059897073579915	3539018
3539017	Web+IR	searching and filtering tweets: csiro at the trec 2012 microblog track	2012	11.210143662057448	-14.031821091625053	3539044
3540147	Web+IR	expert and student user evaluation of semantic protocol search	2018	12.108520303120663	-13.677883191871835	3540174
3542461	AI	pris at trec 2010 blog track: faceted blog distillaton	2010	11.924728257557357	-14.096897466658206	3542488
3542558	SE	the france telecom orange labs (beijing) video semantic indexing systems - trecvid 2010 notebook paper	2010	11.952664740968373	-14.503702016847331	3542585
3543929	NLP	hnews: an enhanced multilingual hyperlinking news platform	2011	11.35580318037467	-13.94252077426867	3543956
3544714	HCI	trec: continuing information retrieval's tradition of experimentation	2007	11.704967018846874	-13.827142801368511	3544741
3547126	ML	integrating correlation clustering and agglomerative hierarchical clustering for holistic schema matching	2015	11.380851634300315	-14.516614099453554	3547153
3548905	AI	linguistic summaries of graph datasets using ontologies: an application to semantic web	2017	11.765697803609905	-14.303154361775556	3548932
3548907	Web+IR	microsoft research at trec 2011 web track	2010	11.691767450222972	-13.808172331745013	3548934
3549771	Web+IR	evaluating the stability and credibility of ontology matching methods	2011	11.719192324605704	-14.047153773146816	3549798
3549816	Web+IR	reducing information redundancy in search results	2013	11.478854455476249	-14.019683315069466	3549843
3552435	Web+IR	towards more effective solution retrieval in it support services using systems log	2016	11.288741936588426	-14.203682839595563	3552462
3553878	ML	a study on the influence of semantics on the analysis of micro-blog tags in the medical domain	2013	11.402387027364993	-14.528498178185403	3553905
3553895	Web+IR	microsoft cambridge at trec 13: web and hard tracks.	2004	12.107275117479515	-14.217306181046588	3553922
3554418	AI	is it the right answer? exploiting web redundancy for answer validation	2002	12.018648727254709	-14.227895387793165	3554445
3554516	NLP	a muitilingual news summarizer	2000	11.320296682619116	-14.215562918042245	3554543
3555508	AI	exploitation of newspaper-article characteristics for article retrieval and answer extraction in qac task 2	2002	11.688705500884295	-13.967065558264336	3555535
3558502	Web+IR	integrating document features for entity ranking	2007	11.381571357507456	-14.167678373135855	3558529
3558649	AI	a system for probabilistic linking of thesauri and classification systems	2015	11.967856978940876	-14.581626177507632	3558676
3559268	Web+IR	an ontology-supported and fully-automatic annotation technology for semantic portals	2007	12.013343528501856	-13.68556891047125	3559295
3562002	Web+IR	theoretical evaluation of xml retrieval	2011	11.716331521171274	-13.671161337462726	3562029
3564316	Web+IR	a framework to collect and extract publication lists of a given researcher from the web	2017	11.833771800841086	-14.253725844897012	3564343
3566577	SE	a model for auto-tagging of research papers based on keyphrase extraction methods	2017	11.755025880682235	-13.976651887617136	3566604
3567451	NLP	readability and the web	2012	11.261854872245667	-13.792558899405249	3567478
3567484	DB	an automatic unsupervised querying algorithm for efficient information extraction in biomedical domain	2005	11.538693008594393	-14.312155852974467	3567511
3567943	Web+IR	from words to concepts in text mining	2006	11.166290894904456	-13.824898937538617	3567970
3569413	DB	approximate address matching	2010	11.760447587470384	-14.368336858194768	3569440
3569966	Web+IR	needle custom search - recall-oriented search on the web using semantic annotations	2014	11.604109743932884	-14.363022775618115	3569993
3571700	HCI	an empirical study on the automatic resolution of semantic ambiguity in social tags	2011	11.421445741855493	-13.674485907151954	3571727
3573542	Web+IR	knowmore - knowledge base augmentation with structured web markup	2019	12.01681359652796	-13.914376614326295	3573569
3573851	Web+IR	a case study: news classification based on term frequency	2005	11.563025053118164	-14.070479425346795	3573878
3574330	DB	mining subjective properties on the web	2015	11.739645368291171	-13.653919013544725	3574357
3575340	Web+IR	finding news citations for wikipedia	2016	11.851745770119138	-14.01292853420307	3575367
3579963	ML	mining reference tables for automatic text segmentation	2004	11.448574948410425	-14.454033224482606	3579990
3581121	Web+IR	exploiting query logs and field-based models to address term mismatch in an hiv/aids faq retrieval system	2013	11.151600506230658	-13.914087219558125	3581148
3582112	SE	expandable group identification in spreadsheets	2018	12.003770116830905	-13.850948619894021	3582139
3593173	NLP	citom: incremental construction of topic maps	2009	11.952329580947811	-14.238974647422465	3593200
3594345	Vision	linguistic estimation of topic difficulty in cross-language image retrieval	2005	12.011078397517226	-14.028730339436574	3594372
3596138	Web+IR	mathwebsearch at ntcir-10	2013	11.682752422524386	-13.658608674106242	3596165
3600214	AI	irit at trec microblog 2012: adhoc task	2012	11.829277307295143	-14.143481772680659	3600241
3602456	AI	concept-based knowledge discovery in texts extracted from the web	2000	11.515606475404189	-13.746815219823349	3602483
3604482	Web+IR	exima™ supply at inex 2002: using an object-relational dbms for xml retrieval	2002	11.48978775733464	-13.759244118915012	3604509
3604973	Vision	ipal at clef 2008: mixed-modality based image search, novelty based re-ranking and extended matching	2008	11.963140913896005	-14.350603324072432	3605000
3605462	AI	a hybrid method for detecting outdated information in wikipedia infoboxes	2013	11.834872262354324	-13.703959205715563	3605489
3605674	Web+IR	thuir at trec 2003: hard experiments	2003	11.862791573286069	-14.25160965691669	3605701
3608446	ML	using owa operators for gene sequential pattern clustering	2009	11.969024650070386	-14.584919403370769	3608473
3609607	Web+IR	exploiting latent semantic relations in highly linked hypertext for information retrieval in wikis	2009	11.731927204931123	-14.228189196390836	3609634
3611606	Web+IR	efficient keyword extraction for meaningful document perception	2011	11.235354949328077	-13.707486443337073	3611633
3614083	Web+IR	integrating the probabilistic models bm25/bm25f into lucene	2009	11.426087869693232	-14.036141587230132	3614110
3614620	NLP	using topic models to interpret medline's medical subject headings	2009	11.161808141143997	-13.839218350894704	3614647
3615968	Web+IR	the inex 2007 multimedia track	2007	11.992115259843915	-13.79713295286643	3615995
3616373	NLP	ferret: interactive question-answering for real-world environments	2006	11.544061377028632	-13.990924189503485	3616400
3616612	AI	a method of preferential unification of plural retrieved elements for xml retrieval task	2006	11.453731439926012	-14.001184975397775	3616639
3619821	Web+IR	deola: a system for linking author entities in web document with dblp	2016	11.797813669299948	-14.313864602765536	3619848
3620708	Web+IR	a real-world framework for translator as expert retrieval	2014	11.399028486089346	-13.688059867495024	3620735
3622506	Robotics	combining text-mess systems at imageclef 2008	2008	11.46838067622275	-14.409016855819011	3622533
3624993	DB	combining textual and visual ontologies to solve medical multimodal queries	2006	11.184146124564943	-14.168737514224274	3625020
3627465	AI	ontology population from the web: an inductive logic programming-based approach	2014	11.744240641442296	-14.325821628804848	3627492
3629497	NLP	helping people to choose for whom to vote. a web information system for the 2009 european elections	2009	11.542990700331082	-13.869710979709213	3629524
3631734	NLP	organizing the oca: learning faceted subjects from a library of digital books	2007	11.609639149596093	-13.974276085287512	3631761
3632144	ML	transformation and aggregation preprocessing for top-k recommendation gap rules induction	2015	12.089932499298556	-14.281001942925418	3632171
3632918	ML	distilling conceptual connections from mesh co-occurrences	2004	12.061374581236036	-14.019488209934945	3632945
3633035	Web+IR	automatic web pages hierarchical classification using dynamic domain ontologies	2011	11.510571518869117	-13.914063631662573	3633062
3636960	Vision	finding needles in an encyclopedic haystack: detecting classes among wikipedia articles	2018	11.454713911375384	-14.543749434414435	3636987
3637953	ML	text retrieval with the trw fast data finder.	1992	11.323950938850526	-14.022789686590643	3637980
3638642	NLP	context-sensitive ranking using cross-domain knowledge for chemical digital libraries	2013	12.067058048881533	-13.864741770763054	3638669
3640206	Web+IR	performing informetric analysis on information retrieval test collections: preliminary experiments in the physics domain	2013	11.814576294097867	-13.984920840545778	3640233
3643453	DB	smurf: self-service string matching using random forests	2018	11.668773137186156	-14.573820964452134	3643480
3644186	NLP	automatic generation of topic pages using query-based aspect models	2009	11.477929481869971	-14.207048976514546	3644213
3644608	AI	predicting quality of crowdsourced annotations using graph kernels	2015	11.83674636419322	-14.05390650332246	3644635
3646475	Web+IR	on the measurement of inter-linker consistency and retrieval effectiveness in hypertext databases	1994	12.07230169667043	-13.872781148282034	3646502
3646570	Web+IR	incremental context mining for adaptive document classification	2002	11.146621459195304	-14.190027190544605	3646597
3646800	AI	integrating information to bootstrap information extraction from web sites	2003	12.096992166202304	-13.72412155349111	3646827
3647134	Web+IR	customizing search results for non-native speakers	2012	11.566791546177141	-13.715859818374529	3647161
3648788	NLP	semeval-2013 task 11: word sense induction and disambiguation within an end-user application	2013	11.168464572972793	-13.979988593267608	3648815
3654501	Web+IR	xml retrieval: what about using contextual relevance?	2006	11.38733116815021	-14.106042837131165	3654528
3655880	DB	approximate substring selectivity estimation	2009	12.034385414476864	-14.376649157110359	3655907
3658146	SE	matching object catalogues	2008	11.17553145393454	-14.321383612261926	3658173
3663660	NLP	nlpr at trec 2005: hard experiments	2005	11.892834498040768	-14.364845355179195	3663687
3664633	Web+IR	boss: context-enhanced search for biomedical objects	2012	11.87557063607532	-14.437983162697352	3664660
3665234	Web+IR	an effective method for finding best entry points in semi-structured documents	2007	11.547323521026035	-13.76492312559979	3665261
3665248	NLP	utilization of multiple sequence analyzers for bibliographic information extraction	2014	11.893779326713492	-13.854704785821562	3665275
3669470	NLP	web reinforced question answering (multitest experiments for trec 2001)	2001	11.225320640848832	-14.38973134648771	3669497
3671164	Web+IR	a domain-independent multi-modifier entity search method	2017	11.443571160591011	-13.79538228210968	3671191
3672246	Web+IR	document title patterns in information retrieval	1999	11.361393801157911	-13.819599807734592	3672273
3672275	Web+IR	understanding combination of evidence using generative probabilistic models for information retrieval (abstract only)	2004	11.165016574349561	-14.17227781440734	3672302
3673151	NLP	nus at tac 2008: augumenting timestamped graphs with event information and selectively expanding opinion contexts.	2008	11.245799611461248	-14.148046118390953	3673178
3673653	Web+IR	enriching a thesaurus to improve retrieval of audiovisual documents	2008	12.001856260130047	-14.396309908812196	3673680
3675676	ML	adaptive web-page content identification	2007	11.460984798495351	-13.730954341767578	3675703
3679057	Web+IR	error analysis of difficult trec topics	2003	11.148758056881551	-13.82512275977917	3679084
3679078	Web+IR	an intelligent agent for content-based indexing and retrieval of documents	2000	12.06743787835966	-13.833709352047475	3679105
3679652	Web+IR	iitd-ibmirl system for question answering using pattern matching, semantic type and semantic category recognition	2007	11.653044763730584	-14.482156707379632	3679679
3680623	NLP	searching sentiments in blogs	2006	11.488375469938527	-13.860154911093217	3680650
3682864	Web+IR	a tripartite graph-based fuzzy co-similarities for document retrieval	2014	11.143758044473241	-13.903607086253908	3682891
3683478	NLP	automatic category structure generation and categorization of chinese text documents	2000	11.376132191554198	-14.146257392974414	3683505
3683868	Web+IR	ntcir-5 patent retrieval experiments at hitachi	2005	11.54792238357788	-14.588874924578107	3683895
3687059	Web+IR	passage retrieval in log files: an approach based on query enrichment	2010	11.152763004862932	-14.088839832083071	3687086
3688918	Web+IR	an integrated method for web resource categorization	2008	11.768742458531197	-13.774089106117065	3688945
3689911	NLP	improving search in folksonomies: a task based comparison of wordnet and ontologies	2009	11.531354939792907	-13.656911535727437	3689938
3690598	Web+IR	using hybrid methods and ‘core documents’ for the representation of clusters and topics: the astronomy dataset	2015	11.260341225066133	-13.80729443479626	3690625
3693802	DB	a fast linkage detection scheme for multi-source information integration	2005	11.426190660924682	-13.786744426493057	3693829
3694107	Web+IR	university of lugano at trec 2008 blog track	2008	11.504179786519463	-14.281374973015833	3694134
3694880	DB	bibpro: a citation parser based on sequence alignment	2012	11.700384253333747	-14.034928210740096	3694907
3696463	NLP	cebbip: a parser of bibliographic information in chinese electronic books	2009	11.780668205262824	-14.53561886374223	3696490
3696806	DB	towards faceted search for named entity queries	2009	11.603646601266725	-14.248126456079975	3696833
3697763	AI	identifying document topics using the wikipedia category network	2009	11.426393228983619	-13.678739768782814	3697790
3697857	AI	instance based clustering of semantic web resources	2008	11.477793252096767	-13.773041566194873	3697884
3698752	AI	a study of concept-based similarity approaches for recommending program examples	2017	11.696663192586739	-13.877889781227694	3698779
3699810	Web+IR	web table understanding by collective inference	2018	11.152582557762264	-13.89170988982938	3699837
3706603	AI	deriving technology intelligence from patents: preposition-based semantic analysis	2018	12.029315427963926	-14.116353738322832	3706630
3708578	NLP	summit: a tool for extractive summarization, discovery and analysis	2017	12.105417668825893	-14.477804863874814	3708605
3710240	AI	which one is better: presentation-based or content-based math search?	2014	11.159024556562775	-13.793627296687609	3710267
3712604	Security	identifying forensically uninteresting files in a large corpus	2016	11.97526502796979	-13.833865444660713	3712631
3714811	Web+IR	enriching concept search across semantic web ontologies	2013	11.619700640484693	-13.880576953420752	3714838
3716183	Web+IR	expoliting rich features for promoting diversity in biomedical information retrieval	2013	11.853578333974669	-14.089924611558793	3716210
3717050	NLP	event mining from the blogosphere using topic words	2007	11.187033208129055	-14.132852894448607	3717077
3717121	NLP	co-occurrence and ranking of entities based on semantic annotation	2008	11.256739714502661	-13.708819769116197	3717148
3718604	Web+IR	michigan state university at the 2007 trec ciqa task	2007	12.045097504866982	-14.138933156958144	3718631
3720623	NLP	resource analysis for question answering	2004	11.564670258510626	-13.875213254396147	3720650
3721691	AI	learning of ontology from the web-table	2011	11.351119833054021	-13.904892110149063	3721718
3726812	Web+IR	on content-driven search-keyword suggesters for literature digital libraries	2008	11.455370628813856	-13.880764426290824	3726839
3730830	NLP	acs: an automatic classification system	1995	11.295807164644062	-14.229836259025081	3730857
3732385	DB	activation on the move: querying tourism information via spreading activation	2003	11.200212226460788	-13.666308695632702	3732412
3736388	Web+IR	the use of automatically-obtained keyword classifications for information retrieval. final report.	1969	12.052345750240706	-13.902336603014493	3736415
3737131	Web+IR	combining fields in known-item email search	2006	11.51507837690316	-13.757484805175213	3737158
3737263	Web+IR	document retrieval in the context of question answering	2003	11.50424204366224	-14.406845908444732	3737290
3737399	Web+IR	learning to select a time-aware retrieval model	2012	11.310335253031123	-13.659351197958564	3737426
3738397	ML	ontology based opinion mining for movie reviews	2009	11.643654942835955	-14.554604774626949	3738424
3739576	Robotics	cheshire ii at inex '04: fusion and feedback for the adhoc and heterogeneous tracks	2004	11.827450947702939	-14.098248444698912	3739603
3743053	Web+IR	development and evaluation of a geographic information retrieval system using fine grained toponyms	2015	11.839558225132858	-14.052091856874995	3743080
3744727	NLP	event-driven document selection for terrorism information extraction	2005	11.495602774542418	-14.029886234609172	3744754
3746075	AI	a system for referencing personal names through iconography and sharing an authoritative information source for personal names by api	2011	11.476360834032198	-14.060615416431768	3746102
3746109	Web+IR	automatic classification and retrieval of documents by means of a bibliographic pattern discovery algorithm	1971	11.677777696290086	-13.64235904332166	3746136
3748567	Web+IR	judging expertise--wim at enterprise	2006	11.373524303058465	-14.373265397493524	3748594
3748615	DB	concepts expansion in materials domain based on ontology matching results	2016	11.438783594292564	-14.15057779382441	3748642
3748857	Web+IR	upv/buap participation in webclef 2006	2006	11.254288009574811	-14.299412529287784	3748884
3750802	Web+IR	logical structure recognition of scientific bibliographic references	1997	11.930100944423357	-14.190516810137431	3750829
3752101	DB	semantic service retrieval based on natural language querying and semantic similarity	2011	11.386425361133472	-13.664866089759338	3752128
3752679	Web+IR	learning contextual behavior of text data	2005	11.78042785974586	-13.909833251978824	3752706
3753322	ML	a gray code based ordering for documents on shelves: classification for browsing and retrieval	1992	11.705006056012385	-13.73262416469044	3753349
3753637	Robotics	a biased summary system and its implementation technology	2008	11.455507414848151	-13.85568167944632	3753664
3754118	Web+IR	trec-7 ad-hoc, high precision and filtering experiments using pircs	1998	11.379486434251985	-14.560326621015735	3754145
3754559	Web+IR	a view on two complementary representations of documents for information retrieval	2006	12.027213662015429	-14.403614254023536	3754586
3754836	Web+IR	overview of patent retrieval task at ntcir-5	2002	11.811603599759016	-14.157650405005437	3754863
3756242	Web+IR	computational and crowdsourcing methods for extracting ontological structure from folksonomy	2010	11.77020095387874	-13.66061286546162	3756269
3756776	Web+IR	automatic extraction of web data records containing user-generated content	2010	11.183626296966336	-14.208511758898208	3756803
3761695	DB	research of the chinese meta-search engine model based on intelligent agent	2005	11.428815650253892	-14.10801024885493	3761722
3762955	NLP	digital libraries: data, information, and knowledge for digital lives	2017	12.045979794529686	-14.377032871190364	3762982
3765402	Web+IR	exploiting a large thesaurus for information retrieval	1994	11.704205869052295	-14.486003149425127	3765429
3766041	NLP	towards intelligent qa interfaces: discourse processing for context questions	2006	11.656384351226055	-14.508265910680134	3766068
3768820	Web+IR	a geographical question answering system	2007	11.317492641844222	-13.864326187552042	3768847
3769230	DB	potentiality of healthcare big data: improving search by automatic query reformulation	2017	11.209560273346694	-14.211899539940871	3769257
3770771	Web+IR	classification of web documents using concept extraction from ontologies	2007	11.775190941014536	-14.291511760787929	3770798
3770917	Web+IR	semir: semantic indexing and retrieving web document using rhetorical structure theory	2003	11.342994947710535	-13.71767676428056	3770944
3773834	SE	a relation mining and visualization framework for automated text summarization	2009	11.647228631260047	-14.153844876607387	3773861
3774235	DB	towards event ordering in digital forensics	2010	11.804687091878874	-13.723418187392545	3774262
3775435	AI	joint information extraction from the web using linked data	2014	12.004293414603453	-13.643383672182493	3775462
3776419	Web+IR	dataset, ground-truth and performance metrics for table detection evaluation	2012	11.51972523535916	-13.942356541714934	3776446
3776683	NLP	a structural-lexical measure of semantic similarity for geo-knowledge graphs	2015	11.753340828685205	-14.181475037995815	3776710
3779213	NLP	matching cultural heritage items to wikipedia	2012	11.70251981701949	-14.272590014805159	3779240
3780684	Web+IR	exploiting semantic annotations for entity-based information retrieval	2014	11.493383105220444	-13.813761738007116	3780711
3780820	Web+IR	uic at trec 208 blog track	2008	11.196830684208944	-14.304999019940476	3780847
3780968	Visualization	tag clouds for displaying semantics: the case of filmscripts	2010	11.439684732028008	-13.842500957550854	3780995
3782798	ML	clustering of rough set related documents with use of knowledge from dbpedia	2011	11.50254353663581	-14.343393840188275	3782825
3782974	DB	exploiting tags for concept extraction and information integration	2009	11.145765070180571	-13.953269018682793	3783001
3785535	NLP	title extraction from bodies of html documents and its application to web page retrieval	2005	11.196555273963444	-14.49477895388249	3785562
3785577	NLP	inext: an investigative search tool for knowledge extraction	2006	11.756948236937216	-14.522659769302726	3785604
3785681	Web+IR	methods for exploring and mining tables on wikipedia	2013	11.497363784752386	-13.75670591051878	3785708
3787894	Web+IR	summaries on the fly: query-based extraction of structured knowledge from web documents	2013	11.431700835493224	-14.109047769859206	3787921
3789434	Web+IR	probabilistic methods for structured document classification at inex'07	2007	11.355940245753338	-14.275982106162362	3789461
3791115	NLP	partitioning the gov2 corpus by internet domain name: a result-set merging experiment	2006	11.198870245538984	-13.993104631735164	3791142
3792769	Web+IR	computing semantic relatedness using dbpedia	2012	11.36619447653685	-13.968804783908315	3792796
3795843	Web+IR	gir experiments with forostar at geoclef 2007	2007	11.724706941124019	-14.302157595561935	3795870
3796204	Vision	overview of the inex 2011 relevance feedback track	2011	11.874735430870187	-13.954400756586232	3796231
3797646	Web+IR	a dempster-shafer model for document retrieval using noun phrases	1998	11.697374777526706	-14.413113577236654	3797673
3798722	Web+IR	extracting exact answers using a meta question answering system	2005	11.3238081748935	-14.109714125994262	3798749
3798728	Web+IR	trec: topic engineering exercise	2014	11.487228615093148	-14.319982627874927	3798755
