id	area	title	year	x	y	ix
3928307	NLP	do social information help book search?	2012	11.546664959367199	-12.716464497266509	3928334
3930671	DB	web entities extraction based on semi-structured semantic database	2013	11.904541501714293	-13.599079995188957	3930698
3932112	Web+IR	interpreting discovered patterns in terms of ontology concepts	2014	11.40902156728201	-12.929194680716655	3932139
3932231	Web+IR	improving consistency of crowdsourced multimedia similarity for evaluation	2015	11.607246512142275	-12.895515186953402	3932258
3933269	ML	consolidating identities of authors through egonet structure	2017	11.721021345907804	-13.06255671648378	3933296
3933741	Web+IR	a query transformation framework for automated structured query construction in structured retrieval environment	2014	11.162243906680748	-13.143803414479075	3933768
3935175	HCI	tag sense disambiguation for clarifying the vocabulary of social tags	2009	11.472464692578027	-13.40200476991543	3935202
3937676	Web+IR	using domain ontologies for efficient information retrieval	2006	11.614027287196748	-13.347104441937365	3937703
3938964	AI	the naive bayes mystery: a classification detective story	2005	11.91061354310236	-12.788951779007121	3938991
3940890	Web+IR	a new mathematics retrieval system	2010	11.773570531158256	-13.465915719996516	3940917
3944152	NLP	in-browser summarisation: generating elaborative summaries biased towards the reading context	2008	11.813970835516095	-13.44935926010574	3944179
3947262	DB	prequery discovery of domain-specific query forms: a survey	2013	12.105257843117766	-13.029290735119055	3947289
3948583	ML	einstein: physicist or vegetarian? summarizing semantic type graphs for knowledge discovery	2011	11.91799371721024	-12.852640794700768	3948610
3949165	DB	practical regular expression mining and its information quality applications	2002	11.960786613307276	-13.299554652839625	3949192
3949426	Web+IR	university of delaware at trec 2015: combining opinion profile modeling with complex context filtering for contextual suggestion	2015	11.490949885535185	-13.133242067429473	3949453
3952309	Web+IR	a combined measure of semantic web and meta tag technology for web retrieval	2011	11.634977135458195	-12.686140684961991	3952336
3952410	Web+IR	on-topic cover stories from news archives	2015	11.233606035970707	-13.193538795372383	3952437
3953249	Web+IR	evaluate retrieval systems based on ontology vocabulary	2009	11.52142544783087	-12.964208857906053	3953276
3953593	Web+IR	candidate document retrieval for arabic-based text reuse detection on the web	2016	11.157417285024954	-13.413836365426615	3953620
3954774	AI	using tag clouds to quickly discover patterns in linked data sets	2011	11.989713648276664	-13.482381379990606	3954801
3954932	Web+IR	usewod2011: 1st international workshop on usage analysis and the web of data	2011	12.007304497755914	-12.981199678070785	3954959
3957260	AI	rules for the implicit acquisition of knowledge about the user	1987	11.566113044960018	-13.37771943462058	3957287
3961823	NLP	ashram: active summarization and markup	1999	11.535340117589323	-12.908121932047539	3961850
3962320	Web+IR	nexus: a real time qa system	2007	12.009497557323026	-13.267067689410824	3962347
3963349	Web+IR	improved annotation of the blogosphere via autotagging and hierarchical clustering	2006	11.54935465686783	-12.856297739175377	3963376
3964384	NLP	using babelnet in bridging the gap between natural language queries and linked data concepts	2013	11.86980982433598	-13.505651503072155	3964411
3964866	NLP	the newspaper image database: empirical supported analysis of users' typology and word association clusters	1995	11.249837983668435	-13.292170135341381	3964893
3967007	Web+IR	letor: a benchmark collection for research on learning to rank for information retrieval	2009	11.488780576959034	-13.607658469766129	3967034
3969651	DB	a survey of web information extraction systems	2006	11.549212419953859	-12.872815039713895	3969678
3970510	DB	numeric query answering on the web	2011	11.337254590741026	-13.417266723260038	3970537
3970965	Web+IR	searchable words on the web	2003	11.794269793832884	-13.49570119409655	3970992
3973507	Web+IR	ranking entities in the age of two webs, an application to semantic snippets	2015	11.273760464872716	-13.207764647776115	3973534
3974533	DB	improving sdi search profiles	1975	11.171639011577668	-12.837153566177607	3974560
3975227	Web+IR	a generic approach to component-level evaluation in information retrieval	2012	11.932219459849794	-13.593569622940295	3975254
3975771	Web+IR	bringing why-qa to web search	2011	11.732800408284529	-12.856999636611354	3975798
3976178	Web+IR	an extended vector-processing scheme for searching information in hypertext systems	1996	11.27448081656816	-13.38226740989484	3976205
3978432	DB	course concept extraction in mooc via explicit/implicit representation	2018	11.499909809569585	-12.98285728936983	3978459
3983986	DB	semi-structured complex list extraction	2004	11.989574159747695	-13.22619640539348	3984013
3985391	HPC	management of scientific documents and visualization of citation relationships using weighted key scientific terms	2016	11.238667938713276	-13.48708836824314	3985418
3987639	NLP	person name disambiguation for building university knowledge base	2016	11.953424805715086	-13.597453643088055	3987666
3987731	Web+IR	utility evaluation of cross-document information extraction	2010	11.38600098974192	-13.6408682582425	3987758
3990669	SE	an unsupervised approach for discovering relevant tutorial fragments for apis	2017	11.893319301093808	-12.925652551472973	3990696
3992392	Vision	what's in a magazine image: evaluation of a multifaceted categorization model	2009	11.939399699712828	-13.043984148834893	3992419
3992714	NLP	a graphical citation browser for the acl anthology	2012	11.312866927420574	-13.102723062780711	3992741
3993933	Web+IR	semantic querying on multimedia data	2016	11.978216234539282	-13.263237036135607	3993960
3995170	Web+IR	a search engine for japanese academic papers	2010	11.64256656567475	-13.63642447269464	3995197
4000649	AI	semantic information retrieval study based on knowledge reasoning	2009	11.269084087447805	-12.956671296165194	4000676
4002170	Web+IR	history rhyme: searching historic events by multimedia knowledge	2016	11.641258346195912	-12.857239666842249	4002197
4003210	Web+IR	readfast: high-relevance search-engine for big text	2013	11.447045636398096	-13.491842658477154	4003237
4004460	NLP	gucas at trec 2011 microblog track	2011	11.208853649156046	-13.561586247841312	4004487
4005983	HCI	supporting web surfers in finding related material in digital library repositories	2016	11.5664229659417	-12.690384329509834	4006010
4006910	Web+IR	ontology augmentation through matching with web tables	2018	11.45045266416539	-13.415959439704142	4006937
4007144	DB	event oriented query expansion for news event queries	2015	11.543102211068993	-13.472409784668471	4007171
4009510	Web+IR	searching an appropriate journal for your paper - an approach inspired by expert search and data fusion	2017	11.466955825729366	-13.434037396217134	4009537
4009784	ML	from data analysis to neural networks: new prospects for efficient browsing through databases	1991	11.654058207360169	-13.149747587496742	4009811
4010797	DB	context and keyword extraction in plain text using a graph representation	2008	11.676373391718744	-13.0918255439939	4010824
4013672	ML	delve: a data set retrieval and document analysis system	2017	12.014819833345806	-12.8410389106706	4013699
4014253	Web+IR	estimating web site readability using content extraction	2009	11.444613467243677	-12.89585655216791	4014280
4016482	Web+IR	supervised extractive summarisation of news events	2018	11.389708759952534	-12.76651753240735	4016509
4017322	AI	ontology learning from user tagging for tag recommendation making	2011	11.71599482334983	-12.6984981219945	4017349
4020002	NLP	improving folksonomies using formal knowledge: a case study on search	2009	11.549733741062047	-13.334900439838705	4020029
4025785	Web+IR	a search/crawl framework for automatically acquiring scientific documents	2016	11.866932201397615	-13.092831040622865	4025812
4026122	Web+IR	on real-time ad-hoc retrieval evaluation	2012	11.504212410704858	-12.782935968940892	4026149
4026434	Web+IR	towards measuring user query tendency for legal document retrieval	2010	11.548541554469011	-12.952185267054956	4026461
4027818	DB	improving content-oriented xml retrieval by exploiting small elements	2007	11.59398283038847	-13.25042039654486	4027845
4028375	SE	cognitive relevance	2017	11.495201847419331	-12.698495579047805	4028402
4030032	Web+IR	do natural language search engines really understand what users want?: a comparative study on three natural language search engines and google	2013	11.318192053637139	-12.98289970761727	4030059
4030856	Web+IR	information retrieval in life sciences: the lailaps search engine	2012	11.575654866057107	-12.759323971388358	4030883
4033318	DB	topick: accurate topic distillation for user streams	2012	11.525505184926958	-13.429207758407605	4033345
4034258	AI	towards an emergent semantic of web resources using collaborative tagging	2017	11.656947874793554	-13.149728050418856	4034285
4041656	Web+IR	further reflections on trec	2000	11.821592617947745	-13.497897234856556	4041683
4042227	DB	interesting-phrase mining for ad-hoc text analytics	2010	11.172150886167376	-13.483998167915725	4042254
4043400	NLP	revisiting reverts: accurate revert detection in wikipedia	2012	11.34836177388631	-13.487706213954695	4043427
4051126	DB	automatic deep web query results extraction based on tag trees	2009	11.171491143396194	-13.382739503743355	4051153
4052729	ML	a scalable approach for contradiction detection driven by opinion mining	2013	11.747604927222927	-12.744458055072455	4052756
4058403	Web+IR	argumentation-based schema matching for multiple digital libraries	2015	12.10564124542306	-13.511685303744171	4058430
4060410	HPC	co-bidding graphs for constrained paper clustering	2016	12.007478826481695	-12.92601585859143	4060437
4062129	DB	extracting structured data from unstructured document with incomplete resources	2015	11.215801359283011	-13.391651413264757	4062156
4065260	Web+IR	extracting semantic relationships for web services based on wikipedia	2011	11.523260225937294	-13.51682139446174	4065287
4065849	AI	using linked open data in recommender systems	2015	11.596781926272753	-12.793028463915606	4065876
4066178	NLP	a scalable approach for question based indexing of encyclopedic texts	1997	11.841045970346654	-13.455328243218096	4066205
4067477	Web+IR	reflections on five years of evaluating semantic search systems	2010	11.580773956060149	-12.935036352638516	4067504
4070425	Web+IR	web-based affiliation matching.	2009	11.829887417772055	-13.281887326200154	4070452
4070923	Web+IR	an analysis of common search in chinese of google the meta - library	2007	11.734949848762092	-13.229763931498045	4070950
4071373	AI	using contextual analysis for news event detection	2001	11.219515953242423	-13.346123837658187	4071400
4071504	Vision	document summarization using semantic clouds	2013	11.189419160466725	-13.494739865141629	4071531
4072772	Web+IR	geographic information retrieval: modeling uncertainty of user's context	2012	11.927546281311445	-13.542036358040669	4072799
4076093	AI	a novel approach of table detection and analysis for semantic annotation	2006	11.143686892506027	-12.985717462875874	4076120
4076833	HCI	using category information for relationship exploration in textual data	2006	11.160138283869927	-12.713884350392904	4076860
4077168	DB	semantic and thematic navigation in electronic encyclopedias	1999	11.88978703411184	-12.982536620012722	4077195
4083958	Web+IR	data extraction from web pages based on structural-semantic entropy	2012	11.211096299493713	-13.148332104935337	4083985
4090066	DB	stavies: a system for information extraction from unknown web data sources through automatic web wrapper generation using clustering techniques	2005	11.28010464251218	-12.972156920949814	4090093
4091040	DB	intelligent techniques for global e-business web portal development	2005	11.985952671076046	-13.311426194212988	4091067
4094770	Web+IR	wikimirs: a mathematical information retrieval system for wikipedia	2013	11.528584320545349	-13.607065757140312	4094797
4097169	Web+IR	web search relevance feedback	2009	11.512485662597015	-13.175421419919267	4097196
4099603	Web+IR	evaluation of the music ontology framework	2012	11.769136921644535	-13.043762001108453	4099630
4099710	Web+IR	summarizing vocabularies in the global semantic web	2009	11.806056690171607	-13.581284091096931	4099737
4101495	ECom	engineering efficient error-correcting geocoding	2011	12.026340706364984	-13.590338261683636	4101522
4103662	ML	a new approach to detecting content anomalies in wikipedia	2013	11.655810346372974	-12.952893003826913	4103689
