id	area	title	year	x	y	ix
3583666	DB	automatic generation of web mining environments	1999	11.613953490188743	-13.219486777032321	3583693
3584195	Web+IR	iclef 2006 overview: searching the flickr www photo-sharing repository	2006	11.795392712946649	-12.740958973787794	3584222
3585993	Web+IR	semantic web services retrieval model based on chinese word segmentation	2008	11.922360984986925	-13.562273487823887	3586020
3588707	Web+IR	news from trec	2016	11.833451109568605	-12.952428590590653	3588734
3589514	Web+IR	improved concept-based query expansion using wikipedia	2013	11.405124741859069	-13.175803328229915	3589541
3593780	DB	introducing structure management in automatic reference resolution: an xml-based approach	2007	11.404266594388526	-13.324198446201926	3593807
3594149	Web+IR	wikianalytics: disambiguation of keyword search results on highly heterogeneous structured data	2010	11.524809336459313	-13.5712724991	3594176
3597239	Web+IR	enriching textual search results at query time using entity mining, linked data and link analysis	2014	11.598045484631793	-13.387968192126165	3597266
3597809	Web+IR	a visual summary for linked open data sources	2014	11.882034172024813	-13.055986735384236	3597836
3598150	Web+IR	understanding tables on the web	2012	11.965626671503287	-13.202716099434106	3598177
3600600	Web+IR	a relevance ranking method for citation-based search results	2017	11.606050633096455	-13.45265316584671	3600627
3604452	Web+IR	construction of a test collection for the focussed retrieval of structured documents	2003	11.411417939586814	-13.545785862515581	3604479
3608948	DB	using information extraction for quality analysis in human authentication	2005	12.03888829766885	-12.812234385227434	3608975
3614256	Web+IR	g-bean: an ontology-graph based web tool for biomedical literature retrieval	2013	11.378843029845015	-13.125450055487294	3614283
3616265	HCI	mining the behaviour of users in a multilingual information access task	2008	11.89024912821791	-13.33968076368017	3616292
3617923	HCI	analysis of titles and readers for title generation centered on the readers	2002	11.965384978708226	-13.077188929216472	3617950
3618962	Web+IR	bag of works retrieval: tf*idf weighting of co-cited works	2016	11.552346480010836	-13.44144794488605	3618989
3619004	Web+IR	focused retrieval and result aggregation with political data	2010	11.426532516383169	-12.76680352474784	3619031
3619913	Web+IR	associative search techniques versus probabilistic retrieval models	1982	11.754704100714042	-13.021921134276075	3619940
3620239	NLP	context based relevance evaluation of web documents	2012	11.178566459592156	-13.230458087939935	3620266
3622564	ML	concept relation discovery and innovation enabling technology (cordiet)	2011	11.283939285176	-13.21914868583658	3622591
3625184	Robotics	a repository with semantic organization for educational content	2008	11.602444785611427	-13.38850501640808	3625211
3627828	ML	internet economic news gathering and classification: a neural network software agent based approach	2002	11.649118481434465	-12.871384055146745	3627855
3628705	Web+IR	on the potential search effectiveness of mesh (medical subject headings) terms	2010	12.005714973623107	-12.801583979242265	3628732
3630130	AI	aspect extraction in sentiment analysis: comparative analysis and survey	2016	11.727936962145428	-13.399851876265876	3630157
3630405	HCI	extracting geographic context from the web: georeferencing in mymose	2009	11.667820426062324	-13.543412329323552	3630432
3630732	DB	using naming authority to rank data and ontologies for web search	2009	11.266527215871642	-13.009694075773954	3630759
3633553	Web+IR	information extraction for enhanced access to disease outbreak reports	2002	11.209633298986034	-12.803948126300716	3633580
3636675	Web+IR	stochastic simulations of rejected world wide web pages	2000	11.321452627745492	-13.252960410086985	3636702
3638321	Web+IR	precision and recall of five search engines for retrieval of scholarly information in the field of biotechnology	2005	11.971735468579867	-12.796595872363325	3638348
3641801	DB	infofilter: a system for expressive pattern specification and detection over text streams	2005	12.055477035007891	-13.497724035140722	3641828
3643080	Web+IR	automatic expert identification using a text categorization technique in knowledge management systems	2008	11.954327704201331	-13.19712549031141	3643107
3646679	Web+IR	recap: building relatedness explanations on the web	2016	11.875711939664534	-13.02522405732466	3646706
3649383	Web+IR	semantic sentence structure search engine	2014	11.176095074598653	-13.331465206244594	3649410
3649396	Web+IR	the effects of tabular-based content extraction on patent document clustering	2012	11.4471183595349	-13.259304093097336	3649423
3650924	AI	ontology-based natural query retrieval using conceptual graphs	2008	12.02022793677804	-13.492000834340427	3650951
3653131	NLP	named entity oriented related news ranking	2014	11.349713019939115	-12.76121198903657	3653158
3653820	Web+IR	fchc: a social semantic focused crawler	2011	11.188764645804213	-12.815169901404685	3653847
3655111	NLP	kizomba: an unsupervised heuristic-based web information extractor	2016	11.201253202622642	-12.864457932382336	3655138
3655878	Web+IR	a context based recommender system through collaborative filtering and word embedding techniques	2016	11.583934855569707	-13.565207096928821	3655905
3656623	Web+IR	measuring search engine quality in image queries in 10 non-english languages: an exploratory study	2008	11.635853627253013	-13.045519380133195	3656650
3656642	AI	upf at inex 2010: towards query-type based focused retrieval	2010	11.947480679617527	-13.60635724862483	3656669
3658315	HCI	exploring linked open data with tag clouds	2013	11.538601672771213	-13.37927369416748	3658342
3661588	DB	interactive thesaurus assessment for automatic document annotation	2007	11.88541343278293	-13.5449540660483	3661615
3661840	AI	adding semantics to microblog posts	2012	11.65448044183534	-12.922447442849435	3661867
3662369	Web+IR	adopting ontologies and rules in web searching services	2004	11.338208003972412	-12.809827562014993	3662396
3662473	AI	automatic detection of survey articles	2005	11.514964215732466	-13.075943762814848	3662500
3663555	DB	improving rule generation precision for domain knowledge based wrappers	2005	11.29768244799094	-13.215421798263293	3663582
3666787	Web+IR	adapting question answering techniques to the web	2002	11.469947197940884	-13.0835754520861	3666814
3668461	Crypto	improved publication scores for online digital libraries via research pyramids	2007	11.338388706571973	-13.26397397818384	3668488
3668478	NLP	an initial study of anchor selection in patent link discovery	2017	11.58519706674745	-13.171030888209273	3668505
3671195	NLP	nexir: a novel web extraction rule language toward a three-stage web data extraction model	2013	11.583670188870823	-13.222977339777458	3671222
3671893	Web+IR	user-driven correction of ocr errors: combing crowdsourcing and information retrieval technology	2014	11.770313153131099	-12.89772560157749	3671920
3673005	ML	generating headline summary from a document set	2005	11.301137134231016	-12.837959436165145	3673032
3673422	DB	viewing the web as a virtual database for question answering.	2004	11.977755532976527	-12.900680580977395	3673449
3675011	NLP	a hybrid approach to detecting alerts in arabic e-mail messages	2012	11.422797623921	-12.703324635227029	3675038
3676685	DB	automatic query adjustment in document retrieval	1977	11.382420426221485	-13.383831270056207	3676712
3677530	NLP	what's on tonight: user-centered and situation-aware proposals for tv programmes	2006	11.941311674555681	-12.825420667584565	3677557
3679866	Web+IR	users want more sophisticated search assistants: results of a task-based evaluation	2005	11.677305609162831	-13.197848986723905	3679893
3680270	Web+IR	a conceptual-modeling approach to extracting data from the web	1998	12.081757875853484	-12.923233475595348	3680297
3681506	NLP	exploring multiple ontologies and wordnet framework to expand query for question answering system	2009	11.317954469011106	-13.301220205636985	3681533
3685390	AI	hykss: hybrid keyword and semantic search	2014	11.323442101920671	-13.612459230675375	3685417
3687216	Web+IR	mesia: a web site assistant for document filtering	2000	11.980200557589946	-13.141395761158359	3687243
3692361	SE	automatic data extraction from web discussion forums	2009	11.357811465477614	-13.181603321108305	3692388
3693697	Web+IR	malformed utf-8 and spam	2013	11.144644687022462	-13.470869171637936	3693724
3694520	AI	evidense: a graph-based method for finding unique high-impact events with succinct keyword-based descriptions	2018	11.288490661143284	-13.088939197905693	3694547
3695712	Web+IR	self-learning web question answering system	2004	11.68513325589606	-13.575408666186506	3695739
3699313	Web+IR	"""a """"suggested"""" picture of web search in turkish"""	2016	11.591673169588141	-12.957844739833504	3699340
3699622	SE	wrapper maintenance: a machine learning approach	2003	11.518369327362961	-13.561486725665727	3699649
3701427	NLP	supporting contextualized information finding with automatic excerpt categorization	2014	11.956916443354906	-13.077724213063776	3701454
3701867	NLP	optimal user-centered knowledge organization and classification systems: using non-reflected gray codes	2002	11.908647088274135	-13.454300040820339	3701894
3707341	NLP	a knowledge-based approach for summarising opinions	2012	11.556525261166408	-13.257717675969227	3707368
3707814	DB	extraction rule language for web information extraction and integration	2013	11.704369825772359	-13.4716606656933	3707841
3707930	HPC	forecasting emerging trends from scientific literature	2016	12.068008442226525	-12.814698571097722	3707957
3710599	Web+IR	machine learning approach for the automatic annotation of the events	2007	11.551427939157172	-13.40543638785786	3710626
3710640	Web+IR	sensing semantics of rss feeds by fuzzy matchmaking	2010	11.577997507526124	-12.802499312795634	3710667
3711014	AI	automatic instance identification in intelligent information search engine crab	2008	11.925201367065325	-13.489621171578953	3711041
3718360	ML	network analysis of repositories	2007	11.90309112769114	-13.571024485647536	3718387
3718493	SE	a hierarchy-aware approach to faceted classification of objected-oriented components	1999	11.60921555913496	-13.486763761994885	3718520
3720800	Web+IR	large scale semantic structures for image retrieval	2007	11.363268631677478	-12.772884514637413	3720827
3721631	Web+IR	overview of the trec 2013 crowdsourcing track	2013	11.937873998057047	-13.512458204588206	3721658
3722468	Web+IR	knowledge-based document retrieval: framework and design	1992	11.646661022436698	-12.942440464152295	3722495
3722538	Web+IR	context-based information analysis for the web environment	2012	11.347474038331027	-13.115617478057894	3722565
3723661	AI	automatic wikibook prototyping via mining wikipedia	2008	12.00336145898484	-12.896968525769232	3723688
3727130	Web+IR	searchresultfinder: federated search made easy	2013	11.60150846145288	-12.764899698681214	3727157
3727708	Web+IR	a comparative analysis of similarity measurement techniques through simreq framework	2009	12.057946562685128	-12.895692434649993	3727735
3730114	DB	xml structural summaries	2008	11.834219070044544	-13.485156871216493	3730141
3730662	HCI	challenges of using lsi for concept location	2007	11.237332849677024	-13.562854101937287	3730689
3731496	Web+IR	towards deeper understanding of the search interfaces of the deep web	2006	11.624390107119133	-13.39963353630733	3731523
3732832	Web+IR	dbsemsxplorer: semantic-based keyword search system over relational databases for knowledge discovery	2012	11.672944086335026	-13.389351607650607	3732859
3734475	Web+IR	generating synopses for document-element search	2009	11.674378207178837	-12.924032075035806	3734502
3735010	Web+IR	exploiting entity relationship for query expansion in enterprise search	2013	11.207196047247656	-13.067618713287455	3735037
3738635	Web+IR	human-based query difficulty prediction	2017	11.20908207849752	-13.454608918896305	3738662
3739622	Web+IR	bridging informal tagging and formal semantics via hybrid navigation	2012	11.690933258393937	-13.199991782066606	3739649
3740611	Web+IR	an architecture for finding entities on the web	2009	11.572019221406698	-13.446627137703759	3740638
3741511	Web+IR	a method for determining ontology-based semantic relevance	2007	11.96854706438799	-13.554918569054765	3741538
3743428	ML	web queries classification based on the syntactical patterns of search types	2017	11.17658093759181	-12.921198845077331	3743455
3744958	DB	finding target and constraint concepts for xml query construction	2015	11.324925493116233	-13.605084771297545	3744985
3745251	HCI	overview of iclef 2009: exploring search behaviour in a multilingual folksonomy environment	2009	11.978272018628495	-13.222845727276194	3745278
3745272	Web+IR	overview of the trec 2003 web track	2003	11.882584584705784	-13.639770392151501	3745299
3745303	Web+IR	semantic structuring and visual querying of document abstracts in digital libraries	1998	11.652313505389097	-13.255501217121177	3745330
3746040	Web+IR	sheffield interactive experiment at trec-9	2000	11.690737714360804	-13.588347354664775	3746067
3746866	EDA	information extraction for personalised services based on conference alerts	2016	12.040131587022774	-13.064177524417632	3746893
3752390	Web+IR	extracting visually presented element relationships from web documents	2013	11.657890916348276	-12.766332879541373	3752417
3753594	Web+IR	more effective boilerplate removal - the goldminer algorithm	2013	11.455432816922366	-13.573796488363554	3753621
3754414	NLP	semantic analysis for document similarity and search queries	2015	11.465320967535558	-13.127898155344415	3754441
3759175	Web+IR	time to judge relevance as an indicator of assessor error	2012	11.238292541809683	-12.86868536790513	3759202
3760363	Web+IR	ranking documents semantically using ontological relationships	2010	11.305341014362405	-13.333010915707376	3760390
3760840	Web+IR	information extraction from microblog for disaster related event	2017	11.550601086518387	-13.525681688880963	3760867
3761347	NLP	stealing anchors to link the wiki	2008	11.60172954329026	-13.018640735185153	3761374
3761829	ML	combining multiple classifiers for text categorization	2001	11.365542153165446	-13.504818051780912	3761856
3766736	Web+IR	a living lab study of query amendment in job search	2018	11.977965734288675	-12.79644926144807	3766763
3768900	Web+IR	a comparative analysis of the search feature effectiveness of the major english and chinese search engines	2013	11.18169514786735	-13.432283870919287	3768927
3773014	Web+IR	document attrition in web corpora: an exploration	2012	11.604411524454331	-12.734870548221714	3773041
3775618	Web+IR	understanding the specificity of web search queries	2013	11.419034993749184	-13.18377252104509	3775645
3775803	Web+IR	memory organization as the missing link between case-based reasoning and information retrieval in biomedicine	2005	11.19403630377102	-13.58057796503656	3775830
3776071	NLP	identifying named entities in academic biographies with supervised learning	2018	11.813205363546091	-13.325437180245313	3776098
3777318	Web+IR	state of the art in semantic focused crawlers	2009	11.972589494176965	-13.179186793252368	3777345
3778018	NLP	sentiment analysis: a survey	2014	11.74421986822133	-12.712721496220697	3778045
3781070	AI	applying taxonomic knowledge to bayesian belief network for personalized search	2010	11.174133303062714	-12.872699695044739	3781097
3782474	Web+IR	annotate once, appear anywhere: collective foraging for snippets of interest using paragraph fingerprinting	2009	11.239768187241905	-12.810774351639633	3782501
3786611	Arch	automatic faceted navigation	2014	11.462796173311212	-13.198369680045333	3786638
3789936	Web+IR	on topic categorization of pubmed query results	2012	11.902262253361387	-13.332635965267205	3789963
3791247	NLP	query expansion via structural motifs in wikipedia graph	2016	11.234300469111409	-13.338091324211234	3791274
3792313	AI	learning semantic content-based profiles for cross-language recommendations	2011	11.25932415562864	-13.430163468128868	3792340
3796136	Web+IR	retrieval effectiveness on the web	2001	11.404016921286026	-12.690801625499384	3796163
3796536	Web+IR	automatic generation of hypertext knowledge bases	1988	11.898094093289227	-13.212081492043906	3796563
3796549	ML	url as starting point for www document categorization	2000	12.06853749628914	-13.156526380139065	3796576
3798813	Web+IR	in search of a semantic book search engine on the web: are we there yet?	2016	11.85608915121702	-13.050732504323445	3798840
3799166	AI	little knowledge rules the web: domain-centric result page extraction	2011	11.43414405522018	-13.08993167636787	3799193
3799426	Web+IR	web document text and images extraction using dom analysis and natural language processing	2009	11.320336521396177	-13.304702248741972	3799453
3802839	NLP	query expansion based on conceptual and contextual term relationships in wikipedia	2013	11.766917554167554	-13.339616476486693	3802866
3805951	Web+IR	terrier information retrieval platform	2005	11.172555794211409	-13.624336234430235	3805978
3806424	Web+IR	tolerance rough set model and its applications in web intelligence	2013	11.491422328801331	-13.582041023874107	3806451
3806780	Web+IR	the implement of searching engine for educational resources using text clustering	2009	11.733809629475894	-12.986471392969479	3806807
3807386	NLP	reuse in question answering: a preliminary study	2003	12.0643222535287	-12.88330097867282	3807413
3807788	Web+IR	evaluating the retrieval effectiveness of web search engines using a representative query sample	2015	11.471681997733373	-13.22270546241501	3807815
3811043	ML	a web mining approach for finding expertise in research areas	2003	11.75573728429165	-12.70863863543164	3811070
3811755	DB	cold-start user-based weighted collaborative filtering for an implicit recommender system for research facilities	2018	11.741554215771725	-13.052206765173551	3811782
3815325	AI	intelligent content based title and author name extraction from formatted documents	2004	11.771864053733573	-13.469721102048132	3815352
3816567	DB	google's deep web crawl	2008	11.365662906402626	-12.683967133508782	3816594
3818081	Web+IR	do expressive geographic queries lead to improvement in retrieval effectiveness?	2012	11.857132769454164	-13.585705238129313	3818108
3819698	Web+IR	location approximation for local search services using natural language hints	2008	11.4808834331011	-13.341189371083248	3819725
3821003	Visualization	nameclarifier: a visual analytics system for author name disambiguation	2017	11.173521668063906	-13.3476056370594	3821030
3827273	Web+IR	an ontology-based information retrieval model	2005	11.690173984005648	-13.496257167693114	3827300
3830820	Web+IR	human versus machine in the topic distillation task	2004	11.363618847869885	-12.929453541476295	3830847
3832646	DB	dociner: a document indexation tool for learning objects	2009	11.675999528840235	-13.476778184022002	3832673
3833390	NLP	fuzzy-neuro web-based multilingual knowledge management	2006	12.061961212450928	-13.349073193553135	3833417
3833558	ECom	extracting opinions relating to consumer electronic goods from web pages	2006	11.227839034408193	-13.077463073388927	3833585
3834383	AI	knowledge retrieval in lexical ontology-based semantic web search engine	2013	11.807326365076456	-13.218773658659913	3834410
3837196	AI	a wrapper generation system for pdf documents	2008	11.321998955697989	-13.123789887082774	3837223
3838711	NLP	enhancing document clustering through heuristics and summary-based pre-processing	2009	11.401012678231714	-13.485755761197419	3838738
3841931	Web+IR	browsing image collections with representations of common-sense activities	2001	12.002784290789313	-13.050815084922375	3841958
3844946	Web+IR	people search in the enterprise	2007	11.9468759664261	-12.687187895984307	3844973
3846463	AI	automating the construction of internet portals with machine learning	2000	11.94926940627875	-12.770295065867904	3846490
3847829	Web+IR	improving document clustering performance: the use of an automatically generated ontology to augment document representations	2017	11.2465666162462	-13.353224871432795	3847856
3848635	NLP	an identification method of inquiry e-mails to the matching faq for automatic question answering	2010	11.580662648452751	-12.968451318265195	3848662
3854635	Web+IR	does indexing exhaustivity matter?	1973	11.39813950895865	-13.540168466565346	3854662
3856793	Web+IR	an information retrieval system for fire 2016 microblog track	2016	11.977105531714829	-13.186949097166805	3856820
3857494	Web+IR	extirp: baseline retrieval from wikipedia	2006	11.402703671660449	-13.49850365036852	3857521
3863718	Web+IR	retrieval experiments using pseudo-desktop collections	2009	11.326473122428155	-13.31511572395534	3863745
3864493	DB	towards web-scale structured web data extraction	2013	11.244536707715204	-13.3553465476526	3864520
3866279	NLP	alto: active learning with topic overviews for speeding label induction and document labeling	2016	11.36032437788426	-13.093443140271614	3866306
3870674	Web+IR	trec 2016 dynamic domain track overview	2016	11.605032271743585	-12.864829187381066	3870701
3873167	AI	uned @ clef-newsreel 2014	2014	11.973841369867154	-13.451156207677366	3873194
3874129	ML	machine learning and data mining in pattern recognition	2001	11.5417055226363	-13.373705428812249	3874156
3882019	Web+IR	optimal query expansion (qe) processing methods with semantically encoded structured thesauri terminology	2001	11.811966607905529	-13.42397905384084	3882046
3884014	DB	categorizing queries by topic directory	2008	11.211915702861429	-12.98162652045074	3884041
3885562	NLP	dictionary-based sentiment analysis applied to a specific domain	2016	11.312415524019064	-13.554044406103122	3885589
3885949	Web+IR	context-aware search in dynamic repositories of digital documents	2013	11.549601259386401	-13.01717300045913	3885976
3888619	NLP	properties of academic paper references	2004	11.922308798967991	-13.338617048002751	3888646
3888846	DB	using the geographic scopes of web documents for contextual advertising	2010	11.594970280866473	-13.189301085499313	3888873
3889580	DB	mining semi-structured online knowledge bases to answer natural language questions on community qa websites	2014	11.762075814255734	-13.418034465777113	3889607
3890215	HCI	a framework to derive web page context from hyperlink structure	2008	11.231048942447405	-13.586601891313526	3890242
3891349	Visualization	query sense disambiguation leveraging large scale user behavioral data	2015	11.868538128581324	-13.408649705998494	3891376
3893514	DB	extraction of keyterms by simple text mining for business information retrieval	2005	11.540113251135907	-13.118390551370332	3893541
3894285	DB	sema-join: joining semantically-related tables using big table corpora	2015	11.203601970130103	-13.403964319934913	3894312
3895909	DB	iris2: a semantic search engine that does rational research	2014	11.687096098180056	-12.972261051371046	3895936
3896699	AI	refining the results of automatic e-textbook construction by clustering	2007	11.358434906977886	-12.925333882548356	3896726
3899240	Web+IR	early precision measures: implications from the downside of blind feedback	2006	11.717063475375731	-13.344683592352617	3899267
3901355	SE	evaluating the specificity of text retrieval queries to support software engineering tasks	2012	11.203807911372616	-13.145505071275409	3901382
3902005	HCI	a study of relevance feedback techniques in interactive multilingual information access	2012	11.639439477101634	-12.923080127194545	3902032
3902159	Web+IR	inverting semantic structure under open domain opinion mining	2010	11.451098378197587	-12.859951160595298	3902186
3902319	Web+IR	exploiting manual indexing to improve collection selection and retrieval effectiveness	2002	11.288875669631441	-13.198930582280711	3902346
3902989	Web+IR	diversity in photo retrieval: overview of the imageclefphoto task 2009	2009	11.239052930038646	-13.52580716359477	3903016
3903871	Vision	a document retrieval system for assisting creative research	1995	11.595524609128166	-13.53455202430765	3903898
3905649	Graphics	computer classification system usage in citeseer	2008	12.075800606937525	-12.980515463048807	3905676
3907940	Web+IR	ontology construction for information selection	2002	11.699000426844632	-13.580093203467907	3907967
3908386	Web+IR	coverage, relevance, and ranking: the impact of query operators on web search engine results	2003	11.168817711854837	-12.99033843754725	3908413
3908868	Web+IR	a survey on retrieval of mathematical knowledge	2015	11.83260258812815	-12.968935958307373	3908895
3910433	Web+IR	ambiguous author query detection using crowdsourced digital library annotations	2013	11.733085140056104	-13.249336141963914	3910460
3912425	SE	sameness: an experiment in code search	2015	11.94903829892535	-12.861947143589065	3912452
3915302	DB	c-rank: a link-based similarity measure for scientific literature databases	2016	11.190017124549355	-12.778599212074285	3915329
3916556	DB	data file layout inference using content-based oracles	2013	11.562894344302704	-13.048277595662126	3916583
3917556	Web+IR	express: an experimental interface for factual information retrieval	1989	12.068925787579651	-13.466381061194255	3917583
3922817	NLP	the off-topic memento toolkit	2018	11.76127378738991	-12.865186130022344	3922844
3923914	DB	an integrated neural ir system	2001	11.686387634797153	-13.494191036198186	3923941
3926673	Web+IR	an indexing model of html documents	2003	11.280257324643918	-13.362487339282382	3926700
