id	area	title	year	x	y	ix
3235382	AI	creation of a style independent intelligent autonomous citation indexer to support academic research	2004	11.995028132993042	-12.817921205245268	3235409
3236384	Web+IR	theory of retrieval: the retrievability of information	2015	11.769434468526207	-12.901592369220884	3236411
3238935	Web+IR	extracting data from the deep web with global-as-view mediators using rule-enriched semantic annotations	2014	11.729156251841445	-12.855887117195625	3238962
3239002	DB	post-search query modeling in federated web scenario	2014	11.710002323760483	-12.968719901380132	3239029
3242604	AI	supporting system for descriptive quiz in large class - effectiveness of the three-step-view system -	2016	11.926851940219915	-13.542801459541945	3242631
3243254	Web+IR	sonia: a service for organizing networked information autonomously	1998	11.219523878447847	-12.729938205697687	3243281
3243318	Robotics	a web-based theme-related word set construction algorithm	2018	12.030398765315692	-13.516647329551027	3243345
3245198	Web+IR	insights into entity name evolution on wikipedia	2014	11.804791438960233	-13.089273026340454	3245225
3245620	Web+IR	scientometric re-ranking approach to improve search results	2017	11.911604982595769	-13.479146880545402	3245647
3245879	SE	ontology-based similarity measurement in software projects through simreq framework	2010	11.607626480461096	-13.177515090646873	3245906
3246052	Web+IR	the use of categorization information in language models for question retrieval	2009	11.559665211718333	-12.76095516461766	3246079
3246144	Web+IR	concept-based web communities for google™ search engine.	2003	11.185820465809222	-13.086601845196311	3246171
3251996	Web+IR	automatic accessibility evaluation of dynamic web pages generated through xslt	2005	11.438805443168778	-12.903855682214887	3252023
3252048	Web+IR	synthesise web queries: search the web by examples	2005	11.36075205542694	-13.00319871182822	3252075
3253830	ML	towards large-scale exploratory search over heterogeneous sources	2018	12.061799545812988	-12.865560939329992	3253857
3254067	DB	annotating search results from web databases	2013	11.344830010078395	-13.091353900390574	3254094
3254188	AI	modeling wikipedia articles to enhance encyclopedic search	2010	11.880034458812109	-13.114672827033699	3254215
3255391	DB	a survey on region extractors from web documents	2013	11.212901886883015	-12.745012506005144	3255418
3255601	ECom	a personalized multilingual web content miner: pmwebminer	2005	11.149563578293257	-12.766924660473757	3255628
3256139	Web+IR	faceted wikipedia search	2010	11.717137373510552	-12.900851836373874	3256166
3256493	Web+IR	knowledgeseeker — an ontological agent-based system for retrieving and analyzing chinese web articles	2008	11.782500088560502	-13.508446462914042	3256520
3256625	Web+IR	reliable evaluations of url normalization	2006	11.182444831774044	-13.56485691637281	3256652
3256711	Web+IR	leveraging semantic annotations to link wikipedia and news archives	2016	11.228542141650548	-13.104635934996734	3256738
3257086	Web+IR	display of search results in hebrew: a comparison study between google and lcc&k interface	2005	11.992708941455215	-12.978288061957956	3257113
3257442	DB	evaluation of sparql-compliant semantic search user interfaces	2015	11.398767712504617	-13.165212357364386	3257469
3257514	NLP	livingknowledge: a platform and testbed for fact and opinion extraction from multimodal data	2011	11.953180396389678	-12.883025097125602	3257541
3259965	AI	learning personalized tag ontology from user tagging information	2012	11.39063349126077	-12.820514312257805	3259992
3260235	NLP	overview of the inex 2010 ad hoc track	2010	11.723516834510963	-13.014979016453765	3260262
3264014	Web+IR	truncation: all the news that fits we'll print	2014	11.91097694472649	-13.172374074997391	3264041
3264164	NLP	data-driven approaches to information access	2003	12.016375781114931	-12.801116621188907	3264191
3267722	ML	algorithm for extracting loosely structured data records through digging strict patterns	2009	11.220604056457708	-12.969641392683766	3267749
3270514	Web+IR	gauging the quality of relevance assessments using inter-rater agreement	2017	11.171789938815536	-13.034880323260614	3270541
3272598	Graphics	dynamic element retrieval in a structured environment	2006	11.47548897554643	-13.547463574202645	3272625
3276511	DB	roxxi: reviving witness documents to explore extracted information	2010	11.531091100902	-12.768863088953257	3276538
3276961	Web+IR	experiences in evaluating multilingual and text-image information retrieval	2006	11.628810965189988	-13.348010534116387	3276988
3279232	Web+IR	processsearch: a framework to search for business processes on the web	2013	11.493293727244954	-13.464199935467885	3279259
3287519	Web+IR	relevance feedback between web search and the semantic web	2011	11.502679777540695	-13.40024003655966	3287546
3288831	Web+IR	selection fusion in semi-structured retrieval	2013	11.17760603685544	-13.35287541905472	3288858
3292274	ML	mining knowledge from text collections using automatically generated metadata	2002	11.728180551820548	-13.461808221949381	3292301
3293363	Web+IR	scifinder scholar 2006: an empirical analysis of research topic query processing	2006	12.055833934040187	-13.243524812307653	3293390
3295850	Web+IR	results of the 2016 entity summarization evaluation campaign (ensec 2016)	2016	11.650112341137467	-13.332674116843931	3295877
3299061	SE	evaluation and comparison of search engines using the lsp method	2006	11.555082163598314	-13.08910838642103	3299088
3306000	DB	reprint of: computational approaches for mining user's opinions on the web 2.0	2015	11.70449782570696	-12.751323941035357	3306027
3306029	HCI	searching the wikipedia with public online search engines	2010	11.659077140564461	-13.290874010884686	3306056
3306480	DB	an algorithm for classifying articles and patent documents using link structure	2008	11.720820435883095	-13.463059118231332	3306507
3307969	NLP	pies: a web information extraction system using ontology and tag patterns	2005	11.178570771201754	-13.121330029566815	3307996
3315351	Web+IR	semantic search for enterprises competencies management	2010	12.099650828018275	-13.496368662718286	3315378
3319082	ML	a comparison of layout based bibliographic metadata extraction techniques	2012	11.651084467365092	-13.468519569441796	3319109
3320899	AI	automatic embedding of social network profile links into knowledge graphs	2018	11.169037362322458	-13.32571725506442	3320926
3321238	ML	heuristics for fixing common errors in deployed schema.org microdata	2015	11.845279117425678	-13.20468792598425	3321265
3325066	HCI	usability aspects of the inside-in approach for ancillary search tasks on the web	2015	11.366315206490171	-12.757040807477605	3325093
3328847	NLP	automatic checking of alternative texts on web pages	2010	11.33081427804484	-13.215222062982109	3328874
3330876	DB	seed: a system for entity exploration and debugging in large-scale knowledge graphs	2016	11.164893908568661	-13.471276927565524	3330903
3332131	EDA	a quantitative method for rss based applications	2007	11.550208322467412	-12.840632100727792	3332158
3333901	AI	trtml - a tripleset recommendation tool based on supervised learning algorithms	2014	11.494133900808961	-13.248116281362055	3333928
3334314	Web+IR	distilling informative content from html news pages	2009	11.219941008188737	-12.913170976667333	3334341
3339920	Web+IR	enterprise, qa, robust and terabyte experiments with hummingbird searchserver at trec 2005	2005	12.013961545269474	-13.575973115089333	3339947
3341761	Web+IR	automatic generation of thematically focused information portals from web data	2006	11.283786773742627	-12.793950748780885	3341788
3345273	Web+IR	document retrieval and text retrieval	1993	11.663868933529775	-13.371418915645055	3345300
3345394	DB	sharding for literature search via cutting citation graphs	2014	11.38447222166906	-13.16910600542916	3345421
3346132	Web+IR	query difficulty for digital libraries	2009	11.385440062123694	-12.751488030825724	3346159
3346731	AI	exploring the knowledge in semi structured data sets with rich queries	2008	11.679232066745426	-13.129526460931224	3346758
3349139	Web+IR	a study on mental models of taggers and experts for article indexing based on analysis of keyword usage	2014	11.2505334524263	-13.532563061219964	3349166
3349225	Web+IR	ontoportal: an ontology-supported portal architecture with linguistically enhanced and focused crawler technologies	2009	11.829880610851461	-13.40935294574297	3349252
3350991	DB	querysem: deriving query semantics based on multiple ontologies	2011	11.180689691938019	-13.217873028974838	3351018
3351198	Web+IR	"""building on redundancy: factoid question answering, robust retrieval and the """"other"""""""	2005	11.508979036231263	-12.838645320318749	3351225
3351703	ML	alias: author disambiguation in microsoft academic search engine dataset	2014	11.236318894170866	-13.307260183388387	3351730
3352228	AI	web wrapper induction: a brief survey	2004	11.481671820240093	-12.97764396129068	3352255
3357680	AI	dblp-filter: effectively search on the dblp bibliography	2014	11.519620432631413	-12.965140246512565	3357707
3360433	ML	improving full text search with text mining tools	2009	11.592060184357992	-13.444280663734428	3360460
3361480	ML	open domain event extraction from twitter	2012	11.309339333041525	-13.046457762980108	3361507
3361795	Web+IR	beyond boolean search: flexicon, a legal tex-based intelligent system	1991	12.075268965363689	-13.244346502105458	3361822
3367988	Web+IR	link analysis of wikipedia documents using mapreduce	2015	11.655535201154105	-13.524876893926473	3368015
3371007	Web+IR	financial activity mining from online multilingual news	2004	11.518673916382806	-12.734696881304062	3371034
3371711	Metrics	search engine of mentions of russian companies on the internet	2014	12.10080234874156	-13.474479052584947	3371738
3374418	Web+IR	automatically generating effective search queries directly from community question-answering questions for finding related questions	2017	11.684280649717708	-13.076768653429218	3374445
3375311	DB	a novel approach for compound document matching	2006	11.633119234649778	-13.143714830111186	3375338
3377137	AI	citeseer x : a scholarly big dataset	2014	12.047701094087332	-13.016188516897552	3377164
3377796	Web+IR	automatically indexing documents: content vs. reference	2002	11.817380715535158	-12.822047800118913	3377823
3378128	DB	incorporating breadth first search for indexing mathml objects	2008	11.555214364151135	-13.231782760018143	3378155
3379540	Web+IR	searching xml documents - preliminary work	2005	11.257484605254863	-13.472626536536401	3379567
3383903	NLP	pagination: it's what you say, not how long it takes to say it	2014	11.91045573323956	-13.191746196119466	3383930
3384072	HPC	smart searching system for virtual science brain	2011	11.887118083677349	-12.850864636873819	3384099
3384211	SE	data-driven semantic concept analysis for user profile learning in 3g recommender systems	2015	11.769504038347074	-13.562802314825962	3384238
3384269	Web+IR	a dempster-shafer indexing for the focussed retrieval of a hierarchically structured document space: implementation and experiments on a web museum collection	2000	11.309510311399212	-12.865832998082507	3384296
3384702	Theory	journal ranking by different parameter. part i. collectivity and selective collectivity: two ranking parameters reflecting the structure of a journal network	1990	11.737415995992956	-12.979879764747366	3384729
3389172	Robotics	effective ontology-based search for educational resources exploiting semantic similarity	2008	11.583594180859187	-13.311130016483743	3389199
3391552	NLP	a web mining method based on personal ontology for semi-structured rdf	2005	11.370996626068266	-12.791040605881856	3391579
3392639	Web+IR	research area classification using wikipedia and information retrieval	2017	11.956963747232608	-13.479043084570556	3392666
3396948	NLP	read article management in document search process for ntcir-9 visex task	2011	11.349816117447286	-12.77906755943708	3396975
3397405	Web+IR	report on the trec-9 experiment: link-based retrieval and distributed collections.	2000	11.504992978942651	-13.3998403588887	3397432
3397438	Web+IR	improving automated controversy detection on the web	2016	11.35612467916049	-12.715519005502912	3397465
3398357	Web+IR	an analysis of topical coverage of wikipedia	2008	12.09787455030049	-13.145672261169707	3398384
3398891	Web+IR	system description: egomath2 as a tool for mathematical searching on wikipedia.org	2011	11.662078443794938	-13.38017121994648	3398918
3399403	Web+IR	a template-based approach to summarize xml collections	2005	11.200335306817443	-13.539198309763893	3399430
3400516	DB	a survey on visual query systems in the web era (extended version)	2017	12.048634795101664	-12.771423972794151	3400543
3401214	DB	design and implementation of a web news extraction system	2011	11.962595390181761	-12.795950688327126	3401241
3402607	NLP	geotagging aided by topic detection with wikipedia	2011	11.609356136118262	-13.569002572230998	3402634
3406086	Web+IR	a wikipedia–based approach to conceptual indexing and retrieval of documents	2014	11.884345475887566	-13.624072952940574	3406113
3406695	HCI	networks of names: visual exploration and semi-automatic tagging of social networks from newspaper articles	2014	11.277918122917194	-12.793590859395175	3406722
3408286	Web+IR	machine learning for query-document matching in search	2012	11.923477048797928	-13.010639704219864	3408313
3409526	AI	summarizing web sites automatically	2003	11.239962354772013	-12.89580618139976	3409553
3409621	NLP	smart searching system for biomedical information	2012	12.052386450311895	-13.332987447469067	3409648
3414213	DB	the mirror dbms at trec-9	1999	11.641558960573088	-13.228888331145784	3414240
3414349	Web+IR	xdoc: a system for xml based document annotation and searching	2009	11.56419267161715	-13.16763240970356	3414376
3414874	Web+IR	aesthetics: analytics with strings, things, and cats	2014	12.06163102508286	-13.106602967193718	3414901
3415290	Web+IR	automatic text summarization based on the global document annotation	1998	11.89046737746221	-12.786735409452586	3415317
3415644	Vision	semantic annotation and retrieval of images in digital libraries	2009	11.950103876621721	-13.211801458444073	3415671
3416898	Web+IR	the many shapes of archive-it	2018	11.844109313919198	-12.738939998178859	3416925
3420670	Web+IR	toward automatic answers in user-interactive question answering systems	2011	11.821843694555053	-13.221915118130072	3420697
3421718	Web+IR	using topic shifts in content-oriented xml retrieval	2009	11.339255748953088	-13.625574817828689	3421745
3424205	AI	stochastic simulations of web search engines: rbf versus second-order regression models	2004	11.325509382987356	-13.273396514492633	3424232
3424217	Web+IR	a cross-domain recommender system based on common-sense knowledge bases	2017	11.320552355104669	-13.591729407516466	3424244
3426203	Web+IR	semantic relatedness hits bibliographic data	2009	11.71406090490318	-13.498937952111822	3426230
3427004	NLP	the one comparing narrative social network extraction techniques	2018	12.078952590280988	-12.768617710423307	3427031
3429487	Web+IR	blogforever crawler: techniques and algorithms to harvest modern weblogs	2014	11.241468624625846	-12.721476270300588	3429514
3430291	DB	data extraction and annotation based on domain-specific ontology evolution for deep web	2011	11.374355439038588	-13.248119886217909	3430318
3438603	ML	incorporating terminology evolution for query translation in text retrieval with association rules	2010	12.04818483708905	-13.524140717990715	3438630
3439776	Web+IR	data extraction from web database query result pages via tagsets and integer sequences.	2003	11.211515080005787	-12.864451155289862	3439803
3441879	Web+IR	an interface sketch for queripidia: query-driven knowledge portfolios from the web	2015	11.536300404821429	-12.872869031714215	3441906
3447076	Web+IR	evaluating leading web search engines on children's queries	2011	11.171904469293967	-12.922695117004954	3447103
3450957	ML	semantic association rule mining in text using domain ontology	2017	12.085228503249136	-13.557857008251734	3450984
3451623	Web+IR	sttm: a tool for short text topic modeling	2018	11.390743072078395	-12.87393840040226	3451650
3452263	Web+IR	deriving quantitative overviews of free text assessments on the web	2006	11.278797435977983	-13.081561567103806	3452290
3453036	Web+IR	on learning researchers' dynamic information needs: an entropy-based query expansion approach	2012	11.482867145163448	-12.763509650010427	3453063
3455078	Robotics	search engine focused on multiple features of scientific articles	2012	11.663262786276189	-13.135111912551913	3455105
3465093	Web+IR	un método eficaz de indexación para la recuperación de imágenes en archivos en formato pdf	2010	11.853441658569231	-13.223988278235982	3465120
3465830	Web+IR	mining opinions from the web: beyond relevance retrieval	2007	11.375552652582385	-12.700625837038764	3465857
3467182	Web+IR	automatic inclusion of semantics over keyword-based linked data retrieval	2014	12.094168347733556	-13.460474459442766	3467209
3469231	Web+IR	work in progress: effects of multiple words on ambiguity in information retrieval	2008	11.180235288224692	-13.365724573778369	3469258
3471791	Web+IR	text mining in 'request for comments document series'	2002	11.162345949956201	-13.017015985633734	3471818
3474778	DB	development and application of optimization model for customized text summarization	2013	11.520998016697616	-12.779276620078955	3474805
3475776	NLP	interactive multimedia summaries of evaluative text	2006	11.967053651016725	-13.135270117189732	3475803
3476334	ML	measuring self-focus bias in community-maintained knowledge repositories	2009	11.467818751322126	-13.241143707386833	3476361
3478692	AI	taxonomic semantic indexing for textual case-based reasoning	2010	11.772050275520018	-13.2394248458086	3478719
3480088	Web+IR	learning knowledge from user search	2015	11.436388916719364	-13.20899793682818	3480115
3482500	NLP	generating and retrieving text segments for focused access to scientific documents	2006	11.876564746754033	-13.221785413588725	3482527
3482521	ML	interactive gp for data retrieval in medical databases	2003	11.533522565656	-13.24433648982066	3482548
3482710	Web+IR	enriching product ads with metadata from html annotations	2016	11.738040041271265	-13.172867592583478	3482737
3483831	Web+IR	a visualization tool of probabilistic models for information access components	2009	11.227197025539734	-13.190375594154778	3483858
3485365	Web+IR	a corpus of realistic known-item topics with associated web pages in the clueweb09	2015	11.350854621309633	-12.773313178898327	3485392
3485642	DB	increasing ner recall with minimal precision loss	2013	11.491334959372196	-13.265004481661695	3485669
3487309	Web+IR	knowledge discovery in web-directories: finding term-relations to build a business ontology	2005	11.165789417052707	-12.782827648259532	3487336
3487616	Web+IR	a search engine for rdf metadata	2004	11.260090498703205	-13.249381827742214	3487643
3488871	DB	an application of text mining: bibliographic navigator powered by extended association rules	2000	11.374857648110984	-12.929601647591694	3488898
3490431	Web+IR	exploiting citation contexts for physics retrieval	2015	11.737634911893473	-13.557541216212087	3490458
3490999	Web+IR	geographic information retrieval to suit immediate surroundings	2009	11.205684697420391	-13.26032772783666	3491026
3491513	Web+IR	tagpedia: a semantic reference to describe and search for web resources	2008	11.738996102742643	-13.561830752790135	3491540
3492757	Web+IR	query expansion in enterprise search	2018	12.012980867295143	-13.034589115578232	3492784
3496909	ML	discovering research key terms as temporal patterns of importance indices for text mining	2010	11.549203680826096	-12.875496536080028	3496936
3497815	Web+IR	lexical analysis for modeling web query reformulation	2007	11.46078446768521	-12.92371568190566	3497842
3500077	DB	semantic ranking and result visualization for life sciences publications	2010	11.95422217523785	-13.16121714500954	3500104
3501791	ML	context-based classification for link data	2004	11.234825527346182	-12.919062304867573	3501818
3501923	Web+IR	a conceptual approach to web image retrieval	2008	11.21843117116758	-13.636653052153184	3501950
3502537	DB	multimodal attribute extraction	2017	11.251407249380078	-12.71359935777735	3502564
3502831	AI	evaluating ontology cleaning	2004	11.766510884747252	-13.58940639486792	3502858
3505209	AI	a knowledge learning approach to information extraction from multiple text based web sites	2004	11.166751781969683	-13.531539687169968	3505236
3508296	Web+IR	a comparison of metadata extraction techniques for crowdsourced bibliographic metadata management	2012	11.51375705430292	-13.398179831092223	3508323
3524845	Web+IR	crowdterrier: automatic crowdsourced relevance assessments with terrier	2012	11.558660236481929	-13.549143972273841	3524872
3525773	Web+IR	a proposal of a temporal semantics aware linked data information retrieval framework	2017	11.506270745385489	-13.454943730048802	3525800
3526105	AI	semantic grounding of social annotations for enhancing resource classification in folksonomies	2014	11.545548412967706	-13.633077180667513	3526132
3527627	ML	development of a patent matching system using a hybrid approach	2006	11.186825191344822	-13.49386359833755	3527654
3529740	DB	wc3: wikipedia category consistency checker based on dbpedia	2015	11.805274093217296	-13.613473813354574	3529767
3530195	NLP	nerdle: topic-specific question answering using wikia seeds	2014	11.8890346690106	-13.162857885635118	3530222
3532614	AI	extracting semantics relationships between wikipedia categories	2006	11.420789508667626	-12.959189869167774	3532641
3532701	Web+IR	tag-based algorithms can predict human ratings of which objects a picture shows	2011	11.373351821274788	-12.714996972639675	3532728
3533233	Web+IR	extraction of evolution descriptions from the web	2014	11.52542924814106	-13.382639588010536	3533260
3534395	NLP	linksum: using link analysis to summarize entity data	2016	11.347396787462046	-13.473322535629348	3534422
3539212	DB	temporal query intent disambiguation using time-series data	2016	11.369318070642517	-13.065779475160587	3539239
3541022	Web+IR	using coreference in question answering.	1999	11.579069503969803	-13.601083539343376	3541049
3542198	AI	personal ontologies: generation of user profiles based on the yago ontology	2013	11.208656556838058	-13.299777285682008	3542225
3542269	DB	exploiting the information web	2007	11.541150144547212	-12.88408743060716	3542296
3542835	DB	post-analysis of keyword-based search results using entity mining, linked data, and link analysis at query time	2014	11.624694980301376	-13.405245565672713	3542862
3543326	Web+IR	esfinge - a question answering system in the web using the web	2006	11.964542492219934	-13.41575636778875	3543353
3543710	Web+IR	using a graph-based data mining system to perform web search	2003	11.354090754944876	-13.01571998437158	3543737
3546526	Web+IR	architecture of a concept-based information retrieval system for educational resources	2014	11.611851675653732	-13.451188207609196	3546553
3547996	Web+IR	characteristics of character usage in chinese web searching	2009	12.010797727968216	-12.910071493351245	3548023
3548509	AI	wiki-rec: a semantic-based recommendation system using wikipedia as an ontology	2010	11.506391729851767	-12.78467091843981	3548536
3550283	Web+IR	identifying latent semantics in high-dimensional web data	2013	11.294550625352983	-13.341827769772141	3550310
3550631	Web+IR	relevance feedback using semantic association between indexing terms in large free text corpuses	2004	11.878096265749855	-13.304476152703137	3550658
3551344	Web+IR	managing déjà vu: collection building for the identification of nonidentical duplicate documents	2006	11.45916811045642	-12.904697224953518	3551371
3566008	ML	feature extraction for the author name disambiguation problem in a bibliographic database	2017	11.916326989033902	-13.041539712909902	3566035
3566771	Web+IR	semantic pattern for user-interactive question answering	2006	11.183886315927491	-13.591151173555508	3566798
3567538	AI	discovering the semantics of keywords: an ontology-based approach	2006	11.873538445843971	-13.632817910773925	3567565
3569978	NLP	what's the issue here?: task-based evaluation of reader comment summarization systems	2016	11.90631005738393	-13.276232738140195	3570005
3570124	NLP	topical categorization of search results based on a domain ontology	2011	11.289475562695598	-13.290813170981238	3570151
3570448	AI	measuring similarity between ontologies	2002	11.667024142516807	-13.115614220788796	3570475
3571529	DB	survey of plagiarism detection approaches and big data techniques related to plagiarism candidate retrieval	2017	11.884719889735305	-13.262797828958117	3571556
3571789	AI	answering engineers' questions using semantic annotations	2007	11.737420199487353	-13.270598068706002	3571816
3571971	Web+IR	towards the self-annotating web	2004	11.682957942032187	-13.422244088111167	3571998
3574497	AI	vector space model of information retrieval - a reevaluation	1984	11.752121769726564	-12.810729579938565	3574524
3576003	DB	measuring quality of collaboratively edited documents: the case of wikipedia	2016	11.775322213515935	-13.079317367062414	3576030
3577025	AI	book recommendation based on social information	2013	11.419712497578779	-12.860914420814593	3577052
3577027	Web+IR	semantic search: from document retrieval to virtual assistants.	2015	11.257729920837093	-13.519085961439655	3577054
