id	area	title	year	x	y	ix
3955085	Web+IR	ontology-based recommender system for cots components	2017	12.050971795699894	11.05522362413884	3955112
3955201	Robotics	a service discovery framework based on linear composition	2007	11.64165502215393	10.669296057325173	3955228
3957343	HPC	dynamic computational workflows: discovery, optimisation and scheduling	2007	11.550447364896064	10.924535683457803	3957370
3959937	SE	separating operational and control behaviors: a new approach to web services modeling	2010	11.487427369741564	10.643515300590554	3959964
3960703	Web+IR	applications of norm and situation calculus in the semantic web service composition	2010	11.80811656323543	10.78911216156026	3960730
3961282	DB	model-driven specification of adaptive cloud-based systems	2012	11.405662776446324	10.991907043885424	3961309
3964437	AI	ontopipeliner: an ontology-based automatic semantic service pipeline generator	2011	11.850200722633152	10.85556830243532	3964464
3965027	DB	implementation of policy based management in workflow management system	2006	11.37994577686022	10.516007430605974	3965054
3968028	Web+IR	ontology translation for interoperability among semantic web services	2005	11.95952506261385	10.783118466473224	3968055
3972880	Vision	modeling and composing service-based nd reference process-based multi-enterprise processes	2000	11.3563839641611	10.326418047555103	3972907
3973209	Web+IR	fuzzy constraint-based schema matching formulation	2008	11.549011570195555	10.965079107020514	3973236
3975357	DB	toward aspect oriented services coordination for building modern information systems	2004	11.300537617036527	10.495670417975726	3975384
3977719	SE	reuse-oriented deployment of software components: congregation in service-oriented development	2009	11.44473706796384	11.19055609660565	3977746
3980133	Web+IR	using interaction models to detect and resolve inconsistencies in evolving service compositions	2009	11.331899292155269	10.401683345533558	3980160
3983333	DB	an unabridged method concerning capability matchmaking of web services	2006	11.88627529231625	11.045560727940817	3983360
3988042	HPC	enabling efficient service distribution using process model transformations	2016	11.575075709649733	10.995781304762783	3988069
3988078	SE	assessing service protocols adaptability using protocol reduction and graph-search with backtracking techniques	2009	11.61586221880558	11.221633719932747	3988105
3988594	Mobile	swrl rule based precondition and effects service matching	2012	11.88512547999321	10.998920572278426	3988621
3989066	AI	enabling automatic certification of online auctions	2014	11.244010485495375	10.442934583220486	3989093
3990294	PL	type based service composition	2004	11.743651996467829	11.215380829263943	3990321
3990425	SE	wsrd: a web services registry description	2010	11.891393414497411	11.011583622128178	3990452
3995577	Robotics	building fca-based decision trees for the selection of heterogeneous services	2011	11.527328932058161	11.060045675557712	3995604
3997112	PL	service-oriented architecture: introducing a query language	2008	11.802754027311266	11.274214625096006	3997139
4000868	Web+IR	a coordination model for the semantic web	2006	11.429296431701426	11.083207925568528	4000895
4001222	SE	extending the ws-humantask architecture to support the resource perspective of bpel processes	2013	11.644527275837204	10.940552807489246	4001249
4001592	OS	towards a dynamic and adaptable application server	2009	11.40127789896096	10.718776978310128	4001619
4002615	SE	data mapping web services for composite daas mediation	2012	11.648647811680592	11.114744617588403	4002642
4002624	Web+IR	on using ws-policy, ontology, and rule reasoning to discover web services	2004	11.982038391577165	11.185302338402565	4002651
4002730	AI	building agent community toward business knowledge base generation	1998	11.753590683669891	10.35535775814413	4002757
4003564	Embedded	distributed execution of s-bpm business processes	2010	11.403946592955153	10.563324146142287	4003591
4006152	AI	web service contracting: specification and reasoning with sciff	2007	11.318600954125307	10.37584176206685	4006179
4006261	SE	dynamic service composition: a discovery-based approach	2008	11.318673433315256	11.237515352809782	4006288
4006372	SE	an agent-based approach for composition of semantic web services	2008	11.836701986653313	10.41490815720402	4006399
4006700	Web+IR	an investigation into dynamic web service composition using a simulation framework	2013	11.883252940036273	11.079204263878774	4006727
4006898	ML	taxonomy and description of policy combination methods	2001	11.28895734250032	11.282972467169378	4006925
4008442	Robotics	dynamic behavior personalization using the meta model	2008	11.223799185180313	10.417433749438727	4008469
4009051	SE	context-aware process injection - enhancing process flexibility by late extension of process instances	2015	11.639649475080331	10.903514262566087	4009078
4009632	Mobile	classifying interoperability conflicts	2003	11.283022711623635	10.43655841300567	4009659
4011066	Metrics	ontology-based service component model for interoperability of service systems	2008	11.87240577814961	10.925903525782731	4011093
4012408	AI	semantic web service composition based on a closed world assumption	2006	11.65468404415407	10.366668456037363	4012435
4014416	SE	repair vs. recomposition for broken service compositions	2010	11.556185210273282	10.345714133981355	4014443
4014963	SE	a graph-based qos-aware method for web service composition with branching	2016	11.44459840222059	11.159664174358161	4014990
4017325	Web+IR	ontology-dependent two-phase semantic web services discovery and its e-government implementation	2011	11.74935482053151	10.343572014592262	4017352
4019727	Web+IR	bpel-rf: a formal framework for bpel orchestrations integrating distributed resources	2012	11.259336596159365	11.055506773646435	4019754
4020184	SE	object-oriented modeling approaches to agent-based workflow services	2003	11.540967016126194	10.634474223490267	4020211
4021155	SE	service selection based on non-functional properties	2007	11.508691838116526	11.111331305599759	4021182
4021993	Web+IR	exception management within web applications implementing business processes	2006	11.258231931363575	10.723957248172344	4022020
4024152	SE	hierarchical composition of owl-s web services	2008	11.217194187508971	11.195600939391928	4024179
4024947	HPC	community-based service discovery	2006	11.960808043131282	11.258288860092218	4024974
4025184	Web+IR	generating an excerpt of a service level agreement from a formal definition of non-functional aspects using owl	2014	11.96706371723181	10.962801947067485	4025211
4025899	Web+IR	matching independent global constraints for composite web services	2008	11.929285696185286	11.089604048987004	4025926
4027065	Robotics	adaptive service composition based on runtime requirements monitoring	2011	11.26388901496172	10.953074938793266	4027092
4028018	DB	algorithms and contracts for network and systems management	1999	11.690442979520132	10.338283624383637	4028045
4028034	Web+IR	describing next generation communication services: a usage perspective	2008	11.19399770991255	11.183051466634591	4028061
4028704	Web+IR	position paper: a grid service discovery matchmaker based on ontology description	2002	11.805263315038994	10.986405857923259	4028731
4029849	Web+IR	web component: a substrate for web service reuse and composition	2002	11.828619789234557	10.596585434383089	4029876
4029968	Web+IR	an approach to semantic matching of web services	2006	11.900523294281856	11.078827309526858	4029995
4030921	Security	supervision décentralisée des chorégraphies de services	2013	11.72193958312488	10.56821377215507	4030948
4034032	DB	on qos web service composition using satisfiability	2015	11.63206540427581	11.087474614926084	4034059
4035584	SE	a compositional trust model for predicting the trust value of software system qos properties	2012	11.274472744848955	10.675413693669485	4035611
4037043	SE	process support for tools interoperability	2002	11.386032682702515	10.42252362244412	4037070
4040807	Mobile	a mashup architecture with modeling and simulation as a service	2015	11.275340677326586	10.650984145808946	4040834
4041619	AI	xdependency: maintaining relationships between xml data resources	2003	11.199314692433417	10.96078397617593	4041646
4041915	HPC	sgrid: a service-oriented model for the semantic grid	2004	11.483054203494575	10.47066913359528	4041942
4043263	Robotics	semantic web-service discovery and composition using flexible parameter matching	2007	11.637549731490202	10.976885220765734	4043290
4044364	DB	xml-based monitoring of services and dependencies	2001	11.458022940684414	10.535230145358973	4044391
4045742	HPC	large scale, type-compatible service composition	2004	11.732136978535474	11.176238571880072	4045769
4046069	Web+IR	a succinct analysis of web service composition	2006	11.712299609807427	10.410439188807912	4046096
4046354	HPC	research on dynamic service composition based on object petri net for the networked information system	2009	11.567993521539163	10.523576092345026	4046381
4048302	DB	a general framework for the execution of heterogenous programs in workflow management systems	1996	11.758992119692287	10.590891178446421	4048329
4050134	SE	interaction protocols adaptation based coordination for business processes	2014	12.050899414320364	10.455598605838702	4050161
4050636	SE	a web of things based device-adaptive service composition framework	2016	11.523895370994484	10.992888085888106	4050663
4053180	HPC	an owl-s based approach to express grid services coordination	2005	11.704535244322088	10.827720502263913	4053207
4056994	HPC	semantic tools for workflow construction	2006	11.903771845612846	10.52793932205464	4057021
4057356	SE	an approach to service adaptation for exploratory application construction	2012	12.062123973311484	10.454376743990807	4057383
4057606	SE	towards nfc-aware process execution for dynamic environments	2011	11.229096157981504	11.001911196294401	4057633
4057926	PL	a generic xacml based declarative authorization scheme for java	2005	11.861590963234935	11.070307536653239	4057953
4059976	Robotics	business object modeling, validation, and mediation for integrating heterogeneous application systems	2001	12.055420452630957	10.495277595156134	4060003
4061456	Web+IR	embedding agents in business processes using enterprise integration patterns	2013	11.193484662764302	11.1267390467661	4061483
4061565	Web+IR	formulation of hierarchical task network service (de)composition	2007	11.293785659798123	10.366508220575778	4061592
4061978	Web+IR	middleware between owl and fipa ontologies in the semantic grid environment.	2006	11.648707682663051	10.750797112130867	4062005
4062815	Robotics	dynamic service reconfiguration and enactment using an open matching architecture	2009	11.53222193960706	10.829837358356972	4062842
4063880	AI	possibilistic petri nets as a basis for agent service description language	2004	11.818119255855436	11.026249106484814	4063907
4064326	Web+IR	a request oriented model forweb services	2013	11.795246577142446	10.9166924208551	4064353
4064841	HCI	enabling smart workflows over heterogeneous id-sensing technologies	2012	11.236870216090754	10.848607088156903	4064868
4066318	Web+IR	ontology mediation in wsmx	2004	11.169350969077582	10.798621418126336	4066345
4068839	SE	runtime configurable service process model	2010	11.458940894253473	10.833916286920099	4068866
4068917	Web+IR	an approach to manage ontology dynamically based on web service composition requests	2012	11.885050332985044	11.139996190621735	4068944
4070227	Web+IR	a session-based ontology alignment approach enabling user involvement	2017	11.644777216073749	10.656815789718788	4070254
4070820	SE	asg - techniques of adaptivity	2007	11.219934918901648	10.815288343289405	4070847
4070897	Robotics	web service discovery and composition using usdl	2006	11.646539944811952	10.69176858954198	4070924
4071495	DB	the tucson coordination infrastructure for virtual enterprises	2001	11.571511898200937	10.349653578251724	4071522
4072225	NLP	dmaas: syntactic, structural and semantic mediation for service composition	2016	11.86219797995631	10.697026150617946	4072252
4075695	Web+IR	model-driven performability analysis of composite web services	2008	11.418660826366635	11.092155361624295	4075722
4076698	SE	toward an agent-based and context-oriented approach for web services composition	2005	11.807227670485814	11.228854770446285	4076725
4078190	Embedded	event-b based approach for verifying cloud resource allocation in business process	2015	11.601822508037994	11.165371843801816	4078217
4078699	SE	filling the gap - extending service oriented architectures with semantics	2006	11.864834822715295	10.4337580650602	4078726
4079207	DB	behaviour approach for composite owl-s services discovery	2017	11.748064042413548	10.948078426890321	4079234
4080880	SE	development of xml-based software and service commerce language xscl and javabeans player	2000	11.212750327742366	10.334582244268127	4080907
4085448	SE	a method for composing process of nondeterministic web services	2004	11.261288629090226	10.840719264725964	4085475
4085870	Web+IR	dynamic service matchmaking in intelligent web	2004	11.774686149418777	11.118504728923435	4085897
4087730	SE	policy driven configuration management of network devices	1996	12.088349173203314	10.683269448010591	4087757
4089098	SE	towards a semantic engine for cloud applications development	2012	11.383858657862852	10.969518813283539	4089125
4089394	Web+IR	abstracting and enforcing web service protocols	2004	11.667053293036926	10.481137359291136	4089421
4089838	Web+IR	mediating heterogeneous web services	2003	11.942400141927852	10.969407761756662	4089865
4089988	AI	planning for web services the hard way	2003	11.801728679187876	10.417625883825243	4090015
4092664	Web+IR	automatic dynamic web service composition: a survey and problem formalization	2011	11.709888414348393	10.85259259200299	4092691
4095259	Web+IR	interoperability description of web services based application servers	2012	11.99967018170774	10.422886753154817	4095286
4097739	HPC	an approach for multiple-instance based service composition	2015	11.612163598392188	11.065290039830222	4097766
4097968	Mobile	regsop: a registry for service oriented programming with behavior based discovery	2012	11.276367492961846	10.860826862369917	4097995
4098234	SE	mashup model and verification using mashup processing network	2008	11.446608528117302	10.549494976792527	4098261
4100670	SE	a framework for requirents monitoring of service based systems	2004	11.262196414218614	10.390307652038118	4100697
