id	area	title	year	x	y	ix
3939753	Vision	real-time temporal action localization in untrimmed videos by sub-action discovery.	2017	-4.2166220022366465	-13.065173857206206	3939780
3940076	Vision	coupling-and-decoupling: a hierarchical model for occlusion-free car detection	2012	-4.008263210055079	-13.224984429191696	3940103
3941098	Vision	boxcars: improving vehicle fine-grained recognition using 3d bounding boxes in traffic surveillance	2017	-3.621604506842123	-13.304222497198362	3941125
3943232	Vision	a binary tree for probability learning in eye detection	2005	-3.7766601708665246	-13.247611586349207	3943259
3943721	Robotics	object localization based on sparse representation for remote sensing imagery	2014	-4.089829822744869	-13.635570935363358	3943748
3945029	Vision	learning hybrid image templates (hit) by information projection	2012	-3.4579980548123226	-13.614756620341867	3945056
3948937	Vision	background subtraction using multiscale fully convolutional network	2018	-3.545527772097503	-12.86227907187276	3948964
3949344	Vision	boosted human head pose estimation using kinect camera	2015	-4.25153392721138	-13.36010125500928	3949371
3949544	Vision	robust visual tracking via bag of superpixels	2015	-3.950965378036877	-13.35375457925107	3949571
3953897	Vision	learning policies for efficiently identifying objects of many classes	2006	-3.945497414689589	-13.556888346113762	3953924
3955534	Vision	robust tracking via convolutional networks without learning.	2015	-3.6902134850273343	-12.900237861058455	3955561
3956454	AI	joint temporal-spatial information and common network consistency constraint for person re-identification	2017	-3.757125361911255	-12.695898774506908	3956481
3959298	Robotics	character segmentation in text line via convolutional neural network	2017	-3.4059536875282093	-13.617999391430626	3959325
3960547	Vision	learning spatial transforms for refining object segment proposals	2017	-3.5967379373964716	-13.014803431762244	3960574
3961065	Vision	evaluating superpixels in video: metrics beyond figure-ground segmentation	2013	-3.367347942862029	-12.988701525040685	3961092
3961158	Vision	dual-svm tracker via multiple support instance and lever strategy	2018	-4.060767114351181	-12.743986124540514	3961185
3961551	Vision	multi-target tracking in team-sports videos via multi-level context-conditioned latent behaviour models	2014	-3.9673775836932736	-13.079363049524884	3961578
3963235	Vision	object localization based on proposal fusion	2017	-3.5241411660219937	-12.737855914323747	3963262
3967801	Vision	learning to integrate occlusion-specific detectors for heavily occluded pedestrian detection	2016	-4.153500899836989	-13.0626951961509	3967828
3968503	Robotics	localization of mobile robots with topological maps and classification with reject option using convolutional neural networks in omnidirectional images	2018	-4.228252834832508	-12.792230310110446	3968530
3970603	Vision	salient object detection via point-to-set metric learning	2016	-3.966724261849252	-13.282798697437535	3970630
3970614	Vision	learning motion patterns in videos	2017	-3.9898421060350255	-12.948607592611618	3970641
3971709	Vision	spatiotemporal salient object detection by integrating with objectness	2017	-3.8061491694415057	-13.05445708707304	3971736
3972748	AI	classification with normalboost	2011	-3.970411823448493	-13.582158070713687	3972775
3973659	Vision	robust class similarity measure for traffic sign recognition	2010	-3.824859605481192	-13.509474154220214	3973686
3975510	Vision	automatic polyp detection via a novel unified bottom-up and top-down saliency approach	2018	-3.5709662236696786	-13.208812887296965	3975537
3975916	Robotics	real-time, long-term hand tracking with unsupervised initialization	2013	-4.219884739845696	-13.097058113215553	3975943
3978428	Robotics	kinect depth recovery via the cooperative profit random forest algorithm	2018	-4.044583837909844	-12.729996580902302	3978455
3986149	Vision	unconstrained face alignment without face detection	2017	-3.3758891221560683	-13.094207198313091	3986176
3986838	Vision	shape-from-mask: a deep learning based human body shape reconstruction from binary mask images	2018	-4.0913346271438185	-12.914784529969136	3986865
3987183	Vision	cpnet: a context preserver convolutional neural network for detecting shadows in single rgb images	2018	-3.3956638236736127	-12.931418707542358	3987210
3987309	Vision	a hierarchical probabilistic model for facial feature detection	2014	-3.824914566957236	-13.514262575855259	3987336
3987429	Vision	learned multi-patch similarity	2017	-3.8871778217125135	-13.223270725549304	3987456
3988040	Vision	license plate detection using deep cascaded convolutional neural networks in complex scenes	2017	-3.5992762054482306	-12.775787295266905	3988067
3988538	Vision	joint shape classification and labeling of 3-d objects using the energy minimization framework	2013	-4.0548980217962445	-13.591814956747953	3988565
3991177	NLP	person re-identification with density-distance unsupervised salience learning	2015	-3.7547828389511935	-13.368419347913857	3991204
3991527	Vision	dart: distribution aware retinal transform for event-based cameras	2017	-3.988901300272701	-12.875623384590336	3991554
3991995	Vision	using segmentation to predict the absence of occluded parts	2015	-3.6804519726046605	-13.241396740066767	3992022
3993437	Vision	unsupervised joint alignment of complex images	2007	-4.143926448382864	-12.818833042348293	3993464
3993826	Vision	procrustean decomposition for orthogonal cascade detection	2016	-3.889172351502927	-13.491229609839207	3993853
3994170	Vision	effective constructing training sets for object detection	2013	-3.66883022280352	-12.950672734310505	3994197
3994587	Vision	fusing generic objectness and deformable part-based models for weakly supervised object detection	2014	-3.862736256184727	-13.380322242604793	3994614
4001525	Vision	point-wise mutual information-based video segmentation with high temporal consistency	2016	-4.274475878995144	-13.587034645769162	4001552
4002958	Vision	a data-driven detection optimization framework	2013	-4.256705848339135	-13.050174335392125	4002985
4008002	Vision	person re-identification by iterative re-weighted sparse ranking	2015	-3.397655378530645	-13.439687495460285	4008029
4008399	Vision	experts-shift: learning active spatial classification experts for keyframe-based video segmentation	2011	-4.227180609926384	-13.103383159630079	4008426
4008423	Vision	privileged information-based conditional structured output regression forest for facial point detection	2015	-3.7450099788916695	-13.344058126317384	4008450
4008993	Vision	pedestrian detection: a benchmark	2009	-3.3797580584278872	-12.782293699403985	4009020
4009506	Vision	learning 3d shapes as multi-layered height-maps using 2d convolutional networks	2018	-3.9339453014398598	-12.965026614355828	4009533
4009869	Vision	s4net: single stage salient-instance segmentation	2017	-3.7490856774436825	-12.812484194679016	4009896
4011505	Vision	rapid object detection using a boosted cascade of simple features	2001	-4.21227529636468	-13.560846570955086	4011532
4017285	Vision	a hierarchical image kernel with application to pedestrian identification for video surveillance	2009	-3.723089956240175	-13.392628804563847	4017312
4018222	Vision	object proposal generation with fully convolutional networks	2018	-3.4561406115152438	-13.108346042797976	4018249
4020708	Web+IR	distilled collections from textual image queries	2015	-3.456369643415572	-13.17577597688982	4020735
4021610	Vision	robust boltzmann machines for recognition and denoising	2012	-4.21293631462547	-13.153012204664718	4021637
4022555	Vision	a coarse-to-fine deep convolutional neural network framework for frame duplication detection and localization in video forgery.	2018	-3.7816015011452175	-13.468448540567438	4022582
4023959	Vision	automatic license plate recognition based on faster r-cnn algorithm	2018	-3.6794631357360936	-12.977135657202286	4023986
4026203	Vision	vehicle re-identification by adversarial bi-directional lstm network	2018	-3.5861418560286715	-12.87465190934084	4026230
4030829	Vision	crowd counting using multiple local features	2009	-3.8145344842770346	-13.483407993370927	4030856
4031448	Robotics	learning a local feature descriptor for 3d lidar scans	2018	-4.184184253581633	-12.876260884561537	4031475
4031450	Vision	human layout estimation using structured output learning	2012	-3.5824868773306906	-13.370288395719376	4031477
4032520	Vision	manifold based dynamic texture synthesis from extremely few samples	2014	-3.805208996815277	-12.983460790068214	4032547
4032938	Vision	deepreid: deep filter pairing neural network for person re-identification	2014	-3.5491434862353524	-13.188110560822626	4032965
4033470	Vision	deep extreme cut: from extreme points to object segmentation	2018	-3.3765983549711724	-12.77196741515729	4033497
4033988	Vision	person re-identification with mutual re-ranking	2016	-3.405846937239964	-13.467499496718926	4034015
4034280	Vision	deep sliding shapes for amodal 3d object detection in rgb-d images	2016	-3.974329509638422	-13.116042439333887	4034307
4035352	Vision	improving pedestrian detection in crowds with synthetic occlusion images	2018	-3.6289766929165115	-12.718742459631489	4035379
4035463	Vision	object proposals estimation in depth image using compact 3d shape manifolds	2015	-3.9247292842310975	-12.873233240025725	4035490
4035705	Vision	a two-stage detector for hand detection in ego-centric videos	2016	-3.848677563204191	-13.085358005135275	4035732
4036433	Vision	virtual view generation using clustering based local view transition model	2012	-3.7924863415703465	-13.581361957723566	4036460
4036762	Vision	localization recall precision (lrp): a new performance metric for object detection	2018	-3.715384420153936	-13.464262952075332	4036789
4036804	Vision	deep people counting in extremely dense crowds	2015	-3.541113301626046	-12.810615466721556	4036831
4037512	ML	local boosted features for pedestrian detection	2009	-3.6865885114402666	-13.565930366217088	4037539
4037544	Vision	data-driven hair segmentation with isomorphic manifold inference	2014	-3.689386850007653	-13.172976764365368	4037571
4037711	Vision	an improved c-cot based visual tracking scheme to weighted fusion of diverse features	2018	-4.292224229587774	-12.733787348073086	4037738
4040155	Vision	fast road scene segmentation using deep learning and scene-based models	2016	-4.126589119548097	-13.006399074642598	4040182
4040854	ML	convolutional neural networks for joint object detection and pose estimation: a comparative study	2014	-3.5877328417762637	-13.054460242545764	4040881
4042601	Vision	unsupervised learning for color constancy	2018	-4.1925612277326385	-12.78763776021959	4042628
4043539	Vision	pixel-wise ear detection with convolutional encoder-decoder networks	2017	-3.5526860865424434	-13.313941632643516	4043566
4044589	Robotics	efficient, dense, object-based segmentation from rgbd video	2016	-3.882158673315781	-13.121132898188135	4044616
4045070	Vision	context-aware cnns for person head detection	2015	-3.370029336296121	-13.192722676292734	4045097
4045086	Vision	size does matter: improving object recognition and 3d reconstruction with cross-media analysis of image clusters	2010	-3.393935837167533	-13.30644280320236	4045113
4046857	Vision	unsupervised joint object discovery and segmentation in internet images	2013	-3.9646243890373016	-13.160756955668287	4046884
4047486	Vision	occlusion-free face alignment: deep regression networks coupled with de-corrupt autoencoders	2016	-3.5179534694485253	-12.986724410510378	4047513
4048626	Vision	fingertip in the eye: an attention-based method for real-time hand tracking and fingertip detection in egocentric videos	2016	-3.750876465282511	-13.337595023797492	4048653
4049317	Vision	people detection in image and video data	2008	-4.233448184564532	-13.004228999592106	4049344
4050363	Vision	3d pose estimation for fine-grained object categories	2018	-3.8404383761318464	-12.8064846617475	4050390
4050714	Vision	people detection and articulated pose estimation framework for crowded scenes	2017	-3.449562616181585	-13.57172628220418	4050741
4052781	Vision	matching features without descriptors: implicitly matched interest points (imips)	2018	-3.783031596583196	-13.319698522336605	4052808
4055633	Vision	dictionary integration using 3d morphable face models for pose-invariant collaborative-representation-based classification	2018	-3.711803136861023	-13.201801087298579	4055660
4059496	Vision	relative camera pose estimation using convolutional neural networks	2017	-3.80926247678194	-12.827949312068707	4059523
4060250	AI	symbolic road marking recognition using convolutional neural networks	2017	-3.606919262232932	-12.740254163562934	4060277
4062953	Vision	from active appearance models and mnemonic descent to 3d morphable models: a brief history of statistical deformable models with examples in menpo	2016	-3.7314556011156506	-12.881178136545362	4062980
4063606	Vision	purely geometric scene association and retrieval - a case for macro scale 3d geometry	2018	-3.869841910964416	-13.051685864729581	4063633
4064350	Vision	local deep hashing matching of aerial images based on relative distance and absolute distance constraints	2017	-3.4126265754329674	-12.934317484314064	4064377
4064381	Robotics	towards annotation free license plate recognition	2015	-4.11737842185689	-12.901240750365874	4064408
4067379	Robotics	real-time semantic context labeling for image understanding	2015	-4.124385308275292	-13.573984090102684	4067406
4069786	Vision	cascade mask generation framework for fast small object detection	2018	-3.4071358763005386	-12.823758122810176	4069813
4071718	Vision	subcategory-aware convolutional neural networks for object proposals and detection	2017	-3.7155965719913753	-13.041358675177223	4071745
4073335	Vision	face recognition and pose estimation with parametric linear subspaces	2008	-4.208455322542404	-13.638276499717731	4073362
4075516	Vision	how far are we from solving pedestrian detection?	2016	-3.4969821233238783	-12.788611675805225	4075543
4076172	Vision	face detection, pose estimation, and landmark localization in the wild	2012	-3.755434918940096	-12.995701910821447	4076199
4081892	Robotics	road detection and segmentation from aerial images using a cnn based system	2018	-3.6418858079748113	-12.719623008556585	4081919
4082008	Vision	refine pedestrian detections by referring to features in different ways	2017	-3.5628834607590085	-12.844940720525338	4082035
4082287	Vision	building large scale 3d face database for face analysis	2007	-4.091179283983628	-13.514927949066813	4082314
4083499	Vision	warpnet: weakly supervised matching for single-view reconstruction	2016	-3.8594011433427204	-12.885530931392045	4083526
4088770	Vision	a multi-staged system for efficient visual person reidentification	2011	-4.015838758387401	-13.55281004832781	4088797
4088913	ML	automatic image de-fencing system	2016	-4.13443845156034	-12.872516111032484	4088940
4092605	Vision	online multi-target tracking by large margin structured learning	2012	-3.413119138467064	-12.930928184442587	4092632
4092760	Vision	learning linear discriminant projections for dimensionality reduction of image descriptors	2011	-3.5039170624475964	-13.525121071408195	4092787
4093067	Vision	simultaneous hallucination and recognition of low-resolution faces based on singular value decomposition	2015	-4.323908389860233	-12.787931996867325	4093094
4093627	Vision	object detection using boosted local binaries	2016	-3.6247656656057594	-13.405362173067694	4093654
4094606	Vision	ship recognition based on active learning and composite kernel svm	2015	-4.217282770751298	-13.484728228938383	4094633
4094979	Vision	deep matching prior network: toward tighter multi-oriented text detection	2017	-3.479543001016282	-13.471990600942178	4095006
4097527	Vision	low-cost scene modeling using a density function improves segmentation performance	2016	-4.214887570058955	-12.819290625659207	4097554
4098018	Vision	unsupervised dense crowd detection by multiscale texture analysis	2014	-4.18310226407618	-13.320950507024175	4098045
4098073	Vision	event monitoring via local motion abnormality detection in non-linear subspace	2010	-3.4856133011645967	-13.592192451642902	4098100
4098855	Vision	fusion of spatially constrained attributes with kernelized ranking for person re-identification	2015	-3.804342789262046	-13.325686232224607	4098882
