id	area	title	year	x	y	ix
3158418	Vision	airport detection on optical satellite images using deep convolutional neural networks	2017	-4.2815304122064255	-12.699165860931348	3158445
3160441	Vision	lstm-cf: unifying context modeling and fusion with lstms for rgb-d scene labeling	2016	-3.4100347220280742	-12.81894337970373	3160468
3164378	Vision	boundary-aware box refinement for object proposal generation	2017	-3.5106244341739603	-12.953131591635563	3164405
3170374	Vision	improving classifiers with unlabeled weakly-related videos	2011	-3.743595253810429	-13.182123991696491	3170401
3172142	Vision	contour detection from deep patch-level boundary prediction	2017	-4.154209260961614	-13.529196868718165	3172169
3172406	Vision	vehicle detection using partial least squares	2011	-3.879008859281389	-13.167076039662488	3172433
3172708	Vision	spatialized epitome and its applications	2010	-4.263578651252982	-13.271203738000235	3172735
3175621	Vision	seq-nms for video object detection	2016	-3.5409160349493303	-13.163212158296432	3175648
3176250	Vision	previewer for multi-scale object detector	2018	-3.4342128223342923	-12.832223395432171	3176277
3176309	Vision	a new anchor-labeling method for oriented text detection using dense detection framework	2018	-3.7527666540528215	-13.254655984892475	3176336
3176955	Robotics	fast vehicle detection with lateral convolutional neural network	2018	-3.549049041949865	-12.814318180549115	3176982
3177703	Vision	searching action proposals via spatial actionness estimation and temporal path inference and tracking	2016	-4.038515888279174	-13.138046692066546	3177730
3177711	Vision	implicit scene context for object segmentation and classification	2011	-3.45592447404606	-12.875107195300432	3177738
3178488	AI	discriminative semi-coupled projective dictionary learning for low-resolution person re-identification	2018	-3.3724658673411767	-13.049631832263668	3178515
3178898	Vision	online web-data-driven segmentation of selected moving objects in videos	2012	-4.2305256488046314	-13.259819558358581	3178925
3181630	Vision	a real-time chinese traffic sign detection algorithm based on modified yolov2	2017	-3.6033923504232592	-12.862580306712706	3181657
3184541	Vision	use fast r-cnn and cascade structure for face detection	2016	-3.371582682932944	-12.782418672477062	3184568
3188411	Vision	evolving boxes for fast vehicle detection	2017	-3.805996876393489	-12.694771400237064	3188438
3189904	Vision	component-based license plate detection using conditional random field model	2013	-4.265747169687009	-13.325028115784132	3189931
3190078	Robotics	vehicle type classification using distributions of structural and appearance-based features	2013	-4.268775142863231	-13.58263639756593	3190105
3191799	Robotics	rgb-d co-segmentation on indoor scene with geometric prior and hypothesis filtering	2018	-3.6783978865621783	-12.807303505537407	3191826
3191845	Vision	locality based discriminative measure for multiple-shot person re-identification	2013	-3.4076360952004405	-13.229192666176539	3191872
3191928	Vision	improving landmark recognition using saliency detection and feature classification	2018	-3.5802231993873845	-13.410191951618927	3191955
3192604	Graphics	automatic semantic modeling of indoor scenes from low-quality rgb-d data using contextual information	2014	-4.147227459561158	-12.831879015875087	3192631
3194460	Robotics	surgeon technical skill assessment using computer vision based analysis	2017	-3.953423357655477	-12.70232092720422	3194487
3195430	ML	tinyposenet: a fast and compact deep network for robust head pose estimation	2017	-3.391750257650407	-13.112114094296944	3195457
3197594	Vision	co-training on multi-view unlabelled data	2012	-3.7256133710608426	-12.783332503665768	3197621
3198856	Robotics	deep contextual description of superpixels for aerial urban scenes classification	2017	-4.0608206969209775	-12.799094822169607	3198883
3199542	Vision	3d object recognition based on volumetric representation using convolutional neural networks	2016	-3.5825934973576232	-12.733637555996015	3199569
3200918	ML	deep stereo matching with explicit cost aggregation sub-architecture	2018	-3.599705006342828	-12.79455205753752	3200945
3201376	Vision	online exemplar-based fully convolutional network for aircraft detection in remote sensing images	2018	-3.5282979651395525	-13.078823565554565	3201403
3201786	Vision	exploring locally rigid discriminative patches for learning relative attributes	2015	-3.460122519943773	-13.250767526773842	3201813
3205782	Robotics	vehicle segmentation from remote sensing images using the small object segmentation convolutional network	2017	-3.3664365922902166	-12.691543554077205	3205809
3206303	Vision	model-based viewpoint invariant human activity recognition from uncalibrated monocular video sequence	2010	-3.737317750454701	-13.461054320520775	3206330
3207093	Vision	action recognition by saliency-based dense sampling	2017	-3.8088162691655394	-13.574586928948118	3207120
3208920	Vision	active object detection	2007	-4.18720022004471	-12.968190609078778	3208947
3208998	Vision	provid: progressive and multimodal vehicle reidentification for large-scale urban surveillance	2018	-3.5351509810452773	-13.374346698174932	3209025
3211082	Vision	belief propagation in spatiotemporal graph topologies for the analysis of image sequences	2010	-3.5362837940022387	-12.746684728847347	3211109
3211437	Vision	art-emap: a neural network architecture for object recognition by evidence accumulation	1995	-3.789893273752113	-13.405743044736965	3211464
3211654	AI	deep multi-center learning for face alignment	2018	-3.445036943583805	-13.028124862952836	3211681
3212184	Vision	learning to detect carried objects with minimal supervision	2013	-3.64699349095331	-13.243132377177893	3212211
3212695	Vision	online boosting oc for face recognition in continuous video stream	2010	-3.647632916877486	-12.97139991888594	3212722
3214031	ML	joint action unit localisation and intensity estimation through heatmap regression	2018	-3.713778986220953	-12.989776717210708	3214058
3215281	Vision	pooling facial segments to face: the shallow and deep ends	2017	-3.4906688127097274	-13.132110123142144	3215308
3217438	Vision	fully convolutional network with superpixel parsing for fashion web image segmentation	2017	-3.5184122145875625	-13.076838571602117	3217465
3220711	Vision	adding the third dimension to spatial relation detection in 2d images	2018	-4.166824492623552	-13.112630344822323	3220738
3221432	AI	cnn-based edge filtering for object proposals	2017	-3.484926870794601	-12.734589084878039	3221459
3223195	Vision	finding distractors in images	2015	-3.7716166284776635	-13.638167088786185	3223222
3223462	Vision	learning spatial context: using stuff to find things	2008	-3.7399837499352606	-13.436890156261047	3223489
3223696	Vision	adaptive pose priors for pictorial structures	2010	-4.194931401059754	-12.874613965756055	3223723
3223753	Robotics	3d data classification based on mid-level geometric features	2011	-4.072831687234847	-13.021670597499465	3223780
3224719	Vision	partial occlusion handling in pedestrian detection with a deep model	2016	-4.300970991431288	-12.990982751430002	3224746
3224849	Vision	combining local appearance and holistic view: dual-source deep neural networks for human pose estimation	2015	-3.808850227786845	-13.114499922918842	3224876
3224872	Vision	pedestrian detection via logistic multiple instance boosting	2008	-3.710424408072924	-13.081253786202947	3224899
3228827	Vision	multi-view body part recognition with random forests	2013	-3.881207755150616	-13.114267772632035	3228854
3229767	Vision	magnify-net for multi-person 2d pose estimation	2018	-3.3972882936293165	-12.893567748659976	3229794
3229804	Vision	learning to colorize infrared images	2017	-3.4982079244574704	-12.909123378848012	3229831
3231322	Vision	fast object detection with occlusions	2004	-3.864105605396531	-13.041660243546309	3231349
3234052	AI	disjunctive normal form of weak classifiers for online learning based object tracking	2013	-4.205938291575107	-13.101436677997556	3234079
3234798	Vision	joint facial landmark detection and action estimation based on deep probabilistic random forest	2017	-4.1430668596090126	-13.166711687733395	3234825
3236271	Vision	indoor scene understanding with rgb-d images: bottom-up segmentation, object detection and semantic segmentation	2014	-3.680662638495194	-13.192236834248972	3236298
3237660	Vision	from images to 3d shape attributes	2019	-3.5900359287735917	-13.17819834048546	3237687
3239855	Vision	change detection based on deep siamese convolutional network for optical aerial images	2017	-3.490400874602132	-13.144418910439065	3239882
3240194	Vision	improving local descriptors by embedding global and local spatial information	2010	-3.5138649371790787	-13.593311498051953	3240221
3240360	ML	hierarchical and spatial structures for interpreting images of man made scenes using graphical models	2011	-3.578608171802349	-12.790421313521282	3240387
3240966	Vision	joint spatio-temporal action localization in untrimmed videos with per-frame segmentation	2018	-4.189914984391889	-13.065403335933096	3240993
3241808	Vision	rscm: region selection and concurrency model for multi-class weather recognition	2017	-3.7075556792818065	-13.311341224992725	3241835
3242735	Robotics	cnn based renormalization method for ship detection in vhr remote sensing images	2018	-3.7257765792048327	-12.81231575865882	3242762
3244919	Vision	transductive 3d shape segmentation using sparse reconstruction	2014	-3.775426939240705	-13.010873781059036	3244946
3247541	ML	asymmetric totally-corrective boosting for real-time object detection	2010	-3.7070930452700246	-12.802714096789371	3247568
3248361	Vision	context-based global multi-class semantic image segmentation by wireless multimedia sensor networks	2013	-3.36755170430596	-13.2080620154841	3248388
3249301	Vision	discriminative dictionary learning sparse coding for person re-identification	2016	-3.4763717107614465	-13.268864847705965	3249328
3249909	Vision	per-sample kernel adaptation for visual recognition and grouping	2015	-3.5008133018992957	-13.098804131612425	3249936
3250008	Vision	monet: multiview semi-supervised keypoint via epipolar divergence	2018	-4.1623771941907535	-12.83475699384049	3250035
3250245	Vision	image segmentation in twenty questions	2015	-3.774944660819541	-12.962574636569308	3250272
3253890	Vision	articulated human pose estimation in natural images	2012	-4.213310387774905	-12.865925927691181	3253917
3256376	Vision	convolutional face finder: a neural architecture for fast and robust face detection	2004	-3.6906697377524007	-13.624028054743786	3256403
3257626	Vision	a study on components and features in face detection	2015	-4.1676525919499685	-13.597951092038482	3257653
3260032	ML	spatial random tree grammars for modeling hierarchal structure in images with regions of arbitrary shape	2007	-3.947438992024321	-12.992966592967072	3260059
3261265	Vision	identifying individuals in video by combining 'generative' and discriminative head models	2005	-3.7876002487471614	-13.571951339289805	3261292
3263465	Vision	fast and accurate object detection using image cropping/resizing in multi-view 4k sports videos	2018	-3.8159935675628067	-13.13205387665876	3263492
3263681	Vision	large scale hard sample mining with monte carlo tree search	2016	-4.085779426052221	-13.10429251231493	3263708
3268747	Vision	an mrf based abnormal event detection approach using motion and appearance features	2014	-4.151465392190501	-12.73463223917906	3268774
3270424	Vision	quality-guided fusion-based co-saliency estimation for image co-segmentation and colocalization	2018	-4.2597843369722606	-13.139627764095945	3270451
3272266	Vision	object boundary guided semantic segmentation	2016	-3.6390001719419023	-13.174874795042633	3272293
3273108	Vision	interactive image segmentation using dirichlet process multiple-view learning	2012	-3.373755596819344	-12.867842720336606	3273135
3274496	Vision	scenenn: a scene meshes dataset with annotations	2016	-3.9793116187471456	-12.975732159527205	3274523
3275070	Vision	occlusion detection and gait silhouette reconstruction from degraded scenes	2011	-4.138557976249679	-13.46573828481936	3275097
3275310	Vision	interactive boundary prediction for object selection	2018	-4.201104774970071	-13.553359889526385	3275337
3277690	Vision	new efficient speed-up scheme for cascade implementation of svm classifier	2015	-4.290733191178428	-13.543568553310847	3277717
3280857	Robotics	multi-class fruit classification using rgb-d data for indoor robots	2013	-3.8461428016979666	-13.547915240785331	3280884
3283034	Vision	bike-person re-identification: a benchmark and a comprehensive evaluation	2018	-3.4567271509244013	-13.141103800784034	3283061
3285888	Vision	semantic segmentation of urban scenes using dense depth maps	2010	-4.1116059703751295	-12.729364039525715	3285915
3287095	Vision	learning 3d keypoint descriptors for non-rigid shape matching	2018	-3.3706253455199082	-13.073229681515999	3287122
3287301	Vision	hand pose estimation and hand shape classification using multi-layered randomized decision forests	2012	-4.0137685147959985	-13.580956661484857	3287328
3291024	Vision	a convolutional learning system for object classification in 3-d lidar data	2010	-3.521230944233133	-13.306687061844206	3291051
3292123	Vision	graph formulation of video activities for abnormal activity recognition	2017	-4.1666034073741	-12.854459792512529	3292150
3292483	Vision	transformed representations for convolutional neural networks in diabetic retinopathy screening	2014	-3.385116386557976	-13.271152479949007	3292510
3294851	Vision	robust visual tracking using exemplar-based detectors	2017	-4.0621758326055035	-12.810844926967635	3294878
3295452	Vision	joint saliency estimation and matching using image regions for geo-localization of online video	2017	-4.2213939735445365	-12.697030406708885	3295479
3295609	Vision	discriminative sparsity for sonar atr	2015	-3.8879326748358567	-13.320521745084172	3295636
3297133	Vision	what makes for effective detection proposals?	2016	-3.5571932528612686	-13.053037662185385	3297160
3298182	Vision	analyzing tracklets for the detection of abnormal crowd behavior	2015	-4.24721597807003	-12.855701765777965	3298209
3299378	ML	object detection and viewpoint estimation with auto-masking neural network	2014	-3.5677974743714245	-13.171878182617426	3299405
3300135	Vision	robust face recognition under varying illumination and occlusion considering structured sparsity	2012	-3.538888830450922	-12.750137852697964	3300162
3301898	Vision	human action recognition with skeleton induced discriminative approximate rigid part model	2016	-3.639884165087522	-13.326804305454793	3301925
3304079	AI	a stochastic graph grammar for compositional object representation and recognition	2009	-3.697012480628055	-13.392550983733829	3304106
3306132	Vision	cad: scale invariant framework for real-time object detection	2017	-3.504003308065427	-12.68879593393872	3306159
3306472	Vision	semantic segmentation using regions and parts	2012	-3.7781138244409753	-13.370240021928046	3306499
3311529	Vision	salient object detection via bootstrap learning	2015	-3.444913170020662	-12.927104560054252	3311556
3313932	Vision	motion-guided cascaded refinement network for video object segmentation	2018	-3.6411949261267136	-13.354001977695464	3313959
3314787	Vision	design of coupled strong classifiers in adaboost framework and its application to pedestrian detection	2015	-3.636417968555007	-13.477747442701745	3314814
3314845	Vision	integrating grammar and segmentation for human pose estimation	2013	-3.5490090334802016	-13.14937784218912	3314872
3314979	Vision	counting people based on linear, weighted, and local random forests	2017	-4.0551690931590665	-12.68875718605843	3315006
3316809	Vision	indoor vs outdoor classification of consumer photographs using low-level and semantic features	2001	-3.9184101981125714	-13.501490695476553	3316836
3317308	AI	joint learning of body and part representation for person re-identification	2018	-3.5002495129468816	-13.4389934324927	3317335
3318769	Vision	unsupervised rgbd video object segmentation using gans	2018	-3.7213763815104834	-12.849485120806964	3318796
3319445	Vision	gesture-based bootstrapping for egocentric hand segmentation	2016	-3.8961337194249217	-13.166626370796536	3319472
3320173	Vision	multi-view hypotheses transfer for enhanced object recognition in clutter	2015	-3.822022711858479	-12.813214534935806	3320200
3320284	Vision	a coarse-to-fine pyramidal model for person re-identification via multi-loss dynamic training	2018	-3.6938162622017527	-13.149158071850438	3320311
3321476	Vision	online multi-face detection and tracking using detector confidence and structured svms	2015	-3.883289606882632	-12.873950139591393	3321503
3321796	Vision	optimization of facade segmentation based on layout priors	2017	-3.600430684701416	-13.433581985411838	3321823
3322404	Vision	robust iris recognition using sparse error correction model and discriminative dictionary learning	2014	-3.9073974413768635	-13.044679704070914	3322431
3324925	ML	coarse-to-fine salient object detection based on deep convolutional neural networks	2018	-3.684227229966551	-13.233990564545534	3324952
3325626	Vision	geometric invariants construction for semantic scene understanding from multiple views inspired by the human visual system	2012	-3.4707666882438475	-12.777416268621874	3325653
3326859	Vision	wide-area video understanding: tracking, video summarization and algorithm-platform co-design	2015	-4.30447485602298	-12.752542700834631	3326886
3327249	Vision	patch-based models for visual object classes	2011	-3.670123915637699	-13.637069607285753	3327276
3327455	Vision	boosting face in video recognition via cnn based key frame extraction	2018	-4.095183473745987	-12.692802479631984	3327482
3329081	Vision	efficient human action detection using a transferable distance function	2009	-3.3802823315893082	-13.554148493219394	3329108
3329414	ML	stereo matching by training a convolutional neural network to compare image patches	2016	-3.626360395572535	-12.700805582649755	3329441
3329433	ML	robust detection with local steering kernel: maximum margin matrix cosine similarity and beyond	2016	-3.5838480970059585	-13.331104259477772	3329460
3329563	Vision	learning a hierarchical deformable template for rapid deformable object parsing	2010	-4.301574301390102	-13.36897029708462	3329590
3331195	Vision	spatially coherent feature learning for pose-invariant facial expression recognition	2018	-3.4988170024768523	-13.564672752416005	3331222
3333644	Vision	exemplar-based cascaded stacked auto-encoder networks for robust face alignment	2018	-3.372087947764072	-13.004343556360944	3333671
3334511	ML	robust person detection for surveillance using online learning	2008	-3.3994035982088318	-12.797687729259026	3334538
3336136	Vision	superpixel-based object class segmentation using conditional random fields	2011	-4.01720533801052	-13.241237757547646	3336163
3339006	Vision	deep learning features inspired saliency detection of 3d images	2016	-3.8642378186856456	-13.38071480540779	3339033
3340290	Vision	posterity logging of face imagery for video surveillance	2012	-4.325408180111888	-13.49959453026865	3340317
3341112	Vision	a large dataset for improving patch matching	2018	-3.862062758973367	-13.174415405322517	3341139
3342049	Vision	collaborative facial landmark localization for transferring annotations across datasets	2014	-4.168561318355895	-13.16047580767292	3342076
3342319	Vision	detection of traffic signs in real-world images: the german traffic sign detection benchmark	2013	-3.767312707995607	-13.60732222008307	3342346
3342843	Vision	modeling spatial layout for scene image understanding via a novel multiscale sum-product network	2016	-3.4570341841119747	-12.921865518565822	3342870
3343867	Vision	putting local features on a manifold	2010	-4.325724085279607	-13.629086754434606	3343894
3344568	Vision	localizing spatially and temporally objects and actions in videos. (localiser spatio-temporallement des objets et des actions dans des vidéos)	2017	-3.473661790545976	-13.045565342753472	3344595
3345029	Vision	learning rich features from rgb-d images for object detection and segmentation	2014	-4.111737685280655	-13.051969631876654	3345056
3346112	Vision	automatic object extraction in single-concept videos	2011	-4.310905448562754	-13.303802389472065	3346139
3346315	Graphics	learning local shape descriptors from part correspondences with multiview convolutional networks	2017	-3.4650128641643287	-12.747062184867493	3346342
3347485	Vision	transferring boosted detectors towards viewpoint and scene adaptiveness	2011	-3.946771850085712	-12.762767844526666	3347512
3347652	Vision	human pose as context for object detection	2015	-3.6270153950581334	-13.309953438020885	3347679
3347660	Vision	group re-identification: leveraging and integrating multi-grain information	2018	-4.13958563919854	-12.960721306941887	3347687
3351858	Vision	toward facial re-identification: experiments with data from an operational surveillance camera plant	2016	-3.4472880405535347	-13.52181924214178	3351885
3352035	Robotics	contextually guided semantic labeling and search for three-dimensional point clouds	2013	-3.99276847361611	-12.73558655449465	3352062
3352114	Vision	recovering 6d object pose and predicting next-best-view in the crowd	2016	-3.7541478958554815	-12.696653034401713	3352141
3355199	Vision	robust object proposals re-ranking for object detection in autonomous driving using convolutional neural networks	2017	-3.8921843196992105	-12.706170445713697	3355226
3357861	Vision	learning to refine human pose estimation	2018	-3.954672368993689	-12.769152632132515	3357888
3358596	Robotics	object recognition and detection with deep learning for autonomous driving applications	2017	-3.9694892736007823	-12.904147771974808	3358623
3360407	Vision	omnidetector: with neural networks to bounding boxes	2018	-4.27131647037268	-13.502994858286069	3360434
3362848	Vision	lean crowdsourcing: combining humans and machines in an online system	2017	-3.8284337757704288	-12.811198834959091	3362875
3364192	Vision	object recognition with hierarchical stel models	2010	-3.485730535373236	-13.217784827760667	3364219
3364205	Vision	improved generic categorical object detection fusing depth cue with 2d appearance and shape features	2012	-3.7201551665609855	-13.603457658811047	3364232
3367344	Vision	letha: learning from high quality inputs for 3d pose estimation in low quality images	2014	-4.011125724926392	-12.94413996848423	3367371
3368358	Vision	combining appearance models and markov random fields for category level object segmentation	2008	-3.738536294109111	-13.158439282911687	3368385
3369180	Vision	car-rec: a real time car recognition system	2011	-4.130307634875398	-13.306040308068466	3369207
3371795	Vision	pose-driven deep models for person re-identification.	2018	-3.6005234040846266	-13.12680625688149	3371822
3372022	Vision	improving 2d face recognition via discriminative face depth estimation	2018	-3.5140744030785656	-13.272817777718878	3372049
3373337	Vision	unsupervised object discovery and localization in the wild: part-based matching with bottom-up region proposals	2015	-3.875095827298168	-13.24948176169468	3373364
3375050	Vision	face detection in the operating room: comparison of state-of-the-art methods and a self-supervised approach	2018	-3.5242707443099532	-13.508504853168578	3375077
3376045	Robotics	learning deep representation for place recognition in slam	2017	-4.2404154797739775	-12.917328412895744	3376072
3379984	Vision	depth-aware salient object detection and segmentation via multiscale discriminative saliency fusion and bootstrap learning	2017	-4.0180267805427095	-13.353034544372369	3380011
3381538	Vision	wing loss for robust facial landmark localisation with convolutional neural networks	2018	-4.189679186117903	-13.367273651436332	3381565
3382943	Vision	a verify-correct approach to person re-identification based on partial least squares signatures	2015	-3.722264711866708	-13.433548560704265	3382970
3382967	Vision	spatiotemporal group context for pedestrian counting	2014	-3.9199287816561967	-13.125564538203006	3382994
3384434	Vision	towards a solid solution of real-time fire and flame detection	2014	-3.3900532590062684	-13.1842335480291	3384461
3385013	Vision	co-bootstrapping saliency	2017	-3.4041283446783566	-12.958565253303563	3385040
3386116	Vision	regressing heatmaps for multiple landmark localization using cnns	2016	-3.7385218424030215	-12.852612351675319	3386143
3386352	Vision	flowing convnets for human pose estimation in videos	2015	-3.6006117291646205	-12.786928473920044	3386379
3387012	Vision	fusing bird view lidar point cloud and front view camera image for deep object detection.	2017	-4.103167296528248	-12.742724111720216	3387039
3388902	Vision	embedding geometry in generative models for pose estimation of object categories	2014	-3.9980590377252696	-12.963926345123566	3388929
3389368	AI	multilinear rank support tensor machine for crowd density estimation	2018	-3.718053586844505	-13.58423916174731	3389395
3390537	Robotics	vehicle color recognition using convolutional neural network	2015	-3.4181096764194807	-13.446253983258636	3390564
3393073	Vision	query adaptive similarity measure for rgb-d object recognition	2015	-3.5991548288148527	-13.594537336633485	3393100
3395748	Vision	staple: complementary learners for real-time tracking	2016	-4.266947366255128	-13.385551888131895	3395775
3396081	Vision	holistically constrained local model: going beyond frontal poses for facial landmark detection.	2016	-3.5174039809099353	-13.344030227828595	3396108
