id	area	title	year	x	y	ix
3676088	Vision	using latent features for short-term person re-identification with rgb-d cameras	2015	-3.762032333925552	-13.269272570143867	3676115
3678536	Vision	max margin learning of hierarchical configural deformable templates (hcdts) for efficient object parsing and pose estimation	2010	-3.738462678542079	-13.174437091974045	3678563
3679099	Vision	a discriminative deep model for pedestrian detection with occlusion handling	2012	-4.179613371997733	-12.96301245430467	3679126
3681018	Vision	automatic topic discovery for multi-object tracking	2015	-4.3211767683481845	-12.973608311152642	3681045
3682668	Vision	bi-level multi-column convolutional neural networks for facial landmark point detection	2016	-3.9178690441505606	-13.025289840019724	3682695
3683345	Vision	fast multi-view face alignment via multi-task auto-encoders	2017	-3.416606621414574	-13.106454608863606	3683372
3683663	Vision	pedestrian-synthesis-gan: generating pedestrian data in real scene and beyond	2018	-3.7200386821250664	-12.784176652317354	3683690
3685460	ML	learning covariant feature detectors	2016	-4.22072735096767	-13.365472854507804	3685487
3687158	Vision	multi-stream region proposal network for pedestrian detection	2018	-3.4645157604002006	-13.095291178877472	3687185
3692961	Vision	model-free tracking with deep appearance and motion features integration	2018	-3.570209528290209	-12.921708274235339	3692988
3693758	Vision	prior knowledge driven energy for saliency detection	2018	-3.55720840542814	-12.979371307457747	3693785
3693949	Vision	privileged information-based conditional regression forest for facial feature detection	2013	-3.856029083928107	-13.405945673002044	3693976
3694602	Vision	deformable part-based fully convolutional network for object detection	2017	-3.74145221266509	-13.115202660669944	3694629
3697819	Vision	activity recognition in unconstrained rgb-d video using 3d trajectories	2014	-3.414141317465257	-13.577616912408786	3697846
3701474	Vision	joint real-time object detection and pose estimation using probabilistic boosting network	2007	-4.060519400893555	-12.875681902886278	3701501
3701507	Vision	a hybrid approach to wide-baseline image matching	2017	-3.4294035427075427	-13.552676507589554	3701534
3703039	Robotics	depth-aware convolutional neural networks for accurate 3d pose estimation in rgb-d images	2017	-3.962172420556086	-12.71851901969102	3703066
3703391	Vision	textsnake: a flexible representation for detecting text of arbitrary shapes	2018	-3.5959155622829417	-13.385840504318447	3703418
3709330	Vision	structure-perceptron learning of a hierarchical log-linear model	2008	-4.091740658382892	-13.326362963281234	3709357
3710363	Vision	automatic 3d point set reconstruction from stereo laparoscopic images using deep neural networks	2016	-4.144695878814077	-12.709634220576199	3710390
3712193	Vision	unconstrained face alignment via cascaded compositional learning	2016	-4.042255646256792	-13.045807565450811	3712220
3715594	Vision	unsupervised and simultaneous training of multiple object detectors from unlabeled surveillance video	2009	-4.084219566995793	-13.098408090045506	3715621
3716453	Robotics	discriminative sparse representation for online visual object tracking	2012	-4.228886438235174	-12.68863370338003	3716480
3716682	Vision	shape-based object localization for descriptive classification	2008	-3.7084221787723903	-13.422771072457115	3716709
3717298	Vision	boosting masked dominant orientation templates for efficient object detection	2014	-3.950213340882697	-13.596621145623732	3717325
3717888	Vision	prism: person reidentification via structured matching	2017	-3.8873620125945214	-13.118081037954438	3717915
3718930	Vision	panocontext: a whole-room 3d context model for panoramic scene understanding	2014	-4.071967319989505	-12.69402058156546	3718957
3720045	AI	image2mass: estimating the mass of an object from its image	2017	-3.659562931284297	-13.04225318989548	3720072
3721373	Vision	normalnet: a voxel-based cnn for 3d object classification and retrieval	2019	-3.863688415730536	-13.566600561400731	3721400
3721938	Vision	three-dimensional head pose estimation in-the-wild	2015	-4.100898330451746	-13.304159390680796	3721965
3722349	Vision	learning active basis model for object detection and recognition	2009	-4.20084796405183	-13.306066850297706	3722376
3724341	Vision	improving accuracy for image parsing using spatial context and mutual information	2013	-3.4500931129474997	-13.100271333372175	3724368
3724583	Vision	deep background subtraction of thermal and visible imagery for pedestrian detection in videos	2018	-3.8641699428757565	-12.81404113729564	3724610
3725495	Vision	an unsupervised method to extract video object via complexity awareness and object local parts	2018	-4.154170418494602	-13.541663066411042	3725522
3727406	Robotics	how to improve the quality of pedestrian detection using the priori knowledge	2013	-4.055079561796246	-13.129935232177289	3727433
3727887	Vision	structured learning of human interactions in tv shows	2012	-3.7750084091384086	-13.306032991036796	3727914
3728470	Vision	3d face recognition for partial data using semi-coupled dictionary learning	2013	-3.912723910899569	-13.606436245327947	3728497
3729903	Vision	person re-identification by deep max pooling network	2017	-3.452366479302134	-13.556830742810225	3729930
3735560	Vision	continuous pose estimation in 2d images at instance and category levels	2013	-3.4447123067286625	-12.750041314240669	3735587
3738000	Vision	unsupervised random forest indexing for fast action search	2011	-3.775348291217901	-13.468914547281194	3738027
3739060	AI	a boosted multi-task model for pedestrian detection with occlusion handling	2015	-3.36531007669432	-12.983195065139649	3739087
3739122	Vision	multiscale feature extractors for stereo matching cost computation	2018	-3.601300310934352	-12.770419419828196	3739149
3740154	Vision	basis mapping based boosting for object detection	2015	-3.572930503599693	-13.43984926286629	3740181
3743192	Vision	cell tracking using deep neural networks with multi-task learning	2017	-4.096673353926116	-12.877128223078312	3743219
3743893	Vision	concatnet: a deep architecture of concatenation-assisted network for dense facial landmark alignment	2018	-3.5180752619045137	-12.963427094776506	3743920
3744215	Vision	data association based multi-target tracking using a joint formulation	2016	-3.616599223616977	-12.88760199005178	3744242
3744976	Vision	unsupervised generation of a view point annotated car dataset from videos	2015	-4.180462789652271	-12.745381468430676	3745003
3749834	Vision	pyramid sub-region sensitive network for object detection	2018	-3.898181297592779	-13.18221154783449	3749861
3749875	Vision	layered object detection for multi-class segmentation	2010	-3.993144239997663	-13.489201254303556	3749902
3753928	Robotics	indoor scene recognition through object detection	2010	-4.185248121099638	-12.740470446293696	3753955
3754511	Vision	detecting actions, poses, and objects with relational phraselets	2012	-3.400129056615124	-13.398037460702259	3754538
3756605	Vision	local part chamfer matching for shape-based object detection	2017	-4.136898367699582	-13.57040134135824	3756632
3760284	Vision	learning material-aware local descriptors for 3d shapes	2018	-3.9229796428829835	-13.314064162399447	3760311
3760645	Robotics	towards a fast and accurate road object detection algorithm based on convolutional neural networks	2018	-3.766111549219061	-12.71617710005378	3760672
3760988	Vision	progressive boosting for class imbalance and its application to face re-identification	2018	-3.859524375808987	-13.10125768839604	3761015
3761730	Vision	multiple foreground recognition and cosegmentation: an object-oriented crf model with robust higher-order potentials	2014	-3.5959502820346243	-13.327725871330845	3761757
3762502	Vision	pose estimation errors, the ultimate diagnosis	2016	-3.774438921352919	-12.945971399378026	3762529
3762672	Vision	depth-based 3d hand pose tracking	2016	-4.160946731322952	-12.742615908382009	3762699
3762704	Robotics	deformable deep convolutional generative adversarial network in microwave based hand gesture recognition system	2017	-4.0886860182963405	-13.57304544566873	3762731
3763889	Vision	semi-dense stereo matching using dual cnns	2018	-4.065940422534216	-12.720290830378294	3763916
3763914	Vision	class segmentation and object localization with superpixel neighborhoods	2009	-4.086009456000217	-13.390858613528351	3763941
3770179	Vision	joint semantic segmentation and 3d reconstruction from monocular video	2014	-4.275788305095016	-13.019420298983855	3770206
3770200	Vision	t-less: an rgb-d dataset for 6d pose estimation of texture-less objects	2017	-4.19156607101029	-12.951957326046275	3770227
3770586	Vision	scene-adaptive human detection with incremental active learning	2010	-3.465512631636281	-12.690188300573885	3770613
3770987	ML	beyond bounding boxes: precise localization of objects in images	2015	-3.6345445129299336	-13.102632577896026	3771014
3772338	Robotics	learning deep features for multiple object tracking by using a multi-task learning strategy	2014	-4.010021291081162	-12.812674737490273	3772365
3773649	Vision	dark model adaptation: semantic image segmentation from daytime to nighttime	2018	-3.5286469915636367	-12.745037689091914	3773676
3778221	Vision	benchmarking and error diagnosis in multi-instance pose estimation	2017	-4.029468474011715	-12.849069044823198	3778248
3779412	Vision	multiple instance ffeature for robust part-based object detection	2009	-3.6431097558643417	-13.004744915152529	3779439
3779489	Robotics	learning of scene-specific object detectors by classifier co-grids	2010	-3.966820249700534	-12.753078794067404	3779516
3782140	Vision	building part-based object detectors via 3d geometry	2013	-3.6655656335946483	-12.989744742190592	3782167
3782144	Vision	multi-shot human re-identification using adaptive fisher discriminant analysis	2015	-3.5603461352376717	-13.640314106385937	3782171
3784618	Vision	single-frame indexing for 3d hand pose estimation	2015	-4.075983229546647	-13.502047189806767	3784645
3784690	AI	attribute recognition from adaptive parts	2016	-3.417066428494973	-13.036501043987515	3784717
3785229	Vision	fast keypoint recognition using random ferns	2010	-4.074887213341726	-13.318903539517471	3785256
3785251	Vision	failure detection for facial landmark detectors	2016	-4.278053191747697	-13.135778481271807	3785278
3786750	Vision	scalable symmetry detection for urban scenes	2013	-3.8526454917697714	-13.365092928808696	3786777
3787784	Vision	seeds-based part segmentation by seeds propagation and region convexity decomposition	2018	-3.6889233039984703	-13.25738417778523	3787811
3789267	Vision	learning to track for spatio-temporal action localization	2015	-3.4385132616190397	-13.272753030060505	3789294
3789624	Vision	pedestrian detection with autoregressive network phases	2018	-3.6699721618978707	-12.769718832043473	3789651
3789749	Vision	3d pose estimation of bin picking object using deep learning and 3d matching	2018	-4.203785172339631	-12.712417105506043	3789776
3792323	Vision	multi-view and 3d deformable part models	2015	-3.8744856670308234	-13.164557353047242	3792350
3794987	Vision	codel: a human co-detection and labeling framework	2013	-3.570177326303504	-13.0058764890551	3795014
3795433	Vision	fewer is more: image segmentation based weakly supervised object detection with partial aggregation	2018	-3.3997890244373195	-13.021050423890802	3795460
3796141	AI	concept-aware ensemble system for pedestrian detection	2014	-3.973512826588163	-13.432691479091575	3796168
3799171	Vision	da-net: learning the fine-grained density distribution with deformation aggregation network	2018	-3.8257733328340917	-13.244737941135275	3799198
3800402	Vision	labelfaces: parsing facial features by multiclass labeling with an epitome prior	2009	-3.5059148736967707	-13.289881079322916	3800429
3800906	Vision	vfsc: a very fast sparse clustering to cluster faces from videos	2016	-3.712805110349768	-13.480740762459176	3800933
3805638	Vision	discriminatively trained templates for 3d object detection: a real time scalable approach	2013	-4.011087235561642	-12.73997843749857	3805665
3807019	Vision	consistent foreground co-segmentation	2014	-4.325726197501973	-13.331200202245231	3807046
3807217	Vision	integrating visual context and object detection within a probabilistic framework	2008	-4.2762162828048815	-12.82541757534189	3807244
3807645	Vision	analysis and control of facial expressions using decomposable nonlinear generative models	2014	-4.242209314144023	-13.602775935557586	3807672
3808544	Vision	a multipath network for object detection	2016	-3.509871899685049	-12.73642599828918	3808571
3810549	Robotics	ensemblenet: improving grasp detection using an ensemble of convolutional neural networks	2018	-3.4237379677572557	-12.990129139298887	3810576
3812547	Vision	abnormal event detection in crowded scenes based on deep learning	2016	-3.947815446307781	-13.378437296467574	3812574
3815863	Vision	capturing layers in image collections with componential models: from the layered epitome to the componential counting grid	2013	-3.5326426152497614	-13.233315155655461	3815890
3816365	Vision	multiview supervision by registration	2018	-3.759005647862408	-12.953503546600087	3816392
3819283	Vision	siamese cascaded region proposal networks for real-time visual tracking	2018	-3.4152523649681212	-12.786845087591466	3819310
3823853	Vision	weighted local metric learning for person re-identification	2016	-3.477193315957812	-13.203739200735965	3823880
3824040	Graphics	sparse coding for flexible, robust 3d facial-expression synthesis	2012	-4.252243416328159	-13.107072013768144	3824067
3824931	Vision	image crowd counting using convolutional neural network and markov random field	2017	-3.4014351291790663	-12.714171324815688	3824958
3826465	Vision	cosegmentation and cosketch by unsupervised learning	2013	-3.999796520838092	-13.352422330119898	3826492
3829614	Vision	supervoxel-consistent foreground propagation in video	2014	-3.9494627834064913	-13.184485772212374	3829641
3829744	ML	object discovery in depth images	2016	-3.705128471395201	-12.932935220111663	3829771
3830368	Vision	effectiveness of the bag-of-words approach on the object search problem in 3d domain	2017	-3.5108724272667216	-13.130403351123595	3830395
3830791	Vision	unconstrained facial landmark localization with backbone-branches fully-convolutional networks	2015	-3.650350903537879	-12.820491625293323	3830818
3837401	Vision	hierarchical activity discovery within spatio-temporal context for video anomaly detection	2013	-3.855306875430717	-12.810611983320769	3837428
3838244	Vision	a probabilistic model for image representation via multiple patterns	2012	-3.6819256378354552	-13.438321079819353	3838271
3843278	Vision	video segmentation by tracking many figure-ground segments	2013	-3.834522544812818	-12.768047463218432	3843305
3847355	Vision	can contextual information improve scene classification performance?	2016	-3.6385692633188063	-13.348350661962945	3847382
3847408	Vision	end-to-end weakly-supervised semantic alignment	2018	-3.8843616695848238	-12.911406766307714	3847435
3849115	Vision	making deep heatmaps robust to partial occlusions for 3d object pose estimation	2018	-4.242398657375815	-12.926291340145161	3849142
3849650	Vision	pyramid coding for functional scene element recognition in video scenes	2013	-3.823093095407197	-13.539590594759476	3849677
3850225	Vision	a novel label learning algorithm for face recognition	2016	-4.2844590790040264	-12.895829922762639	3850252
3851422	Vision	an evaluation of region based object detection strategies within x-ray baggage security imagery	2017	-3.8745682057675688	-12.886967574314532	3851449
3852448	Vision	occlusion-aware hand pose estimation using hierarchical mixture density network	2018	-3.603891179480803	-12.914054761641298	3852475
3857290	Vision	cospair: colored histograms of spatial concentric surflet-pairs for 3d object recognition	2016	-3.7950337104884175	-13.362772080196864	3857317
3859209	Vision	part-level convolutional neural networks for pedestrian detection using saliency and boundary box alignment	2018	-3.6317621564391582	-13.124940742942025	3859236
3859441	Graphics	learning to group and label fine-grained shape components	2018	-3.4567608357987294	-13.078256419457006	3859468
3861366	Vision	estimating the aspect layout of object categories	2012	-4.183970383408041	-13.274960069310946	3861393
3861619	Vision	abnormal activity detection using spatio-temporal feature and laplacian sparse representation	2015	-4.3060138477591225	-12.742115712592918	3861646
3865306	Vision	salient object detection by multi-level features learning determined sparse reconstruction	2016	-3.626075135464572	-13.178160673647113	3865333
3866707	Vision	amodal instance segmentation	2016	-3.8433226195070986	-13.287411336322815	3866734
3866833	Robotics	saliency-based object discovery on rgb-d data with a late-fusion approach	2015	-4.104042322310204	-13.06145261867545	3866860
3868858	Vision	motion deblurring of faces	2018	-3.917858435799236	-13.272074140709867	3868885
3870562	AI	a two-stage approach for bag detection in pedestrian images	2014	-3.9243533114838254	-13.16228910514676	3870589
3872204	Vision	person re-identification using deformable part models	2013	-4.0626528737835415	-13.13761580298855	3872231
3873871	AI	temporally consistent depth map prediction using deep convolutional neural network and spatial-temporal conditional random field	2017	-4.141580360875691	-13.075636545805045	3873898
3874611	Vision	prime object proposals with randomized prim's algorithm	2013	-3.5702476647281056	-13.103307606984009	3874638
3875171	Vision	sgpn: similarity group proposal network for 3d point cloud instance segmentation	2018	-3.4628445033034168	-12.957137513649585	3875198
3875721	Vision	robust system for partially occluded people detection in rgb images	2017	-3.5386659088920025	-13.582852653473994	3875748
3875968	Vision	deep texture manifold for ground terrain recognition	2018	-3.97845192547217	-12.935950260410678	3875995
3875973	Vision	poselet-based multiple human identification and cosegmentation	2014	-3.5293842113860405	-13.396710777787455	3876000
3876001	Robotics	efficient temporal consistency for streaming video scene analysis	2013	-3.772909009623176	-13.167959413696954	3876028
3876997	Vision	learning gait component relationships by fusing logic and graphs using markov logic networks	2010	-3.4099369522739904	-13.218012425615726	3877024
3877074	Vision	towards unsupervised learning for automatic multi-class object detection in surveillance videos	2009	-3.9511258165168353	-12.776395005624835	3877101
3880264	Vision	a taxonomy and evaluation of dense two-frame stereo correspondence algorithms	2002	-4.240909416344455	-12.867296160705974	3880291
3882527	AI	salient object detection by lossless feature reflection	2018	-3.5989142556041798	-13.122466611216463	3882554
3883251	Vision	pixel.js: web-based pixel classification correction platform for ground truth creation	2017	-4.061872874528289	-13.365755834387482	3883278
3883733	Vision	video co-segmentation for meaningful action extraction	2013	-3.6170052054075663	-13.587791517675779	3883760
3883740	AI	simple real-time multi-face tracking based on convolutional neural networks	2018	-4.0634938644184215	-12.69329671418107	3883767
3884100	Robotics	feature co-occurrence maps: appearance-based localisation throughout the day	2013	-4.311827523640578	-13.323094684601626	3884127
3885670	Vision	fast aircraft detection using end-to-end fully convolutional network	2016	-3.5953026753247213	-12.775298316414199	3885697
3886283	Vision	personalized 3d-aided 2d facial landmark localization	2010	-4.1250815701084615	-13.181322531613047	3886310
3886626	Vision	segment-tube: spatio-temporal action localization in untrimmed videos with per-frame segmentation	2018	-4.086699161507977	-13.080669918677266	3886653
3886685	Vision	hierarchical convolutional features for long-term correlation tracking.	2017	-3.904439928014941	-13.09654162167247	3886712
3887641	Vision	macrofeature layout selection for pedestrian localization and its acceleration using gpu	2014	-4.025072449331113	-13.275032524696133	3887668
3889822	Vision	extracting primary objects by video co-segmentation	2014	-3.390393337757844	-13.158570903088126	3889849
3890285	Robotics	object discovery in 3d scenes via shape analysis	2013	-3.9607944505400994	-13.544968900309293	3890312
3890404	ML	learning to parse images of articulated bodies	2006	-3.9957713648808126	-13.180511566126619	3890431
3893048	Vision	long-term correlation tracking using multi-layer hybrid features in dense environments	2017	-3.6129073211838567	-12.944273195909055	3893075
3894571	Vision	inference methods for crfs with co-occurrence statistics	2012	-3.4441723874222707	-12.890218610825373	3894598
3895750	Vision	enhanced cascading classifier using multi-scale hog for pedestrian detection from aerial images	2016	-3.69269678127839	-12.883823540622284	3895777
3895877	Robotics	semantic labeling of 3d point clouds with object affordance for robot manipulation	2014	-4.271084592934193	-12.77248193433039	3895904
3897545	Robotics	visual localization based on sequence matching using convnet features	2016	-3.9003607110293657	-12.764263863963427	3897572
3898642	Vision	relaxed pairwise learned metric for person re-identification	2012	-3.819596606135993	-13.530016444980633	3898669
3900689	Robotics	convolutional features selection for visual tracking	2018	-4.1189988572352485	-12.732514023006125	3900716
3901653	Vision	sparse illumination learning and transfer for single-sample face recognition with image corruption and misalignment	2014	-4.020481519885517	-13.06391720503242	3901680
3901990	Vision	artificial color constancy via googlenet with angular loss function	2018	-3.71391759868181	-13.479567891846907	3902017
3902672	Vision	gal: a global-attributes assisted labeling system for outdoor scenes	2017	-3.5357868534983408	-13.029298603384655	3902699
3905375	Vision	a scene-specific deformable part-based model for object detection	2014	-3.6082806082079815	-12.992987237542259	3905402
3909363	Vision	gm-phd filter based online multiple human tracking using deep discriminative correlation matching	2018	-4.034177904099275	-12.876359802282431	3909390
3910110	Vision	a direct fingerprint minutiae extraction approach based on convolutional neural networks	2016	-3.850874933780132	-13.576330298389587	3910137
3910349	Vision	towards the success rate of one: real-time unconstrained salient object detection	2018	-3.699563049384999	-12.824350262552333	3910376
3910764	Vision	fast pedestrian detection based on the selective window differential filter	2017	-3.4814214497596336	-13.532527389563315	3910791
3914874	AI	bi-directional graph structure information model for multi-person pose estimation	2018	-3.403967406374206	-13.00880147308551	3914901
3915250	Vision	retrieving aerial scene images with learned deep image-sketch features	2017	-3.4947680368140563	-13.109375740841337	3915277
3915336	ML	large-scale 3d point cloud classification based on feature description matrix by cnn	2018	-3.3947452269791443	-12.899202283782726	3915363
3915662	Robotics	optimization beyond the convolution: generalizing spatial relations with end-to-end metric learning	2018	-4.275599884083398	-13.068729145866143	3915689
3916732	Vision	detection and localization with multi-scale models	2016	-3.8155989447414416	-13.395428001952205	3916759
3917904	Vision	hierarchical joint cnn-based models for fine-grained cars recognition	2016	-3.769347734902013	-12.747249210789409	3917931
3918111	Vision	a coarse-to-fine model for 3d pose estimation and sub-category recognition	2015	-3.4075836471419843	-13.089549675245607	3918138
3920499	ML	normalized autobinomial markov channels for pedestrian detection	2015	-3.684569742040701	-13.62562882838912	3920526
3922370	Vision	sketch tokens: a learned mid-level representation for contour and object detection	2013	-3.4885816126878706	-13.405591949850573	3922397
3922785	Vision	dense pyramid network for semantic segmentation of high resolution aerial imagery	2018	-3.9039329157289098	-12.919255405528679	3922812
3922808	Vision	cross diffusion on multi-hypergraph for multi-modal 3d object recognition	2018	-3.426560359958789	-13.633513568672084	3922835
3923055	Vision	coarse-to-fine face alignment with multi-scale local patch regression	2015	-3.91931995473103	-13.09711199537526	3923082
3925257	Vision	shape sharing for object segmentation	2012	-4.279504312552705	-13.565826161175142	3925284
3925391	Vision	fusing saliency maps with region proposals for unsupervised object localization	2018	-3.4375011093022905	-12.9606739167396	3925418
3928061	Vision	a framework for actively selecting viewpoints in object recognition	2009	-3.9082829274511672	-13.231158212846534	3928088
3932408	Vision	shape classification through structured learning of matching measures	2009	-3.61763094464325	-12.801834579439852	3932435
3934848	Vision	improved hierarchical conditional random field model for object segmentation	2015	-4.149086014671597	-13.283226615395105	3934875
3936952	Vision	3d hand-object pose estimation from depth with convolutional neural networks	2017	-3.8797441847003498	-12.995498237040927	3936979
3937096	Vision	face recognition from sequential sparse 3d data via deep registration	2018	-4.014452006587356	-12.7281483141784	3937123
3938816	AI	salient object detection with semantic priors	2017	-3.4185752179777857	-13.036536737581052	3938843
3939084	Vision	video shot detection via information theoretic classification	2007	-4.059149802681096	-13.351965560230141	3939111
3939569	Vision	construction of a traffic sign detector based on voting type co-training	2013	-3.6146794826882354	-12.913965442366571	3939596
