id	area	title	year	x	y	ix
3396123	Vision	object category classification using occluding contours	2010	-4.248507657718972	-13.559131252099865	3396150
3397408	AI	robust and efficient graph correspondence transfer for person re-identification	2018	-3.5127171566895163	-13.097442719350967	3397435
3397437	Robotics	deep manifold embedding for 3d object pose estimation	2017	-3.6344138207332506	-13.161714536063492	3397464
3397489	ML	geometry-aware recurrent neural networks for active visual recognition	2018	-3.545918750446557	-12.845880504904118	3397516
3399172	Vision	lcr-net++: multi-person 2d and 3d pose detection in natural images	2019	-3.9160261299174572	-13.033931952341963	3399199
3404945	Vision	weakly supervised metric learning for traffic sign recognition in a lidar-equipped vehicle	2016	-3.4719596404826243	-13.308001904585076	3404972
3406036	Vision	dataset augmentation for pose and lighting invariant face recognition	2017	-4.136467177668731	-13.32252543068276	3406063
3407568	Vision	an exemplar model for learning object classes	2007	-3.628577088662768	-13.505582005049035	3407595
3410849	Vision	detection-based multi-human tracking using a crf model	2011	-3.9046709466161946	-12.998605520396517	3410876
3412082	Vision	fast human pose detection using randomized hierarchical cascades of rejectors	2012	-4.071879638273232	-13.514825634098065	3412109
3413921	Vision	pose estimation and segmentation of multiple people in stereoscopic movies	2015	-4.305127498940797	-12.933623849316527	3413948
3414396	Vision	pointrcnn: 3d object proposal generation and detection from point cloud.	2018	-3.6716242223593945	-13.056162048720186	3414423
3414406	Vision	higher-order class-specific priors for semantic segmentation of 3d outdoor scenes	2016	-3.9580608721033066	-12.697366774137617	3414433
3414536	Vision	images selection and best descriptor combination for multi-shot person re-identification	2017	-3.3942255729239483	-13.61085571912178	3414563
3416030	Visualization	cnns based viewpoint estimation for volume visualization	2018	-3.635264397483209	-13.000845503105607	3416057
3416559	AI	a deep learning-based approach to progressive vehicle re-identification for urban surveillance	2016	-4.047197067390904	-12.725655970235673	3416586
3416905	Vision	learning-based tone mapping operator for image matching	2017	-4.055502088327944	-13.627667706548918	3416932
3417151	Vision	handcrafted and deep trackers: a review of recent object tracking approaches	2018	-4.0159780107209775	-13.074326446319034	3417178
3417372	ML	supervised learning based stereo matching using neural tree	2011	-4.10735297806707	-13.47636460279674	3417399
3418512	Vision	pedestrian recognition by using a kernel-based multi-modality approach	2014	-4.237665546961873	-13.083224360024936	3418539
3423252	Robotics	automatic illumination planning for robot vision inspection system	2018	-3.6955877952596623	-13.63396793898314	3423279
3423401	Robotics	a multi-features fusion method based on convolutional neural network for vehicle recognition	2018	-4.270051229504701	-12.943633206868776	3423428
3424703	Vision	strengths and weaknesses of deep learning models for face recognition against image degradations	2018	-3.8028124092675855	-13.42803188618474	3424730
3425786	Vision	appearance-based gaze block estimation via cnn classification	2017	-3.9340969130864685	-13.633076886295907	3425813
3426945	Vision	compositional human pose regression	2018	-3.49918026029869	-12.686927268148679	3426972
3429003	Vision	part localization using multi-proposal consensus for fine-grained categorization	2015	-3.86381634860281	-12.968693240243885	3429030
3430062	Vision	real-time online action detection forests using spatio-temporal contexts	2017	-3.5372377376787707	-12.903308186690774	3430089
3432638	Vision	feedback mechanism based iterative metric learning for person re-identification	2018	-3.392836384663179	-12.94095349805199	3432665
3435609	Vision	an obstacle categorization system for visually impaired people	2015	-3.537462307998808	-13.401467186860366	3435636
3435919	Vision	adaptive object detection using adjacency and zoom prediction	2016	-3.736489720278517	-13.242405104104295	3435946
3436289	Vision	learning to assign orientations to feature points	2016	-3.6605928104243146	-12.907059458050833	3436316
3439627	Robotics	real-time human pose estimation via cascaded neural networks embedded with multi-task learning	2017	-3.5374015792575757	-12.78875942853951	3439654
3441704	Vision	a deep convolutional neural network for location recognition and geometry based information	2018	-3.5469713682380286	-12.918639862687128	3441731
3443168	Vision	model-free multiple object tracking with shared proposals	2016	-4.1856159685446235	-12.830838218707207	3443195
3443959	ML	instance-based amn classification for improved object recognition in 2d and 3d laser range data	2007	-3.6890001675139055	-13.322776005724617	3443986
3447607	Vision	accurate and robust face recognition from rgb-d images with a deep learning approach	2016	-3.4466437210156613	-13.326389425126985	3447634
3447898	Vision	discriminative estimation of 3d human pose using gaussian processes	2008	-3.999007993029641	-13.302024072596456	3447925
3448117	Vision	a discriminative tracklets representation for crowd analysis	2015	-3.6123986805810864	-13.358417284689956	3448144
3449621	Vision	adaptive cascade threshold learning from negative samples for deformable part models	2017	-3.8216372096781424	-12.739669998238716	3449648
3451383	Vision	textmountain: accurate scene text detection via instance segmentation	2018	-3.6385020047449435	-13.640832386618118	3451410
3451534	Vision	co-saliency detection via sparse reconstruction and co-salient object discovery	2017	-3.5930031434387577	-12.932877498948818	3451561
3452513	Vision	3d-assisted feature synthesis for novel views of an object	2015	-3.5013124931646735	-12.972794928499516	3452540
3453389	Robotics	automatic part localization using 3d cuboid box for vehicle subcategory recognition	2017	-4.230809922583936	-13.00280272611784	3453416
3453609	Robotics	fast relocalisation and loop closing in keyframe-based slam	2014	-3.644744385260656	-13.166644988267686	3453636
3454298	Vision	radar hrrp target recognition based on concatenated deep neural networks	2018	-3.8338543350081564	-12.81678392412637	3454325
3458135	Vision	learning hough regression models via bridge partial least squares for object detection	2015	-3.7996976325110445	-13.572175075289564	3458162
3459540	Vision	parametric local multi-modal metric learning for person re-identification	2014	-3.713269671369889	-13.261936913505135	3459567
3461001	Robotics	fast shadow detection from a single image using a patched convolutional neural network	2018	-3.789038021854088	-12.852123984591858	3461028
3461237	Vision	multi-modal feature fusion network for ghost imaging object detection	2018	-3.877624170400589	-12.784203297393944	3461264
3462555	Vision	image segmentation using consensus from hierarchical segmentation ensembles	2014	-3.5185962186502704	-13.089929661517644	3462582
3463740	Vision	adjusting transient attributes of outdoor images using generative adversarial networks	2017	-3.7377973273482095	-12.8142962497073	3463767
3468210	Vision	semantic segmentation priors for object discovery	2016	-4.168087674367837	-12.789186883528721	3468237
3472865	ML	robust visual tracking based on deep convolutional neural networks and kernelized correlation filters	2018	-4.256029247944179	-12.952028538921333	3472892
3477966	Vision	a convnet for non-maximum suppression	2016	-3.516254485087422	-12.844415138520233	3477993
3478844	Vision	optical flow requires multiple strategies (but only one network)	2017	-3.4904920969347883	-12.845927169863081	3478871
3479942	Vision	boosting nested cascade detector for multi-view face detection	2004	-3.3996546262142657	-13.328581058289892	3479969
3482008	Vision	scale-adaptive forest training via an efficient feature sampling scheme	2015	-3.765645748409576	-13.2903305235413	3482035
3482108	Vision	an efficient system for hazy scene text detection using a deep cnn and patch-nms	2018	-3.945368254792589	-12.811099199008641	3482135
3485016	Vision	deep cascaded bi-network for face hallucination	2016	-3.714644123914228	-13.196303245866275	3485043
3485069	Vision	pointly-supervised action localization	2018	-3.475122493154236	-12.703758297840777	3485096
3489946	Vision	classcut for unsupervised class segmentation	2010	-3.82095879969942	-13.223684752370154	3489973
3490598	Vision	scale-aware face detection	2017	-4.096835547722026	-13.409953899804645	3490625
3492056	Vision	on video based face recognition through adaptive sparse dictionary	2015	-4.188859920350368	-12.916609165335114	3492083
3497106	Vision	boosting objectness: semi-supervised learning for object detection and segmentation in multi-view images	2016	-3.7034138758642334	-13.120300345463045	3497133
3499692	Vision	learning spectral transform network on 3d surface for non-rigid shape analysis	2018	-3.5158671445317906	-13.175611595644135	3499719
3502042	Vision	a new pedestrian detect method in crowded scenes	2013	-4.1997607040658	-13.176341985066465	3502069
3504753	Robotics	visual object tracking based on the object's salient features with application in automatic nutrition assistance	2012	-4.2639277573105705	-13.560295703235562	3504780
3506406	Vision	identifying multiple objects from their appearance in inaccurate detections	2015	-4.187506047325867	-13.168166454983098	3506433
3507467	Vision	semantic instance labeling leveraging hierarchical segmentation	2015	-4.0701585898862325	-13.24136280335924	3507494
3508217	Vision	learning 6d object pose estimation using 3d object coordinates	2014	-4.085260691294821	-12.886752652604619	3508244
3508575	Vision	an evaluation of gamesourced data for human pose estimation	2015	-3.3964967821306757	-12.768567519606318	3508602
3511290	Vision	multishot person reidentification through inlier orientation and consensus clusters	2017	-3.3990913230209414	-13.374811903145266	3511317
3513196	Vision	color distribution pattern metric for person reidentification	2017	-4.325166722306522	-13.295232393851025	3513223
3515925	Vision	an overview of traffic sign detection and classification methods	2017	-4.04323161627016	-13.592022464975289	3515952
3516041	Vision	exploiting low-rank structures from cross-camera images for robust person re-identification	2014	-4.174369663968739	-12.780466494457615	3516068
3516503	Vision	training for task specific keypoint detection	2009	-4.177821010809928	-13.279793749257937	3516530
3519643	Vision	person re-identification using region covariance in a multi-feature approach	2014	-3.61672686217698	-13.486123231593773	3519670
3520004	Vision	part-based deep network for pedestrian detection in surveillance videos	2015	-3.7577589339113184	-12.94421439584475	3520031
3520088	Vision	fast human detection using a novel boosted cascading structure with meta stages	2008	-3.7064833173071694	-13.542201582318391	3520115
3521946	Vision	multimodal classification with deformable part-based models for urban cartography	2014	-3.9100581125359226	-13.32654597055118	3521973
3522071	Vision	learning structured hough voting for joint object detection and occlusion reasoning	2013	-4.264880986417369	-12.995524505309989	3522098
3525890	Vision	kinect-supported dataset creation for human pose estimation	2014	-3.9157802347937154	-13.167706502166936	3525917
3526643	Vision	temporal objectness: model-free learning of object proposals in video	2016	-4.25732979081325	-13.580111211561992	3526670
3527710	Vision	unmasking the abnormal events in video	2017	-3.504482803489257	-13.132530316201008	3527737
3528191	Vision	using object information for spotting text	2018	-3.619908028267727	-13.088833101430698	3528218
3531005	ML	iorn: an effective remote sensing image scene classification framework	2018	-3.61015096358158	-13.055935437308284	3531032
3532197	Vision	a shape preserving approach for salient object detection using convolutional neural networks	2016	-3.936237179066993	-13.513227629488606	3532224
3533614	Vision	box aggregation for proposal decimation: last mile of object detection	2015	-3.6995144249827296	-12.742531224654224	3533641
3534718	Robotics	d-atr via deep neural network for large scene sar images	2018	-4.038037763515891	-12.754421101854394	3534745
3535267	ML	object of interest detection by saliency learning	2010	-3.5685670928969544	-13.411129071920366	3535294
3536344	Vision	a pursuit of temporal accuracy in general activity detection	2017	-4.029264020166915	-13.130398417368948	3536371
3536520	Vision	an unsupervised, online learning framework for moving object detection	2004	-3.588647519334589	-12.83654687750376	3536547
3538292	Vision	support vector regression of sparse dictionary-based features for view-independent action unit intensity estimation	2017	-3.5903918096088665	-13.432279566190006	3538319
3540469	Vision	attention-based traffic sign recognition with an array of weak classifiers	2010	-4.188685365716433	-12.974075637076332	3540496
3541227	Vision	boundary aware image segmentation with unsupervised mixture models	2017	-3.465490214593773	-12.854998397707664	3541254
3542404	Vision	optimal multiclass classifier threshold estimation with particle swarm optimization for visual object recognition	2011	-4.005514021331778	-13.525685018408634	3542431
3543690	AI	person re-identification using salient region matching game	2017	-3.750461502754406	-13.556249596253323	3543717
3544928	Vision	epat: euclidean perturbation analysis and transform - an agnostic data adaptation framework for improving facial landmark detectors	2017	-4.039335924017721	-12.750030544382513	3544955
3545079	ML	see and think: disentangling semantic scene completion	2018	-3.41708290642652	-12.722156184325321	3545106
3551640	Vision	automatic road detection and centerline extraction via cascaded end-to-end convolutional neural network	2017	-3.927258535354046	-12.736956229991694	3551667
3558427	Robotics	distance metric learning for feature-agnostic place recognition	2015	-3.4824419863209117	-12.936179595260187	3558454
3560410	Robotics	self-supervised online learning of appearance for 3d tracking	2017	-4.269319220690898	-12.951442651012368	3560437
3564219	Vision	rapid pedestrian detection in unseen scenes	2011	-4.153678924578338	-13.358175776229755	3564246
3566802	Vision	hierarchical gaussian descriptors with application to person re-identification	2017	-3.5415613735202385	-13.245394601447506	3566829
3567136	Robotics	a new convolutional architecture for vietnamese car plate recognition	2018	-3.678819973320618	-13.30961221203487	3567163
3567709	Vision	learning to segment on tiny datasets: a new shape model	2017	-3.5005949718459464	-13.313818704229028	3567736
3571388	Vision	face recognition using nonlinear locality preserving with deep networks	2015	-3.5124845280454338	-12.872702559973453	3571415
3571672	Vision	transfer learning for pedestrian detection	2013	-3.380477091183765	-13.02869326313236	3571699
3573678	Vision	robust real-time visual object tracking via multi-scale fully convolutional siamese networks	2017	-3.892022598226736	-12.887734590576038	3573705
3576628	Vision	co-recognition of images and videos: unsupervised matching of identical object patterns and its applications	2013	-3.4178242494420386	-13.187360975126904	3576655
3578075	Vision	part-based pose estimation with local and non-local contextual information	2014	-3.610714298345712	-12.904098785041034	3578102
3578767	Vision	learning a dense multi-view representation for detection, viewpoint classification and synthesis of object categories	2009	-3.3750740438431364	-13.22478771930877	3578794
3579089	Vision	shpd: surveillance human pose dataset and performance evaluation for coarse-grained pose estimation	2018	-3.5319734550587953	-13.131174327372484	3579116
3579734	Vision	iterative instance segmentation	2016	-3.725469157608308	-12.8401648811745	3579761
3579788	Vision	semi-supervised facial landmark annotation	2012	-3.7657013315927137	-12.733798623870461	3579815
3581929	Vision	learning effective human pose estimation from inaccurate annotation	2011	-4.290508724948603	-12.874747174305167	3581956
3582002	Vision	multi-image matching for object recognition	2018	-3.466783198905268	-13.206589268764816	3582029
3583210	Vision	video event detection based on over-segmented stv regions	2011	-3.612336932320376	-13.295166985066967	3583237
3583467	Vision	deep adaptive proposal network for object detection in optical remote sensing images	2018	-3.752662215451559	-12.993984630590663	3583494
3584170	Vision	illumination-aware faster r-cnn for robust multispectral pedestrian detection	2019	-3.4911304907253826	-12.690805524786072	3584197
3590104	Vision	introduction to the special issue on machine learning for traffic sign recognition	2012	-4.214035652256544	-12.75930839594761	3590131
3592287	Vision	semantic segmentation of rgb-d images using 3d and local neighbouring features	2015	-3.666216462355588	-12.723881443049269	3592314
3593382	Vision	3d synthesis of man-made objects based on fine-grained parts	2018	-3.6159450382341607	-13.09146870873034	3593409
3594011	Vision	pedestrian detection based on sparse coding and transfer learning	2013	-3.7726258035590168	-12.785993020932837	3594038
3595504	Vision	dff-den: deep feature flow with detail enhancement network for hand segmentation in depth video	2018	-4.0336037791750625	-12.927910183299401	3595531
3596117	Vision	orgm: occlusion relational graphical model for human pose estimation	2017	-3.5008935115102067	-13.043639824736776	3596144
3596162	Vision	collaborative receptive field learning	2014	-3.584780592130433	-13.170500546498227	3596189
3597043	Vision	a rotation invariant 3d indoor scene labeling approach based on conditional random fields	2017	-3.4856710056449884	-13.362870624349332	3597070
3598352	Vision	multiview 3d human pose estimation using improved least-squares and lstm networks	2019	-4.288044986661719	-12.739631319378665	3598379
3599906	Vision	real-time egocentric gesture recognition on mobile head mounted displays	2017	-3.859398733135479	-12.814987636289525	3599933
3601859	Vision	multiple viewpoint recognition and localization	2010	-4.157865468951395	-12.729502198274556	3601886
3602604	Vision	in-bed pose estimation: deep learning with shallow dataset	2017	-3.3995312471144485	-12.74333215284976	3602631
3604553	AI	detecting abnormality without knowing normality: a two-stage approach for unsupervised video abnormal event detection	2018	-3.8208897807399143	-13.022009376703489	3604580
3606166	Vision	once for all: a two-flow convolutional neural network for visual tracking	2018	-4.024907383927813	-12.881032586884876	3606193
3606289	AI	multi-spectral pedestrian detection	2015	-3.552625905819116	-12.827807685106682	3606316
3607755	Vision	an efficient scene semantic labeling approach for 3d point cloud	2015	-3.503744819731183	-13.040860265871475	3607782
3608021	Vision	co-spectral for robust shape clustering	2016	-3.5187400985628634	-13.341759132309587	3608048
3608137	Vision	learning discriminative and transformation covariant local feature detectors	2017	-4.076546279089187	-13.62879636946977	3608164
3609747	Vision	a field model for repairing 3d shapes	2016	-4.044389575726568	-12.837539463350316	3609774
3609878	AI	learning deep event models for crowd anomaly detection	2017	-3.4686031985953285	-12.938880487752199	3609905
3611007	AI	dynamic background learning through deep auto-encoder networks	2014	-3.4915650650639667	-12.709562055139775	3611034
3612230	Vision	occlusion-aware r-cnn: detecting pedestrians in a crowd	2018	-3.8540573612229023	-12.860455500473863	3612257
3613068	Vision	bag of features tracking	2010	-4.2862442160494805	-13.605545826958735	3613095
3613310	ML	instance segmentation and object detection with bounding shape masks	2018	-3.914380987508424	-13.421712301156733	3613337
3614373	ML	detecting domestic objects with ensembles of view-tuned support vector machine cascades trained on web images	2011	-3.9008295836397937	-13.575139299053154	3614400
3616613	Vision	aggregate channel features for multi-view face detection	2014	-3.37711991448268	-13.224578293413275	3616640
3618608	Vision	masquer hunter: adversarial occlusion-aware face detection	2017	-3.7224751159482503	-13.005065472210115	3618635
3620376	Vision	exploit the unknown gradually: one-shot video-based person re-identification by stepwise learning	2018	-4.113142449382474	-12.891972256989447	3620403
3621041	Vision	co-segmentation of non-homogeneous image sets	2018	-3.6902190937067214	-12.828367963949434	3621068
3621265	Vision	synthesizing normalized faces from facial identity features	2017	-3.4810223230760284	-13.00114637528186	3621292
3622393	Vision	consistent matching based on boosted salience channels for group re-identification	2016	-3.801905686064978	-13.319052132058895	3622420
3624234	Vision	deep learning for robust outdoor vehicle visual tracking	2017	-3.918566486267532	-12.927378132136088	3624261
3625897	Vision	convolutional encoder-decoder networks for pixel-wise ear detection and segmentation	2018	-3.589107693056301	-13.326226181523484	3625924
3627709	Vision	head pose estimation in the wild using approximate view manifolds	2015	-3.6105543943535383	-13.391321108688214	3627736
3627874	Vision	nonparametric scene parsing via label transfer	2011	-3.781457928999465	-13.107645741603568	3627901
3629640	Robotics	robotic grasp detection using extreme learning machine	2015	-4.276461082085143	-13.330411716717474	3629667
3630192	AI	deep low-resolution person re-identification	2018	-3.365073675569336	-13.133094408354314	3630219
3630371	Vision	convolutional regression for visual tracking	2018	-4.243166302119679	-12.71454545703506	3630398
3633043	Vision	hierarchical contextual refinement networks for human pose estimation	2018	-3.46126880053558	-12.968904399962248	3633070
3634825	Vision	learning to detect small impact craters	2005	-3.9468766893371434	-13.045125156280243	3634852
3635556	Vision	unsupervised co-segmentation through region matching	2012	-3.957031732177488	-13.312685461902795	3635583
3636635	Vision	joint 2d-3d temporally consistent semantic segmentation of street scenes	2012	-4.189795138426157	-12.745389023668661	3636662
3637493	Vision	dasc: dense adaptive self-correlation descriptor for multi-modal and multi-spectral correspondence	2015	-4.106092837516522	-13.127755100743759	3637520
3641066	Graphics	i23 - rapid interactive 3d reconstruction from a single image	2009	-4.259371886736202	-12.694314429944011	3641093
3642800	Vision	sparse coding based visual tracking: review and experimental comparison	2013	-3.833578248636079	-13.439805866751314	3642827
3646882	Vision	learning hough forest with depth-encoded context for object detection	2012	-3.6925657213606926	-13.474351495367895	3646909
3648836	Vision	deep learning of graph matching	2018	-3.7835114801594116	-12.762103225583449	3648863
3648999	ML	subordinate class recognition using relational object models	2006	-3.5027945255325124	-13.510988466241471	3649026
3649039	Vision	mixing hierarchical contexts for object recognition	2011	-3.453208727643704	-13.237124550507982	3649066
3649384	Vision	boundary flow: a siamese network that predicts boundary motion without training on motion	2018	-4.040221752044031	-12.919993222479777	3649411
3650537	Vision	pedestrian recognition using a dynamic modality fusion approach	2015	-4.044184797029228	-13.512151646416145	3650564
3657196	Vision	an efficient ip approach to constrained multiple face tracking and recognition	2011	-3.9312857857628183	-13.174412459640946	3657223
3657249	Vision	discriminative learning with latent variables for cluttered indoor scene understanding	2010	-4.327361290051429	-12.766860378530993	3657276
3657603	NLP	stereoscopic video quality assessment based on 3d convolutional neural networks	2018	-3.6722490559542917	-12.926950063168954	3657630
3661167	Vision	dense appearance modeling and efficient learning of camera transitions for person re-identification	2012	-3.4128173786761056	-13.450384056209035	3661194
3661480	Vision	localizing parts of faces using a consensus of exemplars	2011	-4.293040879638806	-13.173372632286858	3661507
3661627	Vision	r2p: recomposition and retargeting of photographic images	2015	-3.3705499432938875	-13.446461734629256	3661654
3662406	Vision	learning category-specific 3d shape models from weakly labeled 2d images	2017	-3.5348780205534918	-12.86531195761391	3662433
3665374	Vision	random forests for real time 3d face analysis	2012	-4.175345037263874	-12.852401961318712	3665401
3668144	Vision	learning object detection from a small number of examples: the importance of good features	2004	-3.7864678478654303	-13.548247462592135	3668171
3668861	AI	real-time and robust object tracking in video via low-rank coherency analysis in feature space	2015	-4.261077266882554	-13.242602994918661	3668888
3669206	Vision	learning to find good correspondences	2018	-4.17340748293596	-13.062017859542511	3669233
3670092	Vision	cascade multi-view hourglass model for robust 3d face alignment	2018	-3.5890270722255027	-13.012507781039664	3670119
3670455	Vision	face verification with local sparse representation	2013	-3.4376125495271546	-13.291838270224154	3670482
3672747	ML	detecting abnormal events in video using narrowed motion clusters	2018	-3.7485093170867985	-13.006036553299039	3672774
3673195	Vision	fully convolutional siamese fusion networks for object tracking	2018	-3.8282035931314	-12.987561140816453	3673222
3673529	ML	eye landmarks detection via two-level cascaded cnns with multi-task learning	2018	-4.121497069284659	-12.938838134492993	3673556
3674982	Vision	online detection and classification of moving objects using progressively improving detectors	2005	-4.017432735661306	-12.772259637626007	3675009
