id	area	title	year	x	y	ix
1605789	HCI	how wechat can retain users: roles of network externalities, social interaction ties, and perceived values in building continuance intention	2017	22.756159573920414	-2.29295865974341	1605816
1606415	HCI	exploring the dual outcomes of mobile social networking service enjoyment: the roles of social self-efficacy and habit	2016	22.719908743583797	-2.323199356655696	1606442
1607672	HCI	predicting information-seeking intention in academic digital libraries	2009	22.357494692985426	-2.5070923238183287	1607699
1612409	HCI	privacy concerns versus desire for interpersonal awareness in driving the use of self-disclosure technologies: the case of instant messaging in two cultures	2011	22.42961992553026	-2.631384315109876	1612436
1613245	HCI	developing a sense of virtual community measure	2007	21.889626269367284	-2.422397971209479	1613272
1613765	HCI	examining explorative and exploitative uses of smartphones: a user competence perspective	2015	22.811936821499	-2.2633713013975094	1613792
1617180	Metrics	the role of social networking in the social reform of young society	2015	22.06022840381807	-2.8367946813562317	1617207
1617627	HCI	understanding social networking sites adoption in china: a comparison of pre-adoption and post-adoption	2011	22.770101494326013	-2.4168608048485174	1617654
1618952	SE	application of theory of reasoned action in u-health system	2015	22.57897890235761	-2.1507892236302637	1618979
1619860	HCI	predicting users' acceptance of e-library from the perspective of technology acceptance model	2011	22.035017439817725	-2.509421484088464	1619887
1621271	HCI	physicians' behavior intentions regarding the use of mobile technology: an exploratory study	2004	22.661121749525147	-2.5420658759103345	1621298
1621494	ML	the contribution of online news attributes to its diffusion: an empirical exploration based on a proposed theoretical model for the micro-process of online news adoption/use	2008	22.200949196063338	-2.1843064285580067	1621521
1622613	HCI	"""""""chill with friends"""" - continuous engagement in social virtual worlds among digital natives"""	2012	22.353067107633848	-2.190649099805912	1622640
1626954	HCI	influence of sns user innovativeness and public individuation on sns usage patterns and social capital development: the case of facebook	2016	22.5960386493185	-2.2539811652460955	1626981
1630431	Web+IR	explaining the intended continuance level of telecommuting	2008	22.517487435262343	-2.196648258436793	1630458
1631674	ML	do online reviews reflect a product's true perceived quality? - an investigation of online movie reviews across cultures	2010	23.005790915406084	-2.205312189970856	1631701
1637596	HCI	use of social networking sites for product communication: a comparative study of hispanics and non-hispanic whites	2015	22.696034413726462	-2.2787568389564394	1637623
1637751	NLP	what drives members to continue sharing knowledge in a virtual professional community? the role of knowledge self-efficacy and satisfaction	2007	22.194142907639712	-2.2885696520886087	1637778
1638157	HCI	antecedents and outcomes of participation in social networking sites	2013	22.512305142677132	-2.295204018150841	1638184
1639653	HCI	examining reactance and reactance restoration with south korean adolescents: a test of psychological reactance within a collectivist culture	2009	21.992880672149926	-2.1791780799243408	1639680
1641528	HCI	a dual-path communication model for the context of mobile apps	2018	22.37087745816444	-2.31467389942032	1641555
1641574	HCI	exposure to online hate material and social trust among finnish youth	2015	22.14030838364661	-2.5502351599938784	1641601
1642603	HCI	what trigger people use physician-patient interactive ohcs? an empirical research based integration model	2015	22.569263098725237	-2.4575140485610816	1642630
1644114	HCI	the differences of user perceived interactivity between two features of web site design	2015	23.07154960936918	-2.4978616912578704	1644141
1646841	HCI	knowledge sharing in enterprise business simulative games: an empirical analysis	2015	21.851349014683656	-2.1859751759870685	1646868
1656026	AI	integrating personality and social networks: a meta-analysis of personality, network position, and work outcomes in organizations	2015	22.06635989579204	-2.181163092815789	1656053
1659539	HCI	testing for the applicability of the tam model in the arabic context: exploring an extended tam with three moderating factors	2008	22.540387445304574	-2.3064269024558492	1659566
1659623	NLP	converging coolness and investigating its relation to user experience	2017	22.808284471886267	-2.351366793705791	1659650
1659782	HCI	digital natives or digital immigrants? the impact of user characteristics on online trust	2014	22.253194273816973	-2.2498989292548046	1659809
1663316	HCI	the influence of familiarity, trust and norms of reciprocity on an experienced sense of community: an empirical analysis based on social online services	2015	22.595828752771872	-2.23722019584162	1663343
1668888	AI	the role of intentions in facebook usage among educated youth in pakistan: an extension of the theory of planned behavior	2017	22.42228455455616	-2.5011298715296606	1668915
1669204	HPC	the asymmetric effect of website attribute performance on satisfaction: an empirical study	2005	22.88642120194905	-2.1397209545448157	1669231
1670363	AI	exploring knowledge sharing in virtual communities	2013	22.283931047912134	-2.2789352606604494	1670390
1671444	AI	factors influence intention to adopt internet medical information on bulletin boards: a heuristic-systematic perspective	2017	22.79882130921151	-2.1935950609041344	1671471
1674122	HCI	individual differences, self-efficacy, and chinese scientists' industry engagement	2017	22.205570966794248	-2.604276463643232	1674149
1677178	HCI	motivating content contributions to online communities: toward a more comprehensive theory	2005	22.150505664546234	-2.248765909223628	1677205
1684510	HCI	sns flow, sns self-disclosure and post hoc interpersonal relations change: focused on korean facebook user	2014	22.710837138155327	-2.5101971157790963	1684537
1686520	HCI	a meta-analysis of factors influencing the development of trust in automation: implications for understanding autonomy in future systems	2016	22.224238840006624	-2.3944368806578264	1686547
1686985	NLP	interplay of cognition and emotion in is usage: emotion as mediator between cognition and is usage	2015	21.973974197827737	-2.1681314057397727	1687012
1688686	HCI	smartphones: user engagement motivations effect on their value, satisfaction, and future engagement intention	2012	23.018603508690724	-2.351500577879244	1688713
1689746	SE	testing and extending p-transqual public transport service quality model: a causal approach	2018	22.99342918098823	-2.168152862545316	1689773
1696256	HCI	continuance intention of e-learning platform: toward an integrated model	2010	22.614741112093657	-2.5433081223627725	1696283
1697687	Mobile	technology acceptance model for the use of tablet pcs	2013	22.82505422130793	-2.2368182738427183	1697714
1697843	HCI	critical factors for the adoption of mobile nursing information systems in taiwan: the nursing department administrators’ perspective	2008	22.100416579392654	-2.16535018242324	1697870
1701228	HCI	enhancing performance through goal setting, engagement, and optimism	2009	21.904974599649268	-2.143273291657956	1701255
1711925	AI	user satisfaction with portals: testing for factorial validity and invariance across age groups	2013	22.526437905721945	-2.4024326080593634	1711952
1716113	AI	gamification in the workplace: the central role of the aesthetic experience	2017	22.408139443816854	-2.3678820685370905	1716140
1716238	SE	the effects of cognitive style and model type on dss acceptance: an empirical study	2001	22.298964266631017	-2.4159358452785247	1716265
1718517	DB	testing a model of adoption and continued use of personally controlled electronic health record (pcehr) system among australian consumers: a preliminary study	2018	22.528859002425524	-2.213308966494122	1718544
1719067	DB	toward an understanding of web-based subscription database acceptance	2006	22.592249887291345	-2.321801547262255	1719094
1719428	HCI	seniors' loyalty to social network sites: effects of social capital and attachment	2016	22.440606039583898	-2.514011492869736	1719455
1724263	ECom	how does social presence influence sns addiction? a belongingness theory perspective	2017	22.655317316058284	-2.4503090594913983	1724290
1728711	HCI	exploring the impact of use context on mobile hedonic services adoption: an empirical study on mobile gaming in china	2011	22.86662786851032	-2.298911915854482	1728738
1729838	HCI	impact of individual differences on the use of mobile phones and applications	2016	22.87158110784616	-2.2764678959919262	1729865
1731875	HCI	determinants of adoption of mobile health services	2015	22.42156294624669	-2.2909807162057323	1731902
1736229	Metrics	investigating member commitment to virtual communities using an integrated perspective	2012	22.22643971546109	-2.3152792687867088	1736256
1736837	HCI	social capital on mobile sns addiction: a perspective from online and offline channel integrations	2016	22.459657427798195	-2.2038593236321318	1736864
1737392	HCI	the role of trust in web-based election system usability	2014	22.499850129399352	-2.4092578911063725	1737419
1737594	HCI	facebook, relatedness and exercise motivation in university students: a mixed methods investigation	2019	22.184852036353227	-2.437611518780336	1737621
1737753	HCI	assessing flow experience in social networking site based brand communities	2016	22.556587375300204	-2.2030029785221865	1737780
1738978	HCI	the interplay of intrinsic need satisfaction and facebook specific motives in explaining addictive behavior on facebook	2014	22.297713309455556	-2.1916362712008013	1739005
1739320	HCI	consumer acceptance of windows 7 and office 2010 - the moderating effect of personal innovativeness	2012	22.704768353165804	-2.47316166551084	1739347
1739412	HCI	how does personality matter? an investigation of the impact of extraversion on individuals' sns use	2013	22.76570668796761	-2.329236130537393	1739439
1744715	HCI	social influence on health it adoption patterns of the elderly: an institutional theory based use behavior approach	2015	22.319208757054195	-2.449033677413245	1744742
1753754	HCI	assessing motivation of contribution in online communities: an empirical investigation of an online travel community	1998	22.212558764221853	-2.23759680542883	1753781
1758212	SE	the structure of web-based information systems satisfaction: testing of competing models	2008	22.731763720688896	-2.5145517742749313	1758239
1758704	HCI	experiential motives for playing online games	2007	22.66734953500284	-2.183112001414926	1758731
1769660	HCI	mobile health services: a new paradigm for health care systems	2015	22.712834527485548	-2.320074840051608	1769687
1770034	HCI	the social context of turnover among information technology professionals	2002	22.084200405610947	-2.246887978230624	1770061
1770167	Metrics	adoption of fitness wearables: insights from partial least squares and qualitative comparative analysis	2018	22.89899591394102	-2.16891493874944	1770194
1771745	HCI	an analysis of young people's use of and attitudes toward cell phones	2003	22.15342604924829	-2.695408794661234	1771772
1773537	HCI	understanding information technology acceptance by individual professionals: toward an integrative view	2006	22.209101039467782	-2.376192189827928	1773564
1777586	HCI	why do you keep doing that? the biasing effects of mental states on it continued usage intentions	2017	22.40905395084004	-2.1588935146618438	1777613
1780391	HCI	categorizing consumer behavioral responses and artifact design features: the case of online advertising	2015	22.93575833958875	-2.317668688934324	1780418
1783446	HCI	personality and espoused cultural differences in technostress creators	2017	21.97140620077383	-2.4267198342285097	1783473
1784711	HCI	a meta-analysis of e-health applications acceptance: moderating impact of user types and e-health application types	2017	22.017335272423296	-2.573756060519113	1784738
1788313	HPC	health information service adoption: case of telemedicine	2009	22.483903230980374	-2.6407568819860123	1788340
1788522	HCI	the role of espoused national cultural values in technology acceptance	2006	21.985455718877066	-2.4486931064782027	1788549
1792805	AI	internet messaging: an examination of the impact of attitudinal, normative, and control belief systems	2008	22.585504276588612	-2.3502340645188684	1792832
1793108	HCI	explaining unplanned online media behaviors: dual system theory models of impulsive use and swearing on social networking sites	2018	21.842760010966014	-2.1447786191204794	1793135
1796212	HCI	information systems post-adoption satisfaction and dissatisfaction: a study in the e-learning context	2011	22.260345811779423	-2.5117477113999054	1796239
1796519	HCI	why would online gamers share their innovation-conducive knowledge in the online game user community? integrating individual motivations and social capital perspectives	2011	22.496085989169696	-2.1834063898030167	1796546
1799288	HCI	does survey format influence self-disclosure on sensitive question items?	2012	21.996763063216587	-2.4306671662813994	1799315
1800545	HCI	let's work together! we-intention to use instant messaging for e-collaboration	2007	22.55785559049286	-2.321656730573917	1800572
1811915	HCI	transition from urge to excessive use of social networking sites: the moderating role of self-control and accessibility	2015	22.16226512036523	-2.2328663981764283	1811942
1813535	HCI	examining the relationships among personality traits, it-specific traits, and perceived ease of use	2007	22.55939843817782	-2.3612896125732954	1813562
1813894	HCI	effective use of human physiological metrics to evaluate website usability: an empirical investigation from china	2017	23.03403041451552	-2.1600583102641577	1813921
1814611	HCI	perception and use of social networking sites among undergraduate students in kuwait	2013	21.9779069569381	-2.9329723459840142	1814638
1816199	HCI	voyeurism and exhibitionism as gratifications from prosuming social networking sites	2014	22.486063545720267	-2.1845041987617284	1816226
1816391	HCI	adoption of mobile apps for mental health: socio-psychological and technological factors	2017	22.537569903554502	-2.358786124607206	1816418
1817817	ECom	the influence of personality traits and social networks on the self-disclosure behavior of social network site users	2016	22.543349266978193	-2.386031079348572	1817844
1821047	HCI	exploring the adoption of sports brand apps: an application of the modified technology acceptance model	2018	23.05050801616372	-2.137333259537876	1821074
1822552	HCI	understanding the effects of gratifications on the continuance intention to use wechat in china: a perspective on uses and gratifications	2018	22.701015130483285	-2.3098650879112452	1822579
1827647	AI	enjoyment fosters media use frequency and determines its relational outcomes: toward a synthesis of uses and gratifications theory and media multiplexity theory	2016	22.142776165970588	-2.380083485970145	1827674
1827861	HCI	good samaritans on social network services: effects of shared context information on social supports for strangers	2013	22.684198126369967	-2.38588958557621	1827888
1831965	HCI	managing the risk of overusing mobile phones in the working environment: a study of ubiquitous technostress	2011	22.09493628482096	-2.2726023344929858	1831992
1836346	HCI	how does interactivity contribute to a smart tv user experience?	2014	22.66054337280752	-2.2233832314097395	1836373
1836451	HCI	the interaction of trait competitiveness and leaderboard design - an experimental analysis of effects on perceptions and usage intention	2018	22.05052724834348	-2.1388468412447588	1836478
1837349	AI	the influence of attitudes on personal computer utilization among knowledge workers: the case of saudi arabia	1999	22.071472559222236	-2.288646482635577	1837376
1842224	HCI	exploring the adoption of technology driven services in the healthcare industry	2010	22.531345427974433	-2.5205113720699064	1842251
1847235	AI	field effects of social media platforms on information-sharing continuance: do reach and richness matter?	2017	22.446592136941337	-2.305646583791256	1847262
1848325	HCI	driver acceptance of car navigation systems: integration of locational accuracy, processing speed, and service and display quality with technology acceptance model	2013	23.06272168886496	-2.2082810503016805	1848352
1849845	HCI	facebook and google usage in taiwan's college students	2012	22.48626683987045	-2.411616495671556	1849872
1850696	Web+IR	exploring the personality trait of self-monitoring on technology usage of web portals	2008	22.360300971716214	-2.317116481845078	1850723
1856302	HCI	interactivity, engagement, and technology dependence: understanding users' technology utilisation behaviour	2017	22.790986735438537	-2.2848081466230123	1856329
1857261	HCI	expansion of mobile information service needs toward improving quality of life in japan	2016	22.320411958703726	-2.2727810056762414	1857288
1857265	SE	readiness measurement model (rmm): mathematical-based evaluation technique for the quantification of knowledge acquisition, individual understanding, and interface acceptance dimensions of software applications on handheld devices	2016	22.410470921068214	-2.505451384363164	1857292
1857553	HPC	an empirical assessment of a modified technology acceptance model	1996	22.344869316507054	-2.160906597925563	1857580
1858174	HCI	the role of users' motivations in generating social capital building and subjective well-being: the case of social network games	2014	22.763251416290828	-2.481633914955821	1858201
1859843	Security	utilitarian and hedonic motivations for live streaming shopping	2018	22.98497477225691	-2.186703589487756	1859870
1861106	HCI	examining the impacts of perceived value and perceived quality on users' intention to join web 2.0 communities	2009	22.88822391300981	-2.2329336629754333	1861133
1862916	HCI	the role of internet addiction in online game loyalty: an exploratory study	2008	22.691555394883448	-2.160378684031718	1862943
1868799	HCI	job seekers' acceptance of job recommender systems: results of an empirical study	2018	22.82288841766539	-2.2527850796507205	1868826
1877840	HCI	quitting the use of a habituated hedonic information system: a theoretical model and empirical examination of facebook users	2015	22.59112964128429	-2.389164540622084	1877867
1883700	HCI	understanding music sharing behavior in china: development of an instrument	2008	21.96460283880165	-2.2287427780999165	1883727
1886454	NLP	mobile phone dependency and its impacts on adolescents' social and academic behaviors	2016	22.380856782564997	-2.8248064950833665	1886481
1889409	SE	applying the technology acceptance model and flow theory to cyworld user behavior: implication of the web2.0 user acceptance	2008	22.763157375520848	-2.150993005148538	1889436
1891327	Theory	an empirical study of an extended technology acceptance model for online video services	2009	22.693983391712365	-2.2194222942572126	1891354
1897620	HCI	hypotheses of information-seeking satisfaction gaps: demographics, sources usage, and person-source fit	2015	22.236130128157207	-2.4481691445198064	1897647
1899829	ECom	exploring the optimal path to online game loyalty: bayesian networks versus theory-based approaches	2011	22.979862693325877	-2.269540952052685	1899856
1899882	HCI	does privacy threat matter in mobile health service? from health belief model perspective	2016	22.329450252851835	-2.1621753451252177	1899909
1900224	Web+IR	impacts of social network structure on knowledge sharing in open source software development teams	2008	22.06264098790397	-2.303978168083397	1900251
1900972	HCI	technology generation and media usage in b-2-b communication: a cross-cultural view	2015	21.980442462566906	-2.742525552174251	1900999
1902313	HCI	user-orientated perspective of social media used by campaigns	2017	22.873076963049144	-2.154069000718396	1902340
1902474	HCI	digital divide in social networking sites	2013	22.407198607403263	-2.2507562675472155	1902501
1902689	Web+IR	user goals in social virtual worlds: a means-end chain approach	2010	22.53694467228224	-2.1998340584796794	1902716
1903129	HCI	a study on the factors influencing the intention of blog usage	2009	22.753187183823442	-2.2769425502419907	1903156
1905017	HCI	physicians' acceptance of mobile communication technology: an exploratory study	2006	22.620422589882587	-2.477812007538964	1905044
1911280	HCI	clinical acceptance of a low-cost portable system for postural assessment	2002	22.32046334007101	-2.5979757799042305	1911307
1917021	HCI	mobile instant messaging use and social capital: direct and indirect associations with employee outcomes	2017	22.619240992365608	-2.2608627532755983	1917048
1925140	HCI	the effects of system trial on consumer beliefs in marketing software	2004	22.867232807696308	-2.4623267035833245	1925167
1926136	HCI	gender and age differences in employee decisions about new technology: an extension to the theory of planned behavior	2005	22.18621453313311	-2.3993907746094343	1926163
1933344	Web+IR	impact of tie strength and experience on the effectiveness of online service recommendations	2016	22.84800456666757	-2.269390315001841	1933371
1934767	HCI	excessive use of online video streaming services: impact of recommender system use, psychological factors, and motives	2018	23.05640733710151	-2.2007160353179547	1934794
1936325	HCI	user acceptance of 'smart products': an empirical investigation	2011	22.61034276592809	-2.40048405542094	1936352
1937637	HCI	critical factors influencing hospitals’ adoption of hl7 version 2 standards: an empirical investigation	2010	22.238067438695435	-2.512231583227116	1937664
1940793	AI	expressive aesthetics to ease perceived community support: exploring personal innovativeness and routinised behaviour as moderators in tuenti	2010	22.56948064589474	-2.57967329311668	1940820
1942596	HCI	habit: how does it develop, and affect continued usage of chinese users on social networking websites?	2014	22.744319064216157	-2.3101002820830687	1942623
1943217	HCI	understanding and predicting compulsive smartphone use: an extension of reinforcement sensitivity approach	2014	22.546049937672773	-2.2391238461355	1943244
1943358	HCI	it is all about being popular: the effects of need for popularity on social network site use	2012	22.59669639028809	-2.400617769364269	1943385
1944253	HCI	a theoretical acceptance model for computer-based communication media: nine field studies	2012	22.441400443289027	-2.1390592930461345	1944280
1944289	HCI	the roles of computer self-efficacy and outcome expectancy in influencing the computer end-user's organizational commitment	2003	21.86479830202267	-2.420087211520586	1944316
1952043	Crypto	examination of the factors that influence teleworkers' willingness to comply with information security guidelines	2012	22.155799402364106	-2.1418398991577967	1952070
1952377	HCI	expectation confirmation in technology use	2012	22.4552173561818	-2.1498172144995027	1952404
1954372	HCI	factors influencing adoption of ubiquitous internet amongst students	2015	22.48595606728979	-2.4231758874068468	1954399
1956328	HCI	social influence on technology acceptance behavior: self-identity theory perspective	2006	22.34005196261063	-2.2078084651601984	1956355
1960152	HCI	the abcd typology: profile and motivations of turkish social network sites users	2017	22.27669067508477	-2.410890033416101	1960179
1962153	HCI	moa and tra in social commerce: an integrated model	2011	22.71095653978511	-2.242174830365716	1962180
1962880	HCI	the impacts of emotional contagion and emotional labor perception on employees' service performance	2010	22.65017964843853	-2.1999070973346	1962907
1963647	HCI	the privacy problem in big bata applications: an empirical study on facebook	2013	21.965683408974147	-2.49117923246811	1963674
1964174	DB	building guanxi network in the mobile social platform: a social capital perspective	2019	22.664809939139747	-2.3827955788191058	1964201
1967663	HCI	mobile-media pragmatism: innovation excellences and encumbrances	2017	22.669223875376296	-2.1494986281890798	1967690
1970082	HCI	how does e-mail use affect perceived control of time?	2014	22.253653743230586	-2.255541926723034	1970109
1976579	HCI	heads-down tribes across four asian countries: antecedents of smartphone addiction	2017	22.680192270507593	-2.4563908664889373	1976606
1977537	DB	a study of personal computer utilization by managers	1990	21.898319317462768	-2.4574371135091218	1977564
1978048	HCI	an empirical study of collective continuance intention on virtual community page of social network site	2013	22.289513785377988	-2.393498396948379	1978075
1982231	HCI	value systems and intentions to interact in social media: the digital natives	2017	22.549162414100675	-2.3131065031976834	1982258
1985435	HCI	the australian general public's perceptions of having a personally controlled electronic health record (pcehr)	2014	22.403672048262624	-2.3668487952601693	1985462
1985654	HCI	student information system satisfaction in higher education: the role of visual aesthetics	2018	22.482729098204455	-2.2727265886880685	1985681
1986407	HCI	mobile augmented reality for environmental awareness: a technology acceptance study	2018	22.673625657471906	-2.294224822678009	1986434
1986791	HCI	a model of acceptance of augmented-reality interactive technology: the moderating role of cognitive innovativeness	2015	22.46277757568152	-2.146289087891425	1986818
1988864	HCI	is communication competence still good for interpersonal media?: mobile phone and instant messenger	2011	21.880330966119228	-2.2547550039315487	1988891
