id	area	title	year	x	y	ix
2655950	HCI	should ai-based, conversational digital assistants employ social- or task-oriented interaction style? a task-competency and reciprocity perspective for older adults	2019	22.90096805734757	-2.2643793861362287	2655977
2659771	HCI	unanticipated software use by adolescents following mandatory adoption	2002	22.00080382006053	-2.7658569871972998	2659798
2663701	HCI	factors impacting the intention to use emergency notification services in campus emergencies: an empirical investigation	2016	21.877498746860603	-2.167455288887349	2663728
2665087	ECom	effects of simultaneous auctions on willingness-to-pay in online auctions	2012	23.57238379220759	-2.249999654558723	2665114
2670481	HCI	exploring success factors of video game communities in hierarchical linear modeling: the perspectives of members and leaders	2009	22.39001133989019	-2.2005566694106085	2670508
2671913	Web+IR	modelling use continuance in virtual worlds: the case of second life	2009	22.524471832813468	-2.5359345381720537	2671940
2675579	ML	take me back: validating the wayback machine	2007	21.90004325055045	-2.176433633281392	2675606
2678986	HCI	beyond hedonic enjoyment: conceptualizing eudaimonic motivation for personal informatics technology usage	2017	22.470582154039374	-2.513483583761869	2679013
2679187	HCI	development and validation of the multimodal presence scale for virtual reality environments: a confirmatory factor analysis and item response theory approach	2017	22.00313425639089	-2.388447984899951	2679214
2683195	Arch	predicting user satisfaction, strain and system usage of employee self-services	2006	22.628700838958835	-2.227323013849414	2683222
2690961	HCI	a review of theory and research based on uses and gratifications in hci	2011	22.547010733149207	-2.1529295479646837	2690988
2697599	AI	the information culture of higher education institutions: the estonian case	2016	21.812829037634607	-2.8296464900062017	2697626
2700165	HCI	elaborating the technology acceptance model with social pressure and social benefits for social networking sites (snss)	2012	22.778441549044203	-2.2317625237201653	2700192
2700520	DB	the effects of personalization on user continuance in social networking sites	2014	22.82150238576718	-2.477825897067308	2700547
2702157	HCI	"""""""being sexy"""" and the labor market: self-objectification in job search related social networks"""	2017	22.361712052347773	-2.417122849238248	2702184
2707347	HCI	appropriate or remix? the effects of social recognition and psychological ownership on intention to share in online communities	2016	22.109096697474552	-2.3119065162953336	2707374
2710920	HCI	examining gender effects in technology acceptance by arabian workers: a survey study	2010	21.874071826758428	-2.348946692401248	2710947
2714758	HCI	experiencing flow with instant messaging and its facilitating role on creative behaviors	2010	22.55436342281646	-2.5195505788003847	2714785
2718583	NLP	why do students use what's app? - an exploratory study	2015	22.263434770838774	-2.9904433395051497	2718610
2725405	HCI	social networking and adjustments among international students	2012	22.102757876797067	-3.1580805151149614	2725432
2727434	HCI	factors influencing bloggers' perceived indentifiability	2009	22.245215064301924	-2.1953505186097657	2727461
2729352	Web+IR	adoption intention in gss: relative importance of beliefs	1995	22.38608242414857	-2.148810222588805	2729379
2729709	HCI	differential innovation of smartphone and application use by sociodemographics and personality	2015	22.559119517549124	-2.2567399246680027	2729736
2731714	HCI	new technology in personnel selection: how recruiter characteristics affect the adoption of new selection technology	2013	22.64982005591839	-2.4611809827147604	2731741
2736747	Crypto	modélisation des facteurs influençant la performance de la chaîne logistique	2009	23.46132420970264	-3.4466671379909672	2736774
2737675	HCI	learning new uses of technology: situational goal orientation matters	2009	22.246117654612352	-2.184162043810892	2737702
2743952	HCI	the moderating role of utilitarian/hedonic user motivation on user behaviour towards web 2.0 applications	2009	22.94711649173595	-2.167542245133547	2743979
2744176	HCI	the effectiveness of user-centric social interfaces on evaluating mobile recommendations	2016	22.922852462759014	-2.3365919126682866	2744203
2744228	ECom	with good we become good: understanding e-learning adoption by theory of planned behavior and group influences	2016	22.595330581129797	-2.278882188812178	2744255
2746570	SE	is salience robust? a heterogeneity analysis of survey ratings	2018	22.239308814994782	-2.570720137362781	2746597
2748944	HCI	extending the theory of planned behavior: a study of lifestyles, contextual factors, mobile viewing habits, tv content interest, and intention to adopt mobile tv	2017	22.931433910040603	-2.1817164275457515	2748971
2749617	HCI	if you build it will they come? an empirical investigation of facilitators and inhibitors of hedonic virtual world acceptance	2011	22.514340184225894	-2.461899919257989	2749644
2750509	HCI	female users' acceptance of the electronic document management system (edms)	2013	21.993366369904336	-2.632760021170041	2750536
2751092	HCI	the interplay of gender, habit, and individual differences in predicting trying intentions	2015	22.219921989944464	-2.42213994925108	2751119
2751619	HCI	exploring trust-based service value chain framework in tele-healthcare services	2013	22.51524883682229	-2.1520665239268033	2751646
2762100	HCI	less effortful thinking leads to more social networking? the associations between the use of social network sites and personality traits	2011	22.682104216527662	-2.6455098706331013	2762127
2763737	HCI	the consumer health information system adoption model.	2015	22.201017155496697	-2.518710552029348	2763764
2764487	HCI	evaluating user interface design with belief constructs	1995	22.53777276443311	-2.1963384499854985	2764514
2766805	HCI	assessing the performance of long-term care information systems and the continued use intention of users	2015	22.218173681834003	-2.7385543725336654	2766832
2767695	Metrics	the effect of task-individual-technology fit on user attitude and performance: an experimental investigation	2013	22.140587135564257	-2.21772825192264	2767722
2768141	HCI	do online reviews reflect a product's true perceived quality? an investigation of online movie reviews across cultures	2010	23.04684298250244	-2.1544040739722647	2768168
2768588	HCI	measuring the usability of academic digital libraries: instrument development and validation	2011	22.45296189897028	-2.670076742254527	2768615
2770026	ML	the influence of external variables on the executives' use of the internet	2007	22.586572519207607	-2.2295011228247383	2770053
2773933	HCI	social viewing behavior in social tv: proposing a new concept of socio-usability	2015	22.747762328552977	-2.2774811836026783	2773960
2774992	HCI	perceived stress and life satisfaction: social network service use as a moderator	2011	22.581392678511	-2.1709146943011866	2775019
2775315	HCI	developing and validating a measure of web personalization strategy	2008	21.878297068893886	-2.3072004078200568	2775342
2776750	AI	evaluating customer relationship management in the context of higher education	2012	21.997278507664515	-3.3847089624258038	2776777
2780538	Robotics	applying health belief model to explore the adoption of telecare	2013	22.317825629400517	-2.3335918928795265	2780565
2780770	HCI	personalizing social influence strategies in a q&a social network	2017	22.2991326282447	-2.8753291581201963	2780797
2781368	HCI	how robust is the utaut instrument?: a multigroup invariance analysis in the context of acceptance and use of online community weblog systems	2006	22.48575694757444	-2.5719119975658344	2781395
2782402	HCI	understanding online regret experience using the theoretical lens of flow experience	2016	22.661992095376945	-2.746062787920513	2782429
2783709	HCI	electronic word of mouth in the taiwanese social networking community: participation factors	2017	22.79649693130007	-2.2419578513122698	2783736
2784561	EDA	information technology acceptance by individual professionals: a model comparison approach	2001	22.23928628602207	-2.530448055719857	2784588
2785878	HCI	need for affiliation, need for popularity, self-esteem, and the moderating effect of big five personality traits affecting individuals' self-disclosure on facebook	2015	22.468729727547952	-2.597841285612056	2785905
2787202	AI	an assessment of equivalence between paper and social media surveys: the role of social desirability and satisficing	2014	22.05453440262784	-2.2551659178185703	2787229
2788091	HCI	hedonic and utilitarian motivations for physical game systems use behavior	2012	22.79708395867112	-2.5070047855106354	2788118
2792184	ECom	the implications of social influence theory on continuance intention for social networking among chinese university students	2016	22.709530062575396	-2.391340738362881	2792211
2792678	HCI	understanding learners' perspectives on m-learning: results from a survey	2009	22.150453918880853	-2.1714412570628747	2792705
2794323	HCI	factors affecting end-user satisfaction on facebook	2012	22.832445931343045	-2.406815027088589	2794350
2797649	Crypto	citizens' use and acceptance of e-government applications of turkish social security institutions	2008	21.920104757243614	-2.6749994925240936	2797676
2797959	HCI	investigating the impact of citizens' trust toward the successful adoption of e-government: a multigroup analysis of gender, age, and internet experience	2018	22.14686332841616	-2.2460266390954224	2797986
2804424	HCI	enhancing user experience with conversational agent for movie recommendation: effects of self-disclosure and reciprocity	2017	22.889415785949375	-2.4147613238321077	2804451
2806236	HCI	nurses' interest, readiness and absorptive capacity to information technology: a survey in china	2017	22.185471469192496	-2.3390955268554543	2806263
2806258	HCI	measuring the sociocultural appeal of sns games in taiwan	2013	22.690839405507308	-2.6335005628579413	2806285
2808341	HCI	understanding the intention of giving information in virtual communities	2009	22.228687673892512	-2.1939861634043663	2808368
2809347	HCI	cultural factors in a mobile phone adoption and usage model	2008	22.380836118954875	-2.1370392759970165	2809374
2809359	HCI	impact of personal innovativeness on the use of the internet among employees at work	2005	22.20389953202005	-2.4705684055915755	2809386
2820378	Logic	the social value of snapchat: an exploration of affiliation motivation, the technology acceptance model, and relational maintenance in snapchat use	2018	22.289906743662733	-2.2066253709970733	2820405
2822539	HCI	online consumer misbehavior: the effects of wom versus observational learning	2014	22.78031035741188	-2.264047776040693	2822566
2827046	HCI	towards understanding users' motivation in a q&a social network using social influence and the moderation by culture	2017	22.200778271213785	-2.477347807031058	2827073
2827978	HCI	cognitive and affective antecedents of mobile data services usage intention	2008	22.82221699963642	-2.2132842437767137	2828005
2829339	HCI	the interaction effect of task experience and new technology on cognitive beliefs	2004	22.04495971335744	-2.1614838300276698	2829366
2830311	HCI	factors influencing mhealth acceptance among elderly people in bangladesh	2016	22.65842595337277	-2.3878893677392927	2830338
2830489	HCI	attitudes towards online communication: an exploratory factor analysis	2013	22.06937773233449	-2.4647796487803197	2830516
2831027	HCI	theory y embedded in theory x: the limited role of autonomy in decreasing perceived stress among it consultants	2013	21.79049623163884	-2.3112177148463973	2831054
2833066	AI	internet addiction as a manageable resource: a focus on social network services	2013	22.540735361000433	-2.1732897026467093	2833093
2838090	HCI	understanding wechat users' behavior of sharing social crisis information	2018	22.3577030124368	-2.261748520143625	2838117
2838847	HCI	using a modified technology acceptance model in hospitals	2009	22.576136474475327	-2.436564033557361	2838874
2840298	HCI	cultural values and facebook use among palestinian youth in israel	2015	22.26468827506263	-2.553505260033567	2840325
2841290	HCI	understanding wechat users' liking behavior: an empirical study in china	2017	22.819728953035163	-2.3001966019767	2841317
2843259	HCI	factors influencing consumption experience of mobile commerce: a study from experiential view	2012	23.047237237133746	-2.187102897800934	2843286
2843504	HCI	online bonding and bridging social capital via social networking sites	2014	22.322155216019546	-2.838734294791317	2843531
2845043	HCI	is it a small world after all?: mapping intercultural competence in computer mediated communication users	2013	21.897539736161093	-3.004314095917489	2845070
2852897	HCI	to use a tree or a forest in behavioral intention	2014	22.713559616653395	-2.4508492308501935	2852924
2853553	HCI	gender and attitudes toward technology use: a meta-analysis	2017	22.322493303903517	-3.074140037843132	2853580
2857362	Robotics	in technology we trust: extending tam from a healthcare technology perspective	2018	22.35711328675245	-2.142955494853449	2857389
2857862	HCI	hewek: measuring the health website quality from the perception of the african american	2010	22.043769835976097	-2.3328061465326373	2857889
2858380	SE	designing flow experience on the web: a grounded theory of online shopping flow	2014	22.774868699059105	-2.226333098929774	2858407
2864835	ECom	factors influencing continuance intention to use social network sites: the facebook case	2015	22.756891112373523	-2.3365742532777025	2864862
2866016	AI	to give or to receive? factors influencing members' knowledge sharing and community promotion in professional virtual communities	2010	22.253771576149227	-2.267736038403689	2866043
2866294	HCI	does a positive gain spiral of resources, efficacy beliefs and engagement exist?	2007	22.434327691250118	-2.7828260390210002	2866321
2868320	HCI	why people use online social media brand communities: a consumption value theory perspective	2018	22.405036517890366	-2.2528696168625943	2868347
2872065	HCI	alt.support: modeling social support online	2005	22.182621973194905	-2.5202403547790184	2872092
2873316	ECom	copresence and its social-relational antecedents in computer-mediated communication: the case of instant messenger	2011	21.843807387132983	-2.2830736562432112	2873343
2873740	DB	adaptive social network services: the practice of 9emba.com	2017	21.9163056730712	-2.4033368499997323	2873767
2876560	AI	blogging privacy management rule development: the impact of self-monitoring skills, concern for appropriateness, and blogging frequency	2010	22.41262406257017	-2.2639877021723955	2876587
2878742	NLP	weibo or weixin? gratifications for using different social media	2014	22.24403268397861	-2.1893232035447774	2878769
2880032	HCI	the role of behavioral expectation in technology acceptance: a cegep case study	2018	22.287263653645788	-2.2039835145281343	2880059
2880150	Comp.	unique motivation for using global social network site in korea	2011	22.202186252466344	-2.5269710598427855	2880177
2881576	HCI	objective evaluation or collective self-presentation: what people expect of linkedin recommendations	2018	22.54036769290023	-2.2557702294539723	2881603
2884521	Theory	the effects of social structure overlap and profile extensiveness on facebook friend requests	2016	22.10753586923709	-2.164124152604452	2884548
2884898	HCI	model of online game addiction: the role of computer-mediated communication motives	2016	22.836985747213202	-2.474208622229761	2884925
2893270	HCI	mis success: why does it vary among users?	1992	22.091867866519536	-2.155324223079132	2893297
2894602	AI	the role of trust belief and its antecedents in a community-driven knowledge environment	2009	22.382024898265552	-2.150186207223628	2894629
2895094	HCI	delineating the dimensions of social support on social networking sites and their effects: a comparative model	2016	22.41722313963208	-2.213218649007052	2895121
2895600	HCI	get tired of socializing as social animal? an empirical explanation on discontinuous usage behavior in social network services	2015	22.455961242522513	-2.4363395556136376	2895627
2895993	AI	influence of traits and emotions on boosting status sharing through microblogging	2017	22.707113837072487	-2.539364921944788	2896020
2896506	SE	from recreational applications to workplace technologies: an empirical study of cross-context is continuance in the case of virtual worlds	2012	22.191617470256237	-2.8741022676018835	2896533
2897294	HCI	media selection to meet communications contexts: comparing e-mail and instant messaging in an undergraduate population	2004	22.576734510908175	-2.2986701695310123	2897321
2902978	HCI	explaining intention to use an information technology innovation: an empirical comparison of the perceived characteristics of innovating and technology acceptance models	2007	22.47305674226821	-2.2462122743506514	2903005
2905558	Web+IR	integrating perceived playfulness into expectation-confirmation model for web portal context	2005	22.617068205741766	-2.1769666247496366	2905585
2905749	HCI	public deliberation on government-managed social media: a study on weibo users in china	2017	21.92853332073366	-2.2193702305311063	2905776
2910768	HCI	social capital, social media, and tv ratings	2017	22.706369441961378	-2.2888464936239483	2910795
2911113	HCI	aesthetics and apparent usability: empirically assessing cultural and methodological issues	1997	22.211081476056872	-2.455640430681368	2911140
2911275	HCI	a comparative study on publicly hosted blog sites in the u.s., china, and korea	2006	22.30981181292664	-2.4718855514682456	2911302
2911858	HCI	the respective roles of perceived usefulness and perceived fun in the acceptance of microcomputer technology	1994	22.442139721166388	-2.591755135303292	2911885
2912262	HCI	does social capital affect sns usage? a look at the roles of subjective well-being and social identity	2014	22.678638237881884	-2.205627330016433	2912289
2913538	HCI	malaysian authors' acceptance to self-archive in institutional repositories: towards a unified view	2013	22.150304553527555	-2.533438509629043	2913565
2913798	HCI	the health information seeking and usage behavior intention of chinese consumers through mobile phones	2015	22.713370809893423	-2.1408774662651915	2913825
2913871	Crypto	the structure of web-based information systems satisfaction: an application of confirmatory factor analysis	2007	22.689539965249356	-2.5096640729428694	2913898
2914289	HCI	understanding the role of motives in smartphone addiction	2014	22.75688394723877	-2.1755178645062707	2914316
2915665	HCI	how behaviors on social network sites and online social capital influence social commerce: the case of facebook	2016	22.737004765228466	-2.1374307953338425	2915692
2915729	HCI	a cross-cultural comparison of ucc usage in korea and u.s.a.	2009	22.646455877465648	-2.391468573740246	2915756
2919174	HCI	understanding the extended use of erp based on individual differences and expectation-confirmation theory	2012	22.291917256725405	-2.1412103480388134	2919201
2924942	DB	examining intention of digital piracy: an integration of social norms and ethical ideologies	2018	22.064760597731933	-2.182282800818216	2924969
2928024	HCI	does culture matters in intersection of individual s personality and social media engagement?	2016	22.643868061326327	-2.4771803446272664	2928051
2930401	HCI	technology acceptance model and time: understanding formation in beliefs through training of developers	2006	22.23953944096921	-2.2854041810269323	2930428
2941455	HCI	consumer use of social live streaming services: the influence of co-experience and effectance on enjoyment	2017	22.912750329400808	-2.347488965727261	2941482
2942843	Security	facebook advertising's influence on intention-to-purchase and purchase amongst millennials	2015	22.702383826784946	-2.193460006471162	2942870
2946811	HCI	identifying the influential factors of knowledge sharing in e-learning 2.0 systems	2016	22.30889063609743	-2.5068369268087367	2946838
2948321	HCI	dispositional factors in the use of social networking sites: findings and implications for social computing research	2008	22.390579333473635	-2.2163170264667627	2948348
2951516	HCI	role of user a priori attitude in the acceptance of mobile health: an empirical investigation	2013	22.76751890373393	-2.3338279151628054	2951543
2954235	AI	the impact of absorptive capacity, exploration, and exploitation on individual creativity: moderating effect of subjective well-being	2015	22.13152652481286	-2.318618447171106	2954262
2956708	HCI	the hidden image of mobile apps: geographic, demographic, and cultural factors in mobile usage	2018	22.189020455473237	-2.398974623603912	2956735
2956762	HCI	perceived interactivity leading to e-loyalty: development of a model for cognitive-affective user responses	2009	23.000772272610718	-2.1740695261694807	2956789
2958466	HCI	how performance and self-efficacy influence the ease of use of object-orientation: the moderating effect of prior training	2003	22.22895241559307	-2.550807023842681	2958493
2959821	HCI	designing persuasive systems for user engagement in collaborative interaction	2014	22.15537399872316	-2.2976433434653827	2959848
2961708	HCI	how does conscientiousness impact on computer game play?	2018	22.833171176830696	-2.2155923583888786	2961735
2964087	HCI	the impact of arab cultural values on online social networking: the case of facebook	2012	21.92188497176056	-2.536432850648016	2964114
2964496	HCI	the impact of engagement motives for social tv on social presence and sports channel commitment	2015	22.928271483988592	-2.460511768749396	2964523
2967318	HCI	exploring online social behavior in crowdsourcing communities: a relationship management perspective	2014	22.417807268928065	-2.359843430780481	2967345
2969067	HCI	viable or vital? evaluation of im services from patrons' perspectives	2012	22.484781412933668	-2.2309112940019045	2969094
2969338	SE	comparación de técnicas de lectura de documentos de requisitos de software: diseño de un experimento	2007	22.382338823589496	-3.786156123756216	2969365
2972345	HCI	explaining and predicting perceived effectiveness and use continuance intention of a behaviour change support system for weight loss	2015	22.2691038164687	-2.311352496643422	2972372
2973073	HCI	smartwatches: accessory or tool? the driving force of visibility and usefulness	2016	22.739358115981666	-2.165564692058269	2973100
2973295	HCI	mobile health	2013	22.782325489833827	-2.3873112742993454	2973322
2977289	HCI	online social network acceptance: a social perspective	2011	22.6360275993789	-2.20098469185718	2977316
2979461	HCI	computer self-efficacy: development of a measure and initial test	1995	22.041542455959775	-2.4488015400246974	2979488
2982411	HCI	social network sites and international students' cross-cultural adaptation	2015	22.41641372728516	-2.8112704221797453	2982438
2983817	HCI	understanding the antecedents of virtual product purchase in mmorpg: an integrative perspective of social presence and user engagement	2015	22.884221533642197	-2.152408171635905	2983844
2984859	ECom	do we behave based on our implicit attitudes? proposing a research model and an experimental study to investigate their influence on behavioral intentions	2015	22.75781558270704	-2.190665174479093	2984886
2984908	HCI	how consistent is your web design?	2001	21.89104037589177	-2.4640031814113565	2984935
2988625	SE	can we have fun @ work? the role of intrinsic motivation for utilitarian systems	2013	22.510241983793897	-2.5190442052099464	2988652
2989562	HCI	mobile computing acceptance factors in the healthcare industry: a structural equation model	2007	22.58759084036314	-2.4280096644021563	2989589
2991674	HCI	facilitators and benefits of using mobile entertainment services	2011	22.815138616788854	-2.2985455474247884	2991701
2993927	HCI	user acceptance of wearable devices: an extended perspective of perceived value	2016	23.0189754157686	-2.13851264331076	2993954
2994378	HCI	the role of task-technology fit as users' motivation to continue information system use	2009	22.543822640170713	-2.3969576635285192	2994405
2994852	Logic	structural equation model of organizational climate in iranian academic libraries	2015	21.795990118296643	-2.5896506694288233	2994879
2995518	AI	service science in information systems research	2012	22.884941638857022	-2.2729010321340093	2995545
2995839	HCI	determinants of live streamers' continuance broadcasting intentions on twitch: a self-determination theory perspective	2018	23.012364876849762	-2.1974536444098107	2995866
3002396	HCI	investigating the influence of age, social capital affinity, and flow on positive outcomes reported by e-commerce site users	2016	22.495089354048694	-2.696295367312874	3002423
3004618	HCI	motives for using social network sites (snss) - an analysis of sns adoption among students	2009	22.300338332040425	-2.3002226750885653	3004645
3004863	NLP	experiential fit: applying task-technology fit theory to experiential consumer tasks	2004	22.426371947381405	-2.356856884178801	3004890
3005471	Web+IR	influential factors of recommendation behaviour in social network sites - an empirical analysis	2011	22.67729973127105	-2.220726646516622	3005498
3006271	HCI	examining the social software characteristics and knowledge sharing behaviour among university students in malaysia	2014	22.486443643347016	-2.8826570143279198	3006298
3008387	HCI	understanding user satisfaction with instant messaging: an empirical survey study	2012	22.766595713829236	-2.3748530598995456	3008414
