id	area	title	year	x	y	ix
3009903	Web+IR	the impact of normative social influence on group homogeneity in media preferences and group meeting outcomes	2008	22.064507453237876	-2.3231085938797102	3009930
3012933	HCI	comparing digital libraries in the web and mobile contexts from the perspective of the digital divide	2015	22.181481734111134	-2.6037815004464244	3012960
3013397	HCI	three classes of attitude and their implications for is research	2011	22.54598381186296	-2.3670864171601385	3013424
3014172	HCI	understanding factors affecting perceived sociability of social software	2010	22.62543554260889	-2.4361379204314337	3014199
3014397	Web+IR	examining the impacts of website complexities on user satisfaction based on the task-technology fit model: an experimental research using an eyetracking device	2014	22.849750008148128	-2.160633958328436	3014424
3015612	HCI	requirements analysis for a student relationship management system--results from an empirical study in ivy league universities	2012	22.001052827805943	-3.300837444917112	3015639
3015806	HCI	cultural dimensions as moderators of the utaut model: a research proposal in a healthcare context	2010	21.989656747309517	-2.3877395971971738	3015833
3021661	HCI	perceived usefulness, perceived ease of use, and user acceptance of information technology	1989	22.63575024024024	-2.339430652702762	3021688
3022547	HCI	the influence of virtual representatives on recommender system evaluation	2009	22.327276080071698	-2.7182219626690785	3022574
3022890	HCI	the influence of sociodemographic and technology-associated factors on stress from human interaction with electric vehicle information systems	2015	22.381605674795004	-2.338241751144594	3022917
3025819	HCI	relatedness need and users' satisfaction with social network sites: a self-determinant perspective	2012	22.286357132637736	-2.424396932807302	3025846
3026276	AI	improving end-user satisfaction through techno-stress prevention: some empirical evidences	2008	21.885892783219738	-2.2493056283453736	3026303
3028143	HCI	motivations for byod: an investigation of the contents of a 21st century school bag	2013	22.23306189783063	-2.8966658173619417	3028170
3028225	HCI	review paper: determinants of success of inpatient clinical information systems: a literature review	2003	21.86240608427744	-2.4299399003270503	3028252
3031561	HCI	compatible quality of social media content: conceptualization, measurement, and affordances	2017	22.24407730211577	-2.30930328496445	3031588
3033436	HCI	the role of motivators in improving knowledge-sharing among academics	2014	22.21909824305036	-2.470134665121265	3033463
3036137	HCI	online environmental community members' intention to participate in environmental activities: an application of the theory of planned behavior in the chinese context	2012	22.596003735674852	-2.501826499998837	3036164
3039031	HCI	training experiences and usage intentions: a field study of a graphical user interface	1996	22.58992360136333	-2.5463261237274826	3039058
3042450	HCI	exploring the user experience of three-dimensional virtual learning environments	2013	22.565692486672653	-2.526459348591416	3042477
3043754	HCI	investigating privacy perception and behavior on weibo	2014	22.2776007532232	-2.1425911735472543	3043781
3043781	HCI	what drives you to check in on facebook? motivations, privacy concerns, and mobile phone involvement for location-based information sharing	2016	22.602320696426798	-2.2274951643154712	3043808
3043928	NLP	the effect of personality on it personnel's job-related attitudes: establishing a dispositional model of turnover intention across it job types	2016	21.803993409516917	-2.2790292632438085	3043955
3050683	HCI	measuring the flow experience of players playing online games	2012	22.896953322707425	-2.620209440478851	3050710
3055244	HCI	predicting selfie-posting behavior on social networking sites: an extension of theory of planned behavior	2016	22.704365161948534	-2.4147707480581198	3055271
3059455	HCI	exploring the use of internet by university students for seeking health related information	2017	22.49993304944995	-2.612081218018454	3059482
3059602	HCI	examining the antecedents of user gratification and its effects on individuals’ social network services usage: the moderating role of habit	2015	22.73284003877501	-2.418341867463795	3059629
3065598	ECom	ranking versus reputation: perception and effects of search result credibility	2017	22.00230359244811	-2.384183500155372	3065625
3066180	HCI	using technology to control intimate partners: an exploratory study of college undergraduates	2011	22.081049176876224	-3.1575527666987933	3066207
3074876	HCI	students' self-presentation on facebook: an examination of personality and self-construal factors	2012	22.40243778979337	-2.6433710218242767	3074903
3075036	HCI	the effects of gender variety and power disparity on group cognitive complexity in collaborative learning groups	2015	22.243929967778783	-2.6709679459000126	3075063
3075198	HCI	a meta-analysis of factors affecting trust in human-robot interaction	2011	22.25402833892037	-2.3549914412804314	3075225
3077578	HCI	within-study measurement invariance of the utaut instrument: an assessment with user technology engagement variables	2015	22.531672230580398	-2.426080437959561	3077605
3077611	HCI	the role of internet self-efficacy in accepting web-based medical records	2003	22.57778003587025	-2.3769599180577865	3077638
3078922	HCI	perceived bridging and bonding social capital on twitter: differentiating between followers and followees	2013	22.55242195312432	-2.3928893163813734	3078949
3079841	HCI	applying the integrative model of behavioral prediction and attitude functions in the context of social media use while viewing mediated sports	2013	22.4925034988812	-2.4502880744322377	3079868
3081600	HCI	effects of interface style on user perceptions and behavioral intention to use computer systems	2007	22.69477041260671	-2.3978244837133866	3081627
3085871	HCI	coping with information technology: mixed emotions, vacillation, and nonconforming use patterns	2015	21.83705438671941	-2.1562880749869637	3085898
3091452	HCI	moderating role of gender in the relationships between perceived benefits and satisfaction in social virtual world continuance	2014	22.62652832540009	-2.4242263044150354	3091479
3092309	HCI	how do perceived enjoyment and perceived usefulness of a software product interact over time to impact technology acceptance?	2017	22.21721221033905	-2.1471424305168942	3092336
3093867	HCI	predictors and social consequences of online interactive self-disclosure: a literature review from 2002 to 2014	2015	22.318024316875725	-2.5194652477534336	3093894
3096809	HCI	a meta-analytic review of more than a decade of research on general computer self-efficacy: research in progress	2008	22.03483922323771	-2.4346154078484057	3096836
3101375	Visualization	from privacy concern to uses of social network sites: a cultural comparison via user survey	2011	22.3425707047937	-2.29151301054434	3101402
3106092	HCI	the effect of simplicity and perceived control on perceived ease of use	2007	22.75257554082214	-2.2215656445951946	3106119
3106436	AI	the effects of the self and social identity on the intention to microblog: an extension of the theory of planned behavior	2016	22.703373267139522	-2.3409220877746733	3106463
3107451	AI	structural equation modeling of co-creation and its influence on the student's satisfaction and loyalty towards university	2016	22.440550405204238	-2.6445708783240183	3107478
3109136	HCI	physicians' behavior intentions regarding a mobile medical information system: an exploratory study	2004	22.609043043746023	-2.4915878424059	3109163
3112591	Security	an empirical analysis of users' privacy disclosure behaviors on social network sites	2015	22.418384910968083	-2.5034526314083068	3112618
3115281	Logic	a fast form approach to measuring technology acceptance and other constructs	2008	22.476892211536068	-2.3848405958756147	3115308
3117562	HCI	the effects of collective mmorpg (massively multiplayer online role-playing games) play on gamers' online and offline social capital	2011	22.58372961717433	-2.5371381174255125	3117589
3121866	HCI	gender differences in reasons for frequent blog posting	2009	22.570679030859427	-2.329861588576727	3121893
3124169	HCI	understanding members' attachment to social networking sites: an empirical investigation of three theories	2014	22.32366002917324	-2.3269555389182712	3124196
3126708	HCI	assimilation of internet-based purchasing applications within medical practices	2012	22.110700821611452	-2.1497501793632643	3126735
3126976	HCI	beyond the credibility of electronic word of mouth: exploring ewom adoption on social networking sites from affective and curiosity perspectives	2014	22.709894821974288	-2.2888442180337663	3127003
3127496	DB	getting by or getting ahead on social networking sites? the role of social capital in happiness and well-being	2018	22.72280954758881	-2.2209820484207627	3127523
3130253	HCI	the acceptance and use of innovative technology: do positive and negative feelings matter?	2015	22.540005420905967	-2.3152128939642997	3130280
3131101	Metrics	understanding social effects in online networks	2015	22.42897342200355	-2.2813849098046792	3131128
3131341	HCI	modelling the impact of perceived connectivity on the intention to use social media : discovering mediating effects and unobserved heterogeneity	2015	22.289089019364546	-2.262492404984627	3131368
3132254	HCI	how do polish and indonesian disclose in facebook?: differences in online self-disclosure, need for popularity, need to belong and self-esteem	2014	22.44416059771022	-2.1841328732943426	3132281
3133431	HCI	managing gamer relationships to enhance online gamer loyalty: the perspectives of social capital theory and self-perception theory	2018	22.87501186523044	-2.2910100588163056	3133458
3134956	HCI	a preliminary study of user acceptance and adoption of data visualisation tools for decision support in business organisations	2017	22.39949579165081	-2.586137920055252	3134983
3138920	HCI	user-generated content on the internet: an examination of gratifications, civic engagement and psychological empowerment	2009	22.2721000503037	-2.598372362742602	3138947
3144761	HCI	understanding perceived enjoyment in mobile game context	2016	22.74047451984766	-2.296895211475304	3144788
3145552	HCI	building member attachment in online communities: applying theories of group identity and interpersonal bonds	2012	22.151029537824897	-2.509066525120683	3145579
3152929	HCI	perceived effectiveness of text vs. multimedia location-based advertising messaging	2009	23.07884533027966	-2.1406019179978863	3152956
3153269	Web+IR	influence of faculty- and web portal design-related factors on web portal usability: a hierarchical regression analysis	2013	21.80883995437129	-3.5973256856569944	3153296
3154194	HCI	smartphone app usage as a predictor of perceived stress levels at workplace	2015	22.61979541629571	-2.6760749600031817	3154221
3156128	HCI	user perceived service quality of mhealth services in developing countries	2010	22.719882986294355	-2.311868544723477	3156155
3157258	HCI	the moderating effects of gender on e-commerce systems adoption factors: an empirical investigation	2010	22.74487726685559	-2.137145262998446	3157285
3163981	HCI	gamification: a new paradigm for online user engagement	2012	22.41004464736701	-2.3788336677822204	3164008
3164701	Crypto	o profissional da informação e a gestão da qualidade em serviços de informação: capacitação e mercado de trabalho	2007	21.807376440143546	-4.023485545541003	3164728
3164824	HCI	empirical investigation on factors influencing the behavioral intention to use facebook	2011	22.630340389082928	-2.3789298045068064	3164851
3165100	HCI	the shadow of microblogging use: relationship between usage types and addiction	2012	22.268725366425414	-2.1499724058470897	3165127
3172171	HCI	self-efficacy, overconfidence, and the negative effect on subsequent performance: a field study	2009	22.426941188713457	-2.55579633110681	3172198
3177739	HCI	factors influencing student acceptance and use of academic portals	2009	22.11994569944322	-3.042539663716907	3177766
3181325	Security	the role of privacy protection in healthcare information systems adoption	2013	22.77305797513649	-2.3272118951598757	3181352
3187592	HCI	differences in the adoption of smartphones between middle aged adults and older adults in china	2015	22.938186954935368	-2.3123140953708177	3187619
3192845	HCI	a study of the impact of individual differences on online shopping	2010	22.84083019906637	-2.3066196723664087	3192872
3195971	HCI	sense of belonging based on novel posting: individuals' processes of social and psychological integration into virtual groups	2016	22.350477838706695	-2.536925440644894	3195998
3196988	HCI	information technology (it) in saudi arabia: culture and the acceptance and use of it	2007	22.35783909499608	-2.1451833931138964	3197015
3204766	HCI	influence of computer attitude and self-efficacy on it usage behavior	2001	22.618577389580437	-2.367346039373055	3204793
3207355	Web+IR	why participate in an online social network? an empirical analysis	2008	22.58831966890385	-2.2195772851552635	3207382
3209612	HCI	common attributes in an unusual context: predicting the desirability of a social match	2010	22.166448181516557	-2.3493611551761946	3209639
3210432	HCI	mobile ad intrusiveness - the effects of message type and situation	2007	22.814872115901924	-2.208082027291473	3210459
3211033	HCI	under-subjective knowledge, compatibility, and the impact on adoption and implementation of technology	2011	22.54214912850817	-2.1823273580385174	3211060
3211988	DB	a study of the relationship between organisational justice and employee readiness for change	2011	22.083667916719683	-2.5426475795131736	3212015
3215317	AI	exploring factors that influence knowledge sharing behavior via weblogs	2010	22.111618425637516	-2.1802053333853704	3215344
3217493	HCI	internet researchers' data sharing behaviors: an integration of data reuse experience, attitudinal beliefs, social norms, and resource factors	2018	22.0956958757418	-2.398284126609548	3217520
3218254	HCI	are shadow system users the better is users? - insights of a lab experiment	2015	22.100865049288476	-2.144439594055947	3218281
3218258	HCI	who needs cyberspace? examining drivers of needs in second life	2011	22.561864210410686	-2.5566854745859047	3218285
3223126	HCI	the mediating role of identity fit: understanding the relationship between communication media, demographic differences, and creativity	2001	21.823565891172404	-2.2717320979381324	3223153
3226878	HCI	analysis of the multi-item dimensionality of patients’ perceived value in hospital services	2010	22.227836549675846	-2.137455995595991	3226905
3228256	HCI	are older adults really that different? some insights from gerontechnology	2015	22.913181552729306	-2.215946363066225	3228283
3230126	HCI	understanding the formation and effects of general self effocacy in business students	2008	22.191039331393426	-2.605344718607437	3230153
3240463	SE	extending information system models to the health care context: an empirical study and experience from developing countries	2017	22.299386128813246	-2.455432264828901	3240490
3241169	HCI	correlates of different forms of cyberloafing: the role of norms and external locus of control	2008	21.956929528152042	-2.1803022751198253	3241196
3248113	HCI	understanding physicians' adoption of emr: an extended technology acceptance model the case of: jordan	2013	21.819819123807434	-2.5246799187074487	3248140
3252424	HCI	social networks, interactivity and satisfaction: assessing socio-technical behavioral factors as an extension to technology acceptance	2013	22.71306369869429	-2.1684065402843387	3252451
3254450	AI	psychological and social influences on blog writing: an online survey of blog authors in japan	2007	22.51561047715081	-2.4276311530769066	3254477
3254613	HCI	continuous usage of social networking sites: the effect of innovation and gratification attributes	2013	22.71871829905705	-2.1817564525668875	3254640
3256294	ECom	the development and validation of the social network sites (snss) usage questionnaire	2014	22.895296967459785	-2.1506639469892157	3256321
3260946	HCI	the perspective of a revised tram on social capital building: the case of facebook usage	2013	22.695990180201875	-2.284338835059036	3260973
3262521	HCI	explaining the use of text-based communication media: an examination of three theories of media use	2012	22.04169081037445	-2.3299829520377813	3262548
3264662	HCI	raising the general public's awareness and adoption of open source software through social q&a interactions	2015	22.398752932416496	-2.5059547927032817	3264689
3265524	OS	a multilevel path analysis of contact frequency between social network members	2012	21.811079286521974	-2.4707005725776447	3265551
3268275	HCI	information worth spreading: an exploration of information sharing from social q&a to other social media platforms	2016	22.695449857297024	-2.173022184298304	3268302
3268489	SE	online social network dependency: theoretical development and testing of competing models	2011	22.494103813859585	-2.4194605522302624	3268516
3271854	HCI	the social impact on web design in online social communities	2009	22.424780443057564	-2.2279971990003675	3271881
3272405	HCI	predicting attitudes toward knowledge sharing by e-mail: an empirical study	2011	22.378925034353752	-2.5197464537996948	3272432
3273729	ECom	acceptance of online audio-visual cultural heritage archive services: a study of the general public	2013	22.396324952171497	-2.523280377804589	3273756
3274397	HCI	knowledge sharing intention in the united states and china: a cross-cultural study	2015	22.108594239962844	-2.1465309549160985	3274424
3274412	HCI	exploring experiential value in online mobile gaming adoption	2008	22.758505191902422	-2.4616773162706127	3274439
3274714	SE	moderating role of gender between job characteristics and job satisfaction: an empirical study of software industry using structural equation modeling	2017	22.035228857103682	-2.1553519970994897	3274741
3277602	HCI	facebook as a toolkit: a uses and gratification approach to unbundling feature use	2011	22.27482397471452	-2.4376209906979573	3277629
3278440	DB	motivations of facebook places and store atmosphere as moderator	2014	22.667721595957406	-2.2344003730442874	3278467
3278624	HCI	system design effects on online impulse-buying	2007	23.007276984365514	-2.254266806895594	3278651
3283011	AI	impact of privacy, trust and user activity on intentions to share facebook photos	2016	22.36541670690769	-2.15791563276223	3283038
3283279	HCI	information systems attachment: an empirical exploration of its antecedents and its impact on community participation intention	2013	22.69121353731802	-2.203945976805192	3283306
3283517	AI	knowledge acquisition skills and traits: a self-assessment of knowledge engineers	1994	21.902719653755128	-4.016802905038563	3283544
3288904	HCI	the effect of tertius iungens orientation on knowledge sharing activity in social media	2012	22.34697415004656	-2.2968169850988915	3288931
3296660	HCI	user perceptions of e-quality of and affinity with virtual communities: the effect of individual differences	2014	22.414545498694302	-2.67223248418091	3296687
3297545	HCI	impact of intangibility on perceived risk associated with online games	2012	22.351781082360212	-2.1864933524587125	3297572
3302846	HCI	it's all about networking! empirical investigation of social capital formation on social network sites	2011	22.1880443026259	-2.2007967253391167	3302873
3303192	HCI	does design matter? affordance perspective on smartphone usage	2013	22.265201445986435	-2.18037924100931	3303219
3304127	HCI	the effects of personality traits and optimum stimulation level on text-messaging activities and m-commerce intention	2007	22.957284383273826	-2.2124363154389104	3304154
3304928	HCI	loyalty to computer terminals: is it anthropomorphism or consistency?	2004	22.547466530651377	-2.697880741508525	3304955
3309949	HCI	the influence of the hedonic and utilitarian value of digital games on product recommendation	2011	22.690861788875655	-2.344487119562592	3309976
3312321	HCI	muslim surfers on the internet: using the theory of planned behaviour to examine the factors influencing engagement in online religious activities	2008	21.9848998545458	-2.3339254045960565	3312348
3314986	HCI	assessing task–technology fit in a pacs upgrade: do users’ and developers’ appraisals converge?	2011	22.38667219856298	-2.458501897504359	3315013
3315817	HCI	assessing users' attachment to their mobile devices	2007	22.50503971134771	-2.3788221791786546	3315844
3316294	AI	influences and benefits of role models on social media	2016	22.2303607102249	-2.3299431814232543	3316321
3324254	HCI	who are likely to experience disconfirmation? impact of temperament and character on disconfirmation	2017	22.449901027219187	-2.527119237125021	3324281
3324720	HCI	examining the mediating roles of microblog use in the relationships between narcissism, social anxiety, and social capital	2014	22.522557795898376	-2.707628777683186	3324747
3325564	HCI	clarifying the impact of social escapism in users' acceptance for online entertaining services - an extension of the technology acceptance model based on online karaoke television services users	2016	22.78282259686277	-2.4442660168028314	3325591
3325621	HCI	how do social networking sites users become loyal? a social exchange perspective	2012	22.641281130380033	-2.2066355106255604	3325648
3333557	HCI	discrepancy between actual self and virtual self: theoretical extensions, measurement and relation to contribution in virtual communities	2010	22.226378149302672	-2.410394261785071	3333584
3335786	NLP	designing an inference engine for assessment of researchers' maturity using rough set theory	2018	22.452159933276896	-4.045464561019245	3335813
3337121	Networks	relationship building through reputation and tribalism on companies' facebook pages: a uses and gratifications approach	2017	22.635977097080932	-2.2270013447978605	3337148
3344619	HCI	measuring patients’ perceptions and social influence on home telecare management system acceptance	2010	22.623901814876774	-2.526204946320506	3344646
3347477	HCI	social networking site addiction: the cognitive bias perspective	2016	22.035177143723445	-2.1515322362636415	3347504
3347493	HCI	"""online authenticity, popularity, and the """"real me"""" in a microblogging environment"""	2015	22.296839463857378	-2.6557344025384753	3347520
3353011	HCI	antecedents and effects of computer self-efficacy on social networking adoption among asian online users	2013	22.58936411410738	-2.1772187415376028	3353038
3353425	SE	what drives mobile health care? an empirical evaluation of technology acceptance	2005	22.52712174688877	-2.533752772689824	3353452
3355515	HCI	the empirical study of automotive telematics acceptance in taiwan: comparing three technology acceptance models	2009	22.95123529661131	-2.138408474156556	3355542
3355553	HCI	an investigation of the factors that predict an internet user's perception of anonymity on the web	2015	22.154162205665664	-2.4526237461767035	3355580
3358396	HCI	mobile learning adoption through the lens of complexity theory and fsqca	2017	22.958396371606913	-2.144631830387429	3358423
3360245	HCI	user acceptance of second life: an extended tam including hedonic consumption behaviours	2009	22.73331531881766	-2.6349921443677853	3360272
3360396	HCI	examining social influence factors affecting consumer continuous usage intention for mobile social networking applications	2016	22.704549952539477	-2.3341523147190446	3360423
3361658	SE	gauging heterogeneity in online consumer behaviour data: a proximity graph approach	2014	22.39800585450201	-2.2073205628135275	3361685
3363583	Metrics	what factors satisfy e-book store customers? development of a model to evaluate e-book user behavior and satisfaction	2017	22.97428286751026	-2.180860786120141	3363610
3366350	HCI	exploring the relationship between technology acceptance model and usability test	2013	22.481379958991962	-2.3566876259223246	3366377
3368842	NLP	the measurement of end-user computing satisfaction	1988	22.338019536272824	-2.3141484898924665	3368869
3370296	Web+IR	framework for user acceptance: clustering for fine-grained results	2012	22.310804577730227	-2.263616346967217	3370323
3372859	HCI	exploring koreans' smartphone usage: an integrated model of the technology acceptance model and uses and gratifications theory	2013	22.82759048531605	-2.2977553134016517	3372886
3376478	AI	forming relationship commitments to online communities: the role of social motivations	2012	22.273169013252293	-2.1723500027167044	3376505
3378673	HCI	social inference risk modeling in mobile and social applications	2009	22.08973598959089	-2.209200414788448	3378700
3378844	HCI	does a contextualized theory of planned behavior explain why teenagers stay in virtual worlds?	2014	22.48908199935472	-2.5426895840006454	3378871
3380368	HCI	tracing college students' acceptance of online health services	2017	22.339495672642045	-2.177690003889221	3380395
3385161	Networks	social and usage process motivations for internet use: differences between light and heavy users	2003	22.653210629371195	-2.2473542381348923	3385188
3389465	HCI	health information seeking in the web 2.0 age: trust in social media, uncertainty reduction, and self-disclosure	2016	22.23355051082029	-2.435288959549129	3389492
3391743	HCI	personality predictors of it addiction	2018	22.53544062109749	-2.46112631676106	3391770
3394727	HCI	physician acceptance behavior of the electronic medical records exchange: an extended decomposed theory of planned behavior	2013	22.49420651658236	-2.6006364433327205	3394754
