id	area	title	year	x	y	ix
2305937	HCI	the role of facebook users' self-systems in generating social relationships and social capital effects	2015	22.418859049504515	-2.5046530603810053	2305964
2306274	HCI	understanding social network sites continuance intention from a self-disclosure and social capital perspective	2014	22.68167684834847	-2.313190598504762	2306301
2306628	SE	addiction to mobile phone or addiction through mobile phone?	2016	22.594925802389174	-2.3419405456340474	2306655
2306894	Metrics	demystifying continuous participation in game applications at social networking sites: a social playfulness design perspective	2018	22.788334736645414	-2.334112474753273	2306921
2308639	Web+IR	social network service use on mobile devices: an examination of gratifications, civic attitudes and civic engagement in china	2015	22.312351768058566	-2.556944971245319	2308666
2309610	HCI	the effect of intrinsic and extrinsic motivations on mobile coupon sharing in social network sites: the role of coupon proneness	2016	22.751294240167798	-2.2229585456235204	2309637
2310578	HCI	determinants of perceived ease of use: integrating control, intrinsic motivation, and emotion into the technology acceptance model	2000	22.641016495978302	-2.411871793305258	2310605
2313963	HCI	love internet, love online content: predicting internet affinity with information gratification and social gratifications	2013	22.52129860657844	-2.459430962672058	2313990
2314709	AI	a study of sme private healthcare personnel acceptance of clinic information system in malaysia	2013	22.59331946380672	-2.306628565612425	2314736
2315510	HCI	what makes continued mobile gaming enjoyable?	2017	22.767074367315335	-2.3853446278553494	2315537
2320553	HCI	the impact of social presence on the experiences of online shoppers - a cross-cultural study	2007	22.573021671573724	-2.254529949789455	2320580
2321009	HCI	impact of viewer engagement on gift-giving in live video streaming	2018	23.004000638182234	-2.2438124413762264	2321036
2321417	HCI	exposure to online hate material and subjective well-being: a comparative study of american and finnish youth	2018	22.258980559218546	-2.7134785882215886	2321444
2321505	AI	why users keep answering questions in online question answering communities: a theoretical and empirical investigation	2013	22.43808836050653	-2.3859780619070117	2321532
2322821	HCI	the role of a modified technology acceptance model in explaining internet usage in higher education in thailand	2009	22.71667232927296	-2.268289406143812	2322848
2324830	AI	understanding the trust building mechanisms in social media: regulatory effectiveness, trust transfer, and gender difference	2018	22.45495967312602	-2.2673633422747983	2324857
2324996	HCI	the differing privacy concerns regarding exchanging electronic medical records of internet users in taiwan	2012	21.881618337573926	-2.23759484906	2325023
2333674	HCI	the role of attachment in facebook usage: a study of canadian college students	2018	22.416883437130465	-2.6110911446976393	2333701
2334565	HCI	explore consumers' experience in using facebook through mobile devices	2012	22.739819621033845	-2.1690734313228903	2334592
2336124	HCI	understanding users' continuance of facebook: the role of general and specific computer self-efficacy	2008	22.685764252991792	-2.317291090911792	2336151
2339142	Robotics	social capital, motivations, and mobile coupon sharing	2016	22.735708944079388	-2.19547873759508	2339169
2339916	AI	système d'information et stratégie dans les transports. le cas du transport express	1993	23.49720667068277	-3.4451356069736523	2339943
2340199	HCI	motivational, structural and tenure factors that impact online community photo sharing	2009	22.354209390074164	-2.1813480365215066	2340226
2341167	HCI	motivations for sharing information and social support in social media: a comparative analysis of facebook, twitter, delicious, youtube, and flickr	2015	22.365659848355907	-2.565595615722718	2341194
2343486	SE	the adoption intentions of mobile applications	2016	23.06444927776545	-2.1702402926933706	2343513
2347915	HCI	the effects of game dynamics on user engagement in gamified systems	2015	22.474822992034287	-2.450961113063252	2347942
2350872	HCI	cultural aspects for technology acceptance: asian perspectives and research techniques	2005	22.001375558545114	-2.3772022629825127	2350899
2354595	HCI	exploring the factors driving m-learning adoption	2009	22.68545364432105	-2.412390313807976	2354622
2354766	HCI	social networking and academic performance: a review	2017	22.145198122520963	-2.21372051528004	2354793
2361274	HCI	continuance intention to use social network game: the philipines case	2016	22.412297662059228	-2.267363983462197	2361301
2362057	HCI	transforming followers into fans: a study of chinese users of the wechat official account	2017	22.70188080856248	-2.423572061880322	2362084
2362895	HCI	does location congruence matter? a field study on the effects of location-based advertising on perceived ad intrusiveness, relevance & value	2017	22.897656229600013	-2.4989856679754268	2362922
2366782	HCI	the effect of gender and internet usage on physical and cyber interpersonal relationships	2013	22.776324006204952	-2.578906652805217	2366809
2368791	HCI	they do! how the explicit motive-structure predicts user behavior in (business-) social network sites like xing or linkedin	2017	22.495257886936948	-2.5844637201507417	2368818
2369895	HCI	impacts of ipad attributes, users' lifestyles, and media dependency on the adoption and intensity of ipad usage	2014	22.86686774396745	-2.3132788353782483	2369922
2370279	HCI	adoption of second life in higher education: comparing the effect of utilitarian and hedonic behaviours	2013	22.747342724861323	-2.7755465247034365	2370306
2370367	HCI	is smartphone usage truly smart? a qualitative investigation of it addictive behaviors	2013	22.356189776944934	-2.208350791910464	2370394
2371450	HCI	predicting the acceptance and use of information and communication technology by older adults: an empirical examination of the revised utaut2	2017	22.736674788623663	-2.2328760823499305	2371477
2380069	HCI	it's not only what i think but what they think! the moderating effect of social norms	2014	22.23122933245829	-2.3336636529682973	2380096
2380626	HCI	enhancing perceived enjoyment in social games through social and gaming factors	2016	22.844138440383364	-2.4025017041304952	2380653
2392236	HCI	understanding online community participation	2012	22.499752500712976	-2.339796490001669	2392263
2392669	HCI	investigating the connection between awareness and internet non-use	2015	22.386260337823845	-2.138227073984498	2392696
2395041	HCI	understanding consumer health information-seeking behavior from the perspective of the risk perception attitude framework and social support in mobile social media websites	2017	22.559821946761122	-2.4158432429388244	2395068
2395814	AI	a motivational model of microcomputer usage	1996	21.811806066280184	-2.416727041490672	2395841
2395934	Metrics	social network influences on technology acceptance: a matter of tie strength, centrality and density	2010	22.46904468180261	-2.139688539902884	2395961
2397948	HCI	does the extended technology acceptance model apply to physicians	2003	22.223306808624052	-2.4981228937321704	2397975
2398563	DB	crm to improve the avoidance tendency in science and engineering college in korea	2009	22.143761191616925	-3.843329247743355	2398590
2404047	HCI	the effect of online fan community attributes on the loyalty and cooperation of fan community members: the moderating role of connect hours	2017	22.803672075856326	-2.2407341743740905	2404074
2407766	HCI	applying the tam to travelers' usage intentions of gps devices	2011	23.047534838359752	-2.1855145766707773	2407793
2409284	HCI	exploring the emotional antecedents and outcomes of technology acceptance	2019	22.480856742426013	-2.1707610424404176	2409311
2409925	DB	developing attitudes and intentions among potential entrepreneurs	2015	21.815187238127304	-2.806727488426095	2409952
2409931	HCI	modeling educational usage of facebook	2010	22.619756340444948	-2.6299356619971	2409958
2411154	HCI	more than search? informational and participatory ehealth behaviors	2014	22.414313451666946	-2.5076822787427737	2411181
2411207	HCI	encouraging participation in virtual communities through usability and sociability development: an empirical investigation	2011	22.368812591374684	-2.2311286686130027	2411234
2416493	HCI	an empirical study of what drives users to share knowledge in virtual communities	2006	22.235963693090447	-2.313789674042681	2416520
2416867	HCI	healthcare professionals' use of health clouds: integrating technology acceptance and status quo bias perspectives	2015	22.3037245186172	-2.22186206492754	2416894
2419281	HCI	adaptive system use; an investigation at the system feature level	2008	22.50660149545181	-2.4288932691529093	2419308
2419346	AI	acceptance of blog usage: the roles of technology acceptance, social influence and knowledge sharing motivation	2008	22.66466160824627	-2.3503622797725896	2419373
2421024	Web+IR	system characteristic or user purpose? - a multi-group analysis on the adoption of online shopping by mobility impaired and unimpaired users	2015	22.80611976541828	-2.2374125722825338	2421051
2422810	HCI	understanding user motivation for evaluating online content: a self-determination theory perspective	2015	22.15698028091759	-2.2924672007836877	2422837
2422883	Metrics	feeling the sense of community in social networking usage	2010	22.696197968303363	-2.1808867910953684	2422910
2423196	AI	college students' disclosure of location-related information on facebook	2014	22.396785200787054	-2.2058778720417607	2423223
2423852	HCI	perceived enjoyment and the effect of gender on continuance intention for mobile internet services	2014	22.909055073951354	-2.2862017965265573	2423879
2426300	NLP	the influence factors of sns users' sense of belonging: theoretical model and empirical test - a cross-culture study on sns	2014	22.24143898743132	-2.1414686931149487	2426327
2428612	HCI	the effect on audience reactions of audience opinion adoption from sns	2013	22.712292185475913	-2.184144713060084	2428639
2429933	HCI	a study of mobile instant messaging adoption: within-culture variation	2011	22.712741486290337	-2.280033355160471	2429960
2430673	HCI	social media, social integration and subjective well-being among new urban migrants in china	2017	22.216922955454802	-2.5241863192390794	2430700
2432133	HCI	a meta-analysis of enjoyment effect on technology acceptance: the moderating role of technology conventionality	2017	22.50006496163715	-2.2798408644736834	2432160
2432415	HCI	effect of personal innovativeness, attachment motivation and social norms on the acceptance of camera mobile phones: an empirical study in an arab country	2011	22.79957637124676	-2.31994958297976	2432442
2432476	HCI	"""""""passion and concern for privacy"""" as factors affecting snapchat use: a situated perspective on technology acceptance"""	2017	22.472383436717113	-2.430974779703592	2432503
2434035	AI	exploring the determinants of knowledge sharing via employee weblogs	2013	22.339457370479327	-2.238418520591926	2434062
2436527	HCI	a closer look at the social influence construct in the utaut model: an institutional theory based approach to investigate health it adoption patterns of the elderly	2016	22.341515728665264	-2.449934861440177	2436554
2438128	HCI	determinants of knowledge sharing in virtual network communities in organizational context	2015	22.28792873051929	-2.234358948338519	2438155
2439021	HCI	interaction on an academic social networking sites: a study of researchgate q&a on library and information science	2018	22.155655609939874	-2.336560114200665	2439048
2442371	HCI	from street protests to facebook campaigns: political cynicism, efficacy and online political engagement of sri lankan students	2015	21.843778247723197	-2.860369399183317	2442398
2446471	Logic	relationships between self-construal and verbal promotion	2000	22.34348577395743	-2.3752500818340163	2446498
2452855	Metrics	the benefits of network externality by social network site	2014	22.787438382701648	-2.277827090400091	2452882
2456261	ECom	the effects of social network properties on the acceleration of fashion information on the web	2012	22.40081556321069	-2.145438786165829	2456288
2456384	HCI	the driving factors of continuance online shopping: gender differences in behaviour among students - the case of saudi arabia	2012	22.822632996532803	-2.433368586543576	2456411
2457157	HCI	a cross-cultural comparison of the impact of social presence on website trust, usefulness and enjoyment	2009	22.51902378194912	-2.253856988651457	2457184
2457450	HCI	incremental persuasion through microblogging: a survey of twitter users in latvia	2011	22.212695039618712	-2.291964523877533	2457477
2457513	HCI	a comparative study on the flow experience in web-based and text-based interaction environments	2011	22.387934815711912	-2.6376037551630875	2457540
2464513	HCI	frequency of usage: the impact of technology acceptance factors versus social factors	2011	22.009396438445364	-2.3770572442807576	2464540
2468713	HCI	mobile ubiquity: understanding the relationship between cognitive absorption, smartphone addiction and social network services	2019	22.603501602048873	-2.601190550052581	2468740
2474220	HCI	applying the technology acceptance model to social networking sites (sns): impact of subjective norm and social capital on the acceptance of sns	2013	22.814245119635444	-2.2498700137348266	2474247
2482300	ECom	measuring user-satisfaction with electronic consumer products: the consumer products questionnaire	2011	22.438878594225635	-2.3858622184546614	2482327
2482730	Security	understanding user adaptation toward a new it system in organizations: a social network perspective	2017	22.539549726356352	-2.391737164891428	2482757
2490130	HCI	extending tam to understand e-governance adoption by teachers in greece	2010	22.417525041556964	-2.1971704429508274	2490157
2494235	HCI	exploring the black box of task-technology fit	2009	22.314487845991707	-2.7181706768563263	2494262
2496335	HCI	what drives people to continue to play online games? an extension of technology model and theory of planned behavior	2010	22.82396445950339	-2.319807078171823	2496362
2496570	Web+IR	the impact of territorial and relational belonging on member retention in social networking sites	2016	22.527708047925753	-2.177061830397008	2496597
2498631	HCI	understanding factors influencing the adoption of mhealth by the elderly: an extension of the utaut model	2017	22.715345557297894	-2.4559208055318984	2498658
2499995	Visualization	virtual world entrepreneurship	2013	22.689201565799827	-2.451470513754206	2500022
2510321	HCI	effects of e-service process presentations on customer readiness and adoption	2014	22.671094382217287	-2.3018507461050897	2510348
2513840	HCI	internet use intention and adoption among chinese older adults: from the expanded technology acceptance model perspective	2010	22.536433165171115	-2.419455700913085	2513867
2521715	HCI	perceived usefulness, ease of use, and usage of information technology: a replication	1992	22.453900494382356	-2.527000751391871	2521742
2527133	HCI	identity-based determinants for virtual community participation: moderating role of gender composition	2014	22.327945918538084	-2.368315913464809	2527160
2529013	Robotics	development, construct validation and measurement invariance of the greek cyber-bullying/victimization experiences questionnaire (cbveq-g)	2016	22.04579935051869	-2.3564639621973544	2529040
2529160	DB	user information satisfaction, job satisfaction and computer background: an exploratory study	1997	22.163700153538304	-2.2443353733322793	2529187
2531299	HCI	the effect of positive emotion and perceived risk on usage intention to online decision aids	2009	22.775937259638553	-2.2740132332957246	2531326
2533824	HCI	comparative analysis of the use of mobile microblogging and nonmobile online message board for group collaboration	2015	22.454584396788935	-2.4674980976531167	2533851
2534115	HCI	leveraging social networks in the adoption of mobile technologies for collaboration	2016	22.54169778236634	-2.3261690379257773	2534142
2535200	Web+IR	web-based information systems satisfaction - theoretical development and testing of competing models	2007	22.70960058747955	-2.45898737428206	2535227
2535525	HCI	examining a model of information technology acceptance by individual professionals: an exploratory study	2002	22.12546563968557	-2.227383144673785	2535552
2537214	HCI	online social networking behaviors among chinese younger and older adolescent: the influences of age, gender, personality, and attachment styles	2014	22.2180562693081	-2.637708438510493	2537241
2538310	HCI	understanding e-learning continuance intention: an extension of the technology acceptance model	2006	22.879982541562384	-2.33448541583559	2538337
2541956	Web+IR	user satisfaction and attitudes towards an internet-based simulation	2004	22.372189518586307	-2.2607924398616386	2541983
2542043	HCI	explicating multitasking with computers: gratifications and situations	2012	22.005981536205287	-2.4633687946724385	2542070
2542584	HCI	antecedents and consequents of a mobile website's interactivity	2012	22.79512378210567	-2.1389426790860897	2542611
2543871	HCI	age, gender, and internet attitudes among employees in the business world	2005	22.73064766678544	-2.4843909627656333	2543898
2544703	HCI	motivations for 21st century school children to bring their own device to school	2017	22.162533639424108	-3.030670974750294	2544730
2546650	HCI	who will buy smart glasses? empirical results of two pre-market-entry studies on the role of personality in individual awareness and intended adoption of google glass wearables	2015	22.883418888750462	-2.3036335947420956	2546677
2550517	Web+IR	political ideology as a predictor of online consumer review characteristics	2016	22.519727480164967	-2.279397120352721	2550544
2551076	HCI	the co-learning process in healthcare professionals: assessing user satisfaction in virtual communities of practice	2015	22.12897568345151	-2.388863401814112	2551103
2551225	HCI	gender and website design across cultures	2009	22.09115281534893	-2.1909395139762355	2551252
2551333	HCI	explaining the usage intentions of exercise monitoring devices: the usage of heart rate monitors in finland	2012	22.9042655874978	-2.2197156058429326	2551360
2553930	HCI	exploring factors influencing acceptance and use of video digital libraries	2018	22.492054104766392	-2.384900554876022	2553957
2554200	HCI	building loyalty to online communities through bond and identity-based attachment to sub-groups	2014	22.121937982271962	-2.61282106088652	2554227
2554345	SE	university staff adoption of ipads: an empirical study using an extended tam model	2014	22.32767132096837	-2.585991178930624	2554372
2559066	HCI	the use of mobile technology for online shopping and entertainment among older adults in finland	2017	22.444494807263556	-2.5785088313486657	2559093
2560477	HCI	the institutional effect on e-learning in hong kong	2007	22.272953431393887	-2.3826989205061437	2560504
2563691	HCI	intention to use and actual use of electronic information resources: further exploring technology acceptance model (tam)	2009	22.218792956994047	-2.8348208459662803	2563718
2564046	HCI	blogging, communication, and privacy management: development of the blogging privacy management measure	2009	22.395527149533557	-2.5129879698492616	2564073
2564999	HCI	the effects of hedonic/utilitarian expectations and social influence on continuance intention to play online games	2014	22.66781688034478	-2.4051558034839915	2565026
2565081	ECom	personality and online/offline choices: mbti profiles and favored communication modes in a singapore study	2006	22.28170814772758	-2.4535374521003184	2565108
2569725	Web+IR	virtual customer service agents: using social presence and personalization to shape online service encounters	2014	22.074409194521166	-2.2055380237964965	2569752
2570678	HCI	college students' social media use and communication network heterogeneity: implications for social capital and subjective well-being	2017	22.375384959011956	-2.410894425486076	2570705
2572684	HCI	investigating the reciprocal relationships within health virtual communities	2012	22.229758717511654	-2.663196300452146	2572711
2574287	HCI	factors influencing emotional attachment to social network apps	2016	22.42776520672456	-2.3287336741233284	2574314
2575341	HCI	examining the determinant factors of perceived online community usefulness using the expectancy value model	2018	22.394735588795534	-2.2173627145347385	2575368
2575655	HCI	factors enhancing employed job seekers intentions to use social networking sites as a job search tool	2011	22.733542823447582	-2.315330202257058	2575682
2579244	HCI	understanding user acceptance of micro-blog services in china using the extended motivational model	2013	22.719511686995958	-2.1469755714371286	2579271
2579561	Vision	the role of interactivity in information search on acg portal site	2014	23.060374503197565	-2.408348205650419	2579588
2580480	HCI	the effects of perceived online justice on relational bonds and engagement intention: evidence from an online game community	2018	22.606247856646167	-2.1882359830178038	2580507
2585962	HCI	adult attachment and profile images on chinese social networking sites: a comparative analysis of sina weibo and wechat	2017	22.391795360133386	-2.2885498846773222	2585989
2587705	HCI	determinants of users' continuance of social networking sites: a self-regulation perspective	2014	22.59365873314745	-2.2763902899091124	2587732
2589039	HCI	do perceptions fully mediate the impacts of individual differences on technology use?	2004	22.27747153480761	-2.4770996565244343	2589066
2593247	Web+IR	a study on the influence of personality traits on global human resources on global communication ability	2017	22.319023400517867	-2.4014988600622718	2593274
2596862	HCI	ehr: a sensing technology readiness model for lifestyle changes	2017	22.522246815780807	-2.7616186931229656	2596889
2600344	HCI	factors influencing intention of mobile application use	2014	22.880557403681284	-2.2048156704705084	2600371
2601811	HCI	the role of internet self-efficacy in the acceptance of web-based electronic medical records	2005	22.56455681493944	-2.389991457294068	2601838
2602083	HCI	can visual familiarity influence attitudes towards brands? an exploratory study of advergame design and cross-cultural consumer behaviour	2018	22.80905765571964	-2.1998765132700115	2602110
2603754	HCI	proposing a research model for slot machine usage	2015	22.486378162077123	-2.515017196394301	2603781
2608383	HCI	factors affecting smart phone web-dependence anxiety for the travellers	2016	22.68264237319091	-2.177235379440108	2608410
2611602	HCI	the effect of users’ characteristics and experiential factors on the compulsive usage of the smartphone	2011	22.853234676675967	-2.2208326548091155	2611629
2618509	HCI	there all along? a preliminary meta-analysis of the moderating gender effects in technology acceptance research	2008	22.295634543145827	-2.167396934587297	2618536
2618847	HCI	the moderating effects of parenting styles on the relation between the internet attitudes and internet behaviors of high-school students in taiwan	2016	22.449956175763067	-2.646347681193078	2618874
2623096	HCI	information retrieval concerning attitudinal and motivational antecedents of contribution concerning web 2.0 online rescue activities based on the pervasive it education	2012	22.211932529356808	-2.2674489264680497	2623123
2623104	HCI	identifying design feature factors critical to acceptance and usage behavior of smartphones	2017	23.051172792626854	-2.259514100184548	2623131
2625633	HCI	why do members contribute knowledge to online communities?	2010	22.29595198296657	-2.541354519202584	2625660
2630478	HCI	understanding mobile sns usage for aging people in china: a perspective from motivations, trust and attitude	2016	22.267117276082406	-2.5165131803692518	2630505
2631723	HCI	understanding continuance intention in e-learning community	2009	22.32044701319433	-2.5556746355285465	2631750
2637764	HCI	an empirical study on the integrative pre-implementation model of technology acceptance in a mandatory environment	2017	22.39574391481187	-2.257074432628502	2637791
2638098	HCI	understanding users' attitudes towards using a voip survey	2008	22.92306104684021	-2.605853334047466	2638125
2640911	ECom	do men and women differ in privacy? gendered privacy and (in)equality in the internet	2015	22.084030360587434	-2.2527448303922784	2640938
2646122	Web+IR	a study of web searching behaviors - comparing the effort-accuracy tradeoff model with the social cognitive theory	2001	22.43641411282848	-2.163393277527616	2646149
2646197	HCI	excessive use of mobile social networking sites: negative consequences on individuals	2016	22.177029642109684	-2.1555896647667727	2646224
2647688	NLP	influence of gender and english proficiency on facebook mobile adoption	2011	22.423511652903738	-2.146566824364621	2647715
2649294	Crypto	implication au plus tôt des fournisseurs dans les projets de développement de produits nouveaux. avantages, risques et impératifs	2010	23.43681958748329	-3.4536440719749373	2649321
2651236	HCI	mobile health technology evaluation: innovativeness and efficacy vs. cost effectiveness	2017	22.704159701309532	-2.283285114112896	2651263
2654660	HCI	an empirical examination of individual traits as antecedents to computer anxiety and computer self-efficacy	2002	22.133581585533186	-2.2908725932005813	2654687
2655016	HCI	e-readers: fatores que influenciam a intenção de adoção	2013	22.517118884122034	-2.4602734865257485	2655043
