id	title	keywords	abstract	entities	authors	year	journal	doi	fos	area	x	y	ix
54b953b6a1b1316c6cef062882532b2fa7e1288f	adopting collaborative games into agile requirements engineering		In agile software development, where great emphasis is put on effective informal communication involving diverse stakeholders, success depends on human and social factors. Not surprisingly, the Agile Manifesto advocates principles and values such as “individuals and interactions over processes and tools”, “focus on the customer”, “collaborate regularly”, “communicate face-to-face within the team” and “have regular team introspection”. However, agile methodologies have hardly provided any tools or techniques that aid the human side of software development. Additionally, more and more research suggests that customers no longer should be viewed as a passive source of information but need to be engaged in envisioning future business practice, discovering opportunities, and shaping solutions. To deal with these challenges, we propose a framework for extending Scrum with 9 collaborative games. Collaborative games refer to several structured techniques inspired by game play and designed to facilitate collaboration, foster customer involvement, and stimulate creative thinking. The feedback received from a Scrum team that leveraged our framework in two commercial projects, indicates that the adopted collaborative games: (1) make customers more willing to attend the meeting; (2) foster stakeholders’ commitment; and (3) produce better results than the standard approach.	agile software development;collaborative software;information source;interaction;introspection;noise shaping;requirements engineering;scrum (software development)	Adam Przybylek;Mateusz Zakrzewski	2018		10.5220/0006681900540064	manifesto;introspection;engineering management;systems engineering;computer science;software development;requirements engineering;agile software development;scrum	HCI	-88.74072193524815	0.07777826922270122	191545
31b8d1d24544d5f106f0bb2bee8bd82030c8a48b	group dynamics findings from coordination in problem solving and decision making meetings	human computer interaction;collaboration;cscw;group evolution	We present the results of group dynamics and their effect on success in problem solving/decision making meetings. We use a novel multiple input environment for collaboration and data collection, and a hidden profile task given to groups, whose goals are to find the correct solution. We observe that groups elect 0, 1 or 2 leaders, and the best results are obtained by the groups with a single leader. Prior acquaintance (familiarity), does not show any effect on the success or on the group strategies. Groups with a single leader tend to be more successful, and leaders expressed their authority verbally rather than by through the collaborative system.	focus group;problem solving	Flaviu Roman;Himanshu Verma;Patrick Jermann;Pierre Dillenbourg	2012		10.1145/2389176.2389232	simulation;human–computer interaction;computer science;knowledge management;computer-supported cooperative work;communication;management;social psychology;collaboration	ML	-87.35959979679203	-0.9942864982982782	193898
25d05ec25ae69e517c29fd3335b0832bcaad96f3	organizational commitment of it workers: leader support and differences across gender and race	race;organizational commitment;information technology personnel;mentoring;gender;leader member exchange	The purpose of this study is to determine how psychosocial mentoring, career mentoring and leader-member exchange (LMX) contribute to organizational commitment for IT workers, as well as how these relationships differ according to race and gender. We draw on affective events theory, as well as the literature on IT personnel and leader support to explicate these relationships. We conducted a field study of 289 IT workers in a Fortune 500 company. LMX and career mentoring explained 28% of the variance in organizational commitment. Additionally, we found that the impact of career mentoring on organizational commitment is stronger for women than for men and that career mentoring influences organizational commitment for non-minority races but not minority races. Finally, the influence of LMX on organizational commitment is stronger for minority races than for non-minority races. This study contributes to the body of literature on IT personnel issues by exploring whether and how organizational support mechanisms enhance organizational commitment for private sector IT workers. We also demonstrate that race and gender are important considerations for researchers studying organizational commitment, mentoring, and LMX. Our findings suggest that managers can boost organizational commitment among IT workers by focusing on LMX and career mentoring. Moreover, they may want to place particular emphasis on career mentoring programs for women and on the development of supervisor/employee relationships for their minority race IT workers.	field research	Jaime B. Windeler;Cynthia K. Riemenschneider	2013		10.1145/2487294.2487298	public relations;organizational commitment;political science;management;social psychology;affective events theory	HCI	-84.77040876123243	-0.6637380003328004	194252
73677d7cb14438e78b7bfdfa2ba616ab16574b9f	cultural impact on intergroup coordination in software development in china: a qualitative analysis	corporate culture;information systems;uncertainty;qualitative analysis;testing;null;software engineering;national culture;programming profession;cultural differences programming profession information systems project engineering information analysis software quality capability maturity model testing software engineering uncertainty;capability maturity model;project engineering;software development;success factor;information analysis;software quality;cultural differences	Intergroup coordination is critical for the success of software projects. This paper examines the impact of Chinese national culture on intergroup coordination success factors through qualitative analysis of semi-structured interviews with programmers from different sized companies. A comparison based on corporate culture, company size and related factors is conducted to analyze the differences among companies. Implications and directions for future research are discussed.	programmer;semiconductor industry;software development	Minghui Yuan;Douglas R. Vogel	2006	Proceedings of the 39th Annual Hawaii International Conference on System Sciences (HICSS'06)	10.1109/HICSS.2006.108	organizational culture;uncertainty;knowledge management;qualitative research;marketing;software development;software engineering;software testing;data analysis;management;capability maturity model;cultural diversity;information system;software quality	SE	-85.49676192627508	1.1869497240380522	196907
d14787651dc244b51e8a625c6e8dd9ea5aa1934d	the impact of cognitive styles on users' future intention to use e-negotiation systems	cognitive style;empirical study;theoretical model;data collection;internet information systems investments testing laboratories psychology electronic mail decision support systems information technology technology management;cognition;negotiation support systems;social psychology;laboratory experiment;adaptive innovative styles negotiation support systems cognitive styles users future intention information systems foxall style involvement model;information system;individual difference;negotiation support systems cognition;is research	Individual differences in cognitive style have long been regarded as key factors in the success of information systems(IS) and an important topic for IS development and implementation. However, few empirical studies of cognitive style have been conducted in the discipline of negotiation systems (NS). To draw the attention of NS researchers, this study applied Foxall's style/involvement model (SIM) to reveal the relationship between users' unique cognitive styles and their ENS future use intentions. The theoretical model was tested using empirical data collected from an online laboratory experiment involving 92 subjects. Findings confirmed that underlying differences in individuals' adaptive- innovative styles and involvement levels were associated with significant differences in their future use intention towards ENSs. More specifically, more- involved innovators reported the highest future use intention towards ENSs among the four segments. This study not only extends the IS research stream of cognitive style in the context of ENS, but also broadens the knowledge of cognitive styles in the context of information systems by introducing a SIM that has been well examined in the disciplines of social psychology and marketing.	information system;theory	Hersen Doong;Hui-Chih Wang	2008	Proceedings of the 41st Annual Hawaii International Conference on System Sciences (HICSS 2008)	10.1109/HICSS.2008.439	cognition;cognitive style;knowledge management;artificial intelligence;marketing;management science;empirical research;management;information system;statistics;data collection	HCI	-85.81182646318891	0.13538375819727835	196943
838eec891edb3883dace1adcee5186e240153fd5	technological communication tools in use - the shape of knowledge shared within software development teams		Knowledge is a strong competitive source for organizations, giving sustainability, and generating long-term success to them. Communication is the basis of the software project since it provides a way to share knowledge among development team members. Technological tool adoption is one of the strategies to improve communication within software development teams and provide the knowledge sharing among its members. Thus, this paper aims to investigate the shape of the knowledge shared by software development teams through technological communication tools (tech-comm-tools). We collected data through a structured questionnaire and face-to-face interviews. The findings point out the team knowledge is shared by mean texts, photos, and videos according to four categories, such as notification, issues, support to clients, and	software development;software project management	Danieli Pinto;Karoline Garcia;Nelson Tenório	2017		10.5220/0006503401580166	knowledge management;software development;computer science	HCI	-88.28458397967474	-0.05334516529907881	198946
da3dde48eb327d8943c993a1decabae42f7ff620	increasing information worker productivity through information work infrastructure	work infrastructure;information work;knowledge worker;information and communication technology;workplace;difference set;productivity;technology profile;knowledge work;empirical research	Deploying high-quality information work infrastructure leads to higher productivity levels of information workers, findings from empirical research show. Different types of information workers use different sets of technologies and devices. Knowledge workers with a high degree of autonomy depend on mobile and flexible work infrastructure. The OFFICE21® Information Worker's Workplace supports productive information work.		Udo-Ernst Haner;Jörg Kelter;Wilhelm Bauer;Stefan Rief	2009		10.1007/978-3-642-02731-4_5	knowledge management;operations management;management science;business	NLP	-87.45093403947675	0.7836224925071165	198956
24670c5bdc0b7e9de32027c522450eea620a84f9	lotus notes and collaboration: le plus ça change	technology fit;groupware;new technology;professional staff;collaborative work;insurance data processing;information technology;training;collaboration;information technology use;calendars;software packages groupware insurance data processing human factors training;human factors;medical services;internet;lotus notes;insurance company;information technology use lotus notes collaborative work groupware professional staff insurance company organization members technology fit limited training;organization members;collaboration collaborative work collaborative software laboratories information technology space technology internet programming medical services calendars;space technology;programming;insurance companies;software packages;limited training;collaborative software	Work in organizations is becoming increasingly focused on collaborative work in groups. Groupware is widely touted as the information technology that can support this new mode of work by fostering collaboration. In a study of Lotus Notes, a popular groupware product, implemented throughout the professional staff of a large American insurance company, we found the impact of groupware to be somewhat different from what many might have expected. While almost everyone was quite pleased with the Notes implementation and its perceived impact, there was no evidence of a change in the degree of collaboration among organization members. Two key themes are explored as possible explanations for this result: the fit of the technology to the organization, and limited training in how best to use this new technology.	ibm notes	Betty Vandenbosch;Michael J. Ginzberg	1996		10.1109/HICSS.1996.493177	human–computer interaction;computer science;knowledge management;marketing;software engineering;database;management;information technology;world wide web;collaborative software	NLP	-85.82685226245822	0.9180704521276417	199401
