id	title	keywords	abstract	entities	authors	year	journal	doi	fos	area	x	y	ix
f33c27dbb3060d2f1613f67fd9a3ff7c373151e5	power distribution in the weimar reichstag in 1919-1933	weimar republic	We present an analysis of the distribution of voting power in the Reichstag of the Weimar Republic based on the outcomes of the nine general elections in the period 1919–1933. The paper contains a brief description of the political and electoral system of the Weimar Republic and a characterization of the main political actors and their political views. The power distributions are evaluated by means of the Banzhaf index and two new indices which take into account the parties’ preferences to coalesce. A model is constructed to evaluate the parties’ preferences with reference to the closeness of the ideological positions in a one-dimensional political space.	weimar map	Fuad Aleskerov;Manfred J. Holler;Rita Kamalova	2014	Annals OR	10.1007/s10479-013-1325-4	economics;economy;weimar republic;economic system	Theory	-87.4381410663791	3.8329844809583573	181832
3e50ed4392fc13930e70780c220e255c8cfe29ee	effects of simultaneous and sequential work structures on distributed collaborative interdependent tasks	small groups;group size;interdependence;coordination	Distributed online groups have great potential for generating interdependent and complex products like encyclopedia articles or product design. However, coordinating multiple group members to work together effectively while minimizing process losses remains an open challenge. We conducted an experiment comparing the effectiveness of two coordination strategies (simultaneous vs. sequential work) on a complex creative task as the number of group members increased. Our results indicate that, contrary to prior work, a sequential work structure was more effective than a simultaneous work structure as the size of the group increased. A mediation analysis suggests that social processes such as territoriality partially accounts for these results. A follow up experiment giving workers specific roles mitigated the detrimental effects of the simultaneous work structure. These results have implications for small group theory and crowdsourcing research.	crowdsourcing;interdependence;mediation (statistics)	Paul André;Robert E. Kraut;Aniket Kittur	2014		10.1145/2556288.2557158	simulation;interdependence;communication in small groups;size of groups, organizations, and communities	HCI	-87.7633063515474	-1.4233553018441136	183265
d8deff894b7d766272f0c95fa4740c9e78ef10ca	a study of collaborative group work with and without computer-based support	anonymity;decision support;leadership;group decision support systems;electronic meeting systems;group work	As organizational environments become more turbulent and as managers spend more time in meetings in an effort to deal with that turbulence, using information technology to support meetings has become more important. This paper reports on an experiment that compared meetings supported by information technology to meetings with conventional manual support only. The experiment differs from most previous group decision support system (GDSS) experiments in that solutions to the task it used could be objectively scored, it introduced assigned leadership as an independent variable, and it is the first GDSS experiment to compare use of a subset of the University of Arizona GroupSystems GDSS tools to manual group methods. In addition to a communication condition (GDSS or manual) and assigned leadership, the experiment also investigated the effects of anonymity on group process and outcomes. The experiment found that GDSS groups were less likely to reach consensus, took more time to reach a decision, and had more e...		Joey F. George;George K. Easton;Jay F. Nunamaker;Gregory B. Northcraft	1990	Information Systems Research	10.1287/isre.1.4.394	public relations;leadership;decision support system;anonymity;computer science;knowledge management;management science;social psychology;computer security	HCI	-87.35604896910588	-1.1904787302288287	183578
f6398129965d2d5ddad5b22c3fed26a0b406ec35	collaborative work across boundaries: filtering, tagging and rating shared resources in interorganizational settings	organisational aspects collaborative filtering meta data;enacted cyber structures inter organizational collaboration resource sharing tagging;tagging peer to peer computing filtering virtual groups communities portals;filtering collaborative virtual work interorganizational settings spanning organizational boundaries architectural pattern collective collaborative tagging cct cloud based resource sharing dropbox file sharing liferay enterprise portal meta data collective wisdom information connectivity cross functional virtual teams digital trace data intrinsic properties cyber structures	The present work concentrates on collaborative virtual work and the tactics for spanning organizational boundaries. To this effect, it proposes an architectural pattern for Collective Collaborative Tagging (CCT) that integrates cloud-based resource sharing and enterprise portals. The current implementation exploits Dropbox for file sharing and the Liferay enterprise portal for managing meta-data and collective wisdom. The results illustrate the feasibility of a tactic for spanning inter-organizational boundaries to establish and sustain improved information connectivity between members of cross-functional virtual teams. They also point to capabilities of digital trace data to untangle intrinsic properties of enacted cyber-structures resulting from the users' recurrent co-engagement.	architectural pattern;cloud computing;computational complexity theory;digital footprint;dropbox;email filtering;file sharing;file spanning;folksonomy;portals;virtual work	Polychronis Papadakis;Demosthenes Akoumianakis	2014	IISA 2014, The 5th International Conference on Information, Intelligence, Systems and Applications	10.1109/IISA.2014.6878781	computer science;knowledge management;database;world wide web	HPC	-90.84795048180673	-0.6294415018556961	184578
7bede3838957bc369b5593d322e043ad6d69159c	indicators for the dynamics of research organizations: a biomedical case study	life cycle;audiences;indicators;development of research groups;organizational ecology;research focus;growth	This paper reports results on a bibliometric case study of the long-term development of research organizations, using an internationally leading biomedical institute as example. Using scientometric concepts, small group theory, organizational ecology, and process-based organizational theory, we developed a life cycle based theoretical model for analyzing long-term development of research groups and institutes. Three bibliometric indicators are proposed for growth, activity profile stability, and focus. With these, the research dynamics of the case institute are described. First, overall output growth matches developments internationally in developmental biology and stem cell research, and, in line with this, journal article output increasingly dominates the institute’s activity profile. Second, superposed on the overall growth curve, a stepwise development is observed, consisting of long phases of growth and stabilisation. These steps reflect local conditions and events. Historical sources from the Institutes’ archive and interviews with the current staff of the institute suggest that the pattern of life cycles reflects a strong influence of pioneering individuals. But once settled, pioneering directors who remain in function for many years delay adaptation of the institutes’ mission to field developments. Furthermore, national science policies on PhD training, and on priority areas have influenced the life cycles, as did merging with other institutes. As in a social science case, also in this case study stabilized local conditions lead to adaptation to research field dynamics in a delayed fashion. In the present case stable output periods lasted at most 15 years, when local impulses led to new growth of research output and thus prevented onset of a lifecycle decline. The continued growth in the larger field both promoted and legitimized these local impulses.	archive;bibliometrics;ecology;enterprise life cycle;onset (audio);quantum superposition;scientometrics;stepwise regression;theory	Robert Braam;Peter Van den Besselaar	2014	Scientometrics	10.1007/s11192-014-1235-5	biological life cycle;social science;computer science;organizational ecology;operations management;sociology;management;operations research;economic growth	ML	-85.38188869775529	4.146020854520037	185456
acc3938b6eee57ea33f1f5de4d9fae3c8c574b3f	continued voluntary participation intention in firm-participating open source software projects		Firm participation in open source software (OSS) development is a noteworthy phenomenon and includes two types of firm-participating OSS projects: community founded (developed from an open project) and spinout (spun out from an information technology firm’s internal project). OSS project leaders implement quality controls to improve the quality of developed products. They may not be aware that their implementation of quality controls produces a side effect—quality controls signal unobservable project quality to volunteers and promote volunteers’ continued participation intentions (VCPI). We focus on two quality controls—accreditation and code acceptance, which, respectively, map to the input and output quality of an OSS project—and compare their respective effects on VCPI in community-founded and spinout projects. We propose that accreditation and code acceptance influence VCPI by signaling unobservable input and output quality to volunteers. As we focus on continued participation, we theorize as to how v...	open-source software	Shuk Ying Ho;Arun Rai	2017	Information Systems Research	10.1287/isre.2016.0687	economics;marketing;multilevel model;knowledge management;accreditation;software;voluntary participation;input/output;unobservable;information technology;phenomenon	SE	-85.02631542859618	3.481031794732029	185809
754b789a246cf9aa5632b4dd2b418677dc36d69d	model of csr in chinese medicine e-commerce firm: strategic management perspective	pharmaceuticals;corporate social responsibility;shandong zhejiang;e commerce csr model medicinet;electronic commerce;strategic management perspective;behavior scale;e commerce;strategic management;information technology;process analytical framework;companies;companies pharmaceuticals costs information analysis performance analysis ethics productivity acquired immune deficiency syndrome africa information technology;ethics;regression analysis corporate social responsibility electronic commerce medicine;zhejiang;factor analysis;medicinet;regression analysis corporate social responsibility chinese medicine e commerce firm strategic management perspective process analytical framework behavior scale shandong zhejiang cone commerce firmatory factor analysis;performance analysis;shandong;model;medicine;csr;regression analysis;economics;productivity;correlation;acquired immune deficiency syndrome;information analysis;africa;chinese medicine e commerce firm;cone commerce firmatory factor analysis;stakeholder theory	"""Inspired by Western literature, the application """"affecting factors - behaviors - affect the outcome"""" process analytical framework, Zheng Haidong has developed a corporate social responsibility Behavior Scale, Shandong, Zhejiang enterprises as the mainstay held three rounds of questionnaires, the use of cone-commerce firmatory factor analysis to develop corporate social responsibility behavior scale, will affect the factors into an individual level, organization level, and social dimensions affect the results to long-term performance and short-term performance as the main indicators, regression analysis. Reached the following conclusions: in-depth stakeholder theory of corporate social responsibility application represents the development of research directions."""	e-commerce;factor analysis;strategic management	Wengeng Shi	2010	2010 Third International Symposium on Intelligent Information Technology and Security Informatics	10.1109/IITSI.2010.36	stakeholder;marketing;business;commerce	Metrics	-85.21677250621909	3.3431777777093954	187284
11e1172ae645a15cfb950419c2ca350daa9dfc30	observations of the lifecycles and information worlds of collaborative scientific teams at a national science lab	high magnetic field;teams;lifecycles;information worlds;mixed method;mixed methods;virtual organization;virtual organizations;scientific research;scientific knowledge;scientific collaboration;observations	Team-based scientific collaborations play a key role in the discovery and distribution of scientific knowledge. In order to determine the social and organizational factors that help support a scientific team's successful transition from short-term experiments to long-term programs of ongoing scientific research, this study used observations of teams conducting experiments at the National High Magnetic Field Laboratory to determine what teams actually do during these experiments. As part of a larger, ongoing research project using mixed methods, our findings describe the scientific culture of hybrid teams at work, and demonstrate how multiple, overlapping, and nested lifecycles and information worlds play an important role in promoting successful and continuing scientific collaboration. The boundaries between worlds and efforts to span them are particularly important, requiring greater attention. Our future research will develop a model including these factors and add further practical and theoretical implications to those we have already identified.	experiment	Adam Worrall;Paul F. Marty;Jessica Roberts;Kathleen Burnett;Gary Burnett;Charles C. Hinnant;Michelle M. Kazmer;Besiki Stvilia;Shuheng Wu	2012		10.1145/2132176.2132234	simulation;engineering;knowledge management;management science	HPC	-87.64199753258708	-0.3720032451736125	187655
e3c2c97510f48ae59f934fe80c5d9568ef79b86c	a field investigation of the nostalgia effect	social aspects of automation information systems;it professional;instruments;atmospheric measurements;information systems;particle measurements;collaboration;semantics;social aspects of automation;satisfiability;correlation instruments semantics conferences atmospheric measurements particle measurements collaboration;goal setting;system development;satisfaction responses nostalgia effect system success is research past goal attainment yield shift theory active goal set exploratory field investigation is it professionals india strong association;correlation;conferences;is research	Satisfaction is a key indicator of system success, and so has been the subject of much IS research. The nostalgia effect, whereby individuals feel satisfied or dissatisfied when thinking about past goal attainment or failure, has been observed to influence analysts' decisions with respect to ongoing systems development. The Yield Shift Theory (YST) of Satisfaction offers an explanation for the nostalgia effect as a function of changes in an individual's active goal set. This paper reports on an exploratory field investigation of nostalgia effect among 105 working IS/IT professionals in India reflecting on past collaboration experiences. The study revealed a measurable nostalgia effect, and revealed a strong association between satisfaction responses and the antecedents proposed by Yield Shift Theory.	experience;software development process	Birud Sindhav;Bruce A. Reinig;Robert O. Briggs	2011	2011 44th Hawaii International Conference on System Sciences	10.1109/HICSS.2011.9	simulation;artificial intelligence;marketing;operations management;semantics;management;information technology;correlation;information system;satisfiability;collaboration	HCI	-86.26764738567057	0.7306911219076941	188668
41a9a993d80d36fca584538a1b43f293683261b2	a semantic and multidisciplinary model for professional and social networks analysis	social network services;networks;electronic commerce;socioprise project;measurement;performance management;static;digital economy multidisciplinary model semantic model ontologies engineering ontologies physics professional social networks analysis social graph static analysis social graph dynamic analysis enterprise content decisional tool performance management socioprise project software engineering company human capital management french state secretariat;sociophysics;enterprise content;social capital;semantic network;semantics;social graph static analysis;professional social networks analysis;human capital management;semantique;software engineering;analyse;graphs;ontologies artificial intelligence;information sharing;social network;indexes;decisional;visualization;semantic model;servers;statistical analysis;decisional tool;social skill;professional aspects;social graph dynamic analysis;semantic processing;decision theory;social networking online;ontology engineering;software engineering company;semantic;social network analysis;human capital;social;sociaux;ontologies;management tool;analysis;communities;digital economy;reseaux;ontologies engineering;static and dynamic analysis;ontologies physics;ontology;dynamic;french state secretariat;flow analysis;semantic analysis;software engineering decision theory electronic commerce graphs ontologies artificial intelligence professional aspects social networking online;sociophysics social networks analysis decisional static dynamic semantic ontology;multidisciplinary model;semantics communities social network services measurement indexes visualization servers	By bridge-building between the classical models of social networks analysis, ontologies engineering and physics, our work defines a multidisciplinary model of professional social networks analysis, dedicated to human and social capital management in enterprises and institutions. We introduce a semantic process of social graphs static and dynamic analysis, based on the enterprise content and producing decisional tools for the performance management. This approach is in line with the Socio prise project, in partnership with a leader software engineering company for human capital management. Socio prise is funded by the French State Secretariat at the prospective and development of digital economy.	applicative programming language;experiment;knowledge engineering;mathematical model;ontology (information science);prospective search;social capital;social network;software engineering	Christophe Thovex;Francky Trichet	2011	2011 International Conference on Advances in Social Networks Analysis and Mining	10.1109/ASONAM.2011.102	semantic data model;database index;social skills;performance management;social network analysis;social science;visualization;social capital;decision theory;semantic memory;computer science;knowledge management;ontology;data-flow analysis;ontology;analysis;data mining;semantics;management science;digital economy;graph;semantic network;social;world wide web;server;measurement;statistics;social network	DB	-90.09187476018968	-0.9718461194948895	190105
a06569fa4bbf05755f48827d712ce1226a6d4a1a	alternative date entry technologies and settings: impact on worker attitudes and behavior	job satisfaction;absenteeism;data entry;task design;key entry;motivation;job design;productivity;attitudes;job characteristics	Changes in technology and the movement of key entry functions into user areas are altering the traditional work environment. These changes can effect worker attitudes and associated behaviors, such as absenteeism and productivity. This study examines the effect of differences in key entry settings and technologies on perceived job characteristics and worker attitudes and behaviors. The results are based upon a study of 350 operators working in 87 key entry environments drawn from 29 organizations. It is found that new technologies and the movement of key entry into user areas affect perceived task characteristics, including task significance, autonomy, and feedback from the job. Job satisfaction, worker motivation, absenteeism, and productivity are also influenced (but to a lesser degree) by changes in key entry technology and setting. The implications of the findings for the design of key entry equipment and jobs are discussed. The conclusion is drawn that designers of key entry technologies and environments will benefit from a knowledge of the dimensions comprising meaningful work.		Blake Ives;Norman L. Chervany	1983	Information & Management	10.1016/0378-7206(83)90018-6	simulation;economics;job design;engineering;knowledge management;operations management;management;job analysis	HCI	-85.2635653796003	-1.782881879959021	190487
1c6f2c07e3587825646d17fdcd67655ab30fe4b9	expectations and influencing factors of is graduates and education in thailand: a perspective of the students, academics and business community		As academic we have always been entrusted with developing the knowledge, skills, and capability of our IS students. In the strive for excellence in education, there is always the question of what has been implemented is appropriate and finally achieves its u ltimate goals of delivering qua lity, capable and intellectual students as workforce for the business. To this end, this exploratory research tries to discover what knowledge, skills and capability are expected of an IS gr aduate, the fac ilities expected to develop these qualities and what influencing factors make the students go for an IS education. The research will be based on the perspectives of the student, academic an business community. The major findings highlight the overall tendency of higher mean expectation of the business community in most of the fundamental expectations of the type of kn owledge, s ills and capability and the fac ilities essential to the development of these attributes. The academics are normally s upportive of the business community’s perspectives except in the dimensions of skill expectation nd attitudinal factors. Overall, it also appears that the students show a lower average means on most attributes as compared to the academics and business community. Based on this research, there appears to be disti nctive expectations of an IS graduate. Based on the balanced technology approach of looking at the development of the IS graduate from degree of so phistication of the Technoware (T), Humaware (H), Inforware (I) and Orgaware (O), it is hoped that the following can be achieved: 1. A newly revise d and revamped IS curriculum, 2. A linkage of the THIO to develop the IS graduate and 3. A linkage of the academia-industry THIO linkage to de velop the IS graduate.	linkage (software);non-functional requirement	Teay Shawyun	1999	InformingSciJ		engineering;knowledge management;operations management;management	Web+IR	-85.09312516625828	2.269364547843822	190618
1263963cbe40ac38c4106b4dbdab0c039e4c5a57	guiding cooperative stakeholders to compromise solutions using an interactive tradespace exploration process	compromise;utility;visual analytics;systems engineering	Engineering projects frequently involve the cooperation of multiple stakeholders with varying objectives and preferences for the resulting system. Finding a mutually agreeable solution is of paramount importance in order to assure the successful completion of these projects, particularly when different stakeholders are splitting the costs because none can afford to finance the project on their own. This paper proposes a process for uncovering potential mutually agreeable solutions between conflicting stakeholders, without relying on hypothetical aggregate or super-stakeholder preferences, by using guided individual preference compromises and efficiency tradeoffs. Opportunities for experimentally testing the process, with results investigating its usability and solution quality, are discussed. Further directions to improve and expand the process are also discussed, with attention paid to the design of the process as it relates to promoting an implied concept of “goodness” or “fairness” of compromise along with the ability of the process to incorporate advanced interactive technology to improve knowledge retention and understanding of the participating stakeholders. © 2013 The Authors. Published by Elsevier B.V. Selection and/or peer-review under responsibility of Georgia Institute of Technology.	aggregate data;experiment;fairness measure;usability	Matthew E. Fitzgerald;Adam M. Ross	2013		10.1016/j.procs.2013.01.036	knowledge management;data mining;management science	HCI	-91.11173916508272	0.6572724796614698	191318
