id	title	keywords	abstract	entities	authors	year	journal	doi	fos	area	x	y	ix
eec39ba00c494a8b28619b46636c4e237cd26f3f	the impact of importance and distribution on information exchange in team decision making: preliminary results	computer mediated decision support system information exchange team decision making information importance information distribution synchronous distributed team environment data collection laboratory study;theoretical framework;complexity theory;distributed teams;team decision making;distributed team;team working data handling decision making decision support systems;firing;team working;decision support system;shape;information exchange;decision support system information exchange group distributed teams;decision support systems;decision making firing complexity theory laboratories shape decision support systems context;data handling;context;group	This research investigates the effects of information importance and distribution on its exchange in a synchronous distributed team environment. Data are being collected in laboratory studies where subjects interact through a computer-mediated decision support system. This paper presents the major research hypotheses, a theoretical framework for the study, describes the methodology, and presents preliminary results for two of the hypotheses. This research aims to make a significant contribution to understanding information exchange in teams.	computer-mediated communication;decision support system;information exchange	Babajide Osatuyi;Starr Roxanne Hiltz;Jerry Fjermestad	2012	2012 45th Hawaii International Conference on System Sciences	10.1109/HICSS.2012.568	information exchange;decision support system;shape;computer science;knowledge management;group method of data handling;management science;group	Robotics	-87.02511859626651	0.07725916735793391	161510
1f5cc1766120b8b41899521579226bcf96634ced	team familiarity, role experience, and performance: evidence from indian software services	experiencia profesional;developpement entreprise;international organizations;professional experience;firm development;experience professionnelle;learning;team learning;performance;experience;teams;service industries;desarrollo empresa;industrie service;team work;team performance;travail equipe;trabajo equipo;cumulant	Much of the literature on team learning views experience as a unidimensional concept captured by the cumulative production volume of, or the number of projects completed by, a team. Implicit in this approach is the assumption that teams are stable in their membership and internal organization. In practice, however, such stability is rare, because the composition and structure of teams often change over time (e.g., between projects). In this paper, we use detailed data from an Indian software services firm to examine how such changes may affect the accumulation of experience within, and the performance of, teams. We find that the level of team familiarity (i.e., the average number of times that each member has worked with every other member of the team) has a significant positive effect on performance, but we observe that conventional measures of the experience of individual team members (e.g., years at the firm) are not consistently related to performance. We do find, however, that the role experience of individuals in a team (i.e., years in a given role within a team) is associated with better team performance. Our results offer an approach for capturing the experience held by fluid teams and highlight the need to study context-specific measures of experience, including role experience. In addition, our findings provide insight into how the interactions of team members may contribute to the development of broader firm capabilities.	ieee xplore	Robert S. Huckman;Bradley R. Staats;David M. Upton	2009	IEEE Engineering Management Review	10.1287/mnsc.1080.0921	team learning;simulation;psychological safety;teamwork;economics;performance;knowledge management;team effectiveness;mathematics;team composition;management;statistics;cumulant	Visualization	-86.23944461931575	2.736563399405657	161898
8c5106b66df0e8346b4fda104eef17642d661f18	discovering group interaction patterns in a teachers professional community	graph theory;community development;life cycle;knowledge management;information technology group interaction patterns teachers professional community community development social network analysis graph theory data mining interaction pattern discovery virtual teams group development internet;data mining;educational computing graph theory internet data mining knowledge management;social network services virtual groups graph theory computer networks pattern analysis information management data mining internet information technology educational institutions;internet;interaction pattern;virtual team;social network analysis;educational computing;group interaction	Managers and group leaders of a community may not have enough information to help them direct the community development. In this paper, we adopt social network analysis, graph theory and data mining techniques to analyze groups in a community at their different project periods. Each group is presented by several attributes that are computed from social network analysis and graph theory to represent various interactions of the group members. The evolution of these attributes enables the discovery of the interaction patterns of different groups in their life cycles. With these discoveries, team leaders can obtain concise information about their teams’ performance, and community managers can cluster groups to capture stereotypes of virtual teams in the community. Such knowledge will benefit group development in a community.	cohesion (computer science);data mining;effective method;graph theory;interaction;interaction design pattern;social network analysis	Fu-Ren Lin;Chun-Hung Chen;Kuo-Lung Tsai	2003		10.1109/HICSS.2003.1174266	biological life cycle;community development;social network analysis;the internet;computer science;knowledge management;graph theory;data science;data mining;world wide web	HCI	-89.94266238728473	-1.0321742620148935	163478
0f58763b1399a760155787990d8e19a66346826f	towards measuring sharedness of team mental models by compositional means		The better the team mental model, the better the teamwork. An important aspect of what determines a good team model is the extent to which the model is shared by the team members. This paper presents suggestions for measuring the extent to which teams have a shared mental model and describes how these measures are related to team performance. The most promising measures of sharedness proposed so far rely on using a compositional approach for team modeling and on a situation-sensitive relevance relation that indicates to what extent components contribute to team performance. A case study illustrates the approach and initial results on measuring performance when teams use different levels of sharedness.	complexity;experiment;mental model;relevance	Catholijn M. Jonker;M. Birna van Riemsdijk;Iris van de Kieft;Maria L. Gini	2011			simulation;knowledge management;team effectiveness;management science;team composition	SE	-87.971862929326	-1.5059832004534313	164111
bbba58f8b93d6bbb16746c701c9bd03dec1c91a0	how large should a complex system be? an application in organizational teams	teams;complex system;complex systems;organization theory;management;team division;nk model	Abstract#R##N##R##N#This article investigates when a growing team benefits from being divided and how complex interactions among workers and management impact this decision. The proposed model—a modification of Kauffman's NK model—has the property that team performance decreases as the size of the team increases. Analytical results and computer simulations show how team size, the amount of supervision, worker performance, interaction among employees, relationships between management and labor, and leadership skill affect when a team should be split. © 2007 Wiley Periodicals, Inc. Complexity 12: 54–70, 2007	complex system	William P. Millhiser;Daniel Solow	2007	Complexity	10.1002/cplx.20172	complex systems;simulation;nk model;knowledge management;team effectiveness;team composition	Robotics	-86.28472249234375	-0.16638202063598573	166164
3885ce6403c9ee8e82e58e19c3fe3f6aff0247ec	the measurement of gss effectiveness: a meta-analysis of the literature and recommendations for future gss research	decision support systems;group decision support systems;groupware;human factors;performance evaluation;effectiveness measurement;group support systems;information quality;meta-analysis;organisational impact;systems and information quality;user satisfaction	Some authors have claimed that much research concerning the success of group support systems (GSS) has been inconclusive. This study examines the multitude of measures of GSS success which have been employed in this research and organises them into categories previously used to study information systems (IS) success, namely systems and information quality, use, user satisfaction, and individual and organisational impact. An extensive literature analysis of 210 GSS papers was undertaken and 95 were identified which collected data concerned with the measurement of GSS success in some way. The analysis reveals a variety of success measures and of different instruments used for each success measure. It reveals gaps in the study of GSS success, suggests research opportunities in areas such as system quality and use, information quality, and organisational impact, and recommends more work in the field.<>	recommender system	Graham Pervan	1994			meta-analysis;decision support system;computer science;knowledge management;human factors and ergonomics;management science;information quality;world wide web;information system	HCI	-88.09446067496461	-2.444306657061245	166700
3257ca454d7bb90052bafc2f0cf2cd8b231a2598	virtual team collaboration: building shared meaning, resolving breakdowns and creating translucence	social context;systemvetenskap informationssystem och informatik;information systems;translucence;1503 business and management;shared meaning;virtual teams;community structure;critical reflection;virtual team;communication breakdown;0806 information systems;face to face;organizational structure;080606 global information systems;geographic distribution	Managing international teams with geographically distributed participants is a complex task. The risk of communication breakdowns increases due to cultural and organizational differences grounded in the geographical distribution of the participants. Such breakdowns indicate general misunderstandings and a lack of shared meaning between participants. In this paper, we address the complexity of building shared meaning. We examine the communication breakdowns that occurred in two globally distributed virtual teams by providing an analytical distinction of the organizational context as the foundation for building shared meaning at three levels. Also we investigate communication breakdowns that can be attributed to differences in lifeworld structures, organizational structures, and work process structures within a virtual team. We find that all communication breakdowns are manifested and experienced by the participants at the work process level; however, resolving breakdowns may require critical reflection at other levels. Where previous research argues that face-to-face interaction is an important variable for virtual team performance, our empirical observations reveal that communication breakdowns related to a lack of shared meaning at the lifeworld level often becomes more salient when the participants are co-located than when geographically distributed. Last, we argue that creating translucence in communication structures is essential for building shared meanings at all three levels.		Pernille Bjørn;Ojelanki K. Ngwenyama	2009	Inf. Syst. J.	10.1111/j.1365-2575.2007.00281.x	organizational structure;social environment;economics;computer science;knowledge management;management science;management;social psychology;community structure;information system;statistics	HCI	-86.72690299089274	-0.847470045100902	168578
74953093e7d124ec07b62466e4d8c3f048a20d6b	an analysis of web-based document management and communication tools usage among project managers		The article analyzes modern cloud document management systems and communication tools from the viewpoint of a EU project managers, who lead multidisciplinary, multilingual and international teams. It also explores the types of users who use these tools as well as the motivation factors guiding their choices. The research includes observation within the project group, interviews and semi-structured surveys among 40 EU project managers, who have managed 244 EU projects. The main finding is that a lot of project managers still don't use shared, cloud document system. The biggest obstacle to more efficient usage of existing systems is their un-friendliness, security concerns and lack of skills. Meetings are still perceived as the most efficient channel for distributing and receiving project tasks, but they are closely followed by communication software. Applying the authors' findings to the project management practice can lead to better communication and shared document storage management, which can influence overall effectiveness of project management.		Tomislav Rozman;Tanja Kocjan Stjepanovic;Andrej Raspor	2017	IJHCITP	10.4018/IJHCITP.2017010101	basis of estimate;project management;extreme project management;market requirements document;program management;software project management;opm3;systems engineering;engineering;knowledge management;functional manager;project management 2.0;project management triangle;management;project charter;world wide web;schedule;risk management plan;project planning;project portfolio management	DB	-88.18442968359054	1.0545628505095934	169836
aa23bf652c829eb4842eaf0fd5911b911d55cb29	research note - perceived firm attributes and intrinsic motivation in sponsored open source software projects	intrinsic motivation;voluntary contributions;firm sponsorship;firm attributes;open source software	Voluntary contributions are crucial to the success of open source software OSS projects. Firms sponsoring OSS projects may face substantial challenges in soliciting such contributions, since volunteer participants are neither regulated by an employment contract nor offered financial incentives. Although prior work has shown the positive impact of motivation on the effort expended by volunteer participants, there is limited understanding of how specific firm attributes shape volunteers' intrinsic motivation. We offer a theoretical model of how the perceived community-based credibility and openness of the sponsoring firm have a positive impact on the intrinsic motivation of volunteer participants. The model is explored using survey data on volunteer participants from two sponsored OSS projects. Results show that a sponsoring firm's community-based credibility OSS developers' perception of its expertise and trustworthiness and openness its mutual knowledge exchange with the community strengthen the volunteer participants' social identification with the firm-sponsored community, which in turn reinforces their intrinsic motivation to participate. Moreover, the perceived community-based credibility of a sponsoring firm directly enhances volunteer participants' intrinsic motivation, whereas perceived openness fails to affect motivation without the mediating mechanism of social identification. Implications for firms seeking voluntary contributions for their sponsored OSS projects are discussed.	open-source software	Sebastian Spaeth;Georg von Krogh;Fang He	2015	Information Systems Research	10.1287/isre.2014.0539	public relations;motivation;knowledge management;marketing;management;social psychology	SE	-86.79130657057341	-2.1502239923156283	171463
5ec64302d217c41f5193190fbbd427e7f39ac9ab	human resources management and its impact on innovation performance in companies	goal recognition;teamwork organisation;human resources management;research and development;innovation management;achievement rewards;r d;technical personnel;hrm;innovation performance;experience sharing;common language;human resource management;scientific personnel;spain	This study is based on the recent literature concerning the management of Human Resources (HR) and, more specifically, how this may influence innovation in a company. We start with the hypothesis that certain management practices in this area (goal recognition and reward for achievement, team work organisation, the creation of a common language and the sharing of experiences amongst R&D workers, inter alia) will have a positive effect on innovation performance in the firm. The influence of industrial sector to which a firm belongs and the combined application of these politics are also considered. These hypotheses are tested with a survey of 670 innovations developed by the Spanish firms.		Carmen Perez Cano;Pilar Quevedo Cano	2006	IJTM	10.1504/IJTM.2006.009227	economics;innovation management;knowledge management;human resource management;management science;lingua franca;management	OS	-84.77694123621012	0.9855877347361938	172408
20abcf97d417f9008b5f7284ca340c8f2bde89b5	communication in context: a stimulus-response account of agile team interactions	empirical study;social interaction;pair programming;communication theory;situated cognition;communication channels	  Previous research has indicated that work artefacts commonly used by agile teams capture progress information, while functional  aspects such as requirements are developed and sustained through the team’s social interactions and communication channels.  This paper reports an initial empirical study to investigate the relationship between agile work artefacts and communication  during stand-up meetings and pair programming sessions, specifically focusing on gathering and clarifying requirements. Using  Bateson’s communication theory, we found that the work artefacts, and other individuals form an external event system which  supports Agile teams during the gathering and clarifying of requirements. Using this communication theory together with Clancey’s  situated cognition, we predict that if the two do not exist together throughout the interactions, then teams members will  form discoordinated actions together.    		Nik Nailah Binti Abdullah;Helen Sharp;Shinichi Honiden	2010		10.1007/978-3-642-13054-0_13	psychology;human–computer interaction;knowledge management;communication	HCI	-88.03685491648336	-0.7394662518594612	172610
07b791aaf5d11d522f95c5404f17615656022b01	citation networks and the emergence of knowledge core	citation network;citation analysis;nickel;complex network;multi agent;knowledge engineering robustness indexes citation analysis optimization;intellectual communities knowledge core core periphery structure artifacts decentralized knowledge contributions knowledge creation knowledge citation knowledge heterogeneity direct citations indirect citations incentive rationale;indexes;期刊论文;optimization complex network multi agent citation network;joining processes;robustness;optimization;communities;knowledge engineering	Observations on the citation networks often confirm a core-periphery structure: A clustered group of artifacts possess the core knowledge to the field, which is widely cited by artifacts at periphery. We explain this as an outcome resulted from decentralized knowledge contributions from individuals who maximize their own utilities. Our model sheds insights on how knowledge creation, knowledge citation, and knowledge heterogeneity affect the emergence of knowledge core, in both cases of direct and indirect citations. We find through simulations that the core-periphery architecture of citation networks is robust to generalizations on knowledge heterogeneity and knowledge creativity. By studying the incentive rationale that underlies the growth of citation networks, our research has potential implications on the design and administration of intellectual communities.	citation analysis;citation graph;core-periphery structure;design rationale;emergence;simulation	Yonghui Zhang;Chi Zhang	2015	IEEE Transactions on Knowledge and Data Engineering	10.1109/TKDE.2015.2454512	nickel;database index;computer science;knowledge management;knowledge engineering;data mining;management science;citation analysis;world wide web;complex network;robustness	DB	-88.04500613274281	1.439256322356102	174731
bbee0db808cbab7e617ec933b761ffc1d536e124	task uncertainty and the use of computer technology	informatica;procesamiento informacion;end user computing;organization management;task uncertainty;information processing;informatique;computer science;gestion organizacion;traitement information;gestion organisation	The relationship between task uncertainty and the utilization of computer technology was studied for a sample of 216 middle managers and first line supervisors in a large mid-Western bank. Greater task variability in Perrow's technology grid was associated with the use of a greater variety of computing tools. Task analyzability was related to the type of computer application used. Where tasks were less analyzable, users opted for personal computers, mostly for analysis and inquiry applications. For more analyzable tasks, mainframe computers were used more extensively, mostly for exception and monitoring applications. Implications are drawn for future research on the use of computer technology.		Jawaid A. Ghani	1992	Information & Management	10.1016/0378-7206(92)90062-K	simulation;information processing;computer science;engineering;electrical engineering;artificial intelligence;operations management;end-user computing;management;social psychology;operations research;world wide web	HCI	-85.91814702163666	3.104381675633129	175502
ba105eb3bae1fc0466bf0a14d7a7ccfcfc03d2cf	understanding user adaptation toward a new it system in organizations: a social network perspective		Social networks can be a vital mechanism for users to adapt to changes induced by new IT systems in organizations. However, we do not adequately understand the effect of social networks on post-adoption IT use. Drawing on coping theory and the social network literature, we develop a cognitive-affective-behavioral classification of user adaptation and identify seeking-network closure and giving-network closure as key network characteristics pertinent to postadoption IT use. Thereafter, we establish a theoretical link from seeking-network closure and giving-network closure to post-adoption IT use through the underlying mechanisms of user adaptation. We operationalize the research model using a field survey of a newly implemented electronic medical record system in a hospital in Northeast China, where we collected network data and objective system logs of 104 doctors. We found that seeking-network closure was positively associated with cognitive adaptation but negatively associated with affective adaptation and behavioral adaptation, whereas giving-network closure was negatively associated with cognitive adaptation but positively associated with affective adaptation and behavioral adaptation. Moreover, cognitive adaptation and affective adaptation were determinants of post-adoption IT use, but behavioral adaptation was not. We discuss our study’s theoretical and practical contributions.		Yi Wu;Ben Choi;Xitong Guo;Klarissa Ting-Ting Chang	2017	J. AIS		knowledge management;computer science;management science;social network	Security	-84.89991079476765	-1.8303983778106776	175975
fbcb795a2bc3e8a560bdcf743e5626b0d0cfadd7	an empirical study of process knowledge: coherence as a static process property	methods;human factors;theory;software process elicitation;empirical studies	This paper presents our research experiences studying process knowledge with qualitative and quantitative methods. Informed by related arguments, we present two hypotheses that are tested using a between subjects experimental design. The first hypothesis concerns the accuracy of software process elicitation, which we characterize as the human perception of error between description and performance of a process. The second hypothesis explores the detection of subtle differences in process articulation using latent semantic analysis, a computational technique for measuring patterns in written discourse. The results of our analyses are compared along with discussion of theoretical implications. We define a new type of process property, Coherence, which represents a measure of relatedness in process knowledge. Results also indicate that Coherence may be increased with the use of a conceptual model. Future research is guided by experimental and industrial application. Copyright © 2012 John Wiley & Sons, Ltd.		Carlton A. Crabtree;Anthony F. Norcio;Carolyn B. Seaman	2014	Journal of Software: Evolution and Process	10.1002/smr.1567	computer science;engineering;artificial intelligence;human factors and ergonomics;management science;empirical research;management;theory	SE	-88.35285623314873	-2.141345929591282	181113
