id	title	keywords	abstract	entities	authors	year	journal	doi	fos	area	x	y	ix
66ec6581ec096ffb40d5d4cbdb034155460f2ea7	on the relative importance of privacy guidelines for ambient health care	empirical study;human computer interaction;ambient intelligence;health monitoring;privacy guidelines;fair information practices;data quality;health care	We present an empirical study regarding the relative importance of complying with privacy related guidelines in the context of a Health Monitoring System. Participants were confronted with text scenarios describing privacy related aspects of a health monitoring service for daily use at home. Participants assessed the relative importance to them of simplified variants of the OECD (Organization of Economic Cooperation and Development) guidelines for the protection of personal data. The guidelines that relate to Insight and Openness were most valued. The guidelines relating to Modification and Data Quality were valued least by most participants in this context. Methodological challenges were encountered on the way, which reveal the complexity of conducting empirical investigations of privacy aspects of human-computer interaction.	data quality;human–computer interaction;openness;personally identifiable information;privacy	Evelien van de Garde-Perik;Panos Markopoulos;Boris E. R. de Ruyter	2006		10.1145/1182475.1182516	data quality;ambient intelligence;human–computer interaction;privacy by design;computer science;data mining;privacy for research participants;ftc fair information practice;empirical research;health care	HCI	-63.97066763717903	-58.019711849788784	109518
970fd0e4797ab6681c3d8abf4370c783c844f629	a comparative agglomerative hierarchical clustering method to cluster implemented course	hierarchical clustering;work environment;qa75 electronic computers computer science;agglomerative hierarchical clustering;clustering method;number of clusters	There are many clustering methods, such as hierarchical clustering method. Most of the approaches to the clustering of variables encountered in the literature are of hierarchical type. The great majority of hierarchical approaches to the clustering of variables are of agglomerative nature. The agglomerative hierarchical approach to clustering starts with each observation as its own cluster and then continually groups the observations into increasingly larger groups. Higher Learning Institution (HLI) provides training to introduce final-year students to the real working environment. In this research will use Euclidean single linkage and complete linkage. MATLAB and HCE 3.5 software will used to train data and cluster course implemented during industrial training. This study indicates that different method will create a different number of clusters.	algorithm;cluster analysis;hierarchical clustering;host card emulation;linkage (software);matlab;single-linkage clustering	Rahmat Widia Sembiring;Jasni Mohamad Zain;Abdullah Embong	2010	CoRR		complete-linkage clustering;correlation clustering;fuzzy clustering;flame clustering;computer science;data science;canopy clustering algorithm;machine learning;hierarchical network model;consensus clustering;cure data clustering algorithm;data mining;hierarchical clustering;cluster analysis;single-linkage clustering;brown clustering;dendrogram;hierarchical clustering of networks;clustering high-dimensional data;conceptual clustering	ML	-79.35699594932964	-52.32781783298459	111476
5753a2f68b1f5f0f24bf9d8d33b37c6b7d7ff48e	operator experience determines performance in a simulated computer-based brain tumor resection task		Develop measures to differentiate between experienced and inexperienced neurosurgeons in a virtual reality brain surgery simulator environment. Medical students ( $$n=71$$ n = 71 ) and neurosurgery residents ( $$n=12$$ n = 12 ) completed four simulated Glioblastoma multiforme resections. Simulated surgeries took place over four days with intermittent spacing in between (average time between surgeries of 4.77  $$\pm $$ ±  0.73 days). The volume of tumor removed (cc), volume of healthy brain removed (cc), and instrument path length (mm) were recorded. Additionally, surgical effectiveness (% tumor removed divided by % healthy brain removed) and efficiency (% tumor removed divided by instrument movement in mm) were calculated. Performance was compared (1) between groups, and (2) for each participant over time to assess the learning curve. In addition, the effect of real-time instruction (“coaching”) was assessed with a randomly selected group of medical students. Neurosurgery residents removed less healthy brain, were more effective in removing tumor and sparing healthy brain tissue, required less instrument movement, and were more efficient in removing tumor tissue than medical students. Medical students approached the resident level of performance over serial sessions. Coached medical students showed more conservative surgical behavior, removing both less tumor and less healthy brain. In sum, neurosurgery residents removed more tumor, removed less healthy brain, and required less instrument movement than medical students. Coaching modified medical student performance. Virtual Reality brain surgery can differentiate operators based on both recent and long-term experience and may be useful in the acquisition and assessment of neurosurgical skills. Coaching alters the learning curve of naïve inexperienced individuals.	brain neoplasms;brain simulation;excision;experience;glioblastoma multiforme;learning disorders;naivety;occur (action);operative surgical procedures;randomness;real-time transcription;science of neurosurgery;simulators;surgery simulator;virtual reality;tumor tissue	Terrell Holloway;Zachary S. Lorsch;Michael A. Chary;Stanislaw Sobotka;Maximillian M. Moore;Anthony B. Costa;Rolando F. Del Maestro;Joshua Bederson	2015	International Journal of Computer Assisted Radiology and Surgery	10.1007/s11548-015-1160-y	simulation;multimedia;surgery	Visualization	-68.16571139763211	-55.22023858738484	111554
887c113e07a0763e432de6a5d3ad90940294f317	context-dependent awareness support in open collaboration environments	context awareness;notification management policies;collaboration environments;web 2 0;personalized awareness information support;interruption management	The widespread adoption of online services for performing work, home and leisure tasks enables users to operate in the ubiquitous environment provided by the Internet by managing a possibly high number of parallel (private and shared) activity contexts. The provision of awareness information is a key factor for keeping users up-to-date with what happens around them; e.g., with the operations performed by their collaborators. However, the delivery of notifications describing the occurred events can interrupt the users’ activities, with a possible disruptive effect on their emotional and attentional states. As a possible solution to the trade-off between informing and interrupting users, we defined two context-dependent notification management policies which support the selection of the notifications to be delivered on the basis of the user’s current activities, at different granularity levels: general collaboration context versus task carried out. These policies are offered by the COntext depeNdent awaReness informAtion Delivery (CONRAD) framework. We tested such policies with users by applying them in a collaboration environment that includes a set of largely used Web 2.0 services. The experiments show that our policies reduce the levels of workload on users while supporting an up-to-the-moment understanding of the interaction with their shared contexts. The present paper presents the CONRAD framework and the techniques underlying the proposed notification policies.	anna-brita stenström;baseline (configuration management);case preservation;context-sensitive language;e-services;experiment;holistic management (agriculture);internet;interrupt;notification system;open collaboration;peripheral;personal cloud;personally identifiable information;privacy;software propagation;software release life cycle;usability;web 2.0;workspace	Liliana Ardissono;Gianni Bosio	2011	User Modeling and User-Adapted Interaction	10.1007/s11257-011-9100-1	simulation;human–computer interaction;computer science;knowledge management;web 2.0;world wide web	HCI	-63.730300121224246	-54.56417682744709	112004
a0d7d625d662ab878debc90d5fc01a35bf2dfffc	evaluation of a web-based interactive multimedia pediatric asthma education program	health research;uk clinical guidelines;biological patents;europe pubmed central;citation search;uk phd theses thesis;life sciences;uk research reports;medical journals;europe pmc;biomedical research;bioinformatics	A web-based interactive multimedia pediatric asthma computer tutorial (IMPACT) is being tested in a randomized controlled clinical trial. Two hundred and twenty asthmatic children under the age of 18 and their caregivers were randomly assigned to a control group or an intervention group. All children enrolled into the study received printed asthma education materials. In addition, the intervention group used the interactive multimedia asthma education program. Asthma knowledge, quality of life, resource utilization, symptom history and pulmonary function test data were gathered at the baseline visit and on two subsequent visits in the year following the initial visit.	baseline (configuration management);printing;randomized algorithm;randomness;test data;web application	Santosh Krishna;Benjamin Francisco;Suzanne Austin Boren;E. Andrew Balas	2000			alternative medicine;medicine;pediatrics	HCI	-65.78933922991261	-56.57446440903851	112251
2fde7a22f6d565db9e00c2dffad39f1355685efd	indicators of organizational readiness for clinical information technology/systems innovation: a delphi study	historia clinica;informatica biomedical;biomedical data processing;hospital;metodologia;medical record;organization management;genie biomedical;information technology;heuristic method;informatique biomedicale;hombre;metodo heuristico;technologie information;systematique;methodologie;hopital;delphi technique;primary health care;biomedical engineering;cuidados salud primaria;sistematica;dossier medical;organizational change;taxonomy;human;information technology system innovation;soin sante primaire;ingenieria biomedica;methode heuristique;information system;gestion organizacion;methodology;organizational evaluation;recherche scientifique;tecnologia informacion;exploratory study;scientific research;health care organization;systeme information;gestion organisation;investigacion cientifica;homme;sistema informacion	The study presented in this article represents the second phase in a multi-phased research program focused on health care organization readiness for clinical information technology/system (IT/S) innovation. The overall purposes of this exploratory study were to: (1) validate the seven IT/S innovation readiness sub-dimensions of a heuristic organizational information technology/systems innovation model (OITIM) developed in phase one of the research program, and (2) identify indicators to assess the validated sub-dimensions. The study was conducted with an expert panel using a two-round modified Delphi technique. In Round #1, panelists supported retention of the OITIMs' seven theoretical IT/S innovation readiness sub-dimensions with an interrater agreement level range of 82-100%. Their sub-dimension importance ratings ranged from 3.27 to 3.72 (1=not important to 4=critically important) with the resources sub-dimension receiving the highest rating of 3.72. Panelists recommended that two sub-dimensions, 'Staffing and Skills' and 'Operations', be renamed to 'End-Users' and 'Management Structures', respectively, and that one sub-dimension, 'Administrative Support' be added. In Round #2, panelists identified a total of 316 indicators to assess the eight sub-dimensions. A two-step thematic analysis process was done with these indicators to reduce duplication and overlap. In Step 1, the investigator created ten preliminary theme categories per sub-dimension. In Step 2, a coding team categorized 279 (88%) of the 316 indicators into preliminary sub-dimension themes to create an organizational IT/S innovation readiness assessment taxonomy. This preliminary taxonomy was used to develop an organizational information technology/systems innovation readiness scale that is currently being pilot tested in phase three of the research program.		Rita Snyder-Halpern	2001	International journal of medical informatics	10.1016/S1386-5056(01)00179-4	scientific method;medicine;delphi method;nursing;methodology;primary health care;management;operations research;information technology;information system;medical record;exploratory research;taxonomy	ML	-63.79753597097241	-65.09505715212882	113182
c51de2e8cb7e5e64442b9124bc0685ced9c1bd47	an evaluation of clustering algorithms for modeling game-based assessment work processes		Title of Dissertation: AN EVALUATION OF CLUSTERING ALGORITHMS FOR MODELING GAME-BASED ASSESSMENT WORK PROCESSES W. Austin Fossey, Doctor of Philosophy, 2017 Dissertation directed by: Professor Laura Stapleton and Professor Tracy Sweet, Department of Human Development and Quantitative Methodology Game-based assessments (GBAs) use game design elements to make assessments more engaging for students and capture response data about work processes. GBA response data are often too complex to plan for every potential response pattern, so some researchers have turned to exploratory cluster analysis to classify students’ work processes. This paper identifies the design elements specific to GBAs and investigates how well k-means, self-organizing maps (SOM), and robust clustering using links (ROCK) clustering algorithms group response patterns in prototypical GBA response data. Results from a simulation study are discussed, and a tutorial is provided with recommendations of general considerations and best practices for analyzing GBA data with clustering algorithms. AN EVALUATION OF CLUSTERING ALGORITHMS FOR MODELING GAMEBASED ASSESSMENT WORK PROCESSES		William Austin Fossey	2017			cluster analysis;machine learning;computer science;artificial intelligence	HCI	-79.28033810201822	-52.211736404581465	113802
9840069e5891b14337fc6f49d876d4e2b385b8bf	the effects of author identity on dialogue for virtual human communication skills training		Because human-produced language is often still considered the golden standard in the natural language generation field, many virtual humans (VHs) used in communication-skills training simulations continue to be accompanied by human-authored dialogue instead of computer-generated dialogue. The human author used for writing such dialogue, however, has yet to be investigated. Dialogue authors can have a variety of identities - gender, culture, profession, etc. - which may or may not have an effect on the VH dialogue they produce. An identity incongruency between an author and the VH itself could have unexpected effects on VH interviewers' interactions. Therefore, in this paper, we examine the effect of an author's identity on VH dialogue produced in the context of a virtual patient (VP) interview. We evaluated writing samples from speech-language pathology (SLP) students and Chinese and Chinese Americans when creating a Chinese VP suffering from trouble swallowing. We also conducted a user study in which SLP students interviewed VPs created with dialogue from these different author identities. Our results indicate that there are some content differences in the dialogue produced by different author identities and that VH interviewers are able to recognize these differences.	computer-generated holography;interaction;natural language generation;simulation;successive linear programming;superword level parallelism;usability testing;virtual actor	Stephanie Carnell;Benjamin Lok	2018		10.1145/3267851.3267856	communication skills training;social psychology;virtual actor;natural language generation;virtual patient;computer science;linguistics	NLP	-68.75575552212459	-52.4080512041247	114099
38aca0655174877afd5b41fea1a054b13960b54c	developing a protocol for an educational software competition	software;computer assisted instruction;american dental association;guidelines as topic;education dental;evaluation studies as topic	This project developed a protocol for the inaugural Instructional Software Competition of the American Dental Education Association (ADEA). The evaluation instrument was derived from the Guidelines for the Design of Educational Software developed by the ANSI-accredited Standards Committee for Dental Informatics. Eleven judges were calibrated in a conference call and rated a total of 30 submissions using a 66-question instrument. The maximum score was 204 points. The mean score of WWW-based programs was 106.7 points, and of CD-ROM-based programs 109.5 points. The summative review of the judging process identified several potential improvements, such as distinguishing between standalone programs and educational support material; increasing the number of answer choices on rating scales; differential weighting of criteria; and a more discriminative approach to judging formative and summative evaluations. We plan to improve the protocol by supporting the process through a Web-based application; calibrating judges with an online handbook; improving and adapting the rating instrument itself; using at least three judges for each program; and conducting a measurement study.		Titus K Schleyer;Layne Johnson	2001	Proceedings. AMIA Symposium		simulation;computer science;data mining;multimedia	SE	-66.97320887444224	-58.84409443303815	116248
e4ea857a7f0d91edb753bd52b5f320106f67903c	teaching it in health care and nursing program--experiences	rail transportation;motion pictures;information technology;work environment;medical information systems biomedical education health care information technology;books;computer networks;computer science education;nursing program;medical services;medical doctor;airplanes;medical information systems;it teaching;biomedical education;medical services biomedical informatics computer science computer science education computer networks rail transportation airplanes books cultural differences motion pictures;computer science;health services;biomedical informatics;health services health care it teaching nursing program medical doctor;cultural differences;health care	From buying transport tickets (railway, bus, metro, airplane) up to shopping (books, tourist trips, clothes, food,..) and visiting cultural events (theater, cinema, concerts) or medical doctors (medicine prescriptions, illness, regular examination) activities connected to the information technology (IT) are needed and requested from professionals, participating in one or another above mentioned process. We would like to point out that every visit to the medical doctor nowadays requests the cooperation of IT. But are medical doctors and nurses really sufficiently equipped with knowledge about IT - which is in part their working environment? Without doubt, more knowledge about the possibilities, benefits, possible mistakes and their consequences related to IT is needed for being used adequately in the health services. In the paper we will present experiences which aim at moving those possible obstacles and targets in this field. In general, we will shortly present the health care and nursing study program. Additionally, we will focus on different for health care important IT areas. The paper will also discuss the experiences and assessments which are acquired during the last years by students.	book;cinema 4d;experience	Tatjana Welzer;Peter Kokol;Ana Habjanic;Bostjan Brumen;Marjan Druzovec;Aida Kamisalic	2007	Twentieth IEEE International Symposium on Computer-Based Medical Systems (CBMS'07)	10.1109/CBMS.2007.106	family medicine;medicine;computer science;nursing;information technology;cultural diversity;health care	Visualization	-64.45615889832615	-60.34221538090423	116443
fd28a2eded6ee465a6e3279d6ccea9a74b840b14	a framework for understanding user requirements for an information service: defining the needs of informal carers	information biomedicale;service information;medicina;exigence usager;exigencia usuario;conceptual framework;medecine;biomedical information;soignant;necesidad informacion;sante;informacion biomedical;user requirement;besoin information;comportement utilisateur;user requirements;servicio informacion;medicine;user behavior;health;information service;information need;salud;article;comportamiento usuario;carer	The aim of this research was to develop a conceptual framework that would help to collect and understand the information needs of a target community. Many information behaviour frameworks already exist, however; although they share some features, they tend to focus on different aspects of the person and their interaction with information. It was proposed that a synthesis of these frameworks could lead to a comprehensive framework. Previous research was analysed and an initial framework defined. This was piloted and adapted and then applied to data on informal carers. This led to further adaptation. Informal carers are people who care for another person, generally a relative, for more than fourteen hours per week and are not paid for this. The data stemmed from		Mark Hepworth	2004	JASIST	10.1002/asi.20015	computer science;knowledge management;user requirements document;data mining;world wide web	HCI	-64.15257510777411	-59.63650324706944	116969
34c0ada4b3e61487b2d2d6871562396e5335de3a	exploring user acceptance of a text-message based health intervention	privacy technological innovation educational institutions mobile communication text processing complexity theory sociology;health it;user interfaces data privacy electronic messaging health care medical computing medical information systems security of data;medical computing;data privacy;medical information systems;intention to use;electronic messaging;technology adoption;text message intervention technology adoption diffusion of innovation health it intention to use;health promotion user acceptance text message service based health intervention information technology cost reduction public sector increase consumer satisfaction private sector technology based interventions healthy sexual behaviors technology mediated interventions diffusion of innovation theory sexual health information technology adoption factors privacy concerns;user interfaces;security of data;diffusion of innovation;text message intervention;health care	Information technology has been used in diverse ways. It has been utilized to reduce costs in the public sector and increase consumer satisfaction in the private sector. Technology may also be instrumental in improving individuals' healthy behaviors. For instance, statistics suggest that technology-based interventions may promote healthy sexual behaviors, however, few studies have explored willingness to participate in technology mediated interventions. This study uses Diffusion of Innovation Theory to identify factors that influence one's intention to use a text-message service to receive sexual health information. The results indicate that technology adoption factors rather than risk beliefs and privacy concerns impacted participant's intention to use a text-message intervention. The findings of this study have significant implications for innovative uses of technology to promote health.	privacy	Maya Corneille;Lemuria Carter;Naomi M. Hall-Byers;Trenette Clark;Sinead Younge	2014	2014 47th Hawaii International Conference on System Sciences	10.1109/HICSS.2014.346	public relations;information privacy;computer science;knowledge management;marketing;user interface;health care	HCI	-63.022794918663664	-62.5792897318063	117962
7eb532b7ae68357ba48e31b949abc53f3fa588a0	examining security and privacy research in developing regions		Prior research suggests that security and privacy needs of users in developing regions are different than those in developed regions. To better understand the underlying differentiating factors, we conducted a systematic review of Human-Computer Interaction for Development and Security & Privacy publications in 15 proceedings, such as CHI, SOUPS, ICTD, and DEV, from the past ten years. Through an in-depth analysis of 114 publications that discuss security and privacy needs of people in developing regions, we identified five key factors---culture, knowledge gaps, unintended technology use, context, and usability and cost considerations---that shape security and privacy preferences of people in developing regions. We discuss how these factors influence their security and privacy considerations using case studies on phone sharing and surveillance. We then present a set of design recommendations and research directions for addressing security and privacy needs of people in resource-constrained settings.	chi;confidentiality;human–computer interaction;privacy;systematic review;usability	Aditya Vashistha;Richard J. Anderson;Shrirang Mare	2018		10.1145/3209811.3209818	internet privacy;meta-analysis;usability;business	Security	-64.0107060958202	-57.941291123062655	118287
