id	title	keywords	abstract	entities	authors	year	journal	doi	fos	area	x	y	ix
f93b08a68151856e010dab4d5f89b5c176dbf325	literature synthesis on evaluative measures in healthcare simulation		Whereas most educators have a good grasp on the history of simulation in healthcare, the current state and types of modalities related to simulation in healthcare education, and the future direction of healthcare simulation, many educators do not have an in-depth understanding of the metrics available to assess the use of simulation. The purpose of this literature synthesis is to build a repository of the metrics being used to evaluate nursing and healthcare provider simulation. Additionally, the level of fidelity and desired learning domains that the matrices purport to evaluate is examined. A secondary purpose of the literature synthesis is to determine if a suitable metric is available that can be used universally to evaluate nursing and healthcare related simulations. Finally, conceptual frameworks suitable for serving as the bases of instrument development related to nursing and health care simulation are explored. Primary studies, meta-analyses, and systematic reviews that discussed or evaluated metrics used to measure outcomes of simulation were analyzed. Recent articles, published within the last five years, which discussed the evaluation of nursing and or healthcare simulation, were eligible for inclusion. Additionally, descriptive, inferential, qualitative, and quantitative studies were eligible for inclusion. DOI: 10.4018/jgcms.2012070103 International Journal of Gaming and Computer-Mediated Simulations, 4(3), 38-48, July-September 2012 39 Copyright © 2012, IGI Global. Copying or distributing in print or electronic forms without written permission of IGI Global is prohibited. future direction of healthcare simulation. Many educators do not have an in-depth understanding of the metrics available to assess the use of simulation. The purpose of this literature synthesis is to build a repository of the metrics being used to evaluate nursing and healthcare provider simulation. Additionally, the level of fidelity and desired learning domains that the matrices purport to evaluate will be examined. A secondary purpose of the literature synthesis is to determine if there is a suitable metric available that can be used universally to evaluate nursing and healthcare related simulations. Finally, conceptual frameworks suitable for serving as the bases of instrument development related to nursing and or health care simulation will be explored. Simulation is defined by Merriam-Webster dictionary (“Simulation”, 2012) as the imitative representation of the functioning of one system or process by means of the functioning of another. Types of simulation that are commonly used in nursing and healthcare education include case studies, role playing, low fidelity, medium fidelity, and high fidelity simulations. For this literature synthesis the author included articles that discussed low fidelity simulators, medium fidelity simulators, and high fidelity simulators. Low fidelity simulators include simple task trainers that replicate human anatomy, which also provide physiological or behavioral feedback to intervention. A common example of a low fidelity simulator is Seymour Butts, a wound care simulator. Medium fidelity simulators replicate the whole human body and give limited physiological or behavioral feedback. Common examples of a medium fidelity simulator include Vital Anne a vital sign simulator manufactured by Laerdal. Vital Anne has adjustable heart sounds, lungs sounds, vital signs, and limited verbal response to interventions such as gagging or coughing. High fidelity simulators mimic real humans from an anatomical perspective and a physiological and behavioral perspective. Well know high fidelity simulators include METI Man and Sim Man. Both of these Human Patient Simulators (HPS) respond to interventions as human would respond (Grady, 2009). The use of simulation, as a teaching strategy, is rapidly expanding and recognized as a method to improve outcomes in a complex health environment. Simulation allows students and healthcare providers’ opportunities to explore and develop skills, knowledge, understanding, and clinical judgments. Simulated settings provide a safe environment for the practice of situations that occur in unique and rare instances. The Standards for Best Practice in Simulation (INASCL, 2011) note that use of simulation experiences can provide meaningful evaluation of the three domains of learning—cognitive, affective and psychomotor. The cognitive domain is further delineated into content knowledge and clinical reasoning. Since simulation is often used in conjunction with or in substitution of clinical experiences, instruments are needed that are reliable and valid in measuring all three domains. According to Kardong-Edgren, Adamson, and Fitzgerald (2010, p. e28), “evaluative instruments ideally should include some measures for each of the three domains of student performance: cognitive, psychomotor, and affective. An instrument, measuring any one of these alone will not be accurate in evaluating overall performance”.	best practice;cognitive science;computer simulation;dictionary;inferential programming;self-replicating machine;software repository;systematic review	Timothy W. Meyers	2012	IJGCMS	10.4018/jgcms.2012070103	psychology;knowledge management;multimedia;social psychology	AI	-65.6697292230132	-57.96752856158873	53999
1e0a1f2a37cd832dd76285cddb3f1e0c073326f1	a new generation of open source data collection tools	android based system;google;open source data collection tools;data reporting;openrosa consortium;mobile device;data collection;filling;mobile phone;personal digital assistants;public domain software;data analysis;standards development;servers;low income;monitoring;ict data collection mobile phones;data aggregation;mobile communication;mobile handsets;ict;organizations;mobile phones;communities;mobile computing;paper based approaches;africa;data reporting open source data collection tools organizations paper based approaches mobile devices android based system openrosa consortium mobile data collection data aggregation data analysis;mobile devices;buildings;java mobile handsets filling data analysis personal digital assistants monitoring decision making africa standards development clinical trials;java;open source;public domain software data analysis mobile computing organisational aspects;organisational aspects;clinical trials;mobile data collection	Organizations in low income regions need tools for collecting and reporting on data. Existing paper-based approaches are often slow and incomplete when compared to data collection tools on mobile devices. In this demonstration, we present the authors Android-based system in addition to broader work by the OpenRosa Consortium - a community dedicated to building open source, standards-based tools for mobile data collection, aggregation, analysis, and reporting.	android;consortium;mobile device;open-source software;source data	Yaw Anokwa;Carl Hartung;Adam Lerer;Brian DeRenzi;Gaetano Borriello	2009	2009 International Conference on Information and Communication Technologies and Development (ICTD)	10.1109/ICTD.2009.5426732	computer science;engineering;operating system;data mining;mobile device;internet privacy;mobile computing;world wide web	SE	-65.31233352518854	-59.22405381312079	55272
c9cfcb94854e50cec5db3697fdb3710c7f663074	the use of virtual reality simulation to improve technical skill in the undergraduate medical imaging student		ABSTRACTIn recent years, simulation has increasingly underpinned the acquisition of pre-clinical skills by undergraduate medical imaging (diagnostic radiography) students. This project aimed to evaluate the impact of an innovative virtual reality (VR) learning environment on the development of technical proficiency by students. The study assessed the technical skills of first year medical imaging students. The learning experience by each student was either via traditional laboratory-based simulation or VR simulation, for two specified anatomical protocols. Following the learning experience, the students performed role-plays and were assessed on their technical proficiency. The type of learning environment, laboratory-based or VR simulation, was recorded for each radiographic procedure, as well as demographic data. Data demonstrated an improved total role-play skill score for those students trained using VR software simulation compared with the total role-play skills score traditional laboratory simulation...	medical imaging;simulated reality;simulation;virtual reality	Therese Gunn;Lee Jones;Pete Bridge;Pam Rowntree;Lisa Nissen	2018	Interactive Learning Environments	10.1080/10494820.2017.1374981	knowledge level;educational technology;multimedia;simulation;computer science;virtual reality;software;forecast skill;health care;medical imaging;learning environment	Visualization	-68.04089097118613	-54.61376898462987	55425
a56d7549ae21ed425ed04663e13c51ba9a49a73d	an integrated e-recruitment system for automated personality mining and applicant ranking	personality mining;analytic hierarchy process;e recruitment;personality;selection;data mining;social networking sites;recommendation systems;human resource management;recruitment	Purpose – The purpose of this paper is to present a novel approach for recruiting and ranking job applicants in online recruitment systems, with the objective to automate applicant pre‐screening. An integrated, company‐oriented, e‐recruitment system was implemented based on the proposed scheme and its functionality was showcased and evaluated in a real‐world recruitment scenario.Design/methodology/approach – The proposed system implements automated candidate ranking, based on objective criteria that can be extracted from the applicant's LinkedIn profile. What is more, candidate personality traits are automatically extracted from his/her social presence using linguistic analysis. The applicant's rank is derived from individual selection criteria using analytical hierarchy process (AHP), while their relative significance (weight) is controlled by the recruiter.Findings – The proposed e‐recruitment system was deployed in a real‐world recruitment scenario, and its output was validated by expert recruiters. It...		Evanthia Faliagka;Athanasios K. Tsakalidis;Giannis Tzimas	2012	Internet Research	10.1108/10662241211271545	selection;analytic hierarchy process;computer science;knowledge management;human resource management;data mining;personality;social psychology;world wide web	ML	-76.10755908271717	-54.88831598087952	55539
08ee97ce3c42e032d3150365b125dc15327ecc6e	video-guided versus direct laryngoscopy: considerations for using simulation to teach inexperienced medical students	direct laryngoscopy;video guided laryngoscopy;airway management training;endotracheal intubation;autonomous learning	The goal of this study was to determine whether video laryngoscopy (VL) provides any advantage over direct laryngoscopy (DL) in first-attempt intubations. This was a controlled, randomized study of 120 medical students. Students were randomly assigned to either of 2 intubation groups, which used (1) DL (n=64) or (2) VL (n=56) with the Karl Storz C-MAC® video laryngoscope. Each student attempted 1 endotracheal intubation on a Laerdal® Airway Management Trainer. The primary outcome measure was the time for successful endotracheal intubation. Secondary outcome measures included the incidence of esophageal intubation (EI), excess application of pressure on the maxillary incisor teeth (EMP), and first-time success rate. Mean time for endotracheal intubation was significantly faster in the VL group than in the DL group (101 ± 83 seconds vs. 180 ± 102.5 seconds; P˂0.001). In the VL group, 3.6% of the students committed an EI versus 56.3% in the DL group (P˂0.001). No significant difference was found in the incidence of EMP: 51.8% in the VL group versus 57.8% in the DL group (P=0.508). For medical students with little or no endotracheal intubation experience, VL facilitates success and decreases the number of EIs, at least in a simulated environment.	binary prefix;c-mac;experience;incidence matrix;karl wiegers;offset binary;randomized algorithm;randomness;simulation;virtual reality	Hannes Prescher;David E. Biffar;Laura E. Meinke;John E. Jarred;Aubrey J. Brooks;Allan J. Hamilton	2014			intubation;airway management;simulation;computer science;randomized controlled trial;anesthesia;laryngoscopy;esophageal intubation	HCI	-68.2204576344418	-55.19571583967104	55891
8bce2bbd4c0f87bcb65eed6406af55d5f372b616	data envelopment analysis model for the appraisal and relative performance evaluation of nurses at an intensive care unit	health care services;performance evaluation;nursing appraisal;data envelopment analysis health care services nursing appraisal performance evaluation ratio pitfalls of units to measures talent management;data envelopment analysis;ratio pitfalls of units to measures;article;talent management	The appraisal and relative performance evaluation of nurses are very important and beneficial for both nurses and employers in an era of clinical governance, increased accountability and high standards of health care services. They enhance and consolidate the knowledge and practical skills of nurses by identification of training and career development plans as well as improvement in health care quality services, increase in job satisfaction and use of cost-effective resources. In this paper, a data envelopment analysis (DEA) model is proposed for the appraisal and relative performance evaluation of nurses. The model is validated on thirty-two nurses working at an Intensive Care Unit (ICU) at one of the most recognized hospitals in Lebanon. The DEA was able to classify nurses into efficient and inefficient ones. The set of efficient nurses was used to establish an internal best practice benchmark to project career development plans for improving the performance of other inefficient nurses. The DEA result confirmed the ranking of some nurses and highlighted injustice in other cases that were produced by the currently practiced appraisal system. Further, the DEA model is shown to be an effective talent management and motivational tool as it can provide clear managerial plans related to promoting, training and development activities from the perspective of nurses, hence increasing their satisfaction, motivation and acceptance of appraisal results. Due to such features, the model is currently being considered for implementation at ICU. Finally, the ratio of the number DEA units to the number of input/output measures is revisited with new suggested values on its upper and lower limits depending on the type of DEA models and the desired number of efficient units from a managerial perspective.	benchmark (computing);best practice;clinical governance;data envelopment analysis;division of extramural activities;health services;input/output;job syndrome;performance evaluation;promotion (action);quality of health care;intensive care unit;standards characteristics	Ibrahim H. Osman;Lynn N. Berbary;Yusuf Sidani;Baydaa Al-Ayoubi;Ali Emrouznejad	2010	Journal of Medical Systems	10.1007/s10916-010-9570-4	medicine;computer science;nursing;data envelopment analysis;management	SE	-63.04274976313691	-62.78184282844356	58062
fef6683e21eeb32806202a45e36f61c9e66b9472	chatbot as an intermediary between a customer and the customer care ecosystem		In the context of customer care, a digital ecosystem may get activated to address a customeru0027s issue or situation. The digital ecosystem may consist of various computerized systems that provide assisted support, relevant mandatory services, opportunistic pro-active offers, reviews and ratings, and insights from the social web. While addressing a customeru0027s situation the customer and/or the digital ecosystem has to choose the appropriate systems/services with suitable options to be activated in order to deliver effective customer care. This aspect can get quite complicated and some customers tend to get lost in the process and are unable to get their situation addressed to their satisfaction. We propose an intermediary chatbot between a customer and digital ecosystem that can act as a catalyst to diagnose a customeru0027s situation and provision the appropriate services in the ecosystem. The intermediary chatbot engages in a dialog with a customer for identifying his/her situation and extract the set of latent beliefs that the customer holds. It then helps contextualize the systems in the digital ecosystem to offer suitable services, leading to a richer user experience.	digital ecosystem;social media;user experience;dialog	Amit Sangroya;Pratik Saini;C. Anantaram	2017		10.1145/3167020.3167040	chatbot;knowledge management;computer science;usability;digital ecosystem;user experience design;social web;dialog box;ecosystem	HCI	-63.761734422298694	-54.08324016355826	63076
e575c825648335e269a9245ecaee1016f0ee797c	a novel hybrid learning achievement prediction model: a case study in gamification education applications (apps)		Adaptive Neuro Fuzzy Inference System (ANFIS) used to be applied to finance, engineering, material design, and decision-making management in past research, but seldom to predict educational learning performance. In recent research, gamification learning material design is often applied to reinforce learning performance, while the prediction of gamification learning performance is seldom discussed. This study therefore applies Rough set theory to extract Core Set and generating rule, ANFIS for learning achievement predication. In order to evaluate the performance of proposed model, the VCCSEGLS dataset are collected as experimental dataset and compared with other models. The results show that the proposed method outperforms the listing models in accuracy. The three key factors are extract, (G7) Time spent on game-based learning, (L1) Examination, normal drugs and treatment, and (L2) Integration ability (time scoring, stability scoring, strain capacity, completeness scoring).The proposed model also can offer accurate predictions and provide some simple decision rules, which can be accurately used by decision-makers and game designers.	gamification	Chung-Ho Su	2017	International Journal of Information Technology and Decision Making	10.1142/S0219622017500092	simulation;artificial intelligence;machine learning	Robotics	-76.8913469021221	-52.08985408661954	63151
747b322690c8c3408304bdaf05baca02ec4e141f	design and evaluation of a data-driven password meter		Despite their ubiquity, many password meters provide inaccurate strength estimates. Furthermore, they do not explain to users what is wrong with their password or how to improve it. We describe the development and evaluation of a data-driven password meter that provides accurate strength measurement and actionable, detailed feedback to users. This meter combines neural networks and numerous carefully combined heuristics to score passwords and generate data-driven text feedback about the user's password. We describe the meter's iterative development and final design. We detail the security and usability impact of the meter's design dimensions, examined through a 4,509-participant online study. Under the more common password-composition policy we tested, we found that the data-driven meter with detailed feedback led users to create more secure, and no less memorable, passwords than a meter with only a bar as a strength indicator.	artificial neural network;heuristic (computer science);iterative and incremental development;iterative method;password;usability	Blase Ur;Felicia Alfieri;Maung Aung;Lujo Bauer;Nicolas Christin;Jessica Colnago;Lorrie Faith Cranor;Henry Dixon;Pardis Emami Naeini;Hana Habib;Noah Johnson;William Melicher	2017		10.1145/3025453.3026050	cognitive password;password;human–computer interaction;real-time computing;heuristics;usability;artificial neural network;iterative and incremental development;password strength;computer security;computer science;data-driven	HCI	-64.31972175338699	-52.51650500531781	67203
8c8c0d4eedada9508930d21b7f561dbc9d2605d2	a multimedia help system for a medical scenario in a rehabilitation clinic	multimedia;hypervideo;help system;html5 player;server application;authoring tool	In this paper we outline instructional, legal, and software requirements as well as a prototypical software implementation for a multimedia help system in a rehabilitation scenario. The help system will be used by patients in a rehabilitation clinic to support their pelvic floor exercises. After describing the use case we will outline the requirements for the scenario and show how our software was extended to meet the requirements. We present the key features of each component of the SIVA Suite: the authoring tool, the redesigned HTML5 player, and the server application. Thereby, important new features are described and illustrated. Design decisions are presented and explained.	html5;requirement;server (computing);software requirements	Britta Meixner;Katrin Tonndorf;Stefan John;Christian Handschigl;Kai Hofmann;Michael Granitzer	2014		10.1145/2637748.2638429	simulation;computer science;systems engineering;multimedia	SE	-63.00829978158083	-52.08254017329329	67716
d468b7a416a480b8d84f0ee3759cc648678d2320	gathering emotional data from multiple sources		Collecting and processing data in order to detect and recognize emotions has become a research hot topic in educational scenarios. We have followed a multimodal approach to collect and process data from different sources to support emotion detection and recognition. To illustrate the approach, in this demo, participants will be shown what emotional data can be gathered while solving Math problems.	emotion recognition;multimodal interaction	Sergio Salmeron-Majadas;Olga C. Santos;Jesus G Boticario;Raúl Cabestrero;Pilar Quirós;Mar Saneiro	2013			computer science;artificial intelligence;machine learning;multimodal therapy	AI	-65.78590368090656	-52.37904458875025	69558
6268b7e02229ae26d47e24c394428ec4911f0c62	designing smart home environments for unobtrusive monitoring for independent living: the use case of usefil	dsrm;usefil system;design science research methodology;ict;independent living;seniors	The “Unobtrusive Smart Environments for Independent Living” EU funded project is proposing an integrated system (USEFIL system) which intends to cope with ageing problem providing advanced, affordable and unobtrusive monitoring and web communication solutions for seniors living independently. The USEFIL system enhances social care and medical service provision by exploiting “frugal” ICT solutions such as low cost “off-the-shelf” technology and unobtrusive monitoring technologies to develop services that will assist the elderly in maintaining their independence throughout their daily activities. The project adopted the Design Science Research Methodology (DSRM) to design and develop the USEFIL system because this methodology incorporates all those principles, practices, and procedures to help us meet USEFIL systems’ objectives. Aim of the paper is to demonstrate the use of the DSRM process to design an ICT solution for the case study of ICT technologies for assistive living environments for elderly people. More specifically using the theoretical lens of the Design Science Research Methodology theory the paper presents the necessary steps that have been conducted to design the USEFIL system. The USEFIL system was implemented and validated over a three year period with elderly people, their unofficial carers and doctors. Results demonstrate that the technology readily succeeds in meeting the study’s initial objectives. Although the project is still running and the design specification of the USEFIL system is under continuous update, the main modules that have been designed and realized will be presented in the paper. KEywoRDS Design Science Research Methodology, DSRM, ICT, Independent Living, Seniors, USEFIL System		Homer Papadopoulos	2016	IJESMA	10.4018/IJESMA.2016010104	information and communications technology;simulation;telecommunications	HCI	-62.89099838305589	-56.268131362783876	70717
