id	title	keywords	abstract	entities	authors	year	journal	doi	fos	area	x	y	ix
350edc79288ab74c88e18db6923fadcee3aee262	evaluation of a computer-based bilingual breastfeeding educational program on breastfeeding knowledge, self-efficacy and intent to breastfeed among rural hispanic women	hispanic women;bapt;knowledge;self efficacy;breastfeeding	OBJECTIVE To evaluate the impact of an interactive, computer based, bi-lingual breastfeeding educational program on breastfeeding knowledge, self-efficacy and intent to breastfeed among rural Hispanic women living in Scottsbluff, Nebraska.   METHODS A two-group, repeated measures quasi-experimental study was conducted to evaluate the impact of a breastfeeding intervention. Forty six rural Hispanic women between ages 18 and 38 years were enrolled at the Regional West Medical Center in Scottsbluff, Nebraska. Study participants were randomized into intervention and control groups, with the intervention group (n=23) receiving bi-lingual (English and Spanish) breastfeeding education on a touch screen computer program, while the control group received printed educational material. Study participants were enrolled during their last six weeks of pregnancy, with follow up assessments conducted post-partum at days 3 and 7, weeks 2 and 6, and months 3 and 6. The study protocol was approved by the University of Nebraska Medical Center Institutional Review Board (IRB protocol #430-12-EP) and City University of New York Institutional Review Board (IRB protocol # 642980-1).   RESULTS A significant improvement in the breastfeeding knowledge and intent to breastfeed scores was seen over a 6 month period among all the study participants (p<0.05). There was a gradual increase in the breastfeeding self-efficacy scores till week 6 followed by a decrease in self-efficacy scores at month 3 (p=0.46), and month 6 (P=0.54). Breastfeeding knowledge scores differed significantly between the study participants in the control and intervention groups at week 6 (p=0.03). There were no significant differences in the breastfeeding knowledge between the control and intervention groups at other time points. The control group showed gradual decline in their self-efficacy scores at month 3 and month 6 compared to the intervention group that showed a gradual increase in their self-efficacy scores at different time points during their follow up period. However, there were no significant differences in the self-efficacy scores between the intervention and control groups at different points. The control group showed significantly higher negative breastfeeding sentiment scores compared to the intervention group at days 3 (p=0.02) and 7 (p=0.03) indicating a lower intent to breastfeed.   CONCLUSION Hispanic women living in rural settings showed improvement in breastfeeding knowledge, self-efficacy and intent to breastfeed using the computer based bi-lingual educational program. Results show week 6 and month 3 to be the critical time points of intervention so that women continue to breastfeed.		Ashish Joshi;Chioma Amadi;Jane Meza;Trina Aguire;Sue Wilhelm	2016	International journal of medical informatics	10.1016/j.ijmedinf.2016.04.001	gerontology;medicine;nursing;pediatrics;knowledge	HCI	-66.68239256350657	-58.51752770899831	141150
386045a5ca68e5ce2405113b56ac470fec632659	towards keystroke continuous authentication using time series analytics	liverpool;repository;university	An approach to Keystroke Continuous Authentication (KCA) is described founded on a time series analysis based approach that, unlike previous work on KCA (using feature vector representations) takes the sequencing of keystrokes into consideration. The significance of KCA is in the context of online assessments and examinations used in eLearning environments and MOOCs, which are becoming increasingly popular. The process is fully described and analysed, including comparison with established feature vector approaches. Our proposed method outperforms these other approaches to KCA (with a detection accuracy of 94%, compared to 79.53%), a clear indicator that the proposed time series analysis based KCA has significant potential.	authentication;basic stamp;bespoke;event (computing);experiment;feature vector;massive open online course;time series;web application	Abdullah Alshehri;Frans Coenen;Danushka Bollegala	2016		10.1007/978-3-319-47175-4_24	computer science;data science;internet privacy;world wide web	SE	-78.67634506103431	-54.849424496610794	142993
b330c833673593e9c1038a3e2484236cdb341e94	online recommender system for personalized nutrition advice		The general recommendations for addressing non-communicable diseases, which are responsible for two thirds of deaths globally, are mainly related to lifestyle changes, such as diet and physical activity. Challenges with encouraging healthy diets include gathering accurate information about dietary intake and delivering interventions that can influence behavior. Internet technologies offer excellent potential for addressing these challenges. Furthermore, personalized recommendations are more effective than general population-based recommendations at modifying health-related behavior in nutrition interventions.  The overall aim of this project is to design, develop and evaluate a recommender system able to assess dietary intake, using a validated Food Frequency Questionnaire (FFQ), and propose valid personalized nutrition advice for adults. It is investigating an effective way of providing personalized online dietary recommendations to increase diet quality at population-level and of considering an individual user's preferences, population data and experts' knowledge in the recommendation. The system is envisaged to be a web-based service, built with commercially available technologies, scalable, replicable, inexpensive and independent of any bespoke device (e.g. proprietary activity trackers).  Different levels of personalized advice will be evaluated via an online Randomised Control Trial (RCT) and surveys with nutrition professionals will be used for rating the advice proposed by the recommender system.	activity tracker;bespoke;internet;personalization;recommender system;scalability;web application	Rodrigo Zenun Franco	2017		10.1145/3109859.3109862	bespoke;recommender system;personalization;computer science;the internet;behavior change;psychological intervention;activity tracker;population;knowledge management	HCI	-63.06751608562304	-56.927672606409004	144197
017e815ed939e02499c57777c7d969c9ff7fc543	modeling patients' acceptance of e-health		Due to the emerging importance of e-health and the possibility that it can reduce health care costs, we try to explain patients’ behavioral intention to use their provider’s e-health system. Using the survey method to collect data from patients newly registered with an e-health site, we test three models of user acceptance: two well-known models (TAM and the Motivational model) and one that has recently been proposed that integrates the other two. We also include several antecedents to the models including satisfaction with medical care, health knowledge, information-seeking preference, health care need, and Internet dependence. We find that all three models produce similar results from our data and that several of the antecedents have significant effects on the model constructs. For example, satisfaction with medical care positively influences intrinsic motivation, information-seeking preference positively influences perceived ease of use, and Internet dependence positively influences both intrinsic motivation and perceived usefulness.	acceptance testing;americas conference on information systems;email;function overloading;hk2;ibm system i;ibm tivoli access manager;id3 algorithm;internet;randomized algorithm;theory;usability	E. Vance Wilson;Nancy Gustafson	2003			health care;knowledge management;survey methodology;computer science;the internet;usability	HCI	-63.01725127402348	-63.00279426836106	145584
5a2083ca656175437d0bee41377689c6693dd210	evaluation of biometric systems: a study of users' acceptance and satisfaction	biometrics;users acceptance and satsifaction;evaluation;decision trees;kruskal wallis test;bayesian networks	This paper presents a modality-independent evaluation methodology to study users’ acceptance and satisfaction of biometric systems. It uses a survey questionnaire for data collection, and some data-mining tools for their analysis. We have applied it on two biometric systems developed in our research laboratory. The results from this survey show the necessity of taking users’ point of view when designing and evaluating biometric systems. A panel of 100 volunteers was more satisfied from the keystroke system than the face one. Users surprisingly considered that its perceived performance was also better, even if the used face system has a better performance with an EER of 8.76% than the keystroke one with an EER of 17.51%. The robustness of a system against attacks, computation time required during the verification phase and its easiness to use have been identified as important factors influencing their opinions regarding the tested systems.	authentication;authorization;bayesian network;biometrics;computation;dvd region code;data mining;decision tree;enhanced entity–relationship model;event (computing);fingerprint;keystroke dynamics;kruskal's algorithm;modality (human–computer interaction);perceived performance;physical access;population;rejection sampling;threat (computer);time complexity;usability testing;user error;web application	Mohamad El-Abed;Romain Giot;Baptiste Hemery;Christophe Rosenberger	2012	IJBM	10.1504/IJBM.2012.047644	simulation;computer science;evaluation;archaeology;machine learning;decision tree;bayesian network;data mining;computer security;kruskal–wallis one-way analysis of variance;biometrics	HCI	-65.6485531535715	-55.08060705697436	145644
c3ebd686264b2958611e279b2ec987606c95033e	phishy - a serious game to train enterprise users on phishing awareness		Game based cyber-security training for enterprise users is a topic which is relatively less researched upon. We intended to conduct an experiment on this topic with Phishy, a game based phishing awareness training, and thus find answers to the following questions: a) Do enterprise, tech-savvy users benefit from having a game based training so that this methodology could be widely used for training important topics on a large scale? b) Will such a game be engaging to the associates and will they come back to play it more than once? c) Will the game be capable of helping them? Phishy game was successfully completed by 8071 associates within a month. From their game data, it was found that the associates who completed the game showed a significant improvement in identifying phishing links. This paper explains the design, development and analysis of Phishy, an online serious game that we developed for providing phishing awareness training to enterprise users.	computer security;emoticon;phishing;technical support	Herbert Pina Freire;Ljiljana Palangetic;George Fili s;Harshal Tupsamudre;Vijayanand Banahatti;Sachin Lodha	2018		10.1145/3270316.3273042	computer security;multimedia;phishing;computer science	HCI	-76.41761443954334	-52.90348298257743	147855
06ca7f0f13a7a89efbe1800822747c01ff010881	compliance disengagement in research: development and validation of a new measure	ethical decision-making;how i think questionnaire;moral disengagement;research compliance	In the world of research, compliance with research regulations is not the same as ethics, but it is closely related. One could say that compliance is how most societies with advanced research programs operationalize many ethical obligations. This paper reports on the development of the How I Think about Research (HIT-Res) questionnaire, which is an adaptation of the How I Think (HIT) questionnaire that examines the use of cognitive distortions to justify antisocial behaviors. Such an adaptation was justified based on a review of the literature on mechanisms of moral disengagement and self-serving biases, which are used by individuals with normal personalities in a variety of contexts, including research. The HIT-Res adapts all items to refer to matters of research compliance and integrity rather than antisocial behaviors. The HIT-Res was administered as part of a battery of tests to 300 researchers and trainees funded by the US National Institutes of Health. The HIT-Res demonstrated excellent reliability (Cronbach's alpha = .92). Construct validity was established by the correlation of the HIT-Res with measures of moral disengagement (r = .75), cynicism (r = .51), and professional decision-making in research (r = -.36). The HIT-Res will enrich the set of assessment tools available to instructors in the responsible conduct of research and to researchers who seek to understand the factors that influence research integrity.	acclimatization;antisocial behavior;decision making;distortion;personality;regulation;societies;thrombocytopenia	James M. DuBois;John T. Chibnall;John Gibbs	2016		10.1007/s11948-015-9681-x	psychology;medicine;management;social psychology;clinical psychology	HCI	-65.66435738580941	-58.0220320692257	148875
dd078a106589f331346d9b14b264ffe6b8494183	the influence of influence diagrams in medicine	clinical decision making;decision analysis;medicine;influence diagrams;influence diagram	Although influence diagrams have used medical examples almost from their inception, that graphical representation of decision problems has disseminated surprisingly slowly in the medical literature and among clinicians performing decision analyses. Clinicians appear to prefer decision trees as their primary modeling metaphor. This perspective examines the use of influence diagrams in medicine and offers explanations and suggestions for accelerating their dissemination.	decision problem;influence diagram;norm (social);semantics (computer science)	Stephen G. Pauker;John B. Wong	2005	Decision Analysis	10.1287/deca.1060.0060	influence diagram;economics;decision analysis;artificial intelligence;management science;mathematical economics;operations research	SE	-65.02929175089201	-62.7600482936372	149524
0badfeeef7882b15df770ab367b88db162481918	persuasive systems design features in promoting medication management for consumers		Medication safety continues to be a growing concern in the healthcare industry. Providing medication information to consumers and supporting selfmanagement would help to reduce medication errors and to increase medication adherence. This paper reviews the persuasive systems design features used in current medication management applications for consumers. A database search was conducted to identify relevant articles, which were then reviewed using the Persuasive Systems Design model as a framework for analysis. The results highlighted the applicability of these features for the medication management information systems available to consumers. Primary task support and Dialogue support categories were highly cited in the articles. System credibility support category was moderately cited and the Social support category was cited least in the reviewed articles. Tailoring, monitoring and reminder features have been considered more than the other features in previous studies.		Khin Than Win;Judy Mullan;Sarah Howard;Harri Oinas-Kukkonen	2017			public relations;computer science;knowledge management;marketing;persuasive technology	SE	-63.14987095110535	-61.09076489079077	150316
f57ae652f452ab38a7fa907f7d70a236ea05744c	children's reasoning about data sets		When reasoning about several numbers, past work has shown that adults mentally summarize data sets and reason based on set characteristics such as the mean and variance (Morris & Masnick, 2015). In the current study, we asked 10and 12-year-old children to look at two columns of numbers (framed as the distances two golfers drove a golf ball, when doing so repeatedly), and to choose which golfer hit the ball farther. We examined reaction time, accuracy, and eye movements, in addition to self-reported strategy use. We found children reasoned using some of the same summary characteristics as adults, though less consistently, and had more varied strategy uses. For example, some children focused only on one number in each set, a pattern not seen in adults. These findings suggest that instruction building on these intuitions may help develop children’s numerical cognition skills.	cognition;column (database);numerical analysis	Amy M. Masnick;Bradley J. Morris;Christopher Was	2017			cognitive psychology;psychology;data set	HCI	-71.96122713493764	-53.73370409817922	150361
761e11e640187a49c0d9a4b26ce624cbf2e73c7f	data stakeholders interacting with patient data	healthcare centre;patient;interact;data;stakeholders;other;patient records;patient record systems	How data stakeholders interact with data is considered in this paper by incorporating a sociotechnical perspective. A data interaction enactment model is proposed to better understand how a logical structure is enacted when data stakeholders interact with data. The proposed model expands a technologies-in-practice view to also provide for the embodied structures of data objects. This extended technology-in-practice view provides designers with an approach that focuses on the interaction between data stakeholders and data objects. Although the proposed model is a generic model it is applied in the healthcare context for this study. An interpretive approach was used for a private healthcare centre as the case to investigate how healthcare professionals interact with patient records. The findings indicate the design of patient records based on the perceived anticipated use may not sufficiently provide for their actual use where different stakeholders need to interact with the patient records. An understanding of the relationships between designers, data stakeholders, the patient record structure enacted during interaction and its physical components is important. This may be one of the reasons why patient records are still mostly paper-based in spite of efforts to develop and adopt electronic patient record systems.	constraint (mathematics);interaction;interpreter (computing);jones calculus;sociotechnical system;the circle (file system)	Retha de la Harpe	2009			stakeholder;computer science;management;data	HCI	-63.21177736832972	-60.80972714511193	152913
9a321764cba3edeae6bb66f4aaacd60d81f1f8ad	usability and users' health issues in systems development - attitudes and perspectives	human computer interaction;manniska datorinteraktion interaktionsdesign;computer and information science;natural sciences;engineering and technology;teknik och teknologier	i Inger Boivie / Usability and Users’ Health Issues in Systems Development Abstract The figures of reported health problems in computer-supported, administrative, work are alarmingly high and increasing. The main health problems are visual discomfort, repetitive strain injuries (RSI) and stress-related disorders. Some important risk factors are poor workstation design, constrained work postures, repetitive work and long hours of computer use every day. Others are high demands, poor control over workload and work pace and poor relations to management and colleagues. There is also evidence that poor design and usability of the computer systems as well as technical problems with the computer add to the pressure perceived by the user, which may in its turn cause stress-related disorders. Systems (software) development is often technology-driven and the design and contents of the resulting system shapes the work situation, including factors affecting the users’ health and well-being. There are numerous examples in the literature describing how poorly designed systems fail to support the real work practices, introducing new ones that are inadequate and more time-consuming. Thus these, supposedly supporting, computer systems get in the way of efficient and effective work, adding a burden on the workers rather than helping them out. This thesis tries to describe some of the relations between the systems development process and users’ health complaints, in a work context. I also discuss whether or not the concepts of usability and user experience can be used to address users’ health issues in the systems development process. The main results indicate that although usability must be addressed, it is not sufficient. Occupational health issues must be explicitly integrated in systems development, and be given priority. This thesis also describes some potential methods and techniques for doing that.	computer;repetitive strain;software development process;usability;user experience;workstation;x86	Åsa Cajander;Inger Boivie;Jan Gulliksen	2008		10.1007/978-1-84628-941-5_11	pluralistic walkthrough;systems engineering;engineering;knowledge management;management science	HCI	-63.19159618097265	-58.08242660684597	153726
b861be1b1af5194211c17ff41e6d1dd0d92627c2	determinants of health behavior choices in patients using computer-mediated decision aid	decision aid;health behaviors;consumer informatics	Using discriminant analysis an optimal set of predictors was identified which determined healthy behavior choices of users of a computer-mediated decision aid. The resulting set included smoking status, smoking cessation success estimate, self-efficacy, BMI and diet status. Prediction of smoking cessation choice was the most accurate (73%) followed by weight management choice (67%). Physical activity and diet choices were much better identified in a combined cluster (76%-87%) indicating that the decision about these two behaviors was affected by the same variables and the variables that could separate them may have been missing from the dataset. Presence of variables related to individual risks and levels of success in accepting certain health behaviors in the final set of predictors confirmed significance of the computer-mediated decision aid which presented these very variables for the user consideration.		Rita Kukafka;In Cheol Jeong;Joseph Finkelstein	2015	Studies in health technology and informatics	10.3233/978-1-61499-488-6-226	actuarial science;medicine;marketing;management science	HCI	-63.21944290950154	-62.702751547362006	156478
cffda7081a54c01d2e613120729d68fb7aecd0df	a grounded theory model of on-duty critical care nurses' information behavior: the patient-chart cycle of informative interactions	etude utilisateur;utilisation information;personal sanitario;dato observacion;uso informacion;infirmier;information use;user study;estudio usuario;hospital environment;enquete;enfermero;observational study;participant observation;nurse;medical information systems;system design;milieu hospitalier;medical information system;comportement utilisateur;medical management;medio hospitalario;nursing care;personnel sanitaire;grounded theory;clinical information system;nurses;encuesta;donnee observation;user behavior;information service;information system;information seeking;survey;health staff;critical care;observation data;systeme information;visual media;comportamiento usuario;design methodology;sistema informacion	Purpose – Critical care nurses' work is rich in informative interactions. Although there have been post‐hoc self report studies of nurses' information seeking, there have been no observational studies of the patterns of their on‐duty information behavior. This paper seeks to address this issue.Design/methodology/approach – This study used participant observation and in context interviews to describe 50 hours of the observable information behavior of a representative sample of critical care nurses in a 20‐bed critical care unit of a community (non‐teaching) hospital. The researcher used open, in vivo and axial coding to develop a grounded theory model of their consistent pattern of multimedia interactions.Findings – The resulting Nurse's Patient‐Chart Cycle describes their activities during the shift as centering on a regular alternation between interactions with the patient and with the patient's chart (in various record systems), clearly bounded with nursing “report” interactions at the beginning and the...	information behavior;interaction	Michelynn McKnight	2007	Journal of Documentation	10.1108/00220410710723885	simulation;design methods;participant observation;sociology;grounded theory;social psychology;observational study;information system;systems design	ECom	-64.22504195300273	-59.63818681878758	158999
1be90ca458ac28abac09d8050b3dd938dc8cb521	analysis of cognitive load for language processing based on brain activities		The present study attempted to investigate the role of memory or cognitive load in language processing using an EEG. Twelve healthy righthanded male adults were asked to read a story twice and their brain activities were recorded using an EEG: (i) focusing on meaning of the content only (M) and (ii) focusing on both meaning and form or grammar (M+F). The results demonstrated significant differences in upper alpha and upper beta bands according to reading instructions, which indicates different degrees of cognitive load. The findings make a significant contribution to language acquisition in that they offer valuable information regarding memory and cognitive load in language processing. Thus, they help language researchers and educators in the field of second language acquisition (SLA) develop more effective ways of instructional design and in turn lead their students to better learning outcomes.		Hyangsook Park;Jun-Su Kang;Sungmook Choi;Minho Lee	2013		10.1007/978-3-642-42054-2_70	natural language processing	NLP	-71.50424893561808	-52.63910752770433	160770
