id	title	keywords	abstract	entities	authors	year	journal	doi	fos	area	x	y	ix
b6f7d1514badefe6766188a7c6590ca81364aced	wireless capacity maximization: a constrained genetic approach	constrained optimization;genetic algorithms approximation algorithms interference biological cells approximation methods algorithm design and analysis transmitters;radiofrequency interference channel capacity genetic algorithms radio links;genetic algorithms;wireless network capacity;constrained optimization link scheduling wireless network capacity genetic algorithms;link scheduling;genetic algorithms wireless capacity maximization wireless links network capacity signal to noise plus interference model sinr np hard genetic algorithm meta heuristics	Given a number of wireless links, this paper addresses the problem of maximizing the network capacity, i.e., the number of links that can be activated simultaneously. Solving this problem under the physical signal-to-noise-plus-interference (SINR) model has been demonstrated to be NP-hard. Previous studies focused, almost exclusively, on approximation algorithms with guaranteed performance ratios. Although such algorithms have tremendous theoretical value, their surprisingly low approximation ratios limit their practicality. This paper solves the problem using another alternative: the genetic algorithm meta-heuristics. The main challenge in using genetic algorithms is to successfully handle optimization constraints, because the original algorithm was designed for unconstrained problems. To this end, we devise a novel constraint handling mechanism that theoretically guarantees finding feasible and optimal solutions. Our numerical results illustrate the efficiency of the proposed approach, and its superiority over existing methods.	approximation algorithm;entropy maximization;genetic algorithm;heuristic (computer science);interference (communication);mathematical optimization;np-hardness;numerical analysis;signal-to-interference-plus-noise ratio;signal-to-noise ratio	Mohamed Saad	2015	2015 IEEE International Conference on Communications (ICC)	10.1109/ICC.2015.7248925	quality control and genetic algorithms;mathematical optimization;constrained optimization;meta-optimization;genetic algorithm;computer science;theoretical computer science;machine learning;approximation algorithm	Robotics	36.81878620955299	91.2324310169553	184933
fd522f0d2b55c268cf6c76bed4ba7ab642a1a109	a chunk-based scheduling algorithm considering user satisfaction for sc-fdma transmission	chunk-based;user satisfaction;sc-fdma;scheduling	Allocating radio resource efficiently on single-carrier frequency division multiple access scheme is a crucial problem. The problem is difficult as it has been proved to be nondeterministic polynomial-time (NP) hard. While many previous studies provided various solutions to improve resource allocating efficiency of this NP-hard problem, they did not take user satisfaction into account. This study works for proposing a chunk-based frequency domain packet scheduling algorithm to improve resource allocating efficiency and user satisfaction at the same time. The proposed algorithm is based on the well-known mean enhanced greedy (MEG) algorithm. Simulation results show that the proposed algorithm achieves higher user satisfaction as well as the best fairness between subscriber compared with the MEG and other related algorithms. Remarkably, the achieved improvement can be consistent regardless the similarity or difference of the desired uplink transmission rates between subscribers.	algorithm;chunking (computing);scheduling (computing)	Yu-Shun Liu;Jung-Shyr Wu	2017	Wireless Personal Communications	10.1007/s11277-016-3611-3	real-time computing;computer science;theoretical computer science;distributed computing;computer network	Mobile	27.773316164149854	92.97021573114738	185147
828c65faf9536961f06991c4589cd13e96efcae2	efficient parallel artificial bee colony algorithm for cooperative spectrum sensing optimization	artificial bee colony;cognitive radio;spectrum sensing;multiple antennas	In this paper, the multiuser linear cooperative spectrum sensing optimization problem in cognitive radio system where the primary user (PU) and cognitive radio (CR) employ multiple antennas is investigated. By optimizing the different weights assigned on the statistic of each CR given a targeted probability of false alarm, the cooperative spectrum sensing optimization focuses on maximizing the probability of detection. Statistical characteristics of parameters in cooperative spectrum sensing for the PU with a single antenna and the CR with multiple antennas (SPMC) system, the PU with multiple antennas and the CR with a single antenna (MPSC) system, both the PU and the CR with multiple antennas (MPMC) system as well as the PU with Alamouti coding system have been investigated. Due to the non-convex characteristic of the cooperative spectrum sensing problem, an efficient parallel artificial bee colony (PABC) method motivated by the intelligent foraging behavior of a honeybee colony is introduced to address the problem without approximations and convexity constraints. Furthermore, classical benchmark functions are presented to validate the searching ability of the proposed algorithm. Simulation results showed that the PABC shows a superior ability when applied in both the typical test functions and the cooperative spectrum sensing scenario. Also, the reliability of spectrum sensing can be significantly promoted with the use of multiple antennas and Alamouti coding.	artificial bee colony algorithm;program optimization	Yongqiang Hei;Wentao Li;Weihong Fu;Xiaohui Li	2015	CSSP	10.1007/s00034-015-0028-2	cognitive radio;telecommunications;computer science;engineering;artificial intelligence	HPC	36.261479992382085	90.70243662777877	185342
41ea7a2e3706dbab5b2b295a56970aa57a77d361	energy-efficient resource allocation for amplify-and-forward relaying in ofdm systems		In this paper, we study end-to-end energy efficiency of an orthogonal frequency-division multiplexing relay-based system under power constraints for the base station and relay node with system circuit power considerations. Using a two-phase amplify-and-forward relaying protocol, we assume that relay has a fixed power constraint and the source power can vary in transmission power interval where the source employs a selective relaying mechanism for each individual subcarrier. Therefore, in our model, the source is able to adaptively select some subcarriers to be relayed. The radio resource allocation is then formulated as an energy-efficient mixed binary integer programming, and then we propose a heuristic algorithm to find the suboptimal solution. The solution consists of the suboptimal transmit power of the source, the suboptimal set of subcarriers for relaying and the optimal transmit power of each subcarrier at the source and relay in the first and second time slots. The algorithm obtains energy-efficient transmission power for a given relay transmission power based on a gradient descent method. Then a two-step iterative scheme is proposed to obtain the subcarriers to be relayed as well as the optimal power allocation at the source and relay in the first and second time slots. To evaluate the efficiency of the proposed method, we compare its efficiency through simulations with the cases without using selective subcarrier relaying and without circuit power consideration in low and high relay transmit power regimes. The simulation results indicate that using our proposed method results in a significant improvement in the energy efficiency. Copyright © 2014 John Wiley & Sons, Ltd. *Correspondence Jafar Kazemi, Electrical and Computer Engineering Department, Isfahan University of Technology, Isfahan, Iran. E-mail: j.kazemi@ec.iut.ac.ir. Received 11 April 2014; Revised 18 June 2014; Accepted 13 July 2014	algorithm;computer engineering;end-to-end principle;gradient descent;heuristic (computer science);integer programming;iterative method;john d. wiley;linear programming;multiplexing;relay;simulation;subcarrier;two-phase commit protocol	Jafar Kazemi;Mohammad Javad Omidi;Keivan Navaie	2017	Trans. Emerging Telecommunications Technologies	10.1002/ett.2862	electronic engineering;real-time computing;telecommunications;engineering	EDA	34.06594197484372	91.91536795685485	185382
5c284bcc3127cdb2539cd877ddf94c29804bc941	wide-band collaborative spectrum search strategy for cognitive radio networks	shadow mapping;radio networks;sensors markov processes collaboration transmitters time frequency analysis shadow mapping fading;fading;closed form solution;band pass filters;sensors;collaboration;search strategy;spectrum;cognitive radio;cognitive radio network;telecommunication channels band pass filters cognitive radio markov processes radio networks;finite horizon markov decision process;transmitters;markov process;collaborative spectrum sensing;finite horizon;spectrum sensing;optimal spectrum sensing policy cognitive radio networks wideband collaborative spectrum search tunable bandpass filter l sensing slots fusion rule regulatory constraint coarse sensing task idle channels finite horizon markov decision process closed form solutions;value function;fusion rule;bandpass filter;markov processes;markov decision process;telecommunication channels;time frequency analysis;finite horizon markov decision process cognitive radio collaborative spectrum sensing	We consider a scenario where n collaborating cognitive radios (CRs) try to jointly detect spectrum opportunities in a wide-band spectrum within a predefined spectrum sensing interval TS. We assume that each CR is equipped with a tunable bandpass filter (BPF) and is able to sense one frequency band (channel) at a time. The sensing interval consists of L sensing slots of length T . During each sensing slot, each of the collaborating CRs is assigned to sense one of the channels and report its observation to the other CRs. The occupancy of each channels is decided after L sensing slots based on a fusion rule that is fitted to a regulatory constraint or a coarse sensing task. We aim to maximize the expected number of identified idle channels by optimally choosing the index of the channel to be sensed by each collaborating CR at each sensing slot. We model this problem in its most general form as a finite horizon Markov decision process. We derive closed-form solutions for an optimal spectrum sensing policy and the associated value functions for the case of two collaborating CRs where individual sensing decisions are fused together according to the OR-rule. We show that the gain due to the optimal sensing policy is more significant when the spectrum utilization is high.	cognitive radio;frequency band;initial condition;map;markov chain;markov decision process;mathematical induction;numerical analysis;recurrence relation;state transition table	Siavash Fazeli-Dehkordy;Konstantinos N. Plataniotis;Subbarayan Pasupathy	2011	IEEE Transactions on Signal Processing	10.1109/TSP.2011.2152395	cognitive radio;simulation;telecommunications;computer science;mathematics;band-pass filter;markov process;statistics	Mobile	27.562226296968532	97.21273861521958	185753
0fa2fd8b37f03688f73acaf60db2e382235d443b	an interference-aware virtual clustering paradigm for resource management in cognitive femtocell networks	different band;co-located femtocells;generalised virtual cluster femtocell;interference-aware virtual clustering paradigm;cognitive femtocell network;gvcf model;corresponding virtual cluster controller;cluster number perspective;conventional cellular system coverage;gvcf algorithm;logical cluster;resource management;different cluster	Femtocells represent a promising alternative solution for high quality wireless access in indoor scenarios where conventional cellular system coverage can be poor. They are randomly deployed by the end user, so only post deployment network planning is possible. Furthermore, this uncoordinated deployment creates severe interference to co-located femtocells, especially in dense deployments. This paper presents a new architecture using a generalised virtual cluster femtocell (GVCF) paradigm, which groups together FAP into logical clusters. It guarantees severely interfering and overlapping femtocells are assigned to different clusters. Since each cluster operates on different band of frequencies, the corresponding virtual cluster controller only has to manage its own FAPs, so the overall system complexity is low. The performance of the GVCF algorithm is analysed from both a resource availability and cluster number perspective. Simulation results conclusively corroborate the superior performance of the GVCF model in interference mitigation, particularly in high density FAP scenarios.	algorithm;cluster analysis;computer cluster;design rationale;display resolution;face animation parameter;interference (communication);lookup table;multitier architecture;programming paradigm;randomness;signal-to-interference-plus-noise ratio;simulation;software deployment;telecommunications link;throughput;wireless access point	Faisal Tariq;Laurence Dooley;Adrian S. Poulton	2014	Computers & Electrical Engineering	10.1016/j.compeleceng.2013.04.006	simulation;telecommunications;engineering;computer network	HPC	27.162260942339607	90.09012123462033	185811
a493f66b30f4b46f15ed4b46be96a21585755a4c	secure beamforming in downlink miso nonorthogonal multiple access systems	noma optimization array signal processing base stations downlink signal to noise ratio miso;secrecy rate alternating optimization constrained concave convex procedure cccp multiple input single output miso non orthogonal multiple access noma	In this paper, we consider a cellular downlink multiple-input-single-output (MISO) nonorthogonal multiple access (NOMA) secure transmission system, where users are grouped as multiple clusters. Each cluster consists of a central user and a cell-edge user. The central user is an entrusted user, and the cell-edge user is a potential eavesdropper. We focus on the secure beamforming and power allocation design optimization problem which maximizes the sum achievable secrecy rate of central users subject to the transmit power constraint at the base station and transmission rate requirements at cell-edge users. The problem is nonconvex because of coupling optimization variables in the considered fractional quadratically constrained quadratic programming. We propose an alternating optimization-based solution and a constrained concave–convex procedure-based solution to the considered problem. Simulation results demonstrate that our proposed NOMA schemes outperform the conventional orthogonal multiple access scheme.	beamforming;concave function;convex optimization;mathematical optimization;oma;optimization problem;quadratic programming;quadratically constrained quadratic program;requirement;secure transmission;simulation;system analysis;telecommunications link	Yiqing Li;Miao Jiang;Qi Zhang;Quanzhong Li;Jiayin Qin	2017	IEEE Transactions on Vehicular Technology	10.1109/TVT.2017.2658563	transmitter power output;secure transmission;electronic engineering;telecommunications link;quadratic programming;computer science;beamforming;mathematical optimization;optimization problem;base station;signal-to-noise ratio	Mobile	36.65960136708884	90.10033787623802	185897
caf2a077de4ea777261cb93709aeaaaa954719c7	a spectrum access game in bidirectional cognitive relay networks	optimal solution;potential game;game theory;nash equilibrium;payoff function;system modeling;social optimal solution;spectrum;joints;learning automata;relays games learning automata power control network coding algorithm design and analysis joints;bidirectional communication;noncooperative games;spectrum access game;network coding;relay network;cognitive radio;physical layer network coding;amplify and forward;games;radio spectrum management cognitive radio game theory learning automata network coding;transmission rate;radio spectrum management;primary user;discrete power control;power consumption;relays;bidirectional cognitive relay network;noncooperative game;amplify and forward relaying strategy;distributed algorithm;secondary user;algorithm design and analysis;learning automata spectrum access game bidirectional cognitive relay network bidirectional communication amplify and forward relaying strategy physical layer network coding joint relay selection discrete power control noncooperative game payoff function transmission rate power consumption nash equilibrium social optimal solution distributed algorithm;joint relay selection;pure strategy nash equilibrium;power control	We consider a cognitive relay network where two secondary users can access the unutilized spectrum and conduct bidirectional communication via the help of primary users. The primary users are regarded as relay nodes of the secondary users and adopt amplify-and-forward relaying strategy. Physical-layer network coding is used when both secondary users select the same relay. The spectrum access problem in the considered system model is defined as joint relay selection and discrete power control. We formulate the problem as a noncooperative game where the players are the secondary users and the common payoff function takes both transmission rate and power consumption into account. The proposed game falls into the framework of potential games where at least one pure strategy Nash equilibrium (NE) exists. Furthermore, the social optimal solution is also a pure strategy NE of the proposed game. We then propose a distributed algorithm based on learning automata to achieve the pure strategy NE. Numerical results show that the proposed algorithm has good convergence and near optimal performance.	anarchy;automata theory;best, worst and average case;converge;distributed algorithm;internet relay chat;learning automata;linear network coding;nash equilibrium;numerical method;selection algorithm;utility	Wei Zhong;Meixia Tao;Youyun Xu	2010	2010 International Conference on Wireless Communications & Signal Processing (WCSP)	10.1109/WCSP.2010.5633668	simulation;telecommunications;computer science;communication	Mobile	32.96424780012544	93.51595202041376	186047
2dc1697372caacff64009368528f3444146bba94	spectrum leasing and relay selection for cooperative cognitive radio network using potential game	wireless channels;game theory;iterative methods;cognitive radio;cooperative communication;relay networks telecommunication;nash equilibrium relay selection spectrum leasing potential game;wireless channels ad hoc networks cognitive radio cooperative communication game theory iterative methods radio spectrum management relay networks telecommunication;ad hoc networks;radio spectrum management;channel state information cooperative cognitive radio network relay selection spectrum leasing network performance improvement cognitive relay network secondary users cooperative relay primary user communication ad hoc network potential game primary user transmission primary user buffer secondary spectrum access nash equilibrium iterative algorithm information theoretic transmission strategy	In cognitive radio networks, cooperation between users can improve each network's performance. In this paper, a cognitive relay network is considered where the secondary users (users in Ad-Hoc network) are involved as cooperative relays in primary users' communication. The primary user owns a given bandwidth and can decide to lease it for a fraction of time to secondary users in exchange for appropriate remuneration. A group of secondary users in Ad-Hoc network are selected using potential game to maximize the primary user's transmission, so that primary user's buffer will be depleted faster, resulting in more channel idle time, namely more transmission opportunities for secondary users. We consider a baseline scenario with full channel state information and information theoretic transmission strategies. Feasibility and existence of the Nash equilibrium (NE) in potential game are proved, and an iterative algorithm of relay selection is designed. Moreover, the impact of different system parameters on primary user selection for secondary Ad-Hoc network is analyzed. Simulation results show that the primary user and secondary Ad-Hoc network can achieve higher utilities by spectrum leasing based on trading secondary spectrum access for cooperation.	algorithm;bandwidth (signal processing);baseline (configuration management);channel state information;cognitive radio;cooperative mimo;hoc (programming language);information theory;iterative method;nash equilibrium;relay;scanline rendering;simulation	Wei Xie;Wenfeng Ma;Peng Han;Wei Zhong;Hua Tian	2012	2012 International Conference on Wireless Communications and Signal Processing (WCSP)	10.1109/WCSP.2012.6543000	cognitive radio;simulation;cognitive network;telecommunications;engineering;cooperative diversity;relay channel;computer network	Mobile	32.86534587993426	94.53016326781979	186080
afb6fe3802a863bcd5070ac4609a9d0637db0a44	performance enhancement of adaptive orthogonal modulation in wireless cdma systems	radio networks;radio networks adaptive modulation code division multiple access power control geometric programming convex programming;convex programming;geometric program;adaptive modulation;multiaccess communication power control modulation coding throughput programmable control adaptive control narrowband performance gain wireless networks bit error rate;module system;objective function;optimization problem;rate control;code division multiple access;energy consumption;nonlinear convex program performance enhancement orthogonal modulation adaptive om code division multiple access wireless cdma system power control joint power rate optimization energy consumption generalized geometric program ggp;geometric programming;lower bound;power control	Recent research in wireless code-division multiple-access systems has shown that adaptive rate/power control can considerably increase network throughput relative to systems that use only power or rate control. In this paper, we consider joint power/rate optimization in the context of orthogonal modulation (OM) and investigate the additional performance gains achieved through adaptation of the OM order. We show that such adaptation can significantly increase network throughput, while simultaneously reducing the per-bit energy consumption relative to fixed-order modulation systems. The optimization is carried out under two different objective functions: minimizing the maximum service time and maximizing the sum of user rates. For the first objective function, we prove that the optimization problem can be formulated as a generalized geometric program (GGP). We then show how this GGP can be transformed into a nonlinear convex program, which can be solved optimally and efficiently. For the second objective function, we obtain a lower bound on the performance gain of adaptive OM (AOM) over fixed-modulation systems. Numerical results indicate that relative to an optimal joint rate/power control fixed-order modulation scheme, the proposed AOM scheme achieves significant throughput and energy gains.	associate-o-matic;convex optimization;general game playing;geometric programming;mathematical optimization;modulation;nonlinear system;numerical method;optimization problem;throughput	Alaa Muqattash;Marwan Krunz;Tao Shu	2006	IEEE Journal on Selected Areas in Communications	10.1109/JSAC.2005.862406	optimization problem;code division multiple access;real-time computing;geometric programming;link adaptation;telecommunications;power control;computer science;upper and lower bounds	Metrics	35.68161161878476	89.18295181178128	186200
