id	title	keywords	abstract	entities	authors	year	journal	doi	fos	area	x	y	ix
eb775c67dded7ef9e7b73f9b854fb5a4d2eba99a	research on cooperative video transmission over heterogeneous devices based on game theory	power control idea cooperative video transmission heterogeneous devices multipoint delivery video data forwarding capabilities power control power allocation collaborative transmission network resources base station noncooperative game theory utility function signal to noise ratio signal to interference ratio power distribution;non cooperative game theory cooperative transmission power distribution;wireless communication;wireless communication signal to noise ratio;signal to noise ratio;video communication cooperative communication game theory power control telecommunication control	This paper presents a cooperative video transmission mechanism based on game theory for heterogeneous devices during broadcasting. Broadcasting is a multipoint delivery of transmission that sends data from a source to multiple destinations. The terminal is involved in cooperative transmission when the station broadcast video data. To enhance performance, the heterogeneity and forwarding capabilities should be considered. This work studies power control and allocation in a collaborative transmission based on game theory, which provides an effective strategy when network resources are limited. First, a novel power allocation model of the base station (BS) based on non-cooperative game theory and bidding is presented in this study. Additionally, we also propose the utility function of Signal-to-Noise Ratios (SNRs) along with Signal-to-Interference Ratio (SIRs). Subsequently, based on such non-cooperative game theory with a utility function, the model of the power distribution of terminal in cooperative transmission can be built. Experiments have proven the correctness of the designed model and superiority, verifying the effectiveness of the proposed power-control idea.	cooperative mimo;correctness (computer science);game theory;interference (communication);multipoint ground;signal-to-noise ratio;streaming media;utility;verification and validation	Shuili Zhang;Wen Ji;Bo-Wei Chen;Yiqiang Chen	2014	The 2014 5th International Conference on Game Theory for Networks	10.1109/GAMENETS.2014.7043731	simulation;telecommunications;computer science;computer network	Mobile	33.24158116272474	94.14136939849395	189861
20b9d6673ab7de42e039e39b0a18690051721573	optimal and suboptimal resource allocations for multi-hop mimo-ofdma networks	optimisation channel allocation decode and forward communication frequency division multiple access mimo communication ofdm modulation;mimo ofdma;optimisation;resource allocation;resource management;frequency division multiple access;nuclear magnetic resonance;multi hop;spread spectrum communication;decode and forward;resource management relays optimization signal to noise ratio ofdm spread spectrum communication nuclear magnetic resonance;general power allocation solution suboptimal resource allocation multihop mimo ofdma networks weighted sum rate maximization decode and forward communication joint subcarrier assignment closed form suboptimal algorithm;ofdm modulation;proceedings paper;ofdm;resource allocation mimo ofdma decode and forward relay multi hop;optimization;signal to noise ratio;relays;channel allocation;decode and forward communication;mimo communication;relay	This paper considers the problem of resource allocation for weighted sum rate maximization in a decode-and-forward (DF) based multi-hop MIMO-OFDMA systems. The optimal solution of joint subcarrier assignment (user and relay selections) and power allocation is obtained by solving a dual problem. We derive the necessary conditions for the optimal power allocation and propose a suboptimal algorithm with a closed-form based general power allocation solution. This suboptimal algorithm, as numerical results verify that, suffers from minor performance loss against that achievable by the optimal solution when SNR is high. It is observed that the corresponding closed-form power allocation yields 8% performance gain when compared with the equal power allocation.	duality (optimization);elegant degradation;expectation–maximization algorithm;mimo;memory management;numerical analysis;numerical method;relay;signal-to-noise ratio;subcarrier;weight function	Yuan-Bin Lin;Wu-Hsiu Wu;Yu Ted Su	2012	2012 IEEE 23rd International Symposium on Personal, Indoor and Mobile Radio Communications - (PIMRC)	10.1109/PIMRC.2012.6362837	orthogonal frequency-division multiplexing;telecommunications;computer science;resource management;computer network	Embedded	34.76351149938932	90.21358207670993	190091
93a80aad9f00ae3a6e396a2d07cec04e6e8cf0fa	a joint time and frequency domains utility-based packet scheduler for mobile wimax networks		Mobile WiMAX represents a broadband wireless solution that enables the convergence of mobile and fixed broadband networks through a common wide area broadband radio access technology and flexible network architecture. IEEE802.16e standard for Mobile WiMAX system is based on the Orthogonal Frequency Division Multiple Access (OFDMA) scheme and allows sub-channelization in both uplink and downlink connections. Different sub-channelization schemes were proposed and implemented for Mobile WiMAX standard. Among them, AMC allows the exploitation of multi-user diversity over frequency domain, in that sub-channels may be allocated to users according to their frequency response over each band of sub-carriers comprising each sub-channel. This multi-user diversity can provide significant gains in overall system capacity if each sub-channel is opportunistically assigned to the user resulting in the highest gain, and therefore using the most efficient modulation and coding scheme. As the frequency diversity is lost with AMC this mode of channelization is more appropriate for fixed and low-mobility applications and/or with the use of Adaptive Antenna Systems (AAS) because these scenarios are associated to better SINR ratios.This article extends the work performed in by proposing a new joint scheduling and resource allocation algorithms for Mobile WiMAX system. The scheduler is based on the two degrees of freedom which results from the definition of radio resources over both time and frequency domains in the TDD OFDMA frame standardized by IEEE802.16e.	network scheduler	Alberto Nascimento;Jonathan Rodriguez	2010		10.1007/978-3-642-35155-6_15	real-time computing;telecommunications;computer network	Metrics	27.71405435240323	88.96205760163608	190439
27da30f2db50e14d87cb458307935d0109aa7a57	robust peer-to-peer collaborative-relay beamforming with ellipsoidal csi uncertainties	diversity;relay distributed beamforming diversity;signal to interference and noise ratios;technology;array signal processing;channel state information;interference;satisfiability;sdp peer to peer collaborative relay beamforming ellipsoidal csi uncertainties multiuser peer to peer communication network signal to interference and noise ratios sinr channel state information semidefinite program;upper bound;multiuser peer to peer communication network;semi definite program;science technology;signal to interference and noise ratio;community networks;peer to peer collaborative relay beamforming;sdp;quadratic optimization;robustness;optimization;peer to peer computing;ellipsoidal csi uncertainties;signal to noise ratio;relays;sinr;peer to peer computing array signal processing;peer to peer;distributed beamforming;telecommunications;semidefinite program;relay;relays interference signal to noise ratio array signal processing robustness peer to peer computing optimization	This letter considers a multiuser peer-to-peer communication network using a number of shared relays for collaborative beamforming and aims to minimize the total transmitted power of the relays whilst satisfying the targets of the signal-to-interference and noise ratios (SINRs) at the destination nodes by optimizing the relaying coefficients with imperfect channel state information (CSI). By deriving an equivalent form for the SINR constraints and an upper bound for the relay power, the problem can be tackled by solving a semi-definite program (SDP). Results reveal that the proposed technique outperforms significantly a conventional robust approach in terms of the transmitted power, and has only a mild increase in power if compared to the non-robust optimum which fails to meet the SINR targets.	beamforming;best, worst and average case;channel state information;coefficient;emoticon;interference (communication);mathematical optimization;multi-user;peer-to-peer;relay;semi-supervised learning;semiconductor industry;signal-to-interference-plus-noise ratio;simulation;telecommunications network;while	Dong Zheng;Ju Liu;Kai-Kit Wong;He Chen;Lei Chen	2012	IEEE Communications Letters	10.1109/LCOMM.2012.021612.111953	signal-to-interference-plus-noise ratio;telecommunications;computer science;mathematics;distributed computing;interference;channel state information;quadratic programming;statistics;robustness;satisfiability;technology	EDA	37.880747949070376	89.96398775075399	190476
4c5f44903cdad107455866605423e9b1119ba620	max-min resource allocation for video transmission in noma-based cognitive wireless networks		Non-orthogonal multiple access (NOMA)-based cognitive wireless networks can improve the spectral efficiency to utilize the vacant spectrum resource and exploit the power domain diversity. In this paper, we formulate a max-min resource allocation problem for video traffic in NOMA-based cognitive wireless networks as a mixed integer non-linear programming (MINLP) problem. The max-min video transmission problem is subject to the constraints of maximum accessed user number at each subchannel, total available energy of each secondary user, video encoding characteristics, and interference power threshold. To solve the formulated MINLP problem, we divide it into two subproblems, i.e., a power allocation and secondary user scheduling subproblem, and a video packet scheduling subproblem. First, we apply a successive convex approximation to transform the joint power allocation and secondary user scheduling subproblem into a bi-convex programming problem. Second, the binary search and dual decomposition methods are combined to obtain the approximated optimal power allocation and secondary user scheduling solutions. Finally, we propose a heuristic packet scheduling algorithm. Simulation numerical results show that the proposed algorithm improves the video quality and guarantees the fairness among different secondary users.	approximation algorithm;binary search algorithm;cognitive network;concave function;convex optimization;data compression;digital subchannel;exptime;fairness measure;greedy algorithm;heuristic;interference (communication);lagrangian relaxation;linear programming;loss function;maxima and minima;network packet;nonlinear programming;nonlinear system;numerical analysis;optimization problem;power domains;scheduling (computing);simulation;spectral efficiency	Lei Xu;Yong Zhou;Ping Wang;Wanli Liu	2018	IEEE Transactions on Communications	10.1109/TCOMM.2018.2854584	control theory;computer science;wireless network;network packet;real-time computing;resource allocation;approximation algorithm;scheduling (computing);spectral efficiency;cognitive radio;video quality	Mobile	32.005289412211404	91.8846172221832	190482
bd94f4f680b9b8125fe33ee43ab0d8792ed2f7d5	joint and distributed scheduling with dynamic power control in multicell orthogonal frequency division multiple access networks	dynamic programming;distributed scheduling local information dynamic programming performance improvement network capacity user scheduling policy information sharing cell edge areas network spectral efflciency universal frequency reuse intercell interference coordination multicell orthogonal frequency division multiple access networks joint scheduling dynamic power control;joint scheduling;intercell interference coordination;network capacity;radiofrequency interference cellular radio dynamic programming frequency allocation frequency division multiple access numerical analysis ofdm modulation power control;information sharing;universal frequency reuse;distributed scheduling;performance improvement;user scheduling policy;network spectral efflciency;multicell orthogonal frequency division multiple access networks;dynamic power control;cell edge areas;local information	This study addresses the issue of intercell interference coordination in a multicell orthogonal frequency division multiple access network with universal frequency reuse, which aims at improving the network spectral efficiency, especially for the cell edge areas. According to different degrees of information sharing within the engaged network, both a joint and a distributed solution are proposed respectively trying to determine the most appropriate power control strategy along with the user scheduling policy. The joint power control and user scheduling scheme with full access to the network information is capable of gaining considerable enhancement on the network capacity and also a performance improvement for users suffering from strong intercell interferences. The distributed scheme with the same purpose manages to adapt the power control and user scheduling strategy on the basis of dynamic programming with respect to both current and future utility of the network with only local information available. Numerical results have shown the advantages of the proposed schemes in achieving better spectral efficiency under both joint and distributed circumstances.	access network;catastrophic interference;control theory;dynamic programming;frequency divider;interference (communication);scheduling (computing);spectral efficiency	Jia Zhang;Dongfeng Yuan;Haixia Zhang;Huimin Li	2013	IET Communications	10.1049/iet-com.2012.0823	real-time computing;computer science;dynamic programming;mathematics;distributed computing	HPC	29.053830823854085	90.68368429885543	190613
8805f14da11dac296e122989846dccc38da3fb80	joint power and rate control for spectrum underlay in cognitive radio networks with a novel pricing scheme	pareto optimisation;pareto efficiency;game theory;nash equilibrium;energy efficient;joint power and rate control;pricing;spectrum;interference;pareto efficiency joint power and rate control cognitive radio networks pricing scheme primary user network spectrum underlay communication nash equilibrium;interference pricing signal to noise ratio games quality of service power control game theory;rate control;signal to interference plus noise ratio;spectrum underlay communication;numerical analysis;cognitive radio;pricing scheme;cognitive radio network;games;radio spectrum management cognitive radio pareto optimisation power control pricing;radio spectrum management;primary user;primary user network;max min fairness;quality of service;signal to noise ratio;existence and uniqueness;secondary user;heterogeneous network;cognitive radio networks;power control	Coexistence of a cognitive radio network (CRN) with a primary user network (PUN) using spectrum underlay communication is modeled as a non-cooperative power and rate control game (NPRG). Main objective is to maximize the utility of each secondary user (SU) making them more energy efficient. Quality of Service (QoS) levels of SUs are guaranteed by max-min fair signal to interference plus noise ratio (SINR) concept while maintaining QoS level of the primary user (PU), thus resulting in reliable operation by reducing the sum interference. Further, the applicability of the proposed novel pricing scheme and the algorithm is discussed with respect to a heterogeneous network with proper power and rate controlling. By reducing the sum power of SUs we explore the survival of cognitive users in a lowered interference threshold imposed by the primary network. The existence and uniqueness of Nash equilibrium and its Pareto efficiency is discussed. A novel power and rate control algorithm with a new pricing scheme is introduced to reach the Nash Equilibrium (NE). By using a common platform for rates and utilities, existing algorithms are compared through numerical analysis.	algorithm;coexist (image);cognitive radio;common platform;comparison sort;ibm systems network architecture;interference (communication);max-min fairness;maxima and minima;nash equilibrium;numerical analysis;numerical method;pareto efficiency;quality of service;signal-to-interference-plus-noise ratio;signal-to-noise ratio	K. B. Shashika Manosha;R. M. A. P. Rajatheva	2010	2010 IEEE 72nd Vehicular Technology Conference - Fall	10.1109/VETECF.2010.5594309	game theory;mathematical optimization;cognitive radio;simulation;telecommunications;computer science;mathematics;computer network	Mobile	31.667471943912197	93.8900504415107	190872
5aeb8ca5257ecf781faa61740a032de967498912	uplink scheduling in clustered 3g network with mobile relaying	relaying;mobile station;bit error rate;cdma2000;wireless network;link adaptation;power allocation;spectrum;system performance;out cell interference;scheduling algorithm;performance improvement;cluster head;uplink scheduling;mobile terminal;3g network;level 1	Hybrid wireless networks are characterized by simultaneously using several radio interfaces to boost system performances. A practical and promising architecture to achieve a better uplink throughput in the traditional CDMA cell is to locally aggregate mobile-generated traffic to some cluster heads through WLAN. Such an architecture opens up questions of the desired clustering structures as well as new uplink scheduling strategies. The scheduling of the aggregated traffic at the cluster heads (called relayed mobile terminals later) is investigated in this work. The proposed uplink scheduling algorithm takes the aggregated traffic nature into account. The scheduling goal is to achieve good throughput under the traffic QoS requirements (e.g. BER, bit-error-rates) and limited power budget at the mobile station. The proposed scheduling algorithm consists of two levels: (1) we use a proportional scheduling algorithm to coordinate the transmission among relaying mobile terminals (RMTs), where the main objective ...		Ju Wang;Jonathan C. L. Liu	2006	IJPEDS	10.1080/17445760601029388	fair-share scheduling;fixed-priority pre-emptive scheduling;spectrum;real-time computing;3g;bit error rate;link adaptation;telecommunications;dynamic priority scheduling;computer science;rate-monotonic scheduling;operating system;wireless network;two-level scheduling;computer performance;mobile station;round-robin scheduling;scheduling;proportionally fair;computer network;cdma2000	Mobile	25.700620714132008	91.54300261295936	190890
31d3008de47519aaadaf6a5049e528cab9e55b7d	rank-constrained separable semidefinite programming for optimal beamforming design	decentralized single antenna;quadratic programming;communication system;base stations;quadratically constrained quadratical programming rank constrained separable semidefinite programming optimal beamforming design downlink communication system multiantenna base station decentralized single antenna common frequency band signal to interference noise ratio interference level;efficient algorithm;data stream;array signal processing;downlink communication system;quadratically constrained quadratical programming;interference signal;rank reduction;downlink;base station;array signal processing interference constraints base stations frequency downlink quality of service signal to noise ratio design engineering books regions;rank constrained separable semidefinite programming;common frequency band;multiantenna base station;signal to interference noise ratio;interference level;optimal beamforming design;quadratically constrained quadratic program;quality of service;signal to noise ratio;interference constraints;quality of service array signal processing interference signal multifrequency antennas quadratic programming;strong duality;semidefinite program;multifrequency antennas	Consider a downlink communication system where multi-antenna base stations transmit independent data streams to decentralized single-antenna users over a common frequency band. The goal of the base stations is to jointly adjust the beamforming vectors so as to minimize the transmission powers while ensuring the signal-to-interference-noise ratio (SINR) requirement of individual users within the system, and keeping lower interference level to other systems which operate in the same frequency band and in the same region. This optimal beamforming problem is a separable homogeneous quadratically constrained quadratical programming (QCQP), and it is difficult to solve in general. In this paper, we give conditions under which strong duality holds, and propose an efficient algorithm for the optimal beamforming problem. First, we study rank-constrained solutions of a general separable semidefinite programming (SDP), and propose a rank reduction procedure to achieve a lower rank solution. Then we show that the SDP relaxation of a class of the optimal beamforming problem has a rank-one solution, which can be obtained by invoking the rank reduction procedure.	algorithm;beamforming;frequency band;interference (communication);linear programming relaxation;quadratic equation;quadratically constrained quadratic program;semidefinite programming;signal-to-interference-plus-noise ratio;strong duality;telecommunications link	Yongwei Huang;Daniel Pérez Palomar	2009	2009 IEEE International Symposium on Information Theory	10.1109/ISIT.2009.5206038	mathematical optimization;computer science;base station;control theory;mathematics;quadratic programming	Theory	36.28402338102949	89.82420505021484	190938
fde3d177704503078c11a26e34f5d60f05020b73	an evolution-inspired algorithm for efficient dynamic spectrum selection	evolutionary computation;radiofrequency interference evolutionary computation learning artificial intelligence radio links;radiofrequency interference;evolution strategy evolution inspired algorithm dynamic spectrum selection dynamic spectrum access dsa interference legacy devices white spaces reinforcement learning;throughput heuristic algorithms switches sociology statistics algorithm design and analysis probability distribution;learning artificial intelligence;radio links	Spectrum selection is a key issue in Dynamic Spectrum Access (DSA). The purpose of the selection is to minimize interference with legacy devices and maximize the discovery of opportunities or white spaces. There are several solutions to this issue, and Reinforcement Learning algorithms are among the most successful. Through simulation, we compare the performance of the Q-Learning algorithm to our proposal which is based on an Evolution Strategy. Our proposal outperforms Q-Learning in most scenarios, and has the further advantage of not requiring any parameterization since the parameters are automatically adjusted by the algorithm.	algorithm;algorithmic learning theory;evolution strategy;interference (communication);q-learning;reinforcement learning;simulation;white spaces (radio)	Camila S. Barbosa;Vinicius C. M. Borges;Sand Correa;Kleber Vieira Cardoso	2013	The International Conference on Information Networking 2013 (ICOIN)	10.1109/ICOIN.2013.6496372	telecommunications;computer science;artificial intelligence;theoretical computer science;machine learning;evolutionary computation	Robotics	27.81193016989745	92.17465952035752	191224
04d429ee8ac2ceae1a1c1dbd561889e3b73ff8fc	optimal channel allocation for multi-pu and multi-su pairs in underlay cognitive radio networks		In the underlay cognitive radio networks, this paper defines the joint channel and power allocation problem, which aims to optimise the max-total and max-min throughputs of secondary users (SUs), with the constraints of interference on primary receivers. For the max-total problem, we formulate the problem as a bipartite matching and derive a maximum weighted matching-based sum throughput maximisation algorithm (STMA) to solve this problem. For the max-min problem, on the basis of the optimal relay assignment (ORA) algorithm, we derive a polynomial time optimal channel assignment algorithm (OCAA) to iteratively assign channels to each SU pair under the power constraint. Simulation results demonstrate the effectiveness of our algorithms when compared with random method.		Long Chen;Liusheng Huang;Hongli Xu;Hansong Guo	2015	IJAHUC	10.1504/IJAHUC.2015.10001758	cognitive radio;throughput;time complexity;distributed computing;computer science;channel allocation schemes;bipartite graph;relay;max-min fairness;communication channel	ECom	34.03120200932421	90.99544193460324	191326
