id	title	keywords	abstract	entities	authors	year	journal	doi	fos	area	x	y	ix
cc588eb103ae928054e74dd092154d1bcb968fcf	learning relaying strategies in cellular d2d networks with token-based incentives	base stations;token exchange system;cellular d2d network mobile users low mobility users high mobility users overall downlink network performance token exchange system dynamic network environment long term utility optimal cooperation strategy network capacity downlink relay services token based incentives selfish users intelligent cellular devices;long term evolution;token networks cellular radio cooperative communication incentive schemes relay networks telecommunication;online learning;d2d cooperative relaying;lte advanced d2d cooperative relaying token exchange system online learning;batteries;relays batteries base stations recruitment long term evolution conferences mobile communication;mobile communication;lte advanced;relays;recruitment;conferences	We consider a cellular network where intelligent cellular devices owned by selfish users are incentivized to cooperate with each other by using tokens, which they exchange electronically to “buy” and “sell” downlink relay services, thereby increasing the network's capacity. We endow each device with the ability to learn its optimal cooperation strategy online in order to maximize its long-term utility in the dynamic network environment. We investigate the impact of the token exchange system on the overall downlink network performance and the performance of individual devices in various deployment scenarios involving mixtures of high and low mobility users. Our results suggest that devices have the greatest incentive to cooperate when the network contains many highly mobile users (e.g., users in motor vehicles). Moreover, within the token system, devices can effectively learn to cooperate online, and achieve over 20% higher throughput on average than with direct transmission alone, all while selfishly maximizing their own utility.	algorithm;compaq lte;decision problem;markov chain;markov decision process;network performance;relay;simulation;software deployment;telecommunications link;throughput	Nicholas Mastronarde;Viral Patel;Jie Xu;Mihaela van der Schaar	2013	2013 IEEE Globecom Workshops (GC Wkshps)	10.1109/GLOCOMW.2013.6824980	simulation;mobile telephony;telecommunications;computer science;base station;lte advanced;operating system;computer network	Mobile	31.280489520238472	95.32098363134435	195274
4f3358105b9e2294de89bc29f91ba33764a7c67b	joint cross-layer resource allocation and interference avoidance with qos support for multiuser cognitive radio systems	resource allocation cognitive radio frequency division multiple access interference suppression ofdm modulation quality of service radiofrequency interference;resource allocation;frequency division multiple access;convex optimization;spectrum;interference cancellation crosslayer resource allocation qos multiuser cognitive radio systems intersystem interference avoidance ofdma quality of service;dual problem;radiofrequency interference;interference suppression;cognitive radio;ofdm modulation;interference quality of service throughput resource management joints cognitive radio optimization;primary user;cross layer;quality of service;secondary user;interference cancellation;non real time;mac layer;power control	We consider joint cross-layer resource allocation and inter-system interference avoidance in OFDMA-based multiuser cognitive radio (CR) systems, where the secondary users (SU) can share spectrum with the primary users (PU) without causing unacceptable interference. The objectives are to provide quality of service (QoS) to both real-time and non-real-time services for SUs, and optimize the system throughput. Based on aggressive sharing method, we quantify these goals by analyzing (i) a joint power control and interference cancellation to guarantee the performance in primary system; (ii) a cross-layer and dual problem method to transform MAC-layer QoS requirements to PHY-layer; (iii) the convex optimization to solve the problem of the system. The joint cross-layer solution is effectively achieved. Simulation results show that, compared to the conventional designs, the performance of proposed algorithm has significantly higher throughput and guarantees the performance in primary system and the QoS in secondary system as well.	algorithm;cognitive radio;computer simulation;convex optimization;duality (optimization);ibm systems network architecture;information sciences institute;interference (communication);mathematical optimization;multi-user;optimization problem;phy (chip);quality of service;real-time clock;real-time transcription;requirement;subcarrier;telecommunications link;throughput;utility	Hailan Peng;Takeo Fujii	2010	2010 7th International Symposium on Wireless Communication Systems	10.1109/ISWCS.2010.5624534	spectrum;cognitive radio;single antenna interference cancellation;convex optimization;duality;orthogonal frequency-division multiplexing;quality of service;telecommunications;power control;resource allocation;computer science;computer network	Embedded	32.853775307726636	91.01681040362311	195351
2efe864fbc1830821899eb06609ef5335d4bb9fb	cross-layer scheduling for ofdma amplify-and-forward relay networks	relays base stations processor scheduling channel state information resource management downlink frequency conversion transmitters fading transceivers;frequency division multiple access networks;cross layer scheduling;fading;imperfect channel state information;base stations;amplify and forward relay networks;orthogonal frequency division multiple access;resource allocation;radio repeaters;rate adaptation;resource management;power adaptation;frequency division multiple access;optimization problem;distributed resource allocation;scheduling algorithm;resource allocation channel allocation fading channels frequency division multiple access radio repeaters;relay network;amplify and forward;ofdma;subcarrier allocation;cross layer design;optimization;distributed resource allocation algorithm;cross layer;signal to noise ratio;relays;channel allocation;slow fading channel;fading channels;channel state information at transmitter;distributed resource allocation algorithm cross layer scheduling ofdma amplify and forward relay networks frequency division multiple access networks imperfect channel state information slow fading channel rate adaptation power adaptation subcarrier allocation	In this paper, we consider cross-layer scheduling for the downlink of amplify-and-forward (AF) relay-assisted orthogonal frequency-division multiple-access (OFDMA) networks. The proposed cross-layer design takes into account the effects of imperfect channel-state information (CSI) at the transmitter (CSIT) in slow fading. The rate, power, and subcarrier allocation policies are optimized to maximize the system goodput (in bits per second per hertz successfully received by the users). The optimization problem is solved by using dual decomposition, resulting in a highly scalable distributed iterative resource-allocation algorithm. We also investigate the asymptotic performance of the proposed scheduler with respect to (w.r.t.) the numbers of users and relays. We find that the number of relays should grow faster than the number of users to fully exploit the multiuser diversity (MUD) gain. On the other hand, diversity from multiple relays can be exploited to enhance system performance when the MUD gain is saturated due to noise amplification at the AF relays. Furthermore, we introduce a feedback-reduction scheme to reduce the computational burden and the required amount of CSI feedback from the users to the relays. Simulation results confirm the derived analytical results for the growth of the system goodput and illustrate that the proposed distributed cross-layer scheduler only requires a small number of iterations to achieve practically the same performance as the optimal centralized scheduler, even if the information exchanged between the base station (BS) and the relays in each iteration is quantized, and the proposed CSI feedback reduction scheme is employed.	anisotropic filtering;centralized computing;channel state information;convex optimization;data rate units;distributed algorithm;duality (optimization);goodput;iteration;lagrangian relaxation;mud;mathematical optimization;multi-user;optimization problem;relay;scalability;scheduling (computing);simulation;subcarrier;telecommunications link;transmitter	Derrick Wing Kwan Ng;Robert Schober	2009	IEEE Transactions on Vehicular Technology	10.1109/VETECF.2009.5378812	radio repeater;optimization problem;electronic engineering;telecommunications;resource allocation;computer science;base station;resource management;signal-to-noise ratio;scheduling;fading;computer network	Mobile	35.60022094908042	89.84487766696206	195559
09a58c449774897c28e22a2808f5de98a724ebd7	efficient learning of statistical primary patterns via bayesian network	primary user statistical primary pattern bayesian network bn structure learning scheme cognitive radio technology;base stations sensors mutual information bayes methods mobile communication computational complexity computational modeling;statistical analysis belief networks cognitive radio learning artificial intelligence	In cognitive radio (CR) technology, the trend of sensing is no longer to only detect the presence of active primary users. A large number of applications demand for primary user behavior correlation in spatial, temporal, and frequency domains. To satisfy such requirements, we study the statistical relationship of primary users by introducing a Bayesian network (BN) based framework. How to learn such a BN structure is a long standing issue, not fully understood even in the statistical learning community. To solve such an issue in CR, this paper proposes a BN structure learning scheme which incurs significantly lower computational complexity compared with previous ones. Thus, with this scheme, cognitive users could efficiently understand the statistical pattern of primary networks.	bayesian network;cognitive radio;computational complexity theory;machine learning;requirement	Weijia Han;Huiyan Sang;Min Sheng;Jiandong Li;Shuguang Cui	2015	2015 IEEE International Conference on Communications (ICC)	10.1109/ICC.2015.7249094	computer science;artificial intelligence;theoretical computer science;machine learning;statistics	Robotics	27.831651999702732	99.2145749873789	195922
957e01036be81a28d0cc5dda9f527a0e286937fd	joint resource allocation method in heterogeneous wireless networks based on genetic algorithm	ga joint resource allocation method heterogeneous wireless networks genetic algorithm radio access networks common network platform parallel multiradio access scheme multiple ran mmt multimode mobile terminals;resource allocation;radio resource management genetic algorithm multidimensional optimization heterogeneous;resource allocation genetic algorithms radio access networks;genetic algorithms;radio access networks	The heterogeneous wireless networks integrate various types of radio access networks (RANs) as far as possible to provide multiple services on the common network platform. Joint resource allocation in these networks plays an important role in improving resource utilization. In this paper, we study the problem of maximizing system capacity for parallel multi-radio access scheme where multi-mode mobile terminals (MMTs) can transmit data simultaneously over multiple RANs. A bandwidth and power joint allocation method named MDGS was proposed, which based on the genetic algorithm (GA). Numerical results validate the effectiveness of the proposed approach.	access network;channel capacity;constrained optimization;constraint (mathematics);genetic algorithm;iteration;mathematical optimization;nonlinear system;numerical method;optimization problem;simulation;software release life cycle;telecommunications link	Li He;Xin Su;Jie Zeng;Yujun Kuang	2012	2012 International Conference on Wireless Communications and Signal Processing (WCSP)	10.1109/WCSP.2012.6542924	channel access method;telecommunications;computer science;radio resource management;distributed computing;computer network	Robotics	29.12211712308767	92.78337485226574	196092
324e3de57ecca729ffe25b026814ff70d5df021c	self-optimizing load balancing with backhaul-constrained radio access networks	lte;long term evolution;telecommunication traffic radio access networks;son;backhaul constrained load balancing;mobile communication;load management;load balancing;load management long term evolution radio access networks self organizing networks heterogeneous networks algorithm design and analysis mobile communication;backhaul constrained heterogeneous network self optimizing load balancing backhaul constrained radio access networks self organizing network base station guaranteed bit rate traffic load estimator self optimized load balancing algorithm;heterogeneous networks;backhaul;algorithm design and analysis;lte son self organizing networks load balancing backhaul backhaul constrained load balancing;radio access networks;self organizing networks	Self-organizing network (SON) technology aims at autonomously deploying, optimizing and repairing radio access networks (RANs). SON algorithms typically use key performance indicators (KPIs) from the RAN. It is shown that in certain cases, it is essential to take into account the impact of the backhaul state in the design of the SON algorithm. We revisit the base station (BS) load definition taking into account the backhaul state. We provide an analytical formula for the load along with a simple estimator for both elastic and guaranteed bit-rate (GBR) traffic. We incorporate the proposed load estimator in a self-optimized load balancing (LB) algorithm. Simulation results for a backhaul constrained heterogeneous network illustrate how the correct load definition can guarantee a proper operation of the SON algorithm.	access network;algorithm;backhaul (telecommunications);interference (communication);lattice boltzmann methods;load balancing (computing);optimizing compiler;organizing (structure);simulation;subpixel rendering	Abdoulaye Tall;Zwi Altman;Eitan Altman	2015	IEEE Wireless Communications Letters	10.1109/LWC.2015.2477499	algorithm design;heterogeneous network;mobile telephony;telecommunications;backhaul;computer science;load balancing;lte advanced;distributed computing;self-organizing network;computer network	Mobile	25.12714998399653	91.8575255808047	196164
d7ff70cbfc0e12d98fbe280c2e02bf0647444e55	energy-efficient power control with time-domain scheduling in heterogeneous networks	picocells cell range expansion;energy efficiency;energy conservation;energy efficient power control;differential evolution;macrocell networks;macrocells user equipments;cellular radio;telecommunication control;utility function;interference;cre;time domain analysis;macro base stations;optimal transmission power energy efficient power control time domain scheduling heterogeneous networks wireless communications macrocells user equipments macro base stations utility function picocells cell range expansion cre differential evolution;wireless communications;optimal transmission power;time domain scheduling;macrocell networks power demand throughput interference energy efficiency time domain analysis optimization;optimization;time domain analysis cellular radio energy conservation power control telecommunication control;power demand;heterogeneous networks;throughput;power control	Improving network Energy Efficiency (EE) in wireless communications has attracted increasing attention recently. The purpose of our research is to optimize the network power consumption and preserve the throughput of macrocells User Equipments (UEs) at the same time. We solve the problem by controlling the transmission power of macro base stations (BSs) in some subframes based on the proposed utility function, and accordingly scheduling picocells Cell Range Expansion (CRE) UEs in these subframes. The existence of the optimal solutions to the problem is discussed, then the Differential Evolution (DE) is applied to search the optimal transmission power which maximizes the proposed utility function. System level simulation results show that the proposed algorithm can not only optimize the network power consumption but also improve the throughput of the network, which will lead to the network EE improvement.	algorithm;cell (microprocessor);differential evolution;interference (communication);multitier architecture;scheduling (computing);simulation;throughput;utility	Yaguang Wu;Hailun Xia;Chunyan Feng;Rui Han;Cong Du	2014	2014 IEEE 79th Vehicular Technology Conference (VTC Spring)	10.1109/VTCSpring.2014.7022911	differential evolution;throughput;electronic engineering;real-time computing;heterogeneous network;energy conservation;telecommunications;power control;computer science;engineering;interference;efficient energy use;wireless	Mobile	26.153905646167562	91.93792329770373	196195
108c2a5e28a4bd55ad4d1cf8ac6de587cb003aca	energy efficiency and capacity tradeoff in cloud radio access network of high-speed railways		To meet the increasing demand of high-data-rate services of high-speed railway (HSR) passengers, cloud radio access network (C-RAN) is proposed. This paper investigates the tradeoff between energy efficiency (EE) performance and capacity in C-RAN of HSR. Considering that the train location can be predicted, we propose a predictable path loss based time domain power allocation method (PPTPA) to improve EE performance of HSR communication system. First, we consider that the communication system of HSR only bears the passenger information services (PISs). The energy-efficient power allocation problem with delay constraint is studied. The formulated problem is nonconvex. To deal with it, an equivalent convex problem is reformulated. Based on PPTPA, we propose an iterative algorithm to improve the EE performance. Second, we consider that the PISs and the train control services (TCSs) are all bore. A capacity optimization problemwith joint EE and services transmission delay constraints is formulated. Based on PPTPA, we propose a hybrid power allocation scheme to improve the capacity of the system. Finally, we analyze the effect of small-scale fading on EE performance. The effectiveness of the proposed power allocation algorithm is validated by HSR channel measurement trace based emulation results and extensive simulation results.	algorithm;c-ran;capacity optimization;channel capacity;convex optimization;emulator;entropy maximization;hierarchical state routing;iterative method;loss function;mathematical optimization;optimization problem;radio access network;regular expression;simulation;social inequality	Shichao Li;Qian Yang;Siyu Lin;Qian Gao;Lei Xiong;Weiliang Xie;Xiaoyu Qiao	2017	Mobile Information Systems	10.1155/2017/5816862	embedded system;simulation;telecommunications;operating system;computer security;computer network	Mobile	30.482109418164015	91.88573841395115	196232
b7efca1ef307e09909a5940022d15ba8c15b2188	maximizing investment income of ssp for spectrum trading in cognitive radio networks	wireless channels channel estimation cognitive radio markov processes queueing theory radio spectrum management;investment estimation bandwidth markov processes analytical models queueing analysis;estimation method ssp investment income maximization spectrum service provider spectrum trading frameworks cognitive radio networks spectrum utilization flexibility improvement spectrum utilization efficiency improvement primary users spectrum resources secondary users markov chain model ssp state transition analysis su waiting time calculation su queuing size calculation queuing theory marginal analysis theory spectrum purchase spectrum auction	More and more researches have demonstrated the benefits of cognitive radio technology in improving flexibility and efficiency of spectrum utilization. In order to encourage primary users (PUs) to share their idle spectrum resources with secondary users (SUs), spectrum trading frameworks are developed. In this paper, the investment problem of spectrum service provider (SSP) is considered which obtains spectrum from PUs and provides service to multiple SUs. The SUs' actions are estimated according to statistical data. A estimation method for channels number is proposed basing on maximizing the SSP's investment income. A Markov chain model is used to analyze the SSP's state transition and calculate the SU's waiting time and queuing size by queuing theory. The optimal number of channels is deduced with marginal analysis theory. In either spectrum purchase or auction, the SSP could adjust its investment strategy timely and flexibly according to these parameters.	cognitive network;cognitive radio;experiment;global serializability;marginal model;markov chain;queueing theory;simulation;spectrum reallocation;user experience	Lu Wang;Zhong Zhou;Wei Wu	2014	2014 IEEE Wireless Communications and Networking Conference (WCNC)	10.1109/WCNC.2014.6953091	telecommunications	Metrics	27.802790167033034	98.17103458244296	196333
8d20ee8f3793c29eaa7929d380e8171c7a210bde	optimal foresighted packet scheduling and resource allocation for multi-user video transmission in 4g cellular networks	video communication 4g mobile communication cellular radio resource allocation scheduling;noise figure 3 db optimal foresighted packet scheduling resource allocation multiuser video transmission 4g cellular network base station allocation bs allocation short term video quality maximization single user video transmission long term video quality maximization low complexity algorithm user optimal decision maximization psnr peak signal to noise ratio noise figure 7 db;streaming media scheduling algorithms resource management wireless communication video recording quality assessment context;multi user communication wireless video transmission packet scheduling resource allocation	We study joint resource allocation and packet scheduling for multi-user video transmission in a 4G cellular network, where the base station (BS) allocates resources (i.e. bandwidth) among the users and each user schedules its video packets based on the allocated resources. Most existing works either propose myopic solutions for multi-user video transmission, in which the resource allocation and packet scheduling is designed to maximize the short-term video quality, or propose foresighted packet scheduling solutions for single-user video transmission which maximize the long-term video quality. In this work, we propose foresighted resource allocation and packet scheduling solutions for multi-user video transmission. Specifically, we develop a low-complexity algorithm in which the BS updates the prices of resources for each user and the users make individual packet scheduling decisions based on the prices. The algorithm can be implemented by the BS and the users in a decentralized manner, and converges to the optimal prices under which the users' optimal decisions maximize the long-term total video quality subject to per-user minimum video quality guarantees. Simulation results show 7 dB and 3 dB improvements in PSNR (Peak Signal-to-Noise Ratio) over myopic solutions and existing foresighted solutions, respectively.	algorithm;decibel;multi-user;network packet;peak signal-to-noise ratio;scheduling (computing);simulation;video	Yuanzhang Xiao;Mihaela van der Schaar	2014	2014 IEEE International Conference on Acoustics, Speech and Signal Processing (ICASSP)	10.1109/ICASSP.2014.6853688	real-time computing;telecommunications;computer science;computer network	Mobile	25.308625843272164	95.79332018621763	196734
