id	title	keywords	abstract	entities	authors	year	journal	doi	fos	area	x	y	ix
4721766e2df7297be1377ea17fbf794426968f78	mutual interference considered power allocation in ofdm-based cognitive networks: the single su case	radio networks;optimisation sous contrainte;constrained optimization;distributed system;teoria cognitiva;red sin hilo;systeme reparti;algorithm complexity;reseau sans fil;complejidad algoritmo;remplissage;wireless network;multiplexage frequence orthogonal;low complexity;power allocation;cognitive theory;filling;theorie cognitive;multiplaje frecuencia ortogonal;asignacion optima;optimizacion con restriccion;optimization problem;sistema repartido;complexite algorithme;cognitive radio;cognitive radio network;reseau radio;mathematical programming;orthogonal frequency division multiplexing;water filling;ofdm;allocation optimale;radio communication;primary user;radiocommunication;optimal allocation;constrained optimization problem;programmation mathematique;peak power;secondary user;programacion matematica;dynamic spectrum access;orthogonal frequency division multiplexing ofdm;radiocomunicacion;relleno;orthogonal frequency division multiplex	Efficient and conflict-free power allocation strategies in cognitive radio networks are being extensively studied in current research in order to meet the requirements of future wireless applications. In this paper, specifying the single secondary user (SU) with multiple primary user (PU) case, a novel power allocation scheme is developed for orthogonal frequency division multiplexing (OFDM) – based cognitive radio networks designed to maximize the capacity of the SU while limiting the interference to the PUs. First, the mutual interference between the SU and the PUs is comprehensively formulated as the restrictions on the SU’s transmission power. Secondly, the power allocation problem is analyzed and formulated as a constrained optimization problem which is concluded to a peak-power constrained water-filling formulation. Finally, a novel low-complexity water-filling algorithm is proposed to solve the optimization problem and the optimal power allocation result is achieved. In a simplified scenario, numerical results are exhibited to confirm the efficiency of the proposed water-filling algorithm, and the influence of the mutual interference on the power allocation and the system capacity is further illustrated. 2009 Elsevier B.V. All rights reserved.	channel capacity;cognitive network;cognitive radio;constrained optimization;constraint (mathematics);frequency divider;ibm systems network architecture;interference (communication);mathematical optimization;multiplexing;numerical analysis;optimization problem;requirement;superuser;water filling algorithm	Chengshi Zhao;Mingrui Zou;Kyung Sup Kwak	2009	Computer Communications	10.1016/j.comcom.2009.07.009	constrained optimization;cognitive radio;simulation;orthogonal frequency-division multiplexing;telecommunications;computer science;computer network	Mobile	33.27166218208937	92.02233843118981	178632
72bcc3d4b659d25bfef6bf305336f55f707952d7	convergence of iterative waterfilling algorithm for gaussian interference channels	first page;iterative waterfilling algorithm;gaussian interference channels;fixed point;non cooperative game;nash equilibrium;indexing terms;wireless communication;convergence;iterative algorithm;throughput;dsl	Iterative waterfilling power allocation algorithm for Gaussian interference channels is investigated. The system is formulated as a non-cooperative game. Based on the measured interference powers, the users maximize their own throughput by iteratively adjusting their power allocations. The Nash equilibrium in this game is a fixed point of such iterative algorithm. Both synchronous and asynchronous power update are considered. Some sufficient conditions under which the algorithm converges to the Nash equilibrium are derived.	algorithm;channel use;data rate units;fixed point (mathematics);interference (communication);iterative method;multi-user;nash equilibrium;statistical interference;throughput	Kenneth W. Shum;Kin Kwong Leung;Chi Wan Sung	2007	IEEE Journal on Selected Areas in Communications		telecommunications;computer science;control theory;mathematics;fading;precoding;statistics	Metrics	36.337083931292526	89.17978133189413	178788
a189367f12db7a1e2e211bc0063a09c13aa453a6	qos based power control for small cell networks		In this paper, we present a power adjustment algorithm that can be used in heterogeneous networks where varying QoS requirements of users should be taken into account. The proposed power control algorithm differs from similar approaches in the literature in the sense that channel state information is not required in the power update. The performance of the algorithm is evaluated both analytically and numerically under a setup with non-ideal communication links. Simulation results demonstrate that optimum power allocation with respect to the QoS requirements of users is achieved when using the proposed algorithm.	algorithm;channel state information;numerical analysis;quality of service;requirement;simulation;telecommunications link	Kazım Şenel;Mehmet Akar	2017	2017 American Control Conference (ACC)	10.23919/ACC.2017.7963713	quality of service;power control;computer science;channel state information;heterogeneous network;algorithm design;small cell;real-time computing;signal-to-noise ratio	Robotics	28.79588418320386	91.72058796330992	179432
f32f8307ea3968b61d03012562803d4e5b2973dd	matrix differentiation for capacity region of gaussian multiple access channels under weighted total power constraint	gaussian channels;matrix differentiation;weighted total power constraint	Maximization the capacity region of Gaussian multiple access channels with vector inputs and vector outputs has been extensively studied in existing schemes. Although these schemes are proven effective in various real-life applications, they are inapplicable to deal with channels with matrix variables subjected to certain constraints. In this work, we present a new framework to estimate the capacity region of Gaussian multiple access channels with matrix inputs and outputs under weighted total power constraints. We propose an optimization model to address this issue and prove its concavity. By introducing an I-chain rule for matrix differentiation, the gradient of the objective function involving matrix variables can be obtained. An algorithm, named normalized projected gradient method (NPGM) is developed to find the global optimal solution for the proposed model. The convergence of NPGM is established by utilizing projection and normalization operators. Simulation results provide an interesting insight that NPGM can manage the existent situations within an unified framework, and provide a novel universal technical solution to optimize the capacity region under weighted total power constraints.		Zhao-Xu Yang;Guang-She Zhao;Guoqi Li;Hai-Jun Rong	2017	Annales des Télécommunications	10.1007/s12243-017-0610-7	mathematics;operator (computer programming);normalization (statistics);gradient method;maximization;matrix (mathematics);convergence (routing);mathematical optimization;gaussian;communication channel	EDA	37.60666654433483	90.93716686335311	179647
db7dace73b9c77c243622dc15f47d561e8b63b2e	fast local d.c. programming for optimal power allocation in wireless networks	radio networks;optimisation;wireless network;resource manager;low complexity;power allocation;iterative algorithm;radiofrequency interference;objective function;optimization problem;iterative methods;computational complexity;convex function;weighted sums;computation complexity fast local dc programming optimal power allocation interference limited wireless network global maximization weighted sum throughput global optimization problems iterative algorithms;radiofrequency interference computational complexity iterative methods optimisation radio networks;global optimization;optimization resource management throughput wireless networks convergence programming vectors	Power allocations in an interference-limited wireless network for global maximization of the weighted sum throughput or global maximization of the minimum rate among network links are not only important but also very hard optimization problems due to their nonconvexity nature. Recently developed methods are either unable to locate the global optimal solutions or prohibitively complex for practical applications. This paper exploits the d.c. (difference of two convex functions/sets) structure of either the objective function or constraint of the these global optimization problems to develop efficient iterative algorithms with very low complexity. Numerical results demonstrate that the developed algorithms are able to locate the global optimal solutions by only a few iterations and they are superior to the previously-proposed methods in both performance and computation complexity.	computation;computational complexity theory;convex function;entropy maximization;expectation–maximization algorithm;global optimization;interference (communication);iteration;mathematical optimization;maximum power transfer theorem;numerical method;optimization problem;throughput;weight function	Ha Hoang Kha;Hoang Duong Tuan;Ha H. Nguyen	2011	2011 IEEE Global Telecommunications Conference - GLOBECOM 2011	10.1109/GLOCOM.2011.6134078	mathematical optimization;computer science;resource management;theoretical computer science;machine learning;iterative method;global optimization	Vision	36.67702231564722	91.13689451343923	179780
2002eeb21f2ee28fad885c6e544154f778bba246	equivalent convex optimisation approach for green cognitive radio-based cooperative networks		Ensuring total rate maximisation whilst keeping Greenhouse gas emission (GHGE) at a minimum in green cooperative cognitive radio networks is key to achieving maximum network quality. This study employs the multi-objective lexicographic algorithm to a proposed multi-objective optimisation problem scheme to deal with these conflicting objectives through two consecutive steps. The challenge posed by maximum throughput – a complex non-convex optimisation problem – is first resolved through a mathematical manipulation resulting in a fractional programming model which is then converted to its simplified convex programming equivalent by applying the Charnes–Cooper transformation. Next, the GHGE minimisation issue is tackled effectively by applying a convex programming. Simulation results confirm that the proposed approach offers superior performance compared to well-known schemes in terms of throughput gain and emission quality.	cognitive radio;convex optimization;mathematical optimization	Mohadeseh Soleimanpour;Shima Esmaeili;Siamak Talebi	2018	IET Communications	10.1049/iet-com.2017.0870	real-time computing;mathematics;throughput;regular polygon;cognitive radio;mathematical optimization;lexicographical order;fractional programming;convex optimization;minimisation (psychology)	ML	34.50392316658792	92.11047961825676	179926
cb65e71471de6d653b3a3cdca5e1f5a820497a67	novel user scheduling algorithms for carrier aggregation system in heterogeneous network		In this paper, the carrier aggregation (CA) is applied to Heterogeneous Networks (HetNets) consisting of a macro base station (MBS) and low-power pico base stations (PBSs). The PBSs are distributed in the outer space of the disk centered at the MBS and the closed-form solution of the radius of the disk is analyzed. In the CA based HetNet, firstly, a practical user association scheme is proposed to classify the users into macrocell user (MUs) and pico-cell users (PUs). Secondly, a PU-centric cooperative transmission strategy is proposed to increase the data rate of PUs. Then, in order to eliminate the cross-tier interference in HetNet, the MUs and PUs schedule different component carriers (CCs) according to different algorithms. For the MUs, an improved simulated annealing (SA) scheduling algorithm is proposed to maximize the sum rate of the MUs. Compared with the existing SA, the inner loop of the proposed SA is redesigned. Consequently, the best value can be obtained more quickly. For PUs, a location information based low-complexity maximize minimum distance (MMD) algorithm is proposed to reduce the interference from PBSs to PUs as much as possible. Overall, an integrated scheme is proposed to improve the performance. At last, numerical results demonstrate the performance of the proposed schemes.	algorithm;data rate units;ibm systems network architecture;inner loop;interference (communication);low-power broadcasting;mikumikudance;multitier architecture;numerical analysis;one-class classification;overhead (computing);scheduling (computing);simulated annealing	Tiejun Lv;Chenchen Liu;Hui Gao	2017	2017 IEEE Wireless Communications and Networking Conference (WCNC)	10.1109/WCNC.2017.7925894	embedded system;real-time computing;telecommunications;operating system;computer network	Mobile	28.25491238203511	90.93400708477726	180003
398ce247713f96ea3f7cd9459d55e6e893f745e9	solvability of coupled downlink beamforming problems	optimisation;antenna radiation patterns;non linear optimization;cochannel interference;cellular radio;telecommunication control;convergence of numerical methods;optical coupling downlink array signal processing iterative algorithms base stations signal processing algorithms power control interference constraints sufficient conditions algorithm design and analysis;array signal processing;iterative algorithm;multiuser channels;iterative methods;interference suppression;adaptive signal processing;necessary and sufficient condition;array signal processing optimisation cochannel interference interference suppression cellular radio antenna radiation patterns power control telecommunication control iterative methods convergence of numerical methods multiuser channels adaptive signal processing;wireless systems;multiuser interference coupled downlink beamforming problems downlink power control cellular wireless systems signal to interference level iterative algorithms nonlinear optimization problem multiple antennas adaptive signal processing spatial signal processing cochannel interference reduction radiation patterns;power control	We address the problem of joint downlink beamforming and power control in interference limited cellular wireless systems. The goal is to support each user with a certain signal-to-interference level at the mobile. Several iterative algorithms have recently been proposed in the literature to solve this non-linear optimization problem. Obviously, no solution exists if the requirements are too demanding. This explains situations where the algorithms do not converge. On the other hand, the observation of convergence is only a necessary condition for the existence of a solution. We investigate the analytical structure of the problem and formulate a unifying framework. In particular, we provide a necessary and sufficient condition which can be used to judge whether or not a solution can be considered as valid. The results give new insights and may prove useful for the design of new fast convergent algorithms.	beamforming;telecommunications link	Martin Schubert;Holger Boche	2001		10.1109/GLOCOM.2001.965190	telecommunications;computer science;control theory;iterative method	Theory	37.10407566317046	91.9509835158933	181089
3f10b7e5fd1a8dc92d6281698b7d31a816a9718f	distributed quality of service provision using coalitions and the nash bargaining solution	pf scheduler distributed quality of service provision coalitions nash bargaining solution qos provision game theoretic concepts coalition formation subcarrier allocation greedy approach minimum data rate requirements multiuser wireless channel greedy schedulers;quality of service game theory;game theoretic concepts;nash bargaining solution;coalition formation;qos provision;subcarrier allocation;greedy approach;distributed quality of service provision;coalitions;pf scheduler;multiuser wireless channel;greedy schedulers;minimum data rate requirements	A new scheduler with the capability for distributed quality of service (QoS) provision is presented. Based on the game-theoretic concepts of coalition formation and bargaining, this scheduler follows a hybrid approach to allocate subcarriers and to satisfy the minimum rate requirement of the wireless users. In the first part of the allocation process, a greedy approach is used to provide users minimum data rate requirements. Then, in the game-theoretic part of the process, the remaining resources are split in a fair manner between the users by forming dynamically sized coalitions and by allowing users to bargain with each other, using the Nash bargaining solution. The novelty of this approach lies in the fact that it allows the distributed, partly-cooperative provision of QoS in a multiuser wireless channel. This new scheduler is compared against the proportional fair and greedy schedulers and the simulation results indicate that the proposed scheduler offers better QoS outage performance than others. It also offers fairness and sum rate that are comparable to the PF scheduler, while the comparison with the Greedy scheduler indicates significantly better fairness, but lower sum rate.	nash equilibrium;quality of service	Stefanos Vatsikas;Simon Armour;Tim Lewis;Marina De Vos	2013	IET Communications	10.1049/iet-com.2012.0466	bargaining problem;real-time computing;distributed computing;computer network	ECom	28.705231701045346	93.80446678072875	181200
5bfb9bc78f0359e6024a9a8daff5bbd4d333dabc	supporting mobile users in database-driven opportunistic spectrum access	opportunistic spectrum access;spectrum sharing;mobility management;geolocation database	In database-driven opportunistic spectrum access, location information of secondary users plays an important role. In a database query-and-update procedure, a secondary user reports to the geolocation database of its location information, so that the updated knowledgebase facilitates location-aided incumbent protection and network coexistence. However, such database-driven spectrum sharing becomes very challenging when the secondary users are mobile. In this paper, we propose a probabilistic coexistence framework that supports mobile users by incorporating the solutions to solve two core problems: (i) white space allocation (WSA) at the database and (ii) location update control (LUC) at the users. We frame the two problems such that they interact through dynamic control of the users' location uncertainty levels. For WSA, we derive a centralized real-time solution to mitigate mutual interference among secondary users and protect primary users against harmful interference. For LUC, we design a local two-level strategy to enable both movement-driven and interference-driven control of location uncertainty. This strategy makes an appropriate trade-off between the effectiveness of interference mitigation and the cost of database queries. To evaluate our algorithms, we have carried out both theoretical model-driven and real-world trace-driven simulation experiments. Our simulation results show that the proposed framework can determine and adapt the database query intervals of mobile users to achieve near-optimal interference mitigation with minimal location updates.	algorithm;centralized computing;coexist (image);computer simulation;database;experiment;geolocation;interference (communication);knowledge base;model-driven integration;national land and property gazetteer;real-time clock;regular expression;winsock	Bo Gao;Jung-Min Jerry Park;Yaling Yang	2014		10.1145/2632951.2632984	data mining;world wide web;computer security;computer network	Mobile	26.990022168354947	94.24698398899844	181241
343bf51b1801b34808b1c6ba54cc62f033c982f9	robust energy harvest balancing optimization with v2x-swipt over miso secrecy channel	vehicle to everything;physical-layer secrecy;miso system;swipt;artificial noise	Abstract Vehicle to everything (V2X) is emerging as a promising application scenario of fifth generation (5G) wireless communications. In V2X systems, a series of applications (information transmission, in-car entertainment, etc.) rely on the limited vehicle battery, and the secrecy communication is a vital issue. However, most prior work limits to the automatic piloting, channel measurement/estimation and high speed transmissions, seldom study has been done on the battery-limited and secrecy communications for V2X. In light of this, here we investigate the V2X systems with a battery-limited perspective based on the multiple-input-single-output (MISO) secrecy channel in the presence of multiple eavesdroppers. The transmit beamformer and artificial noise (AN) are jointly designed. With the channel uncertainties, by subjecting to the battery constraints and secrecy rate, a robust energy harvesting (EH) balancing problem is constructed. The problem is further transformed into a two-level problem, in which we solve the inner-level problem by exploiting S-Procedure , and the outer-level problem with one-dimensional line search method. Finally, simulation results are provided to validate the performance of our proposed scheme.		Zhongyong Wang;Zheng Chu;Di Zhang;Byonghyo Shim	2018	Computer Networks	10.1016/j.comnet.2018.03.018	secrecy;computer network;computer science;battery (electricity);distributed computing;wireless;energy harvesting;artificial noise;communication channel	Metrics	37.39004799421015	91.76878004896022	181281
70ed92d5fd9b5dd342cf3b82e722d39383f4d0f9	downlink multi-cell radio resource management for coordinated base stations	tdma;time division multiple access;radio resource management;base stations;tdma ofdma;multicell radio resource management;processor scheduling;resource allocation;rockets;downlink resource management base stations time division multiple access interference processor scheduling linear matrix inequalities land mobile radio cellular systems signal to noise ratio rockets;cellular radio;resource management;frequency division multiple access;low complexity;interference;data mining;time division multiple access cellular radio frequency division multiple access resource allocation scheduling telecommunication network management;downlink;base station;weighted sums;scheduling;conference report;ofdm;bandwidth;tdma ofdma multicell radio resource management resource allocation scheduling base stations tdma;land mobile radio cellular systems;signal to noise ratio;linear matrix inequalities;telecommunication network management	This paper addresses the design of joint multi-cell resource allocation and scheduling with coordination among neighboring base stations (BS). Considering Ns neighboring sectors, the solution that maximizes the weighted sum-rate in the covered area is found for TDMA and TDMA/OFDMA access. The optimum solution exhibits low complexity as it presents the useful property that its computation admits a decomposition such that each BS is responsible for the selection of the users to be scheduled in its own sector. This result is proved analytically. KeywordsCoordinated scheduling, multi-cell resource allocation, BS coordination	computation;concave function;ergodicity;frequency band;inline linking;radio resource management;scheduling (computing);signal-to-noise ratio;simulation interoperability standards organization;social inequality;spectral efficiency;telecommunications link;weight function	Olga Muñoz;Eduard Calvo;Josep Vidal;Adrian Agustin	2009	VTC Spring 2009 - IEEE 69th Vehicular Technology Conference	10.1109/VETECS.2009.5073512	real-time computing;telecommunications;computer science;engineering;base station;resource management;time division multiple access;computer network	Embedded	32.5229765230434	90.63267136265996	181568
