id	title	keywords	abstract	entities	authors	year	journal	doi	fos	area	x	y	ix
c8e91384473133bab230f25612234bbe2ade294a	use of order sets in inpatient computerized provider order entry systems: a comparative analysis of usage patterns at seven sites	medical order entry systems;inpatients;clinical decision support;humans;user computer interface;safety management;physician s practice patterns;systems integration;electronic health records;order sets;computerized physician order entry system	BACKGROUND Many computerized provider order entry (CPOE) systems include the ability to create electronic order sets: collections of clinically related orders grouped by purpose. Order sets promise to make CPOE systems more efficient, improve care quality and increase adherence to evidence-based guidelines. However, the development and implementation of order sets can be expensive and time-consuming and limited literature exists about their utilization.   METHODS Based on analysis of order set usage logs from a diverse purposive sample of seven sites with commercially and internally developed inpatient CPOE systems, we developed an original order set classification system. Order sets were categorized across seven non-mutually exclusive axes: admission/discharge/transfer (ADT), perioperative, condition-specific, task-specific, service-specific, convenience, and personal. In addition, 731 unique subtypes were identified within five axes: four in ADT (S=4), three in perioperative, 144 in condition-specific, 513 in task-specific, and 67 in service-specific.   RESULTS Order sets (n=1914) were used a total of 676,142 times at the participating sites during a one-year period. ADT and perioperative order sets accounted for 27.6% and 24.2% of usage respectively. Peripartum/labor, chest pain/acute coronary syndrome/myocardial infarction and diabetes order sets accounted for 51.6% of condition-specific usage. Insulin, angiography/angioplasty and arthroplasty order sets accounted for 19.4% of task-specific usage. Emergency/trauma, obstetrics/gynecology/labor delivery and anesthesia accounted for 32.4% of service-specific usage. Overall, the top 20% of order sets accounted for 90.1% of all usage. Additional salient patterns are identified and described.   CONCLUSION We observed recurrent patterns in order set usage across multiple sites as well as meaningful variations between sites. Vendors and institutional developers should identify high-value order set types through concrete data analysis in order to optimize the resources devoted to development and implementation.		Adam Wright;Joshua Feblowitz;Justine E. Pang;James D. Carpenter;Michael Krall;Blackford Middleton;Dean F. Sittig	2012	International journal of medical informatics	10.1016/j.ijmedinf.2012.04.003	clinical decision support system;medicine;computer science;artificial intelligence;nursing;data mining;law;system integration	HCI	-55.412590475156776	-67.78554487656801	136909
0721196ae3c45625281baf9ed42ac7639ceb0b7c	the capture and use of detailed process information in the dialogix system for structured web-based interactions	epidemiology;internet;data collection;questionnaires	Information gathering tools, such as questionnaires, surveys, and structured interviews, are ubiquitously used in evaluating patients and systems. Despite their common use, there is a desperate need for better questionnaires in medical research and epidemiology, and an infrastructure that lets them be publicly scrutinized. Unfortunately, there has been no common platform that supports the deployment of arbitrary information gathering tools. Some psychiatric diagnostic interviews and epidemiological trials require sophisticated structured interviews containing complex branching logic, dynamic phrase composition, and multiple languages. The Dialogix system was developed to meet this need and facilitate the rapid definition and web-based deployment of structured human-computer interactions. This paper describes the content and process-related information captured by Dialogix, and how that information has been used in the development and deployment of two large epidemiological studies.	common platform;deploy;epidemiology;human–computer interaction;interviews;mental disorders;patients;programming languages;web application	Thomas M. White;Michael J. Hauan	2001	Proceedings. AMIA Symposium		data collection;the internet;software deployment;structured interview;web application;medical research;branching (version control);data mining;software;computer science	HCI	-52.15286947961301	-66.65186887838469	138225
049688f9704e8a6e7010f354eeadcf2a476d8b06	htnsystem: hypertension information extraction system for unstructured clinical notes		Hypertension (HTN) relevant information has great application potential in cohort discovery and building predictive models for prevention and surveillance. Unfortunately most of this valuable patient information is buried in the form of unstructured clinical notes. In this study we present HTN information extraction system called HTNSystem which is capable of extracting mentions of HTN and inferring HTN from BP lab values. HTNSystem is a rule based system which implements MetaMap as a core component together with custom built BP value extractor and post processing components. It is evaluated on a corpus of 514 clinical notes (82.92% F-measure). HTNSystem is distributed as an open source command line tool available at https://github.com/TCRNBioinformatics/HTNSystem .	information extraction	Jitendra Jonnagaddala;Siaw-Teng Liaw;Pradeep Kumar Ray;Manish Kumar;Hong-Jie Dai	2014		10.1007/978-3-319-13987-6_21	medicine;data science;data mining;database	NLP	-49.819354027652814	-68.87937733830975	138795
c4f94f04a29de8168b819e7264a3bee2681b9cc5	portals to wonderland: health portals lead to confusing information about the effects of health care	health informatics;systematic review;web pages;information access;information services;information systems and communication service;delivery of health care;internet;health information;management of computing and information systems;humans;review literature as topic;information storage and retrieval;health care	BACKGROUND The Internet offers a seemingly endless amount of health information of varying quality. Health portals, which provide entry points to quality-controlled collections of websites, have been hailed as a solution to this problem. The objective of this study is to assess the extent to which government-run health portals provide access to relevant, valid and understandable information about the effects of health care.   METHODS We selected eight clinically relevant questions for which there was a systematic review, searched four portals for answers, and compared the answers we found to the results of the systematic reviews.   RESULTS Our searches resulted in 3400 hits, 155 of which mentioned both the condition and the intervention in one of the eight questions. Sixty-three of the 155 web pages did not give any information about the effect of the intervention. Seventy-seven qualitatively described the effects of the intervention. Twenty-six of these had information that was too unclear to be categorised; 15 were not consistent with the systematic review; and 36 were consistent with the review, but usually did not mention what happens without the intervention, what outcomes have been measured or when they were measured. Fifteen web pages quantitatively described effects. Four of these were abstracts from the systematic review, nine had information that was incomplete and potentially misleading because of a lack of information about people not receiving the intervention and the length of follow-up; one had information that was consistent with the review, but only referred to three trials whereas the review included six; and one was consistent with the review.   CONCLUSION Information accessible through health portals is unlikely to be based on systematic reviews and is often unclear, incomplete and misleading. Portals are only as good as the websites they lead to. Investments in national health portals are unlikely to benefit consumers without investments in the production and maintenance of relevant, valid and understandable information to which the portals lead.	abstract summary;ambient occlusion;cg (programming language);cochrane library;collections (publication);entry point;expectation propagation;health care;information retrieval;internet;manuscripts;page (document);partial;portals;review [publication type];systematic review;weakness;web page;citation;interest	Claire Glenton;Elizabeth J. Paulsen;Andrew D. Oxman	2005	BMC Medical Informatics and Decision Making	10.1186/1472-6947-5-7	health informatics;clinical decision support system;the internet;systematic review;medicine;hrhis;nursing;web page;data mining;world wide web;information retrieval;information system;health care	HCI	-58.51515693465318	-67.70380411432363	139284
29b7526d4aed949980c88c68427ae107ec90c2f2	analysis of temporal abstraction in medical databases	clinical research	Physicians and medical decision-support applications, such as for diagnosis, therapy, monitoring, quality assessment, and clinical research, reason about patients in terms of abstract, clinically meaningful concepts, typically over significant time periods. Clinical databases, however, store only raw, time-stamped data. Thus, there is a need to bridge this gap. We introduce the Temporal Abstraction Language (TAR) which enables specification of abstract relations involving raw data and abstract concepts, and use it for defining typical medical abstraction patterns. For each pattern we further analyze finiteness properties of the answer set.	database;decision support system;stable model semantics	Mira Balaban;David Boaz;Yuval Shahar	2003			data science;raw data;data mining;clinical research;database;abstraction;computer science	AI	-52.26504076544367	-67.54978454145304	140043
5de770ac53af3a6c1c4ec6eb1a437b5afd77cd4a	integrating va's ndf-rt drug terminology with pharmgkb: preliminary results		Biomedical terminology and vocabulary standards play an important role in enabling consistent, comparable, and meaningful sharing of data within and across institutional boundaries, as well as ensuring semantic interoperability. The Veterans Affairs (VA) National Drug File Reference Terminology (NDF-RT) is a federally recommended standardized terminology resource encompassing medications, ingredients, and a hierarchy for high-level drug classes. In this study, we investigate the drug-disease relationships in NDF-RT and determine how PharmGKB can be leveraged to augment NDF-RT, and vice-versa. Our preliminary results indicate that with additional curation and analyses, information contained in both knowledge resources can be mutually integrated.	class;contain (action);digital curation;high- and low-level;nomenclature;pharmgkb;semantic interoperability;united states department of veterans affairs;vocabulary;standards characteristics	Jyotishman Pathak;Laura C. Weiss;Matthew J. Durski;Qian Zhu;Robert R. Freimuth;Christopher G. Chute	2012	Pacific Symposium on Biocomputing. Pacific Symposium on Biocomputing		semantic interoperability;drug;veterans affairs;pharmgkb;data mining;terminology;vocabulary;hierarchy;biology	Metrics	-50.50239934054266	-67.08510594246367	140567
5f76e9b0ddea024014dbd203275624272da9281e	analysis of annotated data models for improving data quality	cdisc odm;natural language processing;semantic interoperability;umls	The public Medical Data Models (MDM) portal with more than 9.000 annotated forms from clinical trials and other sources provides many research opportunities for the medical informatics community. It is mainly used to address the problem of heterogeneity by searching, mediating, reusing, and assessing data models, e. g. the semi-interactive curation of core data records in a special domain. Furthermore, it can be used as a benchmark for evaluating algorithms that create, transform, annotate, and analyse structured patient data. Using CDISC ODM for syntactically representing all data models in the MDM portal, there are semi-automatically added UMLS CUIs at several ODM levels like ItemGroupDef, ItemDef, or CodeList item. This can improve the interpretability and processability of the received information, but only if the coded information is correct and reliable. This raises the question how to assure that semantically similar datasets are also processed and classified similarly. In this work, a (semi-)automatic approach to analyse and assess items, questions, and data elements in clinical studies is described. The approach uses a hybrid evaluation process to rate and propose semantic annotations for under-specified trial items. The evaluation algorithm operates with the commonly used NLM MetaMap to provide UMLS support and corpus-based proposal algorithms to link datasets from the provided CDISC ODM item pool.		Hannes Ulrich;Ann-Kristin Kock-Schoppenhauer;Björn Andersen;Josef Ingenerf	2017	Studies in health technology and informatics	10.3233/978-1-61499-808-2-190	data modeling;data mining;data quality;computer science	DB	-49.31711583145365	-67.1698544583063	140999
e81eb61942a71aa577ade2a5d46d1a480d2b4804	does domain knowledge matter for assertion annotation in clinical texts?	natural language processing assertion annotation clinical texts statistical difference clinical domain knowledge;information retrieval;text analysis;medical computing;statistical analysis;medical diagnostic imaging medical services standards biomedical informatics educational institutions natural language processing;natural language processing;text analysis information retrieval medical computing natural language processing statistical analysis	This pilot study aims to determine how well subjects annotate assertions about problem mentions in clinical text and determine if a statistical difference exists between subjects with and without clinical domain knowledge.		Danielle L. Mowery;Pamela W. Jordan;Janyce Wiebe;Wendy W. Chapman;Lin Liu	2012	2012 IEEE Second International Conference on Healthcare Informatics, Imaging and Systems Biology	10.1109/HISB.2012.61	natural language processing;language identification;question answering;computer science;data science;temporal annotation;information extraction;information retrieval	Robotics	-48.931665759014564	-68.5665198467261	141156
6232b4275edbf76963a43c30e1aac77105fb1f7d	mining typical order sequences from ehr for building clinical pathways		Clinical pathway is one of the key tools for providing standardized treatment for patients. However, building a new pathway from scratch is a time-consuming task for medical staffs, as it involves optimization of the treatment plan while preserving operability in a hospital. In this paper, we present a method for mining typical treatment processes from electric health records (EHRs) for facilitating creation of new pathways by providing base blocks. Firstly, we constitute occurrence and transition frequency matrices of clinical orders using all cases. Next, we compute the typicalness index for each order sequence based on the occurrence and transition frequencies. After that we perform clustering of all cases according to the similarity defined on the typicalness index. Experimental results on two disease datasets demonstrate that the method is capable of producing clusters that reflect differences of treatment processes without a priori information about order types.		Shoji Hirano;Shusaku Tsumoto	2014		10.1007/978-3-319-13186-3_5	bioinformatics;data mining	Crypto	-52.84652001970451	-68.48797384380279	141179
d30decdd38a31476a01524b040d69687ea46f934	a computational framework for converting textual clinical diagnostic criteria into the quality data model	ctakes;quality data model;diagnostic criteria;conditional random fields;natural language processing	BACKGROUND Constructing standard and computable clinical diagnostic criteria is an important but challenging research field in the clinical informatics community. The Quality Data Model (QDM) is emerging as a promising information model for standardizing clinical diagnostic criteria.   OBJECTIVE To develop and evaluate automated methods for converting textual clinical diagnostic criteria in a structured format using QDM.   METHODS We used a clinical Natural Language Processing (NLP) tool known as cTAKES to detect sentences and annotate events in diagnostic criteria. We developed a rule-based approach for assigning the QDM datatype(s) to an individual criterion, whereas we invoked a machine learning algorithm based on the Conditional Random Fields (CRFs) for annotating attributes belonging to each particular QDM datatype. We manually developed an annotated corpus as the gold standard and used standard measures (precision, recall and f-measure) for the performance evaluation.   RESULTS We harvested 267 individual criteria with the datatypes of Symptom and Laboratory Test from 63 textual diagnostic criteria. We manually annotated attributes and values in 142 individual Laboratory Test criteria. The average performance of our rule-based approach was 0.84 of precision, 0.86 of recall, and 0.85 of f-measure; the performance of CRFs-based classification was 0.95 of precision, 0.88 of recall and 0.91 of f-measure. We also implemented a web-based tool that automatically translates textual Laboratory Test criteria into the QDM XML template format. The results indicated that our approaches leveraging cTAKES and CRFs are effective in facilitating diagnostic criteria annotation and classification.   CONCLUSION Our NLP-based computational framework is a feasible and useful solution in developing diagnostic criteria representation and computerization.		Na Hong;Dingcheng Li;Yue Yu;Qiongying Xiu;Hongfang Liu;Guoqian Jiang	2016	Journal of biomedical informatics	10.1016/j.jbi.2016.07.016	natural language processing;computer science;bioinformatics;artificial intelligence;data science;machine learning;data mining;database;conditional random field;information retrieval	NLP	-50.17779661319897	-68.11521987973197	141839
ab14a499e4235e8a2e55413cbff6d6d2f0f9556e	emerse: the electronic medical record search engine	biological patents;biomedical journals;text mining;europe pubmed central;citation search;citation networks;medical records systems computerized;research articles;abstracts;open access;life sciences;clinical guidelines;full text;information storage and retrieval;rest apis;orcids;europe pmc;biomedical research;bioinformatics;literature search	EMERSE (The Electronic Medical Record Search Engine) is an intuitive, powerful search engine for free-text documents in the electronic medical record. It offers multiple options for creating complex search queries yet has an interface that is easy enough to be used by those with minimal computer experience. EMERSE is ideal for retrospective chart reviews and data abstraction and may have potential for clinical care as well.	abstraction (software engineering);academic medical centers;bug search subtest (wppsi-iv);drug utilization review;electronic health records;electronics, medical;medical records systems, computerized;web search engine;web search query;search a word	David A. Hanauer	2006	AMIA ... Annual Symposium proceedings. AMIA Symposium		computer science;data science;data mining;information retrieval	Arch	-51.16407350620962	-66.36678220963887	141896
dec86f9dae8621a10b25ca59d4da7876c64ca7d6	indicateurs en biologie et en imagerie au sein des systèmes d'information de santé		Introduction: Health information system (HIS) has been widely studied in order to evaluate their effectiveness. However the results are heterogeneous and the methods are rarely adapted to the french health system. This work aims at developing a tool for HIS description and listing indicators frequently used to assess its benefits in the fields of laboratory and radiology. Those tools will allow inter HIS comparison. Methods: Processes were finely described in a university hospital in order to create a processes description tool. A short literature review allowed us to list the most commonly used indicators in the field of research concerning the HIS benefits. Results: Articles longs des 15es Journées francophones d’informatique médicale, JFIM 2014, pages 127–138 Fès, Maroc, 12–13 juin 2014 The process describing tool was successfully used by four hospitals to describe their HIS. Several indicators have been selected in the international literature and some of them have been modified to describe more precisely the sub processes. Conclusion: All the items for the evaluation of the benefits of the HIS are ready. Mots clés : Dossiers médicaux électroniques ; Systèmes d'information hospitaliers ; Systèmes d'information de laboratoire d'analyses médicales ; Systèmes d'information de radiologie ; Indicateurs qualité santé.	information system;radiology	Mher B. Joulakian;Nicolas Griffon;Matthieu Schuers;Éric Lepage;Céline Savoye-Collet;Soumaya Skalli;Philippe Massari;Stéfan Jacques Darmoni	2014				SE	-55.359311001558616	-69.91965433247032	142437
d0fcb72749d4a2ae6a7491dc7ee54071d74d7f02	segmenting and merging domain-specific ontology modules for clinical informatics	snomed ct;segment;module;ontology;domain specificity;clinical informatics	A significant set of challenges to the use of large, source ontologies in the medical domain include: automated translation, customization of source ontologies, and performance issues associated with the use of logical reasoning systems to interpret the meaning of a domain captured in a formal knowledge representation. SNOMED-CT and FMA are two reference ontologies that cover much of the domain of clinical informatics and motivate a better means for re-use. In this paper, we present a method for segmenting and merging modules from these ontologies for a specific domain that preserve the meaning of the anatomy terms they have in	ct scan;fma instruction set;informatics;knowledge representation and reasoning;machine translation;ontology (information science);systematized nomenclature of medicine;upper ontology	Chimezie Ogbuji;Sivaram Arabandi;Songmao Zhang;Guo-Qiang Zhang	2010		10.3233/978-1-60750-535-8-414	module;idef5;computer science;knowledge management;data science;ontology;snomed ct;data mining	AI	-49.143061224189026	-67.41960233076185	142508
fef87417cf0939618e70db7d54b240b700900596	an integrated electronic medical record system (iemrs) with decision support capability in medical prescription	electronic medical records;information technology;data mining;decision support systems;medical prescriptions;hong kong;journal magazine article	Purpose: This study presents how a clinical decision support system can help in prescription and knowledge acquisition processes. Design/methodology/approach: An integrated Electronic Medical Records System (iEMRS) is designed to enhance the decision support quality in prescription. Findings: By evaluating the system performance through 135 prescription records collected from a Hong Kong medical organization, iEMRS shows a satisfactory result in suggesting medicines that is properly the same as the decisions made by the physicians. Originality/value: Compared with the static clinical guidelines built (manually) in the traditional clinical decision support system, knowledge in iEMRS is generated by the knowledge discovery result from professional experiences of various physicians and patient histories, which are more dynamic in nature. A treatment algorithm, designed in data mining technique, is introduced to improve information management in medical organization by integration of decision support capability and EMRS, and supplement the deficiencies of traditional clinical decision support system.	clinical decision support system;data mining;experience;information management;knowledge acquisition;medical algorithm	Jacky S. L. Ting;Andrew W. H. Ip;Albert H. C. Tsang;George T. S. Ho	2012	J. Systems and IT	10.1108/13287261211255347	clinical decision support system;decision support system;computer science;knowledge management;data science;data mining;docle;information technology;medical algorithm	ML	-54.81387052034619	-66.41260581460956	143154
