id	title	keywords	abstract	entities	authors	year	journal	doi	fos	area	x	y	ix
90f813474cf612ff5eee5d1f2b8c92f269d426d2	a systematic review of the types and causes of prescribing errors generated from using computerized provider order entry systems in primary and secondary care	clinical decision support;medication errors;computerized provider order entry;patient safety;alerts	Objective To understand the different types and causes of prescribing errors associated with computerized provider order entry (CPOE) systems, and recommend improvements in these systems.   Materials and Methods We conducted a systematic review of the literature published between January 2004 and June 2015 using three large databases: the Cumulative Index to Nursing and Allied Health Literature, Embase, and Medline. Studies that reported qualitative data about the types and causes of these errors were included. A narrative synthesis of all eligible studies was undertaken.   Results A total of 1185 publications were identified, of which 34 were included in the review. We identified 8 key themes associated with CPOE-related prescribing errors: computer screen display, drop-down menus and auto-population, wording, default settings, nonintuitive or inflexible ordering, repeat prescriptions and automated processes, users' work processes, and clinical decision support systems. Displaying an incomplete list of a patient's medications on the computer screen often contributed to prescribing errors. Lack of system flexibility resulted in users employing error-prone workarounds, such as the addition of contradictory free-text comments. Users' misinterpretations of how text was presented in CPOE systems were also linked with the occurrence of prescribing errors.   Discussion and Conclusions Human factors design is important to reduce error rates. Drop-down menus should be designed with safeguards to decrease the likelihood of selection errors. Development of more sophisticated clinical decision support, which can perform checks on free-text, may also prevent errors. Further research is needed to ensure that systems minimize error likelihood and meet users' workflow expectations.		Clare L. Brown;Helen L. Mulcaster;Katherine L. Triffitt;Dean F. Sittig;Joan S. Ash;Katie Reygate;Andrew K. Husband;David W. Bates;Sarah Patricia Slight	2016	Journal of the American Medical Informatics Association : JAMIA	10.1093/jamia/ocw119	clinical decision support system;medicine;computer science;knowledge management;artificial intelligence;data mining	HCI	-59.73421579970463	-66.38502238652393	174456
3055f55f1b19d0580d7bcae60b3a63d9595110b0	ontological analysis of snomed ct	health informatics;disease;information systems and communication service;terminology as topic;snomed ct;formal reasoning;management of computing and information systems;hungary;systematized nomenclature of medicine;evaluation studies as topic;point of view;systems integration;knowledge engineering	BACKGROUND SNOMED CT is the most comprehensive medical terminology. However, its use for intelligent services based on formal reasoning is questionable.   METHODS The analysis of the structure of SNOMED CT is based on the formal top-level ontology DOLCE.   RESULTS The analysis revealed several ontological and knowledge-engineering errors, the most important are errors in the hierarchy (mostly from an ontological point of view, but also regarding medical aspects) and the mixing of subsumption relations with other types (mostly 'part of').   CONCLUSION The found errors impede formal reasoning. The paper presents a possible way to correct these problems.	ct scan;knowledge engineering;pet/ct scan;reason;subsumption architecture;systematized nomenclature of medicine clinical terms;upper ontology;x-ray computed tomography	Gergely Héja;György Surján;Péter Varga	2008	BMC Medical Informatics and Decision Making	10.1186/1472-6947-8-S1-S8	medcin;health informatics;medicine;systematized nomenclature of medicine;computer science;knowledge management;nursing;knowledge engineering;snomed ct;data mining;information retrieval;system integration	AI	-51.19249817191115	-67.46862115697624	175021
1b82b434004754659044831f041d17873c240108	tracing the formalization steps of textual guidelines.	clinical guideline;authoring tool	This paper presents a new guideline authoring tool, called Guideline Markup Tool (GMT). It proposes two useful features, which are missing in existing tools. First, it facilitates the translation of a free-text guideline into a formal representation, providing special XML macros. Second, it can be used to create links between the original guideline and its formal representation. Therefore, the GMT eases the implementation of clinical guidelines in a formal representation, which can be used in monitoring and therapy planning systems.	xml	Peter Votruba;Silvia Miksch;Andreas Seyfang;Robert Kosara	2004	Studies in health technology and informatics	10.3233/978-1-60750-944-8-172	knowledge management;software engineering;data mining	HCI	-51.55091148826048	-67.08551254200135	175425
72e325d6d55c4d52fbcac0ed7eb5b3da40c97016	understanding and preventing wrong-patient electronic orders: a randomized controlled trial		OBJECTIVE To evaluate systems for estimating and preventing wrong-patient electronic orders in computerized physician order entry systems with a two-phase study.   MATERIALS AND METHODS In phase 1, from May to August 2010, the effectiveness of a 'retract-and-reorder' measurement tool was assessed that identified orders placed on a patient, promptly retracted, and then reordered by the same provider on a different patient as a marker for wrong-patient electronic orders. This tool was then used to estimate the frequency of wrong-patient electronic orders in four hospitals in 2009. In phase 2, from December 2010 to June 2011, a three-armed randomized controlled trial was conducted to evaluate the efficacy of two distinct interventions aimed at preventing these errors by reverifying patient identification: an 'ID-verify alert', and an 'ID-reentry function'.   RESULTS The retract-and-reorder measurement tool effectively identified 170 of 223 events as wrong-patient electronic orders, resulting in a positive predictive value of 76.2% (95% CI 70.6% to 81.9%). Using this tool it was estimated that 5246 electronic orders were placed on wrong patients in 2009. In phase 2, 901 776 ordering sessions among 4028 providers were examined. Compared with control, the ID-verify alert reduced the odds of a retract-and-reorder event (OR 0.84, 95% CI 0.72 to 0.98), but the ID-reentry function reduced the odds by a larger magnitude (OR 0.60, 95% CI 0.50 to 0.71).   DISCUSSION AND CONCLUSION Wrong-patient electronic orders occur frequently with computerized provider order entry systems, and electronic interventions can reduce the risk of these errors occurring.	alert:type:point in time:^patient:nominal;estimated;id-wsf;large;order management system;patients;positive predictive value of diagnostic test;randomized algorithm;two-phase commit protocol;negative resolution <retracted>;orders - hl7publishingdomain	Jason S. Adelman;Gary E. Kalkut;Clyde B. Schechter;Jeffrey M. Weiss;Matthew A. Berger;Stan H. Reissman;Hillel W. Cohen;Stephen J. Lorenzen;Daniel A. Burack;William N. Southern	2013	Journal of the American Medical Informatics Association : JAMIA	10.1136/amiajnl-2012-001055	medicine;data mining	AI	-59.86023978491174	-66.55097678758715	177701
07277a1539c1d39207c1c3f75f267fbabbde32e0	toward a veterinary informatics research agenda: an analysis of the pubmed-indexed literature	medical informatics;research agenda;medical subject headings;indexation;veterinary medicine;medical informatic;subject headings;information storage and retrieval;pubmed;veterinary	PURPOSE Veterinary medicine and human health are inextricably intertwined. Effective tracking of veterinary information - veterinary informatics - impacts not only veterinary medicine, but also public health, informatics research, and clinical care. However, veterinary informatics has received little attention from the general biomedical informatics community.   METHODS To identify both active and under-researched areas in veterinary informatics, we retrieved Medical Subject Heading (MeSH) descriptors for veterinary informatics-related citations and analyzed them by topic category, animal type, and journal.   RESULTS We found that the categories of veterinary informatics with the most growth were information/bibliographical retrieval, hardware/programming, and radiology/imaging. Less than two articles per year were published in the areas of computerized veterinary medical records, clinical decision support, standards, and controlled vocabularies. Veterinary informatics articles primarily address production animals such as cattle and sheep, and companion animals such as cats and dogs. Six journals account for 31% of the veterinary informatics literature, 35 journals account for 66%.   CONCLUSIONS Veterinary informatics remains an embryonic field with relatively few publications. With the exception of radiology/imaging, published articles are primarily focused on non-clinical areas such as hardware/programming and information retrieval. There are very few publications on controlled vocabularies, standards, methodologies for integrating disparate systems, computerized medical records, clinical decision support systems, and system usability. The lack of publications in these areas may hamper efforts to collect and track animal health data at a time when such data are potentially critical to human health.		Kimberly A. Smith-Akin;Charles F. Bearden;Stephen T. Pittenger;Elmer V. Bernstam	2007	International journal of medical informatics	10.1016/j.ijmedinf.2006.02.009	health administration informatics;health informatics;public health informatics;controlled vocabulary;medicine;pathology;data science	HCI	-54.66242653199795	-68.78543266292964	177811
58250fdc7515fb4827353c19c81d0f3a8f2e028a	research paper: an experiment comparing lexical and statistical methods for extracting mesh terms from clinical free text	statistical method;indexation;hybrid system;electronic medical record	OBJECTIVE A primary goal of the University of Pittsburgh's 1990-94 UMLS-sponsored effort was to develop and evaluate PostDoc (a lexical indexing system) and Pindex (a statistical indexing system) comparatively, and then in combination as a hybrid system. Each system takes as input a portion of the free text from a narrative part of a patient's electronic medical record and returns a list of suggested MeSH terms to use in formulating a Medline search that includes concepts in the text. This paper describes the systems and reports an evaluation. The intent is for this evaluation to serve as a step toward the eventual realization of systems that assist healthcare personnel in using the electronic medical record to construct patient-specific searches of Medline.   DESIGN The authors tested the performances of PostDoc, Pindex, and a hybrid system, using text taken from randomly selected clinical records, which were stratified to include six radiology reports, six pathology reports, and six discharge summaries. They identified concepts in the clinical records that might conceivably be used in performing a patient-specific Medline search. Each system was given the free text of each record as an input. The extent to which a system-derived list of MeSH terms captured the relevant concepts in these documents was determined based on blinded assessments by the authors.   RESULTS PostDoc output a mean of approximately 19 MeSH terms per report, which included about 40% of the relevant report concepts. Pindex output a mean of approximately 57 terms per report and captured about 45% of the relevant report concepts. A hybrid system captured approximately 66% of the relevant concepts and output about 71 terms per report.   CONCLUSION The outputs of PostDoc and Pindex are complementary in capturing MeSH terms from clinical free text. The results suggest possible approaches to reduce the number of terms output while maintaining the percentage of terms captured, including the use of UMLS semantic types to constrain the output list to contain only clinically relevant MeSH terms.	cell hybridization;discharger;electronic health records;electronics, medical;evaluation procedure;hybrid system;indexes;medline;medical records systems, computerized;patients;performance;radiology;randomness;unified medical language system;pathology report	Gregory F. Cooper;Randolph A. Miller	1998	Journal of the American Medical Informatics Association : JAMIA	10.1136/jamia.1998.0050062	natural language processing;medicine;computer science;artificial intelligence;data science;machine learning;data mining;database;information retrieval;statistics;hybrid system	Web+IR	-48.87484980022719	-68.69847972705475	179939
44ef9aa9a561c0196b7689eb2fe411200baf1e57	developing a knowledge base to support the annotation of ultrasound images of ectopic pregnancy	data mining and knowledge discovery;computational biology bioinformatics;ectopic pregnancy;algorithms;combinatorial libraries;computer appl in life sciences;application ontology;bioinformatics;knowledge base	BACKGROUND Ectopic pregnancy is a frequent early complication of pregnancy associated with significant rates of morbidly and mortality. The positive diagnosis of this condition is established through transvaginal ultrasound scanning. The timing of diagnosis depends on the operator expertise in identifying the signs of ectopic pregnancy, which varies dramatically among medical staff with heterogeneous training. Developing decision support systems in this context is expected to improve the identification of these signs and subsequently improve the quality of care. In this article, we present a new knowledge base for ectopic pregnancy, and we demonstrate its use on the annotation of clinical images.   RESULTS The knowledge base is supported by an application ontology, which provides the taxonomy, the vocabulary and definitions for 24 types and 81 signs of ectopic pregnancy, 484 anatomical structures and 32 technical elements for image acquisition. The knowledge base provides a sign-centric model of the domain, with the relations of signs to ectopic pregnancy types, anatomical structures and the technical elements. The evaluation of the ontology and knowledge base demonstrated a positive feedback from a panel of 17 medical users. Leveraging these semantic resources, we developed an application for the annotation of ultrasound images. Using this application, 6 operators achieved a precision of 0.83 for the identification of signs in 208 ultrasound images corresponding to 35 clinical cases of ectopic pregnancy.   CONCLUSIONS We developed a new ectopic pregnancy knowledge base for the annotation of ultrasound images. The use of this knowledge base for the annotation of ultrasound images of ectopic pregnancy showed promising results from the perspective of clinical decision support system development. Other gynecological disorders and fetal anomalies may benefit from our approach.	anatomic structures;annotation;cns disorder;clinical decision support system;decision support systems, clinical;ectopic pregnancy;female genital diseases;fetal diseases;genetic heterogeneity;gynecology;knowledge base;medical ultrasound;positive feedback;pregnancy complications;taxonomy;ultrasonography;vocabulary;transvaginal ultrasound	Ferdinand Dhombres;Paul Maurice;Stéphanie Friszer;Lucie Guilbaud;Nathalie Lelong;Babak Khoshnood;Jean Charlet;Nicolas Perrot;Eric Jauniaux;Davor Jurkovic;Jean-Marie Jouannic	2017		10.1186/s13326-017-0117-1	data mining;clinical decision support system;knowledge base;computer science;decision support system;ontology;ectopic pregnancy;pregnancy;annotation;vocabulary	NLP	-55.28320255325071	-67.76219434642647	180839
17942439bcd62542809a913e66195674d3ab2184	experiments to create ontology-based disease models for diabetic retinopathy from different biomedical resources		According to the World Health Organisation diabetic retinopathy (DR) is a high priority eye disease. This paper investigates a method for creating disease models for DR using the ontologies BioTopLite2 and SNOMED CT and different biomedical resources: 1) consultation notes from anonymised electronic health records; 2) the clinical practice guideline for DR by the American Academy of Ophthalmology; 3) the BMJ Best Practice for DR; and 4) neural language models from Deep Learning (CBOW and Skip-gram) using a 14M PubMed dataset. As SNOMED CT does not contain disease models, the novelty of this study is twofold: a) evaluation of the utility of CBOW and Skip-gram for obtaining DR disease models from the biomedical literature; and b) the proposed method for building ontology-based disease models exploiting SNOMED CT reference sets. In our method, we first propose a representation of SNOMED CT reference sets for DR in OWL by extracting upper modules from SNOMED CT. Secondly, we use content ontology design patterns with BioTopLite2 and SNOMED CT that act as templates to semantically represent clinical content in OWL. We report on the effectiveness of the method.	academy;best practice;deep learning;design pattern;emoticon;language model;ontology (information science);pubmed;skip list;systematized nomenclature of medicine	Mercedes Argüello Casteleiro;Catalina Martínez-Costa;Jose Julio Des Diz;Maria Jesus Fernandez Prieto;Chris Wroe;Diego Maseda-Fernandez;George Demetriou;Goran Nenadic;John A. Keane;Stefan Schulz;Robert Stevens	2017			ontology;diabetic retinopathy;disease;computer science;bioinformatics	Web+IR	-50.17998225195233	-67.25251994368776	180876
9f7dec26c10a361dbb9352cf4253a74eac315d1d	mapping equivalence of german emergency department medical record concepts with snomed ct after implementation with hl7 cda	emergency medicine;health level seven;logical observation identifiers names and codes;snomed ct;health information exchange	INTRODUCTION The German Emergency Department Medical Record (GEDMR) was created by medical domain experts and healthcare providers providing a dataset as well as a form. The trauma module of GEDMR was syntactically standardized using HL7 CDA and semantically standardized using different terminologies including SNOMED CT, LOINC and proprietary coding systems. This study depicts the mapping accuracy with aforementioned syntactical and semantical standards in general and especially the content coverage of SNOMED CT.   METHODS The specification of GEDMR (V2015.1) concepts with eHealth-standards HL7-CDA, LOINC, SNOMED CT was analyzed. A content coverage assessment was made using the ISO TR 12300 rating scheme, following descriptive analysis.   RESULTS The trauma module of GEDMR contains 489 concepts, with 202 concepts expressed via HL7 CDA structure. It is possible to code 89 % of the remaining concepts via SNOMED CT. 79 % provide an advanced level of semantic interoperability, as they represent the source information either lexically or as an approved synonym.   DISCUSSION The terminology binding problem is relevant when combining different standards for syntactic and semantic interoperability with best practice documents and reference specifications providing guidance. A national license and extension for SNOMED CT in Germany as well as an ongoing effort in contributing to the International Version of SNOMED CT would be necessary to gain full coverage for concepts in German Emergency Medicine and to leverage the associated standardization process.	.cda file;best practice;binding problem;ct scan;congenital dyserythropoietic anemia;eighty nine;health level 7;health level seven;isoproterenol;medical records, problem-oriented;name binding;pet/ct scan;semantic interoperability;seventy nine;silo (dataset);specification;systematized nomenclature of medicine clinical terms;turing completeness;standards characteristics	Dominik Brammen;Heike Dewenter;Kai U. Heitmann;Volker Thiemann;Raphael W. Majeed;Felix Walcher;Rainer Röhrig;Sylvia Thun	2017	Studies in health technology and informatics	10.3233/978-1-61499-808-2-175	equivalence (measure theory);medcin;medical record;emergency department;emergency medicine;medicine;german;snomed ct	AI	-50.90495666748627	-67.3732573274008	182310
71975f2a27e010970e43e5d61d1d4ae32af4a367	research paper: the utility of adding retrospective medication profiling to computerized provider order entry in an ambulatory care population	study design;adverse drug event;drug utilization;research paper;negative binomial regression;usual care;computerized provider order entry;drug interaction;adverse drug reaction;ambulatory care	BACKGROUND We assessed whether medication safety improved when a medication profiling program was added to a computerized provider order entry system.   DESIGN Between June 2001 and January 2002 we profiled outpatients with potential prescribing errors using computerized retrospective drug utilization software. We focused primarily on drug interactions. Patients were randomly assigned either to Provider Feedback or to Usual Care. Subsequent adverse drug event (ADE) incidence and other outcomes, including ADE preventability and severity, occurring up to 1 year following the last profiling date were evaluated retrospectively by a pharmacist blinded to patient assignment.   MEASUREMENTS Data were abstracted using a study-designed instrument. An ADE was defined by an Adverse Drug Reaction Probability scale score of 1 or more. Statistical analyses included negative binomial regression for comparing ADE incidence.   RESULTS Of 913 patients in the analytic sample, 371 patients (41%) had one or more ADEs. Incidence, by individual, was not significantly different between Usual Care and Provider Feedback groups (37% vs. 45%; p = 0.06; Coefficient, 0.19; 95% CI: -0.008, 0.390). ADE severity was also similar. For example, 51% of ADEs in the Usual Care and 58% in the Provider Feedback groups involved symptoms that were not serious (95% CI for the difference, -15%, 2%). Finally, ADE preventability did not differ. For example, 16% in the Usual Care group and 17% in the Provider Feedback group had an associated warning (95% CI for the difference, -7 to 5%; p = 0.79).   CONCLUSION Medications safety did not improve with the addition of a medication profiling program to an electronic prescribing system.	adverse reaction to drug;blinded;coefficient;dav regimen;drug utilization;incidence matrix;interaction;negative base;order management system;outpatients;patients;personnameuse - assigned;profiling (computer programming);randomness	Peter A. Glassman;Pamela S. Belperio;Andrew Lanto;Barbara Simon;Robert Valuck;Jeffrey Sayers;Martin Lee	2007	Journal of the American Medical Informatics Association : JAMIA	10.1197/jamia.M2313	medicine;ambulatory care;medical emergency;negative binomial distribution;drug interaction;clinical study design;statistics	ML	-60.39547335798939	-66.35313496193916	183473
166ac0ca40125528eb7fd581de2fde8990e813d1	building medical ontologies based on terminology extraction from texts: an experimentation in pneumology	ontology;terminology extraction;pneumology.;knowledge engineering;differential semantics;natural language processing	Pathologies and acts are classified in thesauri to help physicians to code their activity. In practice, the use of thesauri is not sufficient to reduce variability in coding and thesauri do not fit computer processing. We think the automation of the coding task requires a conceptual modelling of medical items: an ontology. Our objective is to help pneumologists code acts and diagnoses with a software that represents medical knowledge by an ontology of the concerned specialty. The main research hypothesis is to apply natural language processing tools to corpora to develop the resources needed to build the ontology. In this paper, our objective is twofold: we have to build the ontology of pneumology and we want to develop a methodology for the knowledge engineer to build various types of medical ontologies based on terminology extraction from texts.	classification;knowledge engineer;natural language processing;nomenclature;ontology (information science);pulmonary medicine;spatial variability;terminology extraction;text corpus;thesaurus	Audrey Baneyx;Jean Charlet;Marie-Christine Jaulent	2005	Studies in health technology and informatics		data mining;ontology (information science);terminology extraction;medicine	AI	-49.15832152005822	-68.38836547441386	185554
