id	title	keywords	abstract	entities	authors	year	journal	doi	fos	area	x	y	ix
eac0f29318a165282dae123dda7eb5653c8e51a7	post-coordination in practice: evaluating compositional terminological system-based registration of icu reasons for admission	post coordination;electronic patient record;electronic medical records;terminological system;evaluation;electronic medical record	BACKGROUND Re-use of patient data from an electronic patient record heavily relies on structured, coded data. Terminological systems (TSs) are meant to support this. TSs are more commonly implemented nowadays, especially those that support post-coordination. The effect of using a compositional TS on correctness and specificity of captured patient data is unknown.   OBJECTIVE To evaluate the agreement between free-text reasons for admission to intensive care captured in a patient data management system (PDMS) and reasons for admission that were recorded using a compositional TS embedded in the PDMS.   METHODS Observational study comparing pairs of free-text reasons for admission to intensive care with reasons for admission that were recorded using a compositional TS. Both reasons for admission were captured in the PDMS by clinicians during regular care practice. Each pair was judged as exact match, partial match or mismatch by two independent raters. Partial matches were further analyzed to investigate whether free-text or TS-based reasons for admissions included more detail and whether these differences could be explained by the content, the interface of the TS or by user or usability characteristics.   RESULTS Eleven percent of the pairs matched exactly, 79% of the pairs matched partially and 10% of the pairs did not match. Compared to free-text registration TS-based registration resulted in more detail for 21% of the partial matches, in less detail for 43% of the partial matches and in 36% of the partial matches some detail was added while at the same time other detail was lacking. In 65% of the cases in which the TS-based registration lacked some detail, this detail was available in the content of the TS. Physicians who used the TS occasionally had a significantly higher percentage of mismatches.   CONCLUSION In practice, post-coordination leads to information with different detail but a level of detail comparable to free-text registration of reasons for admission. Details missing in the TS-based reasons for admission were most often available in the TS, indicating that user interaction with the system is more of an impediment than the contents of the TS.		Nicolette de Keizer;Ferishta Bakhshi-Raiez;Evert de Jonge;Ronald Cornet	2008	International journal of medical informatics	10.1016/j.ijmedinf.2008.05.002	simulation;medicine;evaluation;data mining;management	Web+IR	-51.714982390384165	-68.14739020047573	119619
91bf37141962d02ab89b42a21addf370728cd159	about the language of hungarian discharge reports		Concerning use of terminological systems translated to any particular language or computer assisted translation of patient records the daily medical language has to be taken into account rather than the pure academic language. The aim of this study to investigate the language of the diagnosis of the Hungarian hospital discharge reports. Word of collection of discharge diagnoses were categorised according to the language and form (normal words, abbreviations, acronyms). It was found that Latin is still a dominant, but the language is rather a mixture, where local jargon, non standardised abbreviations occur frequently. Some signs show, that discharge reports are not used primarily as a tool of communication of physicians, rather serve local administrative purposes.		György Surján;Gergely Héja	2003	Studies in health technology and informatics	10.3233/978-1-60750-939-4-869	natural language processing;artificial intelligence;medicine	NLP	-48.814504159501524	-68.91344198876493	119802
6e36e2093288a3f0dfa609667ac20e3c4748d3d5	development and evaluation of an ensemble resource linking medications to their indications	medlineplus;rxnorm;pharmaceutical preparations;internet;drug therapy;dictionaries as topic;natural language processing;electronic health records	OBJECTIVE To create a computable MEDication Indication resource (MEDI) to support primary and secondary use of electronic medical records (EMRs).   MATERIALS AND METHODS We processed four public medication resources, RxNorm, Side Effect Resource (SIDER) 2, MedlinePlus, and Wikipedia, to create MEDI. We applied natural language processing and ontology relationships to extract indications for prescribable, single-ingredient medication concepts and all ingredient concepts as defined by RxNorm. Indications were coded as Unified Medical Language System (UMLS) concepts and International Classification of Diseases, 9th edition (ICD9) codes. A total of 689 extracted indications were randomly selected for manual review for accuracy using dual-physician review. We identified a subset of medication-indication pairs that optimizes recall while maintaining high precision.   RESULTS MEDI contains 3112 medications and 63 343 medication-indication pairs. Wikipedia was the largest resource, with 2608 medications and 34 911 pairs. For each resource, estimated precision and recall, respectively, were 94% and 20% for RxNorm, 75% and 33% for MedlinePlus, 67% and 31% for SIDER 2, and 56% and 51% for Wikipedia. The MEDI high-precision subset (MEDI-HPS) includes indications found within either RxNorm or at least two of the three other resources. MEDI-HPS contains 13 304 unique indication pairs regarding 2136 medications. The mean±SD number of indications for each medication in MEDI-HPS is 6.22 ± 6.09. The estimated precision of MEDI-HPS is 92%.   CONCLUSIONS MEDI is a publicly available, computable resource that links medications with their indications as represented by concepts and billing codes. MEDI may benefit clinical EMR applications and reuse of EMR data for research.	code;computable function;dual;electronic health records;electronic billing;electronics, medical;excalibur: morgana's revenge;extraction;hantavirus infections;haxe;hermanski-pudlak syndrome;holder device component;international classification of diseases;lrsam1 gene;largest;lattice boltzmann methods;license;mandibular right second molar tooth;manuscripts;medlineplus health topics;natural language processing;objective-c;ontology;peer review;precision and recall;quantum well;randomness;refinement (computing);reuse (action);reverse monte carlo;revision procedure;rxnorm;subgroup;typed assembly language;unified medical language system;united states national institutes of health;wikipedia;interest	Wei-Qi Wei;Robert Michael Cronin;Hua Xu;Thomas A. Lasko;Lisa Bastarache;Joshua C. Denny	2013		10.1136/amiajnl-2012-001431	pharmacotherapy;natural language processing;the internet;medicine;computer science;data mining;database;rxnorm;world wide web;information retrieval	Web+IR	-48.925043414487064	-69.98249402961271	119956
a19e389d89837d34a6a58e796a0d5e142997af16	computer-assisted expert case definition in electronic health records	insurance claims data;safety surveillance;case definition;health outcomes;electronic health records	PURPOSE To describe how computer-assisted presentation of case data can lead experts to infer machine-implementable rules for case definition in electronic health records. As an illustration the technique has been applied to obtain a definition of acute liver dysfunction (ALD) in persons with inflammatory bowel disease (IBD).   METHODS The technique consists of repeatedly sampling new batches of case candidates from an enriched pool of persons meeting presumed minimal inclusion criteria, classifying the candidates by a machine-implementable candidate rule and by a human expert, and then updating the rule so that it captures new distinctions introduced by the expert. Iteration continues until an update results in an acceptably small number of changes to form a final case definition.   RESULTS The technique was applied to structured data and terms derived by natural language processing from text records in 29,336 adults with IBD. Over three rounds the technique led to rules with increasing predictive value, as the experts identified exceptions, and increasing sensitivity, as the experts identified missing inclusion criteria. In the final rule inclusion and exclusion terms were often keyed to an ALD onset date. When compared against clinical review in an independent test round, the derived final case definition had a sensitivity of 92% and a positive predictive value of 79%.   CONCLUSION An iterative technique of machine-supported expert review can yield a case definition that accommodates available data, incorporates pre-existing medical knowledge, is transparent and is open to continuous improvement. The expert updates to rules may be informative in themselves. In this limited setting, the final case definition for ALD performed better than previous, published attempts using expert definitions.	adrenoleukodystrophy;atomic layer deposition;classification;electronic health records;exception handling;exclusion;inference;inflammatory bowel diseases;information;intestinal diseases;intestines;ion beam deposition;irritable bowel syndrome;iteration;liver diseases;natural language processing;onset (audio);positive predictive value of diagnostic test;rule (guideline);sampling (signal processing);scientific publication	Alexander Muir Walker;Xiaofeng Zhou;Ashwin N. Ananthakrishnan;Lisa S. Weiss;Rongjun Shen;Rachel E. Sobel;Andrew Bate;Robert F. Reynolds	2016	International journal of medical informatics	10.1016/j.ijmedinf.2015.10.005	medicine;artificial intelligence;data science;data mining;database;case definition;management;statistics	ML	-53.13139252517313	-70.26937881453556	120680
735b9176a862456bc13d4740d3e74427669c451b	arthritis quality indicators for the veterans administration: implications for electronic data collection, storage format, quality assessment, and clinical decision support	vocabulary controlled;data collection;quality of health care;medical records systems computerized;quality indicators health care;medical audit;humans;user computer interface;automatic data processing;arthritis rheumatoid;united states department of veterans affairs	The Veterans Administration (VA) uses information technology and performance measures to improve quality and efficiency. The VA stores all patient data electronically. Manual quality assessment audits are performed every three months. They are time consuming and expensive. Automated reviews would be more efficient. But the patient records are neither sufficiently coded nor structured to allow for full machine interpretability. Evidence-based rheumatology quality indicators have been proposed for inclusion in the quality data set. Automated reviews for some conditions would be possible with modification to some VA electronic data entry screens and to the underlying data repository. This effort would risk the imposition of untenable data entry and workflow burdens upon clinicians. This paper outlines some specific considerations for one disease, rheumatoid arthritis.	chart evaluation by healthcare professional;clinical decision support system;conferences;data collection;evaluation procedure;humans;mind;open system (computing);outlines (document);patients;research data archiving;review [publication type];rheumatoid arthritis;rheumatology specialty;traffic collision avoidance system;united states department of veterans affairs	Carl A. Williams;Angelia D. Mosley-Williams;J. Marc Overhage	2007	AMIA ... Annual Symposium proceedings. AMIA Symposium		medicine;data mining;biological engineering	Embedded	-56.229348586760146	-67.39815025820602	120708
3f6912dedd32ab920c7547428e1b9a10f5107bae	rating quality in metadata harvesting	tool;metadata;open archive initiative;quality;harvesting	The quality of the data and metadata affects the interoperability of the collections and the quality of all processing. Our metadata quality metric helps the metadata harvester collection administrators detecting and improving the weaknesses of their metadata, and harvesters locating the most problematic collections, in terms of metadata quality, and prompt their administrators to improve their metadata. We extended and used an adaptive quantitative metadata quality metric and a tool to implement it. In controlled values, their value distribution is considered, and in free text values the length of their description. Moreover, we also consider additional information in the OAI-PMH XML responces, that is not normally mapped in metadata elements, but still contains metadata information, such as XML attributes. We used the tool to make quality observations, to examine collections for patterns and irregularities and to produce the appropriate advice for the collection administrators. Some of these observations are demonstrated here. We compared the reported quality over a 3-year period, to get a general quantitative and qualitative feeling of the diversity in the record descriptions, and the changes in their quality during their lifetime. We verified the assumption that the quality increases over time: usually by a tiny amount, in every collection, and by a lot on a small number of collections. Also, the lower quality collections are the ones that stop responding and vanish.	interoperability;sensor;vanish (computer science);xml	Sarantos Kapidakis	2015		10.1145/2769493.2769512	computer science;database;metadata;world wide web;information retrieval;metadata repository	Web+IR	-59.61598843528494	-70.79393699889611	120979
23f70b6c5e8e3c2e2cc08d9c53b5d6e46bae355a	whose voices are heard in patient safety incident reports?	bioinformatics;biomedical research	Patient safety incident reporting systems are used to monitor adverse events, generate information for risk management and to improve patient safety. A number of electronic reporting systems have been developed, but their data elements appear relatively similar. An inductive data analysis was carried out to find out especially what is the content of descriptions of contributing factors of adverse events. The data consisted of incident reports entered in a hospital based reporting system in the years 2008-2010. Overall, 82 reports of 785 contained free text information about patients' and relatives' involvement in the events reported by staff. We found that patients themselves noticed almost half of these incidents. Of the incidents they noticed, most resulted in moderate harm.	adverse event domain;contain (action);contribution;description;patients;risk management;voice	Kaija Saranto;David W. Bates;Minna Mykkänen;Mikko Härkönen;Merja Miettinen	2012	NI 2012 : 11th International Congress on Nursing Informatics, June 23-27, 2012, Montreal, Canada. International Congress in Nursing Informatics			DB	-59.837232001118494	-66.1496507028431	121482
481f43d76f86923bbe0b36ddf75d23e68f4e3b09	evaluating a medical error taxonomy	product development;human factors;classification;controlled vocabulary	Healthcare has been slow in using human factors principles to reduce medical errors. The Center for Devices and Radiological Health (CDRH) recognizes that a lack of attention to human factors during product development may lead to errors that have the potential for patient injury, or even death. In response to the need for reducing medication errors, the National Coordinating Council for Medication Errors Reporting and Prevention (NCC MERP) released the NCC MERP taxonomy that provides a standard language for reporting medication errors. This project maps the NCC MERP taxonomy of medication error to MedWatch medical errors involving infusion pumps. Of particular interest are human factors associated with medical device errors. The NCC MERP taxonomy of medication errors is limited in mapping information from MEDWATCH because of the focus on the medical device and the format of reporting.	cessation of life;clinical trial expedited safety report;human factors and ergonomics;medical devices;neural correlates of consciousness;new product development;patients;taxonomy;pump (device)	Juliana J. Brixey;Todd R. Johnson;Jiajie Zhang	2002	Proceedings. AMIA Symposium		new product development;medwatch;data mining;controlled vocabulary;health care;medicine	Visualization	-58.00811036297872	-66.81168569119076	122057
f8e49dca171a0ebc9cd38f6b30363a62c380e174	measuring the quality of medical records: a method for comparing completeness and correctness of clinical encounter data.	methods;quality assurance health care;physician patient relations;medical records systems computerized;humans;pilot projects	This paper explores the attributes of quality in recorded clinical encounter data, examines issues in measuring these attributes, and describes a method for measuring two attributes, completeness and correctness. The method is defined in the context of computer-based records and is demonstrated in a pilot study. Videotaped physician-patient encounters and an empiric process of determining a gold standard for content are used. The methodology was found to be feasible. Problems encountered during the pilot study can be remedied.		Judith R. Logan;Paul N. Gorman;Blackford Middleton	2001	Proceedings. AMIA Symposium		medicine;data mining;database;management science	SE	-54.13468262733033	-67.40365307557299	122150
94bb60942afa52658a74b4875cc86a685c9b5704	automatic classification of mammography reports by bi-rads breast tissue composition class		Because breast tissue composition partially predicts breast cancer risk, classification of mammography reports by breast tissue composition is important from both a scientific and clinical perspective. A method is presented for using the unstructured text of mammography reports to classify them into BI-RADS breast tissue composition categories. An algorithm that uses regular expressions to automatically determine BI-RADS breast tissue composition classes for unstructured mammography reports was developed. The algorithm assigns each report to a single BI-RADS composition class: 'fatty', 'fibroglandular', 'heterogeneously dense', 'dense', or 'unspecified'. We evaluated its performance on mammography reports from two different institutions. The method achieves >99% classification accuracy on a test set of reports from the Marshfield Clinic (Wisconsin) and Stanford University. Since large-scale studies of breast cancer rely heavily on breast tissue composition information, this method could facilitate this research by helping mine large datasets to correlate breast composition with other covariates.	bi-rads;breast fibroglandular tissue;categories;class;collections (publication);mammary gland parenchyma;mammary neoplasms;mammography;ninety nine;regular expression;test set;algorithm	Bethany Percha;Houssam Nassif;Jafi A. Lipson;Elizabeth S. Burnside;Daniel L. Rubin	2012	Journal of the American Medical Informatics Association : JAMIA	10.1136/amiajnl-2011-000607	medicine;pathology;gynecology	AI	-48.7163255059857	-70.07584218633808	122471
afd0f02054fdf4490443755cb56bb1a331f52b2f	developing ontological background knowledge for biomedicine	004 informatik	Biomedicine is an impressively fast developing, interdisciplinary field of research. To control the growing volumes of biomedical data, ontologies are increasingly used as common organization structures. Biomedical ontologies describe domain knowledge in a formal, computationally accessible way. They serve as controlled vocabularies and background knowledge in applications dealing with the integration, analysis and retrieval of heterogeneous types of data. The development of biomedical ontologies, however, is hampered by specific challenges. They include the lack of quality standards, resulting in very heterogeneous resources, and the decentralized development of biomedical ontologies, causing the increasing fragmentation of domain knowledge across them. In the first part of this thesis, a life cycle model for biomedical ontologies is developed, which is intended to cope with these challenges. It comprises the stages “requirements analysis”, “design and implementation”, “evaluation”, “documentation and release” and “maintenance”. For each stage, associated subtasks and activities are specified. To promote quality standards for biomedical ontology development, an emphasis is set on the evaluation stage. As part of it, comprehensive evaluation procedures are specified, which allow to assess the quality of ontologies on various levels. To tackle the issue of knowledge fragmentation, the life cycle model is extended to also cover ontology alignments. Ontology alignments specify mappings between related elements of different ontologies. By making potential overlaps and similarities between ontologies explicit, they support the integration of ontologies and help reduce the fragmentation of knowledge. In the second part of this thesis, the life cycle model for biomedical ontologies and alignments is validated by means of five case studies. As a result, they confirm that the model is effective. Four of the case studies demonstrate that it is able to support the development of useful new ontologies and alignments. The latter facilitate novel natural language processing and bioinformatics applications, and in one case constitute the basis of a task of the “BioNLP shared task 2013”, an international challenge on biomedical information extraction. The fifth case study shows that the presented evaluation procedures are an effective means to check and improve the quality of ontology alignments. Hence, they support the crucial task of quality assurance of alignments, which are themselves increasingly used as reference standards in evaluations of automatic ontology alignment systems. Both, the presented life cycle model and the ontologies and alignments that have resulted from its validation improve information and knowledge management in biomedicine and thus promote biomedical research.	bioinformatics;biomedical text mining;controlled vocabulary;documentation;fork (software development);fragmentation (computing);information extraction;knowledge management;natural language processing;ontology (information science);ontology alignment;requirement;requirements analysis;sequence alignment;trusted computer system evaluation criteria;web ontology language	Elena Beisswanger	2013			idef5;computer science;bioinformatics;knowledge management;data mining	Web+IR	-50.457998811130494	-67.37739264915383	122855
ed912a23574f2e5c1a00ea133a0e61e4816ef250	research paper: developing optimal search strategies for detecting clinically sound studies in medline	internal medicine;clinical application;search strategy;gold standard;indexing terms;selection combining;clinical study;operating characteristic	"""OBJECTIVE To develop optimal MEDLINE search strategies for retrieving sound clinical studies of the etiology, prognosis, diagnosis, prevention, or treatment of disorders in adult general medicine.   DESIGN Analytic survey of operating characteristics of search strategies developed by computerized combinations of terms selected to detect studies meeting basic methodologic criteria for direct clinical use in adult general medicine.   MEASURES The sensitivities, specificities, precision, and accuracy of 134,264 unique combinations of search terms were determined by comparison with a manual review of all articles (the """"gold standard"""") in ten internal medicine and general medicine journals for 1986 and 1991.   RESULTS Less than half of the studies of the topics of interest met basic criteria for scientific merit for testing clinical applications. Combinations of search terms reached peak sensitivities of 82% for sound studies of etiology, 92% for prognosis, 92% for diagnosis, and 99% for therapy in 1991. Compared with the best single terms, multiple terms increased sensitivity for sound studies by over 30% (absolute increase), but with some loss of specificity when sensitivity was maximized. For 1986, combinations reached peak sensitivities of 72% for etiology, 95% for prognosis, 86% for diagnosis, and 98% for therapy. When search terms were combined to maximize specificity, over 93% specificity was achieved for all purpose categories in both years. Compared with individual terms, combined terms achieved near-perfect specificity that was maintained with modest increases in sensitivity in all purpose categories except therapy. Increases in accuracy were achieved by combining terms for all purpose categories, with peak accuracies reaching over 90% for therapy in 1986 and 1991.   CONCLUSIONS The retrieval of studies of important clinical topics cited in MEDLINE can be substantially enhanced by selected combinations of indexing terms and textwords."""	categories;forecast of outcome;indexes;internal medicine specialty;journal;medline;ninety nine;sensitivity and specificity;sensor;general practice (field)	R. Brian Haynes;Nancy L. Wilczynski;K. Ann McKibbon;Cynthia J. Walker-Dilks;John C. Sinclair	1994	Journal of the American Medical Informatics Association : JAMIA	10.1136/jamia.1994.95153434	alternative medicine;index term;medicine;pathology;gold standard;data mining;statistics	Web+IR	-56.83406405329126	-69.22778922476988	123033
