id	title	keywords	abstract	entities	authors	year	journal	doi	fos	area	x	y	ix
54f4577f0ca2b46117e163bd01aecb8ed47fdd33	virtual computer project “delivering content in a vrml world”	3d visualization;3d user manual;virtual reality modeling language;3d communication	The main aim of this project is to deliver information within a Virtual Reality Modeling Language environment system. The content of Virtual Computer Project is: Showing and teaching how to build a computer to an end user.		Carlo Zinzani	2000	Future Generation Comp. Syst.	10.1016/S0167-739X(99)00104-1	visualization;human–computer interaction;computer science;instructional simulation;multimedia;world wide web	Arch	-69.35064974932988	-36.17103461822656	186391
de2d96b41fd3dbdda42b0d898092d9e0b2ce6d73	concepts of e-learning accessibility improvement - codes of new media art and user behavior study		This article examines our proposed innovative strategies to further improve e-learning and new eBig3 learning approaches using an e-Ecosystem that is based on a multi-screen concept to support e-learning. Here we present the data comparison of user behavior in well-known Moodle and EdX learning environments. We propose the New Media art code analysis as an experimental method for eContent evaluation, and present the design science research method as a tool for application of e-learning research results. This paper is a part of a cross-cutting research in the fields of digital / new media art and ICT product innovation. The research is aimed at finding a path to open up the cache of knowledge situated in the theory of modern art, and to incorporate the codes of modern art into the field of ICT. The goal of the research is to transfer knowledge of modern art into areas traditionally not related to contemporary art and its specific academic trends, as well as to encourage the intersection of these disciplines. Consequently, this research aims to create a new profile of products that would exemplify modern interdisciplinary and analytic thought.	accessibility;code;ecosystem;exemplification;experiment;new media;situated;static program analysis;edx	Ieva Gintere;Viktors Zagorskis;Atis Kapenieks	2018		10.5220/0006787304260431	multimedia;computer science;new media	ML	-68.96470593006894	-36.977598766467366	186551
b1794f5099aa68e6c64aa41c314f98bac0f1d012	there's more than one way to analyze feedback on design	tag clouds frequency conversion education visualization encoding text analysis data visualization;text analysis;design research thematic analysis text analysis methods feedback studies design studies word cloud representation word frequency reading ease grade level tests design dataset;feedback on design design education information visualization first year engineering;visualization;data visualization;tag clouds;research and development design engineering engineering education;encoding;frequency conversion	Most studies on feedback and design use thematic analysis. In this paper, we apply three text analysis methods that are not commonly used in feedback and design studies to encourage researchers to think outside of the box and try different methods. We show how word cloud representation, word frequency, and reading ease and grade level tests can be applied to a feedback on design dataset in order to highlight the strengths and limitations of each approach. In general, findings of these three methods are aligned with those from our previous thematic analysis and provide new insights about the feedback. We recommend that these methods be used in addition to thematic analysis in analyzing feedback on design research.	feedback;tag cloud;thinking outside the box;word lists by frequency	Farshid Marbouti;Heidi A. Diefes-Dux;Monica Cardella	2015	2015 IEEE Frontiers in Education Conference (FIE)	10.1109/FIE.2015.7344248	computer science;data science;multimedia;information retrieval	Visualization	-67.83480911198465	-37.32710343060425	186734
4595a4e2b7d51807a1eb028ba5769ee7139841bf	coping with design complexity: a conceptual framework for design alternatives and variants		Interaction design processes are characterised by multi-disciplinary teamwork and by an interplay of creative, situated and analytical thinking. Alhough design in the domain of human-computer interaction has been widely investigated, the focus of research has been mainly on the user’s role and several authors refer to the need for a deeper understanding of the increasingly complex interaction design processes. This paper suggests a conceptual framework for interaction design that accommodates and unifies different perspectives from general design research while considering the specificities of the domain. Within the framework, description and analysis is done through the lens of design spaces, design artefacts, and refinement relationships between design artefacts. The framework extends existing concepts of design spaces by introducing complex spaces which acknowledge that design is rarely an individual activity but is more often undertaken by teams of designers. The framework also offers a distinction between design options into alternatives and variants to better describe and guide processes of idea generation and a convergence within, and between different sub-spaces and sub-teams. Different types of refinement between design artefacts are also discussed.	high- and low-level;human–computer interaction;interaction design;refinement (computing);situated;weitao yang	Judy Bowen;Anke Dittmar	2017		10.1007/978-3-319-67744-6_30	coping (psychology);situated;ideation;analytical skill;computer science;management science;interaction design;conceptual framework;teamwork;design research	HCI	-63.703881522124114	-35.77057907566928	187381
3ee8f3397622294edd9333d0da2c725684a537fd	virtually sacred: the performance of asynchronous cyber-rituals in online spaces		This article explores how the design of sacred spaces and ritual performance are transformed in the move from offline to online contexts. A semiotic analysis of two websites—a Christian Virtual Church and a Hindu Virtual Temple—suggests the potential for demarcating distinct online sacred spaces, in a Durkheimian sense, in which devotees can engage in ritual activity. The article focuses on the performance of cyberpuja in the Virtual Temple and the posting of prayers in the Virtual Church. Interviews with the Web designers and an analysis of the sites suggest that the virtual is primarily conceived in terms of a simulation of the “real.” Consequently these sites are envisaged in terms of conventional notions of sacred space and ritual performance, rather than as something radically new.	spaces	Stephen Jacobs	2007	J. Computer-Mediated Communication	10.1111/j.1083-6101.2007.00365.x	communication;social psychology	PL	-65.39590718563369	-34.35484553705846	187880
b06f320972f82655b5259cdc6b0c81fce4196f66	development of an interactive social tool for mexican young adults to lower and prevent overweight and obesity		In this paper we analyze qualitative factors that are affecting employees from 29 to 35 years old that work in Santa Fe, a corporate sector located in Mexico City, that are leading to overweight and obesity problems. The research phase got as a result that there is a lack of information appropriation towards alimentary matters, mainly caused by their lack of spare time and heavy work loads. Having this in consideration, the proposal is an interactive social tool to aim this lack of information appropriation. Based on User-Centered Design, Information Visualization, Situated and Significant Learning, the tool displays interactive messages on a table, through sensors and video mapping, allowing corporate employees to assimilate information while eating at their work spaces. Methods used in prototyping and testing were helpful to evaluate not only the tool as in its hardware, also the relevance of the messages displayed and the graphic solution chosen to show them (infographics, diagrams, text).	interactivity	Diana M. Sepúlveda;César Delgado;Luis Alvarado;Sergio Zepeda	2017		10.1007/978-3-319-58753-0_43	computer science;business sector;appropriation;situated;multimedia;health communication;usability;information visualization;user-centered design;infographic	HCI	-67.42638622275223	-35.74188021528773	188820
da326b8f79765f608442b31496a9dde3df488505	from knowledge transmission to sign sharing: semiotic web as a new paradigm for teaching and learning in the future internet	semiotic web;creativity platform;living lab;future internet;e service;sign management	In the 21 century, with the advent of ultra high-speed broadband networks (1Gb per second), the Internet will offer new opportunities for innovators to design qualitative services and applications. Indeed, the challenge of such e-services is not only on the technological aspects of Internet with new infrastructures and architectures to conceive. The reality is also on its human and multimedia content delivery, with innovative philosophies of communication to apply in this digital and virtual age. In the context of Teaching and Learning as a human-centered design approach, we propose a new paradigm for thinking the Web, called the Web of Signs, rather than the Web of things. It focuses on the process of making knowledge by sharing signs and significations (Semiotic Web), more than on knowledge transmission with intelligent object representations (Semantic Web). Sign management is the shift of paradigm for education with ICT (e-Education) that we have investigated in such domains as enhancing natural and cultural heritage. In this paper, we will present this concept and illustrate it with two examples issued from La Reunion Island projects in instrumental e-Learning (@-MUSE) and biodiversity informatics (IKBS). This Sign management method was experimented in the frame of our Living Lab in Teaching and Learning at University of Reunion Island.	biodiversity informatics;digital distribution;e-services;future internet;gigabyte;harsh realm;internet access;knowledge-based systems;linear algebra;living lab;programming paradigm;semantic web;semiotics;stunt island;user-centered design;web of things;world wide web	Noël Conruyt;Véronique Sébastien;Olivier Sébastien;David Grosser;Didier Sébastien	2012		10.1007/978-3-642-54897-0_10	web development;web modeling;simulation;engineering;knowledge management;multimedia	Web+IR	-68.58295686338171	-34.11594128173513	188824
f18dc79a7ef143ff8275fd43fccd203e52183b10	an interactive and adaptive building layer: strategies for allowing people to become advanced building-users	scenario;ad hoc;adaptive architecture;interactive systems;participation;retrofit	This paper reports outcomes of a pilot study to develop a conceptual framework to allow people to retrofit a building-layer to gain better control of their own built-environments. The study was initiated by the realisation that discussions surrounding the improvement of building performances tend to be about top-down technological solutions rather than to help and encourage bottom-up involvement of building-users. While users are the ultimate beneficiaries and their feedback is always appreciated, their direct involvements in managing buildings would often be regarded as obstruction or distraction. This is largely because casual interventions by uninformed building-users tend to disrupt the system. Some earlier researches showed however that direct and active participation of users could improve the building performance if appropriate training and/or systems were introduced. We also speculate this in long run would also make the built environment more sustainable. With this in mind, we looked for opportunities to retrofit our own office with an interactive layer to study how we could introduce ad-hoc systems for building-users. The aim of this paper is to describe our vision and initial attempts followed by discussion.	bottom-up proteomics;hoc (programming language);mind;performance;robertson–seymour theorem;top-down and bottom-up design	Yasu Santo	2012		10.1145/2414536.2414617	simulation;human–computer interaction;scenario;management	HCI	-62.984644372054525	-35.87437390921316	189648
2f1babca8ea54607870ada80b55ec106aa69612a	arts and technology	creative arts;media and communication curriculum and pedagogy	ATEC 2321 Writing and Research for Emerging Media (3 semester hours) This writing-intensive course focuses on writing for new and emergent media environments. While a number of technologies will be introduced and discussed in the course, the focus of the course will not be on the particular details of any one technology but rather on developing technological literacy; that is, the ability to understand and master new and emerging technologies as they appear. (3-0) Y	emergence	Anthony Lewis Brooks;Elif E. Ayiter;Onur Yazicigil	2014		10.1007/978-3-319-18836-2	humanities;psychology;arts in education;multimedia;performing arts education;visual arts education;language arts;pedagogy	HCI	-68.60132122278252	-33.53070057197051	189678
4905d1e97c264cf27a9508fbec44d1a2c660e749	the dynamics of design	second order;cybernetics;design process;swinburne;design method;conceptual development;design;design methodology	Purpose – This paper seeks to develop the argument that a cybernetic framework will enable designers to act as an observer and participant in the process of designing. The dynamic nature of the design process will be discussed in order to better understand how these aspects impact on a designer’s ability to act effectively in design. Design/methodology/approach – A second-order cybernetic framework is offered as a means to facilitate a designer’s capacity to act as an observer-participant in the co-creation of a design solution. It characterizes the design process as a conversation to enhance a designer’s ability to conceptually develop novel design solutions in participative situations. Findings – The significance of the designer in the design process and the design solution is established. A second-order cybernetic framework provides an explanation for a designer’s actions by acknowledging their presence in the design process. This makes possible the collaborative development of a design situation and its solution between various participants in this process through negotiation and mutual understanding. Practical implications – It is envisaged that the value of cybernetic concepts as a means to augment interaction, reflection, mutual understanding, creativity and innovation to facilitate designerly ways of knowing, thinking, and acting, is realized. Originality/value – The main value of this framework is for designers who struggle with finding an appropriate framework to facilitate and rationalize the subjective nature of human-centred design methods and the complexity of design.	cybernetics	Natalie Ebenreuter	2007	Kybernetes	10.1108/03684920710827328	cybernetics;design methods;idef6;computer science;artificial intelligence;design review;conceptual design;management science;design education;design brief	HCI	-63.83414281124227	-35.704579994950834	189882
871efab7a7692ac37f344c23cbe4a245a12365ea	a case study of a young child doing turtle graphics in logo	young children;computers in education	This paper explores some important issues with regard to using computers in education. It probes into the question of what programming ideas and projects will engage young children. In particular, a seven year old child's involvement in turtle graphics is presented as a case study.	computer;logo;turtle graphics	Cynthia J. Solomon;Seymour Papert	1976		10.1145/1499799.1499945	humanities;mathematics education;simulation;computer science	HCI	-68.13347580847065	-36.29808473797877	190210
9d9aac8aa162ef0c92b935dc44373cf0c6da1aaa	information source and its relationship with the context of information seeking behavior	information seeking behavior;empirical study;information sources;boundary;information source;classification;contextual identity framework;information seeking;new media;context	Past studies on a person's choice of information sources have shown mixed results because of a lack of understanding of the 'context' surrounding information seeking that impacts a person's choice of an information source. The Contextual Identity Framework combines three conflicting views of context to try and define its boundaries in information behavior. However, it is not clear in which of these three views of context would 'information source' fit. Would it be part of the shared context or contextual stereotype or both? Also, prior studies have often muddled the distinction between sources and channels, and between sources and source types. They have not been comprehensive in classifying types of information sources, especially with the advent of new media. To help address these gaps, this theoretical study proposes: 1) a classification of information source types; 2) a workflow of interaction among different possible elements of context; and 3) the placement of information source within the context of information seeking behavior as defined by the Contextual Identity Framework. The frameworks should help us better understand information sources in relationship to the context of information seeking behavior, and help lend greater rigor to empirical studies relating to a person's choice of information sources. It would also benefit designers of search systems paving the way for the possible information seeking systems that take the context of search into consideration.	contextual inquiry;information seeking behavior;information source;new media	Naresh Kumar Agarwal	2011		10.1145/1940761.1940768	information needs;knowledge management;information integration;political science;context model;information quality;communication;social psychology	HCI	-64.78569391557616	-32.62693781936522	190685
a697a70e6eb4ae6adbbb83bddf57dac31891e665	reimagining stem education and training with e-real. 3d and holographic visualization, immersive and interactive learning for an effective flipped classroom		While the 19th and the 20th centuries were, in education, mainly about standardization, the 21st century is about visualization, interaction, customization, gamification and flipped teaching. What today we know about learning from cognitive psychology is that people learn by practicing, with feedback to tell them what theyu0027re doing right and wrong and how to get better. For STEM education, that means they need to practice thinking like a scientist in the field. So e-REAL is a cornerstone: developed as workplace learning system in a number of fields (from medical simulation to soft skills development within the continuing education), it’s an ideal solution to root a practical – but not simplicistic - approach for STEM education.	holography	Fernando Salvetti;Barbara Bertagni	2017	iJAC		knowledge management;personalization;computer science;multimedia;flipped classroom;immersion (virtual reality);standardization;medical simulation;visualization;soft skills;interactive learning	HCI	-69.96373029256642	-31.581544755429263	191123
1d805d81e5079f2cdcaed7667ea161a13e4a0107	scripting and orchestration of collaborative inquiry: an increasing complexity of designs.				Mike Tissenbaum;James D. Slotta	2013				EDA	-69.06109500412511	-34.13445540319456	192611
59d77be1ecaf30c9de8802c7d33e76253c94beb8	social media tools and platforms in learning environments	future educational platform;social factor;learning environments;educational practitioner;social tagging;online social media;social media;ubiquitous social computing environment;social computing;mobile learning space;educational software;social media tools	Online social media have transformed the face of human interaction in the 21st century. Wikis, blogs, online groups and forums, podcasts, virtual worlds, and social tagging are but a few of the applications enabling innovative behaviors that support acquisition, access, manipulation, retrieval, and visualization of information. It is, therefore, no surprise that educational practitioners and theorists have begun to explore how social media can be harnessed to describe and implement new paradigms for communication, learning, and education. The editors goal in publishing this book was to identify original research on the application of online social media and related technologies in education as well as emerging applications in Web technologies that could provide and shape future educational platforms. The selected contributions deal with questions such as how social media can truly enrich and enhance learning and teaching experiences in ways not otherwise possible; how learning can be integrated in a distributed and ubiquitous social computing environment; or what theories, paradigms, and models are applicable for the support of social computing in education. Researchers in education or educational software will find interesting and sometimes provocative chapters on paradigms and methodologies, virtual and mobile learning spaces, and assessment and social factors. Practitioners in these fields will benefit from an additional section devoted to case studies and first experience reports.	social media	Download Here	2011		10.1007/978-3-642-20392-3	educational technology;social learning;human–computer interaction;computer science;knowledge management;multimedia;social computing	ML	-67.5410826707765	-37.28642130719689	193177
7c3e48b95860b21d4b086eb2e9227e8b4297b5e1	tutorial: parry and riposte: honing cybersecurity skills with challenge-based exercises		We will use the IEEE-supported Riposte framework to provide learners with an introduction to protocol reverse engineering and cryptanalysis via a series of challenged-based exercise, disguised as a 2D top-down shooter game.	computer security;cryptanalysis;parry;reverse engineering;top-down and bottom-up design	Fabian Monrose;Jan Werner	2018	2018 IEEE Cybersecurity Development (SecDev)	10.1109/SecDev.2018.00029	honing;software engineering;reverse engineering;parry;cryptanalysis;computer science	Vision	-69.79103338085145	-33.03492511534624	193645
718be27ed59d4f08a8ebb7e8d7bcbeba7181a5ea	toward virtual community knowledge evolution	virtual communities;knowledge evolution;digital libraries;concept maps;conceptual knowledge structures;computer-mediated communication;hypertext;hypermedia;workflow;ad hoc workflow;decision analysis;process modeling;repository;professional societies;virtual educational communities	This paper puts forth a vision and a possible architecture for a community knowledge evolution system. We propose augmenting a multimedia document repository (digital library) with innovative knowledge evolution support, including computer-mediated communications, community process support, decision support, advanced hypermedia features, and conceptual knowledge structures. These tools, and the techniques developed around them, would enable members of a virtual community to learn from, contribute to, and collectively build upon the community's knowledge and improve many member tasks. The resulting Collaborative Knowledge Evolution Support System (CKESS) would provide an enhanced digital library infrastructure serving as an ever-evolving repository of the community's knowledge, which members would actively use in everyday tasks and regularly update.	code refactoring;decision support system;digital library;evolution;hypermedia;jove;virtual community	Michael Bieber;Douglas C. Engelbart;Richard Furuta;Starr Roxanne Hiltz;John Noll;Jennifer Preece;Edward A. Stohr;Murray Turoff;Bartel VandeWalle	2002	J. of Management Information Systems		concept map;workflow;professional association;digital library;hypertext;human–computer interaction;computer science;knowledge management;process modeling;multimedia;knowledge value chain;world wide web;competitive advantage	Web+IR	-66.83885455720325	-36.60273138645484	193830
20959a9825280a29008adaa5ab4167c884c1f43c	a cognitive and social framework for shared understanding in cooperative hypermedia authoring	language use;grounding;joint cognition;cooperative hypermedia;common ground;shared knowledge structure;cognitive theory;conceptual framework;knowledge worker;shared knowledge;knowledge structure;cooperative work	Creating shared knowledge structures using cooperative hypermedia is a joint activity. The knowledge structures created should fit into the real world environment and reflect the common ground reached and evolved in the cooperation process of the knowledge workers. In order to facilitate the development of shared understanding among knowledge workers, Herbert Clark's theory on language use and Jean Piaget's cognitive theory are applied to the use of hypermedia language in cooperative work settings. To make the theories easier to apply, a conceptual framework is derived from them, which can inform the design and comparison of cooperative hypermedia systems and the use of hypermedia in cooperative settings.	hypermedia;jean;piaget's theory of cognitive development	Weigang Wang;Jessica Rubart	2006		10.1145/1149941.1149953	ground;computer science;knowledge management;artificial intelligence;conceptual framework	HCI	-65.36327185304381	-33.7846128072529	194461
