id	title	keywords	abstract	entities	authors	year	journal	doi	fos	area	x	y	ix
c729432c6e78dcb0d9528261d8f09399d74578ef	collaboration is key!: a multiplayer online education game in the museum environment	online education	learning and invention using new technologies. The Cleveland Institute of Art, the only five year professional art school in the U.S., has created the Professional Partnership Program (PPP) which allows us to stimulate the right challenge in academic settings, as well as creating revenue. One of the most satisfying results of the PPP has been an exciting collaboration between students and partners in the fields of gaming and simulations.	simulation	Jurgen Faust;Len Steinbach;Holly Witchey;Matthew Neff;Anthony Solary	2004		10.1145/1186107.1186109	simulation;human–computer interaction;computer science;multimedia;online participation	HCI	-69.92718808847759	-31.775794102511927	194688
b937a29dd794e0c78ff7ba7439b5cfc3b08e992d	alternative 3d education for children: course design of 3d printing interactivity for beijing's primary schools		New forms of extracurricular programs on creativity in primary schools are bound to emerge in the near future due to the popularization of 3D printing technology. This paper acknowledges the current situation of development of the extracurricular creative programs in China's primary schools, underlining the importance to introduce 3D printing and rapid prototyping technologies in the extracurricular activities. To sustain this argument, the activities of several creative 3D printing courses will be explained and discussed in the paper. Moreover, it will be shown how the particularity of the courses came from the combination of 3D printing technologies with culinary arts, bringing together traditional recipes with immersive and unexpected culinary experiences.  The paper is divided in three parts. In the first part the state of the art of the extracurricular activities in primary schools in China will be shown. The second part will introduce the educational action research as the main methodological framework used in the teaching activities. In the third part the examples will be presented emphasizing on the importance and advantages of experiential learning. The conclusion will present the level of satisfaction of the students, and the benefits of introducing rapid prototyping technologies in the primary schools.	3d printing;digital modeling and fabrication;experience;interactivity;mobile device;rapid prototyping;smartphone;warez	Ding Ting;Chawchen Zhaochen	2017		10.1145/3080631.3080637	immersion (virtual reality);interactivity;the arts;experiential learning;multimedia;action research;rapid prototyping;beijing;creativity;pedagogy;engineering	HCI	-69.05328377329306	-36.9118666970212	196335
54c20d50806d5b0a47226781ca67c29bd555acf7	media sociography: on usenet newsgroups			usenet	Jesper Tække	2005	Cybernetics and Human Knowing		social science;sociography;psychology	Vision	-66.54554071186008	-31.85579280185559	197129
fa3bbda67a7a3cec0974a75c4b2b2ca3caf08cfc	mobile support for ad-hoc learning communities		The creation of user-generated content is an approach which is used to activate learners. This paper presents an approach supporting mobile collaborative use of user-generated e-flashcards within small ad-hoc learning communities. The application of this approach to support cooperative work and workplace learning is discussed too.	hoc (programming language);user-generated content	Inga Saatz;Andrea Kienle	2013				HCI	-66.25512486277321	-36.60644782784437	197469
4d79ce32f6ab9d7d9ba953b182ecb9f4d84b7b14	radio healer: hacking the wii remote to perform indigenous re-imagined ceremony	human computer interaction;interactive museum	Radio Healer is a performance project in residence at the Pueblo Grande Museum in Phoenix, Arizona. During Radio Healer performances, indigenous electronic tools (many of which are created from salvaged materials and hacked Nintendo Wii Remotes) are performed together with traditional indigenous instruments. The convergence of traditional and contemporary indigenous instruments demonstrates value-laden tensions between notions of what is considered traditional and contemporary. At the same time Radio Healer illustrates that despite these tensions, traditional and contemporary technology can connect to each other in useful and meaningful ways (Figure 1). By creating this rivaling complexity, Radio Healer provides an indigenous ground for inclusive public dialogues. Following performances, project artists facilitate dialogues that provide opportunities for audience interpretations of the performance, which often unpack Radio Healer as a metaphor for various lived experiences within the contexts of place, connected-knowledge, culture, relationships, and pervasive media.	experience;performance;pervasive informatics;pueblo;wii remote plus	Cristóbal Martinez;Randy Kemp;Raven Kemp;Joe French;Robert Esler	2014		10.1145/2662155.2662223	social science;human–computer interaction;computer science;engineering;sociology	HCI	-63.56972537747245	-31.137011912281665	197502
15f11e18d05b881857a50d9a743e9930791b0407	the nature of child computer interaction	frameworks;interaction;child computer interaction;theory;children	This paper analyses the field of Child Computer Interaction (CCI). Beginning with an historical look at this field, and identifying some of the key moments in its development, the work then brings together reflection from experience, and knowledge from literature, to describe and explain the nature of Child Computer Interaction. In this process, the authors highlight the key differences that set CCI apart from Human Computer Intraction (HCI) and explore the extent to which both similarities and differences impact on the methods and approaches needed for research and practice in CCI. Key differences that are identified are the rate of change of children, the involvement of adult participants in children’s interactions, the contexts in which children use computer technology, and the underlying cultural and societal assumptions about technology and children that determine what is good for children and what has value.	human computer;human–computer interaction	Janet C. Read;Mathilde M. Bekker	2011			psychology;developmental psychology;communication;social psychology	HCI	-64.6986143551778	-33.10390742110987	197766
fb57ad837c3dbc5de6c47643ee416e1efffa194b	trustworthiness of visualizations of mobility-induced co2 emissions	workshop	In the face of global warming, CO2 emissions have to be reduced. Everybody can contribute by making CO2 aware decisions. But what decisions are good? Next to texts and figures, visualizations are an important communicative tool to encapsulate information in a way that is understood quickly and potentially changes consumer behavior. To have an impact, they have to evoke the trust of the recipient. In this qualitative study we address the mostly neglected topic of how individuals come to trust visualizations. We conducted interviews with eight subjects to compare trustworthiness of two visualizations of CO2 emissions of different means of transportation, either using a bar chart or a chart that depicts differently sized clouds. We analyzed the answers by categorizing different criteria. Overall, the bar chart was considered more trustworthy. We argue that trustworthiness of visualizations follows a complex process, which considers different criteria that interact with each other. The criteria with the most influence trustworthiness are: completeness of information, necessity of information, neutrality, reading accuracy and plainness of the graph. Lastly, trust might follow a U-shaped curve when plotted over the density of graph-features.	categorization;trust (emotion)	Laura Platte;Svenja Freitag;Lisa Schubert;Jerg Molis;André Calero Valdez;Martina Ziefle	2016		10.18420/muc2016-ws11-0006	internet privacy;trustworthiness;environmental science	HCI	-64.44438332510617	-31.641717706664014	199037
8c44f964751dc537c3369df283f05e6dccf7df2a	a brief review of game engines for educational and serious games development		Gamification﻿is﻿the﻿use﻿of﻿game﻿design﻿elements﻿to﻿enhance﻿the﻿teaching-learning﻿process﻿and﻿turn﻿ a﻿regular,﻿non-game﻿activity﻿into﻿a﻿fun,﻿engaging﻿game.﻿Simultaneously,﻿serious﻿games﻿are﻿proposed﻿ as﻿an﻿efficient﻿and﻿enjoyable﻿way﻿of﻿conducting﻿cognitive﻿assessment,﻿as﻿they﻿combine﻿a﻿serious﻿ intention﻿with﻿game﻿rules﻿and﻿targets.﻿In﻿this﻿scenario,﻿game﻿engines﻿have﻿emerged﻿as﻿information﻿ technologies﻿for﻿serious﻿games﻿and﻿educational﻿games﻿development;﻿however,﻿this﻿development﻿has﻿ usually﻿been﻿performed﻿without﻿a﻿guide﻿to﻿identifying﻿game﻿attributes﻿to﻿be﻿present﻿in﻿the﻿game.﻿To﻿ address﻿this﻿gap,﻿we﻿present﻿an﻿analysis﻿of﻿the﻿most﻿used﻿game﻿engines﻿to﻿identify﻿game﻿and﻿learning﻿ attributes﻿supported﻿for﻿serious﻿and﻿educational﻿games﻿development.﻿Findings﻿ from﻿this﻿analysis﻿ provide﻿a﻿guide﻿of﻿the﻿most﻿popular﻿game﻿engines﻿that﻿offer﻿the﻿largest﻿support﻿for﻿game﻿attributes,﻿ which﻿were﻿also﻿classified﻿by﻿game﻿categories. KEywoRDS Games Categories, Games Engines, Gamification, Serious Games		Humberto Marín-Vega;Giner Alor-Hernández;Ramón Zataraín-Cabada;María Lucía Barrón-Estrada;Jorge Luis García-Alcaraz	2017	JITR	10.4018/JITR.2017100101	information technology;computer science;game design;cognitive assessment system;multimedia	HCI	-69.37325957897609	-33.70536767103456	199400
69bc7a39f3a84a45fd61d8bd857529882babcbeb	learning science with art	computer graphics;interdisciplinary instruction;novel approach to science art connection;computer graphic;collaborative practice;student learning	This paper describes the novel approach to cooperative, integrative instruction in science, and examines the effect of non-restrained, spontaneous creation of sketches, versus writings, on the effectiveness of student learning.	spontaneous order	Anna Ursyn;Ruwang Sung	2007		10.1145/1282040.1282049	human–computer interaction;computer science;learning sciences;multimedia;computer graphics;computer graphics (images)	NLP	-69.66005331099498	-36.223321695325126	199864
