id	title	keywords	abstract	entities	authors	year	journal	doi	fos	area	x	y	ix
fae1d45fb358881a41b17e500f98e43f8a4150c4	session details: take me back to school: learning and sensing				Thyaga Nandagopal	2018		10.1145/3285057	computer network;computer hardware;beamforming;beam steering;phased array;computer science	HCI	-69.97532542228032	-34.56082830020785	175519
d40f92e135565722281d42bde34eab2b4d85c986	the construction of valued skills and expertise within the i.t. profession : continuing tensions between techies and managers				Annette Knight	2002				ML	-70.09487276438597	-32.701778532501365	175978
6ce593b8a203db6803b5aa771f997765b2874a05	critical ancestral computing: a culturally relevant computer science education		At first glance ancestral knowledge and computer science appear incompatible. Critical ancestral computing—socio-cultural and historical ecosystem approaches to solve complex problems—as an epistemological center for computer science education opens a pathway of critical consciousness, academic success and cultural relevance (Ladson-Billings, 2009). Weaving both disciplines to build a tapestry of critical ancestral computing in urban computer science education sets a stage for social transformation of present-day colonialism (Orelus, 2012). Critical ancestral computing feeds 1) a socio-historical learning context, 2) positive cultural academic identity formations, and 3) advocacy approaches that link engagement with society as individual and collective action by interrupting neocolonialism and prioritizing the health of social and environmental well-being.	computer science;ecosystem;gene regulatory network;interrupt;neocolonialism;relevance	Cueponcaxochitl Dianna Moreno Sandoval	2013	PsychNology Journal		psychology;social science;computer science;artificial intelligence;mechanical engineering	Theory	-68.13281516204687	-32.361476913188746	177549
2b4ec6b2acd2acf7d008a7f604b984b8c3924a14	what warioware can teach us about game design			video game design	Chaim Gingold	2005	Game Studies		simulation;video game design;multimedia;computer science;non-cooperative game;simulations and games in economics education;game art design;game developer;game design;level design;game design document	HCI	-69.95929547764611	-36.00993308571797	177649
83303dc8ab50d14951879101d845444016e1f818	distant voices in the dark: understanding the incongruent information needs of fiction authors and readers		Online tools enable authors and readers to share information, questions and feedback about a written work without the mediation of a publisher or agent. Little is known about how the two groups interact online around works of fiction, using either specialist social reading platforms e.g. GoodReads or Wattpad, or popular social media tools like Twitter. A better understanding of the interplay between them and the role technology plays as mediator can help inform the development of next-generation tools to suit their needs. We describe findings from interviews conducted with genre fiction authors and readers about how and why they interact and share information online. Interviews revealed that the social dynamics between the groups are complex, and that intercommunication can be both limited and somewhat unwanted. This shifted our focus from identifying how they interact to understanding why they do not. We found that communication patterns established by the traditional publishing industry create barriers between the groups, made visible, and exacerbated, by their retrofit to online social platforms where readers and authors are treated as equal. We discuss our key findings and highlight opportunities to better support the incongruent information needs of the groups.	information needs;matchware mediator;social dynamics;social media	Carol Butler	2018		10.1145/3176349.3176359	knowledge management;data mining;computer science;information needs;publishing;mediation (marxist theory and media studies);social media;social dynamics	HCI	-66.53118392102789	-31.14201050936498	177687
37ef1bf68915247d21d58b2f26132e2c8566fd61	reciprocal kit-build concept map: an approach for encouraging pair discussion to share each other's understanding				Warunya Wunnasri;Jaruwat Pailai;Yusuke Hayashi;Tsukasa Hirashima	2018	IEICE Transactions	10.1587/transinf.2017edp7420	computer vision;concept map;computer science;machine learning;reciprocal;artificial intelligence	SE	-67.04234137773086	-34.054403968762394	177752
5e9c436cb53250b72d2c185c27bf7d3642d5b538	real-life contexts in learning games: towards a new typology		The﻿use﻿of﻿real﻿contexts﻿in﻿learning﻿has﻿been﻿of﻿central﻿interest﻿to﻿educational﻿developments﻿such﻿as﻿ experiential﻿learning,﻿case﻿studies,﻿work﻿placements﻿and﻿simulations.﻿They﻿centre﻿around﻿the﻿benefits﻿ of﻿putting﻿students﻿in﻿realistic﻿situations,﻿using﻿real﻿tools﻿to﻿solve﻿real/realistic﻿problems.﻿A﻿growing﻿ number﻿of﻿learning﻿games﻿are﻿making﻿use﻿of﻿context﻿in﻿this﻿way:﻿initially﻿focused﻿around﻿serious﻿games﻿ (many﻿close﻿in﻿character﻿to﻿simulations)﻿and﻿most﻿recently﻿distilled﻿into﻿immersive﻿and﻿pervasive﻿ games,﻿which﻿mix﻿real﻿and﻿imagined﻿contexts﻿for﻿apparently﻿deep﻿learning﻿experiences.﻿This﻿article﻿ reviews﻿the﻿existing﻿literature﻿around﻿the﻿use﻿of﻿context﻿in﻿learning,﻿considers﻿the﻿applicability﻿to﻿ learning﻿games,﻿and﻿proposes﻿new﻿theoretical﻿developments﻿through﻿the﻿consideration﻿of﻿four﻿models﻿ for﻿the﻿integration﻿of﻿context﻿into﻿learning﻿experiences,﻿based﻿on﻿a﻿typology﻿of﻿existing﻿contextual﻿ learning﻿experiences﻿and﻿games.﻿To﻿illustrate﻿the﻿models﻿and﻿begin﻿to﻿strengthen﻿the﻿typology,﻿a﻿ number﻿of﻿existing﻿case﻿studies﻿are﻿referenced,﻿and﻿further﻿research﻿needs﻿highlighted. KeywoRdS Authentic, Context, Games, Learning, Models, Real, Typology		Alex Moseley	2018	IJGBL	10.4018/IJGBL.2018100102	knowledge management;political science;typology	ML	-68.82176985555687	-32.99164047727921	177808
83fcb15b75594defbf6cd3c730149c1358c76122	analyzing the politics of pd: a conceptual investigation	universities;pedagogy;participatory design;teaching	This workshop discusses power, participation and the politics of PD. We propose a set of concepts and related questions for analyzing and deliberating these issues on the basis of participants' own experiences in PD projects. The conceptual framework we propose has been inspired by Schön's notion of 'design moves' and by Alfred Schütz' concept of choice. The PD experiences of workshop participants will be explored collaboratively with the aim of arriving at a deeper and more specific understanding of what the users participate in and how they can recognize their influence in the design result.	experience	Tone Bratteteig;Ina Wagner	2014		10.1145/2662155.2662203	education;social science;human–computer interaction;computer science;engineering;knowledge management;management science;sociology;management	HCI	-63.75657633764514	-33.764029394038296	177879
a6b7aa5f4bbc5cf6823591c752aabd4b81bdc3c2	paper-based multimedia interaction as learning tool for disabled children	paper based interaction;inf;application framework;disabled children;multimedia;learning experience;learning;visual communication;sense of community;augmentative and alternative communication;learning activities;augmentative and alternative communication aac;visual representation;inclusive education;tangibles;design;interactive space	"""The purpose of our research is to support cognitive, motor, and emotional development of severely disabled children in the school context. We designed and implemented a set of novel learning experiences that are both low-cost and easily customizable, and combine the visual communication paradigm of Augmented Alternative Communication (ACC) with multimedia tangible technology. Using an application framework developed at our lab (called """"Talking Paper""""), teachers and therapists can easily associate conventional paper based elements (e.g., PCS cards, drawings, pictures) to multimedia resources (videos, sounds, animations), and create playful interactive spaces that are customized to the specific learning needs of each disabled child. Paper based elements work as visual representations for the concepts children must learn, as communication devices, and as physical affordances for interacting with multimedia resources. The paper presents the approach and its application in a real school context, highlighting the benefits for both disabled and non disabled children. The latter were involved as co-designers of multimedia contents and learning activities. Their creative participation favored group-binding and increased tolerance and sense of community in the classroom, so that the overall project became a means for real inclusive education."""	application framework;cognition;experience;image;interaction;programming paradigm;punched card	Franca Garzotto;Manuel Bordogna	2010		10.1145/1810543.1810553	simulation;computer science;multimedia;communication	HCI	-68.90959088831754	-37.926067871552725	178042
2d45da5b58ef5cad8d9b3dc1e0c3954a79ff8c20	a framework for the study of external representations in collaborative design settings	inscriptions;shared representations;typology;collaborative design;serious game	The use of modeling, simulation and visualization techniques in scientific and technical domains has led to the co-existence of a large diversity of external representations that, when deployed in collaborative work settings, can be designated by the term ‘‘shared representations’’. This contribution will focus on dyadic cognitive and triadic semiotic perspectives on the issue of interpretation and construction of shared representations. We propose a typology of external representations as a basis for further study of shared representations. As illustrated by examples from an existing corpus, the framework allows describing co-occurrence and superimpositions of different types, as well as transitions from one type to another. In the final section, we anticipate the exploitation of the framework in the light of the design of collaborative systems. & 2012 Elsevier Ltd. All rights reserved.	a.j. han vinck;activity recognition;biological anthropology;categorization;collaborative software;design rationale;dyadic transformation;engineering design process;exemplification;hofstadter's law;interaction;scope (computer science);semiotic engineering;semiotics;simulation	Erica de Vries;Cédric Masclet	2013	Int. J. Hum.-Comput. Stud.	10.1016/j.ijhcs.2012.07.005	typology;computer science;knowledge management;artificial intelligence	HCI	-64.99978797485713	-34.52132087793312	178134
631be7ebe8edb0113d05c7f937bf38bedb9ea8be	artifacts and aberrations: on the volatility of design research and the serendipity of insight	instrumental genesis;mixed-media design;classic model;instrumental genesis model;networked-classroom design;mathematical cognition;design research;respective design-based research study;case study;constructivist design	Reflecting on analyses of data from our respective design-based research studies of mathematical cognition and learning, we propose the utility of the instrumental genesis model (Vérillon & Rabadel, 1995) for examining students’ engagement with designed learning artifacts. The model has helped each of us to account for gaps between intended and enacted sequences in relation to these artifacts. In particular, instrumental genesis provides a mechanism for differentiating between the designer’s arc of intentionality and the student’s learning trajectory, two vectors that may be tacitly aligned for historically evolved learning materials but at variance for recently created materials. Characteristic of our case studies—a networked-classroom design for functions and a mixed-media design for probability—are breakdowns in which students’ behavior deviated either from the designer’s intention or from classic models of constructivist design. In both cases, the breakdowns were valuable in that they occasioned refinement of our theories and designs. Introduction A common and perhaps defining characteristic of design-based research is that the designs under investigation are raw, embryonic, or in flux—they are visions not yet fully realized, guided by principles still seeking clearer articulation, and enacted through tools in need of refinement. This incomplete state of the designs, especially in their early iterations, necessarily reflects the developing nature of the theories of learning-in-relationto-design they seek to inform. We take the inevitable rawness and fluidity of our under-development designs as useful affordances of this empirical genre; in the cases presented below, we describe irregular aspects of our designs that have contributed to the refinement of theory as much as—and perhaps more than—normative features would. However, irregularities of a design can pose distinctive methodological challenges for the design researcher, particularly in the analysis of data from instances in which implementation revealed departures from an intended or canonical design. As to-be-expected features of emergent designs, such departures warrant neither the outright rejection of a hypothesis nor the immediate abandonment of a designed artifact. Rather, we posit, they may occasion the emergence of new instructional or theoretical constructs, and mark pivotal opportunities for reexamining the enfolding dynamics between theory and design in relation to the artifacts we study. This paper seeks to integrate lessons from two quite different design studies into a common set of analytic tools for examining data episodes diagnosed as aberrant in relation to designed learning artifacts. In particular, our respective research studies have required us to interpret instances of temporary divergence of students’ experiences from the designer’s intention, whether this intention was a priori explicit or post facto emergent. We treat these breakdowns—in communication, in understanding, in implementation of a design—as opportunities to consider complexities inherent to learning with artifacts.(2) As researchers with both theoretical and engineering focus on artifacts that support learning, we typically scrutinize students’ engagement with artifacts with an eye on whether, how, why, and at what point students are able to recognize the affordances of these available artifacts for the successful accomplishment of the mandated problem-solving activities. In the cases we discuss below, students were initially unable to instrumentalize an artifact in line with the designer’s intentionality, either because the nature of the problem was temporarily obscured from the student or because the artifact functioned counter to the designer’s intention. Based on our analyses of these cases, we have come to believe that these designer–student breakdowns with respect to the objective and nature of instrumentalization may be quite common to design-based research studies, and that this ubiquity constitutes an empirical resource for advancing particular designs as well as design theory and learning theory. That is, the breakdowns do not necessarily reflect on the integrity of the underlying design rationale, and students’ experiences may ultimately be beneficial, yet the breakdowns give us pause to reflect on students’ dispositions and resourcefulness in relation to the tacit contract underlying productive engagement in designed learning activities. Building on Vérillon and Rabardel’s (1995) theory of instrumental genesis, we propose an approach to examining breakdown—an approach that hinges on analytically separating the structural/functional To appear in G. Kanselaar, J. van Merriënboer, P. Kirschner, & T. de Jong (Eds.), Proceedings of the International Conference of the Learning Sciences (ICLS 2008). Utrecht, The Netherlands: ICLS.	biconnected component;cognition;design by contract;design rationale;emergence;experience;genesis;intentionality;iteration;problem solving;refinement (computing);rejection sampling;smoothing;theory;volatility	Dor Abrahamson;Tobin White	2008			simulation;engineering;artificial intelligence;social psychology	HCI	-64.05373204700184	-33.62867121176129	178883
ae6611b8844651118d41fbaf53cc2f5263dbbd9b	the climate colab: large scale model-based collaborative planning	groupware;groupware artificial intelligence environmental science computing;collective intelligence system climate colab large scale model based collaborative planning global climate change model based planning online debate electronic voting;climate change;biological system modeling;environmental science computing;collaborative planning;large scale;global climate change;climate change collective intelligence collaborative planning;artificial intelligence;predictive models;planning;collective intelligence;prediction model;meteorology biological system modeling communities planning atmospheric modeling decision making predictive models;atmospheric modeling;communities;meteorology;electronic voting	The Climate CoLab is a system to help thousands of people around the world collectively develop plans for what humans should do about global climate change. This paper shows how the system combines three design elements (model-based planning, on-line debates, and electronic voting) in a synergistic way. The paper also reports early usage experience showing that: (a) the system is attracting a continuing stream of new and returning visitors from all over the world, and (b) the nascent community can use the platform to generate interesting and high quality plans to address climate change. These initial results indicate significant progress towards an important goal in developing a collective intelligence system—the formation of a large and diverse community collectively engaged in solving a single problem.	climate model;collective intelligence;display resolution;emoticon;online and offline;programming paradigm;science 2.0;situated;synergy;wicked	Joshua Introne;Rob Laubacher;Gary M. Olson;Thomas W. Malone	2011	2011 International Conference on Collaboration Technologies and Systems (CTS)	10.1109/CTS.2011.5928663	simulation;computer science;knowledge management;artificial intelligence;management science;predictive modelling;management	Robotics	-65.26288760950719	-37.011580665966555	179417
383093238b112a08f4d5a8d0317b3f6bc76b3627	reconstrained design: a manifesto		This manifesto marks the first anniversary of a project, Reconstrained Design, launched explicitly to challenge the state of design: its narrowing pathways, prevailing assumptions, and corporate agendas. Taking Our manifesto takes the form of a preamble which outlines the history of the manifesto genre and its origins in the historical avant-garde of a century ago, followed by a list of 12 tenets that put forward specific design challenges (each based on or challenging a thought-provoking quotation)., our manifestoWith this text we aims to pry open new discursive and imaginative spaces, to force new ideas into the public view, to promote engagement with politics, technology and other facets of everyday life, and to upset the status quo of design thinking. With this manifesto,It is written in an appropriately polemical style in order to, we take at its word the call to provocation. We hope this manifesto will establish our project's aims while encouraging important discussions between conference participants.	norm (social);pry repl	Julian Hanna;James Auger;Enrique Encinas	2017		10.1145/3064857.3079141	multimedia;engineering;manifesto;status quo;upset;social science;preamble;design thinking;politics;management;everyday life	HCI	-63.44790523125881	-32.17381839127958	179506
654f92265e188de2aad39f1e1dd565a952e490b7	'the visual helps me understand the complicated things': pupil views of teaching and learning with interactive whiteboards	software;visual presentation;cognitive psychology;aid concentration;dr kate wall;interactive whiteboards;logiciel;presentation visuelle;teaching perception;teaching and learning;eprints newcastle university;apprentissage visuel;royaume uni;enseignement primaire;visual learning;open access;psychologie cognitive;united kingdom;interactivity;metacognition;primary education;technical difficulties;interactivite;perception de l enseignement;dr heather smith	This study is one element of a Government sponsored evaluation into the introduction of interactive whiteboards (IWB) to Years 5 and 6 o f English primary schools. This element of the research aimed to gather information regarding pupil views of IWBs and the impact these tools can have on teaching and learning. To extend current literature the method targeted pupils’ views of how IWB can impact on metacognition: thinking about learning. Using a tem plate that has been developed by the team at Newcastle University children were enco uraged to talk about learning in different contexts: this methodology and its ration ale are described. The results show that overall comments from the pupils are positive, with the resulting themes encompassing how the IWB can facilitate and initiat e learning and impact on preferred approaches to learning. The pupils descri be how different elements of software and hardware can motivate, aid concentrati on and keep their attention. On the negative side, pupils candidly describe their f rustration when there are technical difficulties, their desire to use the board themsel ves and their perceptions of teacher and pupil affects. We discuss implications and make recommendations for the teacher and manufacturers. Introduction In 1989, Article 12 of the UN conventions on the Ri ghts of the Child increased the emphasis on the entitlement of children to have the ir voice heard. It states that:	addressing mode;cognition;command-line interface;design rationale;diagram;experience;focus group;higgins;interactive whiteboard;multiple dispatch;real-time transcription;relevance;speech synthesis;tunstall coding;video content analysis;word lists by frequency;wow and flutter measurement	Kate Wall;Steve Higgins;Heather J. Smith	2005	BJET	10.1111/j.1467-8535.2005.00508.x	psychology;metacognition;social science;simulation;computer science;primary education;multimedia;sociology;interactivity;management;world wide web;pedagogy	HCI	-68.66820589622138	-34.48576484454521	179561
c5e47729fd0447530a1cc5e53119ddcbeac29817	inclusive design workshop by regional cooperation between an npo and a university	university social contribution;design process;inclusive design;collaboration;nonprofit organization;system theory;regional cooperation	This is a case of running inclusive design workshops. Communication in an inclusive design workshop is not intercultural collaboration itself. However, as designers, engineers, and users who have individual needs, such as aged and disabled people, gather in the workshop, participants may become aware of differences in individual creation of meanings by communicating with other participants. Because as individuals our imaginative power is sometimes quite insufficient, it is not possible to sufficiently analyze such individual needs without communicating directly. In the inclusive design workshop, participants cooperate with each other during the design process, revealing differences in individual creation of meanings. In this paper, we describe some activities of social-academic cooperation, specifically cases of workshops that were run by an nonprofit organization (NPO) and a laboratory at Kyoto University. The former supports aged and disabled people's participation in society and the latter researches communication by the system theory.	optimization problem	Takayuki Shiose;Kentaro Toda;Hiroshi Kawakami;Osamu Katai	2007		10.1007/978-3-540-74000-1_27	engineering;knowledge management;management science;management	HCI	-64.96893472426045	-36.648236419300694	180018
