id	title	keywords	abstract	entities	authors	year	journal	doi	fos	area	x	y	ix
e9ec462c833d798351666014c164ae35fb3e4595	reputation and online communication: visualizing reputational power to promote collaborative discussions	groupware;computer and systems sciences;systemvetenskap informationssystem och informatik;game theory;information systems;collaboration e participation reputation inequality;inequality;social sciences;social sciences data visualisation game theory groupware;collaboration;e participation;reputation;data visualisation;information systems social aspects;data och systemvetenskap;games visualization media internet collaboration information services electronic publishing;systemvetenskap informationssystem och informatik med samhallsvetenskaplig inriktning;design research process online communication reputational power visualization collaborative discussions technological development e democracy in group equality social contexts inequality presupposition discussion groupware democratic meeting techniques social media strategic game user activity user change user inspection hierarchical roles reflecting game levels	In technological development in the area of e-democracy in-group equality is taken for granted. However, inequality in online communication is just as common as in other social contexts. To research the effects of starting from the presupposition of inequality we have developed a groupware for discussions. Based on democratic meeting techniques and social media it takes the form of a strategic game. The score within the game reflect user activity and the reactions to the activity in a dynamic way. The calculation and weighing mechanisms are open to inspection and change by the users. Hierarchical roles reflecting game levels may be attached to rights of what a specific user may change. The prototype presented in this paper will be further evaluated in the next phase of the design research process.	collaborative software;computer-mediated communication;prototype;social inequality;social media	Karin Hansson;Harko Verhagen;Petter Karlström;Aron Larsson	2013	2013 46th Hawaii International Conference on System Sciences	10.1109/HICSS.2013.629	public relations;game theory;reputation;computer science;knowledge management;artificial intelligence;marketing;software engineering;inequality;database;multimedia;management;world wide web;information system;collaboration	HCI	-66.06982896668625	-32.2088089967361	180418
0d697ccba9bbb65ed0c935ca24582db72f717527	what is shared? - a pedagogical perspective on interactive digital narrative and literary narrative		This paper builds on our analysis of interactive digital narrative (IDN) and traditional literary narrative (LN) to address issues relevant to theory and pedagogy of narrative technologies. We discuss pedagogical problems with narrative design and introduce an interdisciplinary experimental course (in computer science and psychology) to increase understanding of complementing and conflicting qualities of IDN and LN. This perspective extends recent debates about protostory [1] elements, processes, and specific micro-structures unique to and possibly shared [2] across these forms. Our practice-based research addresses students’ development of narrative design skills and the question, “What is shared across narrative forms?”	interactivity;pedagogical agent	Colette Daiute;Hartmut Koenitz	2016		10.1007/978-3-319-48279-8_37	narrative inquiry;narrative criticism;narrative network;multimedia;narrative;narrative history;literature;narrative structure	HCI	-63.00444897966715	-34.016485380079565	180591
c31650b2ec82c88c4e6070b585852c2933122467	intui. exploring the facets of intuitive interaction	talk	The growing interest in intuitive interaction in research and product design comes along with a demand for according measurement tools. The present research introduces a novel questionnaire which captures different components of intuitive interaction, in particular, Effortlessness, Gut Feeling, Magical Experience and Verbalizability. Components and the respective questionnaire items were developed based on literature review and an expert workshop, and then tested for reliability and validity in three empirical studies with a total of 334 participants. In all three studies a stable four factor structure representing the four components emerged. Analysis of correlations to further measures provided a deeper understanding of the concept. Finally, product category specific patterns of the relative specification of the components could be identified. Altogether, the presented questionnaire forms an easy applicable tool for practitioners and researchers. 1 Introducing the concept of Intuitive Interaction Product designers are facing new challenges over and over again: after the claim for usability, which was even manifested in an ISO norm (DIN EN ISO 9241-11 1998), it was remarked that products should be even more than usable (e.g., Burmester et al. 2002), and the term usability was integrated in the more holistic term user experience (Hassenzahl & Tractinsky 2006). Finally, the latest buzzword among researchers and vendors is intuitive interaction 1 : Many companies promote their products as being more intuitive than ever, for example, Adobe announced to improve its products by “making the most powerful editing techniques more intuitive“ (Adobe System 2010). And when presenting the new iPad at the Apple Keynote in San Francisco, Steve Jobs claimed that “this new category of devices will connect users with their apps and content in a much more intimate, intuitive and fun way than ever before.” (Apple Inc 2010). Accordingly, there is also a growing interest in the role of intuition in usability testing and evaluation (e.g., Meyer & Kindsmüller 2009). However, it is still unclear how a product’s intuitiveness can or should be assessed. In this paper, we 1 We use the terms intuitive interaction and intuitive use interchangeably, both stand for interaction styles which are perceived as highly intuitive. Accordingly, intuitiveness is not regarded as an existing product feature but as the subjectively perceived degree to which a product is being usable in an intuitive manner. INTUI. Exploring the Facets of Intuitive Interaction. 2 present a novel questionnaire which is based on a multidimensional concept of intuition, and thus captures different facets of intuitive interaction. When starting our research it quickly became clear that rating a product’s degree of intuitiveness would be a challenging undertaking, at least in the sense of objective assessment: What is intuitive for one person might appear absurd for the other. The question whether something appears intuitive depends on the congruence to one’s personal prior experience, so that a new “objectively” intuitive concept might not be perceived as such when it deviates too much from the familiar concept. For example, this was revealed when Microsoft introduced the new ribbon interface in the Office 2007 Suite. Though it was supposed to be the “intuitive counterpoint to the typical standard Windows menu system” (Microsoft 2010) some users were sceptical about its advantages and hesitated to switch from the familiar menu-structure to the foreign ribbon structure, and declared the latter as “a disaster“, “shockingly painful to use” and “definitely not intuitive” (Kyd 2007). The grouping of similar commands and the expanded overview of available functions certainly allows an easy entry for novice users, but at least for some of the expert users, the convincing simplicity of the new concept could not outweigh the loss of their familiar menu structure. However, this dependence of perceived intuitiveness on prior experience is not only an obstacle but also a chance to design for intuitive interaction. Luckily there are also shared cultural experiences which thus can be used as a basis for the design of operating concepts (e.g., Hurtienne & Israel 2007). Accordingly, the reference to prior experience is central to most suggested definitions which describe intuitive use as the unconscious utilization of knowledge acquired through past experiences (e.g., Blackler 2008; Naumann et al. 2009). However, speaking of intuitive use and not simply of the application of knowledge, there remains the question how much these past experiences must differ from the actual use case. Moreover, Naumann and colleagues (2009) point out that intuitive use results in efficient interaction, and accordingly focus in their questionnaire on intuitive use on performance related issues such as “perceived goal achievement“, “error rate“, and “learning“. In our view, intuitive interaction is not a solely pragmatic issue. Other than classical usability criteria, which may be surveyed in form of “checklists” such as the ISO norm questionnaire (Prümper 1997), it requires a holistic approach which respects its complexity. Instead of limiting our scope, we were rather interested in indentifying the different facets that constitute the overall experience of intuitive interaction. Thus, our research goal was to first identify the central components of intuitiveness by literature research and interviews, and then map these onto questionnaire scales. To broaden our scope, we did not only include HCI literature on intuitive interaction but also psychological literature on intuitive decision making. Here, the following central aspects of intuitive decision making were identified:  Intuition is a process that is usually fast and without the need of effort (e.g., Agor 1986, Bastick 2003, Hammond 1996, Hogarth 2001).  Intuition is usually an unconscious process (e.g., Agor 1986; Bastick 2003; Fischbein 1987; Hammond 1996). INTUI. Exploring the Facets of Intuitive Interaction. 3  Intuitive decisions are based on gut feelings rather than reason (Gigerenzer 2007; Hammond 1996; Hogarth 2001).  Intuition leads us to decisions which cannot necessarily been explained (e.g., Agor 1986; Bastick 2003; Fischbein 1987; Hogarth 2001). Based on these finding we formulated labels to capture each of these prominent characteristics of intuitive decision making. In particular, these were Effortlessness, Attention, Gut Feeling, and Verbalizability. Concerning the last one, Verbalizability, we are not certain whether something that applies to decision making – intuitive decisions are characterized by a low degree of verbalizability – can be applied to intuitive interaction as well. However, we still wanted to include this component in our questionnaire to find out whether any correlations to the other components or overall ratings could be revealed. In addition to these four components derived from the literature on intuitive decision making, we believed that there should be an additional component, capturing the experiential characteristics of intuitive interaction compared to “normal” interaction. Here, our idea was that the event of using technology in a particularly affect-based, effortless manner, exceeding the user’s expectations, might also be experienced as something special or even magical. Thus, we added Magical Experience as fifth component. We therefore began our research with a model of five components. 2 Questionnaire Construction Based on the components of intuition which we identified in our literature review, an initial set of items was constructed in a workshop with fifteen participants. At first, they were asked to name characteristics of intuitive interaction based on their daily experience. In order to make sure that participants reported their spontaneous ideas and did not narrow down their thoughts, this brainstorming was conducted before the concepts from intuitive decision making were introduced. However no entirely new component could be identified. After this, statements capturing the experience of (non-)intuitive product interaction were gathered for each of the five components among five usability experts of the authors' working group. They were encouraged to think of as many statements as possible, these were noted without any discussion or critique. In this manner, altogether about fifty statements were gathered. For example, the statement “While using the product I was guided by feelings.” related to Gut Feeling, “Using this product was easy” related to Effortlessness. In the following phase, the statements gathered so far were critically discussed and some of them reformulated. Also, some statements were reassigned to another component than they were initially formulated for. During this discussion it turned out that some statements could be better understood by making use of contradictory terms such as “... guided by feelings” versus “... guided by reason”. Hence, we decided that the questionnaire should consist of a list of paired, contradictory statements, which then could be used to describe one’s personal experience of product use by indicating which of the two statements was more suitable. Accordingly, we gathered contradictory terms for all the statements, while those statements for which no INTUI. Exploring the Facets of Intuitive Interaction. 4 opposite could be found were excluded. Finally, we selected a set of items for a first version of the questionnaire on intuitive interaction. In order to create a measurement tool which can be easily applied with manageable expenditure we did not want more than twenty items for the final version of the questionnaire. We therefore aimed at selecting about thirty items for the first version, with the idea to keep about half of them for the final version. So again, the collection of statements was critically observed and items which were quite long, compli	holism;human–computer interaction;microsoft windows;spontaneous order;usability testing;user experience;zeller's congruence;ipad	Daniel Ullrich;Sarah Diefenbach	2010				HCI	-64.39500510039876	-31.62306100284245	181014
05c4ddcf81812b172c2414660a6b97486c65e8ed	intergenerational play: exploring the needs of children and elderly				Julia Othlinghaus;Kathrin Maria Gerling;Maic Masuch	2011			anthropology;sociology	HCI	-67.11626946171106	-31.997859942888375	181253
a0a4fb1eb897f5639a896d993d09e32e685c431f	human-computer interaction as an instrument for strengthening culture and language of a colombian native community	human computer interaction;hci;nasa precolombian culture;nasa native community;culture;language and culture preservation	This paper is about the relationship between culture and human-computer interaction. Cultures are live, open and in continuous change. Computer and information technology, as external factors for non-Western-industrialized societies, may trigger transformations, that sometimes, could be considered as negative or unwanted. For example, the usage of Western word-processors modified the Japanese writing system when Japanese people faced a number of unfamiliar concepts introduced in those computer tools [8]. At the same time, minority societies around the world are in danger of extinction. The Nasa people, our target population, struggle to revitalize their mother tongue and cultural traditions. This text presents an experience about developing or adapting computer tools to help the revitalization efforts. The use of the computer could lead to positive effects, or at least, to effects aligned with the policies of the society.	central processing unit;computer;human–computer interaction	Santiago Ruano Rincón;Annabelle Boutet;Gilles Coppin;Franck Poirier;Tulio Rojas Curieux	2011		10.1007/978-3-642-21660-2_63	humanities;engineering;communication;anthropology	HCI	-68.34743034688698	-31.26261459033764	181630
8722070dd34f4023848a4c2f8d705c8d1ada6588	the creative process in digital design: towards an understanding of women's approach	creative process;gender;digital design;women	The debate about the differences between men and women is quite old but still topical. Many researchers have been investigating the differences in users' gender while experiencing digital products. However, it seems that few studies have investigated gender differences related to the creative process in digital design. The aim of this paper is to try to understand whether there are gender differences in the creative process in digital design in Brazil. In addition, it discusses the possible influences that women have in the design process and their approach to user experience design. For that, interviews and questionnaires with Brazilian designers, both women and men, were carried out. This investigation points out some gender aspects that can make difference in the design of digital products and presents a discussion of the role of women designers.		Virginia Tiradentes Souto;Paula C. L. A. Faria;Fátima Aparecida dos Santos	2015		10.1007/978-3-319-20898-5_25	humanities;engineering;multimedia;social psychology	HCI	-65.14893297385422	-35.898043762565386	181758
bf6576e6e904608a5c370311b52305735b3ce0f6	linking personality traits and individuals' knowledge management behavior			knowledge management	Osveh Esmaeelinezhad;Abbas Afrazeh	2018	Aslib J. Inf. Manag.	10.1108/AJIM-01-2018-0019		DB	-65.95998335711602	-31.751562403895736	182963
6272c80380fbfbda8d4401fd8d8c7d349edf4aa9	multimedia platform to support knowledge processes anytime and anywhere	multimedia platform;social environment;learning environments;mobile environment;pc environment;successful knowledge management solution;co system;knowledge management area;clear knowledge management strategy;system design;milk project	"""The paper contains a presentation of the work done in two ESPRIT Projects in the knowledge management area: Klee&Co (Knowledge and Learning Environments for European & Creative Organisations, started in 1998 and ended in 2000) and MILK (Multimedia Interaction for Learning and Knowing, started in early 2002 and expected to be closed by 2004). Klee&Co developed an approach and a web-based prototype allowing users to view knowledge in its context: the main feature of the Klee&Co system is the """"view with context"""". MILK is going to develop a system supporting users in any working situation, even mobile and social situations. It means a strong effort in interface and system design in order to create different technological platforms for PC environment, social environment, mobile environment. To get the expected results, it is important to start from the observation of users' needs and from the definition of a clear knowledge management strategy. The main outputs from the first stage of the MILK project will be presented and discussed to show the relevance of the integration between users, technology developers and designers visions for a successful knowledge management solution."""	anytime algorithm	Maurizio Mesenzani;Thomas Schael;Sara Albolino	2003	Journal of Intelligent and Fuzzy Systems		simulation;computer science;knowledge management;artificial intelligence;machine learning;multimedia	Robotics	-67.13304761910585	-37.83020395983603	183296
3ecfb76f9dda0f53593db6061a9141975219158e	innovation method of health products design for elderly adults based on perceived quality and user experience		The traditional research method of the perceived quality is to find the main factors affecting the perceived quality through questionnaire survey and factor analysis, and establish a product perception quality evaluation dimension for UCD. Innovation design can improve the perceived quality has been proved. Therefore, it is necessary to combine innovation method and demand evaluation method to the perceived quality to explore the better design process, and make a bridge between perceived quality evaluation method and innovation design.	user experience	Yongyan Guo;Hong Chen;Minggang Yang	2018		10.1007/978-3-319-92037-5_5	business;questionnaire;marketing;user experience design;design process	HCI	-65.24782190692936	-36.08593064171174	183366
794bf0ee5b58f010b849ca925346adfdbf4ef1b1	automated image understanding: a tutorial	cal;teaching media;computer assisted learning;cai;image understanding;cbe;teaching technologies;computer assisted instruction;computer based education;authoring system;teachware;courseware	One lesson that emerges from the study of attempts to automate the vision process is an appreciation of the difficulty of the task. Most areas in which computers received great success, word processing and inventory control for instance, involve only computation and data handling. Vision involves an additional ingredient: knowledge. The most significant problem in interpreting pictures with computers is the representation of knowledge and its application to the low level elements of the picture.	computation;computer vision;emergence;high- and low-level;inventory control	Dean Lucas	1985		10.1145/320435.320597	human–computer interaction;computer science;multimedia	AI	-69.02817475584521	-36.689040646686365	183731
bef8f98ec04c67be24f79eca65e1ef0a4fdb2502	the activity-based computing project		This position paper describes the Activity-Based Computing (ABC) project which has been ongoing in Denmark since 2003. Originally, the project took its outset in the design of a pervasive computing platform suited for the mobile, collaborative, and time-critical work of clinicians in a hospital setting. Out of this grew a conceptual framework, a set of six ABC principles, and a programming and runtime framework for the development of activity-based computing infrastructures and applications. Lately, these principles and technologies have been successfully moved to other application areas, and is now used to design and implement activitybased computing support for work in a biology laboratory and for global software development.	software development;ubiquitous computing;window of opportunity	Jakob Eyvind Bardram	2011			simulation;computer science;artificial intelligence;end-user computing	HCI	-66.57329821592947	-37.47595513964017	184579
08297c9e9a11a2ebd510edb465a04db352274070	youth perspectives on critical data literacies		As contemporary youth learn, play, and socialize online, their activities are often being recorded and analyzed. What should young people know about these data collection and analysis efforts? Although critiques of these new forms of data collection and analysis have grown increasingly loud, the voices of users, and particularly youth, have largely been absent. This paper explores the critical perspectives of youth who are programming with public data about their own learning and social interaction in the Scratch online community. Using a bottom-up approach based on ethnographic observation of discussions among these young users, we identify a series of themes in how these youth critique, question, and debate the implications of data analytics. We connect these themes-framed in terms of critical data literacies-to expert critiques and discuss the implications of these findings for education and design.	information privacy;online community;scratch (programming language);socialization;top-down and bottom-up design	Samantha Hautea;Sayamindu Dasgupta;Benjamin Mako Hill	2017		10.1145/3025453.3025823	multimedia	HCI	-66.48335488647533	-34.73915717287553	185538
aeda24670f805fed34cd0a33d34f0098981a4543	digital cultural communication: designing co-creative new media environments	cultural institutions;swinburne;interdisciplinary design;sustainability;conceptual design;design technique;design and implementation;cost effectiveness;080000 information and computing sciences;physical environment;natural history;080602 computer human interaction;participatory action research;new media;interaction design;080600 information systems	The design and implementation of audience-focused immersive media-rich physical environments is a familiar landscape within the commercial sphere. From theatre and theme parks to autoshows and airports, commercial interdisciplinary design and production teams have extended and solidified the new media agenda. The success of this track record is demonstrated by the increasing presence of commercial design techniques and knowledge in the creation of immersive new media within the cultural sphere, as proven by London's Natural History Museum, or the Melbourne Museum.This paper introduces the notion of digital cultural communication, a continuum through which designers can consider the place of narrative and experience and their attributes within public and commercial institutions. Digital cultural communication allows users to become co-creators of knowledge by providing tools and methods which enable the co-construction of creative artefacts. This paper uses a case study from Australia's rich cultural institution sector to illustrate the conceptual design of new media co-creative environment using an HCI-derived methodology supported by participatory action research. It is hoped that this method will demonstrate to curators of cultural experiences the cost-effective possibilities for enabling audiences to create rich narrative from user-led content.	experience design;human–computer interaction;new literacies;new media;robustness (computer science);software engineering;testament;triune continuum paradigm;usability	Jerry Watkins;Angelina Russo	2005		10.1145/1056224.1056245	cost-effectiveness analysis;cultural analysis;new media;human–computer interaction;computer science;knowledge management;interaction design;natural history;conceptual design;multimedia;sustainability;participatory action research	HCI	-63.73754565884392	-34.36839351958024	185644
