id	title	keywords	abstract	entities	authors	year	journal	doi	fos	area	x	y	ix
8a5e16be8cf2d0629fddd08a2742616efa44c4c0	tecnologías de la información y comunicación (tics) en los procesos de recepción y despacho	receiving;gestion de almacenes;computacion informatica;technologies infor;despacho;recepcion;ciencias basicas y experimentales;tecnologia de informacion y comunicaciones tics;technologies informat;tecnologia de informacion y comunicaciones tics warehouse management;shipping	─ This article aims to review and analyze the operations of receiving and shipping warehouse management, from the viewpoint of the use of Information Technologies and Communication Technologies (ICTs). As a result of the article identifies the importance of the processes of reception and dispatch efficiency and meeting the needs of customers in the supply chain and how these processes can be supported by ICT, to facilitate the planning, execution and control their activities through different tools: Keywords─ Warehouse management, Receiving, Shipping, Technologies information and communication (ICTs).	dynamic dispatch;linear algebra	Rodrigo Andrés Gómez Montoya;Alexander Alberto Correa Espinal	2011	RASI		performance art;cartography	EDA	-67.521030578427	0.4795974208802234	183061
7e3763951bd3779fc0e81f242f6275a819526a52	"""""""the intelligent enterprise butler - competitive use of intelligence in business"""" business intelligence stream: volume 1 concept report, butler group, january 2001, 95pp., price £595"""	business intelligence			Bob Wiggins	2001	Int J. Information Management	10.1016/S0268-4012(01)00030-5	business model;intelligence analysis management;business analysis;intelligence cycle;intelligence cycle;competitive intelligence;computer science;operations management;business analytics;management;operations research;business activity monitoring;business architecture	DB	-69.08603867294802	0.9632410247697271	183766
3215b929628e15ed9dce025a238c6996a2a29ea2	optimal control theory in intelligent transportation systems research - a review		Continuous motorization and urbanization around the globe eads to an expansion of population in major cities. Therefore, ever-growing pressure imposed on the ex isting mass transit systems calls for a better technology, I ntelligent Transportation Systems (ITS), to solve many new and dem anding management issues. Many studies in the extant ITS literature attempted to address these issues within which v arious research methodologies were adopted. However, ther e is very few paper summarized what does optimal control theory ( OCT), one of the sharpest tools to tackle management issues in engineering, do in solving these issues. It’s both import ant and interesting to answer the following two questions. ( 1) How does OCT contribute to ITS research objectives? (2) What are he research gaps and possible future research directions? We searched 11 top transportation and control journa ls and reviewed 41 research articles in ITS area in which OCT was used as the main research methodology. We categorized th e articles by four different ways to address our research questions. We can conclude from the review that OCT is widely used to address various aspects of management issues in ITS within which a large portion of the studies aimed to reduc e traffic congestion. We also critically discussed these stu dies and pointed out some possible future research directions to wards which OCT can be used.	apache ant (another neat tool);categorization;control theory;network congestion;optimal control	Jimmy S. J. Ren;Wei Wang;Stephen Shaoyi Liao	2013	CoRR		computer science;engineering;artificial intelligence;management science;operations research	SE	-66.17770089400364	-1.4336702362930185	183786
ccee3340be85aa94f2558bf159e597e8103a079c	a systems approach for modeling interactions among the sustainable development goals part 2: system dynamics				David Zelinka;Bernard Amadei	2019	IJSDA	10.4018/IJSDA.2019010103	system dynamics;sustainable development;environmental resource management;economics	AI	-68.59854772130522	-0.5822035393594921	183798
2b9ef3a2e4054b11e38c3e36dde05f041f5c1a56	special issue: decision support systems for teams, groups, and organizations			decision support system	Jay F. Nunamaker	1992	J. of Management Information Systems		r-cast;decision support system;economics;computer science	ECom	-65.68005896823557	-1.176571131434634	184139
e3e0d0e0190cdf9f0c483808f87cab0f4be83649	a decentralized approach for inter-enterprise business process collaboration		Chinese Acad Sci, Inst Software, Technol Ctr Software Engn, Beijing 100080, Peoples R China.	business process	Xiaoqiang Qiao;Jun Wei;Tao Huang	2006		10.1007/978-1-84628-714-5_29	systems engineering;knowledge management;artifact-centric business process model;business process management;process management;business process modeling	Vision	-64.77002048958147	1.5455141966098134	185470
2dfa839ea4c09a9dcf2df677242105c42d76bfc6	analyzing agents for electronic commerce	software;commerce electronique;electronic commerce;comercio electronico;red www;logiciel;e commerce;software agent;agente;data processing;agent;internet;world wide web;logicial;reseau www;intranet;electronic trade	ISSN: 1058-0530 (Print) 1934-8703 (Online) Journal homepage: http://www.tandfonline.com/loi/uism20 Analyzing Agents for Electronic Commerce Shouhong Wang To cite this article: Shouhong Wang (1999) Analyzing Agents for Electronic Commerce, Information Systems Management, 16:1, 40-47, DOI: 10.1201/1078/43187.16.1.19990101/31160.6 To link to this article: http://dx.doi.org/10.1201/1078/43187.16.1.19990101/31160.6	business process;diagram;domain analysis;e-commerce;electronic data processing;industrial and organizational psychology;information systems;information overload;international standard serial number;r language;software agent;software engineering;software system;systems engineering;systems management;systems modeling;task analysis;user interface	Shouhong Wang	1999	IS Management	10.1201/1078/43187.16.1.19990101/31160.6	e-commerce;the internet;computer science;software agent;operating system;database;multimedia;world wide web	AI	-64.92821847324036	1.4775607253250889	186025
87caf76f19fd27c5dfad55f580546a8ebd78a621	exhaustive and efficient identification of rationales using gqm+strategies with stakeholder relationship analysis			gqm+strategies	Takanobu Kobori;Hironori Washizaki;Yoshiaki Fukazawa;Daisuke Hirabayashi;Katsutoshi Shintani;Yasuko Okazaki;Yasuhiro Kikushima	2016	IEICE Transactions		stakeholder;knowledge management;management science	HCI	-68.51800384117038	3.2002585506492123	186160
81992fd27e31cf7f0e580e563c96c3f07814c8ef	"""book review: """"evaluation and decision models: a critical perspective"""" by d. bouyssou, t. marchant, m. pirlot, p. perny, a. tsoukias, p. vincke, (eds.); kluwer academic publishers, boston/london/dordrecht, 2000, 274p. +viii"""	decision models			Didier Dubois	2003	Fuzzy Sets and Systems	10.1016/S0165-0114(03)00038-1	decision model;computer science;mathematics	ML	-65.28614916971429	-1.3797059069346345	187515
b97a2ee837fe83639c8a6f60bc6bce3381156d1d	keynote: building a nervous system for society: the 'new deal on data' and how to make health, financial, logistics, and transportation systems work	transportation systems work;new data ecosystem;connected sensor;growth opportunity;nervous system;personal data;key challenge;centralized water system;accessible asset class;world economic forum;key ceos;new deal	Most of the functions of our society are based on networks designed during the late 1800s, and are modelled after centralized water systems. The rapid spread of ubiquitous networks, and connected sensors such as those contained in smartphones and cars, allow these networks to be reinvented as much more active and reactive control networks at the scale of the individual, the family, the enterprise, the city and the nation. This will fundamentally transform the economics of health, finance, logistics, and transportation. One key challenge is access to the personal data at scale to enable these systems to function more efficiently. In discussions with key CEOs, regulators, and NGOs at the World Economic Forum we have constructed a ‘new deal on data’ that can allow personal data to emerge as accessible asset class that provides strong protection for individuals. The talk will also cover a range of prototype systems and experiments developed at MIT, outline some of the challenges and growth opportunities, focusing on how this new data ecosystem may end up strongly promoting but also shaping the semantic web.	centralized computing;ecosystem;experiment;logistics;noise shaping;personally identifiable information;prototype;semantic web;sensor;smartphone	Alex Pentland	2011		10.1007/978-3-642-25093-4_34	semantic web;new deal;knowledge extraction;computer science;finance	Mobile	-68.57538259281834	-2.5283812037430855	187587
0caf7abee859aa1ccac6037f4d4fc6cbe459c3c5	linking repositories: scoping the development of cross-institutional user-oriented services	model design;focus group;information gathering;service model;business model;literature review;communication technology	The purpose of the Linking Repositories study was to conduct research to identify appropriate sustainable technical and organisational models to support the development of end-user oriented services across repositories. The work covered four overlapping strands: user and community requirements, roles and responsibilities, technical architecture and infrastructure, and business and management models.	scope (computer science)	Chris Awre;Alma Swan	2007	OCLC Systems & Services	10.1108/10650750710831510	business model;information and communications technology;computer science;knowledge management;focus group;service-oriented modeling;management science;world wide web	Robotics	-66.52816419389846	-0.3722609617074231	187923
300f813c2d4a1f465088004e18b3b2e387d1357c	new aspect for organic farming practices: controlled crop nutrition and soilless agriculture	hydroponics;aeroponics;organic farming;indoor farming;aquaponics	It has been a great leap through the biotechnology by enabling genetically modified crops to farmers for getting best ever yields. Yet the practice itself and the output is still questionable in regards of its safety. For the modern era a reliable way is open for productive organic farming practices through the adoption of technology. No questions on biotechnology and its outputs are analyzed here. New breakthroughs can be made in the field of modern agricultural practices through technology aided organic farming. Various modern organic farming practices and new aspects for efficient large scale organic crop cultivation methods are discussed. Some proposals are also made in this work.		P. J. Mahesh;Minhas Naheem;Razak Mubafar;S. Shyba;Sunitha Beevi	2016	2016 IEEE Global Humanitarian Technology Conference (GHTC)	10.1109/GHTC.2016.7857374	intensive crop farming;environmental science;zero budget farming;agricultural science;mixed farming;agronomy;agroforestry;ecological farming;integrated farming	Visualization	-67.26934944939345	-2.049669161994721	188288
e8bb40730878254bbfa19c529b08492a7b0bf32f	building the smart platforms ecosystem: toward an apps-based health information economy			ecosystem;smart	Kenneth D. Mandl;Brian D. Athey;Daniel S. Fritsch;Shawn N. Murphy;Will Ross	2012			ecosystem;environmental resource management;environmental science;environmental planning;information economy	Metrics	-68.095850522645	-1.754980887903699	188484
e281332bab5093b31536da38ce9f1b35ad7066f0	design of an information system supporting distribution and selling of newspapers in a small enterprise			information system	Darko Kovacevic;Asja Kovacevic;Aleksandra Dimcevska	1996			computer science;marketing;nuclear magnetic resonance;information system;newspaper	DB	-69.21399273301981	-1.609218285126291	190488
6893646496d5d2e3b8a43cb7e245aea87d4bf888	information, knowledge, and networked minds	social navigation;mindsets;information systems;information retrieval;information filtering;knowledge management;virtual community;information systems not elsewhere classified;information and communication services;journal article;collaborative filtering;information management;cognition;information resource management;information and communication services not elsewhere classified;information and computing sciences;information;other information and communication services	Knowledge is often seen as information with specific properties; information is viewed as a kind of preliminary stage to knowledge. Given this apparent relationship of information and knowledge it is tempting to apply computer-based information management techniques, such as information retrieval and information filtering, to the management of knowledge as well. A closer look, however, reveals that the effectiveness of computer-based tools is already limited in the information management domain. In order to circumvent similar limitations in the knowledge management domain, we suggest considering humans as scaffolding minds and applying tools in such a way that human cognitive and social capabilities are supported. Examples discussed range from social navigation and collaborative filtering to support for virtual communities of practice.	collaborative filtering;information filtering system;information management;information needs;information retrieval;knowledge management;mind;virtual community	Christopher Peter Lueg	2001	J. Knowledge Management	10.1108/13673270110393194	knowledge base;cognition;information;cognitive models of information retrieval;computer science;knowledge management;collaborative filtering;body of knowledge;personal information management;management information systems;data mining;group information management;management science;knowledge extraction;information management;personal knowledge management;information system;domain knowledge	Web+IR	-66.11717886094713	3.660683931979898	190771
10b3b63e023ea3e6cfe6eedbc19e74171e249454	some recommendations for the reporting of quantitative studies				Ximena López;Jorge Valenzuela;Miguel Nussbaum;Chin-Chung Tsai	2015	Computers & Education	10.1016/j.compedu.2015.09.010	computer science;knowledge management	HCI	-65.06987744371771	-2.062868991210915	190810
5a013c4ab4dd838b84c311ff5ee4f8e6c1f23e1a	mdqm: mediation data quality model aligned data quality model for mediation systems			data quality	Loubna Mimouni;Ahmed Zellou;Ali Idri	2018		10.5220/0006958403170324	data mining;knowledge management;mediation (marxist theory and media studies);data quality;computer science	DB	-66.72209986187872	0.17428350588291133	191774
e930998baa181fa9fa033fb8e7668606777e26bd	computers and the construction of economic models	economic model			R. Burdekin;Roger S. Scowen	1979	Comput. J.	10.1093/comjnl/22.1.3	computer science;economic model	Theory	-64.84674132335805	2.325371533663845	192389
129358d3b9f515dcff83810181c100a783fbeed0	the interactionist perspective on computer implementation				Susan E. Koch	1986	SIGCAS Computers and Society	10.1145/15488.15493	computer science;knowledge management;distributed computing;management science	Vision	-66.24277058820249	-2.0376136465672823	192957
d0080bc74ec2f6c329d82533ef7fb9def34d1de1	enterprise modelling languages - just enough standardisation?	part of book or chapter of book		enterprise modelling;modeling language	Marija Bjekovic;Henderik Alex Proper;Jean-Sébastien Sottet	2013		10.1007/978-3-319-06671-4_1	economics;computer science;operations research	NLP	-67.73936768809347	2.6161417843073753	193841
4884c2096945694c637069d337529405f81b1147	introduction to topics in organizational systems and technology minitrack	organizational systems;technology track;technology minitrack;new idea	This minitrack is special. It is set up to provide a forum for papers in the Organizational Systems and Technology track that do not fit exactly in a specific other minitrack. We often serve as an incubator for new ideas.		Mark N. Frolick;Kelly Rainer;Jim Ryan	2013	2013 46th Hawaii International Conference on System Sciences	10.1109/HICSS.2014.570	software;computer science;knowledge management;quality management;outsourcing	Robotics	-63.38932516745805	-1.9505678985847124	193867
8ef4d79a225ee0866621e60ae42de0b9afa3849c	mapping globalization: visualizing the network of global trade.				Manish Nag	2010	Journal of Social Structure		data mining;globalization;computer science	ML	-69.7786424044657	-0.1820241909574753	194440
37ed403b33cc627b290a21e7beaf3c38416c28b2	intellectual property protection in concurrent engineering domains	intellectual property protection;competence network;supply chain;knowledge based engineering;concurrent engineering	In the age of the globalism the data product definition exchange becomes between the different parties in the creation of value chain, a natural form of business communication. The status of the Knowledge Based Engineering application, the problems with the protection of the Intellectual Property and exemplarily solutions for their protection are explained in the available contribution.		Lionel Antegnard;Harald Liese;Josip Stjepandic	2006			systems engineering;engineering;knowledge management;operations management	DB	-66.07188505152922	1.766972308203458	194835
da76535ff933c1c6f555e22788eb173997a7848c	collaboration support for transport in the retail supply chain - a user-centered design study.				Marit Kjøsnes Natvig;Leendert W. M. Wienhofen	2016		10.1007/978-3-319-49466-1_13	marketing;supply chain;commerce	HCI	-69.60569135861208	-0.5186456997905023	195596
bd381bd0b1d74829eb382747a53f1b734ccdaba7	knowledge connect - an approach for an industrial it service tool				Carsten Beuthel;Paul George;Ulrich Topp	2005			engineering;knowledge management;systems engineering	Logic	-67.13042923098831	1.7241797579488467	195807
448f5fa7b11157748435b499b962bd59791fc6ff	the dynamics of is procurement, case study of a budgeting and financial reporting system			procurement	Ari Heiskanen;Michael Newman	1998			process management;accounting;marketing;procurement;computer science;accounting management	ECom	-69.49219252056068	1.7292092437375557	196063
9789f533707e0fb6b934a44ba9468222cfe5b368	analysis of factors affecting china's cargo insurance demand based on e-commerce background				Xiaoping Liu;Hui Zheng;Yi Yang;Qing Wang	2019	JECO	10.4018/JECO.2019010102		Vision	-69.99038918195555	-0.7372502670298583	196265
5417001588407c9229949ec1162adb8d55ee8bce	valuating it governance strategies with real options in a decision making framework		Information﻿Technology﻿Governance﻿(IT﻿Governance)﻿is﻿an﻿integral﻿part﻿of﻿enterprise﻿governance﻿ which﻿ aims﻿ at﻿ controlling﻿ the﻿ formulation﻿ and﻿ the﻿ implementation﻿ of﻿ strategic﻿ objectives﻿ of﻿ an﻿ organization.﻿The﻿implementation﻿of﻿IT﻿governance﻿strategies﻿generates﻿goals﻿and﻿projects﻿whose﻿ achievements﻿are﻿subject﻿to﻿the﻿availability﻿of﻿IT﻿resources.﻿In﻿order﻿to﻿monitor﻿the﻿achievement﻿of﻿ these﻿strategies,﻿the﻿authors﻿propose﻿to﻿extend﻿the﻿traditional﻿Real﻿Option﻿Analysis﻿(ROA)﻿framework﻿ to﻿valuating﻿governance﻿strategies﻿and﻿illustrating﻿them﻿as﻿classical﻿governance﻿notions.﻿A﻿decisionmaking﻿framework﻿aiming﻿at﻿generating﻿the﻿best﻿investment﻿decisions﻿and﻿responding﻿to﻿governance﻿ constraints﻿is﻿developed.﻿In﻿their﻿simulation﻿model,﻿the﻿authors﻿consider﻿control﻿elements﻿associated﻿ with﻿quality,﻿ resources﻿and﻿time.﻿This﻿modeling﻿approach﻿stands﻿out﻿by﻿opening﻿the﻿way﻿to﻿new﻿ decision-making﻿models﻿based﻿on﻿ROA﻿and﻿compliant﻿with﻿IT﻿governance﻿activities. KeyWORDS Decision Support, Governance, Information Systems, Information Technology, Pricing, Real Options, Resources Modeling, Simulation		Rabii El Ghorfi;Mohamed El Aroussi;Mohamed Ouadou;Driss Aboutajdine	2018	IJISSS	10.4018/IJISSS.2018100103	engineering;knowledge management;corporate governance	ECom	-69.29320687360044	1.413047786197638	196336
ecbc132ff5c1e65b6913084d63be9c9213726c98	supply chain integration and coordination for international sourcing in the context of china's processing trade				Mingu Kang;Kihyun Park;Ma Ga Yang;Mark H. Haney	2018	Industrial Management and Data Systems	10.1108/IMDS-11-2017-0528		DB	-69.8216545430965	-0.15820647817835917	196698
bd886ee4f5293f16bfb2be5a293f52bd0ad9e6bb	it ambidexterity for business processes: the importance of balance			business process	Carl Simon Heckmann;Alexander Maedche	2018	Business Proc. Manag. Journal	10.1108/BPMJ-04-2016-0078	business process;knowledge management;computer science	ML	-68.94729313027452	2.4549266869576924	197565
8c590e840b6c66d38ee9c406cdc190287daaa571	information technology education based on cloud computing		Cloud computing era has brought new development ideas for the education information of our country. This paper has summarized and analyzed the definition and computing features of cloud computing combined with the information technology curriculum features. The impact of the cloud computing on information technology education in four aspects has been concluded, and taking Baihui office cloud product as an example, this paper has briefly introduced application and significance of the cloud computing in education of information technology.	cloud computing	Jiangyan Zheng;Shijie Cao;Jianhui Zheng;Zhihui Chen;Liang Hong	2013		10.1007/978-3-642-53932-9_41	cloud computing security;service catalog;cloud computing;software engineering;cloud testing;utility computing;world wide web;computer engineering	HPC	-65.79080203142053	2.6338491119810064	199615
6ba6937013d675f50224f9ec839e6c75aaa21f11	knowledge management: another management fad?	knowledge management			Leonard J. Ponzi;Michael Koenig	2002	Inf. Res.		computer science;knowledge management;sociology;personal knowledge management	DB	-68.40249316100977	0.9020441811669696	199824
c399642f5e70e193e740c5532ef780b1a1eea349	from shring-wrap to software-on-demand: is usage fee licensing going to be a digital cash cow?			digital currency;ecash	Viktor Mayer-Schönberger	1995				HCI	-69.1087499261089	-2.086819764337327	199982
