id	title	keywords	abstract	entities	authors	year	journal	doi	fos	area	x	y	ix
b56e6db1748b58d0f2004095d29a5fea38403f84	introduction to the special issue on multi-lingual information management	information management		information management	Robert E. Frederking;Eduard H. Hovy;Nancy Ide	2001	Computers and the Humanities	10.1023/A:1011854206510	information technology management;information governance;data management;computer science;management information systems;information management;information system	DB	-65.77960269838198	-1.0263811291174971	151670
b10ec2330bd8325f7217c46808091e1b58939c62	multi-agent organisational model for e-contracting	multi agent system;generic model;structure function;point of view;system architecture	Ph.D. studies in computer science with emphasis on Multi-Agent System, Electronic Commerce, Interactive Television and deontic logic. Ph.D. Thesis: Arbitration in Multi-Agent Systems with Electronic Institution Including two main topics: – Organisational meta-model for agents constrain – Normative agents system for constraints respect control Supervisors: Prof. Dr. Olivier Boissier (Fr) and Prof. Dr. Eric Dubois (Lu)	computer science;deontic logic;e-commerce;lu decomposition;metamodeling;multi-agent system;eric	Benjamin Gâteau;Djamel Khadraoui;Eric Dubois;Olivier Boissier	2004			kolmogorov structure function;simulation;computer science;knowledge management;artificial intelligence;multi-agent system;systems architecture	AI	-63.19297911206902	1.6047618525605811	151978
50f85c74462d614c167fe756e0036d3e69f6707e	tactical scheduling for precision air traffic operations: past research and current problems		Future air transportation systems stand to benefit significantly in safety and efficiency from the predictable movement of aircraft along precisely defined paths in the airspace. Such aircraft movement, hereafter referred to as Precision Air Traffic Operations (PATO), is not widely used during periods of peak air traffic in today’s system, but is the foundation of high-capacity operations envisioned for the future. Automation and deployment of PATO, being a relatively young field of research, has not had time to establish structured theories and standardized reference literature. As a consequence, researchers interested in entering this field have difficulty applying to it classical techniques of operations research and optimal control theory. The main obstacle to such applications is the lack of access to the finer domain knowledge of air traffic operations (most importantly, knowledge of the operational constraints) needed to formulate research problems that promise deployable automation tools. Such a formulation requires the researcher to characterize and assess the research efforts and tendencies that emerged in the recent decades to address diverse problems, some outwardly similar yet essentially different. The research field of PATO has now matured to a stage where this requirement can start being met. This paper, aimed as a step in this direction, provides (a) a formulation of the general problem of defining conceptually, constructing, and using a schedule for PATO that contains specification of merging sequences and provides aircraft separation continuously in time, (b) the context necessary for understanding the formulation and its limitations, and (c) a review of prior research on future Air Traffic Operations (ATO) and, in particular, on the role of Air Traffic Control (ATC) in these operations.	atm turbo;advanced tactical center;advanced transportation controller;approximation;automation;cns;computer science;control theory;critical section;diagram;emoticon;human factors and ergonomics;initial condition;mathematical optimization;multigraph;navier–stokes equations;nonlinear system;operations research;optimal control;perturbation theory;pilot ace;recommender system;robustness (computer science);scheduling (computing);schematic;simulation;software deployment;stochastic process	Douglas R. Isaacson;Alexander V. Sadovsky;Damek Davis	2014	J. Aerospace Inf. Sys.	10.2514/1.I010119	simulation;engineering;operations research	DB	-63.81330457796289	4.1746267262515095	152109
3a52e053619c6a94d25f6de87a5dc06f46b6ef6a	aspekte einer perspektivischen ausrichtung für einen tragfähigen unternehmensmodellierungsprozess		To manage the evolution of the organisational structure and the ITsystems of an enterprise different kinds of models are used. Key to this paper is the observation that despite the promises and some elaborate approaches to corporate modelling, many organisations fail to implement a stable long-term activity to keep its models current. A number of influences are identified. Very important is the motivation of the involved persons, mostly the modellers and the support of their work. This comprises technical and organisational aspects. Many of the aspects are conflicting factors. After discussing them, a practical example is outlined and explained along the lines of the reasoning in the first chapters.	gesellschaft für informatik	Frank Wolff	2002			management science;organizational structure;business	HCI	-69.79713126547294	2.3697109119945625	152889
a63b27e63d05cb9b435b9c1bbacbd78fab666c03	conception of system supported generation of sustainability reports in a large scale enterprise	large scale	For a presentation of activities and performance concerning a sustainable development, specific sustainability reports are generated for companies. Characteristics represent an essential part and furthermore a basis of sustainability reports. These indicators collect facts related to economy, ecology and human resources in a concentrated form.		Christian Grünwald;Jorge Marx Gómez	2007		10.1007/978-3-540-71335-7_9	construction engineering;systems engineering;engineering;environmental resource management	NLP	-67.85858090486231	-1.1260237775963238	154312
6a06ea14b13083b17112be61f3c1017697ddf9ee	factors inhibiting the adoption of cloud community systems in dynamic b2b networks: the case of air cargo				Sären Wallbach;Katrin Coleman;Ralf Elbert	2018			air cargo;cloud computing;marine engineering;business	HCI	-69.81103818276708	-0.44105950245572734	154549
8804d5ed49dbec251568aa29b4b405f38b4bc862	exploring the impact of mobile product information systems on consumers' perceived food quality			information systems	Marvin Hegen	2016				HCI	-69.97224476227825	-2.06206765862367	156239
6db6b4b93bce740dedb1e56640b3eceedf14631d	value creation in knowledge networks. five design principles				Magnus Rotvit Perlt Hansen;Jan Pries-Heje	2017	Scandinavian J. Inf. Systems		management science;knowledge management;strategic management;design elements and principles;engineering;information system;design science research;nexus (standard)	Logic	-69.14834965754619	2.1973996783914704	157509
ea7103369d1c1ed42c79d899a808f4d5336f7e8c	online learning in the business environment - tempting or a temptress?				Geoffrey N. Dick;Tom Case;Craig Van Slyke;Phil Ruhlman	2005			knowledge management;process management	ML	-68.98053280230576	2.2390218042936696	157645
15bddde44078cf07a98148f30d8b5b85a5f0b096	diagrammatic attention management and the effect of conceptual model structure on cardinality validation	entity relationship diagrams	“Market Reaction to E-Commerce Impairments and Web-site Outages,” (with J. Anthony and W. Choi). International Journal of Accounting Information Systems, Volume 7, Number 2, June 2006, pp. 60-78. “Market Reaction to E-Commerce Impairments Evidenced by Website Outages Authors’ Response,” (with Joseph Anthony and Wooseok Choi). International Journal of Accounting Information Systems, Volume 7, Number 2, June 2006, pp. 87-90.	diagram;e-commerce;information systems	Cheryl L. Dunn;Gregory J. Gerard;Severin V. Grabski	2011	J. AIS		diagram;cardinality;conceptual model;management science;computer science;data mining;attention management;entity–relationship model;diagrammatic reasoning;information system;database transaction	DB	-64.72965345211696	1.057989395772318	159039
6a585d12bd56faa59d857557fed20b19a2d274ac	the role of enabling technologies for new public management	new public management			Roland Traunmüller	1995			new public management;computer science;knowledge management;environmental resource management	HCI	-68.5068249171153	-1.3076927464309713	159277
e8127442e05cb87ab69a402a1da4157899dac5de	management considerations for an information center	paper shows;key area;information center environment;information center;management consideration;information systems group;paper discusses;business organization	tion Center as part of an Information Systems group within a business organization. The Information Center is defined, including a user’s viewpoint. Three key areas-the mission, organization and position, and stafing-are  addressed. A procedure on  how to initiate the center is presented. In general, the paper shows what an Information Center environment can be and how it might f i t into a business organization.	information system	Lynn W. Hammond	1982	IBM Systems Journal	10.1147/sj.212.0131	data center services;engineering;knowledge management;management science	ML	-63.78201863556693	-0.4838564348831434	159411
a0a29c932db041e9fc6bd5f0c517ad394cbf760c	"""using microfoundations of value co-creation to guide service systems design """" a multilevel design framework"""				Christian Grotherr;Martin Semmann;Tilo Böhmann	2018				EDA	-67.3656665470552	2.1918847222250757	159594
5ac4ea744e84ae749fcb6445141041a4601682a0	internet banking system prototype	human computer interaction;personal computer;internet banking	– Internet Banking System refers to systems that enable bank customers to access accounts and general information on bank products and services through a personal computer or other intelligent device. Internet banking products and services can include detailed account information for corporate customers as well as account summery and transfer money. Ultimately, the products and services obtained through Internet Banking may mirror products and services offered through other bank delivery channels. In this paper, Internet Banking System Prototype has been proposed in order to illustrate the services which is provided by the Bank online services.	e-services;online banking;personal computer;prototype	Rami Alnaqeib;Hamdan O. Alanazi;Hamid A. Jalab;M. A. Zaidan;Ali K. Hmood	2010	CoRR		telephone banking;the internet;human–computer interaction;computer science;internet appliance;retail banking	OS	-63.13182232580668	3.5929964058019106	159621
600da6b4177cecd93d57a3d252b041a63db4d5a2	a novel conceptual architecture for patient-centered health records				Titus K Schleyer;Zachary King;Zina Ben-Miled	2016			knowledge management;conceptual architecture;computer science	HCI	-65.9940989261581	-0.9243356446148254	160347
cc3f99056aea941948013b2cd75cf488adcf3a13	концептуальные основы и архитектура интернет-системы персонализированной поддержки здоровьесбережения на основе интенсивного анализа данных (conceptual foundation and architecture of the internet system for personalized healthcare support using data intensive analysis)				Vyacheslav Krutko;Alexey Molodchenkov	2016			architecture;personalized medicine;the internet;engineering;knowledge management	AI	-66.23203173326847	-0.7065504910891532	160812
9abc01337db06a074977bab5532ad48cae9dce92	so many mibs!		Abstract#R##N##R##N#The proliferation of MIBs can provide a wealth of information to the network manager, but to process this information requires some investment in understanding the MIBs supported by the device being managed.		Debby Koren	1992	Int. Journal of Network Management	10.1002/nem.4560020307	knowledge management	Networks	-68.92248604193875	-0.010328950260483171	161047
3c7ef26e5f28c663fc4813e72e21b44315030df3	management styles and performance: a knowledge space framework	management styles;knowledge management;conceptual model;organizational performance	"""Users who downloaded this article also downloaded: (2014),""""Leadership styles: relationship with conflict management styles"""", International Journal of Conflict Management, Vol. 25 Iss 3 pp. 214-225 http://dx.doi.org/10.1108/IJCMA-12-2012-0091 (2004),""""The interplay between performance measurement, organizational culture and management styles"""", Measuring Business Excellence, Vol. 8 Iss 3 pp. 28-41 http://dx.doi.org/10.1108/13683040410555591 (2001),""""Gender differences in leadership styles and management skills"""", Women in Management Review, Vol. 16 Iss 5 pp. 244-257 http:// dx.doi.org/10.1108/09649420110395728"""	knowledge space;software management review	Helen Hasan;Maen Al-Hawari	2003	J. Knowledge Management	10.1108/13673270310492912	organizational performance;organizational learning;economics;knowledge economy;computer science;knowledge management;conceptual model;body of knowledge;management science;procedural knowledge;personal knowledge management;knowledge value chain;management;management styles	Metrics	-65.91502794124115	1.051556541704912	161560
63d1a5f5cbae791c193b83ede5d9ef591b952581	a simulation for understanding the role of information systems and information quality in the move towards a green supply chain.	it enabled supply chain management			Hiro Takeda;Frantz Rowe;Johanna Habib;François de Corbière;Nicolas Antheaume	2012			supply chain risk management;supply chain management;service management;computer science;knowledge management;operations management;supply chain	AI	-69.46420068815362	1.022176373266073	161908
1c86883f21fe2f8c5d6fa0e8c7d79c75fce7ef93	the regulation of shared resources - impacts on the logistics sector				Sören Brandt;J. Zimmermann	2014		10.1007/978-3-319-23512-7_2	business administration;operations management;business	NLP	-69.66627801845439	1.221070496180959	162013
45833c74d10d16af07a8050fe3badea3230c0e83	iq as an enabler of the green and collaborative supply chain				Anne Chistine Le Dû;François de Corbière	2011			process management;supply chain;manufacturing engineering;engineering	NLP	-68.61042075523528	1.7059328118363568	162336
e85c4e069490087bd42561e468ad8c68c5f64aaf	the strength of r&d network ties in high-tech sectors - a multi-dimensional analysis of the effects of tie strength on innovation performance	network ties;high tech sectors;multi dimensional;article letter to editor;r d partnerships;innovation performance;tie strength	The strength of R&D network ties in high-tech sectors – a multi-dimensional analysis of the effects of tie strength on innovation performance Danielle Bertrand-Cloodt a , John Hagedoorn b & Hans Van Kranenburg c a Research Centre for Education and the Labour Market, School of Business and Economics, Maastricht University, The Netherlands b Department of Organization and Strategy, UNU–MERIT, School of Business and Economics, Maastricht University, The Netherlands c Nijmegen School of Management, Institute for Management Research, Radboud University Nijmegen, The Netherlands Published online: 01 Nov 2011.	bertrand (programming language)	Danielle Bertrand-Cloodt;John Hagedoorn;Hans Van Kranenburg	2011	Techn. Analysis & Strat. Manag.	10.1080/09537325.2011.621294	marketing;operations management;management	Metrics	-64.5842265247181	0.510196138480859	162368
b3f8bf0b6c6d5c8728ba88416e14384b3d96534d	emerging spatial competences				Agostino Gibaldi;Silvio P. Sabatini;Sylvain Argentieri;Zhengping Ji	2015	Robotics and Autonomous Systems	10.1016/j.robot.2015.03.006	knowledge management;computer science;simulation;competence (human resources)	Robotics	-68.35433692707215	0.39703343413172104	164746
6e823a1cb764ff98da928dfb06a20ada37d162bc	a hermeneutic study of pattern mining as a knowledge creation process: exploring multimedia design practices	school of management and information systems;respubid20155;design practice;knowledge crystallisation;pattern mining;domain knowledge;8902 computer software and services;hermeneutics;knowledge sharing;patterns;2001 communication and media studies;knowledge creation	In this paper, we discuss a special case of knowledge creation via pattern mining that was studied using a hermeneutic approach. The reported study explores the nature of knowledge creation by domain practitioners who do not communicate directly. The focus of this paper extends the traditional view of a knowledge creation process beyond organisational boundaries. The proposed knowledge creation framework explains the facilitated process of knowledge creation by its qualification, combination, socialisation, externalisation, internalisation and introspection, thus allowing the transformation of individual experience and knowledge into formalised shareable domain knowledge.	data mining	Tanya Linden;Jacob L. Cybulski	2010	JIKM	10.1142/S0219649210002668	organizational learning;knowledge integration;computer science;knowledge management;body of knowledge;knowledge-based systems;knowledge engineering;open knowledge base connectivity;management science;procedural knowledge;pattern;knowledge extraction;personal knowledge management;knowledge value chain;hermeneutics;domain knowledge	HCI	-66.63936458241453	3.609405483643519	165214
ab8f34c5f88c1939c477e76391a31b1f2fece1db	the early-stage development of two-sided digital platforms: a simulation approach				Michelle Désirée Haurand;Christian Stummer	2018			knowledge management;systems engineering;computer science	EDA	-67.68671335404902	1.4757813614427115	165787
7707cc48fd575ae463a69f85e90daf8785e259bd	innovation and synergy of hit approaches addressing complex care within the va			synergy	Denise M. Hynes;Alexander S. Young;Michael Ohl;Thomas K. Houston;Mary Kane Goldstein	2013			management science;medicine	HCI	-66.23585976389379	-2.113500434133807	165854
6dcc9e7ad05a14362174c4f0c25eae73fd1ef8a1	tacit knowledge in professional firms: the teachings of firms in very puzzling situations	tacit knowledge;knowledge management;knowledge intensive workers;professional service firms;professional services	"""Tacit knowledge in professional firms: the teachings of firms in very puzzling situations Philippe Baumard Article information: To cite this document: Philippe Baumard, (2002),""""Tacit knowledge in professional firms: the teachings of firms in very puzzling situations"""", Journal of Knowledge Management, Vol. 6 Iss 2 pp. 135 151 Permanent link to this document: http://dx.doi.org/10.1108/13673270210424666"""	knowledge management	Philippe Baumard	2002	J. Knowledge Management	10.1108/13673270210424666	public relations;computer science;knowledge management;personal knowledge management;knowledge value chain;management	NLP	-66.06902461296119	1.0190098665317322	166030
48f5c2651bfbcfa18ca07cb860bc22bbc05e4969	"""""""grey-box"""" and """"black-box"""" supplier-buyer relationship in product innovation under technology and market uncertainty"""				Mehmet Ali Incekara	2018		10.1109/ICE.2018.8436260		ECom	-68.2134174624734	0.9757574543824227	166135
d2a7e0db5f7111a146bbafb7a32522a479188814	toward the development of an integrated economic data base at the world bank	integrated economic data base;world bank			Jan-Henrik Johansson;John D. Shilling	1981			economic data;computer science;data mining;chinese financial system	DB	-69.88865786094765	0.08504789838122552	167130
03d406b894d813b86895cb25b7a6291aa261618f	emerging technologies to support indirect procurement: two case studies from the petroleum industry	outsourcing;electronic commerce;case studies;procurement;emerging technology;internet technology;internet;petroleum industry;critical success factor	This paper discusses the use of emerging Internet technologies to support indirect (nonproduction oriented) procurement processes. We provide an overview of objectives and available technologies and outline some of the critical success factors and key decision points. Two case studies from the Petroleum Industry help demonstrate the concepts.	commerce one;desktop computer;e-commerce;erp;internet;microsoft outlook for mac;offset binary;oracle database;outsourcing;partial template specialization;plug and play;procurement;purchasing;semiconductor consolidation;virtual organization (grid computing)	Judith Gebauer;Arie Segev	2000	Information Technology and Management	10.1023/A:1019160605755	e-commerce;the internet;economics;procurement;computer science;petroleum industry;marketing;operations management;critical success factor;emerging technologies;commerce;outsourcing	HCI	-69.68132157995679	1.5949861121420321	167432
fd479a7ffe120fdb92d8cf4ce7e541849ba0c162	a systemic approach to organizational safety modeling and analysis				Alexei Sharpanskykh	2012	IJISCRAM	10.4018/jiscrm.2012070104	knowledge management;engineering;organizational safety	SE	-66.88700345179289	1.9453176503215301	167821
e6d01f1824757286fabd3bdd6d57ebfc840a331a	emerging patterns in the use of xml for information modelling in vertical industries	information model	S. Hinkelman D. Buddenbaum L.-J. Zhang Extensible Markup Language (XML) has emerged as the predominant non-binary information format. The impact of XML has been most strongly felt in information exchange environments and information modeling. This paper focuses on a set of innovative patterns that has emerged in the use of XML for information modeling and business content design in the health-care, travel, insurance, and other industries. We provide historical perspectives on this development and characterize XML’s current state in relation to Web Services.	content format;information exchange;information model;markup language;web service;xml	S. Hinkelman;D. Buddenbaum;L.-J. Zhang	2006	IBM Systems Journal	10.1147/sj.452.0373	binary xml;geography markup language;information model;computer science;data mining;database;ebxml;world wide web;xml schema editor;efficient xml interchange	Web+IR	-65.9119001791826	2.9425187348802333	168452
5ab0ae530c7b814310c85cb8b4ecc3fa5b1ad520	scoping and developing institutional data services: the data libraries of 2020			library (computing);scope (computer science)	Luis Martinez-Uribe	2009			data mining;database;data as a service;business	HPC	-66.54046808780707	-0.5357389988439298	168840
bd40bccae5715226ac47c9e8698234d371e30271	evaluating management informatoin systems		Management information systems are not generally evaluated in a systematic fashion. This article provides an MIS evaluation framework and describes its application to a strategic planning information system.		William R. King;Jaime I. Rodriguez	1978	MIS Quarterly		reliability engineering;economics;computer science;systems engineering;engineering;knowledge management;management information systems;risk management information systems	EDA	-68.68280088765579	3.5750911923283293	168948
75c14bd0ee7e079e246a618c5fa718b5b1db8731	knowledge management and electronic commerce applications: aprilia's after-sales service system			e-commerce;knowledge management	Ettore Bolisani;Enrico Scarso	1998			knowledge management;marketing;service system;process management;computer science	DB	-69.28114588299948	1.497926119786865	169089
447e7d26dace60d99b3934297731699a3e15b722	a multi-dimensional exploration of global software outsourcing projects in the uk's financial services sector			outsourcing	Ji Zhou	2011				SE	-70.02339484716408	1.1327818222930492	169741
dc4d1248f3a3611856a3b85cba49010461b63e9a	does the approach matter? a qualitative study on differences concerning time pressure in agile and sequential information system projects				Christian Süllwold;Dirk Basten;Janek Richter	2018			knowledge management;information system;qualitative research;agile software development;computer science	HCI	-69.0491796511205	2.8326921512541445	169814
ac5b94b91367a7f39e587af56cb4940fd9fa7c21	shared collaborative spaces challenges in inter-organisational collaborative projects				Mozhdeh Dehghani;Tom Denison;Larry Stillman	2018			knowledge management;computer science	HCI	-67.95836745146717	1.6569761523088995	170374
117bf17961b4042025feda694c6bf333dbc32fb5	recommendations in augmented reality applications - the effect of customer reviews and seller recommendations on purchase intention and product selection				Martin Adam;Mario Pecorelli	2018				HCI	-69.78129904110733	-1.6645034205440343	170506
fc55cc9f41207cad21531b5282412b3ae6212a09	focusing information in manufacturing: a knowledge management perspective	information technology;knowledge management;knowledge worker;manufacturing;strategic information systems;information system;management;knowledge workers	"""Focusing information in manufacturing: a knowledge management perspective Ely Laureano Paiva Aleda V. Roth Jaime Evaldo Fensterseifer Article information: To cite this document: Ely Laureano Paiva Aleda V. Roth Jaime Evaldo Fensterseifer, (2002),""""Focusing information in manufacturing: a knowledge management perspective"""", Industrial Management & Data Systems, Vol. 102 Iss 7 pp. 381 389 Permanent link to this document: http://dx.doi.org/10.1108/02635570210439472"""	data system;knowledge management;realms of the haunting	Ely Laureano Paiva;Aleda V. Roth;Jaime Evaldo Fensterseifer	2002	Industrial Management and Data Systems	10.1108/02635570210439472	executive information system;information technology management;economics;information governance;data management;computer science;systems engineering;knowledge management;information integration;personal information management;management information systems;group information management;information industry;management science;risk management information systems;information quality;information management;manufacturing;personal knowledge management;strategic information system;management;law;information technology;information system;information security management	DB	-66.08271845962004	1.1758171791892156	171049
