id	title	keywords	abstract	entities	authors	year	journal	doi	fos	area	x	y	ix
998059350a5310b8e3a40b47ecd0c381d44f495d	smart tourism: traveler, business, and organizational perspectives				Chulmo Koo;Jaehyun Park;Jae-Nam Lee	2017	Information & Management	10.1016/j.im.2017.04.005	tourism geography;marketing;commerce	DB	-69.92035488178719	-1.3249757848365458	171442
ab1057676be2aae3b242251f0c5f2c0bd679b66c	atira a/s : : breaking down silos with quality data relations - how pure enables uniform management reporting on top of cerif		Management reporting at universities has traditionally been a labour intensive exercise, trying to capture and link unstructured and often duplicate data across a wide range of systems including Finance, Costing, Research repositories, Students and HR. Here we present how Pure enables uniform reporting by linking and refining input from individual researchers or administrative staff with information already present within existing administrative systems in the CERIF data model. We will include best practices based on real-life examples. ___ Thomas Vestdam, PhD., M.Sc.SE Development Manager, Atira A/S Thomas Vestdam is the Manager of the Pure Platform and Pure GUI development teams in Atira, and as such manages the development of the Pure product. Thomas holds a Ph.D. in Computer Science from Aalborg University (2004) and has extensive experience in developing and implementing CRIS systems. Additionally, Thomas has been involved in several projects on interoperability between research systems including FRIS (BE), CRISPool funded by JISC in the UK, and CERIF in Action, also funded by JISC in the UK. Thomas is also a member of the CERIF task group under euroCRIS. Bo Alroe, B.A. Product Director, Atira A/S Bo Alroe had a B.A. in Informatics from Aalborg University in 1991 before taking up a career in the IT industry, focusing through several positions on work within customer-specific enterprise server-side IT-solutions. Today, his area of expertise is IT-support of large research organisations' business processes related to research administration, strategic research management, individual research portfolio management, research financing, and research library science. Bo is Product Director at Atira A/S since 2004, working with Pure and the planning of Pure implementations at universities and other research organisations. ___ Further information: http://www.atira.dk/en/pure/ Contact: tv@atira.dk, ba@atira.dk	best practice;business process;call of duty: black ops;computer science;data model;eurocris;graphical user interface;informatics;interoperability;library science;pure;real life;server (computing);server-side;tridiagonal matrix algorithm	Bo Alroe;Thomas Vestdam	2012			data mining;information silo;computer science	DB	-63.23385905726	0.035581884736117016	172285
024ebee3938c67f391a8ed99f9280b8f93f06509	semantic assistance nets	information structure;personal computer;digital communication;economic impact;object oriented;network management;ontological engineering	Improving the semantic level of the information handling provided by personal computers is likely to be a way both to use the increasing hardware capacities of these machines and to improve their economic impact. While this goal is widely recognized as abstractly desirable, it has not been clear how to accomplish it. This paper presents a design for organizing resources that are presently available, or that soon will be, to obtain systems that should provide significantly improved aids to understanding in fields where there is a substantial base of empirically verified information that involves nonnumeric relationships. Laboratory sciences appear to provide the fields with the greatest scope for such development at present, but there may also be opportunities to use such systems in investment and entrepreneurship. The resources to be assembled include frame-oriented databases and their associated ontological engineering organizations, high-bandwidth digital communications networks, microprocessor systems for vectorized numerical processing and object-oriented processing, larger units for these same purposes, high-capacity storage media, and network management software to coordinate the use of special hardware resources. The role of the personal computer in such a system will be as a combination of a vehicle for navigation through the information structures thus provided and as a node where information received over networks will be integrated with locally produced data. There have been many previous papers about topics related to those in this paper, but the focus of the present discussion is on integrating diverse information to outline the characteristics of the new systems, the prospect of successful development based on sound mathematical principles, and the specificity of the concept for important new fields of application.	database;frame language;information processing;microprocessor;numerical analysis;ontology engineering;organizing (structure);personal computer;sensitivity and specificity;telecommunications network	William David Miller	1990		10.1145/99412.99434	simulation;computer science;knowledge management;management science;automated information system	HPC	-65.14524847132091	3.7249296638278437	172720
814b1a3eddfaaa9f0348fe44d3ee5cb8edb40a48	enterprise architecture development approach in the public sector				Hamood Al-Kharusi;Suraya Miskon;Mahadi Bahari	2018	IJEIS		systems engineering;engineering;enterprise architecture;public sector	SE	-69.16686139498306	2.989435911740619	172946
80072a22c0abed0cf70c78a5c93aa2987ffebf35	rethinking b2b e-marketplaces and mobile commerce: from information to execution	mobile commerce;information flow;digital economy;ease of use;near real time;business process;real time data	"""This article investigates the interface between the exchange relationship in the digital economy and the emerging and continuously improving wireless technology. Exchanges become highly relevant when we look at how collaborative processes are performed. A special emphasis is placed on enabling collaboration between multiple business partners. In most cases, companies require standardization of information flows and business processes to be able to collaborate. Here, trading platforms, private and public exchanges will play a much more important role due to their increased ease-of-use (as opposed to EDI for example). The key line of thought is that collaboration is essentially based on information sharing, information sharing enables exception management, exception management relies on near real-time data, and real-time data can be collected through wireless technologies. The key ideas of online marketplaces are discussed along with the evolution and future of exchanges in the digital economy, to help management rethink the exchange relationship in the digital economy. Introduction B2B is about connecting the existing buyer and sellers. It is not a disintermediation play. It is about intelligently implementing Internet technology to improve business processes. The online B2B market across the world is increasing in value rapidly, but there are some hurdles and limitations to be met in the near future. The report, from Strategy Analytics (an international research and consulting firm), notes that s global B2B e-commerce transactions will grow from $226 billion in 2001 to $2.02 trillion in 2006 [Bellomy 2002]. The B2B eCommerce revolution includes eProcurement, B2B exchanges, and business infrastructure relationships. eProcurement involves firms selling supplies, equipment, materials, and services with a streamlined online purchasing function that often eliminates traditional intermediaries, thereby reducing costs and cycle times while offering greater flexibility and responsiveness to changes in demand. Web-based supply chain management networks improve coordination between trading partners by linking a firm's forecasting and production planning systems with its suppliers' and distributors' systems. They can create dramatic savings and quality improvements. B2B exchanges include various categories of market spaces, including vertical market portals (""""vortals""""), hubs, and various types of auctions. A single Infomediary (industry consortium or 3rd party) brings together many buyers and sellers within a specific vertical market, such as plastics, steel, or industrial chemicals, charging a commission on all transactions. Hundreds of industry-specific exchanges have now been launched, and more are being developed every day. Some of these 'market spaces' operate with posted pricing models, while others employ collaborative negotiated prices, auctions, reverse auctions, Dutch auctions, and other pricing mechanisms. Many are used in spot markets for industrial materials, overstocks, and perishable goods, as well as business services transactions. More important is the development of entirely new eBusiness infrastructure industries. Many firms support online activity by facilitating the interaction between various parties in eCommerce as preferred outsourcers for eBusiness processes. They have become integral to the effective operation of Internet-based activities and may account for the largest source of profits from the future growth of eCommerce. They provide digital content or improve its delivery, bring new customers to websites, finance acquisitions, and provide many other services. They include application services providers, content maximizers, wireless service providers, and payment processors. The key questions addressed in this paper are: What does the exchange landscape look like in the digital economy and what can be inferred from the past to chart the direction and value proposition for the future? This Journal of Electronic Commerce Research, VOL. 3, NO. 2, 2002 Page 87 paper is structured as follows: Following this introduction, we will describe the characteristics and differentiators of online marketplaces followed by the evolution of e-marketplaces. In the next section we conduct an in-depth assessment of e-marketplaces and discuss event management and wireless-enabled exchanges. The concluding section tracks the transforming future of exchanges in the digital economy and provides a summary of the more general lessons, in terms of rethinking the exchange relationship in the digital economy. Online Marketplaces: Characteristics and Differentiators The possible forms of B2B marketplace are point-to-point connections (extranet), or e-marketplaces (Independent Trading Exchange (ITE)). As shown in figure 1, e-marketplaces can be either one-to-many or manyto-many environments. The key pricing mechanisms are fixed/static pricing (i.e., catalog-type/aggregator sales), and dynamic/variable pricing which includes both exchanges and auctions where price is negotiated in real time. An auction is one buyer and many sellers, or one seller and many buyers, whereas an exchange is many buyers and many sellers. However, caution is advised since almost everything is calling itself an exchange. Most are simply catalogs where buyers can search across multiple suppliers. Buyer Auction Exchange Seller Auction Traditional Electronic Relationship S M B"""	business process;central processing unit;content management system;die (integrated circuit);digital recording;disintermediation;e-commerce;edi;emoticon;ethernet hub;extranet;imperative programming;infomediary;internet;link exchange;mobile commerce;one-to-many (data model);online marketplace;point-to-point protocol;portals;programming paradigm;purchasing;real-time clock;real-time computing;real-time data;responsiveness;variable pricing	Mahesh S. Raisinghani;Hanns-Christian L. Hanebeck	2002	J. Electron. Commerce Res.		information sharing;marketing;supply chain management;economics;reverse auction;variable pricing;electronic business;ubiquitous commerce;vertical market;digital economy	AI	-69.38768121382837	-1.0763962474590987	172985
7b1fc5ee3e4a7ce073f93fc30e4d02d165ee3b00	empirical lateral-force-model for forklift tires			lateral thinking	Sergey Stepanyuk;Rainer Bruns;Konstantin Krivenkov	2017	Logistics Research		operations management;business	Crypto	-68.90689425781187	0.01203653909789204	173372
46ef2577248167a0c17cd4985aaba3c2789859f8	evolution of online marketing tools, approaches and strategies with associated challenges: a survey				Shikha Gupta;Atul Mishra	2019	IJTD	10.4018/IJTD.2019010104		HCI	-66.89628275832902	-1.936406048099131	173826
0a50276a3804fc64f7adc0c8f0689da0c857a868	self-organizing executive information networks	neural networks;information network;executive support systems;self organization;self organizing systems;information systems architecture	"""Organizations acquire decision support systems in order to an existing in format ion system. Around 50% of deliver the information needed for decision making. But at total implemented program code is unused, """"dead"""" executive levels, rapid changes in organizational structure or code, and an est imated 50% of all periodic reports executive decision making can quickly obsolete an existing produced in an organizat ion are obsolete at any information dissemination structure. Insights gained from prior one time. The U.S. spends over $100 bil l ion anresearch in executive activities, executive support systems and neural networks are used in this research to design an adaptive, nual ly for p rogram coding and main tenance [31]; self-organizing system for the dissemination of information to most of this is required to to manage """"dead"""" code executives. These self-organizing executive information netand changed in format ion needs [32]. In the past, works are able to learn from the changing needs of their rapid organizat ional and envi ronmenta l change, executive constituency. A neural network based executive inthe major reason for """"dead"""" code and useless formation system incorporates a system for responding to organizational changes in responsibilities and information f lows reports, has posed significant problems for the as an integral part of the information dissemination system, design of executive support systems. Executive Extensive research in neural network based computer systems support systems (ESS) may be compromised by and in studies of biological systems have shown the practicality in format ion overload, in format ion that is unavail-"""	artificial neural network;biological system;dead code;decision support system;executive information system;floor and ceiling functions;organizing (structure);self-organization	J. Christopher Westland	1992	Decision Support Systems	10.1016/0167-9236(92)90036-O	executive information system;self-organization;decision support system;computer science;knowledge management;artificial intelligence;management information systems;management science;management;information system;artificial neural network	AI	-65.47994120580694	3.7000986390273627	173997
980264995c73ff2c5fed23568daf127355d74e33	panel description: are we headed towards smart solutions?	software;technological innovation;green products;industries;medical services;economics;industries economics green products cloud computing medical services software technological innovation;cloud computing			Rajesh Subramanyan	2010	2010 IEEE 34th Annual Computer Software and Applications Conference	10.1109/COMPSAC.2010.86	cloud computing;computer science;operating system;management science;services computing	Embedded	-69.4445480355911	0.3162772370317834	174605
8470edf3b62e4961aaad55bf76f21202ab70749a	are we there yet? functionalities, synergies and pitfalls of major digital humanities infrastructures			digital humanities;synergy	Agiatis Benardou;Erik Champion;Lorna M. Hughes;Sally Chambers;Costis J. Dallas;Alastair Dunning	2014			systems engineering;digital humanities;engineering	Crypto	-66.43205172739013	-2.20445658123496	174612
2fa209658d46b70a118eb3b0460174c36fadade5	introduction and overview: perspectives on ... implementation and evaluation of an integrated information center in an academic environment				George D'Elia	1997	JASIS		data mining;data science;computer science;management science	HPC	-65.1133711367403	-2.332286644694883	174943
948f8eaff3a9ed1f3d520fb5a47e98b7c1292509	research on it governance, risk, and value: challenges and opportunities				Roger S. Debreceny	2013	J. Information Systems	10.2308/isys-10339	knowledge management;computer science;corporate governance	DB	-69.40085269120596	0.9879690680130254	175550
5f74c235b6ec2eddc5af8bce8e065dae4aad9983	strategic adjustment between innovation and production: generation of integrated archetypes in spanish service firms	service industry competitiveness;strategic alignment;service industry;innovation strategy;technology and innovation studies;firm performance	This paper investigates empirically the strategic alignment between innovation and production strategies in a sample of service firms in Spain. It employs the integrated archetypes approach to analyse a dataset of unique, manually collected, firm responses. The results highlight differences in behaviour patterns underpinning both kinds of strategic decisions and, coherent with alignment theory, differential firm performance. How to quote or cite this document Hortelano, Dioni Elche and Moreno, Ấngela González (2008). Strategic Adjustment Between Innovation and Production: Generation of Integrated Archetypes in Spanish Service Firms Manchester Business School Working Paper, Number 551 available: http://www.mbs.ac.uk/research/workingpapers/ María Dioni Elche Hortelano (dioni.elche@uclm.es) is Associate Professor of Management at the Faculty of Economics, University of Castilla-La Mancha (Spain). Her research interests include innovation strategy, mainly innovation in services, and strategic fit. Between July and September 2007 she was visiting researcher at the Manchester Institute of Innovation Research. Ángela González-Moreno (angela.gonzalez@uclm.es) is Lecturer of Strategic Management at the Faculty of Economics, University of Castilla-La Mancha (Spain), where she is ViceDean of the Faculty of Economics. She got a degree in Economics and Business Administration from the University of Valencia and a Ph.D. in Management from the University of Castilla-La Mancha. Her research interests include innovation in the service sector, corporate entrepreneurship and strategic analysis.	coherence (physics);gramática de la lengua castellana;integrated software;linear algebra;strategic management	Dioni Elche Hortelano;Angela Gonzalez-Moreno	2010	Techn. Analysis & Strat. Manag.	10.1080/09537325.2010.488055	tertiary sector of the economy;economics;marketing;operations management;management;strategic alignment;economic growth	Web+IR	-64.58967150274349	0.5407810604254444	176461
228f44f6dc20550d9ee193bea6fed56456f3faa5	towards the development of a conceptual framework for knowledge enhanced e-workflow modelling	conceptual framework			John Ndeta;Farhi Marir	2005			knowledge management;conceptual framework;computer science;workflow	AI	-67.97981775408576	2.756564297369099	176677
55397811542d632e499111239a422b3b6ad8845e	information technology for the welfare of mankind	cybernetics;complexity theory;information technology;systems engineering and theory;cognition;humans systems engineering and theory organizations cybernetics cognition complexity theory information technology;humans;organizations	THE PRINCIPAL thrust of activities within the IEEE Systems, Man, and Cybernetics Society is the development and use of the methods of systems engineering, together with the strongest of emphasis on human-system interaction concerns, for the design of knowledge-based cybernetic systems and processes that support human activities in planning, design, decisionmaking, and associated resource allocation.	ieee systems, man, and cybernetics society;systems engineering;thrust	Andrew P. Sage	1984	IEEE Transactions on Systems, Man, and Cybernetics	10.1109/TSMC.1984.6313307	biomedical cybernetics;cognition;cybernetics;medical cybernetics;computer science;organization;knowledge management;artificial intelligence;management science;information technology	Visualization	-64.77677536923467	-1.172716037268542	176962
9fce82012c67278dd1745d340272f5ea0fa115c7	multi-screen strategy for selling mobile content to customers	mobile device;multi screen;digital business model;mobile content;econometric analyses			Kyeongseo Hwang;Sung-Hyuk Park;Ingoo Han	2012			mobile search;computer science;marketing;operating system;mobile device;advertising;mobile business development;internet privacy;mobile payment	HCI	-69.64606910472932	-1.6807113198798485	177270
81b00f5d38cf3f83f889ef587f8693a214280411	multiparticipant decision making and balanced scorecard collaborative	balanced scorecard			Daniel Xodo	2005			collaborative software;business;social learning;balanced scorecard;benchmarking;workflow;strategy map;knowledge management	ECom	-68.77478016995082	2.325570101285749	177281
fcf6fd420c3b92e8db1f3b9de96bc4541d2f958c	synergies: on the production of a sustainable, open, e-publication infrastructure for the academy			academy;itil;synergy	Michael Eberle-Sinatra	2011				NLP	-68.19728955514886	-1.8021392863670478	178184
8b5077b65a2e97dd472836eb69eebb4d20257906	protocol verification techniques: status quo and perspectives.	protocol verification			Michal Sajkowski	1984			environmental resource management;status quo;computer science	Logic	-68.26635814572249	-1.1993919396191752	178337
8e3202c37b966d04fba320c73f5d84bf255dfa6d	the design of edi controls using case-based reasoning: edicbr	use case		case-based reasoning;electronic data interchange	Sangjae Lee;Ingoo Han	1998	Int. Syst. in Accounting, Finance and Management	10.1002/(SICI)1099-1174(199809)7:3%3C135::AID-ISAF148%3E3.0.CO;2-C		AI	-68.17311074026941	2.182794742156627	178507
2af43e30e33d7064b7b2ea86278bb8fa8bc7a8e4	ethical decision making in software piracy: initial development and a test of a four-component model			component-based software engineering	Trevor T. Moores;Jerry Cha-Jan Chang	2006	MIS Quarterly			SE	-67.63708650783158	-0.5007168251994433	178508
4d1619c81a7cfb8223bd1f72567f20f45329facf	the adoption of social media analytics for crisis management - challenges and opportunities				Stefan Stieglitz;Milad Mirbabaie;Jennifer Fromm;Stefanie Melzer	2018				DB	-67.65755549472068	-1.49657291724495	179899
e042bdbad43d41901ccf1474f34d080304dfa06e	paid internet advertising (pia) and frequency of apps-buying decisions: insights from the retail enterprises in an emerging market			online advertising	Sajad Rezaei;Maryam Emami;Nurlida Ismail	2018	J. Enterprise Inf. Management	10.1108/JEIM-08-2017-0113		Web+IR	-69.9992304019771	-1.5473707482918326	180709
4f2ba93ae98d021325753f347df785e238538c25	designing a sustainable closed-loop supply chain network based on triple bottom line approach: a comparison of metaheuristics hybridization techniques	corporate social responsibility;network design;metaheuristics;multi objective programming;environmental management;supply chain management	Recently, there is a growing concern about the environmental and social footprint of business operations. While most of the papers in the field of supply chain network design focus on economic performance, recently, some studies have considered environmental dimensions.	metaheuristic;supply chain network	K. Devika;Ahmad Jafarian;Vahid Nourbakhsh	2014	European Journal of Operational Research	10.1016/j.ejor.2013.12.032	network planning and design;supply chain management;service management;computer science;environmental resource management;marketing;operations management;management science;corporate social responsibility	Robotics	-69.23053382273598	0.4187123502738306	181830
475a311c9c45ccdc8fcb6f116851cd56ea52d1bd	measuring performance of information systems in evolving computing environments: an empirical investigation	information system		information system	Jaeho Heo;Ingoo Han	2000			information system;knowledge management;human–computer interaction;computer science	HPC	-68.41292864012479	0.6788870282819206	181836
1d782e15d9e93dd478792e738d49734a0e95c7ef	applying semantic web technologies in product information management at nxp semiconductors		In the electronics industry, the ability to get accurate, timely product data in front of the customer is a key factor in the overall business process. In this paper we describe how NXP is making use of Semantic Web technology such as RDF and SPARQL to manage a product taxonomy for marketing purposes that forms the key navigation of the NXP website (http://www.nxp.com) and the next steps to extend this to create a domain model covering applications, technologies and other key entities that can be used to create rich user journeys through the content.	business process;domain model;entity;information management;resource description framework;sparql;semantic web;semiconductor	Parvathy Meenakshy;John Walker	2014			business process;data mining;computer science;domain model;semantic web;information management;rdf;sparql;knowledge management;product classification	Web+IR	-65.78218825307864	3.09713360049464	182203
8bb57a1374371ab235480bedc4b718090d6970c3	extending crm in the retail industry: an rfid-based personal shopping assistant system	retail industry		radio-frequency identification	Eric W. T. Ngai;Karen Ka-Leung Moon;James Nga-Kwok Liu;Kam Fai Elvis Tsang;R. Law;F. F. C. Suk;I. C. L. Wong	2008	CAIS			Robotics	-69.33355281069876	-1.2544972430665966	182226
40b6a8494c6e6bcc04366d18c5cd98de30c64830	sourcemap: eco-design, sustainable supply chains, and radical transparency	supply chain	Industry and consumers need tools to help make decisions that are good for communities and for the environment.		Leo Bonanni	2011	ACM Crossroads	10.1145/1961678.1961681	supply chain risk management;service management;computer science;supply chain	HCI	-69.39091361833061	0.1418305743681233	182443
