id	area	title	year	x	y	ix
3509785	EDA	reliability aware yield improvement technique for nanotechnology based circuits	2009	-5.342549838305914	12.786768143736445	3509812
3511077	EDA	a fault tolerance technique for combinational circuits based on selective-transistor redundancy	2017	-5.368453820938	12.95790245441074	3511104
3512536	EDA	a waveform independent gate model for accurate timing analysis	2005	-6.127329921272974	12.415266485755376	3512563
3514298	EDA	scalable dynamic technique for accurately predicting power-supply noise and path delay	2013	-5.911632054783901	12.279474211074078	3514325
3515035	EDA	a tsv repair scheme using enhanced test access architecture for 3-d ics	2013	-5.581700322049273	12.260674350740617	3515062
3516079	EDA	error prediction based on concurrent self-test and reduced slack time	2011	-5.297532286953267	12.962416856517894	3516106
3516722	EDA	automated critical device identification for configurable analogue transistors	2012	-5.831482683449871	12.335139155091099	3516749
3517356	EDA	accurate and effective algorithm for estimating the reliability of digital combinational circuits	2013	-5.690263909708128	12.665264875944517	3517383
3517662	EDA	reliable sizing of power networks in vlsi circuits	1992	-5.514221267964237	12.387779389820066	3517689
3518298	EDA	reduction of coupling effects by optimizing the 3-d configuration of the routing grid	2003	-6.1864266189444495	12.999587758985546	3518325
3521193	EDA	quick supply current waveform estimation at gate level using existed cell library information	2008	-5.625074412010221	12.493112588968039	3521220
3521862	EDA	on the energy complexity of algorithms realized in cmos	1996	-5.321839968003814	12.632831642130654	3521889
3522523	EDA	advanced timing analysis based on post-opc extraction of critical dimensions	2005	-5.987607371893143	12.737349977932082	3522550
3522921	EDA	optimal synthesis of qca logic circuit eliminating wire-crossings	2017	-6.102612103124673	12.344058496484045	3522948
3523925	EDA	linking statistical learning to diagnosis	2008	-5.5418318096142976	12.434495084379174	3523952
3524602	EDA	delay fault detection problems in circuits featuring a low combinational depth	2007	-5.517713070678994	12.262479197625785	3524629
3524680	EDA	setbist: an soft-error tolerant built-in self-test scheme for random access memories	2011	-5.4046512577942005	13.061791097888765	3524707
3524844	EDA	glitch-aware pattern generation and optimization framework for power-safe scan test	2007	-5.72156295623825	12.356110866160627	3524871
3525446	EDA	state-aware single event analysis for sequential logic	2013	-5.452859104487961	12.873336317641199	3525473
3526330	EDA	analog behavioral modeling for age-dependent degradation of complex analog circuits	2014	-5.95737164157728	12.828190139148314	3526357
3526888	EDA	a statistical model of cell-to-cell variation in li-ion batteries for system-level design	2013	-6.241337769600409	12.655987241281338	3526915
3528608	Vision	cost reduction in the ccd realization of mvmt function	1990	-5.491557983957722	12.41743883608722	3528635
3532084	Arch	eval: utilizing processors with variation-induced timing errors	2008	-5.8130839235264515	12.994589169039473	3532111
3532875	EDA	power conscious test synthesis and scheduling for bist rtl data paths	2000	-6.240202430090402	12.62109686237617	3532902
3533329	EDA	statistical gate sizing for timing yield optimization	2005	-6.249297564095051	12.464754438714811	3533356
3534919	EDA	dynamic ir drop estimation at gate level with standard library information	2010	-5.652991061838537	12.32787524265348	3534946
3535619	EDA	challenges in power-ground integrity	2001	-5.32314966976113	12.823812150012396	3535646
3536020	EDA	characterization and design for variability and reliability	2008	-5.339321597223034	12.368073378952648	3536047
3536294	Embedded	muccra4-bb: a fine-grained body biasing capable drp	2016	-6.148634455205923	12.427120460886679	3536321
3537885	EDA	iddq testing method using a scan pattern for production testing	2005	-5.616611762654177	12.640217561694092	3537912
3538242	EDA	monitoring of aging in integrated circuits by identifying possible critical paths	2014	-5.438016504991095	12.693919954202121	3538269
3539817	EDA	defect detection differences between launch-off-shift and launch-off-capture in sense-amplifier-based flip-flop testing	2009	-5.463405704842237	12.395270570849238	3539844
3540517	EDA	dynamic voltage (ir) drop analysis and design closure: issues and challenges	2010	-5.7824089129212775	12.486885550616556	3540544
3540842	EDA	on nbti degradation process in digital logic circuits	2007	-5.358841870613694	13.060433343968393	3540869
3541676	EDA	architectural assessment of design techniques to improve speed and robustness in embedded microprocessors	2009	-5.979597979166496	13.111934346523693	3541703
3541710	EDA	performing stateful logic on memristor memory	2013	-5.471211944103152	12.942188121411354	3541737
3542515	EDA	modelling and compensating for clock skew variability in fpgas	2008	-5.817945080519623	13.198956152207446	3542542
3542781	EDA	"""""""timing closure by design, """" a high frequency microprocessor design methodology"""	2000	-5.363025139617976	12.62009093572573	3542808
3543843	EDA	a spatially-adaptive bus interface for low-switching communication (poster session)	2000	-6.039571296045607	12.968169781785784	3543870
3544985	EDA	statistical soft error rate (sser) analysis for scaled cmos designs	2012	-6.100753577995008	12.751724832963333	3545012
3546246	EDA	session ep1: power management and optimization challenges for sub 90nm cmos designs- what is the real cost of long battery life?	2006	-5.40611245155527	13.06363102136657	3546273
3546316	EDA	rf-interconnect resource assignment and placement algorithms in application specific ics to improve performance and reduce routing congestion	2012	-5.946951186112628	13.182969824315775	3546343
3547817	EDA	effective capacitance macro-modelling for architectural-level power estimation	1998	-6.190868396542799	12.316267133717954	3547844
3550805	EDA	tsv aware timing analysis and diagnosis in paths with multiple tsvs	2014	-5.706687209919465	12.262905405138538	3550832
3551898	EDA	the heisenberg uncertainty of test	2002	-5.505423826146934	12.482496967740724	3551925
3552259	EDA	a new design-for-test technique for sram core-cell stability faults	2009	-5.298026102329213	12.832756345306699	3552286
3554836	EDA	temperature-driven power and timing analysis for cmos ulsi circuits	1999	-6.1337309751722	13.048558804532735	3554863
3554893	EDA	design and characterization of a new fault-tolerant full-adder for quantum-dot cellular automata	2015	-5.460458137997176	12.888967086236304	3554920
3554921	Arch	exploiting inactive rename slots for detecting soft errors	2010	-5.766848827363742	12.637465883858724	3554948
3556146	Robotics	design of a logically reversible half adder using 2d 2-dot 1-electron qca	2015	-5.998840476344802	12.994754075088395	3556173
3556183	EDA	seu-tolerant qdi circuits	2005	-5.430623732670701	12.418175605892696	3556210
3557038	EDA	mrf reinforcer: a probabilistic element for space redundancy in nanoscale circuits	2006	-5.607436146802389	13.041365759830553	3557065
3562441	EDA	understanding the effect of intradie random process variations in nanometer domino logic	2008	-6.251196553545205	13.088741844747693	3562468
3562455	EDA	transition delay fault testing of 3d ics with ir-drop study	2012	-5.697209141621783	12.487002391497088	3562482
3563352	EDA	faulty tsvs identification and recovery in 3d stacked ics during pre-bond testing	2013	-5.57740912343339	12.303528813557707	3563379
3566457	EDA	mid-bond interposer wire test	2013	-5.3755587425351345	12.458137165064702	3566484
3566948	EDA	logic synthesis and defect tolerance for memristive crossbar arrays	2018	-5.460247777253964	12.881917649928221	3566975
3572420	EDA	testing interconnects for noise and skew in gigahertz socs	2001	-5.727965564744253	12.865949622817686	3572447
3574763	EDA	simulation-based analysis of seu effects in sram-based fpgas	2002	-5.393805504682777	12.578741986487849	3574790
3575568	EDA	test cost reduction for performance yield recovery by classification of multiple-clock test data	2012	-6.048860243939289	12.60630054348361	3575595
3575601	EDA	general timing-aware built-in self-repair for die-to-die interconnects	2015	-5.315809614149633	12.349608781087241	3575628
3577015	EDA	low power combinational circuit synthesis targeting multiplexer based fpgas	2004	-5.393502219861977	12.310609303563604	3577042
3577903	EDA	automatic ecl lsi design	1977	-5.5236916197781865	12.572079404688678	3577930
3578462	Arch	power noise in 14, 10, and 7 nm finfet cmos technologies	2016	-5.497705254870744	13.140992005205344	3578489
3578960	EDA	back-end-of-line defect analysis for rnv8t nonvolatile sram	2013	-5.3478919331086985	12.418633448431635	3578987
3580638	EDA	redressing timing issues for speed-independent circuits in deep submicron age	2011	-5.5217208500018655	12.685420265919536	3580665
3581695	EDA	sizing consideration for leakage control transistor	2004	-6.201310471453352	12.890907412450824	3581722
3583585	EDA	testing domino circuits in soi technology	2000	-5.432484193349626	12.885430980541694	3583612
3586262	EDA	model-based initial bias (mib): toward a single-iteration optical proximity correction	2016	-5.4917537883894205	12.592892475410792	3586289
3587957	EDA	spice-inspired fast gate-level computation of nbti-induced delays in nanoscale logic	2015	-6.125411430217392	12.776894348785415	3587984
3588376	EDA	soft failures in integrated circuits as a matter of esd events	2018	-5.643099220534261	12.751814059689247	3588403
3590908	Arch	hardware implementation of the double-tree scan architecture	2010	-5.977965588918093	12.406010758386886	3590935
3593754	EDA	error correction via restorative feedback in m-ary logic circuits	2014	-6.147349657490857	12.49453416813403	3593781
3596837	EDA	extreme wafer thinning optimization for via-last applications	2016	-5.535359043655348	12.877409802183786	3596864
3597755	EDA	an efficient technique to select logic nodes for single event transient pulse-width reduction	2013	-5.719856875449088	12.630227599014823	3597782
3600212	EDA	a robust c-element design with enhanced metastability performance	2017	-5.7750066175719805	12.537879138640768	3600239
3603290	EDA	area efficient circuit tuning with floating-gate techniques	1999	-5.699805305844809	12.682581108042262	3603317
3609009	EDA	reducing the leakage and timing variability of 2d iccs using 3d ics	2009	-5.839193003815442	12.313217714517313	3609036
3609601	Visualization	cutting metastability using aperture transformation	2004	-5.4142722753001165	12.301154215494632	3609628
3610589	Arch	experimental evaluation of dynamic power supply noise and logical failures in microprocessor operations	2009	-5.50359065993827	12.522795102142007	3610616
3614371	EDA	ohmic weave: memristor-based threshold gate networks	2015	-5.320312481147462	13.143928993369766	3614398
3615660	EDA	repeater scaling and its impact on cad	2004	-5.350879386302825	12.500574860190987	3615687
3616208	Arch	on the effects of intra-gate resistive open defects in gates at nanoscaled cmos	2011	-5.906888083612009	12.845732678383966	3616235
3618786	EDA	crosstalk modeling to predict channel delay in network-on-chips	2010	-5.8440220109150935	12.793678391614215	3618813
3619053	EDA	strategies for improving the parametric yield and profits of 3d ics	2007	-5.893236585023392	12.937572103197592	3619080
3619900	EDA	programmable techniques for cell stability test and debug in embedded srams	2005	-5.444431745087712	12.751743806896133	3619927
3620844	EDA	robust adders based on quantum-dot cellular automata	2007	-5.691196244664942	12.897964786499088	3620871
3621121	EDA	improving thermal-safe test scheduling for core-based systems-on-chip using shift frequency scaling	2005	-5.340436609988672	12.51022921943407	3621148
3621443	HPC	a cellular computing architecture for parallel memristive stateful logic	2014	-6.177079235236792	13.136448801804544	3621470
3621528	EDA	idap: a tool for high-level power estimation of custom array structures	2003	-5.935861211234057	12.731053851244214	3621555
3630044	EDA	fault modeling and detection for drowsy sram caches	2006	-5.396914490562211	12.628463563304546	3630071
3630067	EDA	this paper presents a cost-effective area-io dram a cad tool and algorithms	2005	-5.93551160181918	12.840062247038114	3630094
3631706	EDA	crosstalk noise variation assessment and analysis for the worst process corner	2008	-6.1939955805182425	12.802215842719708	3631733
3633291	EDA	improved analytical delay models for rc-coupled interconnects	2011	-6.262048403479753	12.78701593060471	3633318
3633932	EDA	impact of body bias on delay fault testing of sub-100 nm cmos circuits	2006	-5.980105046590705	13.145343679316356	3633959
3634393	EDA	a power grid optimization algorithm considering via reliability	2011	-6.232305567434447	12.779448217151778	3634420
3636061	EDA	logic ser reduction through flip flop redesign	2006	-5.753586946893108	13.086341354627617	3636088
3636074	EDA	covering hard-to-detect defects by thermal quorum sensing	2018	-5.656435511331959	12.905367564754929	3636101
3637993	SE	novel circuit-level model for gate oxide short and its testing method in srams	2014	-5.729095264124964	12.410487257839868	3638020
3639001	EDA	behavioral transformations to increase noise immunity in asynchronous specifications	1999	-5.793213001704407	12.35412407166394	3639028
3639026	EDA	reconsidering high-speed design criteria for transmission-gate-based master–slave flip-flops	2012	-6.0095031813144	13.030928860791755	3639053
3642566	EDA	failure mechanisms and test methods for the sram tvc write-assist technique	2016	-5.48333744018716	12.729282245880606	3642593
3645046	EDA	probabilistic wire resistance degradation due to electromigration in power grids	2017	-5.796784186430316	12.993163540042133	3645073
3645388	EDA	yield modeling and beol fundamentals	2001	-5.400348860392219	12.711621512664333	3645415
3646138	EDA	interconnect optimization considering multiple critical paths	2018	-5.34225219589214	12.79960314274425	3646165
3647296	EDA	pre-bond testable low-power clock tree design for 3d stacked ics	2009	-5.7669095346200665	12.545005429471226	3647323
3647514	EDA	energy-delay efficient test	2007	-6.2164888035078025	12.808106689025973	3647541
3647552	EDA	a high-speed design methodology for inductive coupling links in 3d-ics	2018	-6.142068364847412	12.704080242557245	3647579
3647561	EDA	on selection of adjacent lines in test pattern generation for delay faults considering crosstalk effects	2017	-5.717001904045103	12.303961816782985	3647588
3651630	EDA	efficient observation point selection for aging monitoring	2015	-5.378488791717082	13.094252036798974	3651657
3651738	EDA	cntfet-rfb: an error correction implementation for multi-valued cntfet logic	2016	-5.957660695719311	12.423977742005045	3651765
3652022	EDA	an sram weak cell fault model and a dft technique with a programmable detection threshold	2004	-5.615540389816284	12.72532910309955	3652049
3653441	EDA	why we need statistical static timing analysis	2007	-5.6666444598523125	12.963353352720086	3653468
3656301	EDA	research on data recovery technology based on flash memory device	2018	-5.3850942713672305	13.112250962705266	3656328
3658244	EDA	radic: a standard-cell-based sensor for on-chip aging and flip-flop metastability measurements	2012	-5.892952475553389	13.144783598985855	3658271
3658476	Arch	optimizing checking-logic for reliability-agnostic control of self-calibrating designs	2007	-5.534829286476186	12.992278155477585	3658503
3659904	Logic	on the design of a fault tolerant ripple-carry adder with controllable-polarity transistors	2015	-5.855403254096014	13.161861023485505	3659931
3660286	EDA	vernier ring based pre-bond through silicon vias test in 3d ics	2017	-5.605155758601546	12.358030284202925	3660313
3660321	EDA	custom on-chip sensors for post-silicon failing path isolation in the presence of process variations	2012	-5.756869800345094	12.372989598453241	3660348
3661647	EDA	useful application of cmos ternary logic to the realisation of asynchronous circuits	1997	-5.851600404667624	12.431353694654813	3661674
3662744	EDA	an embedded iddq testing circuit and technique	2005	-5.515437113508147	12.632802033686936	3662771
3662841	Arch	single-event performance of differential flip-flop designs and hardening implication	2016	-5.648553798855981	12.963162550193616	3662868
3662899	EDA	a dll-based test solution for through silicon via (tsv) in 3d-stacked ics	2015	-5.7387186485213295	12.470984798292582	3662926
3662985	EDA	unified approach for simulation of statistical reliability in nanoscale cmos transistors from devices to circuits	2015	-6.186131359085027	12.769647427296047	3663012
3663170	EDA	an architecture for fault-tolerant computation with stochastic logic	2011	-5.382976884874264	12.52056163046566	3663197
3663548	NLP	sensitivity and reliability evaluation for mixed-signal ics under electromigration and hot-carrier effects	2001	-5.689272708141751	12.721323426587697	3663575
3664433	EDA	hotspot prevention using cmp model in design implementation flow	2008	-6.176374786050153	12.817091395056474	3664460
3664974	EDA	on effective through-silicon via repair for 3-d-stacked ics	2013	-5.40151338101728	12.602583428463795	3665001
3665312	Arch	analysis of setup and hold margins inside silicon for advanced technology nodes	2016	-5.5115253214120745	13.11676053179932	3665339
3669107	EDA	optimising ring oscillator frequency on a novel fpga device via partial reconfiguration	2014	-5.809486520033188	12.753168202631644	3669134
3670464	EDA	modeling of passive elements and reliability	2009	-5.504056974840586	13.003365465079733	3670491
3670865	EDA	synchronization of wave-pipelined circuits	1994	-6.154828453163695	12.305966684122055	3670892
3673137	EDA	test cycle power optimization for scan-based designs	2010	-5.440953029106209	12.378222781867654	3673164
3675425	EDA	evaluating yield and testing impact of sub-wavelength lithography	2010	-5.422482723769939	12.499677695912563	3675452
3675428	EDA	from ambipolarity to multifunctionality: novel library of polymorphic gates using double-gate fets	2018	-5.566107820494497	12.766620475104757	3675455
3676729	EDA	scalable calculation of logical masking effects for selective hardening against soft errors	2008	-5.574516267550579	12.274846452396927	3676756
3677371	EDA	leakage and leakage sensitivity computation for combinational circuits	2003	-6.152879861091519	12.686661203716247	3677398
3677961	EDA	interconnect implications of growth-based structural models for vlsi circuits	2001	-5.621416061222859	12.549449439233197	3677988
3678439	EDA	controller re-specification to minimize switching activity in controller/data path circuits	1996	-5.310396149483237	12.435689526155649	3678466
3679329	EDA	activity-sensitive flip-flop and latch selection for reduced energy	2007	-5.666306060338934	13.181733111271894	3679356
3684101	EDA	estimating power supply noise and its impact on path delay	2012	-5.962326174609465	12.451187805199444	3684128
3684454	Arch	a refined electrical model for particle strikes and its impact on seu prediction	2007	-5.9445597362308105	12.918983397562124	3684481
3687694	Vision	circuit performance oriented device optimization using bsim3 pre-silicon model parameters	2000	-5.585616121981871	12.27295039595144	3687721
3688237	EDA	clock skew verification in the presence of ir-drop in the powerdistribution network	2000	-5.8803984529905415	12.497185946536842	3688264
3688596	EDA	area and reliability efficient ecc scheme for 3d rams	2012	-5.5711003051527515	12.978620346515912	3688623
3689311	EDA	static noise analysis for digital integrated circuits in partially-depleted silicon-on-insulator technology	2000	-5.716857531301727	12.489554987274813	3689338
3689435	EDA	a tsv-cross-link-based approach to 3d-clock network synthesis for improved robustness	2014	-5.714221264973059	12.459350852366688	3689462
3689655	EDA	yield and speedup improvements in extensible processors by allocating extra cycles to some custom instructions	2016	-5.591350455311297	12.837155114274001	3689682
3691017	EDA	peakaso: peak-temperature aware scan-vector optimization	2006	-6.232351122682955	12.388250864770837	3691044
3695099	HPC	power-simulation of cell based asics: accuracy-and performance trade-offs	1998	-5.902754733218619	12.817525074305149	3695126
3695293	EDA	a detailed vth-variation analysis for sub-100-nm embedded sram design	2006	-5.980663018754507	13.186261938867412	3695320
3697363	EDA	analysis and test of resistive-open defects in sram pre-charge circuits	2007	-5.457453322711471	12.567100993961168	3697390
3698345	EDA	robust fpga design under variations	2010	-5.795289453908408	13.046279371089632	3698372
3699093	SE	investigation on marginal failure characteristics and related defects analysed by soft defect localization	2009	-5.501033020215038	12.459717541072006	3699120
3704518	EDA	a new concept for computing using interconnect crosstalks	2017	-5.9846514161308075	12.379176854825447	3704545
3705269	Embedded	handling clock-domain crossings in dual clock-edge logic for dfx features	2018	-5.343938445652818	12.50093631488107	3705296
3705950	EDA	particle swarm optimization guided multi-frequency power-aware system-on-chip test scheduling using window-based peak power model	2014	-6.209043217096234	12.810918172069814	3705977
3706944	Embedded	a bist-based charge analysis for embedded memories	2004	-5.363713967861315	12.728628691297462	3706971
3708952	SE	an overview of the applications of a pulsed laser system for seu testing	2000	-5.47023218685912	13.001347489763385	3708979
3711778	EDA	application of alpha power law models to pll design methodology	2005	-6.236866056285307	12.428232818304705	3711805
3712311	EDA	clock tree synthesis with methodology of re-use in 3d ic	2012	-6.010092419267282	12.81751041357075	3712338
3712512	Embedded	dual edge triggered flip-flops for noise aware design	2011	-5.570776921704228	12.430475036524742	3712539
3713258	EDA	smap: heterogeneous technology mapping for area reduction in fpgas with embedded memory arrays	1998	-5.376826080822517	13.02435647960763	3713285
3713528	Robotics	performance improvement for high speed devices using e-tests and the spice model	2001	-5.663038821278557	12.57997324163924	3713555
3713753	EDA	area-efficient reconfigurable-array-based oscillator for standard cell characterisation	2012	-5.642599078471867	12.302510272333482	3713780
3715023	EDA	inaccuracies in power estimation during logic synthesis	1996	-6.0855749592554345	12.281109357866828	3715050
3716668	EDA	on tolerating faults of tsv/microbumps for power delivery networks in 3d ic	2017	-5.3365712946211445	12.900623270754064	3716695
3721417	EDA	fast identification of true critical paths in sequential circuits	2018	-5.791045485207747	12.610694833964093	3721444
3722561	EDA	a novel technique to detect aging in analog/mixed-signal circuits	2016	-5.598034687670946	12.806340099852026	3722588
3723390	EDA	high-voltage stress test paradigms of analog cmos ics for gate-oxide reliability enhancement	2001	-5.951876919739423	12.791163454374216	3723417
3726011	Embedded	an improved hardware implementation of the fault-tolerant clock synchronization algorithm for large multiprocessor systems	1990	-5.6483822236961165	12.78357377018409	3726038
3726530	EDA	a soft error mitigation technique for constrained gate-level designs	2008	-5.831926343142826	12.867828222945	3726557
3728710	EDA	a vectorless framework for power grid electromigration checking	2013	-6.167087077617718	12.785344434551506	3728737
3731976	Visualization	an analysis of high-speed, linear-passive binary, read-only stores	1968	-6.088733138833996	12.465718848695062	3732003
3732524	EDA	automatic layout integration of bulk built-in current sensors for detection of soft errors	2016	-5.335423723126288	12.946174235143475	3732551
3732764	EDA	clock generator behavioral modeling for supply voltage glitch attack effects analysis	2016	-5.336763223045577	12.87725042123878	3732791
3733275	EDA	quantum-dot cellular automata circuits with reduced external fixed inputs	2017	-5.553068273382281	12.571285119560144	3733302
3733393	Arch	analysing degradation effects in charge-redistribution sar adcs	2013	-5.601035945566377	12.904447959302486	3733420
3734261	EDA	impact of systematic spatial intra-chip gate length variability on performance of high-speed digital circuits	2000	-6.1884437456592645	13.062815650231734	3734288
3734377	EDA	tsv fault-tolerant mechanisms with application to 3d clock networks	2011	-5.469130028374732	12.847123637535114	3734404
3734399	EDA	comparing 32nm full adder tmr and dtmr architectures	2017	-5.375994313964004	13.18864856079018	3734426
3735790	Embedded	indirect method for random jitter measurement on socs using critical path characterization	2012	-6.170331643660942	12.282198877273506	3735817
3735893	EDA	compact modeling of carbon nanotube thin film transistors for flexible circuit design	2018	-5.5171613785483835	13.099995383961337	3735920
3737349	EDA	study of impact of bti's local layout effect including recovery effect on various standard-cells in 10nm finfet	2018	-5.88270926375258	13.143964545845751	3737376
3738968	EDA	mitigating partitioning, routing, and yield concerns in 3d ics by multiplexing tsvs	2011	-5.690176142961122	13.179698952458004	3738995
3739271	EDA	the noise immunity of dynamic digital circuits with technology scaling	2004	-6.2202703926266025	13.069989499492262	3739298
3739631	EDA	electrical behavior of gos fault affected domino logic cell	2006	-5.746450414025383	12.998415053950472	3739658
3739782	EDA	design space exploration for minimizing multi-project wafer production cost	2006	-5.323578590196843	12.251046292939085	3739809
3741498	EDA	technology scaling effects on multipliers	1998	-5.412643275247134	12.84960810506008	3741525
