id	area	title	year	x	y	ix
2935663	EDA	address bus encoding techniques for system-level power optimization	1998	-6.2237404425754805	12.727767520044868	2935690
2942324	SE	a framework to minimize test escape and yield loss during iddq testing: a case study	2000	-5.457042551341834	12.54199094953365	2942351
2943405	Arch	case study on speed failure causes in a microprocessor	2008	-5.424421483337278	12.260941965578976	2943432
2943618	EDA	an alternative organization of defect map for defect-resilient embedded on-chip memories	2007	-5.335670263900962	12.92262952859653	2943645
2943844	Arch	a method to reduce resources for quantum error correction	2017	-6.170596595212955	12.386167673204293	2943871
2944206	EDA	reliability analysis of combinational circuits with the influences of noise and single-event transients	2013	-5.961274580493686	12.576431397884306	2944233
2947374	EDA	test pattern selection for potentially harmful open defects in power distribution networks	2009	-5.3183947053600695	12.737967313104818	2947401
2948203	EDA	soft faults and the importance of stresses in memory testing	2004	-5.4312464015997115	12.822843469356993	2948230
2948401	EDA	bridge defect diagnosis for multiple-voltage design	2008	-5.570470835350849	12.312599388805065	2948428
2950189	EDA	power minimization using control generated clocks	2000	-5.781854173084063	12.367629855952954	2950216
2951001	Embedded	accurate alpha soft error rate evaluation in sram memories	2013	-5.747110968752932	13.178398995762622	2951028
2954602	EDA	saving power by mapping finite-state machines into embedded memory blocks in fpgas	2004	-6.089790765612966	12.760631843591925	2954629
2957148	EDA	schmitt trigger on output inverters of ncl gates for soft error hardening: is it enough?	2014	-5.589711566533643	12.930960133805568	2957175
2961382	EDA	seat-la: a soft error analysis tool for combinational logic	2006	-6.011556824744434	12.445440507210105	2961409
2961466	EDA	is overlay error more important than interconnect variations in double patterning?	2009	-5.976819911733731	12.908692586623998	2961493
2963454	EDA	12.2 a 7nm finfet sram macro using euv lithography for peripheral repair analysis	2017	-5.80266854578632	13.179689194521911	2963481
2963515	SE	on detection of resistive bridging defects by low-temperature and low-voltage testing	2005	-5.602867625068464	12.563264618979268	2963542
2963560	Arch	a defect level monitor of resistive open defect at interconnects in 3d ics by injected charge volume	2017	-5.506694088178122	12.404313603771708	2963587
2965511	EDA	power benefit study for ultra-high density transistor-level monolithic 3d ics	2013	-5.297910074819575	13.107517780413922	2965538
2965551	EDA	stochastic timing error rate estimation under process and temporal variations	2015	-6.232093478572893	12.888154030514949	2965578
2965634	EDA	on the accuracy of elmore-based delay models	2009	-5.7934763688494035	12.481811620587905	2965661
2965701	EDA	temperature- and voltage-aware timing analysis	2007	-6.037525583257668	12.74537158399523	2965728
2965953	EDA	efficient function mapping in nanoscale crossbar architecture	2011	-5.418182939403744	12.535378749239024	2965980
2968185	EDA	modeling transistor level masking of soft errors in combinational circuits	2015	-5.806621175154553	12.844407604927651	2968212
2968781	EDA	thermal aware cell-based full-chip electromigration reliability analysis	2005	-5.710821539089934	13.06532375736078	2968808
2969997	EDA	hot-carrier reliability assessment in cmos digital integrated circuits	1998	-5.99253849439025	13.049060030716634	2970024
2970166	EDA	fault modeling and simulation of power supply voltage transients in digital systems on a chip	2005	-5.986162424421102	12.506151080590714	2970193
2970931	EDA	context-sensitive static transistor-level ir analysis	2008	-5.4763437303844915	12.277299704812707	2970958
2971340	EDA	kth-aggressor fault (kaf)-based thru-silicon-via interconnect built-in self-test and diagnosis	2012	-5.524459044725892	12.374968982020615	2971367
2971538	Arch	defect characterization for scaling of qca devices [quantum dot cellular automata ]	2004	-5.562105393801644	12.909893755157784	2971565
2973619	EDA	multivoltage aware resistive open fault model	2014	-5.624633777911692	12.776862558440294	2973646
2973709	EDA	thermal aware timing budget for buffer insertion in early stage of physical design	2012	-6.177914512313673	13.078376971707385	2973736
2973939	EDA	measurement-based ring oscillator variation analysis	2010	-5.7152551209090925	13.09788675587325	2973966
2974099	EDA	i/sub ddq/ testing for deep-submicron ics: challenges and solutions	2002	-5.845878113123312	12.935259299421086	2974126
2974340	Mobile	layer redundancy based yield improvement for 3d wafer-to-wafer stacked memories	2011	-5.347533224845918	12.70207269163951	2974367
2975719	Arch	a concurrent checking scheme for single and multibit errors in logic circuits	1992	-6.240713309111812	12.461266058072619	2975746
2975735	EDA	statistical prediction of circuit aging under process variations	2008	-6.198485501176123	13.171260861739944	2975762
2976911	Embedded	online tsv health monitoring and built-in self-repair to overcome aging	2013	-5.311459660329271	12.988545948488648	2976938
2979861	EDA	robust passive hardware metering	2011	-5.77543573636477	13.151000039874175	2979888
2981653	EDA	an error correction method for binary and multiple-valued logic	2011	-5.974331311052056	12.422239483478224	2981680
2983146	EDA	simultaneous switching noise: the relation between bus layout and coding	2008	-6.096391586480008	12.406922079819667	2983173
2986048	DB	test scheduling for multi-clock domain socs under power constraint	2008	-5.422747784735962	12.467645685453233	2986075
2988337	SE	avoiding burnt probe tips: practical solutions for testing internally regulated power supplies	2014	-5.641290303287282	12.605659951569452	2988364
2990513	SE	small-delay defect detection in the presence of process variations	2007	-5.7012693079233845	12.665693589454696	2990540
2991314	EDA	accuracy of quasi-monte carlo technique in failure probability estimations	2016	-5.841745116254572	12.393248412902679	2991341
2991791	EDA	behavior and test of open-gate defects in finfet based cells	2016	-5.465505428499418	12.721018822039301	2991818
2995372	Arch	cnt-count failure characteristics of carbon nanotube fets under process variations	2011	-5.9776363951512215	13.177713291338428	2995399
3000821	EDA	on dealing with the charge trapped in floating- gate mos (fgmos) transistors	2007	-5.851665688536679	12.977186780701757	3000848
3002683	EDA	gpu acceleration for pca-based statistical static timing analysis	2015	-6.142826072527059	12.303245748637785	3002710
3004658	Arch	em-aware memory mapping algorithms for sram based fpga	2018	-5.711270727909517	12.756391849945604	3004685
3011672	EDA	characterizing substrate coupling in deep-submicron designs	2002	-5.4030439211755175	12.32688826423449	3011699
3012265	EDA	proximity optimization for adaptive circuit design	2016	-5.981595985410607	13.182027312668824	3012292
3012909	EDA	regression-based rtl power models for controllers	2000	-5.934115694205597	12.249829919306395	3012936
3020450	EDA	power grid analysis and verification considering temperature variations	2012	-6.144295903040726	13.037043572902384	3020477
3020515	EDA	soft error rate determination for nanoscale sequential logic	2010	-6.0581006799503925	12.707766439160993	3020542
3021604	EDA	optimal manufacturing flow to determine minumum operating voltage	2011	-6.04105610101753	12.9522413933215	3021631
3023087	Arch	design of an efficient power distribution network for the ultrasparc-i microprocessor	1995	-5.3988250089283225	12.616833863231616	3023114
3023721	EDA	logic-level fast current simulation for digital cmos circuits	2005	-5.977888930181759	12.354179335205426	3023748
3024028	EDA	parasitic parameters impacts investigation on soft error rate by a circuit level framework	2015	-5.836529576994313	13.007400329889409	3024055
3024297	EDA	variations, margins, and statistics	2008	-5.899848855390406	12.823025470049831	3024324
3025683	EDA	low-power and process variation tolerant memories in sub-90nm technologies	2006	-5.783453031947813	13.168221512746086	3025710
3026119	EDA	automatic generation of inexact digital circuits by gate-level pruning	2015	-6.188114113211094	12.847811152565914	3026146
3028081	EDA	leakage and leakage sensitivity computation for combinational circuits	2005	-6.206173278352453	12.611088042840931	3028108
3029021	EDA	probabilistic approach for yield analysis of dynamic logic circuits	2008	-6.174181523590867	12.803184363119554	3029048
3029596	Robotics	a comparative study of single-phase clocked latches using estimation criteria	1994	-5.746582386312468	12.341199519090129	3029623
3030134	EDA	power analysis techniques for soc with improved wiring models	2002	-5.985863457652233	12.523676398714626	3030161
3030156	EDA	analysis of coupling noise in dynamic circuit	2003	-6.159592051304039	12.883417564399256	3030183
3030200	EDA	an aging-aware transistor sizing tool regarding bti and hcd degradation modes	2015	-5.602513103627381	13.121163715413516	3030227
3031701	PL	optimal p/n width ratio selection for standard cell libraries	1999	-6.2233809264151105	13.004410629685664	3031728
3034356	EDA	power and delay analysis of 4:2 compressor cells	2005	-5.948111312372394	12.892642079061119	3034383
3035019	EDA	a statistical model-based cell-to-cell variability management of li-ion battery pack	2015	-6.215408473261465	12.70887112489303	3035046
3036732	EDA	simulation of power grid networks considering wires and lognormal leakage current variations	2003	-6.259751392776889	12.833366541412078	3036759
3039704	EDA	output waveform evaluation of basic pass transistor structure	2002	-5.809592851400239	12.64150606852648	3039731
3041475	EDA	on effective i/sub ddq/ testing of low voltage cmos circuits using leakage control techniques	2000	-5.644508243736692	12.674443022227551	3041502
3041934	EDA	noise-aware driver modeling for nanometer technology	2003	-6.089373914605749	12.6477568498825	3041961
3042326	EDA	clarinet: a noise analysis tool for deep submicron design	2000	-5.892496388972063	12.257744184195984	3042353
3042402	EDA	turtle logic: a new probabilistic design methodology of nanoscale digital circuits	2010	-5.876229962156239	13.058312755788407	3042429
3042535	EDA	estimation of fmax and isb in microprocessors	2005	-6.09888038147525	12.797606143050912	3042562
3045855	EDA	yield enhancement by bad-die recycling and stacking with though-silicon vias	2011	-5.539943350012279	12.645724125570572	3045882
3048416	EDA	hardening c-elements against metastability	2017	-5.769776451870627	12.341667442436796	3048443
3048423	EDA	testing of dynamic logic circuits based on charge sharing	2001	-5.950692876071073	12.31244974016699	3048450
3048564	EDA	a circuit for concurrent detection of soft and timing errors in digital cmos ics	2004	-5.501472220397026	12.640634566389547	3048591
3049465	EDA	variable frequency crosstalk noise analysis: a methodology to guarantee functionality from dc to f/sub max/	2002	-5.98383755982575	12.627165215043554	3049492
3051233	EDA	accurate and scalable reliability analysis of logic circuits	2007	-5.7813753228662845	12.445075768173597	3051260
3052500	EDA	set susceptibility estimation of clock tree networks from layout extraction	2012	-5.409500451094703	12.664307480632203	3052527
3054506	Theory	fault modeling and testing of gaas static random access memories	1991	-5.3300350436283495	12.280603232618859	3054533
3054617	EDA	creating an affordable 22nm node using design-lithography co-optimization	2009	-5.382741439069735	13.081980164421216	3054644
3055035	EDA	design of low power systems using inexact logic circuits	2010	-5.767498575926628	12.786182086493527	3055062
3059456	EDA	test pattern generation for multiple aggressor crosstalk effects considering gate leakage loading in presence of gate delays	2012	-5.971700184474437	12.584551323189414	3059483
3065559	EDA	path-ro: a novel on-chip critical path delay measurement under process variations	2008	-5.9894336526982865	12.559636068716127	3065586
3067937	EDA	a compact model to identify delay faults due to crosstalk	2006	-6.251578629982044	12.505125121807696	3067964
3074601	EDA	analytical noise-rejection model based on short channel mosfet	2008	-6.094924518652849	13.11444463515882	3074628
3074603	EDA	modeling soft errors at the device and logic levels for combinational circuits	2009	-5.929170787265856	12.693741885361323	3074630
3077059	EDA	limits of gate-level power estimation considering real delay effects and glitches	2014	-5.306869036490332	12.410854707077231	3077086
3077252	EDA	variation-tolerant, power-safe pattern generation	2007	-5.836156866010279	12.721779474315026	3077279
3077667	Embedded	rf robustness enhancement through statistical analysis of chip package co-design	2004	-6.2463574782003315	13.057963767045967	3077694
3077679	EDA	probability aware fault-injection approach for ser estimation	2018	-5.859792226029433	13.135541613451535	3077706
3080599	EDA	concurrent error detection in array dividers by alternating input data	1991	-6.115677067492973	12.257706737293748	3080626
3081198	EDA	cycle-true leakage current modeling for cmos gates	2001	-6.149759870343144	13.161850982757834	3081225
3085116	EDA	optimizing temperature guardbands	2017	-6.217749764673772	13.158887908326138	3085143
3086146	EDA	a methodology for yield-specific leakage estimation in memory	2014	-6.026287550370418	12.881622687802546	3086173
3086265	EDA	advancements on reliability-aware analog circuit design	2012	-5.905482196615129	12.713846817674087	3086292
3086765	EDA	a high-precision on-chip path delay measurement architecture	2012	-5.807149261031362	12.393843991824069	3086792
3088450	EDA	technology variability from a design perspective	2010	-6.106150089282043	13.143706547726252	3088477
3089920	EDA	physical design and testing of nano magnetic architectures	2014	-5.356075669407834	12.934103242649302	3089947
3090886	Arch	tsv power supply array electromigration lifetime analysis in 3d ics	2014	-6.032277941198669	13.089869853901405	3090913
3091736	EDA	simulating the effects of process variations on capacitive crosstalk	2006	-5.8969144933667765	12.838289980401395	3091763
3091994	Arch	nbti-aware statistical circuit delay assessment	2009	-6.030546668645798	12.9092521758002	3092021
3094371	EDA	new approach in gate-level glitch modelling	1996	-5.852798907497772	12.247090437658652	3094398
3095086	EDA	analyzing software influences on substrate noise: an adc perspective	2004	-5.663231594484237	12.995109772203419	3095113
3097432	EDA	impact of power supply voltage variations on fpga-based digital systems performance	2010	-5.826973921250508	12.690098369181928	3097459
3098531	EDA	design-time reliability enhancement using hotspot identification for rf circuits	2016	-5.5027172144872285	13.16233380836476	3098558
3098797	EDA	an energy-efficient 24t flip-flop consisting of standard cmos gates for ultra-low power digital vlsis	2015	-5.409678065021449	12.773171376137846	3098824
3098868	EDA	diagnosis of multiple-voltage design with bridge defect	2009	-5.619809072538271	12.390632795365159	3098895
3099423	EDA	design of clock distribution networks in presence of process variations	1998	-5.379757000132178	13.155844647993886	3099450
3100617	EDA	a cad methodology and tool for the characterization of wide on-chip buses	2004	-5.505460428749002	12.864098790823398	3100644
3100652	EDA	an efficient ser estimation method for combinational circuits	2011	-6.173955370192123	12.986487862947245	3100679
3101056	EDA	a hierarchal approach for power reduction in vlsi chips	1996	-5.68940686063636	12.682384722034929	3101083
3102392	EDA	redressing fork constraints in nanoscale quasi-delay-insensitive asynchronous pipelines	2017	-5.402238904671372	12.91124107178972	3102419
3103216	EDA	an infrastructure for accurate characterization of single-event transients in digital circuits☆	2013	-5.319564834622983	13.16768673878734	3103243
3104002	EDA	crosstalk aware static timing analysis: a two step approach	2000	-6.193303275024915	12.532704858172908	3104029
3104038	EDA	high quality testing of grid style power gating	2014	-5.780460046302783	12.430120800271304	3104065
3104053	EDA	on testability of multiple precharged domino logic	2000	-5.838880530680903	12.95109327075164	3104080
3106303	EDA	design trade-offs and power reduction techniques for high performance circuits and system	2006	-5.985181694341562	13.201101677481885	3106330
3106505	EDA	statistical analysis of random telegraph noise in digital circuits	2014	-6.1913840470149575	12.784278659256787	3106532
3107455	EDA	bridging fault test method with adaptive power management awareness	2008	-5.740563958775176	12.668274491950633	3107482
3107677	EDA	an efficient quantum-dot cellular automata adder	2011	-6.210120368731892	12.43040735135145	3107704
3107872	Arch	simulation-based analysis of ff behavior in presence of power supply noise	2017	-5.744116316315317	13.119414083142171	3107899
3111921	EDA	at tape-out: can system yield in terms of timing/energy specifications be predicted?	2007	-5.712409706734108	12.675549716698265	3111948
3113588	EDA	an easily testable and reconfigurable pipeline for symmetric block ciphers	2006	-5.317764307657521	12.4771996247919	3113615
3114218	EDA	clock skew reduction by self-compensating manufacturing variability with on-chip sensors	2010	-6.0662366182595004	12.980301080332177	3114245
3115378	EDA	improving fpga reliability with wear-levelling	2011	-5.491727232013131	12.707666925390226	3115405
3115960	EDA	transition density: a new measure of activity in digital circuits	1993	-5.952078031558968	12.464459486064086	3115987
3118664	EDA	on-die learning-based self-calibration of analog/rf ics	2016	-6.25476801504264	12.436695428770998	3118691
3119400	EDA	training-based forming process for rram yield improvement	2011	-5.5164534149069615	13.096900587629097	3119427
3120027	EDA	worst-case analysis to obtain stable read/write dc margin of high density 6t-sram-array with local vth variability	2005	-5.998951586725128	13.0863688727065	3120054
3122361	EDA	layout-aware high performance interconnects for network-on-chip design in deep nanometer technologies	2011	-6.018493610184858	13.114563269384954	3122388
3122792	EDA	clock distribution methodology for powerpctm microprocessors	1997	-5.453443662917189	12.863325614075949	3122819
3123820	EDA	variability modeling and variability-aware design in deep submicron integrated circuits	2005	-5.324521683178029	12.891968644724765	3123847
3125944	EDA	an overview of on-chip interconnect variation	2006	-5.4370707456455065	12.973665481933153	3125971
3129418	EDA	an enhanced double-tsv scheme for defect tolerance in 3d-ic	2013	-5.439033624720528	13.063699720138766	3129445
3131444	EDA	yield enhancement by repair circuits for ultra-fine pitch stacked-chip connections	2017	-5.4427696821310665	13.151109505516407	3131471
3131865	EDA	high level area and current estimation	2003	-6.067413640651674	13.088881873826306	3131892
3132818	Visualization	vlsi implementations of threshold logic-a comprehensive survey	2003	-5.425691540701701	13.095559800531342	3132845
3134084	EDA	process-variation and temperature aware soc test scheduling technique	2013	-5.642794855087173	13.134052048001282	3134111
3135245	Vision	clock skew optimization	1990	-6.093418738693801	12.956026624751306	3135272
3138361	SE	current testing procedure for deep submicron devices	2001	-5.569251581525671	12.451333838263118	3138388
3138403	EDA	finfet sram design	2010	-6.044898587528869	13.123517016573976	3138430
3141837	EDA	using transition fault test patterns for cost effective offline performance estimation	2017	-5.732282940483986	13.075537554412648	3141864
3142138	EDA	tsunami: a light-weight on-chip structure for measuring timing uncertainty induced by noise during functional and test operations	2012	-5.572060495742994	13.197237019711544	3142165
3143518	EDA	investigations of faulty dram behavior using electrical simulation versus an analytical approach	2005	-5.373987591300089	12.680153055310221	3143545
3145688	Visualization	an effective model of the overshooting effect for multiple-input gates in nanometer technologies	2014	-5.31087021002357	12.388140776202333	3145715
3148816	EDA	gate-level aged timing simulation methodology for hot-carrier reliability assurance	2000	-6.168367267371232	12.871903265655119	3148843
3152903	EDA	efficient reliability analysis of processor datapath using atomistic bti variability models	2015	-6.076027401246363	12.699651877872634	3152930
3153830	EDA	design as you see fit: system-level soft error analysis of sequential circuits	2009	-5.596753813644074	12.778697287065	3153857
3154343	EDA	o2aba: a novel high-performance predictable circuit architecture for the deep submicron era	2002	-5.587801731258083	13.176259186420081	3154370
3156021	Arch	device and circuit implications of double-patterning — a designer's perspective	2011	-5.867527663599825	13.068604097452535	3156048
3156373	EDA	reducing power dissipation, delay, and area in logic circuits by narrowing transistors	2003	-6.100201808922866	12.765507489896667	3156400
3156524	EDA	a unified detection scheme for crosstalk effects in interconnection bus	2009	-5.923072665271254	12.54237821241586	3156551
3157996	EDA	efficient techniques for noise characterization of sequential cells and macros	2006	-5.76604366429453	12.435490781522725	3158023
3158210	EDA	optical lithography simulation using wavelet transform	2009	-5.499290583174019	12.330636316601527	3158237
3162128	EDA	t-gate: concept of partial polarization in quantum dot cellular automata	2016	-6.123467264720955	12.712260221736518	3162155
3165924	EDA	on-chip power supply noise and its implications on timing	2010	-5.831627937239563	13.003325787023073	3165951
3167433	EDA	a methodology for the estimation of capacitive crosstalk-induced short-circuit energy	2007	-6.231201113739287	13.07321556473534	3167460
3170515	EDA	a unified approach in the analysis of latches and flip-flops for low-power systems	1998	-5.5211290478190245	12.847756210764516	3170542
3172211	Arch	new performance/power/area efficient, reliable full adder design	2009	-6.236829999875318	12.96760543859704	3172238
3172350	EDA	design and analysis of via-configurable routing fabrics for structured asics	2012	-5.5897260896579954	12.445297161749805	3172377
3174998	EDA	defect simulation methodology for iddt testing	2006	-5.552560652050508	12.327829920764904	3175025
3175571	Arch	effects of bit line coupling on the faulty behavior of drams	2004	-5.6067642925494505	12.62870234701115	3175598
3176629	EDA	asynchronous design by conversion: converting synchronous circuits into asynchronous ones	2004	-5.314869053481436	12.369076463983891	3176656
3177253	EDA	incorporating hot-carrier injection effects into timing analysis for large circuits	2014	-6.078099286244794	13.008457637091546	3177280
3179995	Arch	analysis of the fault injection mechanism related to negative and positive power supply glitches using an on-chip voltmeter	2014	-5.49982626896276	13.050295714730794	3180022
3184900	EDA	designing via-configurable logic blocks for regular fabric	2006	-6.1373680143636165	12.427258184389846	3184927
3185857	Arch	intra- and inter-chip voltage droop analysis using a power delivery grid model	2014	-6.15828133294429	12.931953434648015	3185884
3185953	EDA	statistical power supply dynamic noise prediction in hierarchical power grid and package networks	2008	-5.723896589303097	12.480397904671138	3185980
3186817	EDA	frequency detection-based boundary-scan testing of ac coupled nets	2001	-5.683969782397876	12.649939331599127	3186844
3188036	EDA	transistor-level based defect tolerance for reliable nanoelectronics	2008	-5.5132789953924055	12.626507349475592	3188063
3190521	EDA	techniques for improving timing convergence of advanced microprocessors	2000	-5.697774431714348	12.419359858992589	3190548
3194267	EDA	an activity-driven encoding scheme for power optimization in microprogrammed control unit	1999	-5.668477779198387	13.087709510016566	3194294
3194525	Arch	modeling and yield estimation of sram sub-system for different capacities subjected to parametric variations	2016	-6.118786602929482	13.001220572325025	3194552
3195560	EDA	factors that impact the critical charge of memory elements	2006	-6.185976502939025	13.189695762460588	3195587
3195591	EDA	validation of wire length distribution models on commercial designs	2003	-5.32439928455693	12.959799839251044	3195618
3195732	EDA	a 370-mhz memory built-in self-test state machine	1995	-5.457525696643994	12.571143513391386	3195759
3196545	EDA	post-fabrication clock-timing adjustment for digital lsis ensuring operational timing margins	2008	-6.122497405434916	12.79578132624379	3196572
3200002	EDA	layout-driven hot-carrier degradation minimization using logic restructuring techniques	2001	-5.426755208989217	12.788660336171858	3200029
3201052	EDA	a novel cascade control replica-bitline delay technique for reducing timing process-variation of sram sense amplifier	2015	-5.346277014245016	12.633474911139052	3201079
3201232	Arch	assessing intrinsic and extrinsic end-of-life risk using functional sram wafer level testing	2015	-5.737089658504459	13.095163140437286	3201259
3201822	EDA	ring oscillators for functional and delay test of latches and flip-flops	2011	-5.696192294662025	12.286544104213718	3201849
3204029	Robotics	analytical modeling of 3d stacked ic yield from wafer to wafer stacking with radial defect clustering	2014	-6.043649993551887	12.510909210248848	3204056
3204288	EDA	detectability challenges of bridge defects in finfet based logic cells	2018	-5.580061642946893	12.989478828563128	3204315
3206896	EDA	designing closer to the edge	2000	-5.833651637117335	13.12911403503654	3206923
