id	area	title	year	x	y	ix
3209883	Arch	nanofabric pla architecture with redundancy enhancement	2007	-5.605053585931763	12.943921923881474	3209910
3211258	Arch	tsv redundancy: architecture and design issues in 3-d ic	2012	-5.535660492826271	12.927156356332686	3211285
3212099	EDA	a low overhead on-chip path delay measurement circuit	2009	-5.820609783419597	12.434469225105861	3212126
3213351	EDA	ring oscillator clocks and margins	2016	-5.883055860530231	12.760783166822511	3213378
3215167	NLP	screening small-delay defects using inter-path correlation to reduce reliability risk	2015	-5.701567640341888	12.414251304160244	3215194
3215814	EDA	fast wat test structure for measuring vt variance based on latch-based comparators	2017	-6.059168692300246	13.107184952910194	3215841
3217468	EDA	crosstalk noise analysis at multiple frequencies	2005	-6.201633654878153	12.345582455823306	3217495
3217512	EDA	negative-skewed shadow registers for at-speed delay variation characterization	2007	-5.924673587451968	12.526174809964758	3217539
3219050	EDA	design for degradation: cad tools for managing transistor degradation mechanisms	2005	-5.417881789109926	12.85002039468958	3219077
3219314	EDA	cad techniques for power optimization in virtex-5 fpgas	2007	-5.398567243790018	12.98801227329235	3219341
3219583	EDA	combating nbti degradation via gate sizing	2007	-5.695559279695593	12.944334596486074	3219610
3223864	EDA	testing of tsv-induced small delay faults for 3-d integrated circuits	2014	-5.5371151094474556	12.311744771653716	3223891
3224819	EDA	a comprehensive methodology for noise characterization of asic cell libraries	2005	-5.425861291371271	12.622865627666314	3224846
3225746	EDA	a stochastic pattern generation and optimization framework for variation-tolerant, power-safe scan test	2007	-5.85688690950659	12.587070045661552	3225773
3226676	EDA	modeling single event crosstalk speedup in nanometer technologies	2015	-5.946431189259499	12.654195958063982	3226703
3228151	Arch	microarchitectural power modeling techniques for deep sub-micron microprocessors	2004	-5.318097494100228	12.981974924180756	3228178
3230458	EDA	adaptive reduction of the frequency search space for multi- $v_{\mathrm{ dd}}$ digital circuits using variation sensitive ring oscillators	2013	-5.680213584705911	12.297086164025998	3230485
3232874	EDA	identifying nbti-critical paths in nanoscale logic	2013	-5.8019557717340815	13.032044357889584	3232901
3233359	EDA	layout-aware pareto fronts of electronic circuits	2011	-5.416710596818229	12.815857474851866	3233386
3233764	EDA	is there always performance overhead for regular fabric?	2008	-5.723726706066303	12.607545025887143	3233791
3235596	EDA	a process and technology-tolerant iddq method for ic diagnosis	2001	-5.6072461775365126	12.5007323638018	3235623
3237107	EDA	power yield analysis under process and temperature variations	2012	-6.157087071284858	12.936820520291786	3237134
3239912	EDA	application-based, transistor-level full-chip power analysis for 700 mhz powerpctm microprocessor	2000	-6.0474346984392335	12.756371782487154	3239939
3244040	EDA	a study on cmos time uncertainty with technology scaling	2008	-6.132117599665005	12.922115390315179	3244067
3245281	Arch	a high-performance bus architecture for strongly coupled interconnects	2008	-6.082231659288057	13.078860478226073	3245308
3245858	EDA	a new march test for process-variation induced delay faults in srams	2013	-5.4396783285049315	12.678045281954244	3245885
3248900	EDA	an iddq sensor for concurrent timing error detection	1997	-5.343547870274698	13.056508176965217	3248927
3249233	EDA	statistical estimation of leakage-induced power grid voltage drop considering within-die process variations	2003	-6.23783911969557	12.930568990965467	3249260
3252227	Visualization	high-performance robust latches	2010	-6.01031331006977	12.948947498142287	3252254
3254106	EDA	within-die delay variation measurement and power transient analysis using rebel	2015	-5.960790322967383	12.770339538756714	3254133
3255273	EDA	timing analysis in presence of supply voltage and temperature variations	2006	-6.024700529993362	12.755235327830034	3255300
3256009	EDA	soft error hardened latch scheme for enhanced scan based delay fault testing	2007	-5.8156472474760665	13.036993658932786	3256036
3258890	EDA	within-die delay variability in 90nm fpgas and beyond	2006	-6.002153507067907	12.792623988853506	3258917
3259600	EDA	keynote talk: 3d core-based soc testing for low power and tsv count minimization	2018	-5.558656792549701	12.277472900979927	3259627
3259803	EDA	tsv redundancy: architecture and design issues in 3d ic	2010	-5.457367456706203	12.897549258660069	3259830
3260147	EDA	static compaction of delay tests considering power supply noise	2005	-5.854772027298387	12.487588814821315	3260174
3264714	EDA	system-level power estimation methodology using cycle- and bit-accurate tlm	2011	-5.326309425486153	12.832377121944873	3264741
3266628	EDA	illiads-t: an electrothermal timing simulator for temperature-sensitive reliability diagnosis of cmos vlsi chips	1998	-5.767132291047625	12.463377723897429	3266655
3268121	EDA	thermal-electrical co-optimisation of floorplanning of three-dimensional integrated circuits under manufacturing and physical design constraints	2011	-6.070120677256267	13.112435933576615	3268148
3268531	SE	extending the viability of iddq testing in the deep submicron era	2002	-5.33037116279046	12.944109431672258	3268558
3268986	EDA	dummy tsv based bit-line optimization in 3d on-chip memory	2016	-6.249256381799683	13.07064250544761	3269013
3269779	Embedded	a test screening method for 28 nm hk/mg single-port and dual-port srams considering with dynamic stability and read/write disturb issues	2012	-5.781832646139042	13.045520051617418	3269806
3271868	EDA	diagnosis of interconnect full open defects in the presence of gate leakage currents	2013	-5.6408932162002206	12.492975309148509	3271895
3276501	EDA	fast physics-based electromigration checking for on-die power grids	2016	-6.1900445228086305	12.631003055428375	3276528
3278074	EDA	test generation for clock-domain crossing faults in integrated circuits	2012	-5.336629617448825	12.440923180374643	3278101
3278338	EDA	statistical analysis of crosstalk-induced errors for on-chip interconnects	2011	-6.100819495893751	13.117170620597744	3278365
3279085	EDA	a wide-range clock signal generation scheme for speed grading of a logic core	2016	-5.298489609421536	12.998991903101206	3279112
3281111	EDA	a transistor-level stochastic approach for evaluating the reliability of digital nanometric cmos circuits	2011	-5.914171198355018	12.85085181792536	3281138
3283512	EDA	stochastic degradation modeling and simulation for analog integrated circuits in nanometer cmos	2013	-5.941583178615441	13.175111070807946	3283539
3290804	EDA	gate-level exception handling design for noise reduction in high-speed vlsi circuits	2007	-5.347261096727081	12.91743854326122	3290831
3291826	HPC	t-vema: a temperature- and variation-aware electromigration power grid analysis tool	2015	-6.0159529994620495	12.864495937681687	3291853
3293263	EDA	repomo32 - new reconfigurable polymorphic integrated circuit for adaptive hardware	2009	-6.1947586266327	13.036072039097665	3293290
3294226	EDA	early estimation of wire length for dedicated test access mechanisms in networks-on-chip based socs	2011	-5.459955999562851	12.388682957410664	3294253
3294343	EDA	power supply design parameters prediction for high performance ic design flows	2000	-5.8007199582217055	12.89205375502575	3294370
3294382	EDA	an sram based testing methodology for yield analysis of semiconductor ics	2013	-5.406875575812203	12.264172505252823	3294409
3298359	EDA	preferred fill: a scalable method to reduce capture power for scan based designs	2006	-5.5729178877251995	12.57146790996771	3298386
3300961	Arch	radiation-tolerant combinational gates - an implementation based comparison	2012	-5.669163875710011	12.370741186680856	3300988
3301312	EDA	built-in test and diagnosis for tsvs with different placement topologies and crosstalk impact ranges	2017	-5.492862629248681	12.27301645383067	3301339
3305192	Arch	api tests for ram chips	1977	-5.342635812737148	12.30056707444042	3305219
3306995	EDA	performance- and energy-aware optimization of beol interconnect stack geometry in advanced technology nodes	2017	-6.119989573058549	13.186970697804812	3307022
3308408	EDA	lens aberration aware timing-driven placement	2006	-6.1699638542223285	12.871152903702654	3308435
3309258	EDA	semi-custom ncl design with commercial eda frameworks: is it possible?	2014	-5.79738591899264	13.1672933860701	3309285
3309361	EDA	a metallic cnt tolerant design methodology for carbon nanotube-based programmable gate arrays	2016	-5.696849681466307	13.038502063471574	3309388
3310451	EDA	lithography analysis of via-configurable transistor-array fabrics	2012	-5.701017263046988	12.722768984076035	3310478
3311471	EDA	fast timing analysis of clock networks considering environmental uncertainty	2012	-6.1493573162427	12.774729928671146	3311498
3311909	Logic	performance-optimized design for parametric reliability	2008	-5.468221970373858	12.875894767582706	3311936
3314571	EDA	implementation of self-checking two-level combinational logic on fpga and cpld circuits	2004	-5.344124013327785	12.400246605469668	3314598
3316424	Visualization	fast transistor threshold voltage measurement method for high-speed, high-accuracy advanced process characterization	2014	-5.905123083478933	12.754652315983627	3316451
3319077	EDA	influence of resistive bridging fault on crosstalk coupling effects in on-chip aggressor-victim interconnects	2006	-5.688112123857504	12.343771936957948	3319104
3321179	EDA	self-latching operation of mobile circuits using series-connection of rtds and transistors	2006	-5.348743621270954	12.807403361845415	3321206
3323177	EDA	an efficient optimization based method to evaluate the drv of sram cells	2013	-6.262038530907621	13.192182713689766	3323204
3325552	EDA	automatic characterization and modeling of power consumption in static rams	1998	-5.5525698915333	12.495942390826073	3325579
3325860	EDA	switch level hot-carrier reliability enhancement of vlsi circuits	1995	-6.030220344244626	12.825809329082668	3325887
3327215	EDA	toward pdn resource estimation: a law of general power density	2011	-6.067512159588174	12.8492253346166	3327242
3330171	EDA	computing at the ultimate low-energy limits	2010	-5.820251974155814	12.726242774368119	3330198
3334961	Vision	a temperature-aware time-dependent dielectric breakdown analysis framework	2010	-5.923661805348656	13.138384968602107	3334988
3341932	EDA	maximum circuit activity estimation using pseudo-boolean satisfiability	2007	-6.197723521451553	12.506446906345207	3341959
3342737	EDA	power-supply noise reduction with design for manufacturability	2005	-5.518038253759049	12.50062238542722	3342764
3343858	EDA	a genetic algorithm based remaining lifetime prediction for a vliw processor employing path delay and iddx testing	2016	-5.623667335026928	12.804961598273986	3343885
3347694	EDA	topology aware mapping of logic functions onto nanowire-based crossbar architectures	2006	-6.110290314335747	12.59098961710987	3347721
3348533	EDA	asynchronous logic for high variability nano-cmos	2009	-5.313492423884268	12.993859146458226	3348560
3350358	EDA	reliability-aware design method for cmos circuits	2016	-5.717694750482585	13.05858975595709	3350385
3352438	EDA	detecting i/sub ddq/ defective cmos circuits by depowering	1995	-5.528211164425113	12.398557123649006	3352465
3352508	EDA	reliability computer-aided design tool for full-chip electromigration analysis and comparison with different interconnect metallizations	2007	-5.994581090722448	12.571084984294155	3352535
3353824	EDA	a tool for transient fault analysis in combinational circuits	2015	-5.538910264482441	12.448898807290346	3353851
3357462	EDA	predicting interconnect requirements in ultra-large-scale integrated control logic circuitry	2005	-5.6773683398389005	12.80894051129138	3357489
3359111	EDA	a layout-based approach for multiple event transient analysis	2013	-6.047862044858202	12.8963535780991	3359138
3359803	EDA	influence of bit line twisting on the faulty behavior of drams	2004	-5.551513933449124	12.500880152141669	3359830
3360129	EDA	transient current and delay analysis for resistive-open defects in future 16 nm cmos circuits	2010	-5.7372140399459655	12.35005838814634	3360156
3360183	EDA	layout-aware pattern generation for maximizing supply noise effects on critical paths	2009	-5.822879441667133	12.504061336657026	3360210
3361537	EDA	time-borrowing circuit designs and hardware prototyping for timing error resilience	2014	-5.4211583838232125	13.05711670701839	3361564
3364025	Arch	a novel architecture for quantum-dot cellular rom	2010	-5.63118489308612	13.07104835881377	3364052
3367626	EDA	floating body effects model for fault simulation of fully depleted cmos/soi circuits	2003	-5.776789548342457	12.307080161310965	3367653
3369176	Embedded	implementing defect tolerance in 3d-ics by exploiting degrees of freedom in assembly	2012	-5.415501627893094	12.616550967767978	3369203
3370857	EDA	design-process integration for performance-based opc framework	2008	-5.894105353651884	12.563208385787306	3370884
3371821	Logic	a view from the bottom: nanometer technology ac parametric failures -- why, where, and how to detect	2003	-5.510940969939539	12.638145890633107	3371848
3372473	EDA	metrics and design considerations on the energy-delay tradeoff of digital circuits	2009	-5.880738871261912	12.86117486462678	3372500
3374145	EDA	chip substrate resistance modeling technique for integrated circuit design	1984	-5.442580548779586	12.790239284765773	3374172
3375502	EDA	leveraging sensitivity analysis for fast, accurate estimation of sram dynamic write vmin	2013	-6.086002729538945	12.664966074106973	3375529
3376612	Arch	run-time programming of analog circuits using floating-gate transistors	2007	-5.9136759642184415	13.099302307703132	3376639
3376869	Crypto	review of capacitive threshold gate implementations	2003	-6.112379850411219	12.880160296800305	3376896
3378703	Embedded	increasing the sense margin of 1t-1c ferroelectric random-access memories	2007	-5.448304389465339	12.954013157823525	3378730
3381615	EDA	wiring requirement and three-dimensional integration technology for field programmable gate arrays	2003	-6.151180983974331	12.67278835209726	3381642
3382215	EDA	parametric dfm solution for analog circuits: electrical-driven hotspot detection, analysis, and correction flow	2013	-5.524773161958543	12.986276499694329	3382242
3383118	Arch	refined metastability characterization using a time-to-digital converter	2018	-5.926243239978407	12.268509764452705	3383145
3383754	EDA	an approach for pre-silicon power modeling	2007	-6.056977376498866	12.802091972769727	3383781
3385637	EDA	a hybrid power modeling approach to enhance high-level power models	2016	-5.90556852520812	12.80614092414107	3385664
3387553	EDA	qca-based majority gate design under radius of effect-induced faults	2005	-5.952522449521532	12.454306551956368	3387580
3387604	EDA	single event transients in dynamic logic	2006	-6.039093059717438	12.780040635539324	3387631
3390742	DB	on the necessity of combining coding with spacing and shielding for improving performance and power in very deep sub-micron interconnects	2007	-5.381483053291526	12.493191749863614	3390769
3392460	EDA	forter: a forward error correction scheme for timing error resilience	2013	-5.296974038470679	13.140460284016314	3392487
3392738	EDA	a genetic bus encoding technique for power optimization of embedded systems	2003	-5.73749430454582	12.795740244288595	3392765
3394061	EDA	process and environmental variation impacts on asic timing	2004	-5.887218419916178	12.744624609104605	3394088
3395773	EDA	transistor-level sizing and timing verification of domino circuits in the power pc microprocessor	1997	-5.480274016407063	12.371155390486898	3395800
3397053	EDA	the impedance fault model and design for robust impedance fault testability	1991	-5.909973757849832	12.490601089839135	3397080
3398641	Arch	innovative practices session 9c: implications of power delivery network for validation and testing	2010	-5.306740335576092	12.559160588501712	3398668
3401614	EDA	statistical static timing analysis: how simple can we get?	2005	-6.02982316672189	12.425469499060116	3401641
3403718	EDA	power dissipation impact of the technology mapping synthesis on look-up table architectures	2005	-6.012448958150902	12.484063016705505	3403745
3403895	EDA	soft-well digital circuit design	2007	-5.7620581143941125	13.081612313216553	3403922
3404166	EDA	keep-out-zone analysis for three-dimensional ics	2014	-6.022939119813437	13.006489914092569	3404193
3406263	EDA	an analog perspective on device reliability in 32nm high-κ metal gate technology	2011	-5.798839969789759	13.100617239471672	3406290
3406373	Arch	cmos control enabled single-type fet nasic	2008	-5.586870853131324	13.14512687804738	3406400
3406419	EDA	modeling process variability in scaled cmos technology	2010	-5.525361652898465	12.621641491183693	3406446
3407709	EDA	performance-based optical proximity correction methodology	2010	-6.185094491023665	12.965677800681393	3407736
3409902	EDA	on modeling cross-talk faults	2003	-5.630280848818588	12.591572264153434	3409929
3411565	EDA	generation and propagation of single event transients in cmos circuits	2006	-5.8163849766717926	12.42561929231859	3411592
3412484	EDA	innovative practices session 1c: existing/emerging low power techniques	2014	-6.161198964195815	12.91746310835966	3412511
3413565	Embedded	laser fault injection into sram cells: picosecond versus nanosecond pulses	2015	-5.463670586609214	12.601543122313016	3413592
3416560	EDA	interfacing synchronous and asynchronous modules within a high-speed pipeline	1997	-5.781142800303339	12.906860511468285	3416587
3417307	EDA	analysis and test of electromigration failures in fpgas	2010	-5.421962888277224	12.276876348355046	3417334
3422737	EDA	minimizing power supply noise through harmonic mappings in networks-on-chip	2012	-6.094976085941721	12.965805333454783	3422764
3423059	HCI	set-par: place and route tools for the mitigation of single event transients on flash-based fpgas	2015	-5.465643087618421	12.426594220540409	3423086
3423408	EDA	an efficient design of single event transients tolerance for logic circuits	2008	-5.7714096009013	13.023040813374513	3423435
3423867	EDA	package-silicon co-design-experiment with an soc design	2004	-5.431739210891876	12.774589601435551	3423894
3425365	EDA	silicon speedpath measurement and feedback into eda flows	2007	-5.773204498277291	12.758403657305172	3425392
3425826	EDA	a 28 nm dual-port sram macro with screening circuitry against write-read disturb failure issues	2010	-5.946727720115034	13.082837482868314	3425853
3426719	EDA	stochastic lut-based reliability-aware design method for operation point dependent cmos circuits	2016	-6.159046712594651	12.699896470195473	3426746
3427383	EDA	a yield model for integrated circuits and its application to statistical timing analysis	2007	-6.259824760599598	12.392931225280854	3427410
3430366	EDA	microarchitectural-level statistical timing models for near-threshold circuit design	2015	-5.591186206187848	13.145650843132074	3430393
3430731	EDA	a scalable quantitative measure of ir-drop effects for scan pattern generation	2010	-5.854009759521508	12.608566126623792	3430758
3431665	EDA	equi-noise: a statistical model that combines embedded memory failures and channel noise	2014	-5.5523519492775035	13.079382658508711	3431692
3432192	EDA	wafer topography-aware optical proximity correction	2006	-6.202035093298798	12.575426193151733	3432219
3432265	EDA	robust circuit design: challenges and solutions	2009	-5.40029059303285	13.060045616019922	3432292
3435030	EDA	computing the detection of small delay defects caused by resistive opens of nanometer ics	2010	-5.6324857313728725	12.384807918258126	3435057
3436423	EDA	case study and efficient modelling for variational chemical-mechanical planarisation	2008	-6.07770560505548	12.840072187454385	3436450
3439442	EDA	concurrent error detection in self-timed vlsi	1994	-5.830793910176125	12.611418061832662	3439469
3448504	EDA	static timing analysis of irreversible crosstalk noise pulse faults	2004	-5.435231988983699	12.245360101854637	3448531
3448624	EDA	effective selection of favorable gates in bti-critical paths to enhance circuit reliability	2015	-6.033673070853161	12.982191127085766	3448651
3452663	EDA	characterization and design of logic circuits in the presence of carbon nanotube density variations	2011	-6.02273969885634	13.16434295701526	3452690
3453862	EDA	total sensitivity based dfm optimization of standard library cells	2010	-6.187174672580451	13.094773241147394	3453889
3455035	Metrics	fast stochastic analysis of electromigration in power distribution networks	2017	-6.056974285040259	13.02138347509191	3455062
3458400	EDA	power distribution failure analysis using transition-delay fault patterns	2008	-5.370443121699818	12.308228091913113	3458427
3459019	EDA	vddmin test optimization for overscreening minimization through adaptive scan chain masking	2010	-5.6939791094649514	12.591594778928995	3459046
3460124	EDA	test architecture design and optimization for three-dimensional socs	2009	-6.197788230699941	12.261996454407086	3460151
3461785	EDA	computer-aided redesign of vlsi circuits for hot-carrier reliability	1993	-5.502082355598116	12.570470855701522	3461812
3464182	EDA	design guide and process quality improvement for treatment of device variations in an lsi chip	2004	-6.101774796164429	13.057579677527867	3464209
3466144	EDA	a model parameter extraction methodology including time-dependent variability for circuit reliability simulation	2018	-5.704710644714566	12.5203789530026	3466171
3467758	EDA	why to use dual-vt, if single-vt serves the purpose better under process parameter variations?	2008	-6.074393259260166	12.751345559245415	3467785
3469445	EDA	through silicon via-based grid for thermal control in 3d chips	2009	-6.137395533625554	13.102602036374956	3469472
3471390	HCI	on testing prebond dies with incomplete clock networks in a 3d ic using dlls	2012	-5.513229398282063	12.595791852896873	3471417
3472387	EDA	managing contamination delay to improve timing speculation architectures	2016	-6.117365233004955	12.744037055104158	3472414
3474025	EDA	all-digital circuits for measurement of spatial variation in digital circuits	2010	-6.2176591060111726	13.03500382529559	3474052
3476475	EDA	area and timing estimation for lookup table based fpgas	1996	-5.722946667913343	12.567607467111893	3476502
3477617	EDA	modeling the effect of process, power-supply voltage and temperature variations on the timing response of nanometer digital circuits	2012	-5.964137473380414	12.986101550668126	3477644
3488996	EDA	power grid redundant path contribution in system on chip (soc) robustness against electromigration	2014	-5.993277524474157	12.935243971752644	3489023
3490935	EDA	an evolutionary approach to runtime variability mapping and mitigation on a multi-reconfigurable architecture	2017	-5.891842653717263	12.673232858126134	3490962
3491101	EDA	testing techniques for resistive-open defects in future cmos technologies	2010	-5.582451877402109	12.838687280393057	3491128
3493061	EDA	interconnect modeling for copper/low-k technologies	2004	-6.030631249204802	12.843833721795434	3493088
3495278	EDA	statistical critical path analysis considering correlations	2005	-5.79543971066296	12.430410671898427	3495305
3495736	EDA	interconnect-based system-level energy and power prediction to guide architecture exploration	2004	-5.451835479360738	12.780658463520771	3495763
3496245	EDA	new ecc for crosstalk impact minimization	2005	-5.483330649568945	12.931795068893495	3496272
3498070	EDA	managing test coverage uncertainty due to thermal noise in nano-cmos: a case-study on an sram array	2013	-5.843011039715775	13.188309824435331	3498097
3499103	EDA	fault coverage analysis for physically-based cmos bridging faults at different power supply voltages	1996	-6.084385608789858	12.840981741621256	3499130
3499180	EDA	system level power estimation of system-on-chip interconnects in consideration of transition activity and crosstalk	2010	-5.56643949508883	12.987713549347884	3499207
3501661	EDA	aging analysis of circuit timing considering nbti and hci	2009	-5.8067449626052055	13.02755707967534	3501688
3501820	EDA	on the defect tolerance of nano-scale two-dimensional crossbars	2004	-5.381544582988403	12.756534033528462	3501847
3503413	EDA	impact of clock-gating on power distribution network using wavelet analysis	2013	-6.130077408595638	12.377560599874382	3503440
3503608	EDA	comparison of high-performance vlsi adders in the energy-delay space	2005	-5.776562504361014	12.415159023403133	3503635
3504453	EDA	hotspot : visualizing dynamic power consumption in rtl designs	2008	-5.437345540543281	12.724741427096223	3504480
3505390	EDA	modeling and testing crosstalk faults in inter-core interconnects that include tri-state and bi-directional nets	2004	-5.366472843774416	12.393556485469196	3505417
3506680	EDA	tutorial t6: robust design of nanoscale circuits in the presence of process variations	2007	-5.866452834840852	13.14727421931689	3506707
3507195	EDA	a layout sensitivity model for estimating electromigration-vulnerable narrow interconnects	2009	-5.582552201936688	12.337309713991349	3507222
3507593	EDA	power pin testing: making the test coverage complete	2000	-5.374564027980176	12.319565370611391	3507620
3508805	EDA	a physically oriented model to quantify the noise-on-delay effect	2004	-5.746676865816536	12.423267772522605	3508832
3508813	EDA	interconnect scaling implications for cad	1999	-5.901585511134456	12.284923706374896	3508840
