id	area	title	year	x	y	ix
3744569	EDA	critical path selection under nbti/pbti aging for adaptive frequency tuning	2016	-6.220225174652289	12.587414395277245	3744596
3745719	EDA	soft delay error analysis in logic circuits	2006	-6.193165472709638	12.378384797445236	3745746
3747679	EDA	monitoring the delay of long interconnects via distributed tdc	2015	-5.337736372858575	12.869052693466784	3747706
3747848	EDA	library compatible variational delay computation	2006	-6.194006128084457	12.34792620066838	3747875
3750861	Arch	a high-speed gcd chip: a case study in asynchronous design	2009	-5.688341043707798	12.741246207170146	3750888
3751040	EDA	timing yield improvement of fpgas utilizing enhanced architectures and multiple configurations under process variation (abstract only)	2012	-6.081630580559782	12.64822518004756	3751067
3751856	EDA	on reconfiguration-oriented approximate adder design and its application	2013	-6.015565970551777	13.017755884276431	3751883
3752582	Embedded	statistical analysis of timing rules for high-speed synchronous vlsi systems	1999	-5.57748102190814	13.045311666802142	3752609
3753057	EDA	is test power reduction through x-filling good enough?	2010	-5.81000840131348	12.401330513497774	3753084
3753791	EDA	an attempt towards charge-domain logic (cdl)	2007	-5.373281405579792	12.523728315965393	3753818
3753911	EDA	modeling leakage currents of different cmos cells by the power contributors method	2015	-6.075922681515364	13.19679089921325	3753938
3754493	EDA	csl: coordinated and scalable logic synthesis techniques for effective nbti reduction	2015	-5.3272902405414815	12.840618437262846	3754520
3755291	EDA	process variation tolerant online current monitor for robust systems	2005	-5.758353782801808	13.055569003769676	3755318
3756702	EDA	analyzing the effect of concurrent variability in the core cells and sense amplifiers on sram read access failures	2013	-6.197085974761402	13.201769086947172	3756729
3760856	EDA	a generic and reconfigurable test paradigm using low-cost integrated poly-si tfts	2007	-5.478168895821142	13.10890302772951	3760883
3761026	Embedded	analysis of root causes of alpha sensitivity variations on microprocessors manufactured using different cell layouts	2010	-5.509834153961212	12.367134262337697	3761053
3761976	EDA	extraction of threshold voltage degradation modeling due to negative bias temperature instability in circuits with i/o measurements	2014	-6.060847988645652	13.196163263558708	3762003
3765080	EDA	sram dynamic stability verification by reachability analysis with consideration of threshold voltage variation	2013	-6.237564046526782	12.527998871129544	3765107
3765821	Arch	testing for resistive shorts in fpga interconnects	2005	-5.620632135199424	12.391050088022652	3765848
3767155	EDA	asynchronous circuits based on multiple localised current-sensing completion detection	1995	-6.116535489012562	12.74332478790364	3767182
3769442	EDA	optimization of test pin-count, test scheduling, and test access for noc-based multicore socs	2014	-5.5306148572368885	12.354838096940279	3769469
3771885	Logic	on-line transition-time monitoring for die-to-die interconnects in 3d ics	2014	-5.503241703268684	12.837897120835096	3771912
3776072	EDA	smartextract: accurate capacitance extraction for soc designs	2006	-5.894385650814711	12.594245996182792	3776099
3777033	EDA	detecting hardware trojans without a golden ic through clock-tree defined circuit partitions	2017	-5.749680104378252	12.706110296233199	3777060
3778918	EDA	single event transient mitigation through pulse quenching: effectiveness at circuit level	2013	-5.8807738018916655	13.104667733494045	3778945
3779625	EDA	a simplified yield modeling method for design rule trade-off in interconnection substrates	2001	-5.803376228822756	12.749556372282813	3779652
3780200	EDA	a statistical approach to the timing-yield optimization of pipeline circuits	2007	-5.585011096083542	13.179037542123778	3780227
3782405	EDA	methodology for energy-efficient digital circuit sizing: important issues and design limitations	2006	-5.7537099198398725	12.778778878763006	3782432
3782597	EDA	a new repair scheme for tsv-based 3d memory using base die repair cells	2017	-5.328398747996365	12.472100667868284	3782624
3782744	Embedded	efficient multilevel formal analysis and estimation of design vulnerability to single event transients	2015	-5.754809601024965	12.46655987207303	3782771
3783923	EDA	carrot - a tool for fast and accurate soft error rate estimation	2006	-6.109467623526252	13.127642850159285	3783950
3784636	EDA	standard cad tool-based method for simulation of laser-induced faults in large-scale circuits	2018	-5.462531123945055	12.689305566776953	3784663
3786926	EDA	testing and diagnosis of power switches in socs	2006	-5.7014725211497375	12.787949907413028	3786953
3788051	EDA	clocking optimization and distribution in digital systems with scheduled skews	1997	-6.14844021427877	12.83239220756342	3788078
3790792	EDA	effect of mt and vt cmos, on transmission gate logic for low power 4: 1 mux in 45 nm technology	2012	-5.694470371609437	12.647937246740732	3790819
3793968	EDA	standard cell sizing for subthreshold operation	2012	-5.9079815825759185	12.972516188866761	3793995
3796012	EDA	substrate monitoring system for inspecting defects in tsv-based data buses	2014	-5.320843185749009	12.589094873056641	3796039
3796038	EDA	lsta: learning-based static timing analysis for high-dimensional correlated on-chip variations	2017	-6.261615399741683	12.675072736187301	3796065
3804378	EDA	empirical performance models for 3t1d memories	2009	-5.977023495337874	13.124158344794829	3804405
3805624	EDA	variability-tolerant register-transfer level synthesis	2008	-6.06762003818838	12.527098304731837	3805651
3810339	EDA	full-chip interconnect power estimation and simulation considering concurrent repeater and flip-flop insertion	2003	-6.2497097121441785	12.855030054905187	3810366
3810534	EDA	automatic layout for gate arrays with one layer of metal	1983	-5.70139743690307	12.651860088671253	3810561
3810542	EDA	state of the art low capture power methodology	2011	-5.616182305971448	12.367308651307265	3810569
3812293	EDA	joint soft-error-rate (ser) estimation for combinational logic and sequential elements	2016	-5.381813690852091	13.136521750427045	3812320
3813270	EDA	analyzing the inherent reliability of moderately sized magnetic and electrostatic qca circuits via probabilistic transfer matrices	2009	-5.718750209838338	12.734223344233456	3813297
3814162	DB	the radiation tolerance problem: analytical modelling of inter-dependency of parameters	2009	-5.388120549936341	12.794961639994993	3814189
3815169	EDA	novel nbti aware approach for low power finfet based wide fan-in domino logic	2015	-5.470340587840719	12.78905147764135	3815196
3816200	EDA	transistor-specific delay modeling for ssta	2008	-6.149734666329015	12.651412362012485	3816227
3817088	EDA	minimizing process-induced skew using delay tuning	2001	-5.501190653847541	13.143193689668006	3817115
3817709	HCI	power supply noise: causes, effects, and testing	2010	-5.638584653637513	12.727099623342305	3817736
3822179	EDA	thermomechanical stress-aware management for 3d ic designs	2013	-6.090001807873055	12.884238026335623	3822206
3823320	EDA	a cmos-based logic cell for the implementation of self-checking fpgas	1999	-6.1990555287364115	12.332383924244715	3823347
3825884	EDA	real-time heating and power characterization of cells in standard cell designs	2013	-5.315706706612493	12.789453463245149	3825911
3826326	EDA	cell-aware analysis for small-delay effects and production test results from different fault models	2011	-5.317006362260652	12.275202547920804	3826353
3826342	EDA	nocee: energy macro-model extraction methodology for network on chip routers	2005	-5.921147625512616	12.580976447663467	3826369
3827446	EDA	localized thermal effect of sub-16nm finfet technologies and its impact on circuit reliability designs and methodologies	2015	-5.496023099462633	13.174289577656813	3827473
3828162	EDA	macro-models for high level area and power estimation on fpgas	2004	-5.950977501131509	12.326177308490502	3828189
3828208	EDA	common path pessimism removal: an industry perspective	2014	-5.69732797733653	12.44503241034226	3828235
3830395	Metrics	error correcting codes for crosstalk effect minimization	2003	-6.230311344490144	12.885876079933409	3830422
3830486	EDA	a fault tolerance aware synthesis methodology for threshold logic gate networks	2008	-5.523223685816378	12.855818735888874	3830513
3831255	Vision	construction of soft-error-tolerant ff with wide error pulse detecting capability	2009	-5.474296101120911	13.06666127612677	3831282
3831803	EDA	interconnect and current density stress: an introduction to electromigration-aware design	2005	-5.449700136798997	12.958898516596985	3831830
3831995	EDA	tsv stress-aware performance and reliability analysis	2012	-5.955614515551862	13.092104189340679	3832022
3833651	EDA	accurate estimation of leakage power variability in sub-micrometer cmos circuits	2012	-6.107810945402798	12.981401026839931	3833678
3834130	HCI	analysis of the feasibility of dynamic thermal testing in digital circuits	1997	-5.332809515986227	12.298891333234543	3834157
3835597	Theory	defect analysis and realistic fault model extensions for static random access memories	2000	-5.656168005947006	12.694733374770285	3835624
3835675	ML	an analytical model for negative bias temperature instability	2006	-5.641069143699836	13.11840394661274	3835702
3836173	Arch	a microarchitecture-based framework for pre- and post-silicon power delivery analysis	2009	-5.567744570886745	12.692438679752374	3836200
3841148	EDA	a fast statistical soft error rate estimation method for nano-scale combinational circuits	2016	-5.938351393349283	12.502334252012476	3841175
3842274	EDA	multiple-parameter cmos ic testing with increased sensitivity for iddq	2003	-6.163287123444184	13.169371671103615	3842301
3843865	EDA	efficiency evaluation of parametric failure mitigation techniques for reliable sram operation	2012	-5.6678825495060075	12.482330426841294	3843892
3844262	EDA	architectural evaluations on tsv redundancy for reliability enhancement	2017	-5.357636800636058	12.928880040075546	3844289
3844436	HPC	a repeater optimization methodology for deep sub-micron, high performance processors	1997	-6.259313468055215	12.750744350114761	3844463
3849858	Arch	clock gating effectiveness metrics: applications to power optimization	2009	-5.375988171372524	12.797319233335786	3849885
3850127	EDA	electromigration assessment for power grid networks considering temperature and thermal stress effects	2016	-6.095008867762835	13.06685213599136	3850154
3850562	EDA	power supply noise in delay testing	2006	-5.664235337456012	12.518645501983132	3850589
3852079	EDA	designing approximate circuits using clock overgating	2016	-5.77024163849375	13.187527480505713	3852106
3852766	EDA	test schedule optimization for multicore socs: handling dynamic voltage scaling and multiple voltage islands	2012	-6.144712353605268	12.958447958142823	3852793
3853469	EDA	operand width aware hardware reuse: a low cost fault-tolerant approach to alu design in embedded processors	2011	-5.441689954522163	12.272884021158186	3853496
3854709	EDA	samurai: an accurate method for modelling and simulating non-stationary random telegraph noise in srams	2011	-6.1625893400471865	12.775797237777919	3854736
3855582	HPC	block-level electro-migration analysis (bema) for safer product life	2015	-5.391092342589184	12.300927002952989	3855609
3857502	EDA	multi-cycle circuit parameter independent atpg for interconnect open defects	2015	-5.573150844965109	12.439049216756755	3857529
3857748	Arch	statistical analysis of process variation induced sram electromigration degradation	2014	-6.218608481982013	13.16241219021943	3857775
3859607	EDA	physical design implementation of segmented buses to reduce communication energy	2006	-6.258657509537098	12.849803841245695	3859634
3860328	HPC	motifnetwork: high throughput determination of evolutionary domain networks	2009	-6.065443295457972	12.298315907536278	3860355
3861717	EDA	a comparative study of the design of synchronous and asynchronous self-checking risc processors	2004	-5.376780204694499	12.76912187856399	3861744
3863987	EDA	a comparative study of wearout mechanisms in state-of-art microprocessors	2012	-5.330628860523898	13.134536360647173	3864014
3864453	EDA	functional verification of ecl circuits including voltage regulators	1993	-6.229678978366697	12.42639562555496	3864480
3868028	EDA	moment-based power estimation in very deep submicron technologies	2003	-6.0507269096856495	12.358617931697426	3868055
3868798	EDA	characterizing process variation in nanometer cmos	2007	-6.1333350156222375	12.502549309197533	3868825
3870189	EDA	design-phase buffer allocation for post-silicon clock binning by iterative learning	2018	-5.815086113436101	12.636726408517655	3870216
3870505	EDA	design of a testchip for low cost ic testing	2009	-5.3266246590511015	13.075277050533655	3870532
3871788	EDA	a variation-tolerant scheduler for better than worst-case behavioral synthesis	2009	-6.097140452661509	12.585768913524175	3871815
3873742	EDA	impact and optimization of lithography-aware regular layout in digital circuit design	2011	-5.748273562097945	12.720332706667884	3873769
3873783	EDA	layout dependent synthesis for manufacturing costs optimized 3d integrated systems	2013	-5.338769248558044	12.579127162105172	3873810
3874401	EDA	computing detection probability of delay defects in signal line tsvs	2013	-5.631977844626948	12.32261621891843	3874428
3874830	HPC	circuit performance prediction considering core utilization with interconnect length distribution model	2005	-6.252455562579888	13.108058003249461	3874857
3876918	EDA	electrical interconnect test of 3d ics made of dies without esd protection circuits with a built-in test circuit	2015	-5.438823185842039	12.379720840361127	3876945
3879681	Logic	resistive-open defect influence in sram pre-charge circuits: analysis and characterization	2005	-5.468946253381245	12.626558721628392	3879708
3884320	EDA	hierarchical probabilistic macromodeling for qca circuits	2007	-6.172789833693278	12.293187967491141	3884347
3884322	EDA	efficient clock distribution scheme for vlsi rns-enabled controllers	2005	-6.123822877684214	13.121419001574946	3884349
3885125	EDA	exploring scope of power reduction with constrained physical synthesis	2015	-6.099430496902787	12.997899216697713	3885152
3887712	EDA	an early stage design flow for switching noise attenuation	2016	-5.814863434841343	12.467032642886936	3887739
3888955	EDA	yield forecasting across semiconductor fabrication plants and design generations	2017	-5.307663314530224	12.371678864606965	3888982
3889712	EDA	representative critical-path selection for aging-induced delay monitoring	2013	-5.4184269086964765	13.003167942826252	3889739
3890797	EDA	novel transient fault hardened static latch	2003	-5.834727394900553	13.126327787013766	3890824
3890807	EDA	towards automatic diagnosis of minority carriers propagation problems in hv/ht automotive smart power ics	2016	-5.525072621824981	12.56333221030143	3890834
3892426	EDA	a novel algorithmic approach to aid post-silicon delay measurement and clock tuning	2014	-5.665810052750771	12.244318193148533	3892453
3893076	EDA	lens aberration aware placement for timing yield	2009	-6.164457636418737	12.940023861539233	3893103
3893530	EDA	a cycle accurate power estimation tool	2006	-5.5257838435257645	12.975100782389074	3893557
3894874	EDA	design layout optimization in the presence of proximity-dependent stress effects	2014	-5.973747363594381	12.727804277279079	3894901
3895101	EDA	a framework for layout-dependent sti stress analysis and stress-aware circuit optimization	2012	-5.9724891099688255	13.027373993050478	3895128
3896705	EDA	suspicious timing error prediction with in-cycle clock gating	2013	-5.408481053600516	13.001772251219395	3896732
3897172	SE	detection of resistive shorts in deep sub-micron technologies	2003	-5.961242988137325	13.074792059474385	3897199
3897695	EDA	analyzing the impact of frequency and diverse path delays in the time vulnerability factor of master-slave d flip-flops	2015	-5.5995686909770175	12.94301188824782	3897722
3898868	EDA	a design preconditioning flow for low-noise circuits	2015	-5.978247210968517	12.510997727534432	3898895
3899026	EDA	mtj/mos-hybrid logic-circuit design flow for nonvolatile logic-in-memory lsi	2013	-5.349645122845474	12.669284712355061	3899053
3902109	EDA	bti-aware design using variable latency units	2012	-6.005956212627362	13.131718249416402	3902136
3904111	EDA	timber: time borrowing and error relaying for online timing error resilience	2010	-5.4188468792708555	13.102002873640759	3904138
3905732	EDA	statistical analysis of normality of systematic and random variability of flip-flop race immunity in 130nm and 90nm cmos technologies	2007	-5.899341227948617	13.140064538928284	3905759
3906212	EDA	full-chip vectorless dynamic power integrity analysis and verification against 100uv/100ps-resolution measurement	2004	-5.5165397335932695	12.72964681329381	3906239
3907051	EDA	defect analysis and a new fault model for multi-port srams	2001	-5.341686263087559	12.386291373716315	3907078
3907205	EDA	design and use of memory-specific test structures to ensure sram yield and manufacturability	2003	-5.790570620442757	13.183270086184413	3907232
3907571	Embedded	fault detection and repair of dsc arrays through memristor sensing	2015	-5.347782009320014	12.869504895417375	3907598
3907579	HCI	statistical placement for fpgas considering	2007	-5.736184692818479	12.816160897908278	3907606
3910879	EDA	context-specific leakage and delay analysis of a 65nm standard cell library for lithography-induced variability	2007	-6.201311719941442	12.827206381344268	3910906
3912711	Arch	measurement of power supply noise tolerance of self-timed processor	2009	-6.08799734580211	12.776344491116452	3912738
3913516	EDA	accounting for inherent circuit resilience and process variations in analyzing gate oxide reliability	2011	-6.005740642630173	12.948873836112716	3913543
3914096	EDA	a fault-secure high-level synthesis algorithm for rdr architectures	2011	-5.51314789557714	12.321855313469095	3914123
3915343	EDA	power grid effects and their impact on-die	2012	-5.782733041685803	12.423585041401449	3915370
3917331	EDA	design method and test structure to characterize and repair tsv defect induced signal degradation in 3d system	2010	-5.63939550641397	12.41490147734105	3917358
3917760	EDA	physical design solutions to tackle feol/beol degradation in gate-level monolithic 3d ics	2016	-6.218727764307125	13.09131335919987	3917787
3918228	EDA	improving the detectability of resistive open faults in scan cells	2009	-5.4550610272072	12.558911072459635	3918255
3919717	EDA	diagnosis of bridging defects based on current signatures at low power supply voltages	2007	-5.604650765748248	12.799116668590527	3919744
3919875	EDA	design, test, and repair of mlut (memristor look-up table) based asynchronous nanowire reconfigurable crossbar architecture	2014	-5.425578715097656	12.840317470764266	3919902
3922259	EDA	influence of metallic tubes on the reliability of cntfet srams: error mechanisms and countermeasures	2011	-5.4550685774136785	12.897935132957931	3922286
3924325	EDA	sram word-oriented redundancy methodology using built in self-repair	2004	-5.361954473705864	12.448309820220375	3924352
3924799	EDA	power and thermal constrained test scheduling	2009	-5.675465418601947	12.604983223142607	3924826
3924806	EDA	importance of ir drops on the modeling of laser-induced transient faults	2017	-5.5050049935468675	12.752509452232387	3924833
3925091	EDA	on the effectiveness of reducing large linear networks with many ports	2007	-5.633487166963849	12.564265020094814	3925118
3925998	EDA	process-aggravated noise (pan): new validation and test problems	1996	-5.550678091130758	12.689331090304234	3926025
3927289	EDA	a fast and accurate per-cell dynamic ir-drop estimation method for at-speed scan test pattern validation	2012	-5.9388081869741045	12.30681663067636	3927316
3927327	EDA	timing monitoring paths selection for wide voltage ic	2016	-6.19229709800103	13.130415842256575	3927354
3930729	EDA	comparative analysis of the robustness of master-slave flip-flops against variations	2015	-6.055365046146637	13.092191310830236	3930756
3935283	EDA	high-sensitivity hardware trojan detection using multimodal characterization	2013	-5.49814796664074	13.052577176132115	3935310
3936030	EDA	heterogeneous technology mapping for area reduction in fpgas withembedded memory arrays	2000	-5.334543164103273	12.988989209528766	3936057
3936622	EDA	on-chip measurements complementary to design flow for integrity in socs	2007	-5.48132350650927	12.780405809332647	3936649
3937471	EDA	managing contamination delay to improve timing speculation architectures	2016	-6.119434620268432	12.653530797674966	3937498
3938818	EDA	a linear-centric simulation framework for parametric fluctuations	2002	-6.092878533429196	12.591280153117054	3938845
3939398	EDA	performance enhancement of two-phase quasi-delay-insensitive circuits	1996	-5.408060365221751	12.342783174579374	3939425
3940803	Arch	experimental investigation into radiation-hardening-by-design (rhbd) flip-flop designs in a 65nm cmos process	2016	-5.614720922417998	12.849611139619364	3940830
3942208	EDA	a defect-aware approach for mapping reconfigurable single-electron transistor arrays	2015	-5.79977984384269	12.86084655100127	3942235
3943564	HCI	survey of robustness enhancement techniques for wireless systems-on-a-chip and study of temperature as observable for process variations	2011	-5.559410590059035	13.04941547297889	3943591
3945458	EDA	single fault masking logic designs with error correcting codes	1995	-5.323316372978324	12.468795513083274	3945485
3946644	EDA	performance/reliability trade-off in superscalar processors for aggressive nbti restoration of functional units	2013	-5.311036333536472	13.188240192528234	3946671
3950042	EDA	a highly fault tolerant pla architecture for failure-prone nanometer cmos and novel quantum device technologies	2004	-5.304117096785655	13.108619484961949	3950069
3952619	EDA	design and test strategies for microarchitectural post-fabrication tuning	2009	-5.818269176207258	13.14643278095366	3952646
3954309	Arch	stochastic nanoscale addressing for logic	2010	-5.824587505357928	12.675577361610339	3954336
3955111	EDA	using bulk built-in current sensors to detect soft errors	2006	-5.51073627979412	12.645332896793905	3955138
3958326	EDA	a methodology for chip-level electromigration risk assessment and product qualification	2004	-5.541629977389004	12.961785669203554	3958353
3959850	EDA	taming noise in deep submicron digital integrated circuits (panel)	1998	-6.143404790272004	13.01606166185958	3959877
3960064	EDA	placement and timing for fpgas considering variations	2006	-5.81839509683016	12.946416223812625	3960091
3961434	Theory	analysing the operation of the basic pass transistor structure	2007	-5.821917547955805	12.341691391973965	3961461
3962580	EDA	towards aging-induced approximations	2017	-5.862089583591678	12.786138658364154	3962607
3962675	EDA	circuit delay variability due to wire resistance evolution under ac electromigration	2015	-6.025924908246435	12.84412460433682	3962702
3964867	EDA	impact of power supply noise on clock jitter in high-speed ddr memory interfaces	2013	-5.7891471137506745	12.936288086686972	3964894
3966785	Arch	an analytical model for performance yield of nanoscale sram accounting for the sense amplifier strobe signal	2011	-6.043797973387849	13.00130934322957	3966812
3969790	EDA	noise margin constraints for interconnectivity in deep submicron low power and mixed-signal vlsi circuits	1999	-5.6705182218561685	12.828421965629705	3969817
3970362	Arch	implications of device timing variability on full chip timing	2007	-5.987370649573079	12.885051585473109	3970389
3971736	EDA	a statistical design-oriented delay variation model accounting for within-die variations	2008	-6.20872154662337	13.131310075731669	3971763
3973147	EDA	latency/area analysis and optimization of asynchronous nanowire reconfigurable crossbar system	2010	-5.6088681592411795	13.006113634507107	3973174
3976444	EDA	a programmable majority logic array using molecular scale electronics	2007	-6.224816630907066	12.880952449468763	3976471
3976823	EDA	pasap: power aware structured asic placement	2010	-6.233405069145593	13.170619305568945	3976850
3977325	EDA	oscillation ring testing methodology of tsvs in 3d stacked ics	2016	-5.583418269098301	12.298178885263633	3977352
3977956	EDA	on reducing scan shift activity at rtl	2010	-5.675006816125867	12.354374228954839	3977983
3978751	Theory	expandable circuits of mutator-based memcapacitor emulator	2013	-5.852580462707525	12.449440211642733	3978778
3979243	EDA	impact of interconnect variability on circuit performance in advanced technology nodes	2016	-5.82616904226088	13.075237445298344	3979270
3979508	EDA	semi-empirical aging model development via accelerated aging test	2016	-5.964011185926798	12.475077959384766	3979535
3980552	EDA	impact of nano-scale through-silicon vias on the quality of today and future 3d ic designs	2011	-5.399324414177357	13.16874226924887	3980579
3984118	EDA	variation-aware aging analysis with non-gaussian parameters	2011	-6.22376392000288	12.734768965881633	3984145
3984966	EDA	evaluating transient-fault effects on traditional c-element's implementations	2010	-5.6063636449661995	12.88742980137692	3984993
3986234	EDA	improving dpa resistance of quasi delay insensitive circuits using randomly time-shifted acknowledgment signals	2005	-5.5809485805848205	12.57864631641164	3986261
