id	title	keywords	abstract	entities	authors	year	journal	doi	fos	area	x	y	ix
12ea495c74620e6ae4cdd4548622661c3c4d8738	neural masses and fields in dynamic causal modeling	biological patents;biomedical journals;text mining;europe pubmed central;citation search;citation networks;research articles;abstracts;open access;life sciences;clinical guidelines;local field potential lfp;electroencephalography;full text;neural mass models;magnetoencephalography meg;dynamic causal modelling;rest apis;orcids;europe pmc;biomedical research;bioinformatics;literature search	Dynamic causal modeling (DCM) provides a framework for the analysis of effective connectivity among neuronal subpopulations that subtend invasive (electrocorticograms and local field potentials) and non-invasive (electroencephalography and magnetoencephalography) electrophysiological responses. This paper reviews the suite of neuronal population models including neural masses, fields and conductance-based models that are used in DCM. These models are expressed in terms of sets of differential equations that allow one to model the synaptic underpinnings of connectivity. We describe early developments using neural mass models, where convolution-based dynamics are used to generate responses in laminar-specific populations of excitatory and inhibitory cells. We show that these models, though resting on only two simple transforms, can recapitulate the characteristics of both evoked and spectral responses observed empirically. Using an identical neuronal architecture, we show that a set of conductance based models-that consider the dynamics of specific ion-channels-present a richer space of responses; owing to non-linear interactions between conductances and membrane potentials. We propose that conductance-based models may be more appropriate when spectra present with multiple resonances. Finally, we outline a third class of models, where each neuronal subpopulation is treated as a field; in other words, as a manifold on the cortical surface. By explicitly accounting for the spatial propagation of cortical activity through partial differential equations (PDEs), we show that the topology of connectivity-through local lateral interactions among cortical layers-may be inferred, even in the absence of spatially resolved data. We also show that these models allow for a detailed analysis of structure-function relationships in the cortex. Our review highlights the relationship among these models and how the hypothesis asked of empirical data suggests an appropriate model class.	anatomy, regional;causal filter;conductance (graph);convolution;dicom;electroencephalography;epilepsies, partial;inference;interaction;iontophoresis;lateral thinking;magnetoencephalography;membrane potentials;neural ensemble;nonlinear system;numerical partial differential equations;population;rest;review [publication type];software propagation;synaptic package manager;anatomical layer;manifold	Rosalyn J. Moran;Dimitris A. Pinotsis;Karl J. Friston	2013		10.3389/fncom.2013.00057	psychology;text mining;neuroscience;electroencephalography;computer science;bioinformatics;artificial intelligence;machine learning;data mining	ML	20.332458639435814	-74.16627759502424	188843
75965f83e4edf623a369d0f73a9cef1647473243	the left occipitotemporal system in reading: disruption of focal fmri connectivity to left inferior frontal and inferior parietal language areas in children with dyslexia	functional connectivity;region of interest;visual word form area;phonological processing;word processing;developmental dyslexia	"""Developmental dyslexia is a severe reading disorder, which is characterized by dysfluent reading and impaired automaticity of visual word processing. Adults with dyslexia show functional deficits in several brain regions including the so-called """"Visual Word Form Area"""" (VWFA), which is implicated in visual word processing and located within the larger left occipitotemporal VWF-System. The present study examines functional connections of the left occipitotemporal VWF-System with other major language areas in children with dyslexia. Functional connectivity MRI was used to assess connectivity of the VWF-System in 18 children with dyslexia and 24 age-matched controls (age 9.7-12.5 years) using five neighboring left occipitotemporal regions of interest (ROIs) during a continuous reading task requiring phonological and orthographic processing. First, the results revealed a focal origin of connectivity from the VWF-System, in that mainly the VWFA was functionally connected with typical left frontal and parietal language areas in control children. Adjacent posterior and anterior VWF-System ROIs did not show such connectivity, confirming the special role that the VWFA plays in word processing. Second, we detected a significant disruption of functional connectivity between the VWFA and left inferior frontal and left inferior parietal language areas in the children with dyslexia. The current findings add to our understanding of dyslexia by showing that functional disconnection of the left occipitotemporal system is limited to the small VWFA region crucial for automatic visual word processing, and emerges early during reading acquisition in children with dyslexia, along with deficits in orthographic and phonological processing of visual word forms."""	area striata structure;cognition disorders;denial-of-service attack;dyslexia;focal (programming language);large;orthographic projection;region of interest;resting state fmri;schema (genetic algorithms);vwf gene;visual word;frontal lobe	Sanne van der Mark;Peter Klaver;Kerstin Bucher;Urs Maurer;Enrico Schulz;Silvia Brem;Ernst Martin;Daniel Brandeis	2011	NeuroImage	10.1016/j.neuroimage.2010.10.002	psychology;cognitive psychology;dyslexia;developmental psychology;radiology;medicine;communication;region of interest	HCI	19.58702847813711	-78.72184600181072	188933
c3e6edbe1257cddcd4e5f31139a12f54ce270585	dependence of excitability indices on membrane channel dynamics, myelin impedance, electrode location and stimulus waveforms in myelinated and unmyelinated fibre models	electrostimulation;a-fibres;c-fibres;strength-duration;rheobase	Neuronal excitability is determined in a complex way by several interacting factors, such as membrane dynamics, fibre geometry, electrode configuration, myelin impedance, neuronal terminations … $\dots $ This study aims to increase understanding in excitability, by investigating the impact of these factors on different models of myelinated and unmyelinated fibres (five well-known membrane models are combined with three electrostimulation models, that take into account the spatial structure of the neuron). Several excitability indices (rheobase, polarity ratio, bi/monophasic ratio, time constants … $\dots $) are calculated during extensive parameter sweeps, allowing us to obtain novel findings on how these factors interact, e.g. how the dependency of excitability indices on the fibre diameter and myelin impedance is influenced by the electrode location and membrane dynamics. It was found that excitability is profoundly impacted by the used membrane model and the location of the neuronal terminations. The approximation of infinite myelin impedance was investigated by two implementations of the spatially extended non-linear node model. The impact of this approximation on the time constant of strength-duration plots is significant, most importantly in the Frankenhaeuser-Huxley membrane model for large electrode-neuron separations. Finally, a multi-compartmental model for C-fibres is used to determine the impact of the absence of internodes on excitability. Graphical AbstractElectrostimulation models, obtained by combining five membrane models with three representations of the neuronal cable equation, are fed with electrode and stimulus input parameters. The dependency of neuronal excitability on the interaction of these input parameters is determined by deriving excitability indices from the spatiotemporal model response. The impact of the myelin impedance and the fibre diameter on neural excitability is also considered.	anatomic node;approximation;cable theory;characteristic impedance;diameter (qualifier value);excited state;graphical user interface;huxley: the dystopia;impacted tooth;interaction;ion channel;multi-compartment model;myelin p0 protein;myelin sheath;neuron;nonlinear system;numerous;population parameter;quantitative impedance;tissue membrane;emotional dependency;polarity	Thomas Tarnaud;Wout Joseph;Luc Martens;Emmeric Tanghe	2018	Medical & Biological Engineering & Computing	10.1007/s11517-018-1799-y	myelin;biophysics;electronic engineering;electrode;membrane;time constant;electrical impedance;mathematics;neuron;membrane channel;rheobase	ML	20.071409274535057	-73.92302689353039	189127
63d968f71209ee189375d09153e0969cd6d05046	application of wavelet-based tools to study the dynamics of biological processes	programacion de ordenadores;data analysis;wavelet transform;trigeminal;time series analysis;information processing;biological process	The article makes use of three different examples (sensory information processing in the rat trigeminal complex, intracellular interaction in snail neurons and multimodal dynamics in nephron autoregulation) to demonstrate how modern approaches to time-series analysis based on the wavelet-transform can provide information about the underlying complex biological processes.	artificial neuron;biological factors;homeostasis;information processing;multimodal interaction;nephrons;time series;wavelet transform	Alexey N. Pavlov;Valeri A. Makarov;Erik Mosekilde;Olga V. Sosnovtseva	2006	Briefings in bioinformatics	10.1093/bib/bbl041	information processing;computer science;artificial intelligence;time series;data analysis;biological process;statistics;wavelet transform	ML	21.15803996646103	-74.0921432948512	189256
c678a8b1f2589cb1664e8738165c10df073b0a6e	amygdala responsivity related to memory of emotionally neutral stimuli constitutes a trait factor for depression	cognitive deficit;episodic memory;functional neuroimaging;healthy control;major depressive disorder;fmri;hippocampus;memory performance;article letter to editor;memory effect;amygdala;mdd;memory	Episodic memory impairment is considered to be a core cognitive deficit of Major Depressive Disorder (MDD) and has motivated a line of research investigating the role of the amygdala and the hippocampus in depression. While functional neuroimaging studies have focused on memory for emotional but not for neutral stimuli, in order to probe amygdala function, structural imaging studies have tied episodic memory to hippocampal function. We therefore investigated the neural correlates of episodic memory formation for neutral stimuli in 20 patients with a first depressive episode, 20 patients recovered from a first episode and 20 healthy controls. Because there is evidence that the amygdala exhibits hyperactive responses even to neutral stimuli in depressed subjects, we specifically explored the potential role of the amygdala in forming episodic memories with neutral content. Both patient groups showed stronger subsequent memory effects in the amygdala when compared to controls, in the absence of any differences in hippocampal activity between groups. Patients with a first episode of MDD showed increased activity related to episodic memory formation in a fronto-limbic network. These state-related activations may be related to a compensatory mechanism, which is supported by the absence of any differences in memory performance between groups. These findings represent initial evidence for a neurocognitive trait or vulnerability marker of depression-amygdala involvement in episodic memory formation of neutral stimuli.	amygdaloid structure;cognition disorders;consciousness;exhibits as topic;functional neuroimaging;hyperactive behavior;major depressive disorder;medical imaging;memory disorders;memory, episodic;patients;neurocognitive	Philip van Eijndhoven;Guido A. van Wingen;Guillén Fernández;Mark Rijpkema;Robbert Jan Verkes;Jan K. Buitelaar;Indira Tendolkar	2011	NeuroImage	10.1016/j.neuroimage.2010.08.040	psychology;cognitive psychology;exceptional memory;memory effect;neuroscience;long-term memory;developmental psychology;childhood memory;retrospective memory;functional neuroimaging;memory consolidation;explicit memory;episodic memory;effects of stress on memory;hippocampus;declarative memory;memory;social psychology;autobiographical memory	AI	17.92890098353789	-78.198635722246	189812
b933f390974083f03fa103640cbc707233ce431d	lead field space projection for spatiotemporal imaging of independent brain activities	magnetic field;independent component analysis;magnetoencephalography;space use;proceedings paper;brain activation;electroencephalography;neuronal activity	Magnetoencephalography and electroencephalography are non-invasive instruments that can record magnetic fields and scalp potentials, respectively, induced from neuronal activities. The recordings are superimposed signals contributed from the whole brain. Independent component analysis (ICA) can provide a way of decomposition by maximizing the mutual independence of separated components. Beyond the temporal profile and topography provided by ICA, this work aims to estimate and map the cortical source distribution for each component. The proposed method first constructs a source space using lead field vectors for vertices on the cortical surface. By projecting the specified components to this source space, our method provides the corresponding spatiotemporal maps for these independent brain activities. Experiments using simulated brain activities clearly demonstrate the effectiveness and accuracy of the proposed method.		Huiling Chan;Yong-Sheng Chen;Li-Fen Chen;Tzu-Hua Chen;I-Tzu Chen	2009		10.1007/978-3-642-01513-7_56	independent component analysis;magnetic field;electroencephalography;artificial intelligence;premovement neuronal activity;magnetoencephalography	Vision	20.98545706582184	-77.4144185491942	191078
60f2ee9ab1180d3736eff2fa412f01e66eb3ef55	modeling resting state fmri data via longitudinal supervised stochastic coordinate coding		Resting state fMRI (rsfMRI) has been used widely to explore intrinsic brain activities and networks. Although there are a large number of model-driven and data-driven methods that have been employed to model rsfMRI data, it is challenging to model longitudinal rsfMRI data given the time gaps. Currently, sparse dictionary learning (SDL) method has already shown great promise and attracted increasing attention in the rsfMRI research field. The vital advantage of this SDL methodology is that it can identify concurrent brain networks efficiently and systematically. However, the current SDL is not directly applicable to longitudinal rsfMRI data with multiple time points. In response, we propose a longitudinal supervised stochastic coordinate coding (LSSCC) algorithm for longitudinal rsfMRI data analysis. At the first time point, concurrent brain networks are learned and approximated based on the spatial network templates by SDL with l2 norm. Then, the learned networks at the first time point are transferred to the following time points and the LSSCC is employed to conduct the approximations of functional networks longitudinally. The application of LSSCC on the ADNI-2 longitudinal rsfMRI datasets has shown the effectiveness of our proposed methods.	approximation algorithm;machine learning;model-driven integration;resting state fmri;sparse dictionary learning;sparse matrix;spatial network	Wei Zhang;Jinglei Lv;Shu Zhang;Yu Zhao;Tianming Liu	2018	2018 IEEE 15th International Symposium on Biomedical Imaging (ISBI 2018)	10.1109/ISBI.2018.8363538	coding (social sciences);pattern recognition;resting state fmri;artificial intelligence;computer science;norm (mathematics);spatial network	DB	23.19075251088574	-74.99754287454044	191605
1dbe13c03cce346eca0275a938eeee287dd2cb60	same clock, different time read-out: spontaneous brain oscillations and their relationship to deficient coding of cognitive content	journal_article;article letter to editor	Neuronal oscillations provide an efficient means of communication, fostering functional neural states supporting action and reaction. High in the action hierarchy, cognitive abilities are severely compromised in neuropsychiatric disease such as schizophrenia. Current thinking highlights a clocking mechanism provided by the phase of an ongoing slow oscillation that offers a temporal frame for coding of perceptual and computational elements. Yet unclear is whether and how a dysregulated clocking mechanism accounts for diminished cognitive performance. Neuromagnetic oscillatory activity was related to cognitive performance assessed by the MATRICS Consensus Cognitive Battery in 58 healthy individuals (HC) and 46 schizophrenia patients (SZ). HC showed a correlation between gamma-band oscillations (>40 Hz) and working memory performance. This relationship was disrupted in several ways in SZ. First, patients evidenced lower gamma power, poorer working memory performance, and no relationship between these measures. Second, the power spectra were dominated by ~10 Hz alpha oscillations with no group differences in amplitude. However, analysis of phase-to-amplitude coupling (PAC) revealed exaggerated clocking of gamma activity by alpha phase in SZ, associated with poor working memory performance. Third, despite entrainment by the same 10 Hz clock, gamma amplitude was abnormally distributed across the duty cycle in SZ, a potential consequence of compromised interneuron inhibition. Fourth, SZ showed over-engagement of a fronto-parietal network measured by gamma phase coherence, suggesting a brain state hindering cognitive output. Such an endogenous temporal organization may be a core dysfunction in SZ: a segregation/integration input imbalance fostering reduced cognitive performance and compromised behavioral output.	brainwave entrainment;clock rate;cognition;duty cycle;hertz (hz);interferon type ii;interneurons;memory disorders;neural oscillation;parkinson disease;patients;schizophrenia;spontaneous order	Tzvetan Popov;Petia Popova	2015	NeuroImage	10.1016/j.neuroimage.2015.06.071	psychology;neuroscience;developmental psychology;artificial intelligence;communication	HCI	17.461358932459834	-78.02981231129307	191781
8fed04ef65e69d0859c81f666d9f96b6cd9afd2d	brain electrical activity in epilepsy: characterization of the spatio-temporal dynamics with cellular neural networks based on a correlation dimension analysis	bioelectric potentials;brain models;cellular neural nets;diseases brain models cellular neural nets bioelectric potentials electroencephalography;brain epilepsy cellular neural networks steady state piecewise linear approximation electrodes hardware boundary conditions electric variables measurement time measurement;diseases;electroencephalography;steady state determination spatio temporal dynamics brain electrical activity epilepsy cellular neural networks cell outputs parameter deviations hardware realizations enhanced approximation method robustness	In this paper we present a new approach for the analysis of the spatio-temporal dynamics of brain electrical activity in e pil psy with Cellular Neural Networks (CNN). We have shown in recent investigations [1] that the dimension D 2(k;m) of brain electrical activity can be approximated by a function of CNN cell output s. These results obtained with CNN, having non steady-states, w re sensitive to parameter deviations occurring in CNN hardwar e realizations. In this contribution we present an enhanced app roximation method, which is based on a steady state determinati on showing an increased robustness and higher accuracy.	approximation algorithm;correlation dimension;neural networks;steady state	Ronald Kunz;Ronald Tetzlaff;Dietrich Wolf	2000		10.1109/ISCAS.2000.856343	electroencephalography;computer science;artificial intelligence;machine learning	ML	20.574864586199325	-74.34068103355722	192292
1889529c63bc70dd88c7920fd1846944df9cdcf6	developmental maturation of dynamic causal control signals in higher-order cognition: a neurocognitive network model	neurodevelopmental disorder;functional magnetic resonance imaging;human cognition;female;models neurological;neural pathways;diffusion tensor images;neural networks;resting state;male;top down control;nerve fibers;dorsolateral prefrontal cortex;cognitive development;plos computational biology;higher order;prefrontal cortex;image enhancement;cognitive skills;adults;anterior cingulate cortex;analytical method;magnetic resonance imaging;network model;cognition;cognitive control;child;cerebral cortex;regression analysis;humans;young adult;behavior;child development;reaction time;problem solving;posterior parietal cortex	Cognitive skills undergo protracted developmental changes resulting in proficiencies that are a hallmark of human cognition. One skill that develops over time is the ability to problem solve, which in turn relies on cognitive control and attention abilities. Here we use a novel multimodal neurocognitive network-based approach combining task-related fMRI, resting-state fMRI and diffusion tensor imaging (DTI) to investigate the maturation of control processes underlying problem solving skills in 7-9 year-old children. Our analysis focused on two key neurocognitive networks implicated in a wide range of cognitive tasks including control: the insula-cingulate salience network, anchored in anterior insula (AI), ventrolateral prefrontal cortex and anterior cingulate cortex, and the fronto-parietal central executive network, anchored in dorsolateral prefrontal cortex and posterior parietal cortex (PPC). We found that, by age 9, the AI node of the salience network is a major causal hub initiating control signals during problem solving. Critically, despite stronger AI activation, the strength of causal regulatory influences from AI to the PPC node of the central executive network was significantly weaker and contributed to lower levels of behavioral performance in children compared to adults. These results were validated using two different analytic methods for estimating causal interactions in fMRI data. In parallel, DTI-based tractography revealed weaker AI-PPC structural connectivity in children. Our findings point to a crucial role of AI connectivity, and its causal cross-network influences, in the maturation of dynamic top-down control signals underlying cognitive development. Overall, our study demonstrates how a unified neurocognitive network model when combined with multimodal imaging enhances our ability to generalize beyond individual task-activated foci and provides a common framework for elucidating key features of brain and cognitive development. The quantitative approach developed is likely to be useful in investigating neurodevelopmental disorders, in which control processes are impaired, such as autism and ADHD.	anatomic node;anatomical maturation;anterior insula;aortic valve insufficiency;attention deficit hyperactivity disorder;autistic disorder;biologic development;causal filter;causal system;cingulate cortex;cognition;developmental reading disorder;diffusion tensor imaging;estimated;insula of reil;multimodal imaging;multimodal interaction;network model;neurodevelopmental disorders;parietal lobe;posterior parietal cortex;prefrontal cortex;problem solving (mental process);rest;resting state fmri;top-down and bottom-up design;usb hub;cognitive development;neurocognitive	Kaustubh Supekar;Vinod Menon	2012		10.1371/journal.pcbi.1002374	cognition;magnetic resonance imaging;cognitive development;child development	AI	19.391490731803046	-78.38295423350682	192478
