id	title	keywords	abstract	entities	authors	year	journal	doi	fos	area	x	y	ix
9d2f2adbeb7e351c608b174009bdad7d54e545de	level of processing modulates the neural correlates of emotional memory formation	female;emotions;brain;recognition psychology;oxygen;male;semantics;emotional response;image processing computer assisted;diagnostic tests;activity pattern;brain mapping;adult;magnetic resonance imaging;neuropsychological tests;analysis of variance;regression analysis;humans;photic stimulation;neurological organization;young adult;correlation;recognition memory;cognitive processes;prediction;brain hemisphere functions;emotional memory;reaction time;stimuli	Emotion is known to influence multiple aspects of memory formation, including the initial encoding of the memory trace and its consolidation over time. However, the neural mechanisms whereby emotion impacts memory encoding remain largely unexplored. The present study used a levels-of-processing manipulation to characterize the impact of emotion on encoding with and without the influence of elaborative processes. Participants viewed emotionally negative, neutral, and positive scenes under two conditions: a shallow condition focused on the perceptual features of the scenes and a deep condition that queried their semantic meaning. Recognition memory was tested 2 days later. Results showed that emotional memory enhancements were greatest in the shallow condition. fMRI analyses revealed that the right amygdala predicted subsequent emotional memory in the shallow more than deep condition, whereas the right ventrolateral PFC demonstrated the reverse pattern. Furthermore, the association of these regions with the hippocampus was modulated by valence: the amygdala–hippocampal link was strongest for negative stimuli, whereas the prefrontal–hippocampal link was strongest for positive stimuli. Taken together, these results suggest two distinct activation patterns underlying emotional memory formation: an amygdala component that promotes memory during shallow encoding, especially for negative information, and a prefrontal component that provides extra benefits during deep encoding, especially for positive information.	amygdaloid structure;consciousness;hippocampus (brain);lung consolidation;memory disorders;memory management;modulation;powerbuilder foundation classes;quantum information;semiconductor consolidation;the legend of zelda: a link to the past;benefit;fmri	Maureen Ritchey;Kevin S. LaBar;Roberto Cabeza	2011	Journal of Cognitive Neuroscience	10.1162/jocn.2010.21487	psychology;cognitive psychology;neuroscience;developmental psychology;emotion;semantic memory;magnetic resonance imaging;explicit memory;semantics;levels-of-processing effect;communication;social psychology;recognition memory	HCI	17.357107253676254	-77.92408854709369	185668
3e46ae5536474d5e1c80f814762f3259422d3d8f	variability of structurally constrained and unconstrained functional connectivity in schizophrenia	functional mri;structurally constrained;schizophrenia;functional connectivity;functional connectivity entropy;diffusion tensor imaging;structurally unconstrained	Spatial variation in connectivity is an integral aspect of the brain's architecture. In the absence of this variability, the brain may act as a single homogenous entity without regional specialization. In this study, we investigate the variability in functional links categorized on the basis of the presence of direct structural paths (primary) or indirect paths mediated by one (secondary) or more (tertiary) brain regions ascertained by diffusion tensor imaging. We quantified the variability in functional connectivity using an unbiased estimate of unpredictability (functional connectivity entropy) in a neuropsychiatric disorder where structure-function relationship is considered to be abnormal; 34 patients with schizophrenia and 32 healthy controls underwent DTI and resting state functional MRI scans. Less than one-third (27.4% in patients, 27.85% in controls) of functional links between brain regions were regarded as direct primary links on the basis of DTI tractography, while the rest were secondary or tertiary. The most significant changes in the distribution of functional connectivity in schizophrenia occur in indirect tertiary paths with no direct axonal linkage in both early (P=0.0002, d=1.46) and late (P=1×10(-17), d=4.66) stages of schizophrenia, and are not altered by the severity of symptoms, suggesting that this is an invariant feature of this illness. Unlike those with early stage illness, patients with chronic illness show some additional reduction in the distribution of connectivity among functional links that have direct structural paths (P=0.08, d=0.44). Our findings address a critical gap in the literature linking structure and function in schizophrenia, and demonstrate for the first time that the abnormal state of functional connectivity preferentially affects structurally unconstrained links in schizophrenia. It also raises the question of a continuum of dysconnectivity ranging from less direct (structurally unconstrained) to more direct (structurally constrained) brain pathways underlying the progressive clinical staging and persistence of schizophrenia.	central serous chorioretinopathy;chronic disease;conflict (psychology);diffusion tensor imaging;european union;illness (finding);limited stage (cancer stage);mood disorders;patients;rest;schizophrenia;science;specialization;fmri;tertiary	Ye Yao;Lena Palaniyappan;Peter F. Liddle;Jie Zhang;Susan H Francis;Jianfeng Feng	2015		10.1002/hbm.22932	psychology;psychiatry;neuroscience;developmental psychology;schizophrenia;communication	Vision	20.292217475941133	-78.67485053689967	185703
e551d000d5697dc190a31987454e928b78550e92	multisensory integration in multiple reference frames in the posterior parietal cortex	institutional repositories;fedora;reference frame;vital;multisensory integration;superior colliculus;vtls;ils;spatial information;posterior parietal cortex;coordinate system	Spatial information processing takes place in different brain regions that receive converging inputs from several sensory modalities. Because of our own movements—for example, changes in eye position, head rotations, and so forth—unimodal sensory representations move continuously relative to one another. It is generally assumed that for multisensory integration to be an orderly process, it should take place between stimuli at congruent spatial locations. In the monkey posterior parietal cortex, the ventral intraparietal (VIP) area is specialized for the analysis of movement information using visual, somatosensory, vestibular, and auditory signals. Focusing on the visual and tactile modalities, we found that in area VIP, like in the superior colliculus, multisensory signals interact at the single neuron level, suggesting that this area participates in multisensory integration. Curiously, VIP does not use a single, invariant coordinate system to encode locations within and across sensory modalities. Visual stimuli can be encoded with respect to the eye, the head, or halfway between the two reference frames, whereas tactile stimuli seem to be prevalently encoded relative to the body. Hence, while some multisensory neurons in VIP could encode spatially congruent tactile and visual stimuli independently of current posture, in other neurons this would not be the case. Future work will need to evaluate the implications of these observations for theories of optimal multisensory integration.	encode;information processing;neuron;poor posture;reference frame (video);tactile imaging	Marie Avillac;Etienne Olivier;Sophie Denève;Suliann Ben Hamed;Jean-René Duhamel	2004	Cognitive Processing	10.1007/s10339-004-0021-3	psychology;reference frame;computer vision;neuroscience;coordinate system;spatial analysis;posterior parietal cortex;communication	ML	17.620610413021467	-75.62395582355516	185722
47a13e3cf559cb68fd226518282a74b77e5a8884	superlinear summation of information in premotor neuron pairs	neural networks;neural code;cortex;computer networks and communications;spike synchronization;socio culturale;information theory;motor control	Whether premotor/motor neurons encode information in terms of spiking frequency or by their relative time of firing, which may display synchronization, is still undetermined. To address this issue, we used an information theory approach to analyze neuronal responses recorded in the premotor (area F5) and primary motor (area F1) cortices of macaque monkeys under four different conditions of visual feedback during hand grasping. To evaluate the sensitivity of spike timing correlation between single neurons, we investigated the stimulus dependent synchronization in our population of pairs. We first investigated the degree of correlation of trial-to-trial fluctuations in response strength between neighboring neurons for each condition, and second estimated the stimulus dependent synchronization by means of an information theoretical approach. We compared the information conveyed by pairs of simultaneously recorded neurons with the sum of information provided by the respective individual cells. The information transmission across pairs of cells in the primary motor cortex seems largely independent, whereas information transmission across pairs of premotor neurons is summed superlinearly. The brain could take advantage of both the accuracy provided by the independency of F1 and the synergy allowed by the superlinear information population coding in F5, distinguishing thus the generalizing role of F5.		Fernando Montani;Andriy Oliynyk;Luciano Fadiga	2017	International journal of neural systems	10.1142/S012906571650009X	motor control;information theory;computer science;artificial intelligence;machine learning;cortex;neural coding;artificial neural network	ML	17.826457363283836	-75.50277121671068	185823
435c62a045c0327bc53918d4a6714cfa95aac4e8	test–retest reliability of structural brain networks from diffusion mri	connectome;diffusion mri;test retest;human brain;network;tractography	Structural brain networks constructed from diffusion MRI (dMRI) and tractography have been demonstrated in healthy volunteers and more recently in various disorders affecting brain connectivity. However, few studies have addressed the reproducibility of the resulting networks. We measured the test-retest properties of such networks by varying several factors affecting network construction using ten healthy volunteers who underwent a dMRI protocol at 1.5T on two separate occasions. Each T1-weighted brain was parcellated into 84 regions-of-interest and network connections were identified using dMRI and two alternative tractography algorithms, two alternative seeding strategies, a white matter waypoint constraint and three alternative network weightings. In each case, four common graph-theoretic measures were obtained. Network properties were assessed both node-wise and per network in terms of the intraclass correlation coefficient (ICC) and by comparing within- and between-subject differences. Our findings suggest that test-retest performance was improved when: 1) seeding from white matter, rather than grey; and 2) using probabilistic tractography with a two-fibre model and sufficient streamlines, rather than deterministic tensor tractography. In terms of network weighting, a measure of streamline density produced better test-retest performance than tract-averaged diffusion anisotropy, although it remains unclear which is a more accurate representation of the underlying connectivity. For the best performing configuration, the global within-subject differences were between 3.2% and 11.9% with ICCs between 0.62 and 0.76. The mean nodal within-subject differences were between 5.2% and 24.2% with mean ICCs between 0.46 and 0.62. For 83.3% (70/84) of nodes, the within-subject differences were smaller than between-subject differences. Overall, these findings suggest that whilst current techniques produce networks capable of characterising the genuine between-subject differences in connectivity, future work must be undertaken to improve network reliability.	adobe streamline;algorithm;anatomic node;anisotropy;cdisc sdtm respiratory test name terminology;cerebral palsy;coefficient;coefficient;computation;computational neuroscience;conflict (psychology);connectome;connectomics;diffusion anisotropy;folic acid;global network;graph theory;hypertext transfer protocol;neoplasms;neuroinformatics;neuroscience discipline;repeatability;sample size;scanning;science;seeding;small;tract (literature);waypoint;while;white matter;algorithm	Colin R. Buchanan;Cyril R. Pernet;Krzysztof J. Gorgolewski;Amos J. Storkey;Mark E. Bastin	2014	NeuroImage	10.1016/j.neuroimage.2013.09.054	psychology;diffusion mri;neuroscience;developmental psychology;radiology;artificial intelligence;tractography;connectome	Web+IR	21.868555085765298	-79.4488812170888	185836
ed00fd8ed29aa9280d5f45e51dd1d3d01617d9ec	anterior insula coordinates hierarchical processing of tactile mismatch responses	biological patents;biomedical journals;ucl;text mining;europe pubmed central;citation search;discovery;theses;conference proceedings;citation networks;digital web resources;research articles;ucl discovery;abstracts;open access;life sciences;clinical guidelines;ucl library;book chapters;open access repository;full text;rest apis;orcids;europe pmc;biomedical research;bioinformatics;literature search;ucl research	The body underlies our sense of self, emotion, and agency. Signals arising from the skin convey warmth, social touch, and the physical characteristics of external stimuli. Surprising or unexpected tactile sensations can herald events of motivational salience, including imminent threats (e.g., an insect bite) and hedonic rewards (e.g., a caressing touch). Awareness of such events is thought to depend upon the hierarchical integration of body-related mismatch responses by the anterior insula. To investigate this possibility, we measured brain activity using functional magnetic resonance imaging, while healthy participants performed a roving tactile oddball task. Mass-univariate analysis demonstrated robust activations in limbic, somatosensory, and prefrontal cortical areas previously implicated in tactile deviancy, body awareness, and cognitive control. Dynamic Causal Modelling revealed that unexpected stimuli increased the strength of forward connections along a caudal to rostral hierarchy-projecting from thalamic and somatosensory regions towards insula, cingulate and prefrontal cortices. Within this ascending flow of sensory information, the AIC was the only region to show increased backwards connectivity to the somatosensory cortex, augmenting a reciprocal exchange of neuronal signals. Further, participants who rated stimulus changes as easier to detect showed stronger modulation of descending PFC to AIC connections by deviance. These results suggest that the AIC coordinates hierarchical processing of tactile prediction error. They are interpreted in support of an embodied predictive coding model where AIC mediated body awareness is involved in anchoring a global neuronal workspace.	aic gene;aicardi's syndrome;akaike information criterion;cfp gene;caudal;causality;cerebral cortex;code;cognition disorders;data point;electroencephalography;esthesia;hallucinations, tactile;hierarchical integration;inference;insect bites;insula of reil;interaction;modulation;powerbuilder foundation classes;rating (action);regression - mental defense mechanism;resonance;rewards;self-awareness;thalamic structure;top-down and bottom-up design;twelve leverage points;unidentified flying oddball;workspace;fmri	Micah Allen;Francesca Fardo;Martin J. Dietz;Hauke Hillebrandt;Karl J. Friston;Geraint Rees;Andreas Roepstorff	2016		10.1016/j.neuroimage.2015.11.030	psychology;text mining;neuroscience;medical research;computer science;artificial intelligence;communication	HCI	17.748627734693326	-76.38508246855878	185875
0b52f532fa40ded35b8b22cea3dd97fa9307e477	a novel method for detection of voxels for decision making: an fmri study	fmri;brodmann areas;spm;cluster analysis	ABSTRACT#R##N##R##N#This study explores the patterns of activation in brain regions toward classifying decision making voxels from among four major Brodmann areas (BAs) upon stimulus of visual tasks. Toward this goal, a well-known clustering analysis has been performed on real-time data of the human brain obtained using functional magnetic resonance imaging (fMRI). The functional connectivity among various brain regions was detected by leveraging a distance correlation graph. Graphical methods have been employed to visualize the clusters elicited in the process. The analysis of the results sheds new light on how four significantly activated BAs of the brain exhibit effective connectively to perform a visual task in the context of decision making.	voxel	Fayyaz Ahmad;Attique Hussain;Safee Ullah Chaudhary;Iftikhar Ahmad;Shahid M. Ramay	2016	Int. J. Imaging Systems and Technology	10.1002/ima.22172	computer vision;computer science;artificial intelligence;machine learning;cluster analysis	Logic	22.693976814580108	-77.33628714540349	186243
913b6ec3c5f17d91054a6be13ab53fd539c1ac58	estimating coupling direction between neuronal populations with permutation conditional mutual information	neural model;estimation method;granger causality;tetanus toxin;epileptic seizure;conditional mutual information;neuronal populations;coupling direction;permutation;functional connectivity;indexation;mutual information;epileptic seizures	To further understand functional connectivity in the brain, we need to identify the coupling direction between neuronal signals recorded from different brain areas. In this paper, we present a novel methodology based on permutation analysis and conditional mutual information for estimation of a directionality index between two neuronal populations. First, the reliability of this method is numerically assessed with a coupled mass neural model; the simulations show that this method is superior to the conditional mutual information method and the Granger causality method for identifying the coupling direction between unidirectional or bidirectional neuronal populations that are generated by the mass neuronal model. The method is also applied to investigate the coupling direction between neuronal populations in CA1 and CA3 in the rat hippocampal tetanus toxin model of focal epilepsy; the propagation direction of the seizure events could be elucidated through this coupling direction estimation method. All together, these results suggest that the permutation conditional mutual information method is a promising technique for estimating directional coupling between mutually interconnected neuronal populations.	bi-directional text;ca1 field;ca3 field;causality;coefficient;conditional mutual information;coupling constant;epilepsies, partial;epilepsy;estimated;focal (programming language);futures studies;hippocampus (brain);interaction;neural ensemble;numerical analysis;population;resting state fmri;seizures;signal-to-noise ratio;simulation;software propagation;tetany;xfig;tetanus toxin	Xiaoli Li;Gaoxiang Ouyang	2010	NeuroImage	10.1016/j.neuroimage.2010.05.003	granger causality;machine learning;mathematics;permutation;mutual information;conditional mutual information;communication;statistics	ML	21.503125631104375	-76.60670773536113	186784
2f5fa28fe86004fe777ef5f64d2d5db9975b7cc6	the influence of sulcal variability on morphometry of the human anterior cingulate and paracingulate cortex	sulcus;individual variation;cortex;region of interest;mri;brain structure;anterior cingulate;morphological variation;gyrus;cingulate cortex;vbm;dorsal ventral	Human anterior cingulate (ACC) and paracingulate (PaC) cortices play an important role in cognitive and affective regulation and have been implicated in numerous psychiatric and neurological conditions. The region they comprise displays marked inter-individual variability in sulcal and gyral architecture, and although recent evidence suggests that this variability has functional significance, it is often ignored in automated and region-of-interest (ROI) morphometric investigations. This has lead to confounded interpretation of results and inconsistent findings across a number of studies and in a variety of clinical populations. In this paper, we present a reliable method for parcellating the dorsal, ventral, and subcallosal ACC and PaC that accounts for individual variation in the local cortical folding pattern. We also investigated the effect of one well characterized morphological variation, the incidence of the paracingulate sulcus (PCS), on regional volumes in 24 (12 male, 12 female) healthy participants. The presence of a PCS was shown to affect both ACC and PaC volumes, such that it was associated with an 88% increase in paracingulate cortex and a concomitant 39% decrease in cingulate cortex. These findings illustrate the potential confounds inherent in morphometric approaches that ignore or attempt to minimize inter-individual variations in sulcal and gyral anatomy and underscore the need to consider this variability when attempting to understand disease processes or characterize brain structure-function relationships.	anatomic structures;brain;cingulate cortex;heart rate variability;incidence matrix;inter-rater reliability;mental disorders;morphometric analysis;morphometrics;pancoast tumor;photon correlation spectroscopy;population;region of interest;spatial variability;dinoflagellate sulcus	Alex Fornito;Sarah Whittle;Stephen J. Wood;Dennis Velakoulis;Christos Pantelis;Murat Yücel	2006	NeuroImage	10.1016/j.neuroimage.2006.06.061	psychology;neuroscience;developmental psychology;radiology;medicine;magnetic resonance imaging;cortex;anatomy;region of interest	ML	20.28659947987926	-79.56885144437113	186825
cb4aca206cb1f7edf83cbe8548f515648c796eae	kernel-based analysis of functional brain connectivity on grassmann manifold		Functional Magnetic Resonance Imaging (fMRI) is widely adopted to measure brain activity, aiming at studying brain functions both in healthy and pathological subjects. Discrimination and identification of functional alterations in the connectivity, characterizing mental disorders, are getting increasing attention in neuroscience community.	kernel (operating system);manifold integration	Luca Dodero;Fabio Sambataro;Vittorio Murino;Diego Sona	2015		10.1007/978-3-319-24574-4_72	grassmannian;pattern recognition;artificial intelligence;computer science;kernel (linear algebra);autism;brain activity and meditation;functional magnetic resonance imaging	Vision	23.487365727957723	-78.57163691024235	187150
345aa66bc7d0f728a11878f933957742553847f4	default network and intelligence difference	graph theory;brain;temporal lobe;functional integration;cerebellar tonsils;resting state;intelligent networks humans artificial intelligence neuroscience graph theory temporal lobe intelligent sensors automation hospitals alzheimer s disease;hospitals;brain regions;neuroscience;topological properties;average intelligence group;intelligence difference;default network;medial temporal lobes;functional connectivity;neurophysiology brain;average intelligence group default network intelligence difference undirected weighted graph graph theory intelligence levels posterior cingulate cortex brain regions medial temporal lobes cerebellar tonsils global efficiency superior intelligence group;medial temporal lobe;intelligence levels;alzheimer s disease;superior intelligence group;artificial intelligence;global efficiency;humans;intelligent networks;weighted graph;neurophysiology;posterior cingulate cortex;intelligent sensors;undirected weighted graph;automation	In the last few years, many studies in the cognitive and system neuroscience found that a consistent network of brain regions, referred to as the default network, showed high levels of activity when no explicit task was performed. Some scientists believed that the resting state activity might reflect some neural functions that consolidate the past, stabilize brain ensembles, and prepare us for the future. Here, we modeled the default network as undirected weighted graph, and then used graph theory to investigate the topological properties of the default network of the two groups of people with different intelligence levels. We found that, in both groups, the posterior cingulate cortex showed the greatest degree in comparison to the other brain regions in the default network, and that the medial temporal lobes and cerebellar tonsils were topologically separations from the other brain regions in the default network. More importantly, we found that the strength of some functional connectivities and the global efficiency of the default network were significantly different between the superior intelligence group and the average intelligence group, which indicates that the functional integration of the default network might be related to the individual intelligent performance.	cerebellum;cingulate cortex;default;functional integration;graph (discrete mathematics);graph - visual representation;graph theory;medial graph;neuroscience discipline;rest;resting state fmri;temporal lobe;tonsil	Ming Song;Yong Liu;Yuan Zhou;Kun Wang;Chunshui Yu;Tianzi Jiang	2009	2009 Annual International Conference of the IEEE Engineering in Medicine and Biology Society	10.1109/IEMBS.2009.5334874	psychology;default mode network;intelligent network;neuroscience;artificial intelligence;graph theory;automation;machine learning;neurophysiology;resting state fmri;functional integration;intelligent sensor;task-positive network	AI	21.164624052963422	-78.16191455689761	188111
