id	title	keywords	abstract	entities	authors	year	journal	doi	fos	area	x	y	ix
2df65c0e58b12f86f1a6f4b3ee0accdad1ce0f30	regional homogeneity of intrinsic brain activity correlates with auditory-motor processing of vocal pitch errors	auditory feedback;auditory-vocal integration;intrinsic brain activity;regional homogeneity;resting-state fmri	It has been well documented that speakers produce rapid compensatory vocal adjustments for errors they perceive in their auditory feedback. The fact that they differ greatly in the degree to which they compensate for perceived errors, however, has received much less attention. The present study investigated whether intrinsic brain activity during resting can predict an individual's behavioral and cortical responses in compensating for pitch-shifted auditory feedback during vocalization. This relationship was investigated by correlating the regional homogeneity (ReHo) of resting-state fMRI signals with the vocal compensation and event-related potentials (N1 and P2) in response to pitch shifts of -200 and -500 cents. Behaviorally, the magnitudes of vocal compensation were significantly correlated with the ReHo values in the right supplementary motor area (SMA) for both -200 and -500 cents, the right primary motor cortex (M1) for -200 cents, and the left premotor cortex (PMC) for -500 cents. For both pitch shift sizes, there were significant correlations between ReHo and N1 amplitude in the left inferior frontal gyrus (IFG), right superior temporal gyrus (STG), bilateral M1, and left SMA. Significant correlations between ReHo and P2 amplitude were observed in the bilateral IFG, right STG, left SMA and M1 for -200 and -500 cents, the left PMC for -200 cents, and the right SMA for -500 cents. These findings provide the first evidence that regional homogeneity of intrinsic brain activity can predict behavioral and cortical responses in compensating for pitch errors in voice auditory feedback.	bilateral filter;cerebral cortex;crohn disease;document completion status - documented;erp;electroencephalography;frontal lobe gyrus;ifng gene;ifng wt allele;index;inferior frontal gyrus;natural science disciplines;phenylmercuric chloride;pitch (music);pitch shift;rest;resting state fmri;rheum australe;star trek generations;superior temporal gyrus;usp9x gene;vocal cord paralysis;vocal cord structure;auditory feedback;funding grant;mesial premotor cortex;primary motor cortex	Zhiqiang Guo;Xiyan Huang;Meng Wang;Jeffery A. Jones;Zhengjia Dai;Weifeng Li;Peng Liu;Hanjun Liu	2016	NeuroImage	10.1016/j.neuroimage.2016.08.005	psychology;speech recognition;developmental psychology;communication	ML	17.611886067462613	-79.51067598908979	192505
39186ffc9b83df79c7291a2095547d8086ac2e23	timing and expectation of reward: a neuro-computational model of the afferents to the ventral tegmental area	basal ganglia;health research;uk clinical guidelines;biological patents;vta;europe pubmed central;citation search;uk phd theses thesis;life sciences;classical conditioning;amygdala;dopamine;uk research reports;medical journals;europe pmc;biomedical research;bioinformatics;timing	Neural activity in dopaminergic areas such as the ventral tegmental area is influenced by timing processes, in particular by the temporal expectation of rewards during Pavlovian conditioning. Receipt of a reward at the expected time allows to compute reward-prediction errors which can drive learning in motor or cognitive structures. Reciprocally, dopamine plays an important role in the timing of external events. Several models of the dopaminergic system exist, but the substrate of temporal learning is rather unclear. In this article, we propose a neuro-computational model of the afferent network to the ventral tegmental area, including the lateral hypothalamus, the pedunculopontine nucleus, the amygdala, the ventromedial prefrontal cortex, the ventral basal ganglia (including the nucleus accumbens and the ventral pallidum), as well as the lateral habenula and the rostromedial tegmental nucleus. Based on a plausible connectivity and realistic learning rules, this neuro-computational model reproduces several experimental observations, such as the progressive cancelation of dopaminergic bursts at reward delivery, the appearance of bursts at the onset of reward-predicting cues or the influence of reward magnitude on activity in the amygdala and ventral tegmental area. While associative learning occurs primarily in the amygdala, learning of the temporal relationship between the cue and the associated reward is implemented as a dopamine-modulated coincidence detection mechanism in the nucleus accumbens.	amygdaloid structure;average-case complexity;basal (phylogenetics);basal ganglia;cell nucleus;computation (action);computational model;conditioning (psychology);conditioning, classical;dopamine hydrochloride;globus pallidus;habenula;hypothalamic area, lateral;hypothalamic structure;lateral thinking;modulation;nucleus accumbens;onset (audio);pedunculopontine tegmental nucleus;prefrontal cortex;rewards;rule (guideline);temporal logic;ventral tegmental area	Julien Vitay;Fred Henrik Hamker	2014		10.3389/fnbot.2014.00004	psychology;cognitive psychology;classical conditioning;olfactory tubercle;dopamine;neuroscience;developmental psychology;bioinformatics;brain stimulation reward;reward system	ML	17.99145952537218	-73.18786742621221	192920
33eedc42dee6e9606d0148d4e84b89dbf07d3f43	scoring sequences of hippocampal activity using hidden markov models	measurement;hidden markov models;trajectory;neurons;correlation;context modeling;data models	We propose a novel sequence score to determine to what extent neural activity is consistent with trajectories through latent ensemble states - virtual place fields - in an associated environment. In particular, we show how hidden Markov models (HMMs) can be used to model and analyze sequences of neural activity, and how the resulting joint probability of an observation sequence and an underlying sequence of states naturally lead to the development of a two component sequence score in which the sequential and contextual information are decoupled. We also show how this score can discriminate between true and shuffled sequences of hippocampal neural activity.	hidden markov model;markov chain;neural oscillation;refinement (computing);replay attack	Etienne R. Ackermann;Caleb Kemere	2016	2016 38th Annual International Conference of the IEEE Engineering in Medicine and Biology Society (EMBC)	10.1109/EMBC.2016.7590860	data modeling;computer science;trajectory;machine learning;hidden semi-markov model;pattern recognition;mathematics;context model;markov model;correlation;physics;hidden markov model;quantum mechanics;measurement;statistics;variable-order markov model	Vision	21.964105679659767	-73.41212778647021	192971
29e97a900583b0e3d6576cffbe673fa4c3a23ae2	an automated pipeline for constructing personalized virtual brains from multimodal neuroimaging data	connectome;diffusion mri;computational modeling;multimodal imaging;the virtual brain;tractography	Large amounts of multimodal neuroimaging data are acquired every year worldwide. In order to extract high-dimensional information for computational neuroscience applications standardized data fusion and efficient reduction into integrative data structures are required. Such self-consistent multimodal data sets can be used for computational brain modeling to constrain models with individual measurable features of the brain, such as done with The Virtual Brain (TVB). TVB is a simulation platform that uses empirical structural and functional data to build full brain models of individual humans. For convenient model construction, we developed a processing pipeline for structural, functional and diffusion-weighted magnetic resonance imaging (MRI) and optionally electroencephalography (EEG) data. The pipeline combines several state-of-the-art neuroinformatics tools to generate subject-specific cortical and subcortical parcellations, surface-tessellations, structural and functional connectomes, lead field matrices, electrical source activity estimates and region-wise aggregated blood oxygen level dependent (BOLD) functional MRI (fMRI) time-series. The output files of the pipeline can be directly uploaded to TVB to create and simulate individualized large-scale network models that incorporate intra- and intercortical interaction on the basis of cortical surface triangulations and white matter tractograpy. We detail the pitfalls of the individual processing streams and discuss ways of validation. With the pipeline we also introduce novel ways of estimating the transmission strengths of fiber tracts in whole-brain structural connectivity (SC) networks and compare the outcomes of different tractography or parcellation approaches. We tested the functionality of the pipeline on 50 multimodal data sets. In order to quantify the robustness of the connectome extraction part of the pipeline we computed several metrics that quantify its rescan reliability and compared them to other tractography approaches. Together with the pipeline we present several principles to guide future efforts to standardize brain model construction. The code of the pipeline and the fully processed data sets are made available to the public via The Virtual Brain website (thevirtualbrain.org) and via github (https://github.com/BrainModes/TVB-empirical-data-pipeline). Furthermore, the pipeline can be directly used with High Performance Computing (HPC) resources on the Neuroscience Gateway Portal (http://www.nsgportal.org) through a convenient web-interface.	brain neoplasms;computation;computational neuroscience;connectome;data structure;diffusion weighted imaging;electroencephalography phase synchronization;estimated;magnetic resonance imaging;multimodal interaction;neuroimaging;neuroinformatics;personalization;simulation;time series;tissue fiber;user interface;white matter;blood oxygen level dependent;fmri	Michael Schirner;Simon Rothmeier;Viktor K. Jirsa;Anthony Randal McIntosh;Petra Ritter	2015	NeuroImage	10.1016/j.neuroimage.2015.03.055	psychology;diffusion mri;neuroscience;radiology;computer science;bioinformatics;artificial intelligence;tractography;data mining;connectome;computational model	Visualization	23.702703116795952	-76.98012496211919	194026
b12cd86078b36f3702074ace2a904e0ba3880458	brain network dynamics underlying visuospatial judgment: an fmri connectivity study	parietal cortex;effective connectivity;inferior frontal gyrus;time course;right hemisphere;healthy volunteer;functional imaging;functional connectivity;information flow;specific activity;network dynamics;posterior parietal cortex	Previous functional imaging research has consistently indicated involvement of bilateral fronto-parietal networks during the execution of visuospatial tasks. Studies with TMS have suggested that the right hemispheric network, but not the left, is functionally relevant for visuospatial judgments. However, very little is still known about the interactions within these fronto-parietal networks underlying visuospatial processing. In the current study, we investigated task modulation of functional connectivity (instantaneous correlations of regional time courses), and task-specific effective connectivity (direction of influences), within the right fronto-parietal network activated during visuospatial judgments. Ten healthy volunteers performed a behaviorally controlled visuospatial judgment task (ANGLE) or a control task (COLOR) in an fMRI experiment. Visuospatial task-specific activations were found in posterior parietal cortex (PPC) and middle/inferior frontal gyrus (MFG). Functional connectivity within this network was task-modulated, with significantly higher connectivity between PPC and MFG during ANGLE than during COLOR. Effective connectivity analysis for directed influence revealed that visuospatial task-specific projections within this network were predominantly in a frontal-to-parietal direction. Moreover, ANGLE-specific influences from thalamic nuclei to PPC were identified. Exploratory effective connectivity analysis revealed that closely neighboring clusters, within visuospatial regions, were differentially involved in the network. These neighboring clusters had opposite effective connectivity patterns to other nodes of the fronto-parietal network. Our data thus reveal that visuospatial judgments are supported by massive fronto-parietal backprojections, thalamo-parietal influence, and multiple stages, or loops, of information flow within the visuospatial network. We speculate on possible functional contributions of the various network nodes and informational loops in a neurocognitive model.	bilateral filter;exploratory testing;frontal lobe gyrus;functional imaging;inferior frontal gyrus;information flow (information theory);interaction;judgment (mathematical logic);lateral occipitotemporal gyrus;modulation;parietal lobe;posterior parietal cortex;projection defense mechanism;resting state fmri;spatial–temporal reasoning;thalamic nuclei;thalamic structure;transcranial magnetic stimulation;neurocognitive	Tom A. de Graaf;Alard Roebroeck;Rainer Goebel;Alexander Thomas Sack	2010	Journal of Cognitive Neuroscience	10.1162/jocn.2009.21345	psychology;cognitive psychology;neuroscience;developmental psychology;radiology;posterior parietal cortex;communication	ML	19.58023225744656	-77.59103006387369	194169
b5985e9022fbc13eb3708ddf993add58f28e89cb	bayesian spatiotemporal model of fmri data using transfer functions	block design;mcmc algorithm;hemodynamic response function;fmri;transfer functions;hrf estimation;gaussian markov random field;journal article;transfer function;spatiotemporal model;mcmc;synthetic data;signal to noise ratio;bayesian analysis	This research describes a new Bayesian spatiotemporal model to analyse BOLD fMRI studies. In the temporal dimension, we describe the shape of the hemodynamic response function (HRF) with a transfer function model. The spatial continuity and local homogeneity of the evoked responses are modelled by a Gaussian Markov random field prior on the parameter indicating activations. The proposal constitutes an extension of the spatiotemporal model presented in a previous approach [Quirós, A., Montes Diez, R. and Gamerman, D., 2010. Bayesian spatiotemporal model of fMRI data, Neuroimage, 49: 442-456], offering more flexibility in the estimation of the HRF and computational advantages in the resulting MCMC algorithm. Simulations from the model are performed in order to ascertain the performance of the sampling scheme and the ability of the posterior to estimate model parameters, as well as to check the model sensitivity to signal to noise ratio. Results are shown on synthetic data and on a real data set from a block-design fMRI experiment.	algorithm;computer simulation;forty nine;frequency response;function model;hemodynamics;markov chain monte carlo;markov random field;normal statistical distribution;population parameter;sampling (signal processing);scott continuity;signal-to-noise ratio;synthetic data;transfer function;fmri	Alicia Quirós Carretero;Raquel Montes Diez;Simon P. Wilson	2010	NeuroImage	10.1016/j.neuroimage.2009.12.085	econometrics;computer science;machine learning;transfer function;statistics	ML	24.124422838319486	-75.86707252412045	194783
0b18c066ce4db9c6b3ddc45655ee4867b17f2e6c	impact of acoustic coordinated reset neuromodulation on effective connectivity in a neural network of phantom sound	juser;public records;websearch;refs	Chronic subjective tinnitus is an auditory phantom phenomenon characterized by abnormal neuronal synchrony in the central auditory system. As recently shown in a proof of concept clinical trial, acoustic coordinated reset (CR) neuromodulation causes a significant relief of tinnitus symptoms combined with a significant decrease of pathological oscillatory activity in a network comprising auditory and non-auditory brain areas. The objective of the present study was to analyze whether CR therapy caused an alteration of the effective connectivity in a tinnitus related network of localized EEG brain sources. To determine which connections matter, in a first step, we considered a larger network of brain sources previously associated with tinnitus. To that network we applied a data-driven approach, combining empirical mode decomposition and partial directed coherence analysis, in patients with bilateral tinnitus before and after 12 weeks of CR therapy as well as in healthy controls. To increase the signal-to-noise ratio, we focused on the good responders, classified by a reliable-change-index (RCI). Prior to CR therapy and compared to the healthy controls, the good responders showed a significantly increased connectivity between the left primary cortex auditory cortex and the posterior cingulate cortex in the gamma and delta bands together with a significantly decreased effective connectivity between the right primary auditory cortex and the dorsolateral prefrontal cortex in the alpha band. Intriguingly, after 12 weeks of CR therapy most of the pathological interactions were gone, so that the connectivity patterns of good responders and healthy controls became statistically indistinguishable. In addition, we used dynamic causal modeling (DCM) to examine the types of interactions which were altered by CR therapy. Our DCM results show that CR therapy specifically counteracted the imbalance of excitation and inhibition. CR significantly weakened the excitatory connection between posterior cingulate cortex and primary auditory cortex and significantly strengthened inhibitory connections between auditory cortices and the dorsolateral prefrontal cortex. The overall impact of CR therapy on the entire tinnitus-related network showed up as a qualitative transformation of its spectral response, in terms of a drastic change of the shape of its averaged transfer function. Based on our findings we hypothesize that CR therapy restores a silence based cognitive auditory comparator function of the posterior cingulate cortex.	acoustic cryptanalysis;artificial neural network;auditory area;auditory processing disorder;bands;bilateral filter;biological neural networks;cns disorder;causal filter;cerebral cortex;cingulate cortex;classification;comparator device component;dicom;electroencephalography;excitation;hearing problem;hilbert–huang transform;interaction;large;neuromodulation (medicine);patients;phantom reference;phantoms, imaging;prefrontal cortex;signal-to-noise ratio;transfer function	Alexander N. Silchenko;Ilya Adamchic;Christian Hauptmann;Peter A. Tass	2013	NeuroImage	10.1016/j.neuroimage.2013.03.013	psychology;public records;neuroscience;developmental psychology;communication	ML	18.76340975875441	-78.80530328661216	194980
56b7d3f836b4555ce8cb348ab1d4ed3cd600a1a4	bold signal estimation based on dual particle filter	sufficient statistic;functional magnetic resonance imaging;probability biomedical mri blood filters medical signal processing neurophysiology phantoms;linearization based technique;probability;phantoms;probability density function;blood oxygen level dependent;phantom data;kalman filters;filters;linear approximation;stochastic differential equation;prior knowledge;data mining;state estimation;neuronal activity induced changes;human subjects;estimation;hidden physiological states;particle filter;functional magnetic resonance images;beta distribution;blood;dual particle filter;blood flow;neurophysiology;parameter estimation;particle filters;particle filters state estimation magnetic resonance imaging blood discrete time systems stochastic systems differential equations linear approximation nonlinear dynamical systems parametric statistics;bold signal estimation;degeneracy phenomena;medical signal processing;neuronal activity;neuronal activity induced changes bold signal estimation blood oxygenation level dependent dual particle filter hidden physiological states degeneracy phenomena beta distribution parametric posteriori probability density function phantom data human subjects linearization based technique functional magnetic resonance imaging;blood oxygenation level dependent;discrete time system;parametric posteriori probability density function;data models;biomedical mri	Functional magnetic resonance imaging (fMRI) methods measure neuronal activity-induced changes indirectly by the blood oxygenation level dependent (BOLD) effect. The most comprehensive model to date of the BOLD signal is formulated as a mixed continuous discrete time system of nonlinear stochastic differential equations. Previous approaches have been based on linear approximations of the dynamics, which are limited in their ability to capture the inherent nonlinearities in the physiological system. A dual particle filter is proposed to simultaneous estimate the hidden physiological states and the system parameters in this paper, the sufficient statistics is adopted to deal with sampling degeneracy phenomena and the beta distribution which makes good use of prior knowledge as well as avoids tail draws for the parameter is used to fit the parametric posteriori probability density function. This approach applied to phantom data and human subjects. The results showed that state estimates via simulation are accurate, robust and efficient in comparison to linearization-based technique and physiologically reasonable parameter estimates are generated for experimental fMRI data. Keywords-fMRI; BOLD; signal estimation; particle filter	algorithm;approximation;biological system;degeneracy (graph theory);discrete system;nonlinear system;particle filter;phantom reference;resonance;sampling (signal processing);simulation	Sen Liu;Jiexin Pu;Hongyi Zhang;Lu Zhao	2009	2009 2nd International Conference on Biomedical Engineering and Informatics	10.1109/BMEI.2009.5305505	adaptive filter;monte carlo localization;mathematical optimization;invariant extended kalman filter;ensemble kalman filter;kernel adaptive filter;particle filter;auxiliary particle filter;filtering problem;control theory;mathematics;extended kalman filter;moving horizon estimation;filter design;neurophysiology;statistics;alpha beta filter	ML	21.312758194479624	-73.49272378539119	195452
ec6364549bbc4af5adcafaecec7d1199ee201de9	are glutamate and lactate increases ubiquitous to physiological activation? a <ce:sup loc=pre>1</ce:sup>h functional mr spectroscopy study during motor activation in human brain at 7<ce:hsp sp=0.25></ce:hsp>tesla	motor stimulation;serveur institutionnel;h 1 mr spectroscopy;oxidative metabolism;lactate;archive institutionnelle;open access;archive ouverte unige;cybertheses;cibm ait;institutional repository;cerebral metabolic rate	Recent studies at high field (7Tesla) have reported small metabolite changes, in particular lactate and glutamate (below 0.3μmol/g) during visual stimulation. These studies have been limited to the visual cortex because of its high energy metabolism and good magnetic resonance spectroscopy (MRS) sensitivity using surface coil. The aim of this study was to extend functional MRS (fMRS) to investigate for the first time the metabolite changes during motor activation at 7T. Small but sustained increases in lactate (0.17μmol/g±0.05μmol/g, p<0.001) and glutamate (0.17μmol/g±0.09μmol/g, p<0.005) were detected during motor activation followed by a return to the baseline after the end of activation. The present study demonstrates that increases in lactate and glutamate during motor stimulation are small, but similar to those observed during visual stimulation. From the observed glutamate and lactate increase, we inferred that these metabolite changes may be a general manifestation of the increased neuronal activity. In addition, we propose that the measured metabolite concentration increases imply an increase in ΔCMRO2 that is transiently below that of ΔCMRGlc during the first 1 to 2min of the stimulation.	baseline (configuration management);cerebral cortex;coil device component;glutamic acid;heat shock proteins;inference;lactic acid;magnetic resonance spectroscopy;minimal recursion semantics;photic stimulation;snap25 protein, human;snap25 wt allele;tesla - unit	Benoît Schaller;Lijing Xin;Kieran O'Brien;Arthur W. Magill;Rolf Gruetter	2014	NeuroImage	10.1016/j.neuroimage.2014.02.016	neuroscience	HCI	20.422560936953605	-78.9643202309424	196805
