id	title	keywords	abstract	entities	authors	year	journal	doi	fos	area	x	y	ix
98d6dd16d516bd73e7da57831e2622e67a972080	phi1-concavity and fuzzy multiple objective decision making	concavity;fuzzy set;multiple objective optimization;φ 1 concavity;fuzzy multiobjective optimization;multiple objectives;multiobjective optimization;fuzzy decision making;fuzzy optimization;convex combination	Concave properties play a dominate role in solving both classic and fuzzy optimization problems. However, since fuzzy problems are generally represented by sets, not crisp numbers, various aggregation schemes are needed to manipulate and to combine the different elements in a fuzzy optimization problem. Based on these different aggregations, various concavity properties can be formulated and explored. In this paper, the intersection aggregation and the convex combination aggregation are explored based on the supp-Φ1-concave fuzzy sets. First, the concept of Φ1-convexity, which covers a wider class of sets and functions, is extended to fuzzy sets. Supp-Φ1-concave and supp-Φ1-quasiconcave fuzzy sets are then introduced; and some useful aggregation and composition rules are developed. Based on these aggregation and composition rules and the generalized concave properties, fuzzy multiple objective decision making problems are formulated and the conditions to ensure local–global maximum property are discussed. c © 2007 Elsevier Ltd. All rights reserved.	concave function;fuzzy set;mathematical optimization;maxima and minima;optimization problem	Yu-Ru Syau;Lixing Jia;E. Stanley Lee	2008	Computers & Mathematics with Applications	10.1016/j.camwa.2007.06.013	fuzzy logic;mathematical optimization;combinatorics;discrete mathematics;convex combination;membership function;defuzzification;adaptive neuro fuzzy inference system;fuzzy transportation;type-2 fuzzy sets and systems;fuzzy mathematics;fuzzy classification;fuzzy number;neuro-fuzzy;multi-objective optimization;fuzzy measure theory;mathematics;fuzzy set;fuzzy associative matrix;fuzzy set operations	AI	-1.1455899388981556	-18.569227501936656	187585
02843d463e94c7b2f7bb4abd9874cb74b60fd1d1	picture uncertain linguistic aggregation operators and their application to multiple attribute decision making		In this paper, we investigate the multiple attribute decision making problems with picture uncertain linguistic information. Then, we utilize arithmetic and geometric operations to develop some picture uncertain linguistic aggregation operators: picture uncertain linguistic weighted average (PULWA) operator, picture uncertain linguistic weighted geometric (PULWG) operator, picture uncertain linguistic ordered weighted average (PULOWA) operator, picture uncertain linguistic ordered weighted geometric (PULOWG) operator, picture uncertain linguistic hybrid average (PULHA) operator and picture uncertain linguistic hybrid geometric (PULHG) operator. The prominent characteristic of these proposed operators are studied. Then, we have utilized these operators to develop some approaches to solve the picture uncertain linguistic multiple attribute decision making problems. Finally, a practical example for micro-credit risk evaluation of micro-credit companies is given to verify the developed approach and to demonstrate its practicality and effectiveness.		Sheng-Jun Wu;Gui-Wu Wei	2017	KES Journal	10.3233/KES-170368	computer science;artificial intelligence;operator (computer programming);machine learning	AI	-2.7661166296064743	-21.413885793224946	188049
eaf1eac3a0181526fd3fc446282014b61f7440d7	centroid of triangular and gaussian type-2 fuzzy sets	centroid;gaussian;triangular;type 2 fuzzy set;general type reduction	In this paper, we present exact computation procedures for the centroid of type-2 fuzzy sets with either triangular or Gaussian secondary membership functions. We assume the standard formulation of the centroid based on the sup-min extension principle. The centroid of a triangular type-2 fuzzy set can be considered as a subsequent analytical extension of the KM type-reduction procedure dedicated to interval type-2 sets. The centroid of a Gaussian type-2 fuzzy set is recursively expressed by an independent procedure. 2014 Published by Elsevier Inc. 30	computation;fuzzy set;maxima and minima;recursion;type-2 fuzzy sets and systems	Janusz T. Starczewski	2014	Inf. Sci.	10.1016/j.ins.2014.05.004	mathematical optimization;mathematical analysis;discrete mathematics;centroid;defuzzification;fuzzy classification;fuzzy number;mathematics;gaussian;fuzzy set	AI	-0.4380596259126526	-21.562170475260945	188616
9db2e595d287f4c1ad6a930fae5aedc308909e2c	polyhedral representation of fuzzy linear bases	linear interpolation	In [15], we introduced the concepts of fuzzy bases, fuzzy linear interpolation and fuzzy polygon of four-component fuzzy linear bases. In [16], these concepts were used in the maximal profile of the set of polygons generated from a set of break points for each variable dimension. Theconcept was operationalized in a fuzzy linear basis algorithm (FLBA) for nonlinear separable programming problems involving no more than a finite number of discontinuities. The FLBA provides a powerful platform forparallel processing of the fuzzy linear sub-problems included in the finite FLB-chain. In this paper we extend the theory of fuzzy linear bases from the set of polygons toapolyhedral representation of four-component fuzzy linear bases defined on a closed subset of the real line.	polyhedral	Pei-Zhuang Wang;Ralf Östermark;Rajan Alex;Shaohua Tan	2001	Soft Comput.	10.1007/s005000100083	fuzzy logic;mathematical optimization;combinatorics;discrete mathematics;membership function;defuzzification;fuzzy mathematics;fuzzy classification;computer science;fuzzy subalgebra;fuzzy number;fuzzy measure theory;mathematics;fuzzy set;fuzzy associative matrix;linear interpolation;fuzzy set operations	NLP	-0.6264887818735024	-23.903430419795953	188717
41fe2dcc7dcf5d55bf827ee36da2bffdb77549ea	approaches to multiple attribute decision making based on the correlation coefficient with dual hesitant fuzzy information	multiple attribute decision making;incomplete weight;correlation coefficient;dual hesitant fuzzy sets;metal materials	In this paper, we investigate the multiple attribute decision making problems with dual hesitant fuzzy information, in which the information about attribute weights is incompletely known, and the attribute values take the form of dual hesitant fuzzy values. We first introduce some approaches to obtaining the weight information of attributes, and then establish an optimization model based on the positive ideal point of attribute values, by which the attribute weights can be determined. For the special situations where the information about attribute weights is completely unknown, we establish another optimization model. By solving this model, we get a simple and exact formula, which can be used to determine the attribute weights. We compute the correlation coefficient between each alternative and positive ideal alternative, and then rank the alternatives by means of the correlation coefficient between each alternative and positive ideal alternative. Finally, we shall present a numerical example to show the pattern recognition problems about the classification of metal materials with dual hesitant fuzzy information in order to illustrate the method proposed in this paper.	coefficient	Yuanfang Chen;Xiaodong Peng;Guohua Guan;Huade Jiang	2014	Journal of Intelligent and Fuzzy Systems	10.3233/IFS-130926	variable and attribute;attribute domain;artificial intelligence;machine learning;data mining;mathematics	AI	-2.5732598359191883	-20.014310097106932	188935
64bf927938095ed18a15677d6ed6d6f463fa1120	multiple attribute group decision making based on interval neutrosophic uncertain linguistic variables		To deal with decision-making problems with interval neutrosophic uncertain linguistic information, the paper proposes a multiple attribute group decision-making method under an interval neutrosophic uncertain linguistic environment. Firstly, the concept of an interval neutrosophic uncertain linguistic set and an interval neutrosophic uncertain linguistic variable (INULV) is presented by combining an uncertain linguistic variable with an interval neutrosophic set. Secondly, we introduce the operation rules of INULVs and the score function, accuracy function and certainty function of an INULV. Thirdly, we develop an interval neutrosophic uncertain linguistic weighted arithmetic averaging (INULWAA) operator and an interval neutrosophic uncertain linguistic weighted geometric averaging (INULWGA) operator and investigate their properties. Fourthly, a group decision-making method is established based on the INULWAA and INULWGA operators to solve multiple attribute group decision-making problems with interval neutrosophic uncertain linguistic information. Finally, an illustrative example is provided to demonstrate the application of the developed approach.	indeterminacy in concurrent computation;interval arithmetic	Jun Ye	2017	Int. J. Machine Learning & Cybernetics	10.1007/s13042-015-0382-1	discrete mathematics;machine learning;pattern recognition;mathematics	AI	-2.6830999755055336	-21.05224035900981	189299
af61856cb51c66425f931eaf49c8b3216d885ff2	discrete labels and rich foci in theory of evidence	finite element methods;theory of evidence;belief functions theory;probability;belief function theory;discrete sets;lattices;linguistic labels discrete labels evidence theory rich foci combination operators focal elements algebraic structures;rich foci;evidence theory;linguistic labels belief functions theory algebra discrete sets;case based reasoning algebra;algebra;discrete labels;calculus;focal elements;humans;linguistic labels;case based reasoning;lattices finite element methods algebra humans probability equations calculus;algebraic structures;combination operators	Evidence theory allows to build a large family of combination operators, based mostly on intersections and unions between the focal elements expressed by the experts, and multiplications and additions on the masses affected to these focal elements. We explore algebraic structures where these operators behave differently, masses being linguistic labels, or focal elements being more, or less, than an union of singletons of a discernment space. In some cases, we have to forget this space and the notion of singleton to place ourselves in the space of possible focal elements. We propose three new structures for linguistic labels, replacing masses. We show how to adapt the theory of evidence to six constrained spaces for the focal elements expressed by the experts.	focal (programming language);fuzzy set;linear algebra;theory	Christophe Osswald;Arnaud Martin	2008	2008 11th International Conference on Information Fusion		discrete mathematics;mathematics;algebra	DB	2.3969741901292685	-21.225650535065373	189503
8b6ad4b25793f2dbe3ef4a1a4e76cb8c1182673e	on appropriate selection of fuzzy aggregation operators in medical decision support system		The Decision Support System (DSS) contains more than one antecedent and the degrees of strength of the antecedents need to be combined to determine the overall strength of the rule consequent. The membership values of the linguistic variables in Fuzzy have to be combined using an aggregation operator. But it is not feasible to predefine the form of aggregation operators in decision-making. Instead, each rule should be found based on the feeling of the experts and on their actual decision pattern over the set of typical examples. Thus this work illustrates how the choice of aggregation operators is intended to mimic human decision making and can be selected and adjusted to fit empirical data – a series of test cases. Both parametrized and non-parametrized aggregation operators are adapted to fit empirical data. Moreover, they provided compensatory properties and, therefore, seemed to produce a better decision support system. To solve the problem, a threshold point from the output of the aggregation operators is chosen as the separation point between two classes. The bestachieved accuracy is chosen as the appropriate aggregation operator. Thus a medical decision can be generated, which is very close to a practitioner’s guideline.	decision support system	K. M. Motahar Hossain;Zahir Raihan;M. M. A. Hashem	2005	CoRR		optimal decision;artificial intelligence;machine learning;data mining;decision rule;mathematics	AI	-4.346980394893425	-18.770342326774443	190351
bb73ed9d123e93b6a64e97b1b45b6c88fb3e23be	the wowa operator and the interpolation function w*: chen and otto's interpolation method revisited	aggregation function;wowa operator;interpolation method;membership functions;membership function;owa operator	The WOWA operator, a combination function that generalizes both the weighted mean and the OWA operator, is based on a interpolation function to calculate a new set of weights from two initial sets of weights. In this paper we study a variation of Chen and Otto interpolation method that is adequate to the WOWA operator. We report several errors that appear in that article and introduce some new limit conditions that fit our requirements.	entity–relationship model;interpolation;requirement	Vicenç Torra	2000	Fuzzy Sets and Systems	10.1016/S0165-0114(98)00040-2	mathematical optimization;mathematical analysis;discrete mathematics;bilinear interpolation;membership function;interpolation;computer science;artificial intelligence;mathematics	ML	-0.871688065681883	-21.64074840130929	190520
07b927886a604902a801a7faf847c34f2f97d3a1	fuzzy argumentation system for decision support		We introduce in this paper a quantitative preference based argumentation system relying on ASPIC argumentation framework and fuzzy set theory. The knowledge base is fuzzified to allow the experts to express their expertise (premises and rules) attached with grades of importance in the unit interval. Arguments are attached with a score aggregating the importance expressed on their premises and rules. Extensions are then computed and the strength of each of which can also be obtained based on its strong arguments. The strengths are used to rank fuzzy extensions from the strongest to the weakest one, upon which decisions can be made. The approach is finally used for decision making in a real world application within the EcoBioCap project.	argumentation framework;computation;fuzzy logic;fuzzy set;knowledge base;quantifier (logic);set theory;t-norm	Nouredine Tamani;Madalina Croitoru	2014		10.1007/978-3-319-08795-5_9	artificial intelligence;data mining;mathematics;algorithm	AI	-3.132190538795663	-22.136193068957702	190784
880ba41b460ddf06e767c0506ab9f6653bde92f2	on some extensions for s-decomposable fuzzy measures	data mining open wireless architecture data acquisition knowledge representation fuzzy sets;fuzzy measure;integral equations;fuzzy integral;fuzzy set theory;identification;fuzzy set theory fuzzy integrals choquet integrals sugeno integrals fuzzy measure identification;integral equations identification fuzzy set theory;sugeno integral	"""Practical applications of fuzzy integrals (Choquet and Sugeno integrals) require the definition of a fuuy measure. However, when they-are defined in -a -domaitt@n-elements, this definition requires 2"""" parameters. To avoid this large number of parameters, several families of measures have been introduced in the literature. In this work we present a new family that generalises some fuzzy measures but restricted so that the number of parameters is not large."""	fuzzy measure theory;sugeno integral	Vicenç Torra	2001		10.1109/FUZZ.2001.1009072	fuzzy logic;identification;mathematical optimization;mathematical analysis;discrete mathematics;membership function;defuzzification;adaptive neuro fuzzy inference system;type-2 fuzzy sets and systems;fuzzy mathematics;fuzzy classification;computer science;fuzzy subalgebra;fuzzy number;neuro-fuzzy;fuzzy measure theory;mathematics;fuzzy set;fuzzy associative matrix;fuzzy set operations;integral equation;fuzzy control system	ML	-0.6182482853083466	-23.2132579868427	190885
6cdeef09bfe22dc5e81a7daa6deafd207c411982	performance and behavior analysis of repairable industrial systems using vague lambda-tau methodology	industrial system;reliability;ram index;lambda tau methodology;vague set theory;uncertain data	To remain competitive and to provide timely and accurate services, the decision maker or system analyst view the reliability and maintainability issues as a part of corporate quest to improve quality of the products/processes and services delivered. But the collected or available data available from the historical records are mostly uncertain, limited and imprecise in nature. Thus in such situation(s), it is difficult, if not impossible, to analyze the behavior and performance of the system up to desired degree of accuracy. Thus attempt has been made by the author for analyzing the behavior and performance of the system using Vague Lambda–Tau methodology. Intuitionistic fuzzy set theory has been used for representing the classical(crisp) data into triangular fuzzy numbers because intuitionistic sets are characterized by a truth membership function and false membership functions (non-membership functions) so that sum of both values is less than 1. Sensitivity analysis has also been performed and the effects on system mean time between failures are addressed. The performance analysis of the system has been investigated through a composite measure of reliability, availability and maintainability (RAM) called RAM-Index which explore the effect of failure/repair rates on system performance. Based on their performance, the most critical component of the system has been investigated. The methodology improves the shortcomings of the existing probabilistic approaches and gives a better understanding of the system behavior through its graphical representation. The pulping unit of a paper mill situated in a northern part of India, producing approximately 200 ton of paper per day, has been considered to demonstrate the proposed approach. The results obtained by proposed approach are compared with the existing fuzzy Lambda–Tau and the crisp methodologies. 36 37 38 39 40 41 42 43 44 45 46 47 . Introduction It is well known that the conventional reliability analysis using robabilities has been found to be inadequate to handle uncertainty f failure data and modeling. This is mainly due to the fact that hey required the large amount of data for analysis, which are difcult to obtain from various resources. If somehow they can be ollected then they have a high sort of uncertainty and hence if the ata are used as such in the calculations then the results may be ighly uncertain. Thus, the probabilistic approach to the convenional reliability analysis is inadequate to account for such built-in ncertainties in the data. This problem was overcome by using the Please cite this article in press as: H. Garg, Performance and behavior a methodology, Appl. Soft Comput. J. (2014), http://dx.doi.org/10.1016/ otion of the fuzzy set introduced by Zadeh in 1965 [1] in the evalation of the reliability of a system. Using the fuzzy set theoretic pproach [2] introduced the fuzzy state assumption and possibility ∗ Tel.: +91 8699031147. E-mail address: harishg58@gmail.com URL: http://sites.google.com/site/harishg58iitr/. ttp://dx.doi.org/10.1016/j.asoc.2014.05.027 568-4946/© 2014 Published by Elsevier B.V. 48 49 50 51 © 2014 Published by Elsevier B.V. assumption to give Profust and Possbist. Singer [3] presented fuzzy set theoretic approach to fault tree analysis. Chen [4] used the arithmetic of fuzzy numbers to evaluate system reliability. The concept of fuzzy set theory and fuzzy arithmetic has been used in the evaluation of the reliability of the system by the various researchers [5–8,4,9,10]. The applications of handling the uncertainties using linguistic preferences in supply chain management are addressed by the authors given in Tseng [11], Tseng and Chiu [12], Tseng et al.[13] In fuzzy set theory, the degree of belonging of element to the set is represented by a membership value in the real interval [0, 1] and there exists degree of non-membership which is complementary in nature. From latter point of view, it is true and acceptable that grade of membership and non-membership are complementary. But in real life situation, it is assumed that a certain object may or may not be in a set A to a certain degree, but it is possible to enternalysis of repairable industrialsystems using Vague Lambda–Tau j.asoc.2014.05.027 tain some doubt about it. In other words, some hesitation about the degree of belongingness exists. This hesitation in the membership degree may be modeled by intuitionistic fuzzy sets (IFS) defined by Attanassov [14] and has been found to be well suited for dealing 52 53 54 55	canonical account;entity–relationship model;fault tree analysis;fuzzy number;fuzzy set;graphical user interface;mean time between failures;random-access memory;real life;set theory;situated;vagueness	Harish Garg	2014	Appl. Soft Comput.	10.1016/j.asoc.2014.05.027	mathematical optimization;artificial intelligence;machine learning;data mining;reliability;mathematics;statistics	Robotics	0.5019182556302165	-18.948707068185378	190994
4507eaa73de30c9303ab7454b91c2e10ea1165eb	interactive decision making for fuzzy random multiobjective linear programming problems with variance-covariance matrices through probability maximization	interactive decision making method d p pareto optimal solution set convex programming technique bisection method integrated membership space fuzzy decision membership functions distribution functions permissible objective levels fuzzy goals decision maker probability maximization variance covariance matrices fuzzy random multiobjective linear programming problems;random processes convex programming covariance matrices decision making fuzzy set theory linear programming pareto optimisation probability	In this paper, we focus on fuzzy random multiobjective linear programming problems with variance-covariance matrices through probability maximization, and propose an interactive decision making method to obtain a satisfactory solution. In the proposed method, it is assumed that the decision maker has fuzzy goals for not only permissible objective levels but also the corresponding distribution functions. Such fuzzy goals are quantified by eliciting the corresponding membership functions. Using the fuzzy decision, such two kinds of membership functions are integrated, and Dp-Pareto optimal solution concept is defined in the integrated membership space. By using the bisection method and the convex programming technique, the satisfactory solution is obtained from among a Dp-Pareto optimal solution set through the interaction with the decision maker.	bisection method;convex optimization;expectation–maximization algorithm;fuzzy logic;fuzzy set;linear programming;membership function (mathematics);pareto efficiency	Hitoshi Yano	2012	The 6th International Conference on Soft Computing and Intelligent Systems, and The 13th International Symposium on Advanced Intelligence Systems	10.1109/SCIS-ISIS.2012.6504996	mathematical optimization;discrete mathematics;optimal decision;membership function;defuzzification;type-2 fuzzy sets and systems;fuzzy mathematics;fuzzy classification;computer science;fuzzy number;machine learning;linear partial information;goal programming;mathematics;fuzzy set;fuzzy set operations	Robotics	-1.2277815610552152	-18.17639485340182	191037
64d85d2472d161c963c5ee0a8365593b98d01466	precise past - fuzzy future		This paper examines the motivation and foundations of fuzzy sets theory, now some 20 years old, particularly possible misconceptions about possible operators and relations to probability theory. It presents a standard uncertainty logic (SUI.) that subsumes standard propositional, fuzzy and probability logics, and shows how many key results may be derived within SUL without further constraints. These include resolutions of standard paradoxes such as those of the bald man and of the barber, decision rules used in pattern recognition and control, the derivation of numeric truth values from the axiomatic form of the SUL, and the derivation of operators such as the arithmetic mean. The addition of the constraint of truth-functionality to a SUL is shown to give fuzzy, or Lukasiewicz infinitely-valued, logic. The addition of the constraint of the law of the excluded middle to a SUL is shown to give probability, or modal $5, logic. An example is given of the use of the two logics in combination to give a possibility vector when modelling sequential behaviour with uncertain observations.	axiomatic system;fuzzy logic;fuzzy set;logical connective;modal logic;pattern recognition;structured systems analysis and design method	Brian R. Gaines	1983	International Journal of Man-Machine Studies	10.1016/S0020-7373(83)80046-7	fuzzy logic;t-norm fuzzy logics;computer science;artificial intelligence;fuzzy number;algorithm;statistics	AI	-2.962886718342678	-23.564344945956428	191216
