id	title	keywords	abstract	entities	authors	year	journal	doi	fos	area	x	y	ix
a61d2777dbb515ce4e3fe1a81fcb44d08aac996f	consensus models for ahp group decision making under row geometric mean prioritization method	analytic hierarchy process;consensus;geometric consistency index;multiplicative preference relations;decision maker;satisfiability;ahp;simulation experiment;indexation;row geometric mean prioritization method;group decision making;geometric mean;social choice theory	The consistency measure is a vital basis for consensus models of group decision making using preference relations, and includes two subproblems: individual consistency measure and consensus measure. In the analytic hierarchy process (AHP), the decision makers express their preferences using judgement matrices (i.e., multiplicative preference relations). Also, the geometric consistency index is suggested to measure the individual consistency of judgement matrices, when using row geometric mean prioritization method (RGMM), one of the most extended AHP prioritization procedures. This paper further defines the consensus indexes to measure consensus degree among judgement matrices (or decision makers) for the AHP group decision making using RGMM. By using Chiclana et al.'s consensus framework, and by extending Xu and Wei's individual consistency improving method, we present two AHP consensus models under RGMM. Simulation experiments show that the proposed two consensus models can improve the consensus indexes of judgement matrices to help AHP decision makers reach consensus. Moreover, our proposal has two desired features: (1) in reaching consensus, the adjusted judgement matrix has a better individual consistency index (i.e., geometric consistency index) than the corresponding original judgement matrix; (2) this proposal satisfies the Pareto principle of social choice theory.		Yucheng Dong;Guiqing Zhang;Wei-Chiang Hong;Yin-Feng Xu	2010	Decision Support Systems	10.1016/j.dss.2010.03.003	analytic hierarchy process;computer science;data mining;management science;welfare economics	ECom	-3.1816620139967187	-19.801939255808684	168866
d1f358e64888e7e516eadf1eca63af75130d6106	correlation coefficient between generalized atanassov's intuitionistic fuzzy sets	intuitionistic fuzzy set;geometrical representation;correlation;generalized atanassov s intuitionistic fuzzy sets;correlation coefficient	Based on the geometrical representation of generalized Atanassov's intuitionistic fuzzy sets (GA-IFSs), we take into account all three parameters describing GA-IFSs, propose a method to calculate the correlation coefficient for GA-IFSs in a finite set and a probability space, respectively, and discuss some properties of correlation and correlation coefficient of GA-IFSs.	coefficient;fuzzy logic;fuzzy set	Jin-Han Park;Ki Moon Lim;Bu Young Lee	2009	International Journal of Uncertainty, Fuzziness and Knowledge-Based Systems	10.1142/S0218488509005978	mathematical analysis;discrete mathematics;topology;mathematics;correlation	Robotics	-0.7884356265445271	-22.05155073109386	168932
c9807030ccfb2bfd0720ec5dfe859497f66a747e	some results of moments of uncertain variable through inverse uncertainty distribution	uncertain variable;inverse uncertainty distribution;moments;uncertainty theory	Uncertainty theory is a branch of axiomatic mathematics for modeling belief degrees. This theory provides a new mathematical tool for indeterminacy phenomena. Uncertain variable is a fundamental concept in uncertainty theory and used to represent quantities with uncertainty. There are some important characteristics about uncertain variables. The expected value of uncertain variable is its average value in the sense of uncertain measure and represents the size of uncertain variable. The variance of uncertain variable provides a degree of the spread of the distribution around its expected value. The moments are some other important characteristics of an uncertain variable. In order to describe the moment of uncertain variable, this paper provides a new formula using inverse uncertainty distribution. Several practical examples are provided to calculate the moments using inverse uncertainty distribution. In addition, some new formulas are derived to calculate the central moments of uncertain variables through uncertainty distribution and inverse uncertainty distribution.	indeterminacy (philosophy);modern portfolio theory;propositional variable;uncertainty theory;variable (computer science)	Yuhong Sheng;Samarjit Kar	2015	FO & DM	10.1007/s10700-014-9193-1	uncertainty theory;econometrics;mathematical optimization;uncertainty analysis;mathematics;moment;sensitivity analysis;statistics	ML	0.7728238491507409	-19.618699531411632	169434
6d344d3b0b5258441f44d7bc6ab8f0fe4444f6d8	determination of entropy measures for the ordinal scale-based linguistic models	additive and multiplicative linguistic terms;entropy measure;similarity measure	The main objective of this contribution is to develop information about how entropy measures of linguistic terms can be designed. Two different ideas have been put forward to explain this designation: (1) The idea that comes from the seminal definition of fuzziness measure; (2) The idea of transforming similarity measures to entropy ones. To demonstrate the utility and effectiveness of the proposed entropy measures, an entropy-based approach of determining objective weights of attributes is developed to solve multiple-attribute decision-making problems in the context of linguistic term sets.	entropy (information theory);level of measurement;similarity learning	B. Farhadinia	2016	Inf. Sci.	10.1016/j.ins.2016.06.002	information theory and measure theory;entropy power inequality;joint entropy;information diagram;transfer entropy;principle of maximum entropy;pattern recognition;mathematics;cross entropy;conditional entropy;statistics	AI	-3.428064674929259	-22.277879342478784	169447
0489a2fb6380e05ed889f09e954c97d07f4eda5c	estimation from pairwise comparisons: sharp minimax bounds with topology dependence		Data in the form of pairwise comparisons arises in many domains, including preference elicitation, sporting competitions, and peer grading among others. We consider parametric ordinal models for such pairwise comparison data involving a latent vector w∗ ∈ R that represents the “qualities” of the d items being compared; this class of models includes the two most widely used parametric models– the Bradley-Terry-Luce (BTL) and the Thurstone models. Working within a standard minimax framework, we provide tight upper and lower bounds on the optimal error in estimating the quality score vector w∗ under this class of models. The bounds depend on the topology of the comparison graph induced by the subset of pairs being compared via its Laplacian spectrum. Thus, in settings where the subset of pairs may be chosen, our results provide principled guidelines for making this choice. Finally, we compare these error rates to those under cardinal measurement models and show that the error rates in the ordinal and cardinal settings have identical scalings apart from constant pre-factors.	bsd;computer science;electrical engineering;karp–lipton theorem;minimax	Nihar B. Shah;Sivaraman Balakrishnan;Joseph K. Bradley;Abhay Parekh;Kannan Ramchandran;Martin J. Wainwright	2015	Journal of Machine Learning Research		mathematical optimization;combinatorics;statistics	ML	1.848899879990147	-18.943146781720394	169975
702174a6da30394b596fd97d7621c8fe8eac3626	the complex neutrosophic soft expert set and its application in decision making		This paper presents a novel complex neutrosophic soft expert set (CNSES) concept. The range of values of CNSES is extended to the unit circle in the complex plane by adding an additional term called the phase term which describes CNSES’s elements in terms of the time aspect. CNSES is a hybrid structure of soft sets and single-valued neutrosophic sets (SVNSs) defined in a complex setting where the experts’ opinions are included, thus making it highly suitable for use in decision-making problems that involve uncertain and indeterminate data where the time factor plays a key role in determining the final decision. Based on this new concept we define some concepts related to this notion as well as some basic operations namely the complement, union, intersection, AND and OR. The basic properties and relevant laws pertaining to this concept such as the De Morgan’s laws are also verified. Lastly, we propose an algorithm to solve complex neutrosophic soft expert decision-making problem by converting it from the complex state to the real state and subsequently provided the detailed decision steps. This study is supported by the comparison with other existing methods.	algorithm;complement (complexity);de morgan's laws;indeterminacy in concurrent computation;morgan;nondeterministic algorithm;relevance;theory	Ashraf Al-Quran;Nasruddin Hassan	2018	Journal of Intelligent and Fuzzy Systems	10.3233/JIFS-17806	machine learning;mathematics;artificial intelligence	AI	-3.313338074946298	-21.84783301778508	170323
b1056128eade76872d729fbaf3a06ff0bea79a4c	general chebyshev type inequalities for sugeno integrals	engineering;comonotone;chebyshev s inequality;fuzzy set;procesamiento informacion;conjunto difuso;ensemble flou;nonadditive measures;ingenierie;integral sugeno;information processing;ingenieria;sistema difuso;systeme flou;traitement information;integrale sugeno;fuzzy system;sugeno integral	Chebyshev type inequalities for the Sugeno integral on abstract spaces are studied in a rather general form, thus closing the series of papers on the topic dealing with special cases restricted to the real line and product operation.		Radko Mesiar;Yao Ouyang	2009	Fuzzy Sets and Systems	10.1016/j.fss.2008.04.002	mathematical analysis;discrete mathematics;chebyshev's inequality;chebyshev's sum inequality;information processing;computer science;artificial intelligence;calculus;mathematics;fuzzy set;fuzzy control system	Logic	1.0070611941799894	-22.571650911223493	170917
e8dafe2df512bad3bbbb33a0cd0f6eca6f797f08	a fuzzy based matrix methodology for evaluation and ranking of data warehouse conceptual models metrics				Naveen Dahiya;Vishal Bhatnagar;Manjeet Singh	2018	Int. Arab J. Inf. Technol.		machine learning;fuzzy logic;conceptual model;matrix (mathematics);computer science;artificial intelligence;data warehouse;ranking	DB	-4.271347859775086	-22.069377578733846	171451
8a519838efadaba1f5dd744c8278d2a3f6d7dae7	a note on two methods for estimating missing pairwise preference values	algorithms artificial intelligence computer simulation decision support techniques models theoretical pattern recognition automated signal processing computer assisted;pairwise comparison;additive consistency property;independent missing comparison case;uncertainty;computational intelligence;operations research;fedrizzi giove method;software engineering;fuzzy set theory;fuzzy sets;fuzzy preference relation;additives;artificial intelligence;incomplete reciprocal fuzzy preference relation;fuzzy sets fuzzy systems additives computational intelligence computer science artificial intelligence software engineering uncertainty;missing values;computer science;herrera viedma method;fedrizzi giove method missing pairwise preference values incomplete reciprocal fuzzy preference relation additive consistency property independent missing comparison case herrera viedma method;transitivity;transitivity consistency incomplete preference relation missing values pairwise comparison;article;consistency;fuzzy systems;missing pairwise preference values;incomplete preference relation	This note analyzes two methods for calculating missing values of an incomplete reciprocal fuzzy preference relation. The first method by Herrera-Viedma appeared in the IEEE Transactions on Systems, Man, and Cybernetics - Part B: Cybernetics [vol. 37, no. 1 (2007) 176-189], while the second one by Fedrizzi and Giove appeared later in the European Journal of Operational Research [vol. 183 (2007) 303-313]. The underlying concept driving both methods is the additive consistency property. We show that both methods, although different, are very similar. Both methods derive the same estimated values for the independent-missing-comparison case, while they differ in the dependent-missing-comparison case. However, it is shown that a modification of the first method coincides with the second one. Regarding the total reconstruction of an incomplete preference relation, it is true that the second method performs worse than the first one. When Herrera-Viedma 's method is unsuccessful, Fedrizzi-Giove's method is as well. However, in those cases when Fedrizzi-Giove's method cannot guarantee the successful reconstruction of an incomplete preference relation, we have that Herrera-Viedma 's method can. These results lead us to claim that both methods should be seen as complementary rather than competitors in their application, and as such, we propose a reconstruction policy of incomplete fuzzy preference relations using both methods. By doing this, the only unsuccessful reconstruction case is when there is a chain of missing pairwise comparisons involving each one of the feasible alternatives at least once.	aequidens sp. jenaro herrera;computer-aided software engineering;estimated;eventual consistency;fuzzy concept;giove;ieee systems, man, and cybernetics society;missing data;operations research;partial;solutions;utility functions on indivisible goods;volume	Francisco Chiclana;Enrique Herrera-Viedma;Sergio Alonso	2009	IEEE Transactions on Systems, Man, and Cybernetics, Part B (Cybernetics)	10.1109/TSMCB.2009.2023923	computer science;artificial intelligence;machine learning;computational intelligence;data mining;mathematics;fuzzy set;statistics	Vision	-0.5369997174237088	-19.688442141094274	171512
e54d220bf173b43dec02d6d9c9a4e134e4ee3a4f	a novel solution approach for fuzzy linear bilevel multi-follower programming problems		Decision making problems which are inherently hierarchical come under the category of multi-level programming problems. Whenever the hierarchy of problems is limited to two levels, the multi-level programming problem becomes a bilevel programming problem. Classical bilevel problems contain a leader problem subject to its constraints, and a follower problem subject to its own constraints. The follower problem acts as a constraint for the leader problem. However, in real practical cases, there may be a number of followers that constrain the solution space of the leader problem. Moreover, there may be certain impreciseness prevailing in the quantification of the resources of both the leader and the follower problems. In this paper, we deal with linear bilevel programming problems with multiple followers, which suffer from uncertainty, calling them fuzzy linear bilevel programming problems with multiple followers. While many solution approaches for such problems have already been introduced, we propose a novel defuzzification and K-th best algorithm based solution approach in this paper. Relevant results with a suitable numerical example have also been shown.	algorithm;branch and bound;defuzzification;experiment;feasible region;karush–kuhn–tucker conditions;numerical analysis;vertex enumeration problem	Taniya Seth;Pranab K. Muhuri	2018	2018 IEEE International Conference on Fuzzy Systems (FUZZ-IEEE)	10.1109/FUZZ-IEEE.2018.8491559	machine learning;fuzzy logic;artificial intelligence;fuzzy set;defuzzification;linear programming;computer science;hierarchy;bilevel optimization	Robotics	-0.7691257030952207	-18.236481823305784	171721
1ff33579370517478f4c1e3742ea544adc39a912	a discriminative dynamic index based on bipolar aggregation operators for supporting dynamic multi-criteria decision making		While Multi-Criteria Decision Making (MCDM) models are focus on selecting the best alternative from a finite number of feasible solutions according to a set of criteria, in Dynamic Multi-Criteria Decision Making (DMCDM) the selec- tion process also takes into account the temporal performance of such alternatives during different time periods. In this contribution is proposed a new discriminative dynamic index to handling differences in temporal behavior of alternatives, which are not discriminated in preceding dynamic approaches. An example is provided to illustrate the feasibility and effectiveness of the proposed index.		Yeleny Zulueta;Juan Martínez-Moreno;Luis Martínez;Macarena Espinilla	2013		10.1007/978-3-642-39165-1_25	psychology;artificial intelligence;operations management;data mining	DB	-3.354539065647595	-18.356004790183032	171816
9e2dac18c8c3ab2e1904f5b72fd958ff53308e6d	a hybrid approach combining fuzzy consensus-based possibility measure and topsis: application to the plant selection problem	selection problem supply chain coordination multi expert multi criteria consensus possibility measure fuzzy topsis;topsis fuzzy set theory supply chain management;memc fuzzy consensus based possibility measure topsis plant selection problem supply chain complexity supply chain partners coordination multiexpert multicriteria decision making problem;supply chains decision making radio frequency joints supply chain management equations	The current complexity of supply chains (SC) activities requires the need for coordination between supply chains partners to maximize the efficiency. This paper addresses the development of a new hybrid approach for the selection problem. The problem is formulated as a multi-expert multi-criteria (MEMC) decision making problem and solved by combining consensus-based possibility measure with TOPSIS method in a fuzzy environment. To demonstrate the applicability of the proposed approach, a simple example of plant selection problem is presented and the numerical results analyzed.	agent-based model;analytical hierarchy;goal programming;information system;markov chain;numerical analysis;real life;selection algorithm	Idris Igoulalene;Lyès Benyoucef	2014	2014 International Conference on Advanced Logistics and Transport (ICALT)	10.1109/ICAdLT.2014.6866326	mathematical optimization	Robotics	-4.070423938766502	-16.93259314811201	171974
93a62f963985aae4c9d3e7223df8ff0f1c795e26	a lattice structure for the set of interval-valued fuzzy-qualitative labels			fuzzy set	Francesc Prats;Mónica Sánchez;Núria Agell	2018		10.3233/978-1-61499-918-8-47		Robotics	0.9577727289786143	-23.425015743332757	172180
60dac659186e002c57d9c4ddac8b7da6ad99fcd8	soft set theory and uni-int decision making	optimisation;uni int decision making;optimizacion;systeme aide decision;teoria conjunto;soft products;theorie ensemble;prise de decision;sistema ayuda decision;set theory;systeme incertain;decision support system;soft sets;optimization;toma decision;sistema incierto;soft sets soft operations soft products uni int decision function uni int decision making;uncertain system;uni int decision function;soft operations	We firstly redefine the operations of Molodtsov's soft sets to make them more functional for improving several new results. We also define products of soft sets and uni-int decision function. By using these new definitions we then construct an uni-int decision making method which selects a set of optimum elements from the alternatives. We finally present an example which shows that the method can be successfully applied to many problems that contain uncertainties.	set theory	Naim Çagman;Serdar Enginoglu	2010	European Journal of Operational Research	10.1016/j.ejor.2010.05.004	mathematical optimization;decision support system;computer science;artificial intelligence;mathematics;operations research;algorithm;set theory	Theory	-0.3461811348112963	-17.171330472164207	172345
30ef43c3ea7fa0d5b350c27d55a8b8dc0fe2f00d	divisible mv-algebras as an algebraic model for fuzzy control	fuzzy control;natural extension;propositional logic	In this paper we shall describe a very natural extension of MV-algebras, the divisible MV-algebras (DMV). Such algebraic structures will be used to give a formal description of rules of fuzzy control.	fuzzy control system;linear algebra;mv-algebra	Brunella Gerla	2001			fuzzy logic;t-norm fuzzy logics;combinatorics;discrete mathematics;defuzzification;fuzzy classification;fuzzy subalgebra;fuzzy number;mathematics;fuzzy set operations;algorithm	AI	0.5531659341392795	-23.20301091673739	172401
5ab6e81f19a0b8ba8c42109f388947e56396283a	optimization decision of supplier selection in green procurement under the mode of low carbon economy	low carbon economy;green procurement;linguistic 2 tuple;towa operator;supplier selection	Under the background of economic globalization, selecting a path of low-carbon economic development and developing green supply chains are the inevitable choice of realizing the sustainable development for the enterprises. In this paper, we investigate the optimization decision problem of supplier selection in green procurement under the mode of low carbon economy. Concretely, we construct a new evaluation system for green supplier selection by considering commercial criterion and environmental criterion, and then present a decision method with 2-tuple linguistic assessments for green supplier selection. In this proposed decision method, all original decision data are transformed into linguistic 2-tuples, and then a ranking method based on 2-tuple weighted averaging (TWA) operator and 2-tuple ordered weighted averaging (TOWA) operator is presented to rank all alternative suppliers. Moreover, we provide an application decision making example of green supplier selection and compare our method with the method of linguistic 2-tuple Technique for Order Preference by Similarity to an Ideal Solution (LT-TOPSIS) to demonstrate the practicality and effectiveness of our decision method.	akaike information criterion;decision problem;distortion;mathematical optimization;procurement;program optimization	Zhuo Hu;Congjun Rao;Yue Zheng;Dong Huang	2015	Int. J. Comput. Intell. Syst.	10.1080/18756891.2015.1017375	supplier relationship management	AI	-4.462646579370886	-17.648578020505717	172412
ea31770100b301b4679dc1de8be318c23c6d560f	a type-2 fuzzy portfolio selection problem considering possibility measure and crisp possibilistic mean value	fuzzy programming;fuzzy number;portfolio selection;possibility measure;efficient solution method;crisp possibilistic mean value;type 2 fuzzy	This paper considers a portfolio selection problem with type-2 fuzzy future returns involving ambiguous and subjectivity. Since this proposed problem is not well-defined due to fuzziness, introducing the fuzzy goal for the total future return and the degree of possibility, the main problem is transformed into the standard fuzzy programming problem including the secondary fuzzy numbers. Furthermore, using the hybrid solution approaches based on the linearity of the deterministic equivalent problem and the crisp possibilistic mean value, the efficient solution is constructed. Keywords— Portfolio selection, Type-2 fuzzy, Possibility measure, Crisp possibilistic mean value, Efficient solution method	selection algorithm	Takashi Hasuike;Hiroaki Ishii	2009			fuzzy logic;mathematical optimization;defuzzification;fuzzy transportation;type-2 fuzzy sets and systems;fuzzy mathematics;fuzzy classification;fuzzy number;machine learning;fuzzy measure theory;mathematics;welfare economics;fuzzy set operations	AI	-1.2239862191400661	-18.789347032649097	172459
2a7f2320f2c3c7d71b329bccc51f2e1bffc8a6f4	about the use of admissible order for defining implication operators		Implication functions are crucial operators for many fuzzy logic applications. In this work, we consider the definition of implication functions in the interval-valued setting using admissible orders and we use this interval-valued implications for building comparison measures.		Maria José Asiain;Humberto Bustince;Benjamín R. C. Bedregal;Zdenko Takác;Michal Baczynski;Daniel Paternain;Graçaliz Pereira Dimuro	2016		10.1007/978-3-319-40596-4_30	operator (computer programming);discrete mathematics;fuzzy logic;computer science	AI	-1.7316865131173096	-22.08354072862681	172935
