id	title	keywords	abstract	entities	authors	year	journal	doi	fos	area	x	y	ix
615722461f18060ded5eb8a8f94eb4d326fa7cdb	an optimization method to estimate the missing elements for the incomplete fuzzy reciprocal preference relation		In this paper, we investigate the missing elements estimation issue of incomplete fuzzy reciprocal preference relation. Based on the multiplicative consistency property, a constrained nonlinear optimization model, which aims for making the induced matrix close to zero, is proposed to estimate the missing elements in the incomplete fuzzy reciprocal preference relation. The numerical example is illustrated to show the correctness and effectiveness of the proposed method. Our method not only estimates the missing elements accurately but also improves the multiplicative consistency, which makes the decision result derived from the incomplete fuzzy reciprocal preference relation could be scientific and effective.	algorithm;cognitive dimensions of notations;correctness (computer science);matlab;mathematical optimization;missing data;nonlinear programming;nonlinear system;numerical analysis;utility functions on indivisible goods	Yejun Xu;Qianqian Wang	2017	2017 IEEE International Conference on Fuzzy Systems (FUZZ-IEEE)	10.1109/FUZZ-IEEE.2017.8015421	econometrics;fuzzy logic;nonlinear programming;preference relation;correctness;multiplicative function;reciprocal;matrix (mathematics);mathematics	Robotics	-2.1079506802040022	-19.075667878790668	176595
d300981b8a5f15760313671836ebe2d2667e528a	vector-valued choquet integrals for set functions and bi-capacities		Logical vector-valued Choquet integral models are vector-valued functions calculated by m times Choquet integral calculations with respect to the m-th set functions to the interval [0,1]. By placing restrictions on the set functions, we can get some good properties, such as a normalized output. To introduce a symmetric difference expression, some set functions are transformed into monotone set functions, and they can be interpreted by using fuzzy measure tools such as Shapley values. Similarly, we introduce a vector-valued Choquet integral for bi-capacities and their symmetric difference expressions. Despite from the vector-valued Choquet integral for set functions, the output values match with original and symmetric difference expressions.		Eiichiro Takahagi	2012		10.1007/978-3-642-31724-8_23	fuzzy measure theory;choquet integral;choquet theory	Crypto	0.5450857321239322	-21.275695881198956	176667
10f6e50d69d9550c532b18f8772ccdea6c397226	probability theory of fuzzy events	fuzzy set;probability theory;probability measure	We compare two approaches to probability on systems of fuzzy sets—measures on tribes as introduced by Butnariu and Klement [3] and measures on MV-algebras with product studied by Riečan and Mundici [21]. We show that these two approaches overlap significantly and they confirm the original proposal of probability measure on fuzzy sets by Zadeh [24].	automated theorem proving;converge;fuzzy set;lyapunov fractal;mv-algebra;t-norm	Mirko Navara	2005			fuzzy logic;probability distribution;random variable;probability axioms;probability mass function;discrete mathematics;imprecise probability;membership function;probability measure;convolution of probability distributions;type-2 fuzzy sets and systems;fuzzy classification;fuzzy number;regular conditional probability;pattern recognition;tree diagram;total variation distance of probability measures;fuzzy measure theory;mathematics;statistics	NLP	-0.18382400720520073	-21.294613447191573	177165
68af55a3dcf9455c0428738c44ab3387018744a5	evaluation of optimum frp trawler type using symmetrical fuzzy collaborative optimization	traditional ship type evaluation model;optimisation;fuzzy parameters;symmetrical fuzzy collaborative optimization;collaboration;biological system modeling;collaborative optimization;fuzzy set theory;evaluation of optimum frp trawler uncertain parameters fuzzy parameters symmetrical fuzzy collaborative optimization traditional ship type evaluation model decision making;computational modeling;ships;marine vehicles;evaluation of optimum frp trawler fuzzy collaborative optimization symmetrical model;evaluation of optimum;frp trawler;mathematical model;fuzzy collaborative optimization;optimization;evaluation of optimum frp trawler;economics;uncertain parameters;ships decision making fuzzy set theory fuzzy systems optimisation;symmetrical model;fuzzy systems;evaluation model;optimization marine vehicles biological system modeling economics computational modeling collaboration decision making	In the practice of evaluation of optimum FRP trawler type, DM has to face multi disciplines and lots of uncertain or fuzzy parameters. This paper proposes the use of symmetrical fuzzy collaborative optimization model, and the traditional ship type evaluation model is decomposed into three subsystems, i.e., technological, economy and decision-making computation discipline. The fuzzy cut level optimized by system level can be as share variable for different discipline. In each discipline, the relative experts belongs to different disciplines may construct the mathematical model, independently, which guarantees the evaluation of trawler type possesses the distributive and parallel optimization factors and more efficient fuzzy processing ability.	commitment ordering;computation;functional reactive programming;fuzzy concept;mathematical model;mathematical optimization;optimization problem;paradiseo	Ye Tao;Xian-qiang Lv;Wen-Lian Yang;Sheng-ju Han	2010	2010 Seventh International Conference on Fuzzy Systems and Knowledge Discovery	10.1109/FSKD.2010.5569180	computer science;artificial intelligence;mathematical model;management science;fuzzy set;computational model;fuzzy control system;collaboration	Robotics	-1.2786774692576774	-16.961213496941884	177274
e02a5c99c46fa34601e1f093b3d0672001eb60cd	computingwithwords with the use of inverse rdm models of membership functions		Computing with words is a way to artificial, human-like thinking. The paper shows some new possibilities of solving difficult problems of computing with words which are offered by relative-distance-measure RDM models of fuzzy membership functions. Such models are based on RDM interval arithmetic. The way of calculation with words was shown using a specific problem of flight delay formulated by Lotfi Zadeh. The problem seems easy at first sight, but according to the authors’ knowledge it has not been solved yet. Results produced with the achieved solution were tested. The investigations also showed that computing with words sometimes offers possibilities of achieving better problem solutions than with the human mind.		Andrzej Piegat;Marcin Plucinski	2015	Applied Mathematics and Computer Science		rdm;fuzzy logic;mathematics;mathematical optimization;inverse;theoretical computer science;interval arithmetic;granular computing;artificial intelligence;machine learning	NLP	-4.379177801534213	-23.262034763506595	177428
ff3907e44015629a5c1bf38fea072db75ee9695f	characterization of weighted maximum and some related operations	minimisation;agregacion;minimization;operator;operador;maximization;minimizacion;prise decision;aggregation;functional equation;mathematical programming;theory;teoria;operateur;agregation;toma decision;programmation mathematique;maximizacion;programacion matematica;theorie;maximisation	Abstract   The complete characterization of weighted maximum and minimum operations as well as the ordered weighted maximum and minimum is established. The results are obtained via stability properties of the operations. These properties are expressed by functional equations. Solutions of these equations correspond to the studied operations.		János C. Fodor;Marc Roubens	1995	Inf. Sci.	10.1016/0020-0255(94)00064-I	functional equation;minimisation;mathematical optimization;combinatorics;computer science;operator;mathematics;mathematical economics;programming language;theory	AI	0.6618038830679903	-17.363072210103244	178034
1d4e0749c71731caba6303cdfb134bec37904d61	a unified scheme for generalizing cardinality estimators to sum aggregation	big data processing;algorithms;statistical	Cardinality estimation algorithms receive a stream of elements that may appear in arbitrary order, with possible repetitions, and return the number of distinct elements. Such algorithms usually seek to minimize the required storage at the price of inaccuracy in their output. This paper shows how to generalize every cardinality estimation algorithm that relies on extreme order statistics (min/max sketches) to a weighted version, where each item is associated with a weight and the goal is to estimate the total sum of weights. The proposed unified scheme uses the unweighted estimator as a black-box, and manipulates the input using properties of the beta distribution.	algorithm;black box;maxima and minima;weight function	Reuven Cohen;Liran Katzir;Aviv Yehezkel	2015	Inf. Process. Lett.	10.1016/j.ipl.2014.10.009	mathematical optimization;cardinality;combinatorics;computer science;mathematics;algorithm;statistics	DB	2.461989951983847	-17.771879392583806	178423
1a3eaf6f6d1e3c845c9458a9349d765685a73104	probability calculation and element optimization of probabilistic hesitant fuzzy preference relations based on expected consistency		As a generalized fuzzy number, the hesitant fuzzy element (HFE) has received increasing attention. However, it is noted that the occurring probabilities of the elements in the HFE are equal, which is obviously problematic; thus, the preference relations on the HFEs can be inaccurate. To address this issue, this paper proposes the probabilistic hesitant fuzzy preference relations (PHFPRs) based on the probabilistic HFE (PHFE). It seems difficult to provide accurate probabilities that describe the occurring possibilities of the elements in the PHFPRs. This paper further demonstrates the probability calculation method for the PHFPEs based on a proposed variable, which is called the expected consistency. Moreover, the expected consistency index and the judgment principle are designed to evaluate the degree to which the PHFPRs are consistent. For the inconsistent PHFPRs, this paper presents an iterative optimization algorithm to improve their expected consistency by optimizing some elements in the PHFPRs. When the iteration terminates, the consistent PHFPRs and the priorities of the alternatives are identified. Finally, an example that selects a Ph.D. candidate is presented, and the results demonstrate the feasibility and effectiveness of using the PHFPRs and the consistency methods.	algorithm;cladogram;fuzzy number;human factors and ergonomics;iteration;iterative method;mathematical optimization;preference learning;probabilistic database	Wei Zhou;Zeshui Xu	2018	IEEE Transactions on Fuzzy Systems	10.1109/TFUZZ.2017.2723349	artificial intelligence;fuzzy logic;machine learning;mathematics;probabilistic logic;mathematical optimization;fuzzy number	AI	-3.6672384520303654	-19.66656441823419	178425
5af8ea580c6a248a8d2805a4114442120c8624af	a mathematical programming approach to fuzzy efficiency ranking	libraries;modeling technique;nonlinear programming;fuzzy efficiency ranking;operations research;fuzzy set theory;fuzzy sets;data analysis;real world application;nonlinear programming operations research management science fuzzy set theory data envelopment analysis;data envelopment analysis;mathematical programming;membership functions;relative efficiency;membership function;mathematical programming data envelopment analysis fuzzy sets decision making libraries production area measurement data analysis;nonlinear programming mathematical programming fuzzy efficiency ranking decision making units data envelopment analysis membership functions;production;area measurement;decision making units;decision making unit;data envelope analysis;management science	Data envelopment analysis is a widely applied approach for measuring the relative efficiencies of a set of decision making units (DMUs) which use multiple inputs to produce multiple outputs. When some observations are fuzzy, the efficiencies calculated are also fuzzy. This paper devises a method to ranking the fuzzy efficiency scores without knowing the exact form of the membership functions of the fuzzy efficiencies. The idea is to apply maximizing and minimizing set method which is usually applied when membership functions are known. Via a skillful modeling technique, the requirement of the membership functions is avoided. The efficiency rankings are consequently determined by solving a pair of nonlinear programs for each DMU. To illustrate how the proposed method in real world applications, the ranking of the twenty-four university libraries in Taiwan with fuzzy observations is exemplified.	mathematical optimization	Chiang Kao	2001		10.1109/FUZZ.2001.1007286	mathematical optimization;membership function;defuzzification;type-2 fuzzy sets and systems;nonlinear programming;fuzzy classification;computer science;fuzzy number;machine learning;data mining;data envelopment analysis;mathematics;fuzzy set;fuzzy set operations	DB	-3.249277166037164	-17.091477033080466	178427
6e6de65ad587b01975c0dfaca6835df05efab40b	sequencing problems with uncertain parameters and the owa criterion		In this paper a class of sequencing problems with uncertain parameters is discussed. The uncertainty is modeled by using a discrete scenario set. The Ordered WeightedAveraging(OWA)aggregationoperatorisusedtochooseanoptimalsched- ule. The OWA operator generalizes traditional criteria in decision making under uncertainty, such as the maximum, average, median or Hurwicz criterion. In this paper a general framework is proposed and some positive and negative results for a sample problem are presented.		Adam Kasperski;Pawel Zielinski	2013		10.1007/978-3-319-07001-8_30	mathematical optimization;machine learning;data mining;mathematics	Theory	-1.1982596569513395	-20.6354362753631	178829
6b6f75d3084c25db6c7713bc4a624d8ce08adc30	on modifiers based on n-placed functions	demorgan class of oper- ators.;n-placed function;modifier. keywords: modifier;t- norm;t-conorm;fuzzy set;generating function;membership function	The idea, how to generate modifiers by nplaced functions defined on [0,1]n are considered. The subject matter of modifiers are fuzzy sets, i.e. membership functions defined on intervalI = [0,1]. The definition of modifiers is given and the case, how nplaced generator functions fit together with the definition. Some few properties of modifiers are considered. Some examples of generator functions and modifiers generated by them are given. The examples illustrate how graded modifier systems can be created. The place number n of a generator function takes effect to the strength of a modifier.	fuzzy set;modifier key;subject matter expert turing test	Jorma K. Mattila	2003			volumetric flow rate;carburetor;combustion;throttle;flow (psychology);automotive engineering;choke;idle;computer science;choke valve	Logic	0.7483865814157679	-23.91618517593177	180007
6f742fe00c2459699e144172d9f773f3a2d5ac72	a novel fuzzy data envelopment analysis based on robust possibilistic programming: possibility, necessity and credibility-based approaches		Possibilistic programming approach is one of the most popular methods used to cope with epistemic uncertainty in optimization models. In this paper, several robust fuzzy data envelopment analysis (RFDEA) models are proposed by the use of different fuzzy measures including possibility, necessity and credibility measures. Despite the regular fuzzy DEA methods, the proposed models are able to endogenously adjust the confidence level of each constraints and produce both conservative and non-conservative methods based on various fuzzy measures. The developed RFDEA models are then linearized and numerically compared to regular fuzzy DEA models. Illustrative results in all of the FDEA and RFDEA models show that, maximum efficiency is obtained for possibility, credibility and necessity-based models, respectively.		Pejman Peykani;Emran Mohammadi;Mir Saman Pishvaee;Mohsen Rostamy-Malkhalifeh;Armin Jabbarzadeh	2018	RAIRO - Operations Research	10.1051/ro/2018019	uncertainty quantification;mathematical optimization;fuzzy logic;robust optimization;mathematics;data envelopment analysis;credibility;confidence interval	Robotics	-1.8487092806232834	-18.69176708507513	180330
dcbd91f046fcf35165430872448a84c57d673e3e	solving fuzzy transportation problem using multi-choice goal programming		This paper explores the study of fuzzy transportation problem (FTP) using multi-choice goal-programming approach. Generally, the decision variable in transportation problem (TP) is considered as real variable, but here the decision variable in each node is chosen from a set of multi-choice fuzzy numbers. Here, we formulate a mathematical model of FTP considering fuzzy goal to the objective function. Thereafter, the solution procedure of the proposed model is developed through multi-choice goal programming approach. The proposed approach is not only improved the applicability of goal programming in real world situations but also provided useful insight about the solution of a new class of TP. A real-life numerical experiment is incorporated to analyze the feasibility and usefulness of this paper. The conclusions about our proposed work including future studies are discussed last.	fuzzy transportation;goal programming;transportation theory (mathematics)	Gurupada Maity;Sankar Kumar Roy	2017	Discrete Math., Alg. and Appl.	10.1142/S1793830917500768	mathematics;fuzzy set operations;fuzzy logic;transportation theory;goal programming;fuzzy transportation;mathematical optimization;fuzzy number	Robotics	-2.077251382078266	-18.04816962444868	180878
0b31dd9b400a365b85bc3e9cc993655c828e97e9	a new similarity measure of fuzzy numbers	fuzzy number;membership function;fuzzy sets theory;similarity measure	A new method for measuring the degree of similarity between fuzzy numbers is proposed in this paper. The advantage of the proposed method is to take account of the membership functions of fuzzy numbers while measuring the degree of similarity of fuzzy numbers. Finally, six sets of fuzzy numbers are used to compare the proposed method with the existing methods for similarity measure of fuzzy numbers. The results show that the proposed method for similarity measure seems to be more reasonable.	fuzzy number;similarity measure	Chien-Chang Chou	2014	Journal of Intelligent and Fuzzy Systems	10.3233/IFS-120737	fuzzy logic;discrete mathematics;membership function;defuzzification;type-2 fuzzy sets and systems;fuzzy mathematics;fuzzy classification;computer science;artificial intelligence;fuzzy number;fuzzy measure theory;data mining;mathematics;fuzzy set;fuzzy associative matrix;fuzzy set operations	Robotics	-2.275375935539941	-21.077392405939353	181246
1e798645a1c8e2768241d70b3b1b591403932c30	fuzzy multiple criteria decision making: recent developments	fuzzy multiple criteria decision making;multiple criteria decision making;fuzzy set theory;multiple objective programming;group decision;utility theory	Multiple Criteria Decision Making (MCDM) shows signs of becoming a maturing field. There are four quite distinct families of methods: (i) the outranking, (ii) the value and utility theory based, (iii) the multiple objective programming, and (iv) group decision and negotiation theory based methods. Fuzzy MCDM has basically been developed along the same lines, although with the help of fuzzy set theory a number of innovations have been made possible; the most important methods are reviewed and a novel approach interdependence in MCDM is introduced.	common criteria;fuzzy set;interdependence;set theory;utility	Christer Carlsson;Robert Fullér	1996	Fuzzy Sets and Systems	10.1016/0165-0114(95)00165-4	mathematical optimization;optimal decision;decision analysis;weighted product model;computer science;artificial intelligence;decision rule;mathematics;management science;fuzzy set;evidential reasoning approach;utility	AI	-4.28882268744647	-17.274048420654474	181574
35597c4a2672a3cce23ad1d29d7015ddfd6e403f	fuzzy simple additive weighting method by preference ratio	preference ratio;fuzzy numbers;fuzzy number;simple additive weighting;multiple attribute decision making;ranking;fsaw;madm	Although simple additive weighting method (SAW) is the most popular approach for classical multiple attribute decision making (MADM), it is not practical any more if information is fuzzy. The existing methods of Fuzzy Simple Additive Weighting method (FSAW) apply defuzzification which distorts fuzzy numbers. Furthermore, most of the methods usually require lengthy and laborious manipulations. In this paper, we develop a new a fuzzy simple additive weighting method for multiple attribute decision making problems. To avoid defuzzification round off errors caused by multiplication or other arithmetic manipulations, fuzzy numbers are ranked prior to any fuzzy arithmetic in this method. The ranking is done by preference ratio concept which compares fuzzy numbers pairwise. Since this method eventually assigns crisp scores to alternatives, it is practical and more realistic. We also present three other algorithms for ranking or normalizing fuzzy numbers which are actually sub algorithms of the main method.	additive model;algorithm;defuzzification;distortion;fuzzy number;horner's method;round-off error;utility functions on indivisible goods	Mohammad Modarres;Soheil Sadi-Nezhad	2005	Intelligent Automation & Soft Computing	10.1080/10642907.2005.10642907	defuzzification;type-2 fuzzy sets and systems;fuzzy classification;computer science;artificial intelligence;fuzzy number;machine learning;pattern recognition;fuzzy measure theory;data mining;fuzzy associative matrix;fuzzy set operations	AI	-1.830188157667925	-20.555353959134305	181963
ed75562637477c4540f2615bdeb33fdb8f3a7c66	application interval-valued intuitionistic fuzzy set to select supplier	fuzzy sets decision making supply chain management fuzzy systems supply chains conference management knowledge management technology management arithmetic art;intuitionistic fuzzy set;mathematics;fuzzy number;multiple attribute decision making;fuzzy set theory;fuzzy sets;manganese;distance measurement;hamming distance;modified topsis analysis method;interval valued intuitionistic fuzzy set;weighted hamming distances interval valued intuitionistic fuzzy set multiple attribute decision making problems supplier selection supply chain management modified topsis analysis method;multiple attribute decision making problems;supply chain management decision making fuzzy set theory;weighted hamming distances;fuzzy systems;supply chain management;supplier selection	The aim of this paper is to investigate the multiple attribute decision making problems to deal with the supplier selection in supply chain management with interval-valued intuitionistic fuzzy information, in which the information about attribute weights is completely known, and the attribute values take the form of interval-valued intuitionistic fuzzy numbers. A modified TOPSIS analysis method is proposed. Then, based on the traditional TOPSIS method, calculation steps for solving interval-valued intuitionistic fuzzy multiple attribute decision-making problems with known weight information are given. The weighted Hamming distances between every alternative and positive ideal solution and negative ideal solution are calculated. Then, according to the weighted Hamming distances, the relative closeness degree to the positive ideal solution is calculated to rank all alternatives. Finally, an illustrative example about supplier selection is given to verify the developed approach and to demonstrate its practicality and effectiveness.	centrality;fuzzy set;hamming distance;intuitionistic logic;window function	Zhuo Xiao;Guiwu Wei	2008	2008 Fifth International Conference on Fuzzy Systems and Knowledge Discovery	10.1109/FSKD.2008.293	mathematical optimization;discrete mathematics;supply chain management;computer science;artificial intelligence;data mining;mathematics;fuzzy set;fuzzy control system	AI	-2.3524459319388225	-21.01331031994424	182076
5ab443b8328de23fe5b3194885d5cc83bb26780f	rough soft set theory applied to lattices and its applications		This article is to introduce the concept of a rough soft lattice, which is an extended concept of a rough soft set and a lattice. We study roughness in soft lattices with respect to congruence approximation spaces. Some new rough soft operations are explored. In particular, lower and upper rough soft lattices and some special rough soft lattices are investigated. Finally, we give a decision method based on rough soft lattices. 5	approximation;congruence of squares;rough set;set theory	Bin Yu;Qingguo Li	2017	Journal of Intelligent and Fuzzy Systems	10.3233/IFS-162173	mathematics;discrete mathematics;soft set;lattice (order)	Robotics	-1.1627656301343818	-23.547678594408808	182661
