id	area	title	year	x	y	ix
4087559	Theory	a small local computer network for automation of manufacture and scientific researches	1999	7.058742156923696	-0.1587846064249481	4087586
4088731	Theory	the role of computer integrated manufacturing for future shipbuilding	1991	6.500134368524615	0.19789136014907555	4088758
4089205	Graphics	review - supporting valid-time indeterminacy	2000	6.404415344360926	0.6171301893855596	4089232
4090804	AI	formal ontologies for communicating agents	2007	6.801977860213686	0.2370225638217129	4090831
4095886	Vision	notes on performance considerations for single and dual capacity dasd	1986	7.142556744155575	0.0485380324949816	4095913
4101897	Robotics	constraints as incompatibility relations in kbs	1994	6.670656042913404	-0.049409531177936485	4101924
