id	area	title	year	x	y	ix
3723824	Crypto	data base theory and modeling - theoretical and practical aspects	1978	7.101972668626063	-0.0663413553310997	3723851
3726127	DB	database design for information retrieval	1989	7.2423743532731235	0.3638602610944113	3726154
3729519	DB	an analytical model of the micronet distributed database management system.	1982	7.244506366956157	0.5439280768891199	3729546
3734473	DB	doubly-chained tree data base organisation-analysis and design strategies	1977	7.012405106998982	-0.05254813821382597	3734500
3735930	Web+IR	the ecosystem of information retrieval.	2012	6.792823464895933	0.6085029757207434	3735957
3738573	DB	deepflow: using argument schemes to query relational databases	2014	6.936216444624192	0.4707592282070156	3738600
3741815	DB	adaptive selection of tuples over data streams for efficient load shedding	2008	6.424021081657339	0.3335408750740281	3741842
3748734	SE	stress-strength reliability analysis with extreme values based on q-exponential distribution	2017	6.778783337931527	0.4990423963589917	3748761
3749572	HPC	comparison of pre-and post-resolution blocking strategies for entity resolution in a distributed computing environment	2017	7.1680373401660455	0.23455625473351285	3749599
3753170	Theory	inherent complexity trade-offs for range query problems	1981	6.523203526368692	0.2912995607852094	3753197
3757115	HCI	coh, an excel spreadsheet for composition calculations in the c-o-h fluid system	2005	7.1751263624039865	0.08942272761525663	3757142
3758200	HCI	global and vector operations in a rule-based visual language	2005	7.2032621409709074	-0.11786963381989128	3758227
3761151	DB	continuous temporal top-k query over versioned documents	2014	6.981337835767024	0.5724351835135892	3761178
3768881	Visualization	fault tolerance in process control: an overview and examples of european products	1987	6.6220983959946125	0.278401460573571	3768908
3769260	EDA	momt: a multilevel object modeling technique for designing secure database applications	1996	7.08227493453252	0.6110425492491978	3769287
3772760	OS	rbd - rule based job dispatching software for implementing production plans	1990	6.380499317735312	0.07002902330300427	3772787
3776260	AI	pattern matching in conceptual modes - a formal cross-modelling language approach.	2009	6.862543636920775	0.6451019853593791	3776287
3778009	Security	processing multilevel secure objects	1981	7.253694273595791	0.61780485798954	3778036
3780358	DB	iris: an object-oriented database management system.	1987	7.210236493344063	0.5967615040212672	3780385
3781493	SE	performance analysis for a software system by the mathematical modeling method.	2002	6.7698767315296475	-0.06659723611598843	3781520
3784341	AI	knowledge acquisition from prescriptive texts	1990	6.443257680001945	0.09101784317574853	3784368
3785023	DB	concept and implementation of a fuzzy classification query language	2005	6.688448358562331	0.5746019859732998	3785050
3788532	EDA	n/c-programming on the shop floor using graphical simulation techniques	1983	6.660498394741875	-0.18536850562682536	3788559
3793741	DB	horizontal partitioning for distributed database design: a graph-based approach.	1993	7.035337506028858	0.5778067489887808	3793768
3794834	Theory	on some computational problems related to data base coding (abstract)	1984	7.0330715922661495	-0.011486994739948844	3794861
3795296	SE	a benchmark for evaluating software engineering techniques for improving medical processes	2010	6.591562386889442	-0.20374447943635385	3795323
3796313	DB	terminal reliability modeling & analysis of hypercube networks	1992	6.970671717357334	0.1332515253313246	3796340
3798880	DB	d-dependency structures in the relational model of data	1980	6.935040166893407	0.4508519685798122	3798907
3805640	Robotics	gathering metric information using metalevel facilities	1994	7.097451579169368	0.2619912444558756	3805667
3805988	PL	optimized modular production networks in the process industry	2015	6.463882351119063	0.184249712181756	3806015
3806084	AI	system design and evaluation using discrete event simulation with artificial intelligence	1993	6.554024041015366	0.2556675020304582	3806111
3807615	DB	a note on the analysis of extendible hashing	1980	6.628890544685554	0.1531712268906329	3807642
3808919	DB	using java to implement a distributed deductive database.	2002	6.828304638732688	0.4020160159302342	3808946
3811257	EDA	formela: a general design and production data system for sculptured products	1973	6.461243695740711	0.57632235653452	3811284
3812785	DB	evaluation methodology for rule scheduling in active database systems	2004	7.108066020278604	0.08680639212864351	3812812
3815868	EDA	interconnection topologies for shared nothing dbms architectures	1993	7.143608708341419	0.39200536058574176	3815895
3816784	Robotics	off-line programming by cad-systems for welding robots	1990	6.589028284011718	0.5995594790621053	3816811
3822150	ML	components of an intelligent preprocessing agent for data mining: extensibility viewpoint	2017	7.146341542941718	0.26544874097871873	3822177
3826658	Robotics	robotics and computer integrated manufacturing system laboratory	1997	6.898876862041326	-0.18377448577879213	3826685
3826743	Visualization	partial-match via the method of superimposed codes	1979	6.3881336003879765	0.21013768900699634	3826770
3827443	AI	agents and data mining: mutual enhancement by integration	2005	6.557766264370293	0.5060219041091321	3827470
3827673	AI	lazy walks versus walks with backstep: flavor of pagerank	2014	6.660371099804679	0.5354086413325801	3827700
3827699	EDA	3390: a close look at a new dasd generation	1990	7.248490275585656	-0.050414841097547985	3827726
3827726	EDA	data-driven test plan augmentation for platform verification	2017	6.784502503813513	-0.06598289852161858	3827753
3828220	ML	some considerations about distributed data bases on public networks	1980	7.139446647435209	-0.0825325236677103	3828247
3829180	DB	null values in a relational data base	1977	6.760152629898558	0.4322749836923286	3829207
3831114	Graphics	pogo: a declarative representation system for graphics	1989	7.0037130972675135	0.53248602346315	3831141
3831623	DB	object oriented database panel - position statement	1989	7.2138597261975885	0.7061215733855555	3831650
3833307	Vision	i/o performance modelling & evaluation: giving your company the competitive edge	1995	7.2182763672877535	-0.20291665253776853	3833334
3841236	Robotics	additive manufacturing in the context of hybrid flexible manufacturing systems	2012	6.420992135478097	0.1266099070597651	3841263
3841356	DB	three data partitioning strategies for building local classifiers (chapter 14)	2011	6.639973162471057	-0.020740596169096674	3841383
3841490	Robotics	design and performance characterisation of a modular surveillance system for a distributed processing platform	2001	7.037039242369027	-0.071791275942465	3841517
3846558	DB	an entity-relationship approach to modelling petroleum engineering database	1983	7.202653039581937	0.6163189914953969	3846585
3846746	Robotics	methodologies for the structured development and documentation of manufacturing planning and control systems	2000	7.175652860034888	0.21024030808857225	3846773
3849471	Robotics	employing the intelligent interface for scientific discovery	1989	6.389952132337352	0.20843782335398667	3849498
3850696	DB	imidb: an algorithm for indexed mining of incremental databases	2017	6.810995325881145	0.5442236702962768	3850723
3852073	ML	understanding the mvs/xa i/o subsystem through dasd event traces	1989	7.209086012220343	0.059706904942535666	3852100
3856923	NLP	dynamic reliability assessment of a nuclear reactor building	1993	6.554733403413295	0.025630449321743014	3856950
3857839	DB	plan and schedule generation over temporal databases	1990	7.1754594758063535	0.0747599585044051	3857866
3864964	Logic	petri nets for discrete event simulation: would a standard extension be beneficial?	1995	6.575653685028382	0.12422021018555983	3864991
3866119	Robotics	design, analysis and manufacturing of lattice structures: an overview	2018	7.124624742142753	-0.07809389076267796	3866146
3868877	DB	freddy: fast word embeddings in database systems	2018	7.0768175965455535	0.36985122671195797	3868904
3869268	OS	computer control of component insertion	1974	7.1492700764149495	0.5627667283573138	3869295
3870792	Visualization	management of unstructured geological data based on hadoop	2015	6.4426606193057	0.4056076991319463	3870819
3873061	Robotics	wireless sensor network pattern based fault isolation in industrial applications	2009	6.461307188843651	-0.13161795795598974	3873088
3873151	AI	theory-driven logical scaling: conceptual information systems meet description logics	1999	6.546581564965306	0.3956776543647391	3873178
3873673	Metrics	software sirius++ for performance evaluation of modern communication networks	2002	7.125923057540487	0.03981462632652629	3873700
3873970	DB	development of a cubrid-based distributed parallel query processing system	2017	6.736196320645449	0.3750347009663771	3873997
3878543	ML	a sequential pattern query language for supporting instant data mining for e-services	2001	7.018101623397891	0.5754048461837953	3878570
3879475	ML	efficient query processing over personal process description graphs	2016	6.749999777653112	0.18393378158996407	3879502
3880513	DB	수명을 가지는 공간 객체를 r-tree 인덱스에서 효율적으로 갱신하기 위한 방법	2008	6.6408526637371255	0.1558420172164397	3880540
3883607	DB	detecting corrupted schema mappings in xml p2p databases	2005	7.19086588276874	0.26722363893172363	3883634
3886185	AI	competitive-cooperative automated reasoning from distributed and multiple source of data	2009	6.663115206830577	0.722521797681894	3886212
3888052	Web+IR	granular computing for the organization and retrieval of scientific xml documents	2002	7.008208037223438	0.6380113277728517	3888079
3889560	EDA	"""comment on """"computer-aided design: simulation of digital design logic"""""""	1969	7.232463007031673	0.5030687926815813	3889587
3890336	HPC	autonomous tools for grid management, monitoring and optimization	2007	7.1052846153888645	0.4151661268168659	3890363
3891012	HCI	clustering objects for oodbs in a multiple relationship environment	1993	7.0393098175609214	0.6661336812359985	3891039
3891230	Robotics	case - the mototech manufacturing company: process control and improvement	2010	6.685255419828116	-0.1121593244466932	3891257
3891446	PL	communication test for object-oriented systems using gossiped data (fast abstract)	2006	7.2526300975138	0.22824753503096726	3891473
3891638	DB	application of meteorological big data	2016	6.570785182371192	0.5298537647006889	3891665
3892794	Robotics	an agent architecture for open system specifications	2011	6.642755157986102	-0.14948054336436964	3892821
3892939	HPC	creating a knowledge base of biological research papers	1994	6.421003860757621	-0.06363193434246094	3892966
3895694	HCI	guidelines for development of risk identification expert system for product design	2016	6.797494818477711	-0.09140691933017576	3895721
3895881	DB	a hierarchical object model for multimedia database systems	2001	7.075025457681125	0.537254565812244	3895908
3896018	DB	formal semantics for the integration of image data into gis	1994	7.100396864010441	0.6508363275674868	3896045
3896287	DB	a main memory based spatial dbms: kairos	2012	6.509153207458774	0.6979790479000815	3896314
3897397	AI	symmetry breaking in peaceably coexisting armies of queens	2002	6.572568817371735	-0.13316572659962864	3897424
3898227	OS	measurement of response time performance in small time-sharing systems	1980	7.095677645654787	-0.17572556244654822	3898254
3903206	DB	comparing the universal instance and relational data models	1986	6.8341353787729	0.2577967765780088	3903233
3909499	DB	an analysis of database security with queries for high order statistical information	1988	7.256145172335549	-0.11097902913097893	3909526
3910993	Theory	analysis of term distribution in the toxline inverted file	1976	6.599386147472951	0.019291163885084305	3911020
3911755	HCI	requirements for ontology based design project assessment	2008	7.0920222747028605	0.4756656033632875	3911782
3912502	Vision	solving the find-path problem in 3d by a simple object model	1992	7.18430928012729	-0.003826255568452083	3912529
3915752	Embedded	knowledge needs analysis for simultaneously multi-agent real-time systems	1997	6.448558440050662	-0.1953472306939638	3915779
3916548	DB	using a relational database to develop a statistical quality control system for ate	1986	6.851461877353996	-0.0025809664854852267	3916575
3921244	ML	synchronization of distributed simulation using braodcast algorithms	1979	6.885091432051182	0.17760152425167064	3921271
3921663	Vision	automatic generation of r2r mappings from correspondence assertions	2015	7.025982935636176	-0.15073272899380086	3921690
3922135	PL	lopsided little languages: experience with xquery.	2005	6.68160557149209	0.432953306826833	3922162
3924534	DB	a temporal database model using nested relations	2004	7.035903759189176	0.5222547192925459	3924561
3925499	DB	a systematic performance study of object database management systems	1997	7.190346130070621	0.7376681712325475	3925526
3925528	DB	generating multidimensional response surfaces from process data - finding optimal set points for machine control	2011	7.2175354395210025	-0.13249006564883778	3925555
3925833	NLP	ridl on the cris case: a workbench for niam	1988	7.167368543924952	0.6667244257620564	3925860
3926897	DB	finding keys in particular classes of functional dependencies	1995	6.581160739440825	0.3738642084006611	3926924
3928333	DB	functional dependencies in hierarchical structures of data	1991	6.679966692866565	0.4652086398326367	3928360
3928493	NLP	development of metrics for evaluating decomposed process models based on wand and weber's good decomposition model	2018	7.207783009694837	0.5861250048687499	3928520
3931253	DB	geospatial data streams: formal framework and implementation	2014	6.462193061908777	0.4529871217640946	3931280
3931925	Robotics	indexing through separable partitioning for complex data sharing in p2p systems	2018	6.3697206494523	0.6949457397241272	3931952
3940403	Robotics	a cardinal typing approach for an integrated object modeling	1993	7.016497765749175	0.4151083802452503	3940430
3941222	DB	concurrent update control and data base integrity	1974	7.156399645682801	0.4162532182849179	3941249
3941664	Robotics	on updating and querying sub-arrays of multidimensional arrays	2013	6.563341304532018	0.6829655674464253	3941691
3944633	DB	on the integration of lexical and spatial data in a unified high-level model	1989	7.029485771585794	0.08243879917899348	3944660
3947918	AI	a core ontology of safety risk concepts - reconciling scientific literature with standards for automotive and railway	2016	6.6041943862227965	0.22934466987396415	3947945
3949290	Robotics	using model differencing to reason about observable behavior changes of manufacturing systems	2018	6.332528993233285	0.09686876981766944	3949317
3951754	Robotics	the application of hierarchical control systems to reduce lead times in one-of-a-kind production (okp)	1993	6.765893308958847	-0.1251716139681558	3951781
3953288	Theory	guest editors preface	2012	7.1549475738976644	0.2028665355844089	3953315
3953721	Robotics	simulation system model methodology: application in discrete manufacturing	2005	6.552795015920869	-0.11817093691406068	3953748
3956864	EDA	an accurate slicing procedure for layered manufacturing	1996	6.421729664456892	0.20974210094700105	3956891
3963005	Logic	developments of a simulation language in conjunction with hydro-turbine modelling	1982	6.660465810493365	0.3394611842869871	3963032
3968709	DB	sets as a model for data base representation: much ado about something	1975	7.1119765095341165	-0.1432696707212172	3968736
3969714	DB	mashroom+: an interactive data mashup approach with uncertainty handling	2013	6.365921655865358	0.7361710228388046	3969741
3971084	Vision	storing scene graphs in object relational databases	2003	7.2121744315755025	0.5442222409409353	3971111
3973798	Robotics	task specification using technical illustrations	1993	6.546975077051782	0.05659019325415554	3973825
3974333	HPC	dasd performance in an esa/dim environment - faster isn't always better	1992	7.195296722813469	-0.051365552032899435	3974360
3978315	DB	event oriented management of functions and data in distributed systems	1991	7.236691274717057	-0.14182235183094544	3978342
3979634	EDA	representation of functions and features in detail design	1996	7.203260419144571	0.12914653461324554	3979661
3980064	DB	events must be complete in event processing	2008	6.970512888974301	0.24767483613854785	3980091
3980542	DB	a relational schema description and manipulation facility	1985	6.904662508404534	0.6441038179160891	3980569
3980887	Theory	cluster-based exploration for effective keyword search over semantic datasets (extended abstract)	2010	6.577256534412182	0.38822966113502827	3980914
3981888	DB	signature cache: a light weight web cache indexing structure	1998	7.1787485897059655	-0.0980857582835025	3981915
3982097	AI	a learning classifier-based approach to aligning data items and labels	2013	6.946555421675277	0.27294940891525826	3982124
3982375	EDA	automatic generation of simulation-based digital twins of industrial process plants	2018	6.738069337347491	0.4499218299476624	3982402
3984779	Robotics	from process control systems towards virtual automation networks - contributions of computer science	2012	6.771752903132472	-0.15411476640113989	3984806
3986964	Logic	design and evaluation of a new-type multifunctional machine tool - functional requirements and design -	1997	6.558237549907628	0.5368406084570807	3986991
3987680	DB	a rule-based strategy for transforming relational schemas into oo schemas	1996	7.051429523587184	0.7336604481836756	3987707
3988749	HPC	using adaptive runtime filtering to support an event-based performance analysis	2017	7.01621279917601	-0.14571984968039275	3988776
3989397	ML	f0 generation with a data base of natural f0 patterns and with a neural network	1990	7.082881143490861	-0.06480519109847173	3989424
3991246	NLP	applications of a computer system for transformational grammar	1969	6.397180201980688	0.7335342398432643	3991273
3997484	DB	review - relational databases for querying xml documents: limitations and opportunities	2000	7.225005726038963	0.3966594584418131	3997511
3999200	DB	a methodology for the design of logical data base structures	1976	7.036010542528743	0.09217748953023518	3999227
3999990	DB	crossmine: efficient classification across multiple database relations	2004	6.858754787458937	0.011463205669494094	4000017
4001676	DB	a platform dedicated to knowledge engineering for the development of image processing applications	2007	6.346267014975193	0.013688798278647059	4001703
4001988	PL	10131 executive summary and abstracts collection - spatial representation and reasoning in language: ontologies and logics of space	2010	6.810476834612495	-0.19342722884826188	4002015
4002936	DB	treatment of special conditional for similarity searching in complex data bases	2012	7.066442153680782	-0.002551324370027868	4002963
4003433	DB	database slicing on relational databases	2014	7.2375578988512945	-0.1067589913711696	4003460
4003545	SE	validation of job shop control software - a case study	1988	6.323175513540397	0.05009805345648592	4003572
4010065	Theory	data base distribution and concurrency for end-users (abstract)	1988	7.274373616517818	0.4190815059824355	4010092
4011407	EDA	implementation of the eri standard and evaluation of applications with several low-cost technologies	2008	6.887978682906841	-0.09925241555261333	4011434
4011964	HPC	dynamic global scheduling in cooperative distributed systems	2003	7.188373843696313	-0.1876336824443344	4011991
4012790	DB	labelling dynamic xml documents : a groupbased approach	2015	7.22028880241529	0.3942087068037685	4012817
4013822	NLP	guiding ontology learning and population by knowledge system goals	2010	6.57563984737513	0.6277857721754424	4013849
4015722	HPC	validating knowledge based systems with software visualization technology	1995	6.975176566315342	-0.12019644529139377	4015749
4016685	Robotics	a semantic-ambiguity-free relational model for handling imperfect information1	1999	6.649711972529035	0.4353742855274619	4016712
4016933	DB	distributed travelling salesman algorithms for distributed database operation.	1980	6.939492845732242	0.5017611153440344	4016960
4017852	HPC	inter-agent communication in dynamic distributed information systems	1996	6.80828876423287	0.061950535518779985	4017879
4019588	Robotics	querying sensor data for semantic product memories	2009	7.013295709362335	0.25138315022372465	4019615
4019838	DB	heuristics for partial-match retrieval data base design	1976	6.483647752843628	0.4098587820494776	4019865
4021824	SE	a knowledge-based approach to software design support	1989	7.009353708222196	-0.03815383687840947	4021851
4021941	Robotics	advanced condition monitoring services in product lifecycle management	2007	6.464251312635566	0.16115994265554368	4021968
4026374	AI	hybrid knowledge bases for intelligent reasoning systems	1993	6.466456384272287	-0.02937396077063413	4026401
4027888	DB	deriving data base specifications from user queries	1977	7.054058375126141	-0.10006369950934638	4027915
4028509	Web+IR	attributed name evaluation	1995	6.5733598701569695	0.09380405941788654	4028536
4029451	SE	applying a model of the fuzzy control software development process in practice	1995	6.3829841916352095	-0.06388906660353484	4029478
4030174	Vision	developing a modelling framework for document image processing using a simulation model	1993	6.6664937338335815	-0.010623130059433886	4030201
4031379	DB	extending relational algebra to incorporate characteristics of temporal data	1998	6.816032241351932	0.5937818237356179	4031406
4032271	SE	performance assessment for process monitoring and fault detection methods	2016	7.240625632048928	0.4058126340548901	4032298
4033001	AI	a systematic approach for design and planning of mechanical assemblies	1993	6.786887184340371	-0.0980960186936045	4033028
4033445	Robotics	cyber-physical production systems: roots from manufacturing science and technology	2015	7.232607885223646	0.032726305618697805	4033472
4034391	HCI	database design tools: combining theory, guesswork, and user interaction	1989	7.260284335678918	0.4501328447401234	4034418
4039445	Logic	programming language extension for discrete event simulation	1976	6.593680300344008	0.1801632550807249	4039472
4040421	DB	an agent-based on-line monitoring and diagnosis system for distributed databases	2005	7.1639572425951705	0.031438802988863535	4040448
4043452	Metrics	key performance indicators used as measurement parameter for plant-wide feedback loops - (work in progress)	2014	6.4594956646115005	0.109213474305709	4043479
4046911	DB	on dependencies in the relational model of data	1981	6.910441490809466	0.2520542356050766	4046938
4047952	Theory	robustness of large-scale distributed computer systems	1996	7.146316592470112	0.023434738206033274	4047979
4048155	SE	new approach to multidisciplinary content driving of engineering model system component generation	2016	6.635543132833116	0.02298811512464476	4048182
4049437	AI	the application of artificial intelligence to the development of a design support system for externally pressurised journal bearings	1994	6.754486873314956	-0.21361291556354733	4049464
4049761	HPC	parallel and distributed discrete event simulation	2001	6.576483782475022	0.10392108636858696	4049788
4050338	DB	operation of a disc data base	1972	6.994366797661443	-0.07867646837911979	4050365
4050485	Visualization	dynamic tiled map services: supporting query-based visualization of large-scale raster geospatial data	2010	6.7344140045878405	0.7303949121932998	4050512
4052432	AI	a consensus-based multi-agent approach for information retrieval in internet	2006	6.729887786928818	0.5241968679746308	4052459
4056464	DB	empirical study of the gbc approach for mapping xml data to relations	2005	6.951511516724698	0.5204795316039962	4056491
4057436	DB	modeling and querying shapes in an image database system	1999	7.16008682394858	0.3073378970946859	4057463
4057807	Vision	intelligent monitoring and activity interpretation framework - int 3 -horus ontological model.	2012	7.273901474643747	0.016582541758088917	4057834
4064423	Theory	system reliability theory: models and statistics methods (arnljot høyland and marvin rausand)	1996	7.265146664113521	-0.1930403374595108	4064450
4065063	DB	tvorba znalostní databáze pro světelnou techniku s možností expertního zpracování dotazů ; creation of knowledge database for lighting technology with the possibility of expert query processing	2014	6.909787312616506	0.4769537296855378	4065090
4066782	DB	a framework for constraint management in vlsi design database applications	2004	7.104342534831427	0.5455859914595351	4066809
4071261	DB	modelling cics systems: the performance impact of mro implementations and data base considerations	1986	6.9962526174771815	0.1170881121972416	4071288
4075239	DB	model and architecture of distributed data base sharing systems associated with knowledge-information processing systems	1981	7.0767605506560525	-0.13675258952648695	4075266
4075890	NLP	fuzzy based production coordination in one-of-a-kind production	1993	6.8600926580652635	-0.1064518396215105	4075917
4076436	SE	design and development of industrial measurement system - architecture and software	1994	6.495080284153827	0.5278449140824695	4076463
4078887	DB	novel xml data model and query engine	2005	7.188860519742264	0.5676778591760773	4078914
4079823	Theory	identity implies trust in distributed systems - a novel approach - (extended abstract)	2013	7.271062214864648	0.17558779394291674	4079850
