id	area	title	year	x	y	ix
2518251	Arch	analyzing the effects of compiler optimizations on application reliability	2011	-3.637919107505653	13.945164000775463	2518278
2519413	Arch	a novel physiological features-assisted architecture for rapidly distinguishing health problems from hardware trojan attacks and errors in medical devices	2017	-5.027076023475923	14.796016400247108	2519440
2520559	EDA	3d vlsi: a scalable integration beyond 2d	2015	-4.167847671641273	13.343409332240913	2520586
2521244	Arch	mswat: low-cost hardware fault detection and diagnosis for multicore systems	2009	-3.6283850023670445	14.200427707991707	2521271
2523336	EDA	designing optimized pipelined global interconnects: algorithms and methodology impact	2005	-3.5389058235617266	14.064342866221928	2523363
2523347	Arch	a fault tolerant cache system of automotive vision processor complying with iso26262	2016	-4.5722012075237215	14.002129873891649	2523374
2524994	Vision	practical optical fault injection on secure microcontrollers	2011	-5.1534545127517735	14.871728576499072	2525021
2525774	Security	scan attacks and countermeasures in presence of scan response compactors	2011	-5.049609124038236	15.023169607133944	2525801
2525930	EDA	kcad: kinetic cyber-attack detection method for cyber-physical additive manufacturing systems	2016	-4.873089202419804	14.846335766382275	2525957
2527209	EDA	secure scan techniques: a comparison	2006	-5.050007762885783	14.93665344282202	2527236
2527479	ECom	an on-line bisted sram ip core	1999	-4.082861794718425	13.23981433427254	2527506
2527767	Arch	newcache: secure cache architecture thwarting cache side-channel attacks	2016	-4.5187491317719175	15.0418474172559	2527794
2529954	Arch	characterizing microarchitecture soft error vulnerability phase behavior	2006	-3.570517855673472	14.0334941141099	2529981
2530529	SE	one bit is (not) enough: an empirical study of the impact of single and multiple bit-flip errors	2017	-4.3554883773315565	13.833862368324068	2530556
2530610	EDA	the holy grail of holistic low-power design	2006	-3.9260567368213333	13.547438897925634	2530637
2531055	EDA	interconnect opportunities for gigascale integration	2003	-4.4361065601983185	13.38180918908185	2531082
2531386	Arch	golden ic free methodology for hardware trojan detection using symmetric path delays	2016	-5.134856147274551	14.688930190359935	2531413
2532227	EDA	energy-efficient design in fdsoi	2018	-4.9256056471661545	13.55258180920517	2532254
2532469	EDA	sequence-aware watermark design for soft ip embedded processors	2016	-4.8986258639036055	14.311246804492132	2532496
2533742	Security	experiences with software-based soft-error mitigation using an codes	2014	-4.708296714084915	15.057993586065106	2533769
2534016	EDA	mems optically reconfigurable gate array	2009	-5.044379560866123	13.645135164859193	2534043
2534323	AI	a survey of hardware trojan threat and defense	2016	-4.758948572167834	14.810914743502726	2534350
2534368	EDA	low power design techniques	2015	-4.572790129101125	13.587060736199506	2534395
2534755	EDA	evolution of cmos technology at 32 nm and beyond	2007	-4.1816016412207695	13.52908644070184	2534782
2535118	Embedded	fault-tolerant algebraic architecture for radiation induced soft-errors	2012	-4.086060152338361	13.624187583119507	2535145
2535295	EDA	on distribution and impact of fault effects at real-time kernel and application levels	2012	-3.8416311417125786	13.527782306908412	2535322
2535907	EDA	local condition monitoring in integrated circuits using a set of kolmogorov-smirnov tests	2012	-5.026826650797526	13.894228761781134	2535934
2535990	Arch	the alarms project: a hardware/software approach to addressing parameter variations	2011	-4.656613103215099	14.045751062934793	2536017
2537508	OS	from single core to multi-core to many core: are we ready for a new exponential?	2006	-3.827428867748945	13.213179383262506	2537535
2537677	EDA	low-power analog signal processing	2012	-5.020653309679452	13.705239340731394	2537704
2537724	EDA	fault tolerance and reliability in field-programmable gate arrays	2010	-4.290432648408763	13.342648863379749	2537751
2538149	Robotics	rr4dsn: reconfigurable receiver for deepwater sensor nodes	2018	-4.401807625224532	13.784320656167536	2538176
2538764	EDA	introduction to the special issue on the ieee 2011 custom integrated circuits conference	2012	-3.5997304283383365	13.311669713125859	2538791
2538956	EDA	soft error susceptibility analysis methodology of hls designs in sram-based fpgas	2017	-4.03083845545847	13.468520302837412	2538983
2539478	EDA	fmer: a hybrid configuration memory error recovery scheme for highly reliable fpga socs	2016	-4.232605599683703	13.708389551359884	2539505
2539811	Crypto	a survey of techniques for improving security of non-volatile memories	2018	-4.033076386285738	14.722327857674115	2539838
2540077	EDA	a switch architecture and signal synchronization for gals system-on-chips	2004	-3.815287083467227	13.506125715106506	2540104
2541164	EDA	design and evaluation of reliability-oriented task re-mapping in mpsocs using time-series analysis of intermittent faults	2016	-3.7693189806343295	13.909462781760276	2541191
2542025	EDA	computation as estimation: a general framework for robustness and energy efficiency in socs	2010	-4.891311718840603	13.295167036895714	2542052
2542151	EDA	designing layout-timing independent quantum-dot cellular automata (qca) circuits by global asynchrony	2007	-4.454267829210544	13.38261033037608	2542178
2542671	EDA	impact of deep submicron technology on dependability of vlsi circuits	2002	-4.553964181160684	13.3604376447837	2542698
2542742	Arch	dynamic docking architecture for concurrent testing and peak power reduction	2016	-3.4185073519261087	13.223078266515154	2542769
2542771	Arch	estimating soft processor soft error sensitivity through fault injection	2015	-3.878586220973786	13.492854283858533	2542798
2543123	EDA	sstkr: secure and testable scan design through test key randomization	2011	-5.0981286157610475	15.027913492985013	2543150
2543170	EDA	cross-layer resilient system design	2013	-4.364780025491622	13.472574173974724	2543197
2544708	Embedded	predictable, system-level fault tolerance in composite	2013	-4.103350051607654	13.655665236301756	2544735
2545653	EDA	optimization of reliability and power consumption in systems on a chip	2005	-3.860068886416835	14.242496838098118	2545680
2546120	Security	reverse engineering flash eeprom memories using scanning electron microscopy	2016	-5.2442762975429895	14.752073220252809	2546147
2546888	EDA	selectively breaking data dependences to improve the utilization of idle cycles in algorithm level re-computing data paths	2003	-4.00797853237861	14.014097180089571	2546915
2547315	Mobile	rf-mems for wireless communications	2008	-4.006868478809613	13.466499048549993	2547342
2547658	EDA	a scalable circuit-architecture co-design to improve memory yield for high-performance processors	2010	-5.102477745606172	13.784874569762652	2547685
2548137	Arch	characterizing the l1 data cache's vulnerability to transient errors in chip-multiprocessors	2011	-3.3892693513547947	14.350668111934745	2548164
2549025	EDA	a protection mechanism for intellectual property rights (ipr) in fpga design environment	2003	-4.898775838362999	14.9887362963849	2549052
2549192	EDA	modular fault injector for multiple fault dependability and security evaluations	2011	-4.793828117266586	14.776264289114039	2549219
2549389	EDA	digital signature proposal for mixed-signal circuits	2000	-5.188781750491249	14.735919288882206	2549416
2549944	HPC	constructing spare sharing networks for reliability enhancement of scalable systems	2013	-4.050028236848779	14.058018331842856	2549971
2550079	EDA	seu fault classification by fault injection for an fpga in the space instrument sophi	2017	-4.1880584908220015	13.324719678935347	2550106
2550706	EDA	a reconfigurable pla architecture for nanomagnet logic	2012	-5.074163791198608	13.347865880990751	2550733
2551837	Arch	a short survey at the intersection of reliability and security in processor architecture designs	2018	-4.7765345847562966	14.81059693907233	2551864
2551847	EDA	achieving low-overhead fault tolerance for parallel accelerators with dynamic partial reconfiguration	2014	-4.327525342267848	13.485801613509945	2551874
2552567	Arch	alternative cmos or alternative to cmos?	2001	-4.820486120154174	13.355047454012807	2552594
2554103	HPC	a variability-aware analysis and design guideline for write and read operations in crosspoint stt-mram arrays	2018	-5.150641988692751	13.87846666624041	2554130
2555014	EDA	guest editors' introduction: managing uncertainty through postfabrication calibration and repair	2010	-5.128633921711759	13.41426356369993	2555041
2556008	EDA	error control schemes for on-chip communication links: the energy-reliability tradeoff	2005	-3.71439942499702	14.552320977177699	2556035
2556428	Arch	core tunneling: variation-aware voltage noise mitigation in gpus	2016	-4.446268013306224	14.26670400258745	2556455
2556860	EDA	information flow tracking in analog/mixed-signal designs through proof-carrying hardware ip	2017	-5.018247572502084	14.967553374855195	2556887
2558525	EDA	photonic network-on-chip architectures using multilayer deposited silicon materials for high-performance chip multiprocessors	2011	-3.5616740493613963	14.452574215637028	2558552
2558667	Embedded	schedulability analysis for processors with aging-aware autonomic frequency scaling	2012	-4.250739700083772	14.070355982780464	2558694
2559205	EDA	reliability-aware resource allocation and binding in high-level synthesis	2016	-4.525694036529365	13.571135649406779	2559232
2559541	OS	fine-grained self-healing hardware for large-scale autonomic systems	2003	-3.8216714219413297	13.533962576753988	2559568
2560962	EDA	area-energy tradeoffs of logic wear-leveling for bti-induced aging	2016	-5.292353723462405	13.9029286283552	2560989
2561330	Security	fortis: a comprehensive solution for establishing forward trust for protecting ips and ics	2016	-4.969570903771856	14.909897517072249	2561357
2561863	EDA	enabling side channel secure fsms in the presence of low power requirements	2014	-5.293292251457539	15.097298911416285	2561890
2562166	EDA	an effective approach based on partial duplication for reducing soft error rate in sram-based fpga	2014	-4.83244152690226	13.3577658039469	2562193
2562217	EDA	a watermarking system for ip protection by a post layout incremental router	2005	-5.143232126000168	14.993172219328216	2562244
2562813	Security	how to build hardware trojans	2014	-4.64981598501692	14.798706909561353	2562840
2563189	EDA	thruchip interface (tci) for 3d networks on chip	2011	-4.56221090991636	13.495272929281935	2563216
2563928	Security	system-on-chip platform security assurance: architecture and validation	2018	-4.748478946666708	14.86907039712196	2563955
2564023	EDA	an error correction scheme through time redundancy for enhancing persistent soft-error tolerance of cgras	2015	-3.8522856490238047	14.099349535494829	2564050
2565909	Embedded	when processors get old: evaluation of bti and hci effects on performance and reliability	2013	-5.280864984128795	13.360240373437936	2565936
2566543	EDA	built-in self test power and test time analysis in on-chip networks	2015	-5.246138236954794	13.212341533078218	2566570
2567716	Arch	skewed redundancy	2008	-3.648900779560358	14.253381200944805	2567743
2567828	EDA	security and privacy threats to on-chip non-volatile memories and countermeasures	2016	-5.2726420445463535	14.967164661400256	2567855
2568977	Arch	clb-based detection and correction of bit-flip faults in sram-based fpgas	2007	-4.588256770588356	13.412682505179449	2569004
2570140	EDA	neutron ser characterization of microprocessors	2005	-4.947100940213297	13.388744761314928	2570167
2570962	EDA	review of cmos integrated circuit technologies for high-speed photo-detection	2017	-3.611510558930772	14.106840765912972	2570989
2571786	EDA	invited: who is the major threat to tomorrow's security? you, the hardware designer	2016	-4.911143860123928	14.970563104511175	2571813
2572192	EDA	defect tolerance in nanodevice-based programmable interconnects: utilization beyond avoidance	2013	-4.618331208625559	13.47410149319584	2572219
2573106	Arch	csst: preventing distribution of unlicensed and rejected ics by untrusted foundry and assembly	2014	-4.8600175925027465	14.835055473966761	2573133
2573758	EDA	programmable stochastic computing: embracing errors in architecture and design of processors and applications	2011	-4.2646570774954595	13.547917964509981	2573785
2573844	EDA	a software-based self-test and hardware reconfiguration solution for vliw processors	2010	-4.13379642979648	13.353448349386456	2573871
2574467	EDA	holographic scrubbing technique for a programmable gate array	2015	-4.554947745322546	13.462229636993252	2574494
2574666	EDA	ic security evaluation against fault injection attack based on fpga emulation	2016	-5.163020385881403	15.008334923563918	2574693
2574808	HPC	panels: panel session i: resiliency in extreme scale high performance computing systems and applications	2016	-3.5810488739112043	14.009263839412705	2574835
2575730	EDA	a new asic structure with self-repair capability using field-programmable nanowire interconnect architecture	2018	-4.8739302984967825	13.397403888370235	2575757
2576411	OS	experimental validation of the suitability of virtualization-based replication for fault tolerance in real-time control of electric grids	2018	-3.7020922845497233	13.760292629856535	2576438
2576606	Arch	nbti alleviation on finfet-made gpus by utilizing device heterogeneity	2015	-3.615338782429728	14.347277788532574	2576633
2576794	EDA	integration technology for ferroelectric memory devices	2003	-5.286692447276996	13.951387339993	2576821
2577325	EDA	fingerprinting methods for intellectual property protection using constraints in circuit partitioning	2016	-4.956625669471124	14.679434509206722	2577352
2577802	EDA	impact of process and temperature variations on network-on-chip design exploration	2008	-5.2625207694757705	13.327982085944653	2577829
2578279	Arch	revisiting software-based soft error mitigation techniques via accurate error generation and propagation models	2016	-4.1778103517919085	13.537464156294364	2578306
2578990	Arch	automatic obfuscated cell layout for trusted split-foundry design	2015	-5.141418244574939	14.767860216604099	2579017
2579494	EDA	enaam: energy-efficient anti-aging for on-chip video memories	2015	-4.800217998163567	14.228239934858694	2579521
2579537	Security	hardware obfuscation using strong pufs	2018	-5.090147048038399	15.021843397569931	2579564
2580031	EDA	reversible computation	2015	-4.181049927183434	13.240463322740624	2580058
2580166	Arch	diverse compiling for microprocessor fault detection in temporal redundant systems	2015	-3.8914074224951993	13.361913461449676	2580193
2580454	Arch	computing architectural vulnerability factors for address-based structures	2005	-3.84519140430184	14.03614133627346	2580481
2582089	EDA	detection of ijtag attacks using ldpc-based feature reduction and machine learning	2018	-4.88390890220467	14.69165420874786	2582116
2582256	Arch	remora: a hybrid low-cost soft-error reliable fault tolerant architecture	2017	-4.061980906783826	13.978881360286314	2582283
2583971	EDA	determination of on-chip temperature gradients on reconfigurable hardware	2012	-4.8838953937152265	13.826251589031811	2583998
2584598	Arch	online test of control flow errors: a new debug interface-based approach	2016	-3.6621485333433497	13.47843466599459	2584625
2586167	EDA	a low cost low power quaternary lut cell for fault tolerant applications in future technologies	2009	-5.222521641112767	13.444679704515586	2586194
2586785	Arch	memristive crossbar memory lifetime evaluation and reconfiguration strategies	2018	-4.766744047923608	13.698475270056255	2586812
2587123	EDA	design challenges for mobile communication devices	2006	-5.126995478574542	13.821983627737126	2587150
2587706	HPC	lithography till the end of moore's law	2012	-4.202513534382251	13.306825003485752	2587733
2587931	Arch	an accuracy tunable non-boolean co-processor using coupled nano-oscillators	2017	-4.325682105245811	13.740501329451424	2587958
2588176	Arch	shannon-inspired statistical computing for the nanoscale era	2019	-4.163507545327061	13.385646430951686	2588203
2588703	EDA	improving ser immunity of combinational logic using combinations of spatial and temporal checking	2008	-5.2586248298210965	13.390893140827794	2588730
2588825	Logic	the axiom of choice in topology	1983	-3.388711918053373	14.377889002129251	2588852
2589366	EDA	online reconfigurable self-timed links for fault tolerant noc	2007	-4.401059704798336	13.900450242694086	2589393
2589866	EDA	resiliency-aware scheduling for reconfigurable vliw processors	2012	-3.7113735854361893	13.676631410718214	2589893
2590249	Arch	a 48nm 32gb 8-level nand flash memory with 5.5mb/s program throughput	2009	-3.4253932729836856	13.806292122061913	2590276
2590499	EDA	dmr +: an efficient alternative to tmr to protect registers in xilinx fpgas	2016	-4.832153736318526	13.566479307468786	2590526
2590760	EDA	adaptive thermoregulation for applications on reconfigurable devices	2007	-4.830957941110129	13.893703380686285	2590787
2592060	Arch	redesign for untrusted gate-level netlists	2016	-4.966586476259909	14.678466138759225	2592087
2592435	EDA	dynamic variability monitoring using statistical tests for energy efficient adaptive architectures	2014	-4.453549016765975	13.93270604161725	2592462
2592969	EDA	a system-level methodology for fully compensating process variability impact of memory organizations in periodic applications	2005	-5.219155869257183	13.347653490034421	2592996
2593307	EDA	workload- and instruction-aware timing analysis - the missing link between technology and system-level resilience	2014	-4.4152245977733795	13.59698372613218	2593334
2593843	EDA	power and performance evaluation of globally asynchronous locally synchronous processors	2002	-4.238179718012912	14.161006280131335	2593870
2594231	Arch	facelift: hiding and slowing down aging in multicores	2008	-4.670806290927335	14.078836282035338	2594258
2594376	Embedded	nanofabric topologies and reconfiguration algorithms to support dynamically adaptive fault tolerance	2006	-3.771945839686688	14.017542314464292	2594403
2594654	EDA	design and simulation of a quaternary memory cell based on a physical memristor	2016	-4.820740970083829	13.392574753280098	2594681
2594665	EDA	3d integration for energy efficient system design	2006	-3.6457840047500967	13.414449229858965	2594692
2595445	Logic	incorporating error detection and online reconfiguration into a regular architecture for the advanced encryption standard	2005	-5.255086715790465	14.930066840113962	2595472
2595453	EDA	joint crosstalk avoidance with multiple bit error correction coding technique for noc interconnect	2018	-3.5904771600118983	14.727129451916307	2595480
2595833	Arch	parity check for m-of-n delay insensitive codes	2013	-4.927251550882613	13.382051988183207	2595860
2596604	Arch	hardware and software techniques for heterogeneous fault-tolerance	2018	-3.976678421189749	13.901631890339258	2596631
2596733	Security	next-generation 10 gbaud module based on emerging sfp+ with host-based edc [topics in optical communications]	2007	-4.030805748565841	13.333174738596739	2596760
2600815	Embedded	test and repair of non-volatile commodity and embedded memories (nand flash memory)	2002	-4.556162939225692	13.888796894541596	2600842
2601319	EDA	steel: a technique for stress-enhanced standard cell library design	2008	-5.270962056440746	13.370196493223832	2601346
2601378	EDA	electrostatic discharge (esd) protection of rf integrated circuits	2012	-4.999548311541248	13.235668443511555	2601405
2601544	EDA	fram memory technology - advantages for low power, fast write, high endurance applications	2005	-3.881504486995157	13.585988541893153	2601571
2602265	EDA	security against hardware trojan attacks using key-based design obfuscation	2011	-5.038253332116335	14.60167745972472	2602292
2602878	DB	flash memories: successes and challenges	2008	-3.781677322491351	13.32799545260211	2602905
2604875	EDA	vlsi-soc: system-on-chip in the nanoscale era – design, verification and reliability	2016	-4.722110382914348	13.692172805741365	2604902
2606572	EDA	multi-bit transient fault control for noc links using 2d fault coding method	2016	-5.0305658021818935	13.736285220539475	2606599
2607251	Arch	an analysis of microarchitecture vulnerability to soft errors on simultaneous multithreaded architectures	2007	-3.534064615521193	14.166819203823804	2607278
2607390	Arch	techniques for efficient software checking	2007	-4.123228312594872	13.959871257523162	2607417
2607633	EDA	fpga-based failure mode testing and analysis for mlc nand flash memory	2017	-4.607887548205909	13.823730655148106	2607660
2608231	Security	on hardware trojan design and implementation at register-transfer level	2013	-4.958270255179018	14.706648710674644	2608258
2608945	Arch	new metrics for architectural level power performance evaluation	2000	-4.679727284656552	13.607805359918661	2608972
2609814	EDA	on securing scan design through test vector encryption	2018	-5.080360102922839	15.110753746260825	2609841
2609989	EDA	padded cache: a new fault-tolerance technique for cache memories	1999	-4.244330914077903	13.823087519765787	2610016
2610189	EDA	revisit sequential logic obfuscation: attacks and defenses	2017	-5.093168073863204	15.117379897230265	2610216
2610734	EDA	rsfq: what we know and what we don't	1996	-4.236882322157161	13.425618530353232	2610761
2611026	Arch	networks on chip (noc): interconnects of next generation systems on chip	2005	-3.5682106547699672	14.081840600792955	2611053
2615025	EDA	a gals router for asynchronous network-on-chip	2014	-4.1990629519768925	13.69680620285014	2615052
2615322	EDA	timing-error-tolerant network-on-chip design methodology	2007	-4.109151840343565	14.129356713534666	2615349
2615326	EDA	guest editors' introduction: reliability challenges in nano-cmos design	2009	-4.766427796312967	13.294195897622494	2615353
2615665	Arch	spatial and temporal thermal characterization of stacked multicore architectures	2012	-4.379018750655884	14.022039102534507	2615692
2617402	Arch	continuum computer architecture for exaflops computation	2001	-3.5263512375518538	13.269863350132642	2617429
2618323	NLP	recovery/serviceability system test improvements for the ibm es/9000 520 based models	1992	-3.998819950394204	13.270640955470851	2618350
2618621	Arch	non-invasive detection method for recycled flash memory using timing characteristics †	2018	-5.269811752497762	14.11113938916534	2618648
2619303	Arch	cidra: a cache-inspired dram resilience architecture	2015	-4.426604420531595	14.173600932457507	2619330
2619920	EDA	detecting hardware trojans in unspecified functionality through solving satisfiability problems	2017	-4.6463691900958635	14.161440720882199	2619947
2620290	EDA	coping with variations through system-level design	2009	-5.076876458295204	13.437945304150885	2620317
2620442	Arch	a low-latency dmr architecture with efficient recovering scheme exploiting simultaneously copiable sram	2014	-4.035565825044498	14.205568425479338	2620469
2620486	Arch	cross-layer energy and performance evaluation of a nanophotonic manycore processor system using real application workloads	2012	-3.5487549513507126	14.026836357333822	2620513
2620726	EDA	clear: cross-layer exploration for architecting resilience: combining hardware and software techniques to tolerate soft errors in processor cores	2016	-3.968129834949568	14.158778939147327	2620753
2621702	EDA	process variation in near-threshold wide simd architectures	2012	-4.234006430061026	14.094298631784914	2621729
2623256	EDA	power delivery design for 3-d ics using different through-silicon via (tsv) technologies	2011	-4.191182708335426	14.163938664437252	2623283
2623523	Arch	on the impact of performance faults in modern microprocessors	2013	-3.8211214444932433	13.570755100493678	2623550
2623524	EDA	lowering power consumption in clock by using globally asynchronous locally synchronous design style	1999	-4.270299547175264	13.686274758887341	2623551
2623530	EDA	device considerations for nanophotonic cmos global interconnects	2012	-4.876199891000223	13.960657847492346	2623557
2624078	EDA	clock clustering and io optimization for 3d integration	2015	-3.3873918212727814	14.224088955282994	2624105
2626027	Arch	content-aware low-power configurable aging mitigation for sram memories	2016	-4.913651689140535	14.17496521286541	2626054
2626349	EDA	provably-secure logic locking: from theory to practice	2017	-5.1014353719459145	14.966519916572564	2626376
2626390	Security	trustworthy hardware [scanning the issue]	2014	-4.740209000015233	14.839165719049465	2626417
2626896	EDA	a low-cost fault tolerant solution targeting to commercial fpga devices	2012	-4.383743698197524	13.327103700011715	2626923
2627933	EDA	statistical framework for designing on-chip thermal sensing infrastructure in nanoscale systems	2014	-4.8748862885060396	14.019146791076205	2627960
2629677	Arch	timing for virtual tmr in logic circuits	2014	-5.047679423308728	13.40132127722694	2629704
2629912	Arch	fehlerlokalisierung in prozessorinternen kommunikationsnetzen für vielkern-prozessoren	2014	-3.84287808341304	14.004086842163488	2629939
2631102	Embedded	virtual timing isolation for mixed-criticality systems	2018	-3.498482814625252	13.70149153835531	2631129
2632772	Arch	transistor reliability characterization and modeling of the 22ffl finfet technology	2018	-5.05809500076484	13.340864557972925	2632799
2633232	HPC	methods for fault tolerance in networks-on-chip	2013	-3.553413580830977	13.74898013634274	2633259
