id	area	title	year	x	y	ix
3202756	DB	what to lock?: functional and parametric locking	2017	-5.1129444375584026	15.038328833049405	3202783
3204263	EDA	automated identification of performance bottleneck on embedded systems for design space exploration	2013	-4.2274600153063675	14.97781311436208	3204290
3204909	EDA	a distributed fifo scheme for on chip communication	2005	-5.063738100706684	14.015349469715703	3204936
3205261	Arch	a watchdog processor to detect data and control flow errors	2003	-3.8170044274291337	13.283888708306625	3205288
3205274	Arch	computing and minimizing cache vulnerability to transient errors	2009	-3.96005299194726	13.877714108264641	3205301
3205893	EDA	study on puf based secure protection for ic design	2016	-5.024393455740663	14.942467154106035	3205920
3208045	EDA	asynchronous 1r-1w dual-port sram by using single-port sram in 28nm utbb-fdsoi technology	2017	-4.101773984068238	14.056677280177885	3208072
3208335	HPC	enabling flexible datacenter interconnect networks with wdm silicon photonics	2014	-3.676780832574224	14.01871060170907	3208362
3208497	Robotics	raise your game for split manufacturing: restoring the true functionality through beol	2018	-5.082117053093748	14.5658850778443	3208524
3209952	Arch	swizzle-switch networks for many-core systems	2012	-5.06473697380083	13.894833806715152	3209979
3210016	EDA	leveraging 3d technologies for hardware security: opportunities and challenges	2016	-4.989646674729343	14.855874930252133	3210043
3210770	Arch	static analysis of register file vulnerability	2011	-3.675739641755132	13.94798059252054	3210797
3211085	EDA	reliability of key technologies in 3d integration	2013	-4.8534995404884835	13.468085231860972	3211112
3211450	Arch	the changing impact of semiconductor technology on processor architecture	2007	-3.5772327432973183	13.236357617684545	3211477
3211477	Embedded	the study of the embedded encryption technique in the digital television	2008	-4.743878775162655	15.023174863148302	3211504
3211512	Embedded	hybrid soft error detection by means of infrastructure ip cores [soc implementation]	2004	-4.001862104950241	13.254386103333516	3211539
3212323	EDA	a cross-layer reliability design methodology for efficient, dependable wireless receivers	2014	-4.3482025867673455	14.046600866427227	3212350
3213039	Security	trusted integrated circuits: the problem and challenges	2014	-4.824610441323044	14.859593759662724	3213066
3213064	Robotics	quadruple adaptive redundancy with fault detection estimator	2017	-4.369130547180301	13.297732123679138	3213091
3213066	Arch	non-fpga-based field-programmable self-repairable (fpsr) microarchitecture	2008	-4.138225654578047	13.557683532393213	3213093
3214133	NLP	guest editorial arc 2009	2010	-4.11637141972981	13.424415574334786	3214160
3214142	EDA	property coverage analysis based trustworthiness verification for potential threats from eda tools	2016	-4.9020671864011485	14.707139144630963	3214169
3215262	EDA	a hardware-trojans identifying method based on trojan net scoring at gate-level netlists	2015	-4.736106124808125	14.616346081221067	3215289
3215656	EDA	building trusted golden models-free hardware trojan detection framework against untrustworthy testing parties using a novel clustering ensemble technique	2018	-4.998637136950316	14.879892904775513	3215683
3215825	Arch	a model of soft error effects in generic ip processors	2005	-3.766988153942888	13.397235572830482	3215852
3216908	Arch	self-adapting resource escalation for resilient signal processing architectures	2014	-3.7080959698414326	13.85312481569782	3216935
3219123	EDA	test algorithms for ecc-based memory repair in nanotechnologies	2012	-4.765484906870626	13.279336295585306	3219150
3219209	EDA	a new logic encryption strategy ensuring key interdependency	2017	-5.005462550271389	14.95249530564165	3219236
3219969	Arch	an adaptive routing algorithm to improve lifetime reliability in nocs architecture	2016	-4.531223321268205	14.242463229324384	3219996
3220026	Vision	hardware-trojans rank: quantitative evaluation of security threats at gate-level netlists by pattern matching	2016	-4.781284427696849	14.831747141920285	3220053
3220215	EDA	self-test techniques for crypto-devices	2010	-5.2308429848133615	14.67177347831052	3220242
3221051	HCI	low power advanced digital technologies to enable internet of things	2016	-3.7731450431552	13.274624397884505	3221078
3222666	EDA	algorithm level fault tolerance: a technique to cope with long duration transient faults in matrix multiplication algorithms	2008	-4.7027158041007375	13.403827625129692	3222693
3223618	EDA	the eda challenges in the dark silicon era	2014	-3.791504204769613	13.530693556208009	3223645
3223814	EDA	"""novel nonvolatile memory hierarchies to realize """"normally-off mobile processors"""""""	2014	-4.3167614078288254	13.94529541920383	3223841
3223821	Arch	low-cost memory fault tolerance for iot devices	2017	-4.313621501395497	13.953098467870104	3223848
3224592	EDA	transient fault tolerant qdi interconnects using redundant check code	2013	-4.9473564160464365	13.660526081362246	3224619
3225622	EDA	energy-efficient accelerator architecture for stereo image matching using approximate computing and statistical error compensation	2014	-4.138040309544105	13.78368768314135	3225649
3225789	Arch	effectiveness of hybrid recovery techniques on parametric failures	2013	-5.123499120255858	13.954715011010986	3225816
3226120	EDA	correlating power efficiency and lifetime to programming strategies in rram-based fpgas	2018	-4.788025796728814	13.752480261145296	3226147
3226143	EDA	a low-cost see mitigation solution for soft-processors embedded in systems on pogrammable chips	2009	-3.3844647808792514	13.324721488890631	3226170
3226278	HPC	harnessing performance variability: a hpc-oriented application scenario	2015	-3.5188511335313137	13.841485712066028	3226305
3226694	EDA	on the field design bug tolerance on a multi-core processor using fpga	2017	-4.360726826034963	13.417479803250053	3226721
3226842	Arch	an overview of nonvolatile emerging memories— spintronics for working memories	2016	-4.427161809944916	13.661604264236932	3226869
3227117	EDA	online fault tolerance for fpga logic blocks	2007	-4.284713650264487	13.251717929296332	3227144
3227454	EDA	improved test pattern generation for hardware trojan detection using genetic algorithm and boolean satisfiability	2015	-5.0564447247276565	14.543821293076034	3227481
3227546	HPC	mitigating soft errors in highly associative cache with cam-based tag	2005	-4.484643325336179	13.674362477802193	3227573
3228380	EDA	security-aware task scheduling using untrusted components in high-level synthesis	2018	-3.626886956771628	14.517514704070015	3228407
3228471	EDA	wear-out analysis of error correction techniques in phase-change memory	2014	-5.109617368575423	13.988069575742726	3228498
3229427	Arch	archshield: architectural framework for assisting dram scaling by tolerating high error rates	2013	-4.402828763814413	14.184238335115015	3229454
3229755	EDA	retrodmr: troubleshooting non-deterministic faults with retrospective dmr	2017	-3.579235719816669	13.867827474192769	3229782
3231775	Embedded	reliability concerns in embedded system designs	2006	-4.084366845925927	13.946077335907574	3231802
3232818	Arch	nanotechnology and the end of moore's law?	2005	-4.777129455269277	13.233392910214624	3232845
3232822	OS	news track	2008	-3.6358108277762384	13.271405009713295	3232849
3233855	EDA	a practical split manufacturing framework for trojan prevention via simultaneous wire lifting and cell insertion	2018	-5.153195328810108	14.589959331551226	3233882
3234653	Security	defeating hardware trojan in microprocessor cores through software obfuscation	2018	-4.926722445801205	14.886803336470996	3234680
3235380	Security	an efficient technique to reverse engineer minterm protection based camouflaged circuit	2018	-5.062614140289036	14.94516480399863	3235407
3235428	Embedded	reconfiguration control networks for fpga-based tmr systems with modular error recovery	2018	-3.7809588798780833	13.827230520798205	3235455
3235550	Embedded	transparent structural online test for reconfigurable systems	2012	-3.7868266932099286	13.615742980066102	3235577
3236283	EDA	design exploration of emerging nano-scale non-volatile memory	2014	-4.708626334037716	13.245464644785203	3236310
3237323	ML	exploiting component dependency for accurate and efficient soft error analysis via probabilistic graphical models	2015	-4.421269087161729	13.227734545806642	3237350
3237757	EDA	a low overhead error confinement method based on application statistical characteristics	2016	-4.446211267247948	13.7463564400563	3237784
3238381	EDA	trojan detection via delay measurements: a new approach to select paths and vectors to maximize effectiveness and minimize cost	2013	-5.146374534096762	14.248391737038665	3238408
3238448	EDA	fpga architecture for standby power management	2005	-3.7483411258461565	13.67808076980806	3238475
3238573	EDA	a fault-tolerant system-on-programmable-chip based on domain-partition and blind reconfiguration	2010	-4.147542577102145	13.457179034070133	3238600
3238751	Arch	identifying and predicting timing-critical instructions to boost timing speculation	2011	-4.097136346775092	14.227505149916327	3238778
3238884	Arch	a configurable and strong ras solution for die-stacked dram caches	2014	-3.8680041619770313	14.013632337715904	3238911
3239261	EDA	parity-based soft error detection with software-based retry vs. triplication-based soft error correction - an analytical comparison on a flash-based fpga architecture	2015	-4.560530998368763	13.610242403461498	3239288
3239346	EDA	design and implementation of a gals adapter for anoc based architectures	2009	-3.382477315044248	13.379024347507755	3239373
3239391	Embedded	multi-mechanism reliability modeling and management in dynamic systems	2008	-5.079803065119326	13.833232360264214	3239418
3239686	HPC	experimental results on the error detection capability of a concurrent test architecture for massively-parallel computers	1992	-3.3706918519239997	13.917119624195607	3239713
3240731	EDA	active defense against counterfeiting attacks through robust antifuse-based on-chip locks	2014	-5.0812393441114	14.872497089048192	3240758
3240789	Arch	mb-fica: multi-bit fault injection and coverage analysis	2014	-4.2460737391758165	13.464779813762169	3240816
3241137	EDA	high speed mosfet circuits using advanced lithography	1976	-4.964063574377326	13.479423464391074	3241164
3242686	EDA	selective hardening: toward cost-effective error tolerance	2011	-5.262962799429896	13.322019040880434	3242713
3244985	EDA	integrating physical level design and high level synthesis for simultaneous multi-cycle transient and multiple transient fault resiliency of application specific datapath processors	2016	-4.801580220478072	13.587464922980072	3245012
3245316	EDA	frontside versus backside laser injection: a comparative study	2016	-5.195921817662331	14.76017508527972	3245343
3246543	Security	scan chain based ip fingerprint and identification	2017	-5.060242078764584	14.975248683867555	3246570
3247237	Arch	near-threshold computing: reclaiming moore's law through energy efficient integrated circuits	2010	-4.954529149329346	13.910245999180287	3247264
3247924	EDA	evaluating low-cost fault-tolerance mechanism for microprocessors on multimedia applications	2001	-4.052334171529593	13.82920372416477	3247951
3249016	Crypto	why current secure scan designs fail and how to fix them?	2017	-5.124654114679681	15.063721851614735	3249043
3249329	EDA	on-chip optical interconnect for reduced delay uncertainty	2007	-4.362521491773413	13.76447648208041	3249356
3249525	EDA	reshaping eda for power	2003	-4.056185480027446	13.282145286027994	3249552
3251040	HPC	iss: an iterative scrubbing strategy for improving memory reliability against mbu	2016	-4.620687953362915	14.065055675173754	3251067
3251229	Robotics	color configuration method for an optically reconfigurable gate array	2013	-5.075055265105551	13.548504170938973	3251256
3252543	Security	hardware security of ce devices [hardware matters]	2017	-4.80738997561378	14.852947846268911	3252570
3252645	EDA	rtl hardware ip protection using key-based control and data flow obfuscation	2010	-5.043614620900313	14.963376042200347	3252672
3252864	EDA	vast: virtualization-assisted concurrent autonomous self-test	2008	-3.704756686689132	13.364158568499509	3252891
3253140	Theory	design-for-security vs. design-for-testability: a case study on dft chain in cryptographic circuits	2014	-5.1660617623031495	15.114603545132113	3253167
3253493	EDA	low power circuit optimization for iot	2017	-3.4793135410831613	14.069955076132374	3253520
3253576	EDA	asynchronous links for nanonets	2007	-5.178608627256585	13.2419785068409	3253603
3254086	Arch	design of wavelength division multiplexed networks for delay-bound multicasting	1999	-4.147929429446683	13.63692774754518	3254113
3255416	Arch	exploring variation-aware fault-tolerant cache under near-threshold computing	2016	-4.258904677018622	14.268184496235445	3255443
3255567	Arch	reconfigurable pufs for fpga-based socs	2014	-4.9400970595876	14.030339168805922	3255594
3255788	Arch	an event-guided approach to reducing voltage noise in processors	2009	-4.829366983203399	14.036249567483257	3255815
3255984	EDA	using randomization to cope with circuit uncertainty	2009	-4.545091567658248	13.52456780419476	3256011
3256419	Arch	picoserver - building a compact energy efficient multiprocessor	2008	-3.3703190526107147	13.828250861181393	3256446
3257384	EDA	a new approach for root-causing attacks on digital microfluidic devices	2016	-4.806181275200326	14.823733602261706	3257411
3257797	Visualization	free-space interconnects for high-performance optoelectronic switching	1998	-3.901008584585395	13.772752905244104	3257824
3257839	EDA	a similarity based circuit partitioning and trimming method to defend against hardware trojans	2015	-5.038044726858946	14.869963681458998	3257866
3257912	Arch	validation of hardware error recovery mechanisms for the sparc64 v microprocessor	2008	-4.405209796928734	13.504346230152288	3257939
3258508	EDA	compiler-directed instruction duplication for soft error detection	2005	-3.876354616115037	13.858106330853932	3258535
3258636	Arch	online diagnosis of hard faults in microprocessors	2007	-4.202056234997415	13.65115064478312	3258663
3258852	EDA	a standardized knobs and monitors rtl2rtl insertion methodology for fine grain soc tuning	2009	-4.499716435095683	13.30174769341836	3258879
3259094	SE	using single error correction codes to protect against isolated defects and soft errors	2013	-4.879485601778789	13.556073590913995	3259121
3259746	EDA	a probe-based seu detection method for sram-based fpgas	2017	-4.3577603429271905	13.544337198239974	3259773
3259771	Arch	eliminating voltage emergencies via software-guided code transformations	2010	-4.157309407819026	14.280333881855462	3259798
3259873	Embedded	keynote: “design space exploration and run-time resource management in the embedded multi-core era”	2012	-3.607941163889586	13.754501741414211	3259900
3260143	EDA	performance analysis based on density evolution on fault erasure belief propagation decoder	2016	-4.407179842252175	14.308982523214658	3260170
3260893	EDA	watermarking for ip protection through template substitution at logic synthesis level	2007	-5.050276602789429	14.77877762633459	3260920
3263168	Networks	rf mems and nems technology, devices, and applications	2005	-4.055689634330761	13.385825521333018	3263195
3263695	Arch	free-p: protecting non-volatile memory against both hard and soft errors	2011	-3.7194980747851365	14.343734841154726	3263722
3263871	Embedded	flash correct-and-refresh: retention-aware error management for increased flash memory lifetime	2012	-5.006163099980207	14.21990851194458	3263898
3264877	EDA	shadow attacks on meda biochips	2018	-4.715619364257714	14.812120291627505	3264904
3267735	EDA	analysis of power management strategies for a large-scale soc platform in 65nm technology	2008	-4.998134701263432	13.298335568283546	3267762
3268295	EDA	effective usage of redundancy to aid neutralization of hardware trojans in integrated circuits	2017	-5.076446054633504	14.723706258669571	3268322
3268512	Arch	leveraging access locality for the efficient use of multibit error-correcting codes in l2 cache	2009	-4.548799102783929	14.006609116644778	3268539
3268756	Security	trustworthy firmware update for internet-of-thing devices using physical unclonable functions	2017	-4.998518979704616	15.045553663941085	3268783
3268956	EDA	variation-aware core-level redundancy scheme for reliable dsp computation in multi-core systems	2015	-4.020680316445978	14.103178418928064	3268983
3269731	EDA	technology trends in power-grid-induced noise	2002	-4.980352566452939	13.339947399943235	3269758
3270933	Embedded	a new ip core for fast error detection and fault tolerance in cots-based solid state mass memories	2011	-4.594401144377441	13.568719260083268	3270960
3271751	Arch	faulthound: value-locality-based soft-fault tolerance	2015	-3.9956514240639263	14.227361522536668	3271778
3272049	Arch	architecting np-dynamic skybridge	2015	-5.286136674714487	13.722285128760106	3272076
3272213	DB	application-level error measurements for network processors	2005	-4.7606450555713264	13.23206866499566	3272240
3273035	EDA	fast robust intellectual property protection for vlsi physical design	2007	-4.98630309209793	14.946855640881989	3273062
3273552	Metrics	collision for estimating sca measurement quality and related applications	2015	-5.163479811544038	14.775929903166627	3273579
3277695	EDA	a general computational framework and simulations of branching programs of boolean circuits using higher order logic (hol) software - an insight into ecad tool design paradigm	2012	-4.393596767485181	13.240245990138595	3277722
3277869	EDA	analysis of radiation-induced seus on dynamic reconfigurable systems	2016	-4.335081436088287	13.261648002169393	3277896
3278158	EDA	unified reliability estimation and management of noc based chip multiprocessors	2014	-3.4599370074245734	14.246647569597947	3278185
3278436	EDA	using self-reconfiguration to increase manufacturing yield of cntfet-based architectures	2011	-3.731755789060303	13.67079362626013	3278463
3279765	EDA	special session 4b: panel: testing and calibration for power management circuits	2014	-4.405525042837113	13.331085865524932	3279792
3280391	EDA	an experimental study of soft errors in microprocessors	2005	-3.824733607133172	13.328345786881151	3280418
3280744	Metrics	using minimal cuts to study the system capacity for a stochastic-flow network in two-commodity case	2003	-3.4426030121497986	15.052493721608537	3280771
3281077	Security	mcsevic: a model checking based framework for security vulnerability analysis of integrated circuits	2018	-4.883991884635899	14.445805538344526	3281104
3281919	Arch	variation tolerant digitally assisted high-speed io phy	2011	-4.002965278882572	13.30953880754983	3281946
3282516	Arch	multiple upsets tolerance in sram memory	2007	-4.781493611709174	13.638639559040165	3282543
3283283	EDA	reconfigurable concurrent error detection adaptive to dynamicity of power constraints	2010	-5.043935893336443	13.358319630388898	3283310
3283383	EDA	fpga based single cycle, reconfigurable router for noc applications	2013	-3.67830461824687	14.206909043136314	3283410
3283548	Arch	interleaved architectures for high-throughput synthesizable synchronization fifos	2017	-4.352945704094493	13.31320483521257	3283575
3284666	EDA	power distribution and management	2007	-4.3407210789898505	13.684496604710533	3284693
3284879	EDA	non-volatile memories	2007	-4.051190687269437	13.723889079679005	3284906
3285650	EDA	laser-induced single-bit faults in flash memory: instructions corruption on a 32-bit microcontroller	2018	-4.998441447276329	14.908659545748543	3285677
3286473	Arch	noc design and implementation in 65nm technology	2007	-4.3584361830199665	13.439995396273217	3286500
3286651	EDA	on finding suitable key-gate locations in logic encryption	2018	-5.038247692859297	15.07947752200798	3286678
3287007	Arch	characterization of data retention faults in dram devices	2014	-5.004055804349204	13.375703528570158	3287034
3287596	Arch	unambiguous i-cache testing using software-based self-testing methodology	2014	-3.6145624632687055	13.666302476042285	3287623
3287745	EDA	exploring redundancy granularities to repair real-time fpga-based systems	2017	-4.011344448109433	13.705416182288694	3287772
3287785	EDA	design of fault tolerant network interfaces for nocs	2011	-3.4239029848903346	14.469063947893671	3287812
3289703	EDA	measure twice and cut once: robust dynamic voltage scaling for fpgas	2016	-5.193169971576711	13.483633185561981	3289730
3289809	EDA	robust design-for-security architecture for enabling trust in ic manufacturing and test	2018	-4.9669959137973985	14.893633967699545	3289836
3289940	EDA	three-tier 3d ics for more power reduction: strategies in cad, design, and bonding selection	2015	-5.281552232815032	13.567370360920773	3289967
3292441	EDA	soc design with hw/sw co-design methodology for wireless communication system	2017	-3.4814503343711927	13.311268962336786	3292468
3292734	Embedded	control focused soft error detection for embedded applications	2010	-4.185342020579871	13.634227005603456	3292761
3293373	EDA	issues and trends in rf and mixed signal integration and partitioning	2008	-3.712672957778511	13.23238422093374	3293400
3294459	EDA	deadlock recovery in asynchronous networks on chip in the presence of transient faults	2015	-3.6732231010486944	14.323533667501247	3294486
3294480	EDA	session 11 overview: nonvolatile memory solutions	2017	-5.214316589886315	13.967649036432045	3294507
3294915	EDA	oxide-based rram models for circuit designers: a comparative analysis	2017	-4.645591319326099	13.564691344366032	3294942
3295445	EDA	performability/energy tradeoff in error-control schemes for on-chip networks	2010	-3.6017050432104374	14.61160622205701	3295472
3295487	EDA	microprocessors in the era of terascale integration	2007	-3.6998011057260727	13.240987563244653	3295514
3296411	EDA	limits on voltage scaling for caches utilizing fault tolerant techniques	2007	-4.069424987204418	14.209020626340866	3296438
3297413	EDA	an evaluation of asynchronous stacks	2011	-3.910818334263437	13.371776762603666	3297440
3297591	Arch	cmos technology trends and economics	1992	-4.057411896295854	13.202530940974054	3297618
3298129	EDA	transforming nanodevices to next generation nanosystems	2016	-3.8718588475142885	13.817029521636504	3298156
3298683	EDA	run-time reconfigurable array using magnetic ram	2009	-4.743083893653616	13.983501016996856	3298710
3298951	DB	errors in flash-memory-based solid-state drives: analysis, mitigation, and recovery	2017	-4.704756257058812	13.960345309177425	3298978
3299426	EDA	a chip-level anti-reverse engineering technique	2018	-4.908840642446503	14.78390893090321	3299453
3299732	EDA	two high-bandwidth memory bus structures	1999	-4.910725683837535	13.220428566252565	3299759
3300196	Logic	error detection enhancement in cots superscalar processors with event monitoring features	2004	-3.63270537450365	13.650208998129141	3300223
3300742	EDA	record: reducing register traffic for checkpointing in embedded processors	2016	-3.6739801725267593	14.225453221099885	3300769
3300808	EDA	protecting an asynchronous noc against transient channel faults	2012	-3.82544406394102	14.212017733739588	3300835
3300894	EDA	reliable network-on-chip router for crosstalk and soft error tolerance	2008	-5.075611886852489	13.780685005741216	3300921
3300984	HPC	a defect/error-tolerant nanosystem architecture for dsp	2009	-4.824946748278478	13.400546731619814	3301011
3301816	EDA	bridging clock domains by synchronizing the mice in the mousetrap	2003	-3.8584145314356615	13.650048286387172	3301843
3302670	EDA	t1a: opportunities and challenges for secure hardware and verifying trust in integrated circuits	2014	-4.785769218448013	14.868473877117081	3302697
3303825	PL	compiler-assisted detection of transient memory errors	2014	-3.7988569792846425	14.086228848827824	3303852
3304306	Metrics	understanding reduced-voltage operation in modern dram devices: experimental characterization, analysis, and mechanisms	2017	-4.576592177156997	14.072220415415131	3304333
3304417	EDA	acceleration method of optical reconfigurations using analog configuration contexts	2010	-5.219800756185212	13.66094251834095	3304444
3304452	Arch	connecting the physical and application level towards grasping aging effects	2015	-5.231678691452368	13.444544893682568	3304479
3305743	Arch	decor: a delayed commit and rollback mechanism for handling inductive noise in processors	2008	-4.832229138546985	14.001476070044276	3305770
3305948	Arch	"""a """"high resilience"""" mode to minimize soft error vulnerabilities in arm cortex-r cpu pipelines: work-in-progress"""	2017	-3.5147396040420413	13.809718841664871	3305975
3306096	Arch	blueshift: designing processors for timing speculation from the ground up.	2009	-4.1563885330751535	13.9027915004096	3306123
3306315	EDA	on application of one-class svm to reverse engineering-based hardware trojan detection	2014	-4.954028430988499	14.798862644091566	3306342
3306931	Arch	defect tolerance of holographic configurations in orgas	2008	-5.0248302064953805	13.586089519811742	3306958
3308126	EDA	dynamically adapted low-energy fault tolerant processors	2009	-4.1327161010065225	14.023278768508089	3308153
3308384	Arch	a practitioner's guide to software-based soft-error mitigation using an-codes	2014	-4.712411401247536	15.044020004192078	3308411
3308897	Logic	a novel golden models-free hardware trojan detection technique using unsupervised clustering analysis	2018	-5.063746409958222	14.392400708730099	3308924
