id	area	title	year	x	y	ix
901703	Security	applying chaos theory for runtime hardware trojan detection	2015	-5.083424239206246	14.885810457661693	901730
902122	EDA	consistency-based characterization for ic trojan detection	2009	-5.086034897322334	14.469232995407825	902149
902646	EDA	fine-grained architecture in dark silicon era for sram-based reconfigurable devices	2014	-3.6138984122565967	14.09359678481712	902673
902868	EDA	protecting sram-based fpgas against multiple bit upsets using erasure codes	2014	-4.667483218623094	13.99699358225781	902895
903169	EDA	reconfigurable fpga's in the 1-20 ghz band with hbt bicmos	1999	-4.754736239679088	13.787426956876564	903196
903255	Robotics	reliable seu monitoring and recovery using a programmable configuration controller	2017	-3.7792376020355087	13.85051386720425	903282
904771	Arch	assembly of a 3d cellular computer using folded e-blocks 	2016	-4.572437545711539	13.350663276643195	904798
905760	EDA	optically reconfigurable gate arrays vs. asics	2006	-5.1725983773103135	13.726609075537365	905787
906782	Security	formal verification of secure reconfigurable scan network infrastructure	2016	-4.796920791359006	14.830165399943589	906809
907102	ML	an optimization of data movement operations: application to the tree-embedding problem	1997	-3.4874060214958456	14.112541168045807	907129
907147	Arch	microarchitecture on the mosfet diet	2003	-4.38397694653734	13.39643695188412	907174
907820	EDA	session 7 overview: non-volatile memory solutions: memory subcommittee	2015	-3.811520788504358	13.759006709297893	907847
908608	EDA	evaluation of fault-tolerant composite field aes s-boxes under multiple transient faults	2013	-4.788140222689412	13.279374724938164	908635
911074	Arch	exploiting coarse-grain verification parallelism for power-efficient fault tolerance	2005	-3.920360485753017	14.189928939295573	911101
911141	EDA	design of networks on chips for 3d ics	2010	-3.998680881312864	13.520960543376868	911168
911426	Arch	scaling trends and challenges of advanced memory technology	2014	-4.797095279885682	13.72945167255452	911453
911964	EDA	system-level analysis and design under uncertainty	2017	-5.130752699243797	13.531912675963445	911991
912761	EDA	sensor-based time speculation in the presence of timing variability	2018	-5.260262510437647	13.95868534150692	912788
912893	EDA	an adaptive fault-tolerant memory system for fpga-based architectures in the space environment	2007	-4.081852969049431	13.609089274154663	912920
914046	EDA	a performance comparison on asynchronous matched-delay templates	2009	-5.203114822091685	13.437670279402823	914073
914077	EDA	thermal and power characterization of real computing devices	2011	-4.64368838694373	13.79429314947047	914104
914400	EDA	minimum logic of guaranteed single soft error resilience based on group distance-two code	2012	-5.04194162660901	13.444104973882474	914427
914949	Arch	a systematic methodology to develop resilient cache coherence protocols	2011	-3.63116948346748	14.276489358537136	914976
915304	EDA	process variability-aware proactive reconfiguration technique for mitigating aging effects in nano scale sram lifetime	2012	-4.9233592121992755	13.839916956489642	915331
915959	Robotics	revc: computationally reliable video coding on unreliable hardware platforms: a case study on error-tolerant h.264/avc cavlc entropy coding	2011	-4.085662215934106	13.641358716838898	915986
917481	Logic	dynamic adaption to permanent memory faults in industrial control systems	2018	-4.190776342123632	13.347911441436601	917508
917929	Arch	a fault-tolerant dynamic fetch policy for smt processors in multi-bus environments	2006	-3.778967023536144	14.106676967841866	917956
918414	EDA	embedded dram in 45-nm technology and beyond	2011	-3.932911922394301	13.624910457606296	918441
919110	EDA	potential applications based on nvm emerging technologies	2015	-3.4076423962014424	14.237404667198124	919137
919738	Embedded	a 7mb/s 64gb 3-bit/cell ddr nand flash memory in 20nm-node technology	2011	-3.5649185003347053	13.721545894170893	919765
920122	Arch	characterization of a voltage glitch attack detector for secure devices	2009	-5.250608217616417	14.79946273176884	920149
920317	EDA	embedding of signatures in reconfigurable scan architecture for authentication of intellectual properties in system-on-chip	2016	-4.972937436759847	14.452879052137101	920344
920660	EDA	influence of fault-tolerance techniques on power-analysis resistance of cryptographic design	2017	-4.936472038138206	14.961408972458882	920687
921266	Arch	multichipsat fault-tolerant architecture	2011	-4.024538277922886	13.244576906159732	921293
921506	EDA	microprocessor design issues: thoughts on the road ahead	2005	-3.7502921799613658	13.24714656642691	921533
921642	EDA	design of an eeprom in rfid tag: employing mapped epc and ipv6 address	2010	-5.260793691047949	14.22485028087115	921669
923500	EDA	fedc: control flow error detection and correction for embedded systems without program interruption	2008	-3.789264993629831	13.691208095287571	923527
924427	EDA	integrated circuits 3d silicon integration	2009	-4.502210937142227	13.519430768383673	924454
926137	Mobile	shoulder angel: an open platform for reprogramming wayward wireless sensors	2016	-4.1327343577669655	14.740865859097203	926164
926807	Arch	programmable stochastic computing: embracing errors in architecture and design of processors and applications	2012	-4.069451442910149	13.513592102136595	926834
927484	Arch	efficient asynchronous protocol converters for two-phase delay-insensitive global communication	2007	-5.008102782996149	13.908727969689815	927511
927723	EDA	fastrust: feature analysis for third-party ip trust verification	2015	-4.956156081700456	14.893845383819027	927750
927757	Arch	leveraging optical technology in future bus-based chip multiprocessors	2006	-3.3863328592267523	14.018969189893793	927784
928553	Arch	scaling cmos devices through alternative structures	2001	-4.11166003757878	13.228289219412039	928580
930580	DB	a cost-effective method for masking transient errors in noc flit type	2013	-3.418776330329647	14.645896217924898	930607
931265	EDA	system-level analysis of 3d ics with thermal tsvs	2018	-5.290687364787575	13.796077487206741	931292
931523	Arch	implications of electronics technology trends to algorithm design	2008	-3.6566842485614983	13.21351215868062	931550
931916	EDA	distributed clock generator for globally and locally synchronous chips with a large size. (générateur distribué d'horloge pour puces globalement et localement synchrones de grande taille)	2014	-3.969494599532172	13.27012067768906	931943
932088	EDA	an improved aes hardware trojan benchmark to validate trojan detection schemes in an asic design flow	2015	-4.977816033159513	14.9105917361224	932115
933058	HPC	measuring the impact of spectre and meltdown	2018	-3.8505699602113066	13.879990479689535	933085
933602	HPC	application-based fault tolerance techniques for sparse matrix solvers	2018	-3.546131910489428	13.957894637858214	933629
934800	Arch	online soft-error vulnerability estimation for memory arrays	2016	-4.344493308652403	13.695928670568248	934827
934932	HPC	improving application resilience to memory errors with lightweight compression	2016	-3.728086145944565	14.259899585850256	934959
934975	Logic	a novel counterfeit detection approach for integrated circuit supply chain assurance	2018	-4.747277641072072	14.647781259229582	935002
935929	Arch	fault-tolerant vertical link design for effective 3d stacking	2011	-3.97063439838572	14.100834128651664	935956
935963	SE	an approach to analyze effects of soft errors on program level	2012	-3.7499763053357946	13.814262779453829	935990
936525	DB	automatic instruction-level software-only recovery	2006	-3.6825269251838684	13.804163269405274	936552
936739	EDA	secure integrated circuit design via hybrid cloud	2018	-4.943144175383302	14.94972812406919	936766
936777	HPC	vanuca: enabling near-threshold voltage operation in large-capacity cache	2016	-4.0062946193440565	14.364393466942873	936804
937283	Embedded	concurrent detection of control flow errors by hybrid signature monitoring	2005	-4.831906765324704	13.203138310979107	937310
937906	EDA	embedded reconfigurable logic for asic design obfuscation against supply chain attacks	2014	-4.935976236878677	14.909883604503785	937933
937942	EDA	power calculation and modeling in deep submicron	1998	-4.747073156173645	13.654097072133904	937969
938203	EDA	a 13.75 ns holographic reconfiguration of an optically differential reconfigurable gate array	2009	-5.20753960411469	13.65258672233046	938230
938231	EDA	fault-tolerant 3d-noc architecture and design: recent advances and challenges	2015	-3.74509879161387	13.521075464188433	938258
938312	EDA	propelling breakthrough embedded microprocessors by means of integrated photonics	2017	-3.45828141575953	13.912435533191754	938339
938875	Arch	towards a software approach to mitigate voltage emergencies	2007	-5.03160769325728	13.914207699392232	938902
939673	EDA	a novel threshold voltage defined switch for circuit camouflaging	2016	-5.14007499922227	14.901936117455987	939700
941222	Embedded	wcet-aware partial control-flow checking for resource-constrained real-time embedded systems	2014	-3.534986549289713	13.936325038397634	941249
942250	EDA	proca: progressive configuration aware design methodology for low power stochastic asics	2014	-4.388139459198676	13.820132468554414	942277
942282	Arch	shakti-f: a fault tolerant microprocessor architecture	2015	-4.773199492201642	13.68421037295928	942309
943220	Arch	how small and still effective a cmos-soc could ever be?	2015	-4.182002154029716	13.222776451833113	943247
943999	Security	no place to hide: contactless probing of secret data on fpgas	2016	-5.226368598503857	15.046424843480127	944026
944083	Arch	performance implications of tolerating cache faults	1993	-4.315541542361999	14.021729391726725	944110
944096	EDA	normally-off computing project: challenges and opportunities	2014	-3.7490353124891334	13.706632474545328	944123
944945	Arch	self-timed dynamically pipelined adaptive signal processing system: a case study of dlms equalizer for read channel	2005	-4.0347674035652075	14.352105866058723	944972
945989	EDA	frequency domain aware power analysis attack against random clock lsi for secure automotive embedded systems	2015	-5.043043169939192	15.084127265360436	946016
946740	EDA	process variation-tolerant 3d microprocessor design: an efficient architectural solution	2013	-4.08312579291389	14.176996888223893	946767
947292	Arch	error detection and handling in a superscalar, speculative out-of-order execution processor system	1995	-3.7400393787759856	13.774496403230927	947319
947445	PL	a study of the impact of bit-flip errors on programs compiled with different optimization levels	2014	-3.755928890652756	13.979258676540857	947472
947680	EDA	mono3d: open source cell library for monolithic 3-d integrated circuits	2018	-5.099549420704653	13.374909543047266	947707
947765	HPC	deeply-scaled cmos-integrated nanophotonic devices for next generation supercomputers	2011	-3.6241489211305837	14.027512498719885	947792
947806	Arch	architecting connectivity for fine-grained 3-d vertically integrated circuits	2015	-4.712231582389352	13.825720764643247	947833
948284	EDA	carbon nanotube circuits: opportunities and challenges	2013	-4.497384322898901	13.374296609749026	948311
950043	EDA	heterogeneous concurrent error detection (hced) based on output anticipation	2011	-4.584532990755808	13.497499239339785	950070
950522	EDA	logic cells and interconnect strategies for nanoscale reconfigurable computing fabrics	2010	-5.213199278766601	13.541324241323064	950549
950857	Arch	reliability and energy-aware cache reconfiguration for embedded systems	2016	-3.737683061603193	14.415969444189589	950884
952169	SE	instruction-vulnerability-factor-based reliability analysis model for program memory	2016	-4.2478650345591715	13.454755338735714	952196
952348	Robotics	chemical amplification resists: history and development within ibm	1997	-3.383493433115817	14.79671602886673	952375
952463	EDA	a dynamic-key secure scan structure against scan-based side channel and memory cold boot attacks	2018	-5.140389070779164	15.117091873702329	952490
954192	Arch	await: an ultra-lightweight soft-error mitigation mechanism for network-on-chip links	2018	-3.6191844456243882	14.467635659172347	954219
954956	Crypto	escalation: leveraging logic masking to facilitate path-delay-based hardware trojan detection methods	2018	-5.078316296746254	14.814092465998248	954983
955780	EDA	dynamic programming-based runtime thermal management (dprtm): an online thermal control strategy for 3d-noc systems	2013	-3.420362462390982	14.491760002419422	955807
956488	EDA	physical design challenges for performance	1997	-3.867790897141239	13.453172679796998	956515
957114	EDA	high-efficient dc-dc converter design	2011	-5.085685360468752	13.989464536442926	957141
957124	Arch	a fault-tolerant cache architecture based on binary set partitioning	2006	-4.335682870099869	13.872330719091375	957151
957368	Arch	a single chip implementation of receive path termination for sonet oc-12c and quadruple sonet oc-3c	1994	-3.592370656837625	14.206251801255982	957395
957686	EDA	a hybrid hw-sw approach for intermittent error mitigation in streaming-based embedded systems	2012	-4.169328013170578	14.255445518252607	957713
958263	EDA	a 3d system prototype of an edram cache stacked over processor-like logic using through-silicon vias	2012	-5.0341391770558825	14.03335340836891	958290
959243	EDA	characterization of single-electron tunneling transistors for designing low-power embedded systems	2009	-4.694192586122762	13.89995400090743	959270
960392	Arch	relaxfault memory repair	2016	-3.992364876186109	14.169247060809422	960419
960794	EDA	a soft-error resilient route computation unit for 3d networks-on-chips	2018	-3.7692482501951896	14.32455960729932	960821
961451	Security	a versatile framework for implementation attacks on cryptographic rfids and embedded devices	2010	-4.935557205766218	15.09854218521483	961478
962043	EDA	slack-aware timing margin redistribution technique utilizing error avoidance flip-flops and time borrowing	2015	-4.749871497679936	14.04469811520026	962070
962295	Arch	an fpga based test bed for bio inspired computation	2005	-3.8776238100576816	13.303612350488624	962322
962314	EDA	artemis: an aging-aware runtime application mapping framework for 3d noc-based chip multiprocessors	2015	-5.024296810408392	14.020663207641412	962341
962358	EDA	asnchronous wrapper for heterogeneous systems	1997	-3.746520921511917	13.47759036157052	962385
962884	Arch	design methodologies for high density domain wall memory	2013	-4.662259336590856	13.834940432457902	962911
963862	Security	two countermeasures against hardware trojans exploiting non-zero aliasing probability of bist	2017	-4.869246506502097	14.876140562952235	963889
964948	EDA	chapter one - an overview of architecture-level power- and energy-efficient design techniques	2015	-3.3797450794024204	13.40531687589794	964975
965024	EDA	a holistic view on low power design	2010	-3.735174500832088	13.61676677870969	965051
965913	EDA	reconfiguring cmos as pseudo n/pmos for defect tolerance in nano-scale cmos	2008	-5.152782221463856	13.372667462374086	965940
966424	EDA	workshop on fault diagnosis and tolerance in cryptography	2004	-4.622948022725868	14.764463179961295	966451
966445	Arch	new microarchitecture challenges in the coming generations of cmos process technologies	1999	-4.07715865057388	13.353341545815455	966472
967703	EDA	an analytical model for reliability evaluation of noc architectures	2007	-3.4619723650795065	14.411066934812222	967730
968058	EDA	robotic process automation	2018	-3.55808088480319	13.249930008532429	968085
968649	Arch	on-chip cache device scaling limits and effective fault repair techniques in future nanoscale technology	2008	-5.061469223468837	13.819868719557006	968676
969274	Logic	characterization of effective laser spots during attacks in the configuration of a virtex-ii fpga	2009	-5.165792206339104	15.001314965736304	969301
969990	SE	using genetic algorithm to identify soft-error derating blocks of an application program	2012	-3.909164120253612	13.590034617743669	970017
970794	Arch	reconfigurable hardened latch and flip-flop for fpgas	2017	-5.0366251137109055	13.40571358273455	970821
971130	Robotics	low-cost sound-based localization using programmable mixed-signal systems-on-chip	2011	-4.902126549486506	13.962527458501064	971157
971675	OS	internet-scale service infrastructure efficiency	2009	-3.9858518282484137	13.85446866285199	971702
972507	EDA	dtune: leveraging reliable code generation for adaptive dependability tuning under process variation and aging-induced effects	2014	-3.7022979404785135	14.07056705933502	972534
972684	EDA	performance optimization for on-chip sensors to detect recycled ics	2015	-5.190502702344351	13.305952942739143	972711
972821	EDA	hamartia: a fast and accurate error injection framework	2018	-4.4164837684078835	13.218805054935979	972848
972879	EDA	on the impact of within-die process variation in gals-based noc performance	2012	-4.820534892472068	13.378987793960526	972906
973917	Arch	verification of untrusted chips using trusted layout and emission measurements	2014	-5.167246726360656	14.652505203668824	973944
973982	EDA	always-on motion detection with application-level error control on a near-threshold approximate computing platform	2016	-5.275981604145668	14.073740686708465	974009
974860	EDA	design comparison to identify malicious hardware in external intellectual property	2011	-4.940994201848829	14.804263193345356	974887
976176	Arch	xor-based low cost checkers for combinational logic	2008	-4.778535043225446	13.648118260315735	976203
976796	Arch	obfuscation and watermarking of fpga designs based on constant value generators	2014	-4.782735741924451	15.088770030956493	976823
977140	EDA	reliability- and process-variation aware design of integrated circuits — a broader perspective	2008	-4.757685988955669	13.24901592332932	977167
980053	EDA	state-of-the-art silicon device miniaturization technology and its challenges	2014	-5.047646019243459	13.342245991550596	980080
980346	Arch	low-cost highly-robust hardened cells using blocking feedback transistors	2008	-5.062806315478373	13.535799024675965	980373
981191	EDA	low-cost control flow error protection by exploiting available redundancies in the pipeline	2012	-4.266944373845757	13.777588832970876	981218
982270	Arch	using process-level redundancy to exploit multiple cores for transient fault tolerance	2007	-3.532253233658293	14.041222209623447	982297
982286	Arch	error-resilient video encoding using parallel independent signature processing	2017	-4.973873360578561	14.092643614763013	982313
982750	Arch	breakthrough technologies and reference designs for new iot applications	2015	-3.491708811819913	14.112888766219127	982777
982775	Arch	fpga bitstream protection with pufs, obfuscation, and multi-boot	2011	-5.203173406195915	15.07143254928033	982802
983007	HPC	a low-overhead soft–hard fault-tolerant architecture, design and management scheme for reliable high-performance many-core 3d-noc systems	2016	-3.48077363851264	14.62529538807107	983034
983120	EDA	orient: organized interleaved eccs for new stt-mram caches	2018	-4.550741498230204	14.231819599434195	983147
983849	EDA	design benchmarking to 7nm with finfet predictive technology models	2012	-5.079060257015044	13.266419331520533	983876
984110	EDA	a novel threshold voltage assignment for 3d multicore designs	2010	-3.501285455435291	14.342475879927614	984137
987339	Arch	challenging on-chip sram security with boot-state statistics	2017	-5.0274238769335815	14.809861116919146	987366
987576	EDA	a compiler-microarchitecture hybrid approach to soft error reduction for register files	2010	-3.599510225478043	14.303733316170328	987603
987991	EDA	learning nanotechnology through crossbar-based architecture and carbon nanotube(cnt) fets	2011	-4.154386532319935	13.2785325965951	988018
989004	EDA	do you trust your chip?	2016	-4.7753343291629475	14.82811266035184	989031
989026	EDA	probing attacks on integrated circuits: challenges and research opportunities	2017	-4.598268145652668	14.884226486177516	989053
989402	EDA	soft ip protection: watermarking hdl codes	2004	-5.1298353181738445	15.01669410988426	989429
989952	Arch	bamboo ecc: strong, safe, and flexible codes for reliable computer memory	2015	-3.9416068049020683	14.280596431574374	989979
990334	EDA	side-channel oscilloscope	2011	-4.416626960219432	15.04178144937113	990361
990862	EDA	varius-ntv: a microarchitectural model to capture the increased sensitivity of manycores to process variations at near-threshold voltages	2012	-5.1248754433826385	13.975039466270886	990889
991583	EDA	a layout-aware approach for improving localized switching to detect hardware trojans in integrated circuits	2010	-5.074542027809834	14.58270943487876	991610
991634	Embedded	rvc: a mechanism for time-analyzable real-time processors with faulty caches	2011	-3.902719539866823	14.011259329307453	991661
992371	EDA	a brief overview of the challenges of the multicore roadmap	2014	-3.48164257770944	13.825787936441204	992398
992415	EDA	short-circuits on fpgas caused by partial runtime reconfiguration	2010	-4.43947051016842	13.301615430377257	992442
994181	Arch	indirect branch validation unit	2009	-4.88237804836142	14.84544269787212	994208
994819	EDA	dynamic code duplication with vulnerability awareness for soft error detection on vliw architectures	2013	-3.7907637179991633	14.075931559368449	994846
995373	EDA	soft error reliability aware placement and routing for fpgas	2010	-4.704976194231823	13.44557259969816	995400
995464	Arch	estimating the soft error vulnerability of register files via interprocedural data flow analysis	2010	-4.0358398656414405	13.83305796964208	995491
995920	Arch	virtualized and flexible ecc for main memory	2010	-3.4119538890564582	14.485359362878064	995947
996383	EDA	synthesis of trustable ics using untrusted cad tools	2010	-4.837940664106411	14.799860939832461	996410
998463	EDA	da-raid-5: a disturb aware data protection technique for nand flash storage systems	2013	-4.102002459898918	14.371966677173154	998490
1000293	EDA	a runtime framework for robust application scheduling with adaptive parallelism in the dark-silicon era	2017	-5.040963518369958	13.97556018043561	1000320
1000806	EDA	low overhead symmetrical protection of reusable ip core using robust fingerprinting and watermarking during high level synthesis	2017	-5.230907614340094	14.99360452284017	1000833
1001525	EDA	redundancy based interconnect duplication to mitigate soft errors in sram-based fpgas	2015	-4.455083975502128	13.733898296700904	1001552
1001613	EDA	tools and methodologies for low power design	1997	-3.3714720106920635	13.39798895670312	1001640
1003184	Arch	test and reliability of emerging non-volatile memories	2017	-3.5561414412808197	13.665811426028275	1003211
1004376	EDA	design technology for fault-free and maximally-parallel wavelength-routed optical networks-on-chip	2016	-3.4725471050397467	14.043088616001734	1004403
1004475	Arch	protecting caches against multi-bit errors using embedded erasure coding	2015	-4.664893087401504	14.251747829852473	1004502
1004716	Embedded	on-line device replacement techniques for ssd raid	2015	-3.8835898095292714	13.821665439686505	1004743
1005233	Arch	efficient on-line error detection and mitigation for deep neural network accelerators	2018	-3.988192109256535	13.860339745271494	1005260
1005387	EDA	software-based register file vulnerability reduction for embedded processors	2013	-3.5370301749635984	14.24326792777581	1005414
1006544	EDA	trade-offs in execution signature compression for reliable processor systems	2014	-4.322556167526386	13.805050454344855	1006571
1006659	HPC	daft: decoupled acyclic fault tolerance	2010	-3.6423665189181422	14.050185774662511	1006686
1007408	Arch	timing-resilient network-on-chip architectures	2015	-4.884270938410896	13.763561424284823	1007435
1007592	Arch	a compiler-assisted on-chip assigned-signature control flow checking	2004	-4.2693063154896285	13.211831033164115	1007619
1008050	EDA	yield enhancement by robust application-specific mapping on network-on-chips	2009	-3.725475005321968	13.411757229410096	1008077
1008655	Security	cyclic obfuscation for creating sat-unresolvable circuits	2017	-5.144757409707322	15.061186423435688	1008682
1009196	Mobile	a dynamic feature-based security detector in wireless sensor network transceiver	2014	-3.8378496041241257	14.521479083392846	1009223
1009527	Arch	temperature and power measurement of modern dual core processor by infrared thermography	2010	-4.4615272677044056	13.997175621148873	1009554
1010184	EDA	match-making for monolithic 3d ic: finding the right technology node	2016	-3.654907264630213	13.977593696546245	1010211
1012293	Security	intra-die-variation-aware side channel analysis for hardware trojan detection	2017	-5.2452530544455	14.60086726188503	1012320
1013922	EDA	mitigating the impact of faults in unreliable memories for error-resilient applications	2015	-4.855044929649627	14.093287388005095	1013949
1014545	EDA	towards a hardware trojan detection cycle	2014	-4.672395857244847	14.757839368716269	1014572
1014579	Arch	phys: profiled-hybrid sampling for soft error reliability benchmarking	2013	-3.725240363390879	14.182332786793385	1014606
1016045	EDA	on the statistical memory architecture exploration and optimization	2015	-5.030440602693755	13.226999037239725	1016072
1016629	EDA	low-latency maximal-throughput communication interfaces for rationally related clock domains	2014	-4.6512646134082045	13.79749287493774	1016656
1016772	Arch	runtime asynchronous fault tolerance via speculation	2012	-3.47383596790901	13.962310257551419	1016799
