id	area	title	year	x	y	ix
1722323	Robotics	system reliability of a limited-flow network in multicommodity case	2007	-3.4149714980010386	14.997937709131913	1722350
1722550	Arch	dynamic prediction of architectural vulnerability from microarchitectural state	2007	-3.868371741926724	13.948783370530267	1722577
1722979	Arch	a secure design-for-test infrastructure for lifetime security of socs	2015	-4.906876470790916	14.894262310142533	1723006
1723210	EDA	criticality aware soft error mitigation in the configuration memory of sram based fpga	2018	-4.517365010426016	13.963476896804707	1723237
1723718	EDA	physics-based compact models for insulated-gate field-effect biosensors, landau-transistors, and thin-film solar cells	2015	-4.124390096553217	13.286615040898626	1723745
1724499	EDA	a new timing driven placement algorithm for dependable circuits on sram-based fpgas	2010	-4.077708465597364	13.487524469894993	1724526
1724518	EDA	hardware trojan detection using path delay fingerprint	2008	-5.032515325265879	14.740884794816873	1724545
1725884	EDA	publicly detectable techniques for the protection of virtual components	2001	-4.948036834595339	14.971769863194249	1725911
1726828	Arch	a case for acoustic wave detectors for soft-errors	2016	-4.592594382161621	13.709671607912677	1726855
1728301	EDA	on-line detection and diagnosis of stuck-at faults in channels of noc-based systems	2016	-3.5073911142764804	14.385323857375505	1728328
1729770	Arch	the future evolution of high-performance microprocessors	2005	-4.313634840281583	13.7400085618286	1729797
1730004	EDA	practical measurements of data path delays for ip authentication & integrity verification	2013	-5.2461754581011935	15.059809044119227	1730031
1730115	EDA	extended abstract: a hardware-assisted data hiding based approach in building high performance secure execution systems	2008	-5.021353042174586	15.040501078013895	1730142
1731195	SE	adaptive online testing for efficient hard fault detection	2009	-4.13211376089059	13.97442701104837	1731222
1731235	EDA	a 172mm2 32gb mlc nand flash memory in 34nm cmos	2009	-5.189534559905084	13.741287561181098	1731262
1731651	EDA	tuning software-based fault-tolerance techniques for power optimization	2014	-3.8829292269903415	13.886683717571001	1731678
1731887	DB	architecting dependable many-core processors using core-level dynamic redundancy	2012	-3.8356724601761134	13.974764864669948	1731914
1732329	Logic	globoost. combinaisons de moindres généralisés	2005	-4.0185353300273645	13.498305369515569	1732356
1733102	EDA	efuse based ic authentication architecture	2016	-5.061748559733177	14.993526480099142	1733129
1734392	EDA	digital signature proposal for mixed-signal circuits	2001	-5.185700927173693	14.707229743275724	1734419
1734721	Security	emerging embedded and cyber physical system security challenges and innovations	2017	-4.759180017759297	14.89094368957486	1734748
1735321	EDA	formal security verification of third party intellectual property cores for information leakage	2016	-4.931478615440271	14.922386897524413	1735348
1735465	EDA	memristive crossbar design and test in non-adaptive proactive reconfiguring scheme	2015	-4.793873883747152	13.553880872976446	1735492
1735703	EDA	new design strategy for improving hardware trojan detection and reducing trojan activation time	2009	-5.175561578946638	14.724172294670765	1735730
1736200	HPC	thermal analysis for a sige hbt 40 watt 32 ghz clock 3d memory processor chip stack using diamond heat spreader layers	2009	-3.622782273411447	13.402256283334069	1736227
1736933	EDA	pmd: a low-power code for networks-on-chip based on virtual channels	2008	-3.451395825412804	14.63102197881706	1736960
1737469	Networks	a microprocessor-controlled asynchronous circuit switching network	1979	-3.3903011194745933	13.946056088168456	1737496
1737916	EDA	a design for testability of non-volatile memory reliability test for automotive embedded processor	2012	-4.441161780422785	13.387331982877425	1737943
1740102	EDA	scrubbing-based seu mitigation approach for systems-on-programmable-chips	2011	-4.261514762111356	13.757454692905648	1740129
1740276	Embedded	a hardware-software approach for on-line soft error mitigation in interrupt-driven applications	2016	-3.960025743875756	13.504776498215403	1740303
1740784	Embedded	monitoring of i/o for safety-critical systems using pci express advanced error reporting	2015	-3.77918392686196	13.457728355851842	1740811
1740922	EDA	floorplan and congestion aware framework for optimal sram selection for memory subsystems	2015	-4.791067286302678	13.648626230962494	1740949
1741515	NLP	verifying reliability (dagstuhl seminar 12341)	2012	-4.598474001973892	13.229978597334142	1741542
1743140	HPC	session 12 overview: dram: memory subcommittee	2018	-3.6768920818616384	13.644247105698273	1743167
1743181	EDA	esl power analysis of embedded processors for temperature and reliability estimations	2009	-4.4714907901514716	13.292601304338136	1743208
1744336	EDA	a low-overhead dynamic watermarking scheme on scan design for easy authentication	2014	-4.9693634444330845	14.787609040467062	1744363
1745896	Embedded	a flexible sopc-based fault injection environment	2006	-3.8760824156762514	13.319062478662078	1745923
1745942	Arch	gds-ii trojan detection using multiple supply pad vdd and gnd iddqs in asic functional units	2015	-5.254353703859349	14.797657334528846	1745969
1746779	EDA	reliability degradation in the scope of aging — from physical to system level	2015	-4.517649956674794	13.660055705258575	1746806
1747568	SE	exploration of the effects of soft errors from dynamic software behaviours	2012	-3.72430923614136	13.819957191950376	1747595
1747655	EDA	hardware trojan detection using the order of path delay	2018	-5.106738000695032	14.706889387796345	1747682
1749650	Arch	leveraging systematic unidirectional error-detecting codes for fast stt-mram cache	2017	-4.648382134766954	14.212256170557687	1749677
1749765	EDA	it is all about power analysis, exploration and trade-offs	2009	-3.8293650120342653	13.342228408307482	1749792
1750051	EDA	embedded systems to high performance computing using stt-mram	2017	-4.395429200589878	13.792400572117204	1750078
1750085	PL	an efficient manhattan-distance-constrained disjoint paths algorithm for incomplete mesh network	2019	-3.9034015050139312	14.806490340708637	1750112
1750883	Arch	detailed design and evaluation of redundant multithreading alternatives	2002	-3.5587256616869896	13.879954313565307	1750910
1751183	EDA	a hardware-software collaborated method for soft-error tolerant mpsoc	2011	-3.7035503539357286	14.340873293827311	1751210
1752005	EDA	pair and swap: an approach to graceful degradation for dependable chip multiprocessors	2010	-3.6625788284221263	13.938266375390072	1752032
1753400	Embedded	fpga see test with ultra-high energy heavy ions	2018	-4.446699286820431	13.397544913520605	1753427
1753768	Arch	scalable fualt detection for fpgas	2010	-3.95354055668768	13.53075087328567	1753795
1753838	EDA	synchronous elasticization: considerations for correct implementation and minimips case study	2010	-4.013751663023356	13.997876482143955	1753865
1754435	EDA	hci-tolerant noc router microarchitecture	2013	-4.715020170604661	14.041420407246866	1754462
1755221	EDA	reliability-aware and energy-efficient synthesis of noc based mpsocs	2013	-4.488292950006438	14.069451422078853	1755248
1755497	Arch	resilience challenges for exascale systems	2009	-3.6675685153647204	14.102956868172832	1755524
1755779	EDA	exploiting free lut entries to mitigate soft errors in sram-based fpgas	2011	-5.116266481580655	13.370425816922907	1755806
1755935	EDA	using logic-based reduction for adversarial component recovery	2010	-4.620557211180974	15.01359211298059	1755962
1756016	EDA	avf-driven parity optimization for mbu protection of in-core memory arrays	2013	-3.8597672150347537	14.229282354610785	1756043
1756429	Embedded	guest editorial special section on memory architectures and organization	2012	-3.424102405965816	13.216634204925773	1756456
1756627	HPC	a memory coherence technique for online transient error recovery of fpga configurations	2001	-3.94526739782572	13.908188517557033	1756654
1756680	Robotics	a polynomial time algorithm for reconfiguring the 1 1/2 track-switch model with pe and bus faults	1997	-4.120568341809059	13.529462953008672	1756707
1757624	EDA	trends and future directions in nano structure based computing and fabrication	2006	-4.32846068778553	13.419781586022925	1757651
1758382	EDA	design methodology of low-power microprocessors	2003	-4.400728735971219	13.625097139337141	1758409
1758548	Embedded	scheduling voter checks to detect configuration memory errors in fpga-based tmr systems	2017	-4.1152617443628765	13.50842377495256	1758575
1758917	Arch	viper: virtual pipelines for enhanced reliability	2012	-3.595168519429456	14.289669372469046	1758944
1759677	EDA	electrical modeling and simulation challenges in chip-package codesign	1998	-4.296808482281633	13.273198916814911	1759704
1760190	EDA	fault-tolerant training with on-line fault detection for rram-based neural computing systems	2017	-4.674574122210278	13.268370687153855	1760217
1760495	EDA	high rate data synchronization in gals socs	2006	-4.03478163914416	13.670766665062365	1760522
1760561	Arch	the impact of production defects on the soft-error tolerance of hardened latches	2018	-5.1639682596123215	13.736752057580905	1760588
1761693	EDA	temperature tracking: an innovative run-time approach for hardware trojan detection	2013	-5.003762927748482	14.678384408939095	1761720
1762113	DB	cross-layer fault-space pruning for hardware-assisted fault injection	2018	-4.269857440007387	13.54716698650506	1762140
1762598	Arch	cost-minimized double die dram packaging for ultra-high performance ddr3 and ddr4 multi-rank server dimms	2012	-5.237874726944977	13.404052113262525	1762625
1763143	EDA	an adaptive redundancy oriented method to tolerate soft errors in sram-based fpgas using unused resources	2010	-4.408148065013928	13.665690210939786	1763170
1763348	EDA	robustness analysis of different aes implementations on sram based fpgas	2011	-5.232580659865465	15.039177900674725	1763375
1763395	EDA	fpga interconnect modeling for lifetime failure detection	2014	-3.5146481991863547	14.533698486359766	1763422
1763871	Arch	thanks for the memories: nonvolatile memory technology enables the age of spin [the art of storage]	2014	-4.257638178432676	13.428080377587852	1763898
1765424	EDA	low power microprocessor design for embedded systems	2006	-4.155649198332018	13.644508575146409	1765451
1765721	Arch	a cross-layer multicore architecture to tradeoff program accuracy and resilience overheads	2015	-3.3807025429006656	14.214914778430655	1765748
1766948	EDA	new insights into the impact of seus in fpga crams	2015	-3.9118483287507937	13.728149747151887	1766975
1767639	EDA	fault scrambling techniques for yield enhancement of embedded memories	2013	-4.882422840384747	13.783174998827311	1767666
1768162	EDA	a framework for exploring alternative fault-tolerant schemes targeting 3-d reconfigurable architectures	2016	-4.810287579598754	13.569927065037145	1768189
1769797	Security	a learning-based approach to secure jtag against unseen scan-based attacks	2016	-4.971237713016603	14.85470339218048	1769824
1769848	Arch	area, performance, and yield implications of redundancy in on-chip caches	1999	-4.405996990207845	13.942432270479832	1769875
1770591	EDA	ultra low power circuit design using tunnel fets	2012	-4.996733832536015	13.774249967569439	1770618
1771288	Embedded	an intellectual property core to detect task schedulling-related faults in rtos-based embedded systems	2011	-4.048609865244079	13.439194631070846	1771315
1771653	Arch	transient-fault recovery for chip multiprocessors	2003	-3.8457295635897815	14.215624179805298	1771680
1772357	EDA	circuit design in nano-scale cmos era: opportunities & challenges	2009	-4.394946040196206	13.435918728677153	1772384
1772787	Security	efficient triggering of trojan hardware logic	2016	-4.974150882337027	14.957895221021115	1772814
1772876	EDA	graal: a new fault tolerant design paradigm for mitigating the flaws of deep nanometric technologies	2007	-5.018668678022412	13.381581886701875	1772903
1773364	EDA	la-lru: a latency-aware replacement policy for variation tolerant caches	2011	-4.701670240635663	14.00756050643142	1773391
1773687	HPC	faults in data prefetchers: performance degradation and variability	2016	-4.056791714580905	14.29276612596865	1773714
1774908	Arch	security enhancement of cloud servers with a redundancy-based fault-tolerant cache structure	2015	-3.8249500948897452	14.372311035881538	1774935
1777240	EDA	adaptive thermal monitoring of deep-submicron cmos vlsi circuits	2013	-5.192128458311738	13.801536069785385	1777267
1777824	EDA	fighting dark silicon: toward realizing efficient thermal-aware 3-d stacked multiprocessors	2017	-3.4952861273138334	13.843579464280069	1777851
1778572	EDA	n3asics: designing nanofabrics with fine-grained cmos integration	2011	-5.090766348965719	13.365212039937852	1778599
1778660	EDA	spin-transfer torque magnetic random access memory (stt-mram)	2013	-4.581698115225001	13.633497467802409	1778687
1778676	EDA	advanced strain engineering for state-of-the-art nanoscale cmos technology	2011	-5.152913249216523	13.657655428943846	1778703
1779062	Embedded	transient bit error recovery scheme for rom-based embedded systems	2005	-4.674173726318981	13.812714877896571	1779089
1780319	Robotics	development of robust sensor node for internet of things	2013	-4.153242245755424	13.958033929298713	1780346
1780471	EDA	on-chip sensor networks for soft-error tolerant real-time multiprocessor systems-on-chip	2014	-3.5074250293824845	13.979430607304002	1780498
1782604	EDA	on-line single event upset detection and correction in field programmable gate array configuration memories	2010	-4.475976236811723	13.336315934591566	1782631
1783492	Mobile	a comprehensive metering scheme for intellectual property protection during both after-sale and evaluation periods of ic design	2013	-5.210979482355798	15.0133530859745	1783519
1783622	EDA	multi-ported memories for fpgas via xor	2012	-5.178662443157451	13.496641039953886	1783649
1784437	EDA	reverse engineering and prevention techniques for physical unclonable functions using side channels	2014	-5.23349413190741	15.073079124502232	1784464
1784905	EDA	design and implementation of fault-tolerant soft processors on fpgas	2012	-4.1057587345327455	13.525670199497645	1784932
1784963	EDA	guidelines for use of registers and multiplexers in low power low voltage dsp systems	1998	-3.562478686096968	13.342343897494265	1784990
1784981	Arch	continuous signature monitoring: efficient concurrent-detection of processor control errors	1988	-3.891113346331277	13.555834224203956	1785008
1786515	Arch	characterization of error-tolerant applications when protecting control data	2006	-3.984732828011128	13.970022230073994	1786542
1787592	EDA	spin-transistor electronics: an overview and outlook	2010	-4.9186932200618765	13.575132355318296	1787619
1787719	Logic	yielding optimized dependability assurance through bit inversion	2019	-4.619545717455076	14.108526387935688	1787746
1787904	EDA	evaluating the efficiency of using tmr in the high-level synthesis design flow of sram-based fpga	2017	-4.515172195603336	13.441862088427126	1787931
1788218	EDA	modelling and designing reliable on-chip-communication devices in mpsocs with real-time requirements	2008	-3.6681057919119606	13.617038769001573	1788245
1788401	EDA	fast reliability exploration for embedded processors via high-level fault injection	2013	-4.225874325349702	13.389212426440869	1788428
1789846	EDA	digital rf architectures for wireless transceivers (invited)	2011	-3.7024241577114423	13.279244444078193	1789873
1790074	Arch	two-level soft error vulnerability prediction on smt/cmp architectures	2011	-3.438535398319212	13.865525975689774	1790101
1790510	EDA	a process for the detection of design-level hardware trojans using verification methods	2014	-4.840045334384212	14.834383272042858	1790537
1790815	EDA	trojanzero: switching activity-aware design of undetectable hardware trojans with zero power and area footprint	2018	-5.171543275587194	14.7742508338718	1790842
1792239	EDA	protecting dsp circuits through obfuscation	2014	-5.258962049132067	14.794517916359494	1792266
1792764	EDA	design methodology for 2.4ghz dual-core microprocessor	2007	-4.378729821742678	13.336771070522662	1792791
1793951	EDA	introduction to special issue: asynchrony in system design	2011	-3.484645643441132	13.570089350121913	1793978
1794073	EDA	reducing wearout in embedded processors using proactive fine-grain dynamic runtime adaptation	2012	-4.927684490035185	13.873072575761109	1794100
1794346	Arch	e < mc2: less energy through multi-copy cache	2010	-3.8892391248798184	14.449661120401359	1794373
1797023	EDA	thermal management for dependable on-chip systems	2013	-4.63127137872755	13.408359448732293	1797050
1797778	EDA	reliability issues in deep deep sub-micron technologies: time-dependent variability and its impact on embedded system design	2006	-4.715346541958236	13.333038630432785	1797805
1797849	EDA	timing analysis and optimization for 3d stacked multi-core microprocessors	2010	-3.6198194126400742	13.639614302789912	1797876
1798223	EDA	dftt: design for trojan test	2010	-4.838669063397903	14.825901486808474	1798250
1798583	EDA	silicon photonics for on-chip interconnections	2011	-3.7488414252499247	13.725426806180428	1798610
1798933	Embedded	puf based pay-per-device scheme for ip protection of cnn model	2018	-4.955066089098566	15.060451278659091	1798960
1799456	EDA	state retention validation of c66x dsp core	2013	-3.8756826403757585	13.320645181757705	1799483
1799996	EDA	a hybrid fault tolerant architecture for robustness improvement of digital circuits	2011	-5.059446437089723	13.546152773585119	1800023
1800649	AI	on the generalization of composite memristive network structures for computational analog/digital circuits and systems	2014	-4.518748241774758	13.307338182895466	1800676
1801920	Arch	an on-line control flow checking method for vliw processor	2007	-3.787328811591877	13.710363782780984	1801947
1801982	Mobile	efficient self-timed interfaces for crossing clock domains	2003	-4.330575470482395	13.344459796612055	1802009
1802450	HCI	silicon cmos devices beyond scaling	2006	-4.712575754466877	13.468540329772676	1802477
1803586	EDA	optimizing dynamic mapping techniques for on-line noc test	2018	-3.968132428611844	13.72607371411796	1803613
1804055	EDA	trojanguard: simple and effective hardware trojan mitigation techniques for pipelined mpsocs	2017	-3.9431167180665962	13.953868623229447	1804082
1804079	Arch	on the in-field test of branch prediction units using the correlated predictor mechanism	2014	-3.70020711556408	13.262998816487515	1804106
1805250	EDA	extended abstract: circuit cad tools as a security threat	2008	-4.8496326242805425	14.927095717018025	1805277
1805440	EDA	memory trends	2009	-4.082975832331371	13.46295127201026	1805467
1805660	Arch	a secure camouflaged threshold voltage defined logic family	2016	-5.2057558503573	14.867276205731478	1805687
1805979	EDA	technology-design-manufacturing co-optimization for advanced mobile socs	2014	-3.7530243198677593	13.310463873704547	1806006
1807990	Arch	efficient software checking for fault tolerance	2008	-4.1168705595786985	13.897969134296408	1808017
1809638	Logic	a novel fault tolerant approach for sram-based fpgas	1999	-3.877962613115835	13.534838552009418	1809665
1809867	Arch	securing ijtag against data-integrity attacks	2018	-5.017995875906991	15.008109563913507	1809894
1810397	EDA	mitigating the power density and temperature problems in the nano-era	2015	-3.8659704172301312	13.887284283693807	1810424
1810643	EDA	designing bio-inspired autonomous error-tolerant massively parallel computing architectures	2017	-3.8092516289729237	13.493057618768148	1810670
1810652	HPC	a fault tolerance infrastructure for dependable computing with high-performance cots components	2000	-3.9355648819064237	13.775953962490945	1810679
1810735	EDA	cfpu: configurable floating point multiplier for energy-efficient computing	2017	-5.2453363423373185	14.144512993081415	1810762
1810830	SE	a comprehensive framework for counterfeit defect coverage analysis and detection assessment	2014	-4.722329829182574	14.761188693005273	1810857
1812279	Crypto	using gate-level side channel parameters for formally analyzing vulnerabilities in integrated circuits	2019	-4.899799514435571	14.616920770658462	1812306
1812908	EDA	thermal sensor allocation and placement for reconfigurable systems	2009	-4.955399767453355	13.900196691400199	1812935
1814555	Arch	abstract: exploring design space of a 3d stacked vector cache	2012	-4.075232428258229	13.481354997967026	1814582
1814897	Security	cryptographic rights management of fpga intellectual property cores	2002	-4.455070468739351	14.387669837980544	1814924
1815000	EDA	emulation-based test and verification of a design's functional, performance, power, and supply voltage behavior	2013	-4.154075259827989	13.685345180320187	1815027
1816502	EDA	2.5d/3d integration technologies for circuit obfuscation	2016	-4.993318111218343	14.89858989925848	1816529
1816895	EDA	innovative design platforms for reliable socs in advanced nanometer technologies	2007	-4.447229402066681	13.240551927993677	1816922
1817673	Arch	shoestring: probabilistic soft error reliability on the cheap	2010	-4.0498123825174925	14.064196014677222	1817700
1818657	Arch	integrated microarchitectures	2005	-4.578289405486452	13.50610676276579	1818684
1818917	Arch	low active power high speed cache design	2011	-5.255615475411401	13.73786525894976	1818944
1819022	EDA	veboc: variation and error-aware design for billions of devices on a chip	2008	-4.326659664365901	13.673293596143225	1819049
1820215	EDA	reducing the number of sensors under hot spot temperature error bound for microprocessors based on dual clustering	2013	-5.1477311522242175	13.910453065230774	1820242
1820498	HPC	performance-oriented fault tolerance in computing systems	2010	-3.8242028326375497	14.106307536837056	1820525
1821244	EDA	ibm eserver z900 high-frequency microprocessor technology, circuits, and design methodology	2002	-4.079289225411069	13.212797575447519	1821271
1822259	EDA	survey of hardware protection of design data for integrated circuits and intellectual properties	2014	-4.827596999259361	14.83936930457979	1822286
1822852	Arch	wire optimization for multimedia soc and sip designs	2008	-3.928055117873388	13.919947377859756	1822879
1823072	EDA	power-efficient dual-supply 64kb l1 caches in a 65nm cmos technology	2007	-3.4373918436864157	14.216742345011596	1823099
1823794	EDA	a software technique to improve yield of processor chips in presence of ultra-leaky sram cells caused by process variation	2007	-5.1647299298615845	14.049442651669901	1823821
1823914	EDA	cas-fest 2010: mitigating variability in near-threshold computing	2011	-5.006226000887266	13.455235039988786	1823941
1823954	Embedded	complementary formal approaches for dependability analysis	2009	-4.08287542623789	13.316010103543027	1823981
1824117	SE	on the feasibility of automatically detecting and recovering from seus in cyber-physical space systems	2018	-4.029240507256319	13.463024683202514	1824144
1825142	EDA	an integrated ecc and redundancy repair scheme for memory reliability enhancement	2005	-4.572817194104338	13.671808691015348	1825169
1825144	EDA	variability and yield improvement: rules, models, and characterization	2006	-4.044100129174236	13.302698167341108	1825171
1826164	EDA	power and area evaluation of a fault-tolerant network-on-chip	2017	-3.715331472434526	14.417729648591594	1826191
1826165	Vision	an organizational pattern for contributing to the deployment of secure virtual enterprises	2009	-3.9962347993373295	13.827029737531278	1826192
1826791	HPC	cpu-aware, process-level redundancy to tolerate faults in multi-core	2011	-3.460290368653081	14.088057771539154	1826818
1827062	Crypto	low-cost security aware hls methodology	2017	-4.970707445364416	14.855454839823437	1827089
1828168	Arch	fault tolerance on-chip: a reliable computing paradigm using self-test, self-diagnosis, and self-repair (3s) approach	2017	-4.222507520311568	13.380933647389913	1828195
1828453	Arch	centip3de demonstrates more than moore...: technical perspective	2013	-4.249080857945007	13.676292984855369	1828480
1828683	EDA	facilitating side channel analysis by obfuscation for hardware trojan detection	2015	-5.088183557007749	14.79065638625574	1828710
1829404	Embedded	dynamic reconfiguration for management of radiation-induced faults in fpgas	2004	-4.132154991435408	13.34770297715782	1829431
1829720	EDA	low power design based on seed circulation supervisory hand-held device	2011	-3.5614402761997153	13.938611400145295	1829747
1830567	EDA	optimal partitioning of globally asychronous locally synchronous processor arrays	2004	-4.072109501970932	13.889599089632735	1830594
1832115	EDA	a robust architectural approach for cryptographic algorithms using gals pipelines	2011	-5.116755526718912	14.524859960038784	1832142
1832727	EDA	compiler-managed register file protection for energy-efficient soft error reduction	2009	-3.489399305798092	14.36071357043784	1832754
1833631	Security	trojan detection using ic fingerprinting	2007	-5.146673032922831	14.953765421554895	1833658
1834739	EDA	ultralow-energy variation-aware design: adder architecture study	2016	-4.720447167224654	13.930241078286498	1834766
1835512	EDA	functional correctness for cmp interconnects	2011	-3.982108385662829	13.725535849865064	1835539
1835779	EDA	a variation-aware preferential design approach for memory-based reconfigurable computing	2009	-5.262289894366057	13.72282303843914	1835806
