id	area	title	year	x	y	ix
3232217	Mobile	localized construction of low weighted structure and its applications in wireless ad hoc networks	2005	-5.500705476123762	20.172725064353198	3232244
3233113	Mobile	budget constrained relay node placement problem for maximal “connectedness”	2016	-5.681043667917623	20.08019780131763	3233140
3233471	Mobile	energy-efficient strip monitoring by identical devices directed to one side along the strip and having a coverage area in the form of a sector	2017	-5.299671346386371	19.028964569527005	3233498
3234573	Mobile	statistical analysis of quality measures for mobile ad hoc networks	2005	-5.741463670584105	20.48676193155818	3234600
3235865	Mobile	performance analysis of rfid generation-2 protocol	2009	-6.6214500556928835	19.790722224090146	3235892
3236501	Embedded	new algorithms for barrier coverage with mobile sensors	2010	-5.406561174768293	18.992041303057142	3236528
3236561	Mobile	applying cubic spline method to estimate the number of rfid tags in error-prone communication channels	2015	-6.943318292001856	19.52225254268044	3236588
3237444	Mobile	average connectivity properties of wireless ad hoc networks	2003	-6.181853370266055	20.51045987085416	3237471
3243196	Theory	asymptotic distribution of critical transmission radius for greedy forward routing	2011	-6.213297510478169	20.61032474379701	3243223
3243279	Robotics	bounds on minimum number of anchors for iterative localization and its connections to bootstrap percolation	2012	-5.4024320012165745	19.29838910085664	3243306
3243507	Mobile	average interference minimization under the protocol model in wireless sensor networks	2012	-5.968053522158346	20.531230256021537	3243534
3244182	Mobile	the spinning problem	2008	-5.957730286428063	20.1017252224776	3244209
3244445	Mobile	construction of directional virtual backbones with minimum routing cost in wireless networks	2011	-5.553612902567125	20.416842985917338	3244472
3245002	Mobile	on the interdependence of routing and data compression in multi-hop sensor networks	2005	-5.909985177057253	20.13339307545591	3245029
3246639	Mobile	corrective consensus: converging to the exact average	2010	-5.619218104953194	19.34728626358857	3246666
3247000	Mobile	energy-efficient wireless network design	2005	-5.341260555349981	20.45610235193912	3247027
3248105	Mobile	as-you-go deployment of a wireless network with on-line measurements and backtracking	2013	-5.318856319149549	20.02656677921082	3248132
3248264	Mobile	wireless power transfer for access limited wireless underground sensor networks	2016	-6.973286067978452	20.421547017245636	3248291
3251460	Mobile	beating the beat: rssi-based packet combining in concurrent transmission sensor networks: poster abstract	2016	-6.686670644555021	20.83732773687033	3251487
3253421	Mobile	reliability or sustainability: optimal data stream estimation and scheduling in smart water networks	2017	-5.471316593503363	20.3053467636635	3253448
3254353	Robotics	combinatorial approach for geographic routing with delivery guarantees	2014	-5.596542325128406	19.226383885157468	3254380
3256605	Mobile	channel characterization and link quality assessment of ieee 802.15.4-compliant radio for factory environments	2007	-6.73528859235442	19.79345235255324	3256632
3258710	Mobile	performance evaluation of non-persistent csma as anti-collision protocol for active rfid tags	2007	-6.680322645514488	19.706190605674728	3258737
3261301	Metrics	optimal time-resource allocation for activity-detection via multimodal sensing	2009	-5.841303451801952	19.790407468985023	3261328
3262052	Mobile	efficient in-network processing through local ad-hoc information coalescence	2006	-5.516480969487627	20.111833691808013	3262079
3262103	Mobile	improving efficiency of passive rfid tag anti-collision protocol using dynamic frame adjustment and optimal splitting	2018	-6.789568525616004	19.620255721325872	3262130
3270773	Mobile	an adaptive pre-detection based rfid tag anti-collision scheme	2015	-6.797802679725843	19.612722076570872	3270800
3271005	Robotics	power control of an energy harvesting sensor for remote state estimation	2017	-7.0986070333782445	20.349996343009696	3271032
3275687	Mobile	reducing reader collision for mobile rfid	2011	-6.595204824367532	19.8819738281825	3275714
3276685	Mobile	energy balanced scheduling for target tracking with distance-dependent measurement noise in a wsn	2013	-6.361943902302119	19.297007914912367	3276712
3277180	Mobile	an effective heuristic for construction of all-to-all minimum power broadcast trees in wireless networks	2014	-5.4825243031695425	20.82718601085302	3277207
3279469	Mobile	efficient protocol design for dynamic tag population monitoring in large-scale radio frequency identification systems	2013	-6.746206247615589	19.571868862711906	3279496
3281187	Mobile	towards more efficient cardinality estimation for large-scale rfid systems	2014	-6.370306093680867	19.439690595104192	3281214
3283157	Mobile	an enhanced query tree protocol for rfid tag collision resolution with progressive population estimation	2009	-6.7880751623045725	19.546794162503986	3283184
3283162	Mobile	minimum-energy multicasting in asynchronous duty-cycled wireless ad hoc networks	2010	-5.493925864031503	20.489994025793568	3283189
3283708	AI	constructing weakly connected dominating set for secure clustering in distributed sensor network	2012	-5.796983891023779	19.578222987891312	3283735
3283889	Mobile	efficient data retrieval in faulty sensor networks using a mobile mule	2017	-5.406345846391764	19.888548010224927	3283916
3283925	Theory	connectivity of inhomogeneous random key graphs intersecting inhomogeneous erdős-rényi graphs	2017	-6.169486648124253	20.293388983109953	3283952
3284035	Embedded	a new distributed approximation algorithm for constructing minimum connected dominating set in wireless ad hoc networks	2005	-5.583334827170019	20.005645939484847	3284062
3284204	Robotics	an event-based scheduling solution for remote state estimation of two lti systems under bandwidth constraint	2013	-7.009136712895078	19.73334740237476	3284231
3284840	Networks	adaptive frame on binary splitting for radio frequency identification anticollision	2014	-6.813885630916832	19.596550965473345	3284867
3287501	AI	iterated local search for minimum power symmetric connectivity in wireless networks	2009	-5.518625516187892	20.514795845363096	3287528
3289236	Mobile	performance evaluation of distance-hop proportionality on geometric graph models of dense sensor networks	2008	-6.138139850082947	20.348693810152486	3289263
3289468	Mobile	a novel transmission control algorithm for framed-aloha schemes in dense rfid networks	2007	-6.8138855298070595	19.602805794780842	3289495
3290709	Robotics	optimal sensor querying: general markovian and lqg models with controlled observations	2008	-6.775142073821797	19.68384921004873	3290736
3290833	Mobile	measurement based impromptu deployment of a multi-hop wireless relay network	2013	-5.859102526907826	20.50279485938064	3290860
3292178	Mobile	compensation strategy for distributed tracking in wireless sensor networks with packet losses	2015	-5.648956367830037	19.250373804319047	3292205
3294242	Mobile	performance study of anti-collision algorithms for epc-c1 gen2 rfid protocol	2007	-6.8044608753663445	19.588404871220714	3294269
3297149	Mobile	bounding the mean interference in mat\'ern type ii hard-core wireless networks	2013	-6.56972209014331	20.405926368077782	3297176
3303412	Mobile	influence of the distribution of tag ids on rfid memoryless anti-collision protocols	2017	-6.7370786868287995	19.62148497891217	3303439
3304764	Mobile	revisiting planarity in position-based routing for wireless networks	2012	-5.5170137230152365	19.558841334690324	3304791
3306492	Networks	ring versus tree embedding for real-time group multicast	1999	-7.12820833900923	19.085185698868298	3306519
3309117	Vision	fast and reliable tag search in large-scale rfid systems: a probabilistic tree-based approach	2018	-6.745590314523488	19.54140813090085	3309144
3310092	Embedded	an efficient anti-collision protocol using bit change sensing unit in rfid system	2008	-6.715697726215447	19.601807929408988	3310119
3310624	Mobile	distributed wake-up scheduling for energy saving in wireless networks	2011	-5.6239729711840925	20.71422959553211	3310651
3311555	ML	minimum-cost first-push-then-pull gossip algorithm	2012	-5.905244493433675	19.85344136601841	3311582
3313454	Metrics	some fundamental results on base station movement problem for wireless sensor networks	2012	-5.468343447915752	20.19004214335711	3313481
3315025	EDA	gen2-based hybrid tag anti-collision q algorithm using chebyshev’s inequality for passive rfid systems	2008	-6.871559621328879	19.57826509058537	3315052
3316065	Mobile	on the connectivity analysis over large-scale hybrid wireless networks	2010	-5.66863786939375	20.85727707476817	3316092
3317639	EDA	bayesian estimation in dynamic framed slotted aloha algorithm for rfid system	2012	-6.905122189504388	19.560046876344934	3317666
3318854	ECom	minimum connected r-hop k-dominating set in wireless networks	2009	-5.696542257178647	20.130623137466863	3318881
3319690	Mobile	power assignment problems in wireless communication: covering points by disks, reaching few receivers quickly, and energy-efficient travelling salesman tours	2011	-5.786143328421495	20.575473471164344	3319717
3320008	Mobile	minimum-energy broadcast with few senders	2007	-5.668043777946753	20.354479768865176	3320035
3320836	Theory	experimental comparison of algorithms for energy-efficient multicasting in ad hoc networks	2004	-5.4229255572048665	20.195782433170056	3320863
3323269	Theory	geometric spanners for wireless ad hoc networks	2002	-5.438878279686958	19.78923294627811	3323296
3324822	Theory	deterministic m2m multicast in radio networks: (extended abstract)	2004	-5.9361375955402425	19.997870877832565	3324849
3325985	Mobile	corrective consensus with asymmetric wireless links	2011	-5.724738213403027	19.47476852965778	3326012
3326512	AI	minimizing interference in ad-hoc networks with bounded communication radius	2011	-5.936661624283775	20.033554957127524	3326539
3326762	Theory	on the relations between sinr diagrams and voronoi diagrams	2015	-6.871277810641332	20.381953997175035	3326789
3326930	Embedded	tracing a linearly moving node from asynchronous time-of-arrival measurements	2016	-6.864017460677983	19.552540947545182	3326957
3328430	Embedded	multi-objective optimization for distributed collaborative beamforming in mobile wireless sensor networks	2018	-5.329165883801716	20.56947725276956	3328457
3329465	Mobile	covariance-based transmission power control for estimation over wireless sensor networks	2018	-7.162111587437238	20.403804617744328	3329492
3330609	Metrics	distributional properties of euclidean distances in wireless networks involving road systems	2009	-6.403316600543429	20.490995646432047	3330636
3331019	Mobile	parameterized complexity of max-lifetime target coverage in wireless sensor networks	2014	-5.726824781333914	20.06160768522973	3331046
3331491	Mobile	on the properties of giant component in wireless multi-hop networks	2009	-6.20733904447067	20.737356479601214	3331518
3331606	Mobile	a statistical model for the connectivity of nodes in a multi-sink wireless sensor network over a bounded region	2008	-5.87756889736517	20.261808919846576	3331633
3331891	Mobile	near-optimal activation policies in rechargeable sensor networks under spatial correlations	2003	-5.992398548724222	20.296836667351656	3331918
3333523	Mobile	minimum energy broadcast routing in ad hoc and sensor networks with directional antennas	2009	-5.37656172040446	20.36815874721199	3333550
3333798	Theory	optimum locations on a graph with probabilistic demands	1966	-5.54297709317402	19.24424907885844	3333825
3335028	Embedded	asymptotically optimal parameter estimation with scheduled measurements	2013	-6.909131845758085	19.480377220210496	3335055
3336039	Robotics	a tractable framework for exact probability of node isolation and minimum node degree distribution in finite multihop networks	2014	-6.1629232494420325	20.682989029806272	3336066
3337573	Theory	exact and approximate link scheduling algorithms under the physical interference model	2008	-6.509299183426435	20.590320999861763	3337600
3337681	Theory	the range assignment problem in non-homogeneous static ad-hoc networks	2004	-5.712827134101541	20.193668650647343	3337708
3338349	Theory	on simple back-off in complicated radio networks	2018	-5.941472311746894	20.541043337675703	3338376
3339274	DB	a novel anti-collision scheme for rfid systems	2014	-6.7377412161885255	19.516642855858347	3339301
3339784	Metrics	performance analysis of tag identification time in passive rfid systems	2016	-6.795786417578938	19.62634436624354	3339811
3339867	Theory	localized spanners for ad hoc wireless networks	2010	-6.015716653962556	19.50419725973401	3339894
3343149	Robotics	generalized voronoi partition: a new tool for optimal placement of base stations	2011	-6.451385737539157	19.911203554534236	3343176
3343426	Mobile	an adaptive ternary query splitting based tag anti-collision protocol for mobile rfid systems	2016	-6.787852006168626	19.59598967075652	3343453
3344780	Mobile	robust statistical methods for detection of missing rfid tags	2011	-6.649946549590773	19.66025922771151	3344807
3345417	Mobile	state estimation over sensor networks with correlated wireless fading channels	2013	-7.007224682760463	20.723478604075893	3345444
3345533	Mobile	collision alignment: an rfid anti-collision algorithm assisted by orthogonal signal detection and analogy principle	2017	-7.088603018602787	19.528049995124636	3345560
3347009	Robotics	achieving connectivity through coalescence in mobile robot networks	2007	-5.732780412777853	20.26587598182768	3347036
3349774	ECom	maximum matching in multi-interface networks	2013	-6.1317126671766164	20.04506392319087	3349801
3350980	Mobile	a dynamic framed slotted aloha algorithm using collision factor for rfid identification	2009	-6.832921136477968	19.57604535195025	3351007
3351133	Embedded	minimum interference planar geometric topology in wireless sensor networks	2009	-5.882495272919013	20.119822610274593	3351160
3352479	Theory	on the distribution of random geometric graphs	2018	-6.225171782184481	20.611681447921352	3352506
3352736	Theory	the threshold behaviour of the fixed radius random graph model and applications to the key management problem of sensor networks	2006	-5.822552216612901	20.184373527231468	3352763
3354190	Theory	minimum eccentricity multicast trees	2001	-5.7304132203798925	20.113972800654953	3354217
3354875	HPC	adaptive probabilistic flooding for nanonetworks employing molecular communication	2016	-5.401215846633325	20.79019468893127	3354902
3355258	Embedded	minimum node degree and k-connectivity in wireless networks with unreliable links	2014	-6.040048908220492	20.24659184026117	3355285
3358840	Mobile	stability analysis of an efficient anti-collision protocol for rfid tag identification	2012	-6.725712420302143	19.62839392094041	3358867
3359208	Mobile	construction of strategic connected dominating set for mobile ad hoc networks	2014	-5.695054622305398	19.913810202143058	3359235
3359667	Mobile	assigned tree slotted aloha rfid tag anti-collision protocols	2013	-6.790687802031955	19.609846856967405	3359694
3360700	Embedded	a load-balanced topology maintenance with partial reconstruction of connected dominating sets	2011	-5.409665768473665	19.735793928927496	3360727
3361084	Mobile	enhancement of redundant reader elimination by using hybrid algorithm in rfid systems	2013	-5.402775225616283	19.351985324258454	3361111
3362178	Mobile	dfra: demodulation-free random access for uav ad hoc networks	2017	-6.694500267567253	20.24460160675963	3362205
3362842	Robotics	connected coverage in three-dimensional wireless sensor networks using convex polyhedral space-fillers	2017	-5.398745083075426	19.152362060233788	3362869
3363572	Mobile	dbf: a general framework for anomaly detection in rfid systems	2017	-6.752432654664031	19.50897337154722	3363599
3363778	Mobile	data aggregation over multiple access wireless sensors network	2017	-5.991593836115331	20.192705217739228	3363805
3364955	Mobile	distributed virtual backbone construction in sensor networks with asymmetric links	2011	-5.782564056519947	19.884851160672845	3364982
3365197	DB	fast collection of data in sensor-augmented rfid networks	2016	-6.585464108421003	19.521619055843228	3365224
3365460	Mobile	on positioning performance for the narrow-band internet of things: how participating enbs impact?	2019	-7.143892261542062	19.710927259820878	3365487
3367866	Mobile	distributed computation of virtual coordinates for greedy routing in sensor networks	2011	-5.4622648100954185	19.628704598712197	3367893
3368399	Mobile	cramer-rao lower bound for the clock offset of silent nodes synchronizing through a general sender-receiver protocol in wireless sensornets	2008	-5.757080699785857	19.287458407039736	3368426
3369022	Mobile	on the connectivity of circularly distributed nodes in ad hoc wireless networks	2008	-6.431832946195258	20.697213358470698	3369049
3369597	Mobile	modeling and connectivity analysis in obstructed wireless ad hoc networks	2012	-6.0701018716217385	20.438112673300342	3369624
3370052	Theory	estimating time complexity of rumor spreading in ad-hoc networks	2013	-5.9476003455700575	19.966101730963697	3370079
3370873	Mobile	a collision-tolerant-based anti-collision algorithm for large scale rfid system	2017	-6.837581312304965	19.616755652862878	3370900
3371039	Metrics	a distributed algorithm for min-max tree and max-min cut problems in communication networks	2010	-5.507586665318657	20.193423667519298	3371066
3375245	Theory	min-energy broadcast in mobile ad hoc networks with restricted motion	2012	-6.349098783833868	19.89655871847153	3375272
3375742	Theory	connectivity of large scale networks: emergence of unique unbounded component	2011	-6.446094052514624	20.29459578280947	3375769
3378776	Theory	polynomial time approximation schemes for base station coverage with minimum total radii	2005	-6.331328336758106	20.40164770457866	3378803
3382906	AI	decentralized fault-tolerant connected dominating set algorithm for mobile ad hoc networks	2009	-5.6292018303632805	19.76968095109033	3382933
3383850	AI	finding the optimal location and allocation of relay robots for building a rapid end-to-end wireless communication	2016	-5.720806785224172	20.346126210487718	3383877
3386044	Theory	bounded stretch geographic homotopic routing in sensor networks	2014	-5.506939478691079	19.389814006291022	3386071
3386687	ECom	tightening the upper bound for the minimum energy broadcasting	2008	-5.899854258982368	20.10965532279457	3386714
3388483	EDA	optimal design of cognitive radio wireless parameters based on non-dominated neighbor distribution genetic algorithm	2009	-5.5698274040958236	20.207178314912955	3388510
3388936	Robotics	a communication-aware framework for robotic field estimation	2011	-5.304802053196078	19.21110733167516	3388963
3389083	Theory	expected sum and maximum of displacement of random sensors for coverage of a domain: extended abstract	2013	-5.747643146477829	19.2754797429355	3389110
3391452	Mobile	results on finite wireless sensor networks: connectivity and coverage	2013	-6.143348909355363	20.75566729776113	3391479
3392706	Theory	brief announcement: set it and forget it - approximating the set once strip cover problem	2013	-5.501633847063752	19.373434034908236	3392733
3392825	Vision	decentralized activation in sensor networks - global games and adaptive filtering games	2011	-6.326148405451844	20.204859604739013	3392852
3393324	Theory	tree bound on probabilistic connectivity of underwater sensor networks	2014	-5.414636634168731	19.890092634201647	3393351
3395863	Robotics	multi-hop greedy gossip with eavesdropping	2009	-6.34934403189816	19.469336446327414	3395890
3400039	Theory	scalability of node degrees in random wireless network topologies	2009	-6.096933515965907	20.388859187485235	3400066
3400078	Mobile	topology control of ad hoc wireless networks for energy efficiency	2004	-5.329701054948544	20.73159025645246	3400105
3402116	Networks	proximal labeling for oblivious routing in wireless ad hoc networks	2009	-5.3287986243089405	19.74960320689781	3402143
3402131	Security	optimal gathering protocols on paths under interference constraints	2009	-6.181523953724456	20.28326761028111	3402158
3402983	Mobile	a pomdp framework for heterogeneous sensor selection in wireless body area networks	2012	-6.493232333615757	19.93830939837308	3403010
3403035	Mobile	minimum latency gossiping in radio networks	2010	-5.7697706790448295	19.862316825139594	3403062
3405105	Theory	improved topology control algorithms for simple mobile networks	2009	-5.467450468827269	20.09144215382335	3405132
3405462	Arch	xtc: a practical topology control algorithm for ad-hoc networks	2004	-5.854300476814625	19.732665067063547	3405489
3405610	Metrics	a high reliability asymptotic approach for packet inter-delivery time optimization in cyber-physical systems	2015	-7.071520382617367	19.899026184492804	3405637
3405766	Robotics	designing securely connected wireless sensor networks in the presence of unreliable links	2011	-6.155723911058764	20.170808965245968	3405793
3407884	Theory	analysis of connectedness of the fixed radius random graph model in one-dimensional space	2005	-6.117511656369723	20.536714160584673	3407911
3408133	ECom	constructing minimum-energy broadcast trees in wireless ad hoc networks	2002	-5.673434982348289	20.44484932538344	3408160
3408184	Theory	radio network distributed algorithms in the unknown neighborhood model	2010	-6.216001604654207	19.658188139226922	3408211
3408382	Theory	weak communication in radio networks	2002	-6.218970161701223	19.978959478886786	3408409
3409531	Mobile	target tracking via crowdsourcing: a mechanism design approach	2015	-6.114327348252831	20.30689604386896	3409558
3410750	Robotics	cross-layer design of networked control systems	2009	-7.0703037789848615	20.69541472001428	3410777
3412376	Mobile	an efficient anti-collision protocol for rfid tag identification	2010	-6.783149569221518	19.557693495582107	3412403
3412700	Robotics	the speed of greed: characterizing myopic gossip through network voracity	2009	-6.317189469426188	19.465053378466934	3412727
3413547	Mobile	charging state aware optimal auction design for sensor selection in crowdsourcing based sensor networks	2016	-6.443125082608108	20.272428293971647	3413574
3413655	Mobile	energy efficiency of centralized and distributed computation in unattended multi-hop wireless sensor networks for battlefield monitoring	2010	-6.778607572704648	20.552829297442567	3413682
3414750	Mobile	multiple rfid tags access algorithm	2010	-6.874005559825454	19.524750685426415	3414777
3415268	Mobile	blackbone2, an efficient deterministic algorithm for creating 2-connected m-dominating set-based backbones in ad hoc networks	2009	-5.5925172227683	19.849625781051255	3415295
3415761	Theory	heuristic algorithms for constructing connected dominating sets with minimum size and bounded diameter in wireless networks	2010	-5.765400249021099	19.910885019022555	3415788
3416500	Embedded	self-stabilizing distributed formation of minimal k-dominating sets in mobile ad hoc networks	2014	-5.388350029746307	19.587757919865197	3416527
3417613	Embedded	computing the probability of specific random sector graphs with applications in wireless networks with directional antennas	2014	-5.802150447021356	20.10078429492159	3417640
3418056	Mobile	a theoretical foundation of network localization and navigation	2018	-7.189037493503423	19.41228862377577	3418083
3419063	Theory	distributed algorithms for constructing approximate minimum spanning trees in wireless sensor networks	2009	-5.530677295843455	19.876636124007465	3419090
3424415	ECom	solvability of geocasting in mobile ad-hoc networks	2007	-5.719157338623207	19.739548211209673	3424442
3425901	Robotics	qos constrained optimal sink and relay placement in planned wireless sensor networks	2014	-5.4270745960276265	20.515689462744394	3425928
3426688	Robotics	sensor network deployment using circle packings	2007	-5.307901889552536	19.056613507450194	3426715
3426813	Mobile	a unified energy-efficient topology for unicast and broadcast	2005	-5.388539897553066	20.29461592372619	3426840
3427935	Embedded	wireless sensor network scheduling for remote estimation under energy constraints	2017	-7.100593591819061	20.053115717951037	3427962
3428567	Embedded	percolation in directed random geometric graphs	2012	-6.021134228467182	20.54102914612318	3428594
3432424	Robotics	symmetric connectivity with minimum power consumption in radio networks	2002	-5.578547720693597	20.40133544259856	3432451
3434194	Embedded	distributed source coding in wireless sensor networks	2005	-6.2587507818116785	20.494971087342385	3434221
3434661	ML	connectivity in obstructed wireless networks: from geometry to percolation	2013	-5.9843756156471315	20.567247969149246	3434688
3434864	Robotics	a mobile system for non-centralized target tracking in presence of dynamic interferences	2013	-6.511382570227298	19.343461585790237	3434891
3435490	Mobile	token-based data collection protocols for multi-hop underwater acoustic sensor networks: short paper	2009	-5.35732591968791	20.26147551966058	3435517
3435651	DB	anticipative inquiry scheme for efficient rfid tag identification	2009	-6.756710181068934	19.59379560953649	3435678
3437209	Robotics	artificial neural networks for estimation and fusion in long-haul sensor networks	2015	-6.95861594920917	19.98666648735493	3437236
3438673	Mobile	efficiency analysis on an information sharing process with randomly moving mobile sensors	2008	-5.737518769428317	20.32709419517242	3438700
