id	area	title	year	x	y	ix
2045916	Theory	minimize the maximum duty in multi-interface networks	2011	-6.1333509533443245	20.02311062064468	2045943
2047817	Theory	a bluetooth scatternet formation algorithm	2001	-5.427606818391631	19.833794530009637	2047844
2049114	Robotics	a distributed algorithm for network-wide clock synchronization in wireless sensor networks	2013	-5.935022610231874	19.28241422036344	2049141
2049491	Theory	topology control with limited geometric information	2005	-5.4292204093642455	19.844072844777962	2049518
2049604	Mobile	the impact of transmit rate control on energy-efficient estimation in wireless sensor networks	2012	-6.512584927244588	20.76866296978964	2049631
2052459	Mobile	graph-based joint signal/power restoration for energy harvesting wireless sensor networks	2017	-5.8785255242532735	20.180954209263657	2052486
2053151	ML	variable neighborhood search variants for min-power symmetric connectivity problem	2017	-5.543876352818262	20.393611988911157	2053178
2053463	Mobile	an exponential improvement on the mst heuristic for minimum energy broadcasting in ad hoc wireless networks	2007	-5.6917440545810525	20.337930176786994	2053490
2054485	Mobile	efficient framed slotted aloha protocol for rfid tag anticollision	2011	-6.792202096835178	19.62270113139002	2054512
2054532	ECom	percolation in the secrecy graph	2011	-6.354179301899864	20.456413864621414	2054559
2054909	Mobile	a multiple hashing approach to complete identification of missing rfid tags	2014	-6.798272485479424	19.581114626817374	2054936
2055814	Mobile	quantifying the channel quality for interference-aware wireless sensor networks	2011	-6.930103186955559	20.818681696965875	2055841
2058614	Embedded	maximizing aggregated information in sensor networks under deadline constraints	2011	-5.667524837169057	20.479873360475505	2058641
2058833	Mobile	redundant reader elimination for directional antenna in rfid systems	2011	-6.0100373313387365	19.389622522503977	2058860
2059818	Visualization	towards adaptive continuous scanning in large-scale rfid systems	2014	-6.800179338568188	19.515834187139514	2059845
2060839	Mobile	temporally staggered sensing for field estimation with quantized data in wireless sensor networks	2012	-6.821155844117903	19.29918562204932	2060866
2060963	Web+IR	weight decision scheme based on slot-count in gen-2 q-algorithm	2011	-6.811820882253881	19.55931881353787	2060990
2062784	Mobile	a new greedy algorithm for constructing the minimum size connected dominating sets in wireless networks	2017	-5.3282179091335715	20.1895936749489	2062811
2064818	Embedded	fast interference-aware scheduling of multiple wireless chargers	2018	-5.32001449738098	20.2912491496682	2064845
2065184	Networks	cardinality estimation using collective interference for large-scale rfid systems	2017	-6.5864704088146215	19.606684141298548	2065211
2065545	EDA	path-search algorithm introducing path-management tables for a ds-cdma mobile terminal	2002	-6.982981694903828	19.62139165095744	2065572
2068217	Mobile	event-triggered decision propagation in proximity networks	2014	-6.4614859557073805	20.399113975569865	2068244
2068273	Embedded	event-based sensor data scheduling: trade-off between communication rate and estimation quality	2013	-6.998531635583554	19.74365752675344	2068300
2069563	Mobile	a novel tag identification algorithm for rfid system using uhf	2005	-6.840981242985227	19.56285653741288	2069590
2069807	Mobile	maximum likelihood estimation of clock skew in sparse one-way packet transmissions for machine type communication applications	2016	-5.562046010948126	19.296184653325007	2069834
2070540	AI	an inhomogeneous spatial node distribution and its stochastic properties	2007	-6.5369622857251	20.47578104691469	2070567
2072893	Mobile	afsa: an efficient framework for fast rfid tag reading in dense environments	2007	-6.756305831401937	19.618529736897987	2072920
2073204	Embedded	topological analysis of satellite-based distributed sensor networks	1991	-5.330971523949573	19.389148596578305	2073231
2073300	Theory	a simple improved distributed algorithm for minimum cds in unit disk graphs	2005	-5.773026700693624	19.84261228616202	2073327
2075590	Mobile	connectivity analysis of clustered ad hoc and mesh networks	2007	-5.8843527663417845	20.76963620696472	2075617
2076736	HCI	place: physical layer cardinality estimation for large-scale rfid systems	2015	-6.6870974695914125	19.66947403195741	2076763
2079102	Metrics	timely updates in energy harvesting two-hop networks: offline and online policies	2018	-6.6636131098763585	20.487347592452547	2079129
2079995	Mobile	binary tree slotted aloha for passive rfid tag anticollision	2013	-6.8455566315269545	19.58502611982659	2080022
2081497	Theory	monitoring the plane with rotating radars	2015	-5.673265678581427	19.24041288379264	2081524
2081557	Mobile	radiation constrained scheduling of wireless charging tasks	2018	-5.296299804313383	19.91894408521591	2081584
2082087	Robotics	smart trend-traversal protocol with shortcutting for memory-less rfid tag collision resolution	2012	-6.773649117891236	19.55079330271043	2082114
2083490	Robotics	coded quickest classification for multiple power quality events in smart grid	2017	-7.191537449809637	19.92463816970046	2083517
2083547	Arch	percolation for d2d networks on street systems	2018	-6.196015532317487	20.62581619806843	2083574
2084397	Mobile	cardinality estimation algorithm in large-scale anonymous wireless sensor networks	2017	-5.7016739492340704	19.270539598477463	2084424
2085578	Mobile	solving a 2-covered path problem with variable radii for wireless sensor networks	2012	-5.422872758348615	19.91876525931236	2085605
2085698	Vision	spectrum patrolling with crowdsourced spectrum sensors	2018	-5.481426413878723	19.340250997815822	2085725
2087120	Robotics	measuring inhomogeneity in spatial distributions	2008	-5.7282918967174945	20.353373245135593	2087147
2087646	Mobile	distributed algorithms for maximum clique in wireless networks	2015	-5.794871171007447	20.0927986861008	2087673
2087855	Mobile	a stochastic model for the analysis of session and power switching effects on the performance of uhf rfid system with mobile tags	2018	-6.8070781362192525	19.6468082243689	2087882
2087915	Theory	the distributed wireless gathering problem	2011	-5.668318820375893	20.167836400127765	2087942
2089672	Mobile	a combination of wireless multicast advantage and hitch-hiking	2005	-5.438405381385063	20.71325029981595	2089699
2090636	Theory	on the stability of paths, steiner trees and connected dominating sets in mobile ad hoc networks	2008	-5.404347551134204	19.99662262543848	2090663
2090738	Mobile	on the coverage process of a moving target in a dynamic nonstationary sensor field	2008	-6.534255069811097	19.902249931303135	2090765
2091965	Mobile	an energy-efficient initialization protocol for wireless sensor networks	2001	-5.514506940550522	19.923572069674943	2091992
2092719	Mobile	efficient unknown tag detection in large-scale rfid systems with unreliable channels	2017	-6.891729441099867	19.609820082234982	2092746
2092856	Mobile	design of a quaternary query tree aloha protocol based on optimal tag estimation method	2016	-6.789575830401577	19.566145178640607	2092883
2093711	Mobile	optimal design of distributed sensor networks for field reconstruction	2013	-5.517340813065992	19.884802856508948	2093738
2095304	Mobile	scalable routing in 3d high genus sensor networks using graph embedding	2012	-5.738914557913271	19.2079454796998	2095331
2095580	Mobile	bit level synchronized mac protocol for multireader rfid networks	2010	-6.7353035747906915	19.76344863370499	2095607
2098738	Mobile	space and time curvature in information propagation in massively dense ad hoc networks	2004	-5.871383645395065	20.57430900498194	2098765
2100125	Mobile	minimum-energy broadcasting in static ad hoc wireless networks	2002	-5.5109905215354384	20.57528521584713	2100152
2100732	HCI	model of a random geometric graph with attachment to the coverage area	2017	-5.609352047486281	19.683621205680197	2100759
2101611	Mobile	energy efficient spectrum sensing for state estimation over a wireless channel	2014	-7.049432091756708	20.228437251923346	2101638
2102527	ECom	finding mobile data under delay constraints with searching costs	2010	-6.748933188887259	20.24602863242761	2102554
2102548	Mobile	a voronoi diagram approach for mobile element scheduling in sparse sensor networks	2008	-5.5162264408698665	19.86893470243168	2102575
2103728	EDA	hybrid teaching-learning optimization of wireless sensor networks	2017	-5.566159533831131	20.012618662625968	2103755
2105869	DB	approximation algorithm for sweep coverage on graph	2015	-5.35062604974453	19.371422663810247	2105896
2106578	Metrics	precise time system efficiency of a frame slotted aloha based anti-collision algorithm in a rfid system	2013	-6.845429009602418	19.70790417144532	2106605
2106885	Mobile	efficient anti-collision algorithm using variable length id in rfid systems	2010	-6.827309718184638	19.518117669314925	2106912
2108381	Robotics	geographical cluster based multihop ad hoc network routing with guaranteed delivery	2005	-5.363488870895723	19.90174350643265	2108408
2109041	Mobile	low-complexity energy-efficient broadcasting in one-dimensional wireless networks	2012	-5.713672288671925	20.541575611297787	2109068
2110153	Embedded	non-bayesian quickest change detection with stochastic sample right constraints	2013	-7.186276994189893	20.221586884303225	2110180
2113376	Embedded	on power and energy trends of ieee 802.11n phy	2009	-6.868447950279613	20.193779943051243	2113403
2113460	EDA	cdma-based anti-collision algorithm for epc global c1 gen2 systems	2018	-7.1532041419772066	19.68852650979943	2113487
2113809	Mobile	optimal deployment of large wireless sensor networks	2006	-5.495423651682938	20.790376508251715	2113836
2115092	Theory	neighborhood-based topology recognition in sensor networks	2004	-5.307281637766785	19.34446894974211	2115119
2116188	Embedded	a column generation method for constructing and scheduling multiple forwarding trees in wireless sensor networks	2016	-5.441423007546587	20.787088341837624	2116215
2117842	Metrics	analytical and experimental performance evaluation of ble neighbor discovery process including non-idealities of real chipsets	2017	-6.756230666328173	19.59833649840779	2117869
2119122	Theory	wireless aggregation at nearly constant rate	2018	-5.838196425638548	20.487556507681397	2119149
2120398	Mobile	connectivity of multihop wireless networks with log-normal shadowing	2015	-6.233935684627916	20.838297758195374	2120425
2120721	EDA	minimizing the total cost of barrier coverage in a linear domain	2018	-5.454312120423538	19.311366110430654	2120748
2123133	AI	optimal transmission policies for energy harvesting devices with limited state-of-charge knowledge	2014	-5.4075880186134695	20.422199280375413	2123160
2124543	Theory	a convex-hull based algorithm to connect the maximal independent set in unit-disk graphs	2006	-5.731047635516662	19.777587005887888	2124570
2125006	Mobile	optimal energy requesting strategy for rf-based energy harvesting wireless communications	2017	-5.560347277875646	20.478403037599687	2125033
2126227	Mobile	toward quasiregular sensor networks: topology control algorithms for improved energy efficiency	2006	-5.731914319898462	20.184015637880474	2126254
2127060	Logic	efficient algorithm for placing base stations by avoiding forbidden zone	2005	-6.844404590717097	20.448800741961115	2127087
2128311	Mobile	performance improvement of hybrid tag anti-collision protocol for radio frequency identification systems	2013	-6.831785235731932	19.53872533736572	2128338
2128933	Mobile	distance-based location update and routing in irregular cellular networks	2005	-5.974270736480468	19.57787531664598	2128960
2132410	Visualization	an efficient query tree protocol for rfid tag anti-collision	2014	-6.733077937708415	19.610173691885873	2132437
2132577	DB	constructing minimum connected dominating sets with constant update time in wireless ad-hoc sensor networks	2014	-5.338957100601836	20.039572862978762	2132604
2132815	Robotics	cost optimized distributed source coding for data gathering single-hop wireless sensor networks	2010	-5.646057426079778	20.760059638862653	2132842
2133289	Mobile	fast rfid counting under unreliable radio channels	2009	-6.849423865758218	19.97064208429609	2133316
2140415	Embedded	constant approximation for virtual backbone construction with guaranteed routing cost in wireless sensor networks	2011	-5.54283398708877	19.980374441277498	2140442
2141429	Theory	on the asymptotic connectivity of random networks under the random connection model	2011	-6.438185123647656	20.306284367925496	2141456
2143444	Mobile	many-to-one deliverability of greedy routing in 2-d wireless sensor networks	2011	-5.607361749177515	20.809417506403754	2143471
2144769	Mobile	opportunistic manets: mobility can make up for low transmission power	2013	-5.605795229058164	20.31333054645128	2144796
2147694	Robotics	statistical analysis of stochastic multi-robot boundary coverage	2014	-5.477484240361104	19.41729026203995	2147721
2148935	Mobile	an energy-efficient communication scheme for wireless networks: a redundant radix-based approach	2010	-6.552552479315443	20.71732313230615	2148962
2149088	Mobile	iss-tca: an identified slot scan-based tag collection algorithm for performance improvement in active rfid systems	2012	-6.766124182611646	19.580893415818547	2149115
2149307	Theory	on the eschenauer-gligor key predistribution scheme under on-off communication channels: the absence of isolated nodes	2015	-6.2310474742242565	20.357227491585164	2149334
2149430	Theory	joint base station scheduling	2004	-6.119278734402752	20.50989061040467	2149457
2150187	Mobile	collision avoidance in a dense rfid network	2006	-6.496973300910222	19.482220168145968	2150214
2150205	Mobile	an estimation scheme based on pairwise broadcast to synchronize wireless sensor networks	2016	-5.737988897978357	19.30535384745983	2150232
2150216	Theory	optimal relay location for resource-limited energy-efficient wireless communication	2006	-5.586963725157956	20.224342250025188	2150243
2151431	Embedded	analysis of synchronization algorithms with time-out control over networks with exponentially symmetric delays	2002	-6.143750326926828	19.263285018367732	2151458
2151709	DB	approximations for characteristics of nomadic communications	2000	-6.0786179752703475	20.632562046578627	2151736
2152136	Mobile	maximum lifetime of the wireless sensor network and the gossip problem	2018	-5.77863087908106	20.15610977837649	2152163
2152251	Mobile	efficient solutions framework for optimal multitask resource assignments for data fusion in wireless sensor networks	2014	-5.341526533504567	19.888151812805194	2152278
2153239	Theory	planar hop spanners for unit disk graphs	2010	-5.977472307861611	19.678983111476594	2153266
2153251	Embedded	on bounding node-to-sink latency in wireless sensor networks with multiple sinks	2013	-5.590706683364076	20.35233660306308	2153278
2153472	EDA	a new collision arbitration algorithm for fm0 code in rfid applications	2007	-6.718505838739116	19.593092659077172	2153499
2153733	Theory	distributed models and algorithms for survivability in network routing	2000	-5.632302763719356	20.110145752966954	2153760
2154625	Visualization	rfid reader anti-collision algorithm using a server and mobile readers based on conflict-free multiple access	2008	-6.421963552839456	19.92064056321628	2154652
2155493	Theory	leader election in unreliable radio networks	2016	-6.244738716130366	19.667957503523677	2155520
2156147	Theory	probabilistic connectivity threshold for directional antenna widths - (extended abstract)	2013	-6.16449934146456	20.362640088200887	2156174
2162255	Embedded	age of information in multi-source systems	2017	-6.098822963307005	20.036713404078576	2162282
2163168	ML	on computing compression trees for data collection in sensor networks	2009	-5.478688740364156	19.954896419209717	2163195
2165293	Theory	approximation and heuristic algorithms for computing backbones in asymmetric ad-hoc networks	2017	-5.820685028360463	20.068609912513367	2165320
2165778	ECom	on efficient resource allocation in the internet of things environment	2018	-6.066081587885036	20.201040861393302	2165805
2167418	ECom	multi-message broadcast with abstract mac layers and unreliable links	2014	-5.591844761384358	20.22841067771368	2167445
2169014	Vision	anonymous temporal-spatial joint estimation at category level over multiple tag sets	2018	-5.968319845953696	19.1301171952848	2169041
2169182	Mobile	a centrality-based rsu deployment approach for vehicular ad hoc networks	2017	-5.403550639914156	20.65442733293776	2169209
2170873	Embedded	sensor networks protocol design using random markov field theory	2009	-5.517405238383273	20.295729181470747	2170900
2171117	Embedded	a framework for energy consumption based design space exploration for wireless sensor nodes	2008	-6.192046030126995	20.682892958987264	2171144
2172148	EDA	randomized k-coverage algorithms for dense sensor networks	2007	-5.301980826735303	19.802664685938737	2172175
2174594	Mobile	connectivity and critical point behavior in mobile ad hoc and sensor networks	2009	-6.026964897050799	20.434050784113868	2174621
2174619	Mobile	an efficient bit-detecting protocol for continuous tag recognition in mobile rfid systems	2018	-6.77779279045217	19.57955107536437	2174646
2174873	HCI	opportunistic coverage for urban vehicular sensing	2015	-6.347823417262763	19.815689580045266	2174900
2179178	Vision	a group of people acts like a black body in a wireless mesh network	2007	-6.277252581397348	19.720019971185295	2179205
2181930	Vision	cucker-smale flocking with randomly failed interactions	2015	-6.018206144888665	19.795993533395183	2181957
2182829	DB	weighted broadcast in linear radio networks	2008	-6.474924996319536	19.845377810325516	2182856
2182962	Mobile	the degrees of freedom of wireless networksvia cut-set integrals	2011	-6.477416828136188	20.5632544177995	2182989
2183064	Mobile	staggered scheduling of estimation and fusion in long-haul sensor networks	2013	-6.911290215934433	20.039801153926113	2183091
2184716	Mobile	optimal placement and routing strategies for resilient two-tiered sensor networks	2009	-5.313755290916039	20.394273660526768	2184743
2184830	DB	a combined polling and random access technique for enhanced anti-collision performance in rfid systems	2009	-6.725882104892363	19.786444630929306	2184857
2187089	Mobile	efficient anonymous category-level joint tag estimation	2016	-5.951418364312635	19.10421365354716	2187116
2188527	Embedded	fundamental limits on synchronization of affine clocks in networks	2007	-6.205336555011714	19.274000867486656	2188554
2189980	Embedded	fundamental protocols for wireless sensor networks	2001	-5.51373818705668	19.931233534020453	2190007
2191096	Mobile	deployment algorithms for wireless underground sensor networks using magnetic induction	2010	-5.353508321076879	19.347004344800013	2191123
2191323	EDA	frequency assignment and multicoloring powers of square and triangular meshes	2005	-6.668951229976488	20.720196762665054	2191350
2191537	Mobile	token-mac: a fair mac protocol for passive rfid systems	2011	-6.511795473380785	19.79840373578265	2191564
2191622	Metrics	on the clustering properties of exponential random networks	2005	-6.181538145855402	20.40752694782309	2191649
2194597	Robotics	multi-objective clustering optimization for multi-channel cooperative spectrum sensing in heterogeneous green crns	2016	-6.245075163574207	20.853649040352927	2194624
2195430	ML	anchored desynchronization	2012	-5.671974454383003	19.763752997591983	2195457
2195504	Mobile	wsn18-5: asymptotic distribution of the number of isolated nodes in wireless ad hoc networks with unreliable nodes and links	2006	-6.215082002268021	20.38262776115421	2195531
2195646	Mobile	multi-sensor event detection under temporal correlations with renewable energy sources	2009	-6.444879692303353	19.988119301990412	2195673
2195987	Mobile	secure connectivity of wireless sensor networks under key predistribution with on/off channels	2017	-5.8146781566518975	20.348555483331584	2196014
2196634	Mobile	topological properties of secure wireless sensor networks under the $q$ -composite key predistribution scheme with unreliable links	2017	-5.933935851935532	20.360775770825136	2196661
2197580	Networks	constructing perimeter barrier coverage with bistatic radar sensors	2015	-5.59211798536829	19.38716500619579	2197607
2197626	Mobile	coverage and connectivity in three-dimensional networks	2006	-5.573251982514925	19.58103311121645	2197653
2197931	Mobile	capture-aware estimation for large-scale rfid tags identification	2015	-6.9022570701747314	19.585097667656783	2197958
2198299	Visualization	performance lower bounds for phase offset estimation in ieee 1588 synchronization	2015	-6.192709459068552	19.273568857202207	2198326
2198546	Robotics	fast estimation of area-coverage for wireless sensor networks based on digital geometry	2017	-5.455285048190155	19.13537755410761	2198573
2200462	Embedded	age of information minimization for an energy harvesting source with updating erasures: with and without feedback	2018	-6.77919782266816	20.486405892807802	2200489
2200474	Theory	a note on the 2-connectivity in one-dimensional ad hoc networks	2010	-6.022844970077706	20.428036635329804	2200501
2201831	EDA	decoding and lossy forwarding based multiple access relaying	2015	-7.003996978380407	19.624940533803407	2201858
2201888	Mobile	fttp: a fast tree traversal protocol for efficient tag identification in rfid networks	2010	-6.773850375040423	19.613846197718352	2201915
2201976	Embedded	stabilization of ncss by random allocation of transmission power to sensors	2016	-7.104425503400455	20.259058768026797	2202003
2202635	Mobile	analyzing connectivity of heterogeneous secure sensor networks	2018	-6.392790146489919	20.043188928037733	2202662
2202814	Mobile	sensing and link model for wireless sensor network: coverage and connectivity analysis	2014	-5.817087829845778	20.67912663901317	2202841
2204386	Embedded	analysis of multi-path random key pre-distribution for wireless sensor networks	2011	-6.113367848566326	19.69333496467859	2204413
2206391	Theory	a self-stabilizing 3-approximation for the maximum leaf spanning tree problem in arbitrary networks	2013	-5.8246687402368575	19.680378342828032	2206418
2206412	Mobile	accuracy-aware interference modeling and measurement in wireless sensor networks	2011	-5.60322059238613	20.80170231814704	2206439
2206749	Robotics	quality-driven congestion control for target tracking in wireless sensor networks	2008	-5.9530284339482735	19.585931430199413	2206776
2207096	Mobile	addressing and routing in hexagonal networks with applications for tracking mobile users and connection rerouting in cellular networks	2002	-5.835096470578455	19.532813548594863	2207123
2207470	ECom	communication in wireless networks with directional antennas	2008	-6.034219401399497	20.018645567241947	2207497
2208498	Mobile	achieving robust average consensus over wireless networks	2016	-6.299057633731498	19.762138761372626	2208525
2209646	Mobile	the critical range in clustered ad hoc networks: an analysis for gaussian distributed nodes	2015	-5.692042306635506	20.231878671501256	2209673
2211247	Robotics	innovations-based sampling over spatially-correlated sensors	2007	-7.212609119441461	19.401355770079746	2211274
2211990	AI	jamming attack in wsn: a spatial perspective	2011	-5.4884267499237085	20.24248436677084	2212017
2212067	Mobile	rotation of cds via connected domatic partition in ad hoc sensor networks	2009	-5.4807912595837065	19.985787750068152	2212094
2212715	Robotics	power allocation in asynchronous location-aware sensor networks	2016	-6.8817674025981885	20.839904348272427	2212742
2213179	Mobile	an efficient tree-based tag identification protocol for rfid systems	2008	-6.709072968891759	19.57198273534611	2213206
2213996	Mobile	reading rate improvement for uhf rfid systems with massive tags by the q parameter	2011	-6.8643756664031335	19.27938316217275	2214023
2214245	Embedded	nearly constant approximation for data aggregation scheduling in wireless sensor networks	2007	-5.5397195787567775	20.04097506529066	2214272
2217628	Theory	distribution of cell size in bounded voronoi tesselations with application to secure local connectivity	2016	-6.386986578047052	20.345232296453734	2217655
2220342	Mobile	new algorithm for minimum multicast time problem in wireless sensor networks	2007	-5.577734986184715	20.257814345784254	2220369
2220733	Robotics	study on performance of some typical tag collision avoidance algorithms	2010	-6.70098040504274	19.63766499018644	2220760
2221590	Mobile	impact of the dynamic membership in the connectivity graph of the wireless ad hoc networks	2009	-5.855094744695187	20.65265152351817	2221617
2223057	Theory	network coded gossip with correlated data	2012	-6.225827593109585	20.32449334621515	2223084
2223309	HCI	order preserving barrier coverage with weighted sensors on a line	2018	-5.732592779974611	19.29194837969708	2223336
2225894	Robotics	design of stochastic robotic swarms for target performance metrics in boundary coverage tasks	2017	-5.408755397437554	19.495003129924058	2225921
2226626	Theory	optimal time data gathering in wireless networks with omni-directional antennas	2011	-5.623409777126611	20.473561386179746	2226653
2226751	EDA	minimum-energy broadcast and multicast in wireless networks: an integer programming approach and improved heuristic algorithms	2008	-5.616827580649525	20.841665143548678	2226778
2230624	Theory	approximating the minimum number of maximum power users in ad hoc networks	2006	-5.8976879029297145	20.321983178913825	2230651
