id	area	title	year	x	y	ix
2636548	Robotics	a multi-sensor rss spatial sensing-based robust stochastic optimization algorithm for enhanced wireless tethering	2014	-7.15164510083012	19.667291004423607	2636575
2636640	Robotics	an analytical model of network connectivity in vehicular ad hoc networks using spatial point processes	2014	-7.135482760775807	20.49653074973112	2636667
2637974	Robotics	the base station placement for delay-constrained information coverage in mobile wireless networks	2010	-5.3277697809275235	20.404263781190764	2638001
2638107	Mobile	optimizing the collection of local decisions for time-constrained distributed detection in wsns	2013	-7.214240655558451	20.17941317230773	2638134
2638136	EDA	an improved anti-collision algorithm based on jds	2013	-6.803867421426769	19.55947264720546	2638163
2638501	Mobile	fast counting the key tags in anonymous rfid systems	2014	-6.69054165472762	19.574044342913	2638528
2638749	Embedded	interference minimization in asymmetric sensor networks	2014	-5.985578595602338	20.253489494846317	2638776
2639530	Mobile	unknown-target information collection in sensor-enabled rfid systems	2014	-6.674211563265973	19.51952915189881	2639557
2639935	Robotics	a novel multidimensional q-selection with random tree for an anti-collision algorithm in rfid systems	2013	-6.775170688714559	19.5230161106426	2639962
2641452	EDA	an empirical study on differential evolution for optimal power allocation in wsns	2012	-5.613317286161276	20.004080537378886	2641479
2641651	Theory	decomposing broadcast algorithms using abstract mac layers	2010	-5.829156637119813	20.733650381454726	2641678
2644316	Arch	analyzing interference from static cellular cooperation using the nearest neighbour model	2015	-6.836464686805799	20.726845975710862	2644343
2644874	Theory	the impact of correlated channel fluctuations on the connectivity of wireless ad-hoc networks	2009	-6.0647244694568245	20.454766610346912	2644901
2646236	Mobile	distributed source-destination synchronization using inband clock distribution	1996	-5.964349845536883	19.15585527781732	2646263
2647570	Mobile	flexible and time-efficient tag scanning with handheld readers	2016	-6.777757511686098	19.53997029095783	2647597
2648459	ECom	distributed backbone structure for algorithms in the sinr model of wireless networks	2012	-6.118688386385918	20.349229553030966	2648486
2648620	Embedded	ofdp: a distributed algorithm for finding disjoint paths with minimum total energy cost in wireless sensor networks	2014	-5.490486112932763	20.303847178511933	2648647
2649613	Networks	understanding topology dynamics in large-scale cognitive radio networks under generic failures	2013	-5.999639193413738	20.693476624808536	2649640
2652156	AI	adaptive q-algorithm for multiple tag identification in epcglobal gen-2 rfid system	2010	-6.811704936151093	19.571595608870076	2652183
2652340	Robotics	novel anti-collision algorithms for fast object identification in rfid system	2005	-6.8391878441154645	19.5946715780312	2652367
2652616	NLP	an empirical study on hidden tag problem	2015	-7.017125055380513	19.77654430471268	2652643
2653494	Theory	routing, anycast, and multicast for mesh and sensor networks	2007	-5.901228125677831	19.731430325364546	2653521
2654788	Embedded	on distributed computation in noisy random planar networks	2007	-5.341821547018093	19.41315159676041	2654815
2655512	AI	minimum power multicasting problem in wireless networks	2008	-5.510555398137256	19.783259635840466	2655539
2655595	Embedded	from rosenstock model to random walk based routing in wireless sensor networks	2009	-5.563365873208984	20.77729570551429	2655622
2656083	Mobile	decentralized hypothesis testing in energy harvesting wireless sensor networks	2017	-6.958729282469393	19.975915076310763	2656110
2656181	Networks	maximum throughput of multiple access channels in adversarial environments	2009	-7.178364696343273	18.992083980333472	2656208
2656329	Mobile	performance analysis of rfid tag anti-collision protocols with channel error	2011	-6.957339623850533	19.450157784729157	2656356
2659472	Mobile	a deep learning approach to iot authentication	2018	-7.056135599400292	19.240835240487787	2659499
2659788	Theory	analysis of push-type epidemic data dissemination in fully connected networks	2014	-6.1487412567048905	19.632504079638256	2659815
2660812	Mobile	transmit rate control for energy-efficient estimation in wireless sensor networks	2010	-6.440013342476188	20.809303618449366	2660839
2661749	Mobile	a parallel identification protocol for rfid systems	2014	-6.758094546251639	19.541586007879573	2661776
2662911	EDA	inductive coloring: implementing basic communication primitives with rayleigh-fading interference	2016	-5.911044464174784	20.649142151672663	2662938
2664677	Mobile	network connectivity with a family of group mobility models	2012	-6.126612231502852	20.458849227170433	2664704
2664685	Mobile	on the construction of energy-efficient broadcast tree with hitch-hiking in wireless networks	2005	-5.389362394187176	20.71514959842456	2664712
2664768	Robotics	safety assessment of a uav cd&r system in high density airspace using monte carlo simulations	2018	-6.452173464516124	19.818664884400366	2664795
2665322	Visualization	"""a comment on """"heed: a hybrid, energy-efficient, distributed clustering approach for ad hoc sensor networks'"""	2006	-5.531847951208984	19.748508798071285	2665349
2666794	Robotics	a closed form network connectivity formula one-dimensional manets	2004	-5.797710663271135	20.84605590030624	2666821
2668238	Mobile	energy efficiency in two-tiered wireless sensor networks	2017	-6.591429376510758	20.3654992694848	2668265
2669556	Mobile	a statistical characterization of localization performance in wireless networks	2018	-7.084593280689116	19.79333389832296	2669583
2670002	ECom	brief announcement: distributed algorithms for maximum link scheduling in the physical interference model	2012	-7.115431494255898	20.81446971116064	2670029
2671847	Visualization	channel assignment for wireless networks modelled as d-dimensional square grids	2002	-6.7525967521075705	20.74286491294212	2671874
2674286	AI	switch-and-navigate: controlling data ferry mobility for delay-bounded messages	2011	-5.87809290925458	20.676485764422548	2674313
2674400	Mobile	range assignment problem on the steiner tree based topology in ad hoc wireless networks	2009	-5.767446943717265	20.47396324163836	2674427
2675192	Metrics	optimal distance-based clustering for tag anti-collision in rfid systems	2008	-6.628742627982724	19.59641864323529	2675219
2675627	Embedded	deep reinforcement learning for wireless sensor scheduling in cyber-physical systems	2018	-6.3502246520415415	20.027612674284228	2675654
2676414	Mobile	analysis of planar mobile distribution and interference evaluation in wireless ad-hoc networks	2016	-6.2014689152426685	20.848789610264557	2676441
2677252	Mobile	caesar: carrier sense-based ranging in off-the-shelf 802.11 wireless lan	2011	-6.8123217798518265	19.608850478326787	2677279
2678313	Mobile	sparse power-efficient topologies for wireless ad hoc sensor networks	2010	-5.362251983167377	19.96480783324312	2678340
2678576	Mobile	clock skew and offset estimations for channel rendezvous in cognitive radio networks	2014	-6.103555821396861	19.359897733767074	2678603
2678681	Theory	asymptotically optimal geometric mobile ad-hoc routing	2002	-5.607025286013408	19.75299663403781	2678708
2678911	Theory	scheduling for information gathering on sensor network	2009	-5.509179278896395	20.6157384899552	2678938
2680498	Robotics	nonlinear resource allocation in restoration of compromised systems	2006	-7.0489269842708095	19.86607361104905	2680525
2682470	Theory	deterministic and energy-optimal wireless synchronization	2014	-5.973283047577348	19.989091832999424	2682497
2684272	Mobile	a probability model for lifetime of wireless sensor networks	2007	-5.784287340777018	20.773140470153038	2684299
2684406	Mobile	time efficient tag searching in multiple reader rfid systems	2013	-6.712391528106151	19.567913056843764	2684433
2687503	Mobile	entropy based image segmentation for energy efficient lte system with cloud	2017	-6.6670009017439575	19.498970067325907	2687530
2692102	Mobile	efficient multicast search under delay and bandwidth constraints	2006	-6.604988915529313	20.800062851797172	2692129
2692225	Vision	intelligent video event detection for surveillance systems	2007	-6.9902269243611475	19.462395977054328	2692252
2692474	EDA	an efficient distributed algorithm for constructing delay- and degree-bounded application-level multicast tree	2005	-5.5487646625036575	19.945510532549427	2692501
2692541	Embedded	timely-efficient and reliable topologies for 3-d sensor networks	2010	-5.610262800543488	19.524729581479555	2692568
2693549	Metrics	a highly efficient predetection-based anticollision mechanism for radio-frequency identification	2018	-6.76571299760082	19.6283603857302	2693576
2695349	Mobile	a time-efficient pair-wise collision-resolving protocol for missing tag identification	2017	-6.740571640870527	19.540018552039157	2695376
2696781	Robotics	dynamic activation policies for event capture in rechargeable sensor network	2014	-6.4146847503306486	20.17306547192934	2696808
2698276	Robotics	maintaining connectivity in environments with obstacles	2010	-5.8935705436226105	19.53057172607248	2698303
2699428	Mobile	interferer classification, channel selection and transmission adaptation for wireless sensor networks	2009	-7.1300989322800925	20.817348396528462	2699455
2699642	DB	query tree algorithm for energy conserving and fast identification in rfid systems	2007	-6.801954027836169	19.55648937496037	2699669
2700566	Vision	on a routing problem within probabilistic graphs and its application to intermittently connected networks	2007	-5.8746114753082415	20.115738365274	2700593
2701554	Theory	approximations for minimum connected sensor cover	2013	-5.779673577903861	19.75627004622796	2701581
2701669	Mobile	on wireless network infrastructure optimization for cyber-physical systems in future smart buildings	2012	-5.389889724192182	20.34490058453992	2701696
2702441	Embedded	improvement to the anticollision protocol specification for 900mhz class 0 radio frequency identification tag	2005	-6.788337703159328	19.461051077443987	2702468
2707519	DB	capacity scaling of wireless social networks	2015	-5.946909204217353	20.841485607456786	2707546
2709912	Theory	switching to directional antennas with constant increase in radius and hop distance	2011	-5.95061384682409	20.002865120567588	2709939
2710775	Mobile	estimation of the number of operating sensors in large-scale sensor networks with mobile access	2006	-6.609288378395228	19.71594258230037	2710802
2710977	Robotics	distributed asynchronous localization over wsns via non-convex consensus admm	2017	-5.5718650142047945	20.624262682443266	2711004
2712057	DB	on alleviating reader collisions towards high efficient rfid systems	2010	-6.6001817737164625	19.76955215388742	2712084
2714303	Mobile	distributed computation of connected dominating set for multi-hop wireless networks	2015	-5.526132113641119	20.361172008493515	2714330
2715614	Theory	deterministic broadcast on multiple access channels	2010	-7.208462881941688	18.9843172453653	2715641
2717874	Mobile	sleeping schedule-aware minimum latency broadcast in wireless ad hoc networks	2009	-5.575715098789542	20.305676544838985	2717901
2719231	Mobile	megcom: minimum-energy group communication in multihop wireless networks	2014	-5.497746793148637	20.552054859253627	2719258
2719853	Mobile	accurate tag estimation for dynamic framed-slotted aloha in rfid systems	2010	-6.846521422366343	19.55976379254696	2719880
2719909	Mobile	randomized routing algorithms in mobile ad hoc networks	2004	-5.342483622078862	19.984687076783302	2719936
2721449	Robotics	multi-leader election in dynamic sensor networks	2016	-5.67589925122449	20.19772279084978	2721476
2722358	Theory	routing properties of the localized delaunay triangulation over heterogeneous ad-hoc wireless networks	2006	-5.47610461154071	19.631922425418026	2722385
2724476	Metrics	a scheme for guaranteeing fair identification delay in gen-2 rfid systems	2011	-6.7921169737747285	19.616677225385878	2724503
2724906	Mobile	toward more rigorous and practical cardinality estimation for large-scale rfid systems	2017	-6.515230319135776	19.210464206442527	2724933
2726081	Robotics	multi-agent coverage control with energy depletion and repletion	2018	-5.6618063960114124	20.74671386108453	2726108
2726138	Theory	minimum average routing path clustering problem in multi-hop 2-d underwater sensor networks	2010	-5.515512822800491	20.030357404530186	2726165
2726812	Mobile	zoe: fast cardinality estimation for large-scale rfid systems	2013	-6.471845753524808	19.461114136337915	2726839
2727050	EDA	an efficient heuristic algorithm for 2d h-hops range assignment problem	2004	-6.245291531822892	20.15883719718788	2727077
2727466	Mobile	distributed sensor allocation for multi-target tracking in wireless sensor networks	2012	-5.460650702704176	19.498936805669945	2727493
2728973	Mobile	threshold behavior of multi-path random key pre-distribution for sparse wireless sensor networks	2013	-6.07547532701002	19.692234410185684	2729000
2729098	Metrics	modified tree-based identification protocols for solving hidden-tag problem in rfid systems over fading channels	2017	-6.8936806494347636	19.5808468498332	2729125
2730782	Theory	on approximation of dominating tree in wireless sensor networks	2010	-5.655333503085519	19.97327975319616	2730809
2731720	ECom	percolation of lipschitz surface and tight bounds on the spread of information among mobile agents	2018	-6.350718381656859	20.05401293661832	2731747
2732809	Mobile	on asymptotically optimal routing in large wireless networks and geometrical optics analogy	2009	-5.727215926727783	20.58422377387016	2732836
2733355	Robotics	using /spl beta/-skeletons for localized topology control in wireless ad hoc networks	2005	-5.88618499227583	19.687704411248774	2733382
2736232	Mobile	collecting data in ad-hoc networks with reduced uncertainty	2013	-5.422586598758622	19.747259222202803	2736259
2736299	Arch	topology control for minimal path interference in wireless sensor networks	2008	-5.438633188922374	20.26157483779991	2736326
2736994	Metrics	accurate distributed time synchronization in mobile wireless sensor networks from noisy difference measurements.	2014	-5.484217527818633	19.122228440820766	2737021
2738186	Theory	an efficient randomized routing protocol for single-hop radio networks	2010	-6.144821535581295	19.82198642046372	2738213
2739130	Mobile	esense: communication through energy sensing	2009	-6.814050356906281	20.685727896601836	2739157
2739244	Mobile	self-similar geometry for ad-hoc wireless networks: hyperfractals	2017	-5.918514677940062	20.809780374758052	2739271
2739858	Mobile	hypothesis testing over a random access channel in wireless sensor networks	2006	-6.6535140258590815	20.249809539817992	2739885
2740503	Embedded	asymptotic coverage and detection in randomized scheduling algorithm in wireless sensor networks	2007	-5.832019708290613	20.520260802921825	2740530
2741042	Embedded	neither shortest path nor dominating set: aggregation scheduling by greedy growing tree in multihop wireless sensor networks	2011	-5.405459252172506	20.70438625011434	2741069
2741846	Mobile	critical density for coverage and connectivity in three-dimensional wireless sensor networks using continuum percolation	2009	-5.911758447481268	20.168432324612766	2741873
2743940	Mobile	a unified analytic framework based on minimum scan statistics for wireless ad hoc and sensor networks	2009	-6.045868447856585	20.79899733644753	2743967
2744680	Mobile	design and analysis of a novel time- and energy-efficient  $m$ -ary tree protocol with collision window for dense rfid systems	2018	-6.764868381188974	19.621730155748992	2744707
2745188	Mobile	power-efficient topology control for static wireless networks with switched beam directional antennas	2008	-5.962380042519582	20.57396494378884	2745215
2746426	Mobile	energy-optimal data collection and communication using a group of uuvs	2007	-5.830825352089577	19.871611330470763	2746453
2748821	Theory	1-local 33/24-competitive algorithm for multicoloring hexagonal graphs	2011	-6.7875988666279055	20.745807120028914	2748848
2749027	Mobile	duty-cycle-aware minimum latency broadcast scheduling in multi-hop wireless networks	2010	-5.58578511001791	20.829240106537192	2749054
2749718	Robotics	decentralized detection in energy harvesting wireless sensor networks	2016	-6.97515916429353	19.962137612428773	2749745
2749892	Robotics	on clock offset estimation in wireless sensor networks with weibull distributed network delays	2010	-6.113704274726846	19.2450274923364	2749919
2751442	Robotics	an improved distributed approximation algorithm for minimum connected dominating set	2012	-5.474995025684548	20.06744477952905	2751469
2751871	Theory	a survey on distance vector routing protocols	2011	-5.677746689646781	19.680994298295808	2751898
2753090	ML	probabilistic flooding in stochastic networks: analysis of global information outreach	2012	-5.8333427277885	20.53774354568249	2753117
2753260	Robotics	on the existence of infinite localizable nodes in stochastic networks	2018	-6.178554165752996	20.595032345202235	2753287
2754050	Robotics	approximate local utility design for potential game approach to cooperative sensor network planning	2018	-5.495432404930813	19.115413959213047	2754077
2754902	Mobile	communication scheduling and remote estimation with energy harvesting sensor	2012	-7.1915897940921125	19.828805410592505	2754929
2755316	Mobile	network coding for data dissemination: it is not what you know, but what your neighbors don't know	2009	-6.3763271432883695	20.719611267780603	2755343
2756052	Mobile	on the capacity of ad hoc networks with clustering	2005	-6.1857347078553895	20.747135160735752	2756079
2757505	ECom	maximum scan statistics and channel assignment problems in homogeneous wireless networks	2009	-6.482428787350798	20.76898712544192	2757532
2757785	ECom	scale-free aggregation in sensor networks	2005	-5.496527128177727	19.84289625817413	2757812
2757926	Embedded	strong minimum energy hierarchical topology in wireless sensor networks	2016	-5.608547084895611	20.235591190202197	2757953
2759647	Mobile	sensing coverage for randomly distributed wireless sensor networks in shadowed environments	2008	-5.37179114313041	18.966090964126735	2759674
2759978	Embedded	using vns for the optimal synthesis of the communication tree in wireless sensor networks	2015	-5.48358133397387	20.360906160752272	2760005
2760025	Mobile	reliability-based splitting algorithms for time-constrained distributed detection in random-access wsns	2014	-7.051825061610146	20.33956694067843	2760052
2760765	Visualization	coexistence issues of multiple co-located ieee 802.15.4/zigbee networks running on adjacent radio channels in industrial environments	2009	-7.146819136590363	20.617424546756293	2760792
2765206	Robotics	the complexity of the minimum sensor cover problem with unit-disk sensing regions over a connected monitored region	2012	-5.404260128423587	19.775303899256112	2765233
2765240	Mobile	non-existence of isolated nodes in secure wireless sensor network	2015	-6.2235759459831925	20.037926502989077	2765267
2766760	Robotics	coverage gains from the static cooperation of mutually nearest neighbours	2016	-6.885640380763436	20.82812609198296	2766787
2768596	ECom	monitoring churn in wireless networks	2012	-6.501934800975348	19.28733997059539	2768623
2768936	EDA	energy-efficient area coverage in bistatic radar sensor networks	2013	-5.760960048667594	19.17468799764111	2768963
2769599	ECom	collecting information by power-aware mobile agents	2012	-5.8030804415187625	19.749170988447077	2769626
2770121	Embedded	designing secure and reliable wireless sensor networks under a pairwise key predistribution scheme	2015	-6.207604152555343	20.16265396516699	2770148
2770773	Theory	network correlated data gathering with explicit communication: np-completeness and algorithms	2006	-5.634359688011553	20.63755207095834	2770800
2771313	Mobile	optimal dynamic activation policies in sensor networks	2007	-5.797666111117655	20.583320814227065	2771340
2771408	Robotics	on constructing minimum-energy path-preserving graphs for ad-hoc wireless networks	2005	-5.422268005367309	20.360965474247056	2771435
2772349	Arch	minimizing average interference through topology control	2011	-5.828498296559932	20.416392173887974	2772376
2774296	Mobile	fdap: fast data aggregation protocol in wireless sensor networks	2012	-5.393640210048433	20.493614632197584	2774323
2775798	Mobile	barrier coverage by sensors with adjustable ranges	2014	-5.53946900211375	19.495664775911763	2775825
2778403	Mobile	an efficient and easy-to-implement tag identification algorithm for uhf rfid systems	2017	-6.876093960354985	19.562745649238977	2778430
2778505	Mobile	stochastic coverage in heterogeneous sensor networks	2006	-6.215016944336193	20.21203927863807	2778532
2778612	Robotics	task assignment for cooperating uavs under radio propagation path loss constraints	2012	-7.2000831382234525	20.672291718919322	2778639
2778782	Metrics	bi-slotted tree based anti-collision protocols for fast tag identification in rfid systems	2006	-6.7605011491795794	19.580698353497294	2778809
2781994	Mobile	an anti-collision algorithm for rfid based on an array and encoding scheme	2018	-6.740256267253226	19.479963688631987	2782021
2782378	Mobile	addressing, distances and routing in triangular systems with applications in cellular networks	2006	-6.002668521373094	19.49540847698959	2782405
2783113	Mobile	efficient rfid grouping protocols	2016	-6.7511498467235995	19.64233812700851	2783140
2784167	Mobile	secondary system initialization protocol using fft-based correlation matching for cognitive radio ad-hoc networks	2017	-6.857411168937937	19.7871174256872	2784194
2784755	Embedded	a new lower bound on range-free localization algorithms in wireless sensor networks	2011	-5.980270362053911	20.399722784498785	2784782
2787761	EDA	efficient rfid devices	2016	-6.933616905413093	19.17084060078514	2787788
2788428	Mobile	trade-off between maximum cardinality of collision sets and accuracy of rfid reader-to-reader collision detection	2013	-6.546584628422442	19.72926685276168	2788455
2788689	Embedded	a distributed and deterministic tdma algorithm for write-all-with-collision model	2008	-5.8459541593266175	19.256931421401852	2788716
2789142	Mobile	distributed broadcast with minimum latency in asynchronous wireless sensor networks under sinr-based interference	2013	-5.441834743012774	20.79363699987746	2789169
2791593	Robotics	broadcasting with the least energy is an np-complete problem	2008	-5.303887343577329	20.17043407774482	2791620
2792265	EDA	collision arbitration based on different slot times for slotted-aloha rfid systems	2008	-6.811350521189901	19.62101555155016	2792292
2793457	Mobile	formation of cognitive personal area networks (cpans) using probabilistic rendezvous	2018	-5.841584209592763	20.719077560136235	2793484
2793944	Embedded	relay sensor placement in wireless sensor networks	2008	-5.388103699879302	20.050850060296234	2793971
2794688	AI	flying in the dark: controlling autonomous data ferries with partial observations	2010	-5.938869746421733	20.443853326549853	2794715
2795221	Mobile	weaker links for synchronization	2012	-5.304954742347703	19.21190091717102	2795248
2796910	Mobile	algorithms for ad hoc and sensor networks	2005	-5.636679296836125	19.87265514737732	2796937
2799106	HPC	gossigping in a distributed network	1993	-5.76651369577446	20.071088621173374	2799133
2802371	Embedded	a self-stabilizing algorithm for cds construction with constant approximation in wireless networks under sinr model	2015	-5.708596462345099	20.051224911088052	2802398
2802421	Embedded	v2vunet — a filtering out concept for packet forwarding decision in three-dimensional inter-vehicular communication scenarios	2016	-6.167480805740382	20.20558975805894	2802448
2802521	Theory	kinetic spanning trees for minimum-power routing in manets	2002	-5.943677858258938	20.079698230762	2802548
2806565	Mobile	data collection in sensor networks via the novel fast markov decision process framework	2015	-6.3671954638732	20.347233377071763	2806592
2812047	Embedded	topology-transparent schedules for energy limited ad hoc networks	2006	-5.856426961026468	20.825293902097755	2812074
2813172	Mobile	facilitating an active transmit-only rfid system through receiver-based processing	2007	-7.1985822214363	19.81404031470252	2813199
2813278	EDA	everything is better with sprinkles: greedy routing with bounded stretch	2013	-5.409643070900347	19.68170777354404	2813305
2813415	Mobile	the geodesic broadcast scheme for wireless ad hoc networks	2006	-5.386953034099231	19.825388068292874	2813442
2814175	Robotics	power allocation policy for distributed estimation in wireless networks	2011	-7.187478200093543	20.084690616827203	2814202
2814575	Mobile	distribution of the node degree for wireless ad hoc networks in shadow fading environments	2007	-6.2209980689538975	20.665138491162974	2814602
2814669	Networks	compressed network coding: overcome all-or-nothing problem in finite fields	2014	-6.266857989174572	20.39401599392786	2814696
2814951	Mobile	sleep control for tracking in sensor networks	2011	-6.1306139871473295	19.960242768530275	2814978
2816639	Theory	congestion, dilation, and energy in radio networks	2004	-6.039010221982965	20.460027039671626	2816666
2820919	Theory	the minimum range assignment problem on linear radio networks	2000	-6.451483173661643	19.933685734403387	2820946
2821037	Mobile	rfid tag counting over lossy wireless channels	2011	-6.878727662714742	19.887811953220517	2821064
