id	area	title	year	x	y	ix
1259482	Mobile	effective coverage for the connectivity of magnetic induction-based ad hoc networks	2014	-6.383656510043093	19.97763265165233	1259509
1259904	Embedded	cthp1-7: prefix-length adaptation for prqt protocol in rfid systems	2006	-6.794510331999213	19.581965594771184	1259931
1260565	Mobile	model-based adaptive transmission power control (matpoc) for wireless sensor networks in fading environment	2017	-6.858294597409	20.730924724092574	1260592
1261254	Metrics	reducing transmitted bits in a memoryless rfid anti-collision protocol	2016	-6.862129389895829	19.54257242156116	1261281
1261705	Theory	on the performance of multi-message algebraic gossip algorithms in dynamic random geometric graphs	2018	-5.6342153569334545	20.407336939682352	1261732
1264184	Mobile	robust transmission power management for remote state estimation with wireless energy harvesting	2018	-7.182390848365539	20.164471504001828	1264211
1264357	Arch	performance analysis of probabilistic flooding using random graphs	2007	-5.762276378319019	20.51302615609533	1264384
1266141	Mobile	energy-aware quality of information maximisation for wireless sensor networks	2016	-6.939801439191657	20.735136223107453	1266168
1266532	Metrics	on a class of stochastic multilayer networks	2018	-6.257834460686875	20.73382463676239	1266559
1266837	Mobile	a stochastic process model of the hop count distribution in wireless sensor networks	2014	-6.032847588176894	20.32433388396759	1266864
1267411	ECom	approximation bounds on the number of mixedcast rounds in wireless ad-hoc networks	2013	-5.34559564405824	20.459620064495876	1267438
1269837	EDA	hardware based design and performance evaluation of a tree based rfid anti-collision protocol	2015	-6.67572375210101	19.46072171520802	1269864
1270643	Embedded	an energy-efficient distributed algorithm for minimum-latency aggregation scheduling in wireless sensor networks	2010	-5.475645722216227	20.369678049015207	1270670
1271452	Mobile	energy efficient broadcast in multiradio multichannel wireless networks	2012	-5.7176893751238405	20.711104971637173	1271479
1271757	Mobile	infection spread in wireless networks with random and adversarial node mobilities	2008	-5.79517205880643	20.49028676859408	1271784
1273930	Vision	gossip protocol on the ad hoc networks and its approximated saturation	2010	-5.819015479252946	20.41163932661836	1273957
1274621	Embedded	fault-tolerant virtual backbone in heterogeneous wireless sensor network	2017	-5.6818729937583266	19.831042368115078	1274648
1275570	Mobile	construction of minimum connected dominating set in 3-dimensional wireless network	2008	-5.6146620527202735	20.013492368534838	1275597
1279259	Theory	reliable probabilistic gossip over large-scale random topologies	2017	-5.72791608471665	19.419490686525	1279286
1281061	Mobile	time- and energy-efficient detection of unknown tags in large-scale rfid systems	2013	-6.710502169975898	19.519003644784352	1281088
1281959	Mobile	a dominating and absorbent set in a wireless ad-hoc network with different transmission ranges	2007	-5.542574524083143	20.095023486799935	1281986
1282972	Mobile	bounded-distance multi-clusterhead formation in wireless ad hoc networks	2007	-5.3534576145990656	20.03262538361065	1282999
1283122	Theory	switching to directional antennas with constant increase in radius and hop distance	2012	-5.9413326297704945	20.004585640330628	1283149
1283173	Mobile	max-contribution: on optimal resource allocation in delay tolerant networks	2010	-5.497417813380751	20.308451092373094	1283200
1283316	Mobile	mdlt: a polynomial time optimal algorithm for maximization of time-to-first- failure in energy constrained wireless broadcast networks	2003	-5.530362754176171	20.51846527875302	1283343
1285044	Mobile	dynamic system model for optimal configuration of mobile rfid systems	2011	-6.729946322312823	19.49734588091966	1285071
1285864	Mobile	energy-optimal online algorithms for broadcasting in wireless networks	2005	-5.404355506047798	20.426717923717007	1285891
1285876	Theory	connectivity assessment of random directed graphs with application to underwater sensor networks	2017	-5.628967076701027	19.753236835559413	1285903
1285988	Theory	energy-efficient size approximation of radio networks with no collision detection	2002	-5.784772741272099	20.06078337498653	1286015
1287438	Mobile	localized construction of bounded degree and planar spanner for wireless ad hoc networks	2006	-6.136533217913724	19.550289291056927	1287465
1288101	Mobile	efficient identification uhf rfid system scheme based on combination of dfsa and ovsf-cdma	2008	-7.069277744125898	19.66474620299231	1288128
1288271	Metrics	constructing minimum connected dominating sets with bounded diameters in wireless networks	2009	-5.428233781992729	20.041703175213033	1288298
1288972	Vision	fast rfid grouping protocols	2015	-6.757189974574689	19.627999791038533	1288999
1290240	Mobile	smart home gateway system over bluetooth low energy with wireless energy transfer capability	2015	-7.0561838912094474	20.705086221722286	1290267
1292576	Mobile	energy efficiency of cooperative dense wireless sensor networks	2006	-6.0301429591816404	20.019592845093428	1292603
1293882	Arch	frequency agility in ipv6-based wireless personal area networks (6lowpan)	2010	-6.83192253422154	20.585356482748185	1293909
1294756	Robotics	joint power optimization and connectivity control problem over underwater random sensor networks	2015	-5.518069342386823	20.49860291979771	1294783
1296080	Mobile	dominating connectivity and reliability of heterogeneous sensor networks	2006	-6.002878809626311	20.152194331038828	1296107
1296615	AI	construction of minimum connected dominating set in wireless sensor networks using pseudo dominating set	2016	-5.518373453084601	20.058859544617494	1296642
1297921	Embedded	approximation algorithm for maximum lifetime in wireless sensor networks with data aggregation	2006	-5.65858873272095	19.9722503734698	1297948
1298399	Networks	spatial distribution of traffic density in aloha with capture	1998	-6.037083051042093	20.836670474982764	1298426
1300100	Mobile	arpa: an arbitration protocol based on advanced channel feedback for radio frequency identification	2008	-6.814036719288644	19.55793495166977	1300127
1300845	Theory	energy conservation via domatic partitions	2006	-5.489245930667599	19.978974567604638	1300872
1302700	Mobile	classification of solutions to the minimum energy problem in one dimensional sensor networks	2016	-6.598271271183775	20.561703601543837	1302727
1303261	Mobile	approximation algorithms for sweep coverage in wireless sensor networks	2014	-5.314012765248345	19.391748065886787	1303288
1306892	EDA	the value of sleeping: a rollout algorithm for sensor scheduling in hmms	2013	-6.128766078253309	20.003995370171683	1306919
1309513	Mobile	modelagem e análise de conectividade em redes sem fios obstruídas	2014	-6.064601988917677	20.43506786393204	1309540
1309836	Robotics	maximization of data gathering in clustered wireless sensor networks	2010	-5.9881629441979465	20.817988639038894	1309863
1314007	HCI	timing analysis of passive uhf rfid - epc c1g2 system in dynamic frame	2009	-6.809883808574195	19.444380520708293	1314034
1315206	Theory	the homogeneous broadcast problem in narrow and wide strips	2017	-6.029613039540151	19.81299152583527	1315233
1316572	Metrics	a divide-and-conquer technique for throughput enhancement of rfid anti-collision protocol	2008	-6.868852118807758	19.64157386098837	1316599
1316897	Mobile	key search and adaptation based on association rules for backward secrecy	2015	-6.763844609201144	19.506657907845884	1316924
1317513	Robotics	upper and lower bounds for dynamic cluster assignment for multi-target tracking in heterogeneous wsns	2013	-5.368480504017582	20.20818274172149	1317540
1326106	Mobile	on connectivity properties of large-scale sensor networks	2004	-5.894573083887931	20.07347163800421	1326133
1328366	DB	algorithms for minimum m-connected k-dominating set problem	2007	-5.349789777686722	19.98634829648956	1328393
1333455	AI	acceleration of distributed minimax flow optimization in networks	2011	-5.811886236095985	20.26219766961797	1333482
1334418	Embedded	strongly connected dominating sets in wireless sensor networks with unidirectional links	2006	-5.476909069660053	19.95530645724239	1334445
1334545	Theory	efficient gossip-based aggregate computation	2006	-5.621036396751905	20.074661704698148	1334572
1335949	Mobile	energy efficient broadcast routing in ad hoc sensor networks with directional antennas	2008	-5.397853682815738	20.31141060826996	1335976
1336085	Theory	fault-tolerant spanners in networks with symmetric directional antennas	2017	-6.070467559548845	19.950351997621496	1336112
1338998	EDA	on the construction of a strongly connected broadcast arborescence with bounded transmission delay	2006	-5.560855478550974	20.38996838199564	1339025
1341078	Mobile	opportunistic time-of-arrival localization in fully asynchronous wireless networks	2017	-7.203659196830832	19.445452004020673	1341105
1342253	Mobile	performance analysis of tag anti-collision algorithms for rfid systems	2006	-6.785258166444573	19.60439353389397	1342280
1342369	EDA	learning with finite memory for machine type communication	2016	-6.347235370245117	20.074390120193218	1342396
1343148	Mobile	complete and fast unknown tag identification in large rfid systems	2012	-6.757423402547082	19.51562721377231	1343175
1345109	Mobile	optimization of tag reading performance in generation-2 rfid protocol	2009	-6.855669110252292	19.60886945901166	1345136
1348465	ML	a max-flow min-cut theorem with applications in small worlds and dual radio networks	2008	-6.319767574703591	20.60047482880972	1348492
1350781	Mobile	optimal policies for distributed data aggregation in wireless sensor networks	2007	-6.498879972343322	20.105763785554988	1350808
1351066	Metrics	analytical model for link reliability in bacteria nanonetworks	2014	-5.359836987841055	20.860788349139366	1351093
1352750	DB	a scheme for estimating number of tags in fsa-based rfid systems	2009	-6.918153719998384	19.45883349849121	1352777
1354697	Theory	approximate neighbor counting in radio networks	2018	-6.091770973679563	19.887908170689613	1354724
1354756	Mobile	a novel time-efficient frame adjustment strategy for rfid anti-collision	2017	-6.858277304763536	19.554641356936212	1354783
1355218	Embedded	on some sufficient conditions for distributed quality-of-service support in wireless networks	2009	-6.216039092803826	20.869974954714557	1355245
1355416	AI	algorithms for minimum connected capacitated dominating set problem	2011	-5.436424932058588	20.035645009295898	1355443
1355614	Mobile	scalable rfid tag estimator with enhanced accuracy and low estimation time	2017	-7.0968893328802105	19.513546623980147	1355641
1356850	Mobile	continuous scanning with mobile reader in rfid systems: an experimental study	2013	-6.397922104424758	19.437632475593603	1356877
1357451	Mobile	distribution of decentralized optimization convergence bounds in energy harvesting wireless sensor networks	2016	-5.8783311307173935	20.27708106671536	1357478
1359749	Mobile	unified q-ary tree for rfid tag anti-collision resolution	2009	-6.782270597993543	19.56796371998855	1359776
1360988	Robotics	temporal connectivity in finite networks with non-uniform measures	2018	-5.929553823045257	20.40684885121344	1361015
1361026	Robotics	a distributed algorithm to approximate node-weighted minimum alpha-connected (theta, k)-coverage in dense sensor networks	2008	-5.380432250501463	19.633380781735273	1361053
1361167	Robotics	towards evaluating the effects of stereoscopic viewing and haptic interaction on perception-action coordination	2018	-6.09928427283548	20.081317215665077	1361194
1362430	Mobile	near-optimal multicriteria spanner constructions in wireless ad hoc networks	2010	-5.59996849667722	20.306770535822213	1362457
1363194	Robotics	the pulse coupled phasor measurement units	2014	-6.426677211756518	19.138870159538783	1363221
1363825	Mobile	challenges: wide-area wirelesss networks (wanets)	2008	-7.1939096110017084	20.38546200190627	1363852
1364520	Mobile	ebqp: enhanced binary query protocol for rfid tag collision resolution with progressive population estimation	2011	-6.783141414107315	19.550388359757267	1364547
1364726	Mobile	on critical density for coverage and connectivity in directional sensor network over stochastic channels using continuum percolation	2015	-5.4562000252768215	20.136412902487162	1364753
1364738	Robotics	quantifying individual communication capability in opportunistic mobile social networks	2014	-5.514467356173916	20.75147928023837	1364765
1367054	Mobile	analytic evaluation of target detection in heterogeneous wireless sensor networks	2009	-6.590770967511243	19.92544183029852	1367081
1368343	Mobile	enhanced binary search with time-divided responses for efficient rfid tag anti-collision	2007	-6.783635368429532	19.58087150396481	1368370
1368716	Mobile	stochastic network collection point (ncp) selection in mobile sensor networks with cooperative communications	2014	-5.4507665301206565	20.824980765325165	1368743
1371712	Mobile	are there so many sons per node in a wireless sensor network data aggregation tree?	2009	-5.4838289618770055	20.006285807650293	1371739
1371776	Embedded	approximation algorithm for base station placement in wireless sensor networks	2007	-5.430460897232813	20.10041792492565	1371803
1371789	Robotics	an improved hybrid sensor schedule for remote state estimation under limited communication resources	2012	-6.942833820739652	19.743337214504766	1371816
1372380	Mobile	phy-tree: physical layer tree-based rfid identification	2018	-6.868641856595318	19.57513189041085	1372407
1375607	AI	coded quickest classification with applications in bandwidth-efficient smart grid monitoring	2018	-7.130924219625722	19.869131058515155	1375634
1379270	Mobile	upper bound on operational lifetime of ultra wide band sensor network	2006	-5.732253335114198	20.601606890662232	1379297
1379338	Theory	hardness results for the power range assignmet problem in packet radio networks	1999	-6.1875319802616335	20.16391350445746	1379365
1379770	Networks	floc-spanner: an o(1) time, locally self-stabilizing algorithm for geometric spanner construction in a wireless sensor network	2014	-5.296931824449014	19.484382427589683	1379797
1381939	Mobile	algorithms on improving end-to-end connectivity and barrier coverage in stochastic network deployments	2011	-5.640916731805032	20.835921744420585	1381966
1381963	Mobile	two-phase cardinality estimation protocols for sensor networks with provable precision	2012	-6.2287385453173485	19.357691929341478	1381990
1382560	Mobile	speed improves delay-capacity trade-off in motioncast	2011	-5.952644481289974	20.748286185392512	1382587
1385805	Theory	approximation algorithms for the mobile piercing set problem with applications to clustering in ad-hoc networks	2002	-5.6199629727762614	19.78088689814203	1385832
1387299	Mobile	adaptive scheduling mechanisms toward intelligent services in mobile and wireless rfid environments	2008	-6.555928716770473	19.848217852456575	1387326
1387337	Robotics	distributed optimisation of mrf-based sensor networks via dual decomposition	2011	-5.441324547844767	20.36608396118877	1387364
1387376	Mobile	on the giant component in wireless multi-hop networks	2009	-6.143519354254943	20.60541862958154	1387403
1387430	Theory	on the probability of finding a receiver in an ellipsoid neighborhood of a sender in 3d random uans	2016	-6.267361160770624	20.639355882208235	1387457
1388098	Theory	on computing ad-hoc selective families	2001	-6.979475396462626	19.103698204476775	1388125
1388830	ML	zebranet and its theoretical analysis on distribution functions of data gathering times	2010	-6.305494563739827	20.12597102001022	1388857
1392855	Mobile	localized minimum spanning tree based multicast routing with energy-efficient guaranteed delivery in ad hoc and sensor networks	2008	-5.390304462775002	20.021582291455235	1392882
1393202	Mobile	qtdfs-aloha: a hybrid collision resolution protocol for dense rfid tag environment	2010	-6.762031145103159	19.6102789294452	1393229
1393552	Mobile	efficient unknown tag identification protocols in large-scale rfid systems	2014	-6.757521313758299	19.53458676067904	1393579
1393671	ECom	distributed (δ+1)-coloring in the physical model	2014	-6.175307362244466	20.682043860995293	1393698
1393980	Robotics	hierarchical averaging over wireless sensor networks	2012	-6.984987962945062	20.46968274492745	1394007
1393981	Mobile	upper bounds for the min-max and min-sum cost online problems in wireless ad hoc networks	2015	-5.468558707663028	20.419300369450728	1394008
1395554	Mobile	a stochastic shortest path model to minimize the reading time in dfsa-based rfid systems	2013	-6.535189612695475	18.987403198567065	1395581
1397596	Mobile	active consensus over sensor networks via randomized communication	2013	-5.538870277557376	20.380212641375643	1397623
1399690	ECom	an exact algorithm for maximum lifetime data gathering tree without aggregation in wireless sensor networks	2015	-5.309661746421216	20.12282466781595	1399717
1403204	Robotics	greedy convex embeddings for sensor networks	2009	-5.466922513750241	19.486570088291877	1403231
1404045	Mobile	energy-aware compress and forward systems for wireless monitoring of time-varying fields	2010	-5.517829443334574	20.769128071824703	1404072
1405010	Mobile	minimum cost topology construction for rural wireless mesh networks	2008	-5.859255083874366	20.22083518338329	1405037
1405088	SE	a bivariate dtmc model of the rfid fsa reading process to study the continuous wave outage effect	2015	-7.006590190859307	19.537299418279623	1405115
1406491	Embedded	timestamp-free network synchronization with random pairwise message exchanges	2014	-5.807344807065584	19.492881030405602	1406518
1407126	Robotics	ordering for energy efficient estimation and optimization in sensor networks	2011	-6.488942596979617	20.169984215414832	1407153
1407544	Mobile	interference cancellation-based rfid tags identification	2011	-7.053171170737349	19.609273166695708	1407571
1408659	Vision	distributed adaptive beam nulling to survive against jamming in 3d uav mesh networks	2018	-6.98279892766162	20.19780327569596	1408686
1410991	Visualization	design and implementation of an active rfid system for fast tag collection	2007	-6.725253352384184	19.47686171880602	1411018
1412084	Mobile	rfid-based localization with non-blocking tag scanning	2013	-6.786377011564956	19.48173561660513	1412111
1412165	Mobile	run-time estimation of the number of un-identified tags in rfid systems	2013	-6.887012587046224	19.50515054464164	1412192
1412314	Security	continuum percolation in the intrinsically secure communications graph	2010	-6.622925159629565	20.320572380999643	1412341
1413996	Theory	a fast hybrid ε-approximation algorithm for computing constrained shortest paths	2013	-5.573627314576816	20.365056309571628	1414023
1415931	Mobile	on environment-aware channel estimation for wireless sensor networks using magnetic induction	2017	-7.1121414858648615	20.458446647394023	1415958
1416249	Metrics	optimization-based linear network coding for general connections of continuous flows	2018	-6.38080437825868	19.832294930648846	1416276
1416752	Mobile	editorial: ad hoc networking and emerging applications	2017	-5.318325383294146	20.42887512929116	1416779
1416887	Mobile	on white-space detection, localization and coverage	2014	-6.506244444151917	19.910668728967746	1416914
1417756	Theory	parameterized algorithms for power-efficient connected symmetric wireless sensor networks	2017	-5.831685755824683	19.87321288261443	1417783
1418056	Theory	ad-hoc network unicast in time o(log log n) using beamforming	2014	-6.478290357902446	20.66431733350005	1418083
1420263	Mobile	the transport capacity of a wireless network is a subadditive euclidean functional	2008	-6.283878643694379	20.559486569691998	1420290
1421133	Mobile	minimum interference topology control in cognitive radio networks through channel assignment	2018	-5.7776859545212	20.782915671605014	1421160
1422323	Theory	2-local 7/6-competitive algorithm for multicolouring a sub-class of hexagonal graphs	2010	-6.696926973757758	20.743744741265523	1422350
1424094	Mobile	a load-balancing routing algorithm for wireless sensor networks based on domain decomposition	2015	-5.594081679982458	18.955782652680114	1424121
1425745	ECom	fault-tolerant routing: k-inconnected many-to-one routing in wireless networks	2011	-5.435000701649628	20.25063982007143	1425772
1425760	Mobile	distance distributions in random networks	2012	-6.2210563850698986	20.687552872141467	1425787
1427341	Mobile	the wave expansion approach to broadcasting in multihop radio networks	1991	-5.835633017756092	20.502775954505385	1427368
1428434	Mobile	minimum power energy spanners in wireless ad hoc networks	2011	-5.9432631066481365	20.175128292331433	1428461
1428521	Embedded	energy-efficient transmission with data sharing in participatory sensing systems	2016	-5.699995036407034	20.450199019073885	1428548
1429444	Embedded	reduction algorithm for simplicial complexes	2013	-5.378618195789679	19.47418667430548	1429471
1429974	Mobile	data gathering tours in sensor networks	2006	-5.738453884090033	19.945709413505387	1430001
1430870	EDA	towards constant-time cardinality estimation for large-scale rfid systems	2015	-6.614910291721814	19.469674119221533	1430897
1431034	Metrics	a slot allocated blocking anti-collision algorithm for rfid tag identification	2015	-6.784437696686377	19.624127076904962	1431061
1432045	EDA	a critical survey and analysis of rfid anti-collision mechanisms	2011	-6.996199137323706	19.66039624130955	1432072
1433867	Mobile	backbone construction for heterogeneous wireless ad hoc networks	2009	-5.470355265382935	20.437945300941625	1433894
1434697	Vision	algorithms on minimizing the maximum sensor movement for barrier coverage of a linear domain	2013	-5.536769945332988	19.115005151772376	1434724
1434987	Theory	the influence of communication range on connectivity for resilient wireless sensor networks using a probabilistic approach	2013	-5.921489736352274	20.00182975550977	1435014
1436045	ECom	should i stay or should i go? maximizing lifetime with relays	2014	-5.3220499704685	20.16911087151383	1436072
1436338	Theory	probabilistic analysis of power assignments	2017	-5.855080805230362	20.28227925066948	1436365
1437061	Robotics	partial delaunay triangulation-based asynchronous planarization of quasi unit disk graphs	2015	-5.957168586721642	19.642917210031587	1437088
1438113	Mobile	connectivity properties for uavs networks in wireless ultraviolet communication	2017	-5.8087230933308085	20.850853470595226	1438140
1439508	Theory	a hop constrained min-sum arborescence with outage costs	2003	-6.129307352822894	19.91022667924736	1439535
1439927	Mobile	less is more: efficient rfid-based 3d localization	2013	-6.331077558805804	19.586048470466963	1439954
1443015	ECom	dual power assignment optimization and fault tolerance in wsns	2015	-5.574478058213528	20.055637544418087	1443042
1444461	Networks	power assignment problems in wireless communication	2006	-5.7877667953405885	20.764184754798624	1444488
1445611	Mobile	cs-based framework for sparse signal transmission over lossy link	2014	-6.4068725887199935	19.814587094947395	1445638
1445618	Mobile	efficient time-oriented anti-collision protocol for rfid tag identification	2017	-6.8216187359566165	19.57817913512054	1445645
1448239	Embedded	ginibre sampling and signal reconstruction	2016	-7.2195883153924445	19.368328697485584	1448266
1449744	Vision	a dynamic detection point frame length adjustment method for rfid anti-collision	2017	-6.85675164323889	19.574720752978614	1449771
1450386	Mobile	a hierarchical leader election protocol for mobile ad hoc networks	2008	-5.431853636614108	19.436724498590365	1450413
1451172	Robotics	wireless access point deployment for both coverage and localization	2010	-5.788323942908067	19.96557792637677	1451199
1453925	Mobile	a framework for fast rfid tag reading in static and mobile environments	2008	-6.747262508880889	19.63409485306465	1453952
1455059	Mobile	analysis and algorithms for partitioning of large-scale adaptive mobile networks	2002	-5.505819262105942	20.82720860563457	1455086
1455455	Robotics	decentralized predictive sensor allocation	2008	-6.590359266382903	20.368045760572134	1455482
1458974	Mobile	optimal energy management policy of mobile energy gateway	2016	-5.325770293855158	20.602329772357287	1459001
1459733	Mobile	distributed saddle-point computation for lifetime maximization in mobile sensor networks	2011	-5.39948634428275	20.31513675005782	1459760
1460133	Embedded	a hybrid technique based query tree protocol for energy efficiency in rfid system	2012	-6.7295661449405015	19.604264221105822	1460160
1460405	Mobile	on 2-way neighbor discovery in wireless networks with directional antennas	2015	-5.661111338584943	20.524831782256204	1460432
1460638	Mobile	field reconstruction in sensor networks with coverage holes and packet losses	2011	-6.882213001620989	19.497571011760147	1460665
1461000	Theory	single-step creation of localized delaunay triangulations	2009	-5.429421941943344	19.720072745566377	1461027
1461021	Theory	accelerating distributed consensus via lifting markov chains	2007	-6.023743278012549	19.8930194521215	1461048
1462589	Mobile	interference-constrained wireless coverage in a protocol model	2006	-6.814057177947238	20.451284363781923	1462616
1463589	Metrics	two dimensional connectivity for vehicular ad-hoc networks	2008	-6.036294790879228	20.67514519730489	1463616
1463716	Theory	topology control and geographic routing in realistic wireless networks	2007	-5.34040308231763	19.763120530923892	1463743
