id	title	keywords	abstract	entities	authors	year	journal	doi	fos	area	x	y	ix
1eab50ee722e4c01627fdeff1995b42d56c71212	distributed simulation of hybrid systems with hla support	machine abstraite;distributed system;continuous time;reponse temporelle;equation differentielle;metodo analisis;systeme reparti;simulation systeme;sistema hibrido;reseau interconnecte;systeme discret;lenguaje uml;ecuacion algebraica;maquina abstracta;differential equation;langage modelisation unifie;state machine;continuous system;sistema complejo;abstract machine;model complexity;ecuacion diferencial;systeme continu;synchronisation;methode analyse;sistema repartido;systeme complexe;time response;complex system;analysis method;synchronization;sistema continuo;unified modelling language;interconnected system;hybrid system;sistema interconectado;equation algebrique;sincronizacion;sistema discreto;systeme interconnecte;distributed simulation;respuesta temporal;red interconectada;hybrid simulation;system simulation;interconnected power system;high level architecture;simulacion sistema;algebraic equation;discrete system;systeme hybride;modeling and analysis	As engineers are confronted with designing increasingly complex systems composed of interconnected components of diverse nature, traditional methods of modeling and analysis become cumbersome and inefficient. In the paper we discuss one of the approaches to modeling and distributed simulation of hybrid (discrete/continuous) systems. We use hybrid state machines, where sets of algebraic-differential equations are assigned to states, to model complex interdependencies between discrete and continuous time behaviors. This framework is fully supported by UML-RT/Java tool AnyLogic developed at Experimental Object Technologies. We use High Level Architecture (HLA), a defacto standard for distributed simulation, as a communication and synchronization media for distributed hybrid simulation components. Integration of simulations developed with AnyLogic into HLA is considered.	anylogic;complex systems;distributed computing;hybrid system;interdependence;interoperability;java class library;linear algebra;semantics (computer science);simulation;systems modeling;uml tool;unified modeling language;world-system	Andrei Borshchev;Yuri Karpov;Pavel Lebedev	2001		10.1007/3-540-44743-1_42	synchronization;computer science;artificial intelligence;abstract machine;algorithm	Robotics	-37.10444072075248	26.49371214407534	194565
569d074198d8472af57d95a69824fed1418f4ed4	a petri net based supervisory control implementation	programmable controllers;control system analysis computing;mathematics computing;supervisory control;system modeling;programming environment;model based approach;feedback;supervisory control petri nets automatic control communication system control open loop systems programmable control feedback control safety manufacturing system recovery;mathematics computing petri nets discrete event systems control system analysis computing feedback programmable controllers digital simulation;discrete event systems;petri nets;programmable logic control petri nets offline supervisory control synthesis supervisory controller design compliant programming feedback controllers discrete event systems supervisor simulation matlab plc controller control system synthesis;petri net;time discretization;digital simulation	The paper presents an implementation of supervisory controllers in the IEC 61131-3 compliant programming environment. The implemented modelbased approaches provide particularly simple methods for constructing feedback controllers for untimed and timed discrete event systems modeled by Petri nets. Programs written in Matlab 5.3/6,1 have been used to solve the OFFLINE supervisoiy control synthesis and supervisor simulation. The implementation of the designed supervisay controller can be perjiarmed in an IEC 61 131-3 compliant programming environment with help of a quick PLC controller, or a quick dedicated controller.	iec 61131;iec 61131-3;integrated development environment;matlab;petri net;power-line communication;simulation	Jana Flochova	2003		10.1109/ICSMC.2003.1244549	real-time computing;computer science;control theory;supervisory control;petri net	Robotics	-35.39273345613528	29.60683150834327	196060
5444a68982b82ebf75a83f926b9e899ca631bf26	equivalent design representations and transformations for interactive scheduling	interactive scheduling;equivalent design representation;finite state machines;finite state machine;scheduling;high level synthesis	High-level synthesis (HLS) requires more designer interaction to better meet the needs of experienced designers. However, attempts to create a highly interactive synthesis process are hampered by incompatibility of various representations used during synthesis. To overcome this problem, equivalent representations are needed, as well as equivalence-preserving synthesis transformations. We present the Structured Finite State Machine (SFSM) design model for scheduled behavior, show its equivalence to the Control/Data Flow Graph (CDFG) model, and define primitive behavior-preserving transformations for scheduling. We have integrated this model and these transjormations into the BIF interactive environment to enable manual rescheduling of a design.	dataflow architecture;finite-state machine;format-preserving encryption;high-level synthesis;interactive design;scheduling (computing);software incompatibility;turing completeness	Roger P. Ang;Nikil D. Dutt	1992		10.1145/304032.304129	mathematical optimization;real-time computing;computer science;theoretical computer science;operating system;distributed computing;finite-state machine;high-level synthesis;scheduling;algorithm	EDA	-38.96040879850259	31.56328242769128	196948
5daa29bfbb00ce6984459615fbb45dfa55b8c33e	petri net based implementation of hierarchical and distributed control for discrete event robotic manufacturing systems	manufacturing systems;distributed system;machining;control systems;petri nets discrete event systems distributed control flexible manufacturing systems hierarchical systems industrial robots;flexible manufacturing systems;complex manufacturing system;hierarchical systems;hierarchical control;flexible manufacturing system petri net hierarchical control distributed control discrete event robotic manufacturing system task specification net representation distributed system complex manufacturing system;satisfiability;firing;net representation;flexible manufacturing system;robot kinematics manufacturing systems machining firing control systems petri nets;industrial robots;discrete event systems;task specification;petri nets;petri net;manufacturing system;distributed control;discrete event;discrete event robotic manufacturing system;model simulation;robot kinematics	The methods of modeling and control of discrete event robotic manufacturing systems using Petri nets are considered, and a methodology of decomposition and coordination is presented for hierarchical and distributed control. Based on a task specification, the conceptual Petri net model is designed and transformed to the detailed net representation of the subtasks. The overall net model is decomposed and the constituent subnets are assigned to local Petri net based controllers. The controllers are coordinated so that the aggregated behavior of the distributed system satisfies the task specification completely. By the proposed method, modeling, simulation and control of large and complex manufacturing systems can be performed consistently using Petri nets.	content-control software;distributed computing;distributed control system;experiment;interactivity;list of version control software;microcomputer;nondeterministic algorithm;petri net;real-time transcription;robot;shared memory;simulation;subnetwork	Gen'ichi Yasuda	2010	2010 IEEE International Conference on Control Applications	10.1109/CCA.2010.5611183	control engineering;real-time computing;stochastic petri net;engineering;operations management;process architecture;petri net	Robotics	-35.048606567080405	29.739757243347892	197014
e309080b5bde20e29018607ebec0244e60421c2b	hierarchical high level petri nets for complex system analysis	high level petri net;bottom up;top down;reachable set;concurrent systems;complex system;system analysis;divide and conquer	The class of Hierarchical High Level Petri Nets (HHPNs) is introduced. HHPNs provide a framework for a modular specification of complex parallel and concurrent systems which supports top-down and bottom-up design. Apart from specification convenience HHPNs can be analysed very efficiently according to functional aspects of the modelled system. Analysis is based on a divide and conquer approach combined with behaviour preserving reduction techniques on subsets of the reachability set. The complexity of an analysis on the reachability set of the net can often be reduced by several orders of a magnitude by considering only small parts of the complex reachability set in a single analysis step and performing behaviour preserving reductions before composing subsets of the reachability set.	complex system;petri net;system analysis	Peter Buchholz	1994		10.1007/3-540-58152-9_8	complex systems;real-time computing;computer science;top-down and bottom-up design;distributed computing;process architecture;petri net;algorithm	Robotics	-38.26442202826977	30.04360431201247	197486
e85426f79865af52c167a741b9373a930b8e1f9a	interaction patterns as composite connectors in component-based software development	composite connector;composition mechanism;interaction pattern;separation of computation and interaction;component model	In current component models, interaction aspects of system behaviour are mostly specified by components, rather than by composition mechanisms, due to the fact that most composition mechanisms cannot express complex interactions. Consequently current component models do not enjoy the benefits that arise from separating the specification of computation from the specification of interaction in software architecture.This thesis investigates the possibility of representing recurring patterns of interaction as composition mechanisms (and other associated component model entities), as distinct from components that define computation; these composition mechanisms would appear as first-class entities in architectures, and can be stored in and reused from repositories.To this end, we have defined a novel, control-driven and data-driven component model that strictly separates computation from interaction. To represent interaction patterns in this model, we have defined composite connectors that can encapsulate control flow and data flow and can be reused via repositories in different contexts. We have also developed a prototype implementation of the component model, and carried out a case study from the reactive control systems domain in order to evaluate the feasibility of our approach. Comparison with related work shows that our composite connectors improve the state of the art in component-based interaction modelling (i) by specifying control flow and data flow explicitly and separately in software architecture; and (ii) by increasing the reuse potential of interaction patterns compared to patterns that are represented by components only.	component-based software engineering;rca connector;software development	Petr Stepan	2014			real-time computing;simulation;engineering;engineering drawing	SE	-38.54274019807489	30.28000464309387	198508
4859fb813d38dc4708349a323fa50dc6b8d02063	recent developments in non-markovian stochastic petri nets	stochastic petri net;analysis and design;analytical model	Analytical modeling plays a crucial role in the analysis and design of computer systems. Stochastic Petri Nets represent a powerful paradigm, widely used for such modeling in the context of dependability, performance and performability. Many structural and stochastic extensions have been proposed in recent years to increase their modeling power, or their capability to handle large systems. This paper reviews recent developments by providing the theoretical background and the possible areas of application. Markovian Petri nets are rst considered together with very well established extensions known as Generalized Stochastic Petri nets and Stochastic Reward Nets. Key ideas for coping with large state spaces are then discussed. The challenging area of non-Markovian Petri nets is considered, and the related analysis techniques are surveyed together with the detailed elaboration of an example. Finally new models based on Continuous or Fluid Stochastic Petri Nets are brieey discussed.	dependability;programming paradigm;stochastic petri net	Andrea Bobbio;Antonio Puliafito;Miklós Telek;Kishor S. Trivedi	1998	Journal of Circuits, Systems, and Computers	10.1142/S0218126698000067	simulation;stochastic petri net;computer science;artificial intelligence;process architecture;petri net	EDA	-36.5848566439728	29.371631727161688	199013
d8fe7f581bf4f02a36d16cd184564491741fd355	codesim: a compact discrete event simulator	data collection;simulation;material handling system;automated storage and retrieval system;gpss;fortran;technical report;discrete event simulation	CODESIM is a compact software facility1 that supports discrete event simulation modeling. Written in Fortran, the CODESIM routines enable facile model construction with a maximum of modeler independence. CODESIM requires no inputs, handles queuing without buffer movement, provides built-in trace control, and permits arbitrary user naming and typing of entity attributes. Statistical routines for data collection and reporting are provided by the CODESIM software—all outputs are in the user domain, as are additional model input parameters, etc. Thus, CODESIM represents a no-frills tool for discrete event simulation. Its advantages include a free programmer structure, speed, size, interactive use, and potential for both machine and language portability.	fortran;programmer;simulation;software portability	Lawrence L. Rose	1983			real-time computing;simulation;computer science;technical report;gpss;theoretical computer science;discrete event simulation;world wide web;data collection	DB	-34.33760012062922	26.790557171691628	199516
f5e2d447042cc8a0c55698d21cf259c6cb4083b5	knowledge representation-oriented nets for discrete event system applications	high level petri net;object oriented methods;computer graphics;inference mechanisms;manufacturing systems knowledge representation oriented nets kron discrete event system applications des static structure high level petri nets frame based representation techniques object oriented paradigm inference engine rete matching algorithm frame object oriented representation schema simulation tool graphical display animation;discrete event system;object oriented;discrete event systems object oriented modeling petri nets knowledge representation engines inference algorithms virtual prototyping displays animation manufacturing systems;frame based representation;petri nets;knowledge representation;discrete event simulation modelling petri nets frame based representation object oriented methods inference mechanisms computer graphics;simulation tool;manufacturing system;object oriented paradigm;discrete event simulation	This paper presents knowledge representationoriented nets (KRON), a knowledge representation schema for discrete event systems (DES’s). KRON enables the representation and use of a variety of knowledge about a DES static structure and its dynamic states and behavior. It is based on the integration of high-level Petri nets with frame-based representation techniques and follows the object-oriented paradigm. The main objective considered in its definition is to obtain a comprehensive and powerful representation model for data and control of DES’s. The use of the DES behavioral knowledge is governed by a control mechanism stored in a separate inference engine. KRON provides an efficient execution mechanism to make the models evolve. This is an adaptation of the RETE matching algorithm in order to deal with the features provided by high-level Petri nets and it takes advantage of its integration with a frame/object-oriented representation schema. Moreover, KRON facilitates dealing with decision points in the execution of nondeterministic models. A prototype of a simulation tool with graphical display and animation facilities has been implemented for KRON and it has been used in several case studies in the manufacturing systems domain.	graphical user interface;high- and low-level;inference engine;infographic;knowledge representation and reasoning;petri net;programming paradigm;prototype;rete algorithm;simulation	Pedro R. Muro-Medrano;José A. Bañares;J. L. Villarroel	1998	IEEE Trans. Systems, Man, and Cybernetics, Part A	10.1109/3468.661146	knowledge representation and reasoning;computer vision;computer science;artificial intelligence;theoretical computer science;discrete event simulation;machine learning;computer graphics;object-oriented programming;petri net	AI	-36.57080950793846	28.09307350032316	199733
