id	title	keywords	abstract	entities	authors	year	journal	doi	fos	area	x	y	ix
a6bfd0bac39342347fee94bb01383e78954e1bf4	kinetic modelling with the systems biology modelling environment sybme	system biology;modelling and simulation;kinetics;simulation model	Kinetic modelling and simulation is an important approach in systems biology. While the focus of current modelling tools is on simulation, model development is a highly iterative process which is currently only partly supported. To support the development of biochemical models, their simulation, and graphical understanding, we designed and implemented SyBME, the Systems Biology Modelling Environment. Here we present the architecture and the main components of SyBME and show its use by modelling sucrose breakdown in developing potato tubers.	copasi;canonical account;database;graphical user interface;iterative method;open-source software;sbml;simulation;systems biology;volume rendering	Björn H. Junker;Dirk Koschützki;Falk Schreiber	2006	J. Integrative Bioinformatics	10.2390/biecoll-jib-2006-18	computational science;simulation;computer science;bioinformatics;simulation modeling;systems biology;kinetics	SE	-34.78054205860527	26.18269571725788	176773
6cac560cfd4050853f805d45dd62688560374ab5	probabilistic programming for java using symbolic execution and model counting		In this paper we describe a probabilistic programming environment for Java that is based on symbolic execution and model counting. The novelty of the framework is that the probability distributions in the program can themselves be symbolic, which allows parametric probabilistic programming. The framework handles typical probabilistic programming features, such as observe statements, and can be used for the encoding and analysis of Discrete Time Markov Chains (DTMC), Bayesian Networks, etc. We show two examples of using the system: (1) analysis of bubble sort when using an unreliable comparison operation, and, (2) analysis of a simulation model of autonomous aircraft towing vehicles, to show whether plans generated for these vehicles are robust when probability distributions are changed from the ones used to generate the plans.	autonomous robot;bayesian network;bubble sort;integrated development environment;java;markov chain;sampling (signal processing);simulation;symbolic execution;unmanned aerial vehicle	Willem Visser;Corina S. Pasareanu	2017		10.1145/3129416.3129433	probability distribution;inductive programming;theoretical computer science;computer science;bayesian network;machine learning;parametric statistics;probabilistic logic;java;artificial intelligence;symbolic execution;markov chain	SE	-34.58240213564615	29.05178606284024	177669
29a8dbec7526b5b6c882a33b74f85007bb8fbe38	overview of thirty semantic formalisms for reo		Over the past decades, coordination languages have emerged for the specification and implementation of interaction protocols for communicating software components. This class of languages includes Reo, a platform for compositional construction of connectors. In recent years, many formalisms for describing the behavior of Reo connectors have emerged. In this paper, we give an overview of all these classes of semantic models. Furthermore, we investigate the expressiveness of two more prominent classes, constraint automata and coloring models, in detail.	automata theory;color;component-based software engineering;constraint automaton;dos;graph coloring;semantic data model;vereofy	Sung-Shik T. Q. Jongmans;Farhad Arbab	2012	Sci. Ann. Comp. Sci.	10.7561/SACS.2012.1.201	computer science;theoretical computer science;reo coordination language;programming language;algorithm	SE	-38.90051077034395	28.83222589499487	177709
b63441c56fa04a8a133f3da8cc0d1233a5f76e5f	sensoria process calculi for service-oriented computing	distributed system;process calculi;service orientation;e learning system;software systems;network performance;web service;software engineering;qa75 electronic computers computer science;integrated project;service oriented computing;quantitative analysis;process algebra;service engineering	The IST-FET Integrated Project SENSORIA aims at developing a novel comprehensive approach to the engineering of service-oriented software systems where foundational theories, techniques and methods are fully integrated in a pragmatic software engineering approach. Process calculi and logical methods serve as the main mathematical basis of the SENSORIA approach. In this paper we give first a short overview of SENSORIA and then focus on process calculi for service-oriented computing. The Service Centered Calculus SCC is a general purpose calculus which enriches traditional process calculi with an explicit notion of session; the Service Oriented Computing Kernel SOCK is inspired by the Web services protocol stack and consists of three layers for service description, service engines, and the service network; Performance Evaluation Process Algebra (PEPA) is an expressive formal language for modelling distributed systems which we use for quantitative analysis of services. The calculi and the analysis techniques are illustrated by a case study in the area of distributed e-learning systems.		Martin Wirsing;Rocco De Nicola;Stephen Gilmore;M. Hoelzl;Roberto Lucchi;Mirco Tribastone;Gianlugi Zavattaro	2006		10.1007/978-3-540-75336-0_3	web service;process calculus;computer science;quantitative analysis;theoretical computer science;distributed computing;network performance;programming language	SE	-38.45940835730448	28.32874666579818	178725
78ca915454ee9e5cda56283ba430121d15dc5e60	a behavioral model for composition of software components	modele comportement;modelizacion;distributed system;behavior model;movilidad;systeme reparti;components;formal specification;composition;componente logicial;mobility;reconfigurable architectures;behavior modeling;modelo comportamiento;semantics;reo;composant logiciel;coordination language;mobilite;semantica;semantique;software engineering;specification formelle;modelisation;especificacion formal;langage coordination;sistema repartido;lenguaje coordinacion;object oriented;abstract behavior types;software component;software package;genie logiciel;oriente objet;coordinacion;progiciel;exogenous coordination;modeling;orientado objeto;ingenieria informatica;architecture reconfigurable;paquete programa;coordination	Engineering of component based software systems requires a formal model for its foundation. Virtually all contemporary component models use some form of object oriented method invocation for their component composition semantics. In contrast, Abstract Behavior Types (ABT) offer a simpler model of components and their composition. Reo is an exogenous coordination language that provides a middleware for dynamically reconfigurable component composition on distributed, mobile platforms. The ABT model serves as a unifying formalism to express the behavior of Reo connectors, as well as that of components. By examples, we show the expressive power of Reo, and the applicability of the ABT model. RÉSUMÉ. L’ingénierie des systèmes logiciels à base de composants nécessite un modèle formel comme fondation. Virtuellement tous les modèles actuels de composants utilisent une forme particulière d’appel de méthode orienté-objet comme base de leur sémantique de composition. À l’opposé, les Abstract Behavior Types (ABT) offrent un modèle plus simple aux composants et à leur composition. Reo est un langage de coordination exogène qui fournit un intergiciel permettant la composition dynamiquement reconfigurable de composants sur les plates-formes distribuées et mobiles. Le modèle ABT sert de formalisme unificateur pour exprimer le comportement des connecteurs Reo ainsi que celui des composants. Au travers d’exemples, nous montrons le pouvoir d’expressivité de Reo et l’applicabilité du modèle ABT.	automata theory;autonomous robot;black box;complex systems;component-based software engineering;constraint automaton;floor and ceiling functions;formal system;geforce 6 series;integrated development environment;linear algebra;loose coupling;mathematical model;middleware;mobile device;model checking;reconfigurability;reo coordination language;scripting language;server efficiency rating tool;simulation;software system;subroutine;visual programming language	Farhad Arbab	2006	L'OBJET	10.3166/objet.12.1.33-76	behavioral modeling;real-time computing;simulation;computer science;semantics;programming language;algorithm	SE	-39.48173852363837	25.65373904809297	178970
459d7841d9497a06fca26effc7a822e8b7a2eba3	credible autocoding of fault detection observers	safety critical software fault diagnosis formal verification helicopters observers;3 degree of freedom helicopter control system domain specific process observer based fault detection software verification control systems quadratic type invariant properties software safety properties state boundedness correctness properties false alarms formal verification credible autocoding framework synchronous modeling environment simulink code annotation analysis output observer fault detector model;formal methods fault detection software verification credible autocoding aerospace systems;ellipsoids fault detection mathematical model observers semantics software equations	We present a domain specific process to enable the verification of observer-based fault detection software. Observer-based fault detection systems, like control systems, yield invariant properties of quadratic types. These quadratic invariants express both safety properties of the software, such as the boundedness of the states, and correctness properties, such as the absence of false alarms from the fault detector. We seek to leverage these quadratic invariants, in an automated way, for the formal verification of the fault detection software. The approach, named the credible autocoding framework, can be characterized as autocoding with proofs. The process starts with the fault detector model, along with its safety and correctness properties, all expressed formally in a synchronous modeling environment such as Simulink. The model is then transformed by a prototype credible autocoder into both code and analyzable annotations for the code. We demonstrate the credible autocoding process on a running example of an output observer fault detector for a 3 degree-of-freedom helicopter control system.	autocode;autocoder;automated theorem proving;control system;correctness (computer science);ellipsoid method;fault detection and isolation;formal verification;high- and low-level;petri net;prototype;semi-supervised learning;semiconductor industry;simulink	Timothy Wang;Alireza Esna Ashari;Romain Jobredeaux;Eric Feron	2014	2014 American Control Conference	10.1109/ACC.2014.6859131	control engineering;real-time computing;computer science;control theory;fault model	SE	-39.81997243335415	31.755314177674826	179073
bb8f3aaf4fdfce41251e4cd0a2fd1efb2e88fded	data-aware design and verification of service compositions with reo and mcrl2	verification;mcrl2;reo;service based systems	Service-based systems can be modeled as stand-alone services coordinated by external connectors. Reo is a channel-based coordination language with well-defined semantics that enables a compositional construction of complex connectors from a set of primitive channels. It has been successfully applied in the area of web service composition specification as well as in business process modeling. In this paper, we present a mapping from Reo to mCRL2, a specification language based on the process algebra ACP, extended with data and time. The mapping enables verification of Reo process models and service compositions using the mCRL2 model checking facilities. The supporting Eclipse Coordination Tools suite provides a user-friendly environment for the modeling and verification process.	business process;eclipse;mcrl2;model checking;process calculus;process modeling;service composability principle;specification language;usability;web service	Natallia Kokash;Christian Krause;Erik P. de Vink	2010		10.1145/1774088.1774590	real-time computing;verification;computer science;operating system;database;reo coordination language;programming language	SE	-40.96743217458377	31.339902641239853	180055
abddd372eacb4477a00675fa581fdeb222e2596c	x.500 directory service usage for x.400 e-mail	directory service usage;addressing;directory services;x 500;directory service	Abstract In the design of open distributed systems, architectural concepts play a crucial role. Because they are elementary notions, their clear and unambiguous understanding is essential for the understanding of the whole design. One of the key concepts of open systems is the interaction point which is used to conceptually model the boundaries between the system and its environment. In this paper, we investigate the interaction point concept and arrive at a list of properties which an interaction point could have. Most of these properties are formally defined, using a temporal first-order logic with operators for past, present, and future. Some interdependencies between these properties are pointed out and proved. Interaction points can be represented by concepts of formal description techniques (FDTs) or even by a piece of a formal description. In this paper, representations in Estelle, LOTOS, and SDL, which are FDTs specifically designed for the specification of open distributed systems, are studied. The semantics of each of these representations is captured (to some extent) in a unified way by subsets of the listed properties. This makes a limited comparison between them feasible.	directory service;x.500	Urs Eppenberger	1993	Computer Networks and ISDN Systems		directory service;telecommunications;computer science;theoretical computer science;database;programming language;law;world wide web;computer network	Networks	-38.6447054142312	28.36427407066546	180542
5afe031e21c9504645f80f221e697602857754ce	modular design of man-machine interfaces with larissa	concepcion modular;langage reactif;componente logicial;concepcion maquina;component based development;relacion hombre maquina;orientado aspecto;man machine relation;composant logiciel;automaton;sistema reactivo;man machine system;automata;machine design;reactive language;automate;conception machine;software component;reactive system;systeme reactif;modular design;sistema hombre maquina;aspect oriented;man machine interface;relation homme machine;lenguaje reactivo;oriente aspect;conception modulaire;systeme homme machine	The man-machine interface of a small electronic device like a wristwatch is a crucial component, as more and more functions have to be controlled using a small set of buttons. We propose to use Argos, an automaton-based language for reactive systems, and Larissa, its aspectoriented extension, to show that several interfaces can be obtained from the same set of basic components, assembled in various ways. This is the basis of a quite general component-based development method for man-machine interfaces.	automaton;component-based software engineering;human–computer interaction;modular design;user interface;watch	Karine Altisen;Florence Maraninchi;David Stauch	2006		10.1007/11821946_19	computer science;artificial intelligence;component-based software engineering;automaton;programming language;algorithm	SE	-38.880296138853375	26.07934482454164	181016
ff38f3f7dcf5ae080967ee84224e78633f4ac373	a (timed) state-transition semantics for reflective petri nets	symbolic state transition petri nets reflection dynamic systems;system lifecycle;dynamic discrete event systems;formal model;color;petri nets discrete event systems timing pollution discrete event simulation engines markov processes performance analysis stochastic processes scientific computing;markov processes discrete event simulation;dynamic system;dynamic systems;layout;discrete event simulation engine;data mining;state transition semantics;discrete event system;adaptation model;reflective petri nets;reflection model;markov process;discrete event systems;markov process state transition semantics reflective petri nets dynamic discrete event systems system lifecycle dynamic workflow management discrete event simulation engine;markov processes;petri nets;state transition graph;petri net;dynamic adaptation;symbolic state transition;reflection;discrete event;state transition;dynamic workflow management;discrete event simulation;timing	The design of dynamic (adaptable) discrete-event systems calls for adequate modeling formalisms and tools able to manage possible changes occurring during systempsilas lifecycle. A common approach is to pollute design with details that do not regard the current system behavior, rather its evolution. That hampers analysis, reuse and maintenance in general. A Petri net-based reflective model (based on classical Petri nets) was recently proposed to support dynamic discrete-event systempsilas design, and was applied to dynamic workflowpsilas management. Behind there is the idea that keeping functional aspects separated from evolutionary ones, and applying evolution to the (current) system only when necessary, results in a simple formal model on which the ability of verifying properties typical of Petri nets is preserved. On the perspective of implementing in the short time a discrete-event simulation engine, Reflective Petri nets are provided in this paper with a timed state-transition graph semantics, defined in terms of a Markov process.	formal language;high- and low-level;hoc (programming language);semantics (computer science);semiconductor industry;simulation;state diagram;stochastic petri net;verification and validation	Lorenzo Capra	2008	2008 10th International Symposium on Symbolic and Numeric Algorithms for Scientific Computing	10.1109/SYNASC.2008.65	real-time computing;simulation;computer science;theoretical computer science;dynamical system;process architecture;markov process;petri net;statistics	SE	-36.71853794949899	30.243287508329402	181341
f3228d2820bebd823578a9fb47a1cc319ec49886	hybrid dynamic systems: relating chi to hybrid automata	hybrid dynamical system;formal model;transition systems;hybrid system;differential algebraic equation;hybrid automata;model simulation	A hybrid automation is one of the most popular formal models for hybrid system specification. The Chi language is a hybrid formalism for modeling, simulation and verification. It consists of a number of operators that operate on all process terms, including differential algebraic equations. This paper relates the two formalisms by means of a formal translation from a hybrid automaton model to a Chi model, and a comparison of the semantics of the two models in terms of their respective transition systems. The comparison is illustrated by means of three examples: a thermostat, a railroad gate controller, and dry friction.	automata theory;chi;differential algebraic equation;dynamical system;formal verification;hybrid automaton;hybrid system;semantics (computer science);simulation	Dirk A. van Beek;Niek G. Jansen;J. E. Rooda;Ramon R. H. Schiffelers;Ka Lok Man;Michel A. Reniers	2003		10.1145/1030818.1030904	discrete mathematics;differential algebraic equation;theoretical computer science;mathematics;algorithm;hybrid system	Logic	-39.69213488402314	30.424456497209423	182708
61ed7a0a08b95fe5a3c347615d407961e9eea52e	formal verification of communication protocols	verification;formal verification;communication protocol;satisfiability;network protocols	This paper presents the modeling and formal verification of some communication protocols for Remote Procedure Call (RPC). These protocols include Request (R) Protocol, Request Reply (RR) Protocol and Request-Reply-Acknowledgement (RRA) Protocol. We have modeled the above-mentioned protocols in Symbolic Model Verifier (SMV), a formal verification tool. In modeling of each protocol, each of the two agents (Client and Server) is modeled as a finite state machine. The common channel between these agents is modeled as a bounded queue of message. Some important features of modeled protocols are then formal verified using the SMV tools.	communications protocol;computer science;corner case;finite-state machine;formal verification;network security;queue (abstract data type);rapid refresh;remote procedure call;spin;sensor	M. A. S. Smith	1996			communications protocol;formal methods;formal verification;computer science;theoretical computer science;distributed computing;runtime verification;programming language;intelligent verification;functional verification	Networks	-34.63985631264629	31.945404915058102	182932
91178092241f9d77df449f8ed48e6c9991e41d0d	formal reasoning for air traffic control system using event-b method		We present a formal modeling and verification of Air Traffic Control system (ATC) for airspace management. This system assists air traffic controllers by visualizing aircrafts in the airport vicinity. In such a critical-safety system, the use of robust formal methods that assure bugs absence is highly required. Therefore, we use a formalism of discrete transition systems based on abstraction and refinement along proof obligations. These proofs ensure the consistency of the system by mean of invariants preservation and deadlock freedom. The first guarantee that all invariants hold permanently and thus provide a handy solution for bugs absence verification. The second prove that the system runs forever to avoid deadlock. This modeling and proving enable us to establish that the system is, relatively to some criteria, correct by construction.	b-method;control system;reason	Abdessamad Jarrar;Youssef Balouki	2018		10.1007/978-3-319-95165-2_17	mathematical optimization;airspace class;real-time computing;air traffic management;computer science;mathematical proof;formal methods;b-method;air traffic control;deadlock;formalism (philosophy)	Robotics	-40.843225533820615	29.809070672830902	183000
c74799db68aaaafa5534dfc965ba94bb69898f87	petri nets with causal time for system verification	high level petri net;automated verification;timed automata;petri net;constrained system	We present a new approach to the modelling of time constrained systems. It is based on untimed high-level Petri nets using the concept of causal time. With this concept, the progression of time is modelled in the system by the occurrence of a distinguished event, tick , which serves as a reference to the rest of the system. In order to validate this approach as suitable for automated verification, a case study is provided and the results obtained using a model-checker on high-level Petri nets are compared with those obtained for timed automata using prominent tools. The comparison is encouraging and shows that the causal time approach is intuitive and modular. It also potentially allows for efficient verification.	automata theory;causal filter;color gradient;high- and low-level;model checking;petri net;timed automaton	Cécile Bui Thanh;Hanna Klaudel;Franck Pommereau	2002	Electr. Notes Theor. Comput. Sci.	10.1016/S1571-0661(04)80521-8	real-time computing;stochastic petri net;computer science;theoretical computer science;process architecture;petri net;algorithm	SE	-38.14199978628231	31.162505765114464	183646
0141f03da4b15c80231035dd39592bbc6062d44a	specification of a batch plant using process algebra and petri nets	text;high level languages;publikationer;resource allocation;individual object;konferensbidrag;indexing terms;automatic generation;production engineering computing;discrete event system batch plant process algebra petri nets general routing system resource allocation system high level language specification language;modelling framework;discrete event system;batch processing industrial;modelling language;specification languages;artiklar;discrete event systems;rapporter;algebra petri nets routing automatic control resource management high level languages automation laboratories signal processing automotive engineering;petri nets;production engineering computing process algebra petri nets resource allocation specification languages high level languages discrete event systems batch processing industrial;process algebra;petri net;high level language	A modelling framework for general routing and resource allocation systems is presented. The task is to specify desired routes for individual objects (products, data packets, vehicles), which are to be served by a number of shared resources (machines, computers, communication links). Based on simple booking models for the resources and routing specifications for the objects, a controller that synchronizes the objects utilization of the available resources is automatically generated. A high level language is presented in order to simplify the specification of desired routes. This modelling language combines Petri nets and process algebra. Process operators are introduced for specification of alternative, synchronization, start and stop process, and restriction, which are applied in order to model join and split operations. This language results in a compact and efficient representation of complex routing specifications.	automata theory;batch processing;computer;formal specification;high-level programming language;modeling language;network packet;petri net;process calculus;routing;synchronization (computer science)	Petter Falkman;Bengt Lennartson;Michael Tittus	2005	IEEE International Conference on Automation Science and Engineering, 2005.	10.1109/COASE.2005.1506792	real-time computing;computer science;theoretical computer science;distributed computing	Robotics	-35.13232898505472	30.18352357433013	183707
