id	title	keywords	abstract	entities	authors	year	journal	doi	fos	area	x	y	ix
6b8f759cd8ae47fbc943ea8aa5cb52eb84c930db	object-oriented simulation with sml and silk in java and .net: object-oriented simulation with sml and silk in .net and java	simulation library;advanced simulation developer;object-oriented simulation;languages vb;object-oriented programming language;object-oriented simulation model;discrete-event simulation;simulation code;system behavior;simulation control;system controller	This tutorial is for advanced simulation developers engaged in the use of object-oriented programming languages and libraries that support object-oriented, discrete-event simulation. The tutorial is based on generic structures common to SML simulation libraries in the .Net languages VB.Net, C# and J# and the Silk libraries in Java. The focus of the tutorial is on the use of consistent design patterns that encourage usability, reusability and cross-language compatibility. Particular emphasis is placed on designing and coding object-oriented simulation models to properly transfer simulation control between entities, resources and system controllers, and on techniques for obtaining a one-to-one correspondence between simulation code and system behavior.	.net framework;design pattern;entity;java;library (computing);one-to-one (data model);programming language;silk;simulation;usability;visual basic[.net];visual j#	Richard A. Kilgore	2003		10.1145/1030818.1030849	computer science;theoretical computer science;programming language	PL	-34.05584169120802	26.264157905831887	184223
4066cb44247bf987eda9d8dc1a4a0dab3573512c	development of generic simulation models to evaluate wafer fabrication cluster tools	system performance;design evaluation;technical report;simulation model;analytical model;semiconductor manufacturing;discrete event simulation	This document presents the purpose, development and applications of generic simulation models used to design, evaluate and demonstrate the potential performance of semiconductor wafer fabrication cluster tools. The use of this type of highly integrated equipment is growing rapidly within the semiconductor manufacturing industry. Because of the complex interactions involved in cluster tools, analytical models and calculations have usually been inadequate for determining system performance. However, discrete-event simulation models have proven to be quite beneficial to cluster tool developers and owners. The models are used to simulate the performance of equipment integrating multiple process modules in a radial cont@ration. A menu-clrken interface permits analysts to customize, develop and exercise the model for a variety of cluster tools.	interaction;radial (radio);semiconductor device fabrication;simulation;wafer (electronics);wafer fabrication	Neal G. Pierce;Michael J. Drevna	1992		10.1145/167293.167757	simulation;computer science;systems engineering;engineering;technical report;discrete event simulation;simulation modeling;computer performance;semiconductor device fabrication;world wide web;manufacturing engineering	HPC	-35.41983729147468	26.127677959790148	184261
15789c4e5b44cebc627a2003627a6921b7057195	time considered irrelevant for real-time systems	systeme temps reel;distributed system;interfase usuario;systeme reparti;protocole transmission;user interface;mando numerico;sistema informatico;simulation;simulacion;computer system;commande numerique;protocolo transmision;sistema repartido;communication protocol;interface utilisateur;real time system;systeme informatique;sistema tiempo real;digital control;real time systems;transmission protocol	Various manifestations of the time-as-a-proxy phenomenon in specification of computing problems are considered. It is argued that unless the time-related considerations constitute an essential part of natural (physical) problems, safer specifications are obtained from avoiding short-cuts offered by introduction of time-related notions. This methodological principle is illustrated by examples from several fields: digital control and simulation, design of operator's interface and communication protocols.		Wladyslaw M. Turski	1988	BIT	10.1007/BF01941129	communications protocol;simulation;real-time operating system;digital control;telecommunications;user interface	Embedded	-33.944661431467885	30.3098767122957	185013
da2948dd087d9c18befd4957a208404a05c9987c	developments in dynamic and intelligent reconfiguration of industrial automation	reconfiguration;controleur logique programmable;controlador logica programable;componente logicial;reconfigurable architectures;automatisation;composant logiciel;automatizacion;commande industrielle;programmable logical controller;industrial control;software component;iec 61499;industrial automation;architecture reconfigurable;industrial automation and control;programmable logic controller;automation	This paper provides an overview of current techniques to allow the industrial systems to automatically adapt to change while maintaining predictable and stable system behaviour. This is performed along the dimensions of simple, dynamic and intelligent reconfiguration and focuses on the physical device and software component levels of the shop floor and in particular, on automatic reconfiguration of programmable logic controller systems. Through an analysis of recent work by the authors and others in this area, the paper identifies the basic requirements for intelligent reconfiguration and the outstanding issues in this area. # 2008 Elsevier B.V. All rights reserved.	automation;competitive analysis (online algorithm);component-based software engineering;control system;data recovery;distributed artificial intelligence;drag and drop;firewall (computing);intelligent control;interoperability;peripheral;programmable logic device;real-time computing;real-time transcription;refinement (computing);requirement;seamless3d;software architecture;tag (game);top-down and bottom-up design;usability;wizard (software)	Robert W. Brennan;Pavel Vrba;Pavel Tichý;Alois Zoitl;Christoph Sünder;Thomas I. Strasser;Vladimír Marík	2008	Computers in Industry	10.1016/j.compind.2008.02.001	control engineering;real-time computing;computer science;engineering;automation;computer engineering	Robotics	-34.597561813249925	30.667799365931113	185104
6fdae5281b792c9c9ec2b14b06e2e58274bb96d4	object oriented modelling and simulation of hydropower plants with run-of-river scheme: a new simulation tool	generic model;info eu repo semantics article;simulator;component library;operating characteristic;graphic user interface;object oriented modelling;water flow;hydropower plants;simulation tool	This paper presents the design of a component library for modelling hydropower plants, and describes the development of a new simulation tool for small hydropower plants with a run-of-river scheme. After reviewing the desirable features of simulation, an approach based on an object oriented modelling language, like EcosimPro, is presented. A general model of hydropower plant with run-of-river scheme is created with this component library. It provides the possibility of choosing a specific number of turbines and spillway gates. In this way, several hydropower stations of similar operating characteristics can be simulated using this same general model. It is expected to obtain interesting information in simulation like the reservoir level, water flows, turbine efficiencies, and so on. In addition, a graphical user interface has been designed in order to operate this general model more easily, to configure plant parameters and to simulate the plant behaviour under different conditions. Three real stations have been used as real examples for validating the model and testing the simulator: hydropower stations of Villafranca and El Carpio (Córdoba, Spain) and Marmolejo (Jaén, Spain).	graphical user interface;modeling language;simulation	Juan Garrido;Ángel Zafra;Francisco Vázquez	2009	Simulation Modelling Practice and Theory	10.1016/j.simpat.2009.08.007	simulation;computer science;systems engineering;engineering;graphical user interface	Robotics	-35.46609898182942	26.24294875626503	186257
61d23b34ac9414aa352df6913d0d435a47a05c5a	from formal specification of code mobility to design and implementation: an uml-based mobile agent approach	agent interaction;formal specification;uml sequence diagram;formal specifications mobile agents unified modeling language software agents code standards software engineering scientific computing application software prototypes algorithm design and analysis;agent interactions;client server code mobility;software agent;mobile agents;data mining;code mobility implementation;uml sequence diagrams;software agents;uml based mobile agent;client server;design and implementation;mobile software agents;client server code mobility formal specification uml based mobile agent code mobility design code mobility implementation mobile software agents uml sequence diagrams agent interactions agent migration;distributed programming;ovens;unified modeling language;mobile communication;agent migration;code mobility design;code mobility;mobile agent;programming;unified modeling language distributed programming formal specification mobile agents	The contribution of this paper is to propose a simple approach for the design and implementation of code mobility using mobile software agents. The approach is demonstrated by its application to standard code mobility paradigms. We start from existing formalizations of code mobility paradigms and show how they can be used to derive standard UML sequence diagrams that describe agent interactions and migration. Then we show how these diagrams can guide a prototype JADE-based implementation of the client-server code mobility paradigm.	client–server model;code mobility;formal specification;interaction;jade;mobile agent;programming paradigm;prototype;sequence diagram;server (computing);software agent;unified modeling language	Amelia Badica;Costin Badica	2008	2008 10th International Symposium on Symbolic and Numeric Algorithms for Scientific Computing	10.1109/SYNASC.2008.75	real-time computing;computer science;artificial intelligence;software agent;operating system;database;programming language	SE	-40.28561576039906	27.775965642623838	186609
60522816bd51a0a2b34545f15e7cba54da990fc2	a software architecture for knowledge-based systems	domain model;algebraic specification;knowledge based system;efficiency;karl;dynamic logic;article letter to editor;software architecture;assumptions;specification and verification;specification languages;acquisition;problem solving method;level;reusable component;architecture;problem solving methods;amenagement de l espace	The paper introduces a software architecture for the specification and verification of knowledge-based systems combining conceptual and formal techniques. Our focus is component-based specification enabling their reuse. We identify four elements of the specification of a knowledge-based system: a task definition, a problem-solving method, a domain model, and an adapter. We present algebraic specifications and a variant of dynamic logic as formal means to specify and verify these different elements. As a consequence of our architecture we can decompose the overall specification and verification task of the knowledge-based systems into subtasks. We identify different subcomponents for specification and different proof obligations for verification. The use of the architecture in specification and verification improves understandability and reduces the effort for both activities. In addition, its decomposition and modularisation enables reuse of components and proofs. Therefore, a knowledge-based system can be built by combining and adapting different reusable components.	abstract data type;automated theorem proving;cobham's thesis;component-based software engineering;computation;correctness (computer science);domain model;dynamic logic (modal logic);eddy willems;encapsulation (networking);first-order predicate;formal methods;formal specification;functional specification;java;john reif;knowledge engineer;knowledge-based systems;library (computing);parametric design;pile (abstract data type);problem solving;proof assistant;refinement (computing);software architecture;specification language;verification and validation	Dieter Fensel;Rix Groenboom	1999	Knowledge Eng. Review	10.1017/S0269888999142097	dynamic logic;software architecture;formal methods;specification language;computer science;artificial intelligence;theoretical computer science;architecture;knowledge-based systems;domain model;formal specification;efficiency;programming language;algorithm;functional verification;language of temporal ordering specification	SE	-40.12988481387231	26.460365711335992	186722
1a688b447cd90f0b6cd7817446b02f7a01fc106c	interface-based protocol specification of open systems using psl	three dimensions;functional properties;open system;protocol specification	PSL is a framework for describing dynamic and architectural properties of open systems. PSL extends established interface-based tactics for describing the functional properties of open systems to the realm of protocol description. PSL specifications consist of logical and temporal rules relating situations, each of which describes potential states with respect to instances of interfaces, their attributes, and the issuance and reception of events. PSL accommodates refinement and extensibility of specifications along the three dimensions of interfaces, situations, and orderings. A specialized form, PSL/IDL describes protocols in CORBA systems.	common object request broker architecture;extensibility;interface description language;refinement (computing)	Doug Lea;Jos Marlowe	1995		10.1007/3-540-49538-X_18	three-dimensional space;computer science;database;distributed computing;open system;programming language	SE	-38.64033368142495	28.445228762838976	187294
20f1df0ab5bf54bd706d923a43b1859de38cce0b	digital simulation of communication systems with topsim iii	computer languages;communication system;performance evaluation;building block;communication systems;satellite communications communication systems computer languages;satellite communications;analysis and design;digital simulation packaging communication systems software libraries computational modeling software packages computer aided manufacturing high level languages digital communication computer simulation;digital communication;time domain;fortran;high level language;digital simulation	TOPSIM III is a flexible, easy to use, stand-alone Fortran package for the digital simulation of communication systems in the time domain. TOPSIM III provides a simple high-level language for the description of the system. Programs can be written following the same structure used in drawing the system block diagram. The paper discusses the time domain simulation approach used in the design of the package and describes its capabilities. The contents of the subprogram libraries are presented, describing some of the building blocks that can be used in the simulation as well as the performance evaluation facilities available in the package. Some simple examples illustrate the use of TOPSIM III as a tool for analysis and design of digital communication systems.	simulation	Marco Ajmone Marsan;Sergio Benedetto;Ezio Biglieri;Valentino Castellani;Michele Elia;Letizia Lo Presti;Mario Pent	1984	IEEE Journal on Selected Areas in Communications	10.1109/JSAC.1984.1146036	telecommunications;computer science;theoretical computer science;communications system	Metrics	-34.7978991604229	26.841700568922604	188312
37b8551270e88fd341134ee59dbb6ba49be7b7b2	stateml+s: from graphical state machine models to thread-safe ada code	generacion de hilo seguro de codigo;plataforma eclipse;state machine;automatic generation;info eu repo semantics article;model to text transformation;finite state machines;lenguajes y sistemas informaticos;model driven engineering;eclipse;modelos de ingenieria de conduccion;model driven engineering mde;finite state machines fsm;model to text m2t transformation;maquinas de estado finito;meta model;thread safe code generation;eclipse platform;transformacion de modelo a texto	This paper presents the StateML tool aimed at designing statemachines and automatically generating thread-safe and multi-tasking modular Ada code from them, following a Model-Driven Engineering approach. The StateML meta-model is an extension of a previous version, and now it offers improved modeling capabilities, which include regions and macro-state definition. In this paper, a case study regarding the design of a robotic system will be used to demonstrate the benefits of the proposed approach.	abstraction layer;active object;ada;computer multitasking;concurrency (computer science);design pattern;embedded system;executable;finite-state machine;graphical user interface;machine code;metamodeling;model-driven architecture;model-driven engineering;multiversion concurrency control;reactor (software);robot;run to completion scheduling;software system;systems design;thread safety;uml state machine;unified modeling language	Diego Alonso;Cristina Vicente-Chicote;Juan Angel Pastor;Bárbara Álvarez	2008		10.1007/978-3-540-68624-8_12	metamodeling;eclipse;model-driven architecture;computer science;engineering;software engineering;finite-state machine;algorithm	SE	-39.01920868394839	26.65450624315748	188945
ed43a0a2d11b8166dc9f2a6491c8846fe82c847d	queueing structure modelling	structural modelling;simulation;manpower planning;q gert;technical report	"""A modelling scheme for simulation of queueing structures is proposed. After a general discussion about the special properties of queueing structures and how such usually are investigated, the scheme follows. The scheme makes use of three different concepts: Deterministic Analysis, Load Analysis and Balance Analysis. These concepts are explained and thereafter used in the modelling scheme. It is emphasised that complex models are difficult to handle and validate and that a simple model which comprises the important features of the """"real"""" system is to prefer. The paper discusses which these features can be and how to find them."""	simulation	Berth Eklundh	1982			simulation;computer science;engineering;technical report;operations research;world wide web	Web+IR	-35.465367330628666	27.197248733023166	190044
449c3c9a9a555a1b32eab798f847e7a835e6b21c	simulating set-valued transformations with algorithmic graph transformation languages	system modeling;product line;graph transformation;model complexity;control structure	PROGRES is one of the most mature graph transformation languages currently available. It offers many language features, also some for non-homomorphic transformations, e.g. set-nodes. Nevertheless, the language does not offer a comfortable possibility to work with complex set-valued structures. However, these are often useful when modeling complex systems, e.g. simulation systems, models-of-computation, or product lines using multiplicity variation points. We introduce the notion of set-valued transformations to PROGRES, define their syntax and semantics and show how they can be simulated using basic language constructs offered by most algorithmic graph transformation languages with a rich set of control structures.	transformation language	Christian Fuss;Verena Majuntke	2007		10.1007/978-3-540-89020-1_30	discrete mathematics;theoretical computer science;abstract semantic graph;mathematics;graph;algorithm;graph rewriting	PL	-39.699939196041846	29.807479926068613	192061
0a812f0c50e715a1e47e42ea564c42dbe12d6468	jeops - the java embedded object production system	production system;systeme production;langage java;sistema produccion;object oriented;agent intelligent;component reuse;intelligent agent;oriente objet;agente inteligente;orientado objeto;production rule;java language;programmation declarative	Although the concept of intelligent agents facilitates the development of systems which require intelligent behavior, the lack of standard tools to support the creation of agents is still an obstacle for the broad use of this paradigm. Agents can be created via the use of either specialized languages or generalpurpose ones. We claim that the latter is more suitable for complex applications where components reuse is highly demanded. In this case, the integration of production rules and objects is a promising approach. This article presents JEOPS, an inference engine that aims to provide reasoning capabilities to Java. JEOPS gives a special attention to the problem of the rule-object integration uniformity, because of its impact on the system reusability and readability. JEOPS has been used in different projects, and the results are very encouraging.	java;production system (computer science)	Carlos Santos da Figueira Filho;Geber Ramalho	2000		10.1007/3-540-44399-1_7	real-time computing;simulation;computer science;artificial intelligence;operating system;database;production system;programming language;object-oriented programming;intelligent agent;algorithm	HCI	-36.54973520890138	25.675872837733127	193045
cc7ddf4155346edfbcbe65945e543d348c0b4c8a	merging features in featured transition systems		Featured Transition Systems (FTSs) is a popular representation for software product lines: an entire product line is compactly represented as a single transition-machine model, in which feature-specific behaviour is guarded by feature expressions that are satisfied (or not) by the presence or absence of individual features. In previous work, FTS models were monolithic in the sense that the modeller had to construct the full FTS model of the product line in its entirety. To allow for modularity of FTS models, we propose here a language for extending an existing FTS model with new features. We demonstrate the language using a running example and present results about the language’s expressivity, commutativity of feature extensions, feature interactions, and resolution of such interactions.	fleet telematics system;formal methods europe;interaction;line level;modeller;modeling language;sensor;software product line;usability	Joanne M. Atlee;Sandy Beidu;Ulrich Fahrenberg;Axel Legay	2015			computer science;artificial intelligence;algorithm	AI	-38.270507173882606	30.059780240781826	193318
bf5796972083b5545fa9255ebace1162ba98f42b	a pictorial approach to the animation of process-oriented formal specifications	computer graphics software tools specification languages;formal specification;ada;modular multiprogramming language;pascal plus;formal languages;process oriented formal specifications;animation;peep;specification languages computer graphics software tools;csp;lotos animation process oriented formal specifications peep concurrent applications modular multiprogramming language ada pascal plus formal languages csp ccs sdl;concurrent applications;ccs;sdl;lotos	This paper considers how the meaning of process-oriented formal specifications might be made more apparent through the use of pictorial animation. The approach taken is based on techniques embodied in the software animation system PEEP. The PEEP system gives pictorial representations of the changing states of software as it is executed. It was designed for concurrent applications expressed in a modular multiprogramming language, such as Ada or Pascal Plus. Corresponding formal languages suitable for the specification of concurrent systems include CSP, CCS, SDL and LOTOS. The LOTOS language is used for illustration purposes in this paper, but the techniques discussed are equally applicable to the other languages.	formal specification;image	David W. Bustard;Mark T. Norris;Rodney A. Orr	1988	Software Engineering Journal	10.1049/sej.1988.0013	anime;computer architecture;formal language;real-time computing;ada;computer science;communicating sequential processes;formal specification;programming language	SE	-34.72282260119004	28.094972420565128	193584
