id	area	title	year	x	y	ix
640601	Metrics	switching and diffusion models for gene regulation networks	2009	-11.763707751301306	2.501320630415445	640628
640624	ML	regularized mixed variational-like inequalities	2012	-14.740327127861487	2.0375846074736	640651
640727	AI	tight bounds on indefinite separable singly-constrained quadratic programs in linear-time	2017	-13.215685988649255	2.23944631754436	640754
640890	AI	a new approach to characterize the solution set of a pseudoconvex programming problem	2014	-14.163615815044091	2.7842411372645546	640917
640931	ML	optimality conditions via exact penalty functions	2010	-13.895748696774882	2.788638490778036	640958
641197	Robotics	adaptive task allocation for mobile edge learning	2018	-12.702121280959062	1.5558331970225552	641224
641245	Crypto	near-optimal compressive binary search	2012	-13.691989727117994	0.08725467802241144	641272
641257	Mobile	zil: an energy-efficient indoor localization system using zigbee radio to detect wifi fingerprints	2015	-11.357563925841633	1.0412556422859325	641284
641322	Theory	strong convergence theorems for approximating common fixed points of families of nonexpansive mappings and applications	2013	-14.843192347644708	3.0955522464586496	641349
641381	ML	distributed subgradient-push online convex optimization on time-varying directed graphs	2014	-12.715469830989024	1.0605974498246398	641408
641455	Vision	updating the self-scaling symmetric rank one algorithm with limited memory for large-scale unconstrained optimization	2004	-14.150302140434524	1.895177712662646	641482
641522	Theory	eigenvalue bounds versus semidefinite relaxations for the quadratic assignment problem	2000	-13.486657203549399	2.3397730554218934	641549
641622	Vision	phaselin: linear phase retrieval	2018	-14.202472104379833	0.11501689061747765	641649
641835	Vision	a fast matrix majorization-projection method for penalized stress minimization with box constraints	2018	-13.834173236524672	1.7038371332696445	641862
641861	HCI	multi-sensor data fusion methods for indoor localization under collinear ambiguity	2016	-11.9467855101356	-0.01622757356083844	641888
642135	Theory	an fptas for sm-cels problem with monotone cost functions	2009	-13.253421490874882	3.136159253383875	642162
642183	Theory	experimental investigation of an interior search method within a simplex framework	1988	-13.61658727316952	2.142016567113161	642210
642209	Robotics	automatic generation of high-level contact state space	2001	-11.55013063620028	3.2332091897833144	642236
642239	Mobile	best practice in rss measurements and ranging	2016	-11.607198261532064	0.9824293533877404	642266
642377	Theory	testing for quaternion propriety	2011	-14.607326512669545	0.11676635706047092	642404
642388	Theory	a characterization of statistical manifolds on which the relative entropy is a bregman divergence	2016	-12.751197674320405	2.9190527457604434	642415
642443	Mobile	rssi-based heading control for robust long-range aerial networking using directional antennas	2017	-11.375035796262114	-0.19404269839704716	642470
642678	AI	study on the model of grey matrix game based on grey mixed strategy - solution of grey linear program model on grey matrix game	2008	-13.331397867987256	3.165342030446892	642705
642854	ML	network independent rates in distributed learning	2016	-12.678794600826215	0.755459615685121	642881
642894	Mobile	removing systematic error in node localisation using scalable data fusion	2007	-11.78415957242133	0.42164734452132935	642921
642899	AI	parallel algorithms for robust convex programs over networks	2016	-12.80847167045432	0.6284360056822561	642926
642910	Embedded	regularized interpolation for noisy data	2007	-14.887637938255086	0.3832811393369685	642937
643043	Theory	estimating entropy on m bins given fewer than m samples	2004	-12.377016426877	2.8512011202564014	643070
643098	EDA	alternating minimization approach for identification of piecewise continuous hammerstein systems	2018	-14.890263115282732	1.216993270862665	643125
643524	Theory	iterated codes with improved performance (ph.d. thesis abstr.)	1976	-11.788854859692806	2.6465068176242985	643551
643547	AI	an explicit solution to the multi-level programming problem	1982	-13.253490120328758	2.6143353817537665	643574
643656	Mobile	demo: shadowmaps, the urban phone tracking system	2014	-11.280662908316176	0.8912888853573954	643683
643667	Mobile	challenges for rf two-way time-of-flight ranging in wireless sensor networks	2012	-11.771054738088985	0.5230159205848315	643694
643725	ML	"""on the convergence of the iterates of the """"fast iterative shrinkage/thresholding algorithm"""""""	2015	-14.38773545126287	2.2742473862649986	643752
643871	Mobile	architectures for location data acquisition and distribution in uwb indoor tracking systems	2010	-11.518298756690285	0.721939778957933	643898
643898	Robotics	a nonconvex admm algorithm for group sparsity with sparse groups	2013	-14.121428428388406	0.4688568362620956	643925
644167	NLP	penalty lagrangian methods via a quasi-newton approach	1979	-14.595465041059244	1.952462008095584	644194
644358	ML	error bounds for degenerate cone inclusion problems	2005	-14.668676710250082	3.1138417912063248	644385
644394	ML	a decentralized prediction-correction method for networked time-varying convex optimization	2015	-13.181666928170145	0.9805227962038142	644421
644419	Theory	matrix sensitivity analysis from an interior solution of a linear program	1999	-13.403858291377318	2.8228697528106204	644446
644446	ML	on some methods to derive necessary and sufficient optimality conditions in vector optimization	2017	-14.057762658541346	2.490193690614322	644473
644688	ECom	a continuous technique for the weighted low-rank approximation problem	2004	-14.86990098802474	1.3671456625890022	644715
644705	EDA	strictly feasible solutions and strict complementarity in multiple objective linear optimization	2017	-13.895091021686998	2.9039157881236046	644732
644863	Theory	new method for obtaining optimal polygonal approximations	2015	-12.073648438171706	2.4816755519441336	644890
644910	AI	on pseudo gradient search for solving nonlinear multiregression with the choquet integral	2013	-13.810379606787436	1.696239631792894	644937
645061	Theory	on the existence of a classical optimal solution and of an almost strongly optimal solution for an infinite-horizon control problem	2013	-14.497035330203751	3.1325677838178088	645088
645065	ML	mime: mutual information minimization and entropy maximization for bayesian belief propagation	2001	-12.448005930554267	2.190722384039061	645092
645104	Robotics	sampling matrix perturbation analysis of subspace pursuit for compressive sensing	2010	-14.219647521408865	0.02725001377394513	645131
645157	AI	bounds tightening based on optimality conditions for nonconvex box-constrained optimization	2017	-13.863473156460461	2.1037173828302387	645184
645179	Theory	nearly-linear time packing and covering lp solver with faster convergence rate than $o(1/\varepsilon^2)$	2014	-13.725370259625265	2.134073267331664	645206
645375	Robotics	a boolean penalty method for zero-one nonlinear programming	2000	-13.370087098545715	2.5582446455858188	645402
645381	ML	first-passage problems for asymmetric diffusions and skew-diffusion processes	2009	-12.426138408971715	3.3678115807483158	645408
645513	Robotics	an inexact restoration strategy for the globalization of the ssqp method	2013	-14.486470240109401	1.857879670043575	645540
645597	Robotics	max-min feasible point pursuit for non-convex qcqp	2015	-13.884739082592347	1.8497426554441867	645624
645736	Vision	a dynamic convexized function with the same global minimizers for global optimization	2006	-13.75367953476603	1.932498611611956	645763
645973	ML	trust-region algorithm for nonnegative matrix factorization with alpha- and beta-divergences	2012	-14.143760916649669	0.5889248493761573	646000
646120	Theory	decision theory solutions for nonlinear devices (corresp.)	1963	-12.030978987663307	2.705394801903792	646147
646413	Arch	"""comments on """"infinite-series representations associated with the bivariate rician distribution and their applications"""""""	2006	-12.482067970174455	2.645449100672532	646440
646541	Mobile	tracking of moving wireless lan terminals	2004	-11.339290311352002	0.9475115432240974	646568
646656	ML	maximum likelihood estimator of the parameter for a continuous one-parameter exponential family under the optimal ranked set sampling	2017	-12.537212538139858	1.9488384950847435	646683
646819	Metrics	tracking performance and optimal adaptation step-sizes of diffusion-lms networks	2018	-13.105700890754225	0.2132740744901624	646846
646984	ML	cauchy diversity measures: a novel methodology for enhancing sparsity in compressed sensing	2013	-14.056940608806133	-0.052726570809424736	647011
647054	ML	simplifying generalized belief propagation on redundant region graphs	2013	-12.610992394383636	1.8976707099924977	647081
647143	ML	cooperative and distributed algorithm for compressed sensing recovery in wsns	2018	-12.873631677594593	-0.140988868724987	647170
647173	AI	the generalized trust region subproblem	2014	-14.180732987011185	2.6134133685372314	647200
647174	ML	convexity in hamilton-jacobi theory ii: envelope representations	2000	-14.524535318829756	2.9320186841959544	647201
647342	Theory	on the belgian chocolate problem and output feedback stabilization: efficacy of algebraic methods	2012	-14.333198846309099	3.4701401908345573	647369
647365	ML	analysis of fixed-point and coordinate descent algorithms for regularized kernel methods	2011	-14.053630190542359	1.2572565599613987	647392
647387	Mobile	a train-once approach for location estimation using the directional propagation model	2008	-11.588721755820892	0.8035936054826108	647414
647394	ML	a derivative-free comirror algorithm for convex optimization	2015	-14.26244702992618	1.6660398104063754	647421
647676	Theory	an optimal algorithm for constrained differentiable convex optimization	2013	-13.883975569028564	2.3266196280621423	647703
647856	ML	finding global minima with a novel filled function for non-smooth unconstrained optimisation	2012	-13.954883582584035	1.9242247592896344	647883
647958	Mobile	human slam, indoor localisation of devices and users	2016	-11.168947926437653	0.9997099123225188	647985
648012	Graphics	real solving of ill-conditioned sine-polynomials equations	1999	-12.00846992199639	3.1093433096665644	648039
648108	Robotics	convex relaxations for pose graph optimization with outliers	2018	-13.201874958557351	-0.0340301320555271	648135
648160	ML	a convergent decomposition algorithm for support vector machines	2007	-13.754012954949006	1.7861220741958073	648187
648221	ML	randomized algorithms for estimating the trace of an implicit symmetric positive semi-definite matrix	2011	-14.1378986606689	0.8971656762630915	648248
648280	Mobile	sampling rate synchronisation in acoustic sensor networks with a pre-trained clock skew error model	2013	-11.90314120654359	0.04687681583257969	648307
648378	Mobile	acoustic sensor network relative self-calibration using joint tdoa and doa with unknown beacon positions	2014	-11.850188243183586	0.01340847791149195	648405
648422	ML	binary embeddings with structured hashed projections	2016	-13.663070830337258	0.3901348239460777	648449
648486	Theory	image restoration using a modified hopfield network	1992	-12.991069988241351	1.2192516548240824	648513
648568	Logic	an algorithm to perform a complete right-hand-side parametrical analysis for a 0-1-integer linear programming problem	1999	-12.986937566456232	2.9822870156259187	648595
648594	ECom	resilient continuous-time consensus in fractional robust networks	2013	-12.070954854076192	1.8361027952444324	648621
648667	Vision	on the kalman-yakubovich-popov lemma for positive systems	2012	-14.709239627557151	3.044393137227222	648694
648763	Theory	single- and double-adjacent error-correcting codes for arithmetic units (corresp.)	1963	-11.812497216833494	3.0987901198647463	648790
648870	ML	second-order analysis of polyhedral systems in finite and infinite dimensions with applications to robust stability of variational inequalities	2010	-14.61291871062256	3.1186748270053366	648897
648942	Robotics	a calibration-free localization solution for handling signal strength variance	2009	-11.645710362639324	0.6033926227181204	648969
649083	ML	vector minimax concave penalty for sparse representation	2018	-13.966881301972576	0.4124857511853491	649110
649936	ML	multiterm polyhedral relaxations for nonconvex, quadratically constrained quadratic programs	2009	-13.641524376513155	2.4413395158958293	649963
650023	ECom	the splitting game and applications	2002	-14.622914588592836	3.4837582371417137	650050
650030	ML	on the recovery limit of sparse signals using orthogonal matching pursuit	2012	-14.016046493899774	0.10601328704819553	650057
650046	Theory	generalized error bounds in pattern recognition	1985	-12.26741714132284	2.679067102242733	650073
650162	AI	an algorithm for the multiparametric 0-1-integer linear programming problem relative to the constraint matrix	2000	-13.156628014044676	3.163292735867839	650189
650233	Theory	optimal worst-case dynamic average consensus	2015	-13.141947001250625	1.2615612054578298	650260
650242	Robotics	a progressive barrier for derivative-free nonlinear programming	2009	-14.176607029964373	1.8041000502972224	650269
650416	Theory	a dynamical system pair with identical first two moments but different probability densities	2014	-12.366125928872194	2.549373870851169	650443
650418	Mobile	ear-phone: a context-aware noise mapping using smart phones	2015	-11.212713905701904	1.051770709083817	650445
650420	ML	optimizing condition numbers	2009	-14.319464579429006	2.4723411761252745	650447
650454	Vision	entropy minimization for solving sudoku	2012	-13.348384860748153	2.8071499795442945	650481
650471	Robotics	inexact proximal operators for $\ell_{p}$-quasinorm minimization	2018	-14.173282599629841	0.4541317000639895	650498
650608	NLP	the tensor splitting with application to solve multi-linear systems	2018	-14.925929322772427	2.8391063812874773	650635
650650	EDA	using ibeacon technology with nearest neighbor algorithm to area positioning systems	2017	-11.490692003944288	0.6310016244202645	650677
650662	Theory	a new characterization of (weak) pareto optimality for differentiable vector optimization problems with g-invex functions	2011	-13.700526622298444	2.9746673054021584	650689
650663	Robotics	practical considerations of optimal three-dimensional indoor localization	2006	-12.147899709105737	-0.08694315996615216	650690
650763	Theory	the multiparametric 0-1-integer linear programming problem: a unified approach	2002	-12.963785876763694	2.5611545282951957	650790
650785	ML	the mean drift: tailoring the mean field theory of markov processes for real-world applications	2017	-11.443303776815698	3.5830654427315585	650812
651097	Mobile	pharos: enable physical analytics through visible light based indoor localization	2013	-11.523545834944056	0.8484361162792058	651124
651221	Theory	an infeasible path-following method for monotone complementarity problems	1997	-14.574465332174736	2.240800572424109	651248
651229	Theory	non-binary deterministic measurement matrix construction employing maximal curves	2016	-13.989546744160545	-0.04219651426695451	651256
651340	HCI	locatable-body temperature monitoring based on semi-active uhf rfid tags	2014	-11.493933828463627	0.7528643517203721	651367
651557	ML	fast determinantal point processes via distortion-free intermediate sampling	2018	-13.658265101035555	0.6718035447674012	651584
651806	Metrics	large deviations for multi-scale markovian switching systems with a small diffusion	2014	-12.232271235466564	2.6730215088108378	651833
651981	Theory	initialization in semidefinite programming via a self-dual skew-symmetric embedding	1997	-14.05766773740024	2.4767756282665254	652008
652104	Robotics	sparsity in tensor optimization for optical-interferometric imaging	2014	-14.655969760520575	-0.12672645532571633	652131
652119	Arch	relations between information and estimation in scalar lévy channels	2014	-14.92669352685727	0.3224069973336571	652146
652151	PL	linear programming and the inverse method of images	2013	-13.235229383451061	3.0673620683199614	652178
652242	Theory	phase transitions and optimal algorithms in high-dimensional gaussian mixture clustering	2016	-12.56512978952606	0.954666854831232	652269
652336	ML	prox-method with rate of convergence o(1/t) for variational inequalities with lipschitz continuous monotone operators and smooth convex-concave saddle point problems	2004	-14.570949164661224	2.570757515963066	652363
652349	HCI	indoor localization based on cellular telephony rssi fingerprints containing very large numbers of carriers	2011	-11.439693852960847	1.0223785039076836	652376
652551	AI	a study of the difference-of-convex approach for solving linear programs with complementarity constraints	2018	-14.088753824971779	2.0781307059299463	652578
652706	ML	a family of second-order methods for convex ℓ1-regularized optimization	2016	-14.846009455464804	1.5243786689352672	652733
652874	ML	the (s)+ condition on generalized variational inequalities	2008	-14.455759927060685	3.593458001473063	652901
652979	EDA	minimizing nonsmooth dc functions via successive dc piecewise-affine approximations	2018	-14.150630507203848	2.1210715169708987	653006
652990	Mobile	a noise reduction fingerprint feature for indoor localization	2018	-11.57842125616718	0.7299251519885958	653017
652992	Robotics	orthogonal packing of identical rectangles within isotropic convex regions	2010	-13.408268784391089	2.478162385955396	653019
653087	ML	recognizing underlying sparsity in optimization	2009	-14.475557338313305	1.3098113622527685	653114
653361	ML	extended formulations in mixed-integer convex programming	2016	-13.599008177496414	2.598737118673209	653388
653376	ML	dc programming and dca for solving brugnano-casulli piecewise linear systems	2017	-14.905270493250338	2.311738981144437	653403
653446	Visualization	association of transmitters in multipath-assisted positioning	2017	-11.882830687155955	0.08016101305394878	653473
653573	AI	an iterative framework for sparse signal reconstruction algorithms	2015	-14.103968469565206	0.2001477850080714	653600
653638	ML	approximation of controllable set by semidefinite programming for open-loop unstable systems with input saturation	2006	-14.298819814893806	2.003174898340741	653665
653675	ML	monotonicity of fixed point and normal mappings associated with variational inequality and its application	2001	-14.537202194838846	3.1659426338564263	653702
653792	ML	an self-adaptive lqp method for constrained variational inequalities	2007	-14.28074091193483	1.8100196353804687	653819
653794	AI	calculus of variations in discrete space for constrained nonlinear dynamic optimization	2002	-13.2219406802492	1.880980700825548	653821
653919	Mobile	towards localization of rfid tags based on experimental analysis of rssi	2014	-11.682606205440786	0.5702207837625172	653946
653923	EDA	real-time opf based on quasi-newton methods	2017	-12.483301843757534	1.3363645277076204	653950
653924	Theory	enhanced multilevel linear sampling methods for inverse scattering problems	2014	-14.603378548835675	1.4477052191217017	653951
654138	Mobile	centralized cooperative positioning and tracking with realistic communications constraints	2010	-11.775931852699602	0.23906484979927856	654165
654257	Arch	generalized regression neural network prediction model for indoor environment	2004	-11.581595445414536	0.6936410659411553	654284
654533	Mobile	maintenance of wi-fi fingerprint database by crowdsourcing for indoor localization	2014	-11.353947239105228	0.9784228642781552	654560
654673	Theory	on the convergence of the weiszfeld algorithm	2002	-14.005479719743281	3.6002747175480243	654700
654722	Theory	functional classification and the random tukey depth. practical issues	2010	-12.765559908479233	3.4411277786724224	654749
654835	ML	approximation bounds for sparse principal component analysis	2014	-13.560561702477582	0.8691763865990595	654862
654903	HPC	flow through fissured media: mathematical analysis and numerical approach	1992	-11.280252138140426	3.2151218907317163	654930
654920	Theory	stochastic characteristics and simulation of the random waypoint mobility model	2012	-11.81394716654407	3.42600547575028	654947
655262	Logic	discontinuous piecewise linear optimization	1998	-14.143825032015446	2.615792229583888	655289
655578	Mobile	indoor localization using unsupervised manifold alignment with geometry perturbation	2014	-11.41757832575815	0.9549785095603568	655605
655617	ML	computing the kullback-leibler divergence between two generalized gamma distributions	2014	-12.251695068869234	2.8102775847082904	655644
655730	Mobile	cocktail: an rf-based hybrid approach for indoor localization	2010	-11.488912374110253	0.8693475438706331	655757
655816	ML	square deal: lower bounds and improved relaxations for tensor recovery	2014	-13.906923390129368	0.4370325768244411	655843
655935	ML	computable error bounds for nonlinear programming	1973	-14.214355282522115	3.0577520406006764	655962
655963	HCI	characterising indoor positioning estimation using experimental data from an active rfid-based real-time location system	2016	-11.291750231916328	0.6699850658910844	655990
656121	Mobile	poster: on the low-cost and distance-adaptive device-free localization	2015	-11.433535443174026	0.8690363099965471	656148
656142	ML	observability with random observations	2014	-14.167375085626226	0.2701806254165791	656169
656874	Mobile	robust indoor localization on a commercial smart phone	2012	-11.142417810379172	0.8521513527212271	656901
657009	Theory	from quasidifferentiable to directed subdifferentiable functions: exact calculus rules	2016	-14.409313757790331	3.5685562241835465	657036
657019	Mobile	location estimation using rss measurements with unknown path loss exponents	2013	-12.25253908639852	-0.2155547765894656	657046
657148	ML	on the number of iterations of karmarkar's algorithm for linear programming	1993	-14.114119015526473	2.7456553802501427	657175
657414	ML	minimum variance in biased estimation: bounds and asymptotically optimal estimators	2004	-14.545139503563117	-0.07251622711756052	657441
657498	AI	complexity of necessary efficiency in interval linear programming and multiobjective linear programming	2012	-13.116095323411935	3.034272107137461	657525
657530	Theory	efficient minimization of higher order submodular functions using monotonic boolean functions	2017	-14.24057701608789	2.9340789896407364	657557
657544	Robotics	compressive sensing with weighted coefficient approach for indoor source localization	2017	-12.092760249746355	0.01907505510614867	657571
657822	Theory	error bounds in mathematical programming	1997	-13.764968017838008	2.544230844239171	657849
657855	ML	efficiently testing local optimality and escaping saddles for relu networks	2018	-14.116225006986562	1.893427863379364	657882
657892	EDA	point-wise maximum approach to approximate dynamic programming	2017	-13.796091674427288	1.8034696003582384	657919
657984	Embedded	uwb-ir receiver with accurate time-interval-measurement circuit for communication/location system	2009	-12.074457789453144	0.30458948875472475	658011
658184	Vision	general lump-type solutions of the (3+1)-dimensional jimbo-miwa equation	2018	-11.37506103600851	3.530734202565504	658211
658343	ML	sparse phase retrieval via sparse pca despite model misspecification: a simplified and extended analysis	2017	-14.03327863394935	0.2569854803731617	658370
658373	HPC	weighting the recursive spectral besection algorithm for unstructured grids	1995	-11.219503748854036	3.0966928589777103	658400
658384	EDA	nondifferentiable multiobjective second-order symmetric duality	2011	-14.006907709417016	3.0803920277938266	658411
658551	Logic	nonsmooth multiobjective fractional programming with local lipschitz exponential b-(p, r)-invexity	2013	-13.927431637889896	2.8726151837066185	658578
658760	DB	on interval-subgradient and no-good cuts	2010	-13.934891922259078	3.0895917857867383	658787
658857	EDA	optimal stochastic parameter design for estimation problems	2012	-12.92862392406822	0.18009038404742778	658884
658865	Theory	parallelized solution to semidefinite programmings in quantum complexity theory	2010	-14.418492630424351	2.5730845618291744	658892
659230	EDA	a new branch and bound algorithm for noncovex quadratic programming with box constraints	2013	-13.240513263328078	2.325133445806736	659257
659265	Theory	network decomposition and complexity measures: an information geometrical approach	2014	-12.224663854853265	3.4711246678192116	659292
659387	Robotics	a beacon color code scheduling for the localization of multiple robots	2011	-11.21923499367434	0.2921298608018456	659414
659500	Mobile	link sensing-adaptive passive object localization in wireless sensor networks	2014	-11.513753244844361	0.3962391089639167	659527
659693	Robotics	convergence of distributed averaging and maximizing algorithms part i: time-dependent graphs	2013	-12.845093129467072	1.2103979632253954	659720
659742	Robotics	distributed estimation with constant modulus signals over multiple access channels	2010	-13.879724708610627	-0.19834710373386147	659769
659757	ML	global convergence of conjugate gradient methods without line search	2001	-14.538077994835598	1.9476467436153675	659784
660152	HPC	spectral covariance and limit theorems for random fields with infinite variance	2017	-12.655796327404804	2.416503516318972	660179
660254	Theory	a randomized gossip consensus algorithm on convex metric spaces	2012	-12.75522688377218	1.68827887587978	660281
660293	Theory	stability in multistage stochastic programming	1995	-14.30884606826488	2.7589086601267736	660320
