id	area	title	year	x	y	ix
820551	ML	on the complexity of steepest descent, newton's and regularized newton's methods for nonconvex unconstrained optimization problems	2010	-14.221741459496744	1.6854965767106018	820578
820600	ML	sensor selection via randomized sampling	2017	-13.881306119706721	0.02799506815737187	820627
820602	ML	gammachi: a package for the inversion and computation of the gamma and chi-square cumulative distribution functions (central and noncentral)	2015	-12.503860981402118	1.6676778225594269	820629
821148	AI	phase retrieval via sparse wirtinger flow	2017	-14.16906262355984	-0.0242855949623173	821175
821472	ML	a flocking-based approach for distributed stochastic optimization	2018	-12.686822580369064	0.9896080757111836	821499
821559	Theory	augmented lagrangians with adaptive precision control for quadratic programming with simple bounds and equality constraints	2003	-14.572426983306887	1.8576167543905664	821586
821603	ML	explicit reformulations for robust optimization problems with general uncertainty sets	2008	-13.249178055067626	2.53868337745432	821630
821652	ML	rank-sparsity incoherence for matrix decomposition	2011	-14.245143039729097	0.4863300443597134	821679
821748	EDA	a new quadratic semi-infinite programming algorithm based on dual parametrization	2004	-14.728473797703169	2.1345330658228585	821775
821878	Vision	cross-device wi-fi map fusion with gaussian processes	2017	-11.51790310418099	0.827277144106449	821905
822061	Arch	advances in computation of the maximum of a set of random variables	2006	-11.977042736013805	2.623080333155505	822088
822144	ML	relaxation methods for problems with strictly convex separable costs and linear constraints	1987	-14.271767350129647	2.059634882065104	822171
822271	Mobile	location of mobile terminals with quantized measurements	2005	-11.989885710278184	0.10333443621963656	822298
822687	Theory	a parametric characterization of local optimality	2003	-13.856672192744044	2.926838236360278	822714
822977	Theory	hamburger moment problem and maximum entropy: on the existence conditions	2014	-12.683738418770197	3.301549279326488	823004
822980	HCI	walkielokie: relative positioning for augmented reality using a dummy acoustic speaker	2015	-11.40525129076157	0.4856809813284708	823007
823036	ML	a new general iterative method for solution of a new general system of variational inclusions for nonexpansive semigroups in banach spaces	2011	-14.695216942689624	3.0030702797783118	823063
823202	AI	a differential equation approach to fuzzy vector optimization problems and sensitivity analysis	2001	-13.73042424654404	2.9048770115468923	823229
823204	EDA	a convexification method for a class of global optimization problems with applications to reliability optimization	2001	-13.490948552698512	2.534199700797998	823231
823270	Vision	a computationally efficient tensor completion algorithm	2018	-13.883130039994864	-0.008679657604042448	823297
823297	Visualization	comparability of rf-based indoor localisation solutions in heterogeneous environments: an experimental study	2016	-11.18323435241008	1.080628121862529	823324
823515	Mobile	reduce redundancies: signal-based clustering of large-scale fingerprint data	2018	-11.345216984485216	0.9481339933610354	823542
823735	Vision	note on discrimination information and variation (corresp.)	1970	-11.795503274852324	2.7783088706970207	823762
824290	Mobile	smartphone-based user location tracking in indoor environment	2016	-11.267754808907645	0.8907476225336031	824317
824344	HCI	wearable indoor localisation approach in internet of things	2016	-11.148707114933968	0.8923603660122811	824371
824461	Visualization	how many low-precision sensors are enough for reliable detection?	2011	-13.39132278795883	0.05929769711917843	824488
824492	Mobile	indoor deployment of a wireless sensor network for inventory and localization of mobile assets	2012	-11.52861585273684	0.6539728514961517	824519
824560	ML	distributed semidefinite programming with application to large-scale system analysis	2018	-13.142925629427063	1.296654304879273	824587
824743	AI	convergence of descent method without line search	2005	-14.856871714998185	1.9117320434482208	824770
824899	ML	hybrid method with perturbation for lipschitzian pseudocontractions	2012	-14.856693112176476	2.646966753191247	824926
825062	Theory	proximal mapping for symmetric penalty and sparsity	2018	-14.408709023107546	2.371769005767317	825089
825117	Mobile	localization algorithm in wireless sensor networks based on semi-supervised manifold learning and its application	2009	-11.45330961517186	0.940307896837102	825144
825146	Metrics	cooperative convex optimization in networked systems: augmented lagrangian algorithms with directed gossip communication	2011	-12.828098655726738	0.9214304649949939	825173
825311	ML	preconditioned spectral gradient method	2002	-14.781238718639017	1.7707741682324585	825338
825387	Robotics	strong duality of sparse functional optimization	2018	-14.214632177738268	0.4237217971308428	825414
825437	Theory	second-order limit laws for occupation times of fractional brownian motion	2017	-12.731002863592868	3.001654268916901	825464
825617	Mobile	source localization in a cognitive radio environment consisting of frequency and spatial mobility	2012	-11.86797025970158	0.3044828327459498	825644
825784	ML	new algorithmic alternatives for the o-d matrix adjustment problem on traffic networks	2006	-13.024023421785689	2.181279508647374	825811
825860	ML	continuity of generalized semi-markov processes	1980	-12.418751941986914	3.4803002845787225	825887
825885	ML	projected gradient methods for linearly constrained problems	1987	-14.531253201199494	1.9252111305535105	825912
826028	Theory	numerical solution of nonlinear optimal control problems using nonlinear programming	2007	-13.6958216624611	2.187592817860838	826055
826097	AI	matrix factorization for low-rank tensor completion using framelet prior	2018	-13.956337137560773	0.4037194420054619	826124
826118	Vision	improved filter-sqp algorithm with active set for constrained minimax problems	2014	-14.190311071750855	1.8415343980555483	826145
826193	ML	a conical algorithm for globally minimizing a concave function over a closed convex set	1985	-13.844114185498285	2.3288766860114256	826220
826324	Vision	convergence analysis and experiments using an rpem based on nonlinear odes and midpoint integration	2012	-14.852093039784807	1.488779194325981	826351
826515	Arch	robust orientation-location hybrid algorithm	2008	-12.080770191406284	-0.20765344615748724	826542
826668	Theory	descent and penalization techniques for equilibrium problems with nonlinear constraints	2015	-14.054379117337806	2.037382263047804	826695
826767	Theory	absolute value equation solution via linear programming	2014	-13.753098174132527	3.2576165263944734	826794
826972	Logic	the relaxation method for solving systems of linear inequalities	1980	-14.119647876949054	2.555434906831316	826999
827053	ML	learning generalized hypergeometric distribution (ghd) dag models	2018	-12.582461760125286	3.3544622150498298	827080
827227	Theory	quadrature formulas for multivariate convex functions	1996	-13.941189960287234	1.1386364222097274	827254
827244	ML	first- and second-order optimality conditions for piecewise smooth objective functions	2016	-14.493586850167448	2.572061837218349	827271
827266	ML	simultaneously structured models with application to sparse and low-rank matrices	2015	-14.002021372257893	0.5392569461004395	827293
827753	Robotics	semidefinite programming relaxations for sensor network localization	2010	-13.923305291572582	1.6177854611909341	827780
828066	EDA	a modified tunnelling algorithm for global minimization with box constrained	2012	-14.15838192640367	2.592706422595811	828093
828459	Visualization	development of network-based rtk-gps positioning system using fkp via a tv broadcast in japan	2008	-11.797748141117351	0.0914309673235102	828486
828590	ML	column generation algorithms for nonlinear optimization, ii: numerical investigations	2011	-13.255721632547306	2.311639014640812	828617
828689	ML	linearized alternating direction method with adaptive penalty for low-rank representation	2011	-14.204980122162983	0.8807523219348312	828716
828869	Theory	information theoretic limits for linear prediction with graph-structured sparsity	2017	-13.887336827462395	-0.13280620365678042	828896
829104	Theory	global convergence of a filter-trust-region algorithm for solving nonsmooth equations	2010	-14.711125674563403	1.9470896223973868	829131
829197	Theory	nonseparation of sets and optimality conditions	2017	-14.241058422729427	2.865650888329028	829224
829292	Theory	testing the ℜ- strategy for a reverse convex problem	1998	-12.35083889661907	3.0583455739896	829319
829589	ML	quadratic matrix programming	2007	-14.148877198547952	2.7073104288499312	829616
829592	HPC	improvements for some condition number estimates for preconditioned system in p-fem	2006	-11.75736048268616	3.3583095188164287	829619
829633	Robotics	survey of inertial/magnetic sensors based pedestrian dead reckoning by multi-sensor fusion method	2018	-11.15000886525589	0.90676045542414	829660
829765	Theory	bilinear separation of two sets inn-space	1993	-14.02310074339725	2.9777538764012004	829792
829791	Vision	the hawkes process with different exciting functions and its asymptotic behavior	2015	-12.358086080351347	3.3147390054105585	829818
829874	ML	projected filter trust region methods for a semismooth least squares formulation of mixed complementarity problems	2007	-14.759392687670806	1.8332775750553485	829901
829964	ML	poisson process driven stochastic differential equations for bivariate heavy tailed distributions	2016	-12.105204873737573	2.8891630207516634	829991
830309	Crypto	an indoor localization pre-processing with optimal channel selection considering channel interference	2012	-11.724922481139538	0.6783788637814245	830336
830586	Mobile	an indoor localization mechanism using active rfid tag	2006	-11.108911498671146	1.056448044967374	830613
830621	ML	c-lasso and its dual for sparse signal estimation from array data	2017	-14.507073803287339	0.2121955038691268	830648
830677	Theory	farkas-type results with conjugate functions	2005	-14.376606770579588	3.176194065699998	830704
830811	Mobile	fast wifi access point localization and autonomous crowdsourcing	2014	-11.41315438955375	0.785430299899638	830838
830905	ML	distributed computation of generalized nash equilibria in quadratic aggregative games with affine coupling constraints	2016	-12.459821992898133	1.3984913454084007	830932
831135	Robotics	reconstruction of sparse signals from highly corrupted measurements by nonconvex minimization	2014	-14.194068959696539	-0.026157892838185755	831162
831378	ML	iterative algorithm for common fixed points of infinite family of nonexpansive mappings in banach spaces	2012	-14.785193189444788	3.3554485285275484	831405
831383	Robotics	recovering k-sparse n-length vectors in o(k log n) time: compressed sensing using sparse-graph codes	2016	-13.842047871561984	-0.09314887932549927	831410
831429	Mobile	a parameterized wifi fingerprint database construction method	2017	-11.474196458166551	0.7485975647702521	831456
831564	Mobile	a range-free 3-d localization method for rfid tags based on virtual landmarks	2008	-11.186491047062137	0.9143285967205024	831591
831661	Theory	an iterative method for equilibrium problems and a finite family of relatively nonexpansive mappings in a banach space	2010	-14.897247841579787	3.0156612757319485	831688
831720	Robotics	sparse structures in l-infinity norm minimization for structure and motion reconstruction	2008	-14.464584603984015	1.5510553489108143	831747
831791	Theory	threshold characteristics of fm signals demodulated by an fm discriminator	1969	-12.193521570096221	2.3991563602137496	831818
832298	ML	tradeoffs between convergence speed and reconstruction accuracy in inverse problems	2018	-13.986109310684125	0.04360860814308673	832325
832547	Robotics	fast sparse recovery for any rip-1 matrix	2017	-13.925872941944759	0.2388489372438256	832574
832704	Theory	exact asymptotics of distributions of integral functionals of the geometric brownian motion and other related formulas	2007	-12.755624226671634	2.6581709693437823	832731
832870	ML	matrix completion via max-norm constrained optimization	2013	-13.968480349256685	0.4628637539981983	832897
832956	Mobile	wips: the wisard indoor positioning system	2013	-11.159644204367003	0.853849779436789	832983
832962	ML	an armijo-type method for pseudomonotone equilibrium problems and its applications	2013	-14.644463363699682	2.3284849244036923	832989
833157	Vision	eigentime identity for one-dimensional diffusion processes	2015	-12.627529904510276	3.347960370970474	833184
833290	ML	the boosted dc algorithm for nonsmooth functions	2018	-14.330367087281065	1.6153268220805508	833317
833293	ML	further results on distributed bayesian signal detection	1993	-13.186106473312593	0.7428020897426054	833320
833324	Vision	sufficient descent directions in unconstrained optimization	2011	-14.7651649553495	1.8696986297232352	833351
833501	ML	screening tests for lasso problems	2017	-14.321623390521696	0.8864713128851505	833528
833741	PL	a smoothing levenberg-marquardt algorithm for semi-infinite programming	2015	-14.660278985033708	1.9040325371365483	833768
833766	ML	an efficient greedy algorithm for finding the nearest simultaneous diagonalizable family	2018	-14.463307343289726	1.2097567804498195	833793
833818	ML	quasi-newton methods: superlinear convergence without line searches for self-concordant functions	2019	-14.548149317724713	1.7462580877942595	833845
834148	Vision	combination of two underestimators for univariate global optimization	2018	-14.85152010125098	2.295322512084812	834175
834231	EDA	a proximal point algorithm based on decomposition method for cone constrained multiobjective optimization problems	2016	-14.04464331400118	2.208957191159713	834258
834559	Vision	tensor decompositions for signal processing applications: from two-way to multiway component analysis	2015	-14.706359598600896	0.21714961275191644	834586
834574	ML	primal-dual subgradient method for huge-scale linear conic problems	2014	-14.207137347830711	3.1760096138758507	834601
834646	Theory	strongly convergent net given by a fixed point theorem for firmly nonexpansive type mappings	2008	-14.85420160940692	3.487967483615418	834673
834664	ML	a hybrid splitting method for variational inequality problems with separable structure	2013	-14.577228811243884	1.7616321540202702	834691
834987	Theory	stability and ergodicity of piecewise deterministic markov processes	2008	-12.361207029103253	3.2608862414758333	835014
835012	ML	a dual decomposition algorithm	1976	-13.423646198899958	2.682776928576984	835039
835050	Logic	a posteriori distributions and detection theory	1969	-12.509280951029382	2.583534391793569	835077
835055	Mobile	indoor tracking using undirected graphical models	2015	-11.146268494821294	1.0302654219339151	835082
835118	Vision	joint results of long-term earth-space propagation experiments at 20-ghz in canada and europe	2013	-11.568766087431504	2.7903840714981096	835145
835484	AI	non-monotone trust region methods for nonlinear equality constrained optimization without a penalty function	2003	-14.205423115605537	2.0081107990147804	835511
835494	Theory	exact simulation of brownian diffusions with drift admitting jumps	2017	-12.18318482050622	2.852125568933247	835521
835551	ML	tensor completion via optimization on the product of matrix manifolds	2015	-13.885533407401425	0.09615787876666952	835578
835680	Robotics	heuristic kalman algorithm for solving optimization problems	2009	-13.541910786802145	1.6843173424203186	835707
835689	Theory	small drift limit theorems for random walks	2017	-12.48334368444018	3.533602229090965	835716
835718	AI	analysis sparse representation for nonnegative signals based on determinant measure by dc programming	2018	-14.031488644615846	0.6048596260309368	835745
835808	EDA	a granulating algorithm using global filled function	2008	-13.585304606456914	1.8640591870452592	835835
835837	AI	efficient tensor completion: low-rank tensor train	2016	-13.825854391379774	0.273459195140663	835864
835839	Robotics	interval analysis for certified numerical solution of problems in robotics	2009	-12.93932273189023	2.242602972346733	835866
836150	Mobile	exposure assessment of smartphones and tablets	2015	-11.128487640991516	1.036735118621508	836177
836229	Robotics	a vehicular positioning enhancement with connected vehicle assistance	2015	-11.674866667515055	0.13576969283076734	836256
836295	AI	necessary optimality conditions for multiobjective bilevel programs	2011	-13.237555870443435	2.4092712427950813	836322
836402	PL	sufficiency and duality in multiobjective variational problems with generalized type i functions	2006	-14.05153488953055	2.97923730274554	836429
836638	ML	on the fisher information matrix for multivariate elliptically contoured distributions	2013	-14.633677024446735	-0.07944439737181629	836665
836779	Mobile	a context-aware mobility indoor positioning system	2015	-11.100674371439847	1.1377742885732671	836806
837360	ML	who needs qp for linear mpc anyway?	2002	-13.268471853724606	2.379572743083929	837387
837394	Theory	upper bounds for gaussian stochastic programs	1999	-12.154950263630324	3.007354927760862	837421
837430	ML	on solving the lagrangian dual of integer programs via an incremental approach	2009	-13.303601224952347	2.3444251984912405	837457
837545	Robotics	an indoor localization algorithm based on continuous feature scaling and outlier deleting	2018	-11.603980461398466	0.7246951904052886	837572
837608	Robotics	accuracy of aoa-based and rss-based 3d localization for visible light communications	2015	-12.23747313960269	-0.21413453306560515	837635
837676	Mobile	mobile crowdsensing framework for a large-scale wi-fi fingerprinting system	2016	-11.24920061384393	1.0881231337212276	837703
837692	Mobile	restricted p-isometry property and its application for nonconvex compressive sensing	2012	-14.147445400091287	0.44719948507287377	837719
837716	Mobile	indoor positioning using time difference of arrival between multipath components	2013	-12.122389981113324	-0.1451623340617134	837743
837858	Vision	general economic equilibrium and variational inequalities: existence, uniqueness and sensitivity	1993	-13.898166744303484	3.3001727990802605	837885
837898	EDA	mapping urban environmental noise using smartphones	2016	-11.231121054156553	0.8522513462982175	837925
838355	Mobile	a better positioning with ble tag by rssi compensation through crowd density estimation	2016	-11.498038329588676	0.7322685735194924	838382
838554	ML	a geometric characterization of strong duality in nonconvex quadratic programming with linear and nonconvex quadratic constraints	2014	-14.283558459477046	3.0778402780653678	838581
838603	Theory	dominators for multiple-objective quasiconvex maximization problems	2000	-13.221602044536931	2.7837186700037795	838630
838826	ML	quadratic programming with a quasiconvex objective function	1971	-14.136902240339928	3.0062526326066896	838853
838843	ML	a double incremental aggregated gradient method with linear convergence rate for large-scale optimization	2017	-13.856465448222625	1.4542039296954403	838870
839065	Robotics	iteration-complexity of a newton proximal extragradient method for monotone variational inequalities and inclusion problems	2012	-14.616064713406628	2.594177977840695	839092
839074	Theory	on the envelopes of zonal filter outputs of memoryless distortions of narrow-band processes (corresp.)	1965	-12.064285646528175	2.4494089782343478	839101
839404	Theory	discontinuous optimization by smoothing	1981	-14.64213211325377	1.9220284883166037	839431
839540	ML	greedy algorithms for joint sparse recovery	2014	-13.910558579231706	0.11301019528166613	839567
839564	ML	1-bit compressive sensing: reformulation and rrsp-based recovery theory	2014	-14.213405038327187	0.180795891245347	839591
839846	ML	proximal point method for a special class of nonconvex multiobjective optimization functions	2018	-14.039023617584755	2.6858274591108944	839873
840162	Mobile	rss fingerprints dimensionality reduction in wlan-based indoor positioning	2016	-11.60368309958793	0.8406432111097951	840189
840201	Theory	restrictive metric regularity and generalized differential calculus in banach spaces	2004	-14.578230567963212	3.449867833619296	840228
840301	Theory	euclidean distance location-allocation problems with uniform demands over convex polygons	1986	-13.314637971194047	2.649417315971434	840328
840595	Embedded	pattern maximum likelihood estimation of finite-state discrete-time markov chains	2016	-12.309550928871193	1.994744419977172	840622
840614	ML	multiple graphs clustering by gradient flow method	2018	-14.839130372091866	1.4308239795999378	840641
840804	ML	path-following gradient-based decomposition algorithms for separable convex optimization	2014	-14.381123217381516	1.6485450147811491	840831
840893	ML	convergence rates for deterministic and stochastic subgradient methods without lipschitz continuity	2017	-14.244439610957494	1.6359811703579612	840920
840900	ML	a new primal-dual algorithm for minimizing the sum of three functions with a linear operator	2018	-14.394084165180528	1.8383939080793463	840927
841272	ML	deriving the continuity of maximum-entropy basis functions via variational analysis	2007	-12.683167933131394	2.8983615475669904	841299
841427	ML	an alternating direction method with increasing penalty for stable principal component pursuit	2015	-14.102990419021822	0.5316301495419167	841454
841438	Theory	approximation and decomposition properties of some classes of locally d.c. functions	1988	-13.984914287672124	3.4834064418102093	841465
841725	Theory	a second-order weak approximation of sdes using a markov chain without lévy area simulation	2018	-11.842604269727811	3.0405323756527656	841752
841854	ML	is the 1-norm the best convex sparse regularization?	2018	-14.020205108200456	0.44269249779507	841881
841916	Theory	semidefinite programming relaxation for nonconvex quadratic programs	1997	-13.554452151500948	2.609483267422208	841943
841939	ML	bayesian compressive sensing	2008	-14.164002514670653	-0.09736421780089978	841966
842178	Robotics	sparse signal reconstruction based on random search procedure	2017	-14.397722592096482	1.1991246856923483	842205
842609	HPC	quasi-monte carlo methods for numerical integration: comparison of different low discrepancy sequences	1996	-11.621858875307556	3.330692837526521	842636
842648	Vision	nesterov-based alternating optimization for nonnegative tensor factorization: algorithm and parallel implementation	2018	-14.2778914405375	1.2214761420587876	842675
842653	Vision	l2/3 regularization: convergence of iterative thresholding algorithm	2015	-14.567901400437243	1.5214439976896414	842680
842790	EDA	feasibility of power system structure preserving linear transformations for the ac optimal power flow problem	2014	-13.768811677248735	2.418969114531265	842817
842823	AI	distributed formation of balanced and bistochastic weighted digraphs in multi-agent systems	2013	-12.71662137448272	1.243333980950532	842850
842868	Theory	possibility of theoretical prediction of fading circuit error clustering (corresp.)	1965	-11.86541096681452	2.707986022134941	842895
843210	Theory	some quasi-distribution free and distribution free methods for estimating channel performance (ph.d. thesis abstr.)	1972	-11.798493060854664	2.571022729139428	843237
843425	Mobile	accurate vehicle location system using rfid, an internet of things approach	2016	-11.413075552925045	0.7494470872722299	843452
843837	Theory	nonsmoothness and a variable metric method	2015	-14.229952311515847	1.8715443797956517	843864
844002	ML	concentration inequalities for the empirical distribution	2018	-12.377344669546694	2.5714563598611813	844029
844157	Theory	on subspace system identification algorithms implemented through sequences of modified householder algorithms	2004	-13.609383769048936	-0.213683757798192	844184
844338	ML	phase transitions of spectral initialization for high-dimensional nonconvex estimation	2017	-13.921486155669568	0.4438840266520149	844365
844577	ML	canonical analysis: ranks, ratios and fits	2014	-13.008467994938865	3.2310340006312366	844604
844592	ML	primal-dual methods for sparse constrained matrix completion	2012	-13.921347512977178	0.4541601816170098	844619
845056	ML	directional derivatives of the solution of a parametric nonlinear program	1995	-14.282338697154485	2.178184341971012	845083
845232	ML	sparse recovery using the preservability of the null space property under random measurements	2017	-14.08625854426874	0.33228678217473456	845259
845254	ML	"""special issue on """"non-linear continuous optimization"""""""	2016	-14.766338632366018	1.5808159232996095	845281
845395	Vision	heterogeneous device tracking with rss variation mitigation over a radio map	2016	-11.982466868295536	-0.09159213851170496	845422
845430	Mobile	a standalone rfid indoor positioning system using passive tags	2011	-11.37359120183918	0.6449227252160068	845457
845651	AI	infeasibility resolution based on goal programming	2008	-13.577219923385075	2.813246009568932	845678
845717	Logic	cooperating stochastic automata: approximate lumping an reversed process	2012	-11.751833988670569	3.4140106690279084	845744
845790	Mobile	three-dimensional positioning for lte systems	2017	-12.087620351477636	0.12565038784493146	845817
845939	ML	a simplicial algorithm for the nonlinear complementarity problem	1974	-14.128440505023889	2.6715137178026107	845966
845963	Logic	feasible direction algorithm for solving the sdp relaxations of quadratic {-1, 1} programming problems	2004	-14.284389668626304	1.78108089758656	845990
