id	area	title	year	x	y	ix
455886	ML	parallel algorithms for stochastic dynamic programming with continuous state and control variables	1995	-14.734083086591479	1.9655593674165248	455913
456314	HPC	a parallel primal-dual interior-point method for dc optimal power flow	2016	-13.025333282844247	1.7604793211686425	456341
456366	Visualization	neural network based radio fingerprint similarity measure	2018	-11.427121149655841	0.8284100633052128	456393
456527	AI	a new heuristic approach for non-convex optimization problems	2010	-13.567917246071662	1.6417046023621873	456554
456681	Theory	an improved divide-and-conquer algorithm for the banded matrices with narrow bandwidths	2016	-11.11481497342708	3.0982302960707084	456708
456764	Theory	a class of polynomial interior point algorithms for the cartesian p-matrix linear complementarity problem over symmetric cones	2012	-14.70896488198452	3.0049162325126546	456791
456807	Mobile	recognizing semantic locations from smartphone log with combined machine learning techniques	2014	-11.171058025575087	1.0352964404564802	456834
456942	Robotics	iterative methods for efficient sampling-based optimal motion planning of nonlinear systems	2018	-13.692400930755591	1.4368833281264115	456969
457125	Mobile	bearing-only maneuvering mobile tracking with nonlinear filtering algorithms in wireless sensor networks	2014	-12.053518891441927	-0.16547033612415699	457152
457220	AI	piecewise linear approximation of functions of two variables in milp models	2010	-13.525064758394125	2.4071998282122262	457247
457360	ML	computing constrained cramér-rao bounds	2012	-14.690001482649105	0.7537747885293264	457387
457546	ML	a class of interior proximal-like algorithms for convex second-order cone programming	2008	-14.138754528220911	1.930651725613772	457573
457964	Theory	solution of the navier-stokes problem	2019	-11.297516307795565	3.0759638884481983	457991
458477	Logic	gaussian ornstein-uhlenbeck and bogoliubov processes: asymptotics of small deviations for l  p -functionals, 0 < p < ∞	2014	-12.53461759941738	2.488473884081324	458504
458716	Mobile	indoor localization using analog output of pyroelectric infrared sensors	2018	-11.461064119767974	0.7862928027854063	458743
458722	ML	nearly sharp sufficient conditions on exact sparsity pattern recovery	2011	-14.020521217397613	0.2194699363971092	458749
458733	Theory	an infeasible-interior-point predictor-corrector algorithm for linear programming	1996	-14.335327789196274	2.4919028761141755	458760
458790	Mobile	smart probabilistic fingerprinting for wifi-based indoor positioning with mobile devices	2016	-11.4161751687134	0.8623054920885342	458817
458849	Vision	improved branching disjunctions for branch-and-bound: an analytic center approach	2015	-13.31759955621367	2.6208392916312464	458876
459139	ML	the exponential penalty function method for multiobjective programming problems	2010	-13.25382062525995	2.6707847068319417	459166
459226	Theory	fast construction of constant bound functions for sparse polynomials	2009	-14.400999278924274	2.772149732131685	459253
459281	Theory	deformations of log-symplectic structures	2014	-11.60631222386648	3.533370293404753	459308
459525	HCI	rfid indoor localization based on doppler effect	2015	-11.564030597528786	0.650399703532621	459552
459586	Theory	on zero duality gap in nonconvex quadratic programming problems	2012	-13.971955519764306	2.885801968907947	459613
459591	EDA	a low-computation-complexity, energy-efficient, and high-performance linear program solver based on primal-dual interior point method using memristor crossbars	2018	-11.297262986363494	2.4247442565248547	459618
459877	ML	linearization-based algorithms for mixed-integer nonlinear programs with convex continuous relaxation	2014	-13.565491920816555	2.207782070981918	459904
460051	Mobile	prior nlos measurement correction for positioning in cellular wireless networks	2009	-12.040955179668956	-0.03600822850489378	460078
460265	Vision	studies on gravimeter leveling algorithm based on mixed sensitivity robust control theory	2017	-11.34392466223252	2.1920585036768983	460292
460368	ML	noise benefits in the expectation-maximization algorithm: nem theorems and models	2011	-14.669068836183252	-0.2049941191282191	460395
460544	HCI	the impact of sensor errors and building structures on particle filter-based inertial positioning	2012	-11.191466199651172	0.8116009277056653	460571
460575	Mobile	bayesian localization in wireless networks using angle of arrival	2005	-11.730367232726831	0.5214211295339092	460602
460612	ML	concentration and stability of community-detecting functions on random networks	2013	-12.380749802658338	2.277055830201608	460639
460647	Robotics	particle filter and smoother for indoor localization	2013	-11.627097331995039	0.15391806233917468	460674
461251	ML	minimax filtering regret via relations between information and estimation	2013	-14.565114127373828	0.3934679714317067	461278
461468	Robotics	information geometry metric for random signal detection in large random sensing systems	2017	-14.441780143844824	-0.08693345165029341	461495
461513	ML	linear models based on noisy data and the frisch scheme	2015	-14.267976976276353	0.3020564752712491	461540
461527	ML	learning sparsely used overcomplete dictionaries via alternating minimization	2016	-14.049017489562454	0.4251736387527718	461554
461608	ML	detection over diffusion networks: asymptotic tools for performance prediction and simulation	2016	-12.712514525785586	0.38461139019812657	461635
461610	ML	karush-kuhn-tucker systems: regularity conditions, error bounds and a class of newton-type methods	2003	-14.522628824971733	2.152526405403453	461637
461948	Mobile	wifi ilocate: wifi based indoor localization for smartphone	2014	-11.232125941057916	0.9661425191414033	461975
461978	Embedded	a spherical-wavefront-based scatterer localization algorithm using large-scale antenna arrays	2016	-12.220200099691962	-0.17555181612406714	462005
462193	ML	generalized nonnegative matrix approximations with bregman divergences	2005	-14.42172108997904	0.9230889472411804	462220
462356	Mobile	indoor pedestrian localization using ibeacon and improved kalman filter	2018	-11.470709207999242	0.6091089570758434	462383
462398	Visualization	error analysis of the otdoa from the resolved first arrival path in lte	2016	-12.155637605959745	-0.03641090754215915	462425
462607	ML	prox-pda: the proximal primal-dual algorithm for fast distributed nonconvex optimization and learning over networks	2017	-12.895572447437337	0.9865080664926302	462634
462738	ML	the exact l 1 penalty function method for constrained nonsmooth invex optimization problems	2011	-14.091626436655334	2.384280912914494	462765
463016	Theory	fastest distributed consensus averaging problem on perfect and complete n-ary tree networks	2010	-12.807731840268268	1.5341932906292108	463043
463109	Mobile	indoor localization using audio features of fm radio signals	2011	-11.815165504874749	0.413589698261513	463136
463212	AI	optimistic parallel biscrete relaxation	1993	-13.558012887872788	2.7290556797685213	463239
463231	ML	necessary conditions for convergence rates of regularizations of optimal control problems	2011	-14.812725439954102	1.7023203010029038	463258
463370	Robotics	joint ultra-wideband and signal strength-based through-building tracking for tactical operations	2013	-11.495073975631474	0.5183771511045865	463397
463491	Mobile	intelligent strategies of access point selection for vehicle to infrastructure opportunistic communications	2009	-11.359087700293932	1.1251104127369267	463518
463527	Theory	second order analysis for optimal control problems: improving results expected from abstract theory	2012	-14.247075949927895	2.966685552083596	463554
463839	Mobile	investigation of radio channel uncertainty in distance estimation in wireless sensor networks	2013	-11.617819996409931	0.5702096363452254	463866
463870	Mobile	a bayesian approach to dealing with device heterogeneity in an indoor positioning system	2018	-11.52766347175368	0.7327643764192913	463897
463939	ML	nonadaptive group testing based on sparse pooling graphs	2017	-12.37559079236623	1.9300420981089084	463966
464043	ML	a block-iterative quadratic signal recovery algorithm	1998	-14.544354951911092	1.1850289162260397	464070
464082	Theory	knapsack feasibility as an absolute value equation solvable by successive linear programming	2009	-13.67566632955671	3.306220765374965	464109
464259	Theory	an extension of karmarkar's projective algorithm for convex quadratic programming	1989	-14.050576613768671	2.6922885438644384	464286
464373	Robotics	an improved rssi of geomagnetic field-based indoor positioning method involving efficient database generation by building materials	2016	-11.43802729434362	0.5323545383563039	464400
464726	Logic	balancing and factorization theory for classes of linear systems in discrete- and continuous-time	1994	-11.766777611565962	3.4516498014163846	464753
465152	Visualization	optimal knn positioning algorithm via theoretical accuracy criterion in wlan indoor environment	2010	-11.470825401998198	0.8548980334981051	465179
465263	ML	a polya urn-based model for epidemics on networks	2017	-12.2485167812663	1.8502391229837272	465290
465370	Robotics	global optimization of trusses with constraints on number of different cross-sections: a mixed-integer second-order cone programming approach	2016	-12.925186030295858	2.301262073641503	465397
465590	ML	random derivative-free algorithm for solving unconstrained or bound constrained continuously differentiable non-linear problems	2015	-13.78816571118125	1.8611340635206373	465617
466185	Theory	a sharp condition for exact support recovery of sparse signals with orthogonal matching pursuit	2016	-14.109878444181778	0.30844369850103576	466212
466200	ML	modified simplex imbeddings method in convex non-differentiable optimization	2016	-13.708106187963846	2.5895834582390247	466227
466207	Theory	a note on estimating the spectral norm of a matrix efficiently	2011	-14.096122850978801	0.6556065046043114	466234
466263	Robotics	channel fluctuation measurement for image sensor based i2v-vlc, v2i-vlc, and v2v-vlc	2014	-11.28159513343316	0.26976059122887625	466290
466432	ML	a unified local convergence analysis of inexact constrained levenberg-marquardt methods	2012	-14.774947762861412	1.907918408917528	466459
466555	Robotics	modelling received signal strength from on-vehicle ble beacons using skewed distributions: a preliminary study	2017	-11.38794938031391	0.7144718826802545	466582
466584	ML	a sparse proximal implementation of the lp dual active set algorithm	2008	-14.294585317450752	1.6933373965396017	466611
466939	AI	local stability and robustness of sparse dictionary learning in the presence of noise	2012	-13.914441972356427	-0.0932029182757851	466966
467222	Theory	an outer approximation method for the variational inequality problem	2005	-14.643113749534786	3.1955331572401295	467249
467339	Mobile	wfid: passive device-free human identification using wifi signal	2016	-11.498093369215207	1.2553122522994913	467366
467432	HPC	generating linear and linear-quadratic bilevel programming problems	1993	-13.740117893717064	2.7778286633269578	467459
467564	Robotics	a decomposition algorithm for mean-variance economic model predictive control of stochastic linear systems	2014	-13.46382746084494	1.5365513924481076	467591
467671	ML	spark level sparsity and the ℓ1 tail minimization	2016	-14.046965227521325	0.2684550792292177	467698
467783	AI	sparse approximation via penalty decomposition methods	2013	-14.132694245575271	0.6716294010469698	467810
468127	ML	sensitivity analysis in linear programming and semidefinite programming using interior-point methods	2001	-13.930152798848296	2.9477196111450583	468154
468214	Vision	a characterization of sampling patterns for low-rank multi-view data completion problem	2017	-14.085219826016251	0.5704663576637451	468241
468234	Theory	efficient simulations for the exponential integrals of hölder continuous gaussian random fields	2014	-14.801130265333233	0.6301813032394933	468261
468286	Theory	hybrid methods for solving simultaneously an equilibrium problem and countably many fixed point problems in a hilbert space	2014	-14.687144772865135	2.7031965631994463	468313
468633	Vision	data induced metric and fuzzy clustering of non-convex patterns of arbitrary shape	1997	-12.450553121661606	2.7782474635520864	468660
468852	Networks	realistic indoor radio propagation for sub-ghz communication	2018	-11.628147760596946	0.6518246235616817	468879
469488	ML	distributed large neural network with centralized equivalence	2018	-12.743439638749214	0.7404533399647638	469515
469535	ML	on the use of copulas in joint chance-constrained programming	2014	-12.92516918383822	2.6498454450947597	469562
469596	ML	learning k-variable pattern languages efficiently stochastically finite on average from positive data	1998	-11.602164513494618	2.6254306717696423	469623
469873	ML	bounds on the bayesian cost in optimum receivers	1997	-12.540078805199645	1.6485273185422946	469900
469920	AI	an effective computational algorithm for a class of linear multiplicative programming	2013	-13.806300563164775	2.2103130500776387	469947
469934	ML	robust large-scale non-negative matrix factorization using proximal point algorithm	2013	-13.919769525795784	0.5325208475327633	469961
469983	ML	a lyapunov-type approach to convergence of the douglas-rachford algorithm for a nonconvex setting	2019	-14.643013138023242	2.7976017003974003	470010
470080	Mobile	cooperative scheme in sfn positioning system	2012	-11.729707311223311	0.2603753275172776	470107
470087	Robotics	visibility-limited coverage control using nonsmooth optimization	2012	-12.90962020145209	2.1583180906748094	470114
470113	Mobile	an empirical study of wifi-based radio tomographic imaging	2017	-11.529667636241234	0.6819632020326689	470140
470182	Mobile	comparison of algorithms for uwb indoor location and tracking systems	2011	-11.540907694643467	0.6813459690759034	470209
470228	AI	using direct to solve an aircraft routing problem	2002	-11.741908716103222	3.1253627206113817	470255
470253	ML	a regularized simplex method	2015	-14.159101151662085	1.9235805489185631	470280
470292	AI	embedded mixed-integer quadratic optimization using the osqp solver	2018	-14.014885586501016	1.7609819818827714	470319
470520	Graphics	on computational aspects of bounded linear least squares problems	1991	-14.526074022943769	1.8851705503601648	470547
470631	ML	newton sketch: a near linear-time optimization algorithm with linear-quadratic convergence	2017	-14.10364676251626	1.6270860209749416	470658
470697	Vision	"""sheppard's correction for variances and the """"quantization noise model"""""""	2005	-12.5995651744674	3.3522523177582486	470724
471368	Theory	the sampling rate-distortion tradeoff for sparsity pattern recovery in compressed sensing	2012	-14.108005200090561	0.011826277520265693	471395
471502	Mobile	rssi-fingerprinting-based mobile phone localization with route constraints	2014	-11.361470286933804	0.8517555850668059	471529
471644	AI	linear-quadratic control and information relaxations	2012	-14.506848848089286	2.3622564584906347	471671
471771	Theory	primal-dual active-set methods for large-scale optimization	2015	-14.743577721225936	2.111001014004429	471798
471827	EDA	method of hill tunneling via simplex centroid for continuous piecewise linear programming	2015	-13.078666114992538	2.2672030211631604	471854
471933	ECom	e-equilibrium strategies for lq differential games with output measurement	2005	-11.232873285807106	2.4982415228484727	471960
471953	Theory	isolated and proper efficiencies in semi-infinite vector optimization problems	2014	-14.358794391006231	3.0635283689151347	471980
472861	Mobile	hips: a calibration-less hybrid indoor positioning system using heterogeneous sensors	2009	-11.143607221758721	0.9720287676084688	472888
472906	ML	distributed multi-agent optimization with state-dependent communication	2011	-12.762077839792655	1.1587101451809916	472933
472932	Theory	direct methods with maximal lower bound for mixed-integer optimal control problems	2009	-13.584346376371878	2.3039514791562206	472959
472973	ML	metric characterizations of α-well-posedness for a system of mixed quasivariational-like inequalities in banach spaces	2012	-14.462062044777298	3.274521374457783	473000
473014	Mobile	accurate radio distance estimation by phase measurements with multiple frequencies	2014	-11.43527102790235	0.6458333639889324	473041
473050	ML	a penalization-gradient algorithm for variational inequalities	2011	-14.626736240259206	2.992195240941005	473077
473075	Vision	vector optimization: singularities, regularizations	1998	-14.138232543129961	2.6845949816047416	473102
473079	Theory	saddle points for vector valued functions: existence, necessary and sufficient theorems	2012	-14.730948158913955	3.089341588356872	473106
473091	ML	free-steering relaxation methods for problems with strictly convex costs and linear constraints	1997	-14.11971391878297	1.5099928398357219	473118
473122	Robotics	a generalized nash game for energy efficiency optimization: a quasi variational inequality approach	2013	-12.68521702997092	1.8626758212615249	473149
473272	ML	stable cosparse recovery via \ell_q-analysis optimization	2014	-14.023906231539007	0.6409257856893597	473299
473325	ML	convergence rates for the iteratively regularized landweber iteration in banach space	2011	-14.626759187777328	1.3415021559776559	473352
473381	PL	sequential quadratic programming methods for large-scale problems	1997	-13.507085460050742	2.0929707352075373	473408
473503	Theory	on the robustness of complex networks by using the algebraic connectivity	2008	-12.17524721045624	1.888943912768964	473530
473585	ML	efficient gaussian sampling for solving large-scale inverse problems using mcmc	2015	-14.689058123718368	0.3189053425163905	473612
473593	Mobile	radio-interferometric object trajectory estimation	2014	-11.96561783026598	-0.15486321607967324	473620
473693	Vision	tensor subspace detection with tubal-sampling and elementwise-sampling	2018	-13.982563182757714	-0.17886830951974142	473720
473709	Robotics	distributed estimation of the degree distribution in wireless sensor networks	2016	-12.80662735993233	0.2861228015391488	473736
473814	HPC	subspace trust-region methods for large bound-constrained nonlinear equations	2006	-14.820007833970337	1.8351925245713745	473841
473939	Theory	erratum: a continuous exact ℓ0 penalty (cel0) for least squares regularized problem	2016	-14.090473259331711	1.5144538300124115	473966
473957	Vision	tensor completion using kronecker rank-1 tensor train with application to visual data inpainting	2018	-13.962563365786687	0.10405144615096583	473984
473961	Embedded	gof analysis for gaussianity assumption of range errors in wsn	2010	-12.00009345160378	0.16523289229039356	473988
474017	ML	complexity analysis of interior point methods for linear programming based on a parameterized kernel function	2016	-14.926273864523143	2.7075514592590157	474044
474024	Vision	multi-entity device-free wlan localization	2012	-11.325555488656097	0.9151683362734498	474051
474031	ML	fast sequential creation of random realizations of degree sequences	2016	-11.475566773682285	3.599301611689722	474058
474077	Mobile	third-party receiver positioning in wireless sensor networks	2016	-11.79216135507093	0.4205084759402434	474104
474128	Theory	partition-optimization with schur convex sum objective functions	2004	-13.711521723454075	3.166592050916388	474155
474174	Mobile	uavs for wi-fi receiver mapping and packet sniffing with antenna radiation pattern diversity	2017	-11.338956249377244	0.9659917508164484	474201
474279	Vision	structural analysis of laplacian spectral properties of large-scale networks	2013	-12.73663663867258	1.428619068147335	474306
474465	Vision	the least-disturbance principle and weak constraints	1983	-13.181396290418222	2.4756024278531368	474492
474511	Theory	technical efficiency and distance to a reverse convex set	1999	-13.53953982429975	3.2412665918103096	474538
474631	Theory	characterization of strong stability for c-stationary points in mpcc	2012	-14.697636911503015	3.3905054627576168	474658
474709	ML	convex quadratic relaxations of nonconvex quadratically constrained quadratic programs	2014	-13.69566826178506	2.3671755248777018	474736
474791	ML	convergent and correct message passing schemes for optimization problems over graphical models	2010	-12.684666498475327	1.7540361433842306	474818
474810	Robotics	a warm-started homogeneous and self-dual interior-point method for linear economic model predictive control	2013	-13.821307854000715	1.5859902877699859	474837
474817	AI	exploiting equalities in polynomial programming	2008	-13.735212590036493	3.4364916887607526	474844
475113	Theory	on mixtures of markov chains	2016	-12.884718787684893	3.085270743641356	475140
475348	ML	a recurrent neural network for channel assignment problems in mobiles	2010	-12.9152468468668	2.3085906014765896	475375
475380	Metrics	entropy-based toa estimation and svm-based ranging error mitigation in uwb ranging systems	2015	-11.994885018619936	0.1773514724653178	475407
475420	Robotics	performance analysis of a distributed robbins-monro algorithm for sensor networks	2011	-12.862741330218856	0.43161372399178816	475447
475489	Theory	algorithm of solutions for solving generalized mixed implicit equilibrium problems	2013	-14.66393093291064	2.905763141972656	475516
475593	Mobile	an analysis of radio fingerprints behavior in the context of rss-based location fingerprinting systems	2011	-11.451468381488453	0.8270616320180388	475620
475675	Theory	radial epiderivatives and asymptotic functions in nonconvex vector optimization	2003	-14.262765885634911	3.1312941067066085	475702
475680	Vision	global descent method for constrained continuous global optimization	2014	-14.433419921906767	1.9342198184934725	475707
475738	ML	putting nonnegative matrix factorization to the test: a tutorial derivation of pertinent cramer—rao bounds and performance benchmarking	2014	-14.383337609462302	0.1954035160857203	475765
475755	AI	combining lagrangian decomposition and excessive gap smoothing technique for solving large-scale separable convex optimization problems	2013	-14.02354831664781	1.7438851929908317	475782
475901	Theory	solution sets of quadratic complementarity problems	2018	-14.654015399992149	3.2210236347037893	475928
476019	Vision	proximal point methods and nonconvex optimization	1998	-14.288616635517785	1.9302539099575058	476046
476071	ML	comparing sos and sdp relaxations of sensor network localization	2012	-14.59590002201313	2.652293867913764	476098
476158	Robotics	mobile sensor mapping via semi-definite programming	2014	-11.646637207395404	0.6753149182456312	476185
476232	Theory	nonmonotone second-order wolfe's line search method for unconstrained optimization problems	2010	-14.72951163517856	1.8682926032014315	476259
476257	Mobile	cross-provider cooperation for improved network-based localization	2013	-11.449681985770665	0.8249348637184886	476284
476498	Robotics	an example of the utility of linear programming- ii. nonlinear application	1980	-14.502814228987287	3.4494023704580763	476525
476661	ML	an alternating trust region algorithm for distributed linearly constrained nonlinear programs, application to the optimal power flow problem	2017	-14.233425948087337	1.5418763530460076	476688
476697	ML	distributed linearized alternating direction method of multipliers for composite convex consensus optimization	2018	-12.828116902255392	1.1580956909265328	476724
476746	Mobile	vehicle positioning by database comparison using the box-cox metric and kalman filtering	2002	-11.900391393559596	0.16291809966014498	476773
476759	ML	non-negative principal component analysis: message passing algorithms and sharp asymptotics	2016	-13.986711563701625	0.06352371390921499	476786
476782	ML	multi-agent constrained optimization of a strongly convex function	2017	-12.763947429991171	1.2725248421673878	476809
476847	Robotics	a novel nlos localization method based on tabu search	2013	-12.011586962687712	-0.03365436294798761	476874
476850	ML	mean-squared error estimation for linear systems with block circulant uncertainty	2007	-14.461476615761594	0.5517898006240871	476877
476852	PL	local reduction based sqp-type method for semi-infinite programs with an infinite number of second-order cone constraints	2014	-14.368960941652027	2.1607249689993604	476879
476956	ML	minimum norm solution to the absolute value equation in the convex case	2012	-14.653367753363801	2.3829861663071896	476983
477162	AI	solving ℓ0-penalized problems with simple constraints via the frank-wolfe reduced dimension method	2015	-14.478092245994675	1.4835603974781515	477189
477170	ML	gradient projection methods for quadratic programs and applications in training support vector machines	2005	-14.862774435615794	1.7718270299565897	477197
477433	ML	quasi-monte carlo methods for markov chains with continuous multi-dimensional state space	2010	-11.796168291957233	3.2892227074921183	477460
477542	ML	loss rates for lévy processes with two reflecting barriers	2007	-12.288813959638029	3.3978417573063533	477569
477674	EDA	examining the limits of the application of semidefinite programming to power flow problems	2011	-13.239706900631347	1.9103938878940463	477701
477843	Mobile	empirical-based analysis of a cooperative location-sensing system	2007	-11.722946630732276	0.4702838430709988	477870
477991	Robotics	sparse signal recovery from compressed measurements using hybrid particle swarm optimization	2017	-13.96801894151186	-0.09156282135582594	478018
478078	Vision	convergence of mesh adaptive direct search to second-order stationary points	2006	-14.426384070536013	2.0204496704928365	478105
