id	area	title	year	x	y	ix
274841	Theory	successive linear programs for computing all integral points in a minkowski sum	2005	-14.254913174047553	3.0738046695249164	274868
274957	ML	loop corrected belief propagation	2007	-12.2058963360625	2.173810418585777	274984
275152	Mobile	a visible light positioning system using frequency division multiple access with square waves	2015	-11.904706118078089	0.2666833679347663	275179
275159	Theory	existence results for primal and dual generalized vector equilibrium problems with applications to generalized semi-infinite programming	2005	-14.156586340184234	3.4420477944714536	275186
275175	ML	the incremental gauss-newton algorithm with adaptive stepsize rule	2003	-14.78950799181489	1.7543925816289971	275202
275191	AI	a distributed computation algorithm for solving portfolio problems with integer variables	2008	-13.102890642466248	2.479477140438913	275218
275278	Theory	an inverse problem for a class of linear stochastic evolution equations	2012	-14.398223938094775	2.246667833399171	275305
275552	Theory	computation of minimum cross entropy spectral estimates: an unconstrained dual convex programming method	1986	-14.387466961359642	1.7697586944617532	275579
275674	Theory	order estimation and sequential universal data compression of a hidden markov source by the method of mixtures	1994	-12.258172610420132	2.2324766351593444	275701
275783	Robotics	a non-line-of-sight mitigation technique based on ml-detection	2004	-12.068211389314213	-0.037008340136262544	275810
275869	Mobile	poster: a hybrid approach for indoor mobile phone localization	2012	-11.252735978568923	0.9214259826341612	275896
275926	HCI	adaptive indoor positioning model based on wlan-fingerprinting for dynamic and multi-floor environments	2017	-11.38968861358384	0.8097752574594237	275953
275969	Robotics	a conjugate gradient method with sufficient descent property	2014	-14.685541630755177	1.874022401780694	275996
275982	Theory	maximal recursive sequences with 3-valued recursive cross-correlation functions (corresp.)	1968	-11.8919355087703	2.9504454030244878	276009
276076	AI	distributed decoupling of multiagent simple temporal problems	2016	-12.913025154859744	1.1933986254188491	276103
276079	Metrics	interval approach to phase measurements can lead to arbitrarily complex sets – a theorem and ways around it	2004	-12.424179816206676	-0.16502785999810854	276106
276081	Mobile	demo: lightweight visible light communication forindoor positioning	2015	-11.297260795510958	1.4665758107071745	276108
276276	ML	a finite newton algorithm for non-degenerate piecewise linear systems	2011	-14.624597803410909	1.831614671429325	276303
276317	Robotics	lane recognition for moving vehicles using multiple on-car rfid receiver antennas — algorithm and its experimental results	2012	-11.755764510222914	0.26319373650517275	276344
276439	ML	generalization properties and implicit regularization for multiple passes sgm	2016	-14.055273930133994	1.4340990239850833	276466
276609	Theory	time-variant filters and analytic signals (corresp.)	1967	-11.929106632584366	2.572118055391341	276636
276763	Theory	the noisy, asynchronously multiplexed, binary channel (corresp.)	1967	-11.816101858313887	2.7903542516908466	276790
277056	Theory	generalized cumulative residual entropy for distributions with unrestricted supports	2008	-12.345393431756227	3.2337455435301994	277083
277057	ML	ls-cs-residual (ls-cs): compressive sensing on least squares residual	2010	-14.181689125997329	-0.018552424235927845	277084
277134	AI	a trust-region algorithm combining line search filter method with lagrange merit function for nonlinear constrained optimization	2014	-14.760484948091525	1.845327532348376	277161
277332	ML	a new algorithm for box-constrained global optimization	2011	-14.847805004139222	1.6490908659061188	277359
277408	ML	godec: randomized lowrank & sparse matrix decomposition in noisy case	2011	-13.843948716709551	0.017531095427886192	277435
277714	Vision	warm start of the primal-dual method applied in the cutting-plane scheme	1998	-13.424985697508173	2.1443115931943537	277741
277816	ML	a globally convergent primal-dual active-set framework for large-scale convex quadratic optimization	2015	-14.556571563521937	1.648569129349904	277843
278004	AI	special backtracking proximal bundle method for nonconvex maximum eigenvalue optimization	2015	-14.374288868807087	2.0117271224418376	278031
278284	ML	beyond moore-penrose part ii: the sparse pseudoinverse	2017	-14.398481523412654	1.1172577657685825	278311
278285	Theory	concave minimization via conical partitions and polyhedral outer approximation	1991	-13.283048133045465	2.7442140327785487	278312
278416	Mobile	preserving synchronization accuracy from the plug-in of nonsynchronized nodes in a wireless sensor network	2017	-12.755749877272766	-0.08590260632998509	278443
278518	Mobile	using radio frequency identify (rfid) radar to detect overhead high voltage power line position	2014	-11.646741962492039	0.6204288910623637	278545
278625	Mobile	high-precision multiple-antenna indoor positioning system based on chirp signal	2017	-11.908113417158466	0.350832538938317	278652
278732	ML	a measure-theoretic variational bayesian algorithm for large dimensional problems	2014	-14.333710368463773	0.30828457770231504	278759
278780	ML	an efficient algorithm for globally minimizing a quadratic function under convex quadratic constraints	2000	-13.807314190836722	2.395090859831336	278807
278995	Theory	simulation of random variables under rényi divergence measures of all orders	2018	-12.62705844449606	3.4954268542671816	279022
279007	DB	two-level optimization with approximate solutions in the lower level	1995	-13.425067000191824	2.4321695991804195	279034
279022	ML	on the applications of the minimum mean p-th error (mmpe) to information theoretic quantities	2016	-14.735666943974838	0.022487450014069515	279049
279086	Graphics	block algorithms for reordering standard and generalized schur forms	2006	-11.329055434636276	3.1411507617190573	279113
279319	ML	bilevel derivative-free optimization and its application to robust optimization	2012	-13.528557189849694	1.9237419886842133	279346
279585	ML	an interior point algorithm to solve computationally difficult set covering problems	1991	-13.470897089947794	2.9950530649536113	279612
279616	ML	an adaptive infeasible interior-point algorithm with full nesterov-todd step for semidefinite optimization	2015	-13.862664229142075	2.2264662925770833	279643
279733	ML	an algorithm for the estimation of a regression function by continuous piecewise linear functions	2010	-13.929687813628838	1.6606381966511259	279760
279849	ML	on the entropy and filtering of hidden markov processes observed through arbitrary memoryless channels	2008	-12.403104379697961	2.9776635161134344	279876
280003	HCI	ultra wideband indoor positioning technologies: analysis and recent advances †	2016	-11.165129168452015	1.1765462832833562	280030
280172	Mobile	real-time estimation of sensor node's position using particle swarm optimization with log-barrier constraint	2011	-12.046947283547475	0.010491885641167924	280199
280203	AI	the approximation algorithm for solving a sort of non-smooth programming	2007	-13.503183067729546	2.620077325451785	280230
280254	EDA	greedy adaptive measurements with signal and measurement noise	2012	-12.739378981762107	-0.1813484498105221	280281
280294	Theory	first hitting place probabilities for a discrete version of the ornstein-uhlenbeck process	2009	-11.897153798143627	3.4676120606039067	280321
280328	ML	incrementally updated gradient methods for constrained and regularized optimization	2014	-14.334633079727736	1.7085493229953854	280355
280393	ML	new globally convergent training scheme based on the resilient propagation algorithm	2005	-14.723421695346543	1.7902007111378317	280420
280648	Theory	solving generalized equations via homotopies	1985	-14.696780792730605	3.0478738744800107	280675
280669	ML	positivity and optimization for semi-algebraic functions	2010	-14.524871526074204	3.481689308059176	280696
280745	ML	smoothed rank approximation algorithms for matrix completion	2014	-14.060539149946926	-0.008303906790651187	280772
280766	Robotics	design of navigation system and transmitter based on gps and gsm	2016	-11.19287924572288	0.8211496244686253	280793
281130	ML	inferring rankings using constrained sensing	2011	-13.926388320765215	0.5018123731308012	281157
281315	Theory	solving semidefinite quadratic problems within nonsmooth optimization algorithms	1996	-14.841892341951606	2.8367885539334954	281342
281535	Robotics	scheduling nonlinear sensors for stochastic process estimation	2017	-13.070372180482615	-0.0297022923266461	281562
281651	Mobile	rss-based monte carlo localisation for mobile sensor networks	2008	-12.039852790876928	-0.14502290254264433	281678
281867	ML	sharpness, restart and acceleration	2017	-14.753106947900223	2.606761571557929	281894
281870	AI	decentralized chance-constrained finite-horizon optimal control for multi-agent systems	2010	-12.750951434367918	1.2760815201743014	281897
281888	Visualization	"""comments on """"the effects of quantization on multilayer neural networks"""" [and reply]"""	1998	-12.024291037593192	2.893865410438725	281915
281992	Robotics	convergence analysis for the primal-dual gradient dynamics associated with optimal power flow problems	2015	-13.07801524579717	1.4650639341424725	282019
282160	Theory	asymptotic behavior of quantum walks with spatio-temporal coin fluctuations	2012	-12.793961631041414	3.544240127598309	282187
282161	ML	maximal deviations of incomplete u-statistics with applications to empirical risk sampling	2013	-13.315927290912509	3.3165575757485404	282188
282243	Robotics	distributed kalman filtering with finite-time max-consensus protocol	2018	-12.897602978580101	-0.18047228027775605	282270
282281	Visualization	an improved location algorithm based on cc2431	2013	-11.808516757968876	0.2949437996925029	282308
282510	ML	finding sparse solutions of systems of polynomial equations via group-sparsity optimization	2015	-14.119960146007188	0.6111465652483606	282537
282528	AI	an efficient algorithm for dictionary learning with a mixed-norm regularizer for sparsity based on proximal operator	2015	-14.021745725949526	0.43421545816145146	282555
282554	ML	on the differentiability check in gradient sampling methods	2016	-14.167766754364324	2.587427482199555	282581
282826	HCI	a fresnel diffraction model based human respiration detection system using cots wi-fi devices	2018	-11.19188968009238	1.0940154942617497	282853
282874	AI	new augmented lagrangian-based proximal point algorithm for convex optimization with equality constraints	2016	-14.275571078984887	1.5075016693863068	282901
282886	ML	compressed sensing with local structure: uniform recovery guarantees for the sparsity in levels class	2016	-14.140365337768088	0.16600655916217574	282913
282957	ML	entropic updating of probabilities and density matrices	2017	-12.015686481833749	3.5329393417617414	282984
283064	Theory	a modified integer labeling for complementarity algorithms	1981	-13.79002425136964	2.599800778209918	283091
283110	Theory	solving nonlinear single-facility network location problems	1986	-13.038846545150731	1.7010713023118882	283137
283136	AI	the minimization of the fuel costs in the train transportation	2006	-13.365781347074893	2.130109151773851	283163
283211	Robotics	exponentially consistent k-means clustering algorithm based on kolmogrov-smirnov test	2018	-12.53894510345364	1.049872593267358	283238
283327	ML	distributed consensus optimization in multiagent networks with time-varying directed topologies and quantized communication	2017	-12.7969804030708	1.04771392105559	283354
283401	ML	a hessian schatten-norm regularization approach for solving linear inverse problems	2012	-12.330816095428435	2.497992085049753	283428
283437	ML	a new inexact alternating directions method for monotone variational inequalities	2002	-14.54068297286075	1.9246642380994825	283464
283618	ML	local linear convergence of ista and fista on the lasso problem	2016	-14.260174924461644	0.4759704735435162	283645
283669	Mobile	ubiquitous sensor-based pedestrian dead-reckoning for lbs applications	2012	-11.220156237938303	0.824765969535598	283696
283847	Robotics	a hybrid localization method in wireless sensor networks	2011	-12.132671500313366	-0.12532443024996698	283874
283858	Theory	numerical block diagonalization of matrix *-algebras with application to semidefinite programming	2011	-13.630711777978316	2.270117370189611	283885
283860	AI	a nonlinear lagrangian dual for integer programming	2002	-13.584595199528785	2.6210320508624694	283887
284052	SE	knowledge aspects of resource allocation problems with saturation	1997	-13.789168600574193	3.3062445845987143	284079
284248	Robotics	reinforcement learning in decentralized stochastic control systems with partial history sharing	2015	-12.203702541774506	1.2982617019036042	284275
284282	ML	conditioning of random block subdictionaries with applications to block-sparse recovery and regression	2015	-13.898726500607747	0.2669223064149902	284309
284338	ML	global convergence of non-convex gradient descent for computing matrix squareroot	2017	-14.040549131752217	1.3829999787227871	284365
284435	ML	iterative tomographic solution of integer least squares problems with applications to mimo detection	2011	-14.363729707175624	-0.008198883801591913	284462
284488	Robotics	hybrid tdoa/aoa indoor positioning and tracking using extended kalman filters	2006	-11.971682411434655	-0.08942976732471387	284515
284615	Theory	on the existence of a trivariate copula with given values of a trivariate quasi-copula at several points	2013	-14.688202226655841	3.564161502812205	284642
284717	DB	convergence analysis of processes with valiant projection operators in hilbert space	2018	-14.711173869652114	3.6040445594638304	284744
284877	AI	input design as a tool to improve the convergence of pem	2013	-13.849899788249125	1.5103178119206415	284904
285049	Mobile	ols: opportunistic localization system for smart phones devices	2009	-11.200484730781579	1.0443877417574834	285076
285828	ML	sample complexity bounds for dictionary learning of tensor data	2017	-14.022759717742064	0.08536313401065787	285855
285906	ML	a characterization of sampling patterns for union of low-rank subspaces retrieval problem	2018	-14.457249599735489	0.9535313674927	285933
285914	ML	an active set method for single-cone second-order cone programs	2006	-13.6487260983624	2.1208727928317117	285941
286181	Robotics	the weighted l 2, 1 minimization for partially known support	2016	-14.712047063578579	-0.17084690636954047	286208
286269	Robotics	stable sparse approximations via nonconvex optimization	2008	-14.297885062817613	0.6878448070748674	286296
286366	ML	an adaptive version of the boost by majority algorithm	1999	-13.903583429633963	1.4786615509282368	286393
286406	Mobile	hybrid toa/aoa techniques for mobile location in non-line-of-sight environments	2004	-12.043734246852178	-0.0212111949000742	286433
286555	Mobile	optimal network topology for a locating system using rssi-based direction finding	2015	-11.862613816128874	0.22648139485697885	286582
286689	Mobile	an improved rfid-based localization algorithm for wireless sensor networks	2013	-11.502167930675327	0.6728953951397113	286716
286792	ML	duality approach to bilevel programs with a convex lower level	2018	-13.956867310769965	2.340578802199473	286819
286798	ML	a variable-penalty alternating directions method for convex optimization	1998	-14.173808188743024	1.9808039730308988	286825
286947	Vision	adjustment process-based approach for computing a nash-cournot equilibrium	1994	-14.55463222710582	2.6733693277224204	286974
287074	Vision	transputer implementation of block regularized filtering	1996	-11.21119179871912	3.413224766734156	287101
287292	Theory	singular values of gaussian matrices and permanent estimators	2016	-14.19782759017467	1.0010785424407191	287319
287360	ML	solving nonsmooth inclusions in the convex case	1991	-14.586857900561734	3.273277708519353	287387
287372	Robotics	high precision ultrasonic positioning using a robust optimization approach	2013	-11.543145519657829	0.4526898637595659	287399
287379	ML	practical matrix completion and corruption recovery using proximal alternating robust subspace minimization	2014	-13.859530529900155	0.5109855643758533	287406
287475	Metrics	erratum: the derivation of chemotaxis equations as limit dynamics of moderately interacting stochastic many-particle systems	2001	-11.451067006377606	3.3786502809966907	287502
287576	ML	a descent algorithm-based parallel variable dual matrix model and application to blind source separation	2015	-14.743830039422653	1.1761998185300098	287603
287579	Robotics	a projected derivative-free algorithm for nonlinear equations with convex constraints	2014	-14.55305032199228	1.8452103882700601	287606
287633	Mobile	how precise should localization be? a quantitative analysis of the impact of delay and mobility on reliability of location information	2010	-11.338428733813073	0.8345663605106037	287660
287638	Theory	some proximity and sensitivity results in quadratic integer programming	1990	-13.615066029023028	3.154133396853797	287665
287855	Theory	error analysis of a statistical decision method	1964	-14.066300653419676	-0.18187353203752912	287882
288043	Mobile	fuzzy location and tracking on wireless networks	2006	-11.475560018471784	0.7757740715680487	288070
288172	Mobile	rss-based localization in obstructed environment with unknown path loss exponent	2014	-11.989583166131215	0.17656201786996714	288199
288212	ML	asynchronous gossip-based random projection algorithms over networks	2016	-12.860162146506429	1.0721703013471513	288239
288341	ML	projected sub-gradient with ℓ1 or simplex constraints via isotonic regression	2015	-13.75444924814332	1.2024494697344952	288368
288367	Robotics	a predictor-corrector algorithm combined conjugate gradient with homotopy interior point for general nonlinear programming	2013	-14.679149058941519	2.0099273516432343	288394
288409	Theory	new order relations in set optimization	2011	-13.925065915553718	3.4564286184311936	288436
288470	Theory	a global-optimization algorithm for mixed-integer nonlinear programs having separable non-convexity	2009	-13.15112539961923	2.3723242725257774	288497
289064	AI	rigidity of abnormal extrema in nonlinear programming problems with equality and inequality constraints	2007	-14.469155992651693	2.861941850290516	289091
289073	Mobile	a self-adapting algorithm based on atmospheric pressure to localize indoor devices	2016	-11.132514610246556	0.9891299538664564	289100
289078	Crypto	'no overlap no gap' and the attack of a linear target by n different weapons	2005	-12.616343167151834	1.1556730377575606	289105
289422	Robotics	single-phase wireless lan based multi-floor indoor location determination system	2011	-11.62215001489019	0.5764350196559465	289449
289873	Robotics	self-dual approximations to fully convex impulsive systems	2016	-14.402662012677714	2.909532593718504	289900
290106	Theory	a practical globalization of one-shot optimization for optimal design of tokamak divertors	2017	-14.945716773873565	1.7235490989050912	290133
290188	Vision	gpca with denoising: a moments-based convex approach	2010	-14.436392268337789	0.4276686927113711	290215
290239	Robotics	another iterative method for approximating a common element of sets in banach spaces	2011	-14.711208886985142	2.9886870038685225	290266
290272	Robotics	admm penalty parameter selection with krylov subspace recycling technique for sparse coding	2017	-14.319682335930654	0.9049651053975152	290299
290861	Robotics	wlan location determination systems	2006	-11.349790691258285	0.8447118859245246	290888
290866	Embedded	an improved anchor selection strategy for wireless localization of wsn nodes	2016	-11.425249542514134	0.8438229477008365	290893
290932	Robotics	a location and tracking method for indoor and outdoor target via multi-channel phase comparison	2017	-12.217836280439306	-0.1964183956954748	290959
291015	ML	well-posedness for a class of variational-hemivariational inequalities with perturbations	2011	-14.580069407583384	3.1509856668599667	291042
291109	ML	on the convergence of a distributed augmented lagrangian method for nonconvex optimization	2017	-13.318337093653462	1.34113821123077	291136
291258	Logic	set approach for set optimization with variable ordering structures part i: set relations and relationship to vector approach	2016	-13.380587855553276	3.580480582923044	291285
291275	Mobile	portable roadside sensors for vehicle counting, classification, and speed measurement	2014	-11.379342967363394	0.4902569279172814	291302
291394	Mobile	rt-fall: a real-time and contactless fall detection system with commodity wifi devices	2017	-11.364324341153687	1.215443092369084	291421
291689	SE	gaussian processes for rss fingerprints construction in indoor localization	2018	-11.421893496870046	0.8958372591310183	291716
291944	Theory	more efficient internal-regret-minimizing algorithms.	2008	-12.279028727216838	1.9092583239243457	291971
291994	Robotics	cooperative relative positioning for intelligent transportation system	2015	-11.69276186093184	-0.004507551330695132	292021
291999	Theory	an extragradient method for equilibrium problems on hadamard manifolds	2016	-14.434244565867234	2.7636877008386014	292026
292185	Theory	parallel solution of large-scale, block-diagonal concave maximization problems	1991	-13.221110145886245	2.4066871551952667	292212
292192	AI	a theoretical perspective of solving phaseless compressive sensing via its nonconvex relaxation	2017	-14.095755132801493	0.7036814548291596	292219
292221	ML	a cutting plane method from analytic centers for stochastic programming	1995	-13.501925273857957	2.5703816136584594	292248
292224	ML	approximating extreme points of infinite dimensional convex sets	1998	-14.082654234660804	3.1284770470082597	292251
292393	Mobile	a novel wireless positioning system for seamless internet connectivity based on the wlan infrastructure	2008	-11.444521038713743	0.8600616542196698	292420
292408	Mobile	a smartphone-based indoor localisation system using fm and wi-fi signals	2017	-11.235578088131573	1.0108411168770617	292435
292475	Theory	stable super-resolution limit and smallest singular value of restricted fourier matrices	2017	-14.522040290758495	0.5086004981232122	292502
292757	Vision	optimality of affine policies in multi-stage robust optimization	2009	-13.224875183392381	2.491755356720073	292784
292758	Theory	on lao testing of multiple hypotheses for many independent objects	2006	-12.242450611396894	2.603001081164586	292785
293052	Mobile	received signal strength database interpolation by kriging for a wi-fi indoor positioning system	2015	-11.69776882946005	0.6066119234815784	293079
293257	Theory	a trajectory-based method for constrained nonlinear optimization problems	2018	-14.460640092864985	1.7190495143703095	293284
293279	Theory	a general hankel-norm approximation scheme for linear recursive filtering	1990	-14.365628987746403	0.3877442451871846	293306
293474	ML	approximation with random bases: pro et contra	2016	-14.899583841094069	3.5992340285818987	293501
293639	Theory	pair correlation functions and limiting distributions of iterated cluster point processes	2018	-12.46729678144792	3.0608565128797283	293666
293734	Mobile	tag-compass: determining the spatial direction of an object with small dimensions	2017	-11.584831571844633	0.5055215985741028	293761
293786	ML	dynamic updates of the barrier parameter in primal-dual methods for nonlinear programming	2008	-14.471258411240928	1.7080839076432934	293813
294219	Theory	solving sequences of refined multistage stochastic linear programs	2003	-13.700808499385882	2.1636029495895333	294246
294255	Embedded	"""correction to """"mean square convergence of consensus algorithms in random wsns"""""""	2011	-12.217440593246412	2.5112729611689986	294282
294261	HCI	enhancing the performance of indoor localization using multiple steady tags	2013	-11.570340438946307	1.0653542369708795	294288
294431	Theory	finite-memory hypothesis testing-comments on a critique (corresp.)	1970	-11.788721939131706	2.815547249500652	294458
294438	ML	directional derivatives for the value-function in semi-infinite programming	1989	-14.395553468434056	3.035571132219665	294465
294455	Theory	a convex polynomial that is not sos-convex	2012	-14.728525444573727	3.3742434602743425	294482
294549	Theory	generalized form of price's theorem and its converse	1967	-12.7886210768966	3.475999604795828	294576
294737	ML	scale-invariant divergences for density functions	2014	-12.666539121715115	3.469916918606881	294764
294790	ML	interior-point algorithms for semidefinite programming based on a nonlinear formulation	2002	-14.447865669833	2.0716396556176	294817
295088	Robotics	estimation of spatial fields of nlos/los conditions for improved localization in indoor environments	2018	-11.900686634582875	0.1768612456778964	295115
295353	Vision	robustness of dc networks with controllable link weights	2018	-12.734442929989891	1.6247658732054209	295380
295537	ML	sequential compressed sensing	2010	-14.037193894429695	-0.07941170480205707	295564
295639	Logic	distributed primal-dual optimisation method with uncoordinated time-varying step-sizes	2018	-12.769418109512227	1.2344121241559542	295666
295682	Theory	the discrete moment problem and linear programming	1990	-13.367576471572539	3.3419700133267702	295709
295788	Theory	sparse extractor families for all the entropy	2012	-13.171378479789144	0.6592777707300426	295815
296260	EDA	multiple matrix rank constrained optimization for optimal power flow over large scale transmission networks	2016	-12.998258077128416	1.9207492564106197	296287
