id	area	title	year	x	y	ix
274855	Theory	generalized-quasi-variational inequality problems with discontinuous mappings	1995	-13.60339343480884	3.8080929506397703	274882
274935	Theory	voronoi diagrams and polynomial root-finding	2009	-14.839943964262028	6.1830498926826785	274962
275154	Logic	a space efficient algorithm for group structure computation	1998	-14.919322241210251	6.412630024685218	275181
275210	Theory	geometric problems solvable in single exponential time	1990	-13.325446082342115	7.0841921270212005	275237
275696	Metrics	approximate/perfect samplers for closed jackson networks	2005	-12.30436391986342	3.6368322748826953	275723
275727	Theory	minimal polynomial algorithms for finite sequences	2010	-13.30087081090023	5.769207678577634	275754
275832	Vision	"""review: """"on nonsymmetric topological and probabilistic structures"""" by m. grabiec, y. je cho and v. radu"""	2009	-11.940468722734327	4.1641151133063	275859
275953	Theory	optimal locations for a class of nonlinear, single-facility location problems on a network	1983	-12.206957080684715	4.602437131757053	275980
276086	Theory	solving polynomial systems in the cloud with polynomial homotopy continuation	2015	-14.152912265934342	4.925362738063818	276113
276131	Theory	asymptotic analysis of powers of matrices	2006	-13.253199260668206	3.7493959686927463	276158
276482	AI	criteria for generalized invex monotonicities	2005	-14.496313651315507	3.71463370402472	276509
276545	Theory	tractability of infinite-dimensional integration in the worst case and randomized settings	2011	-13.727540900497381	3.772445752709341	276572
276698	Visualization	computation of discrete comprehensive gröbner bases using modular dynamic evaluation	2007	-14.488500877420625	5.357936892854888	276725
276879	AI	a point-inclusion algorithm for a domain with boundary composed of algebraic curve segments	1991	-13.441764197587108	6.361392658409255	276906
276950	Theory	"""remark on """"algorithm 526: bivariate interpolation and smooth surface fitting for irregularly distributed data points [e1]"""""""	1979	-14.172851778396433	5.463636607088849	276977
277026	Theory	orthogonal exponentials on the generalized plane sierpinski gasket	2008	-14.32781016575526	7.021126483044148	277053
277149	ML	contributions to persistence theory	2012	-14.92835712722458	4.960858691634034	277176
277531	Theory	groups and information inequalities in 5 variables	2013	-12.745275948877573	4.232426300901055	277558
277683	ML	mixed-type reverse-order laws of (ab)(1, 2, 3) and (ab)(1, 2, 4)	2011	-14.716191015425483	4.251079245537628	277710
277805	Crypto	some criteria for meromorphic multivalent starlike functions	2011	-14.769363864518564	4.579674000800196	277832
277876	Theory	the strong data processing constant for sums of i.i.d. random variables	2015	-12.638632653813227	3.7815178319373732	277903
277923	Theory	coalescence in subcritical bellman-harris age-dependent branching processes	2013	-11.809470800445304	4.146149058699097	277950
277984	ML	on the algebraic representation of certain optimal non-linear binary codes	2011	-11.316848167474394	5.142290147113997	278011
278066	Theory	complexity of domination in triangulated plane graphs	2017	-12.243847154422042	6.4603147987059595	278093
278436	Robotics	on the diophantine system \(f(z)\, {=}\, f(x)f(y)\, {=}\, f(u) f(v)\)	2017	-11.236631163418453	5.299205079498201	278463
278613	Robotics	metric topology on the l-fuzzy real line	2009	-13.632368116932753	4.645939327895445	278640
278689	Theory	on the rainbow restrained domination number	2016	-11.97900847236424	6.788846532578439	278716
278839	ML	smooth max-information as one-shot generalization for mutual information	2014	-12.265343542492174	4.192691620584877	278866
278840	ML	integrated kernels and their properties	2007	-12.839607043954793	3.6754244537167295	278867
278962	Logic	rado's theorem and solvability of systems of equations	1973	-12.40563990232816	4.651517224013488	278989
279030	Logic	a self-orthogonal doubly-even code invariant under mcl	2009	-12.085064884723037	6.043982981236343	279057
279136	Vision	a note on the equation axb=b=bxa	2018	-13.954275918263278	4.520046851434113	279163
279211	ML	deterministic complexity and entropy	2005	-12.332490547581232	4.175443213827049	279238
279244	DB	construction of well separated interaction semigroups to refine the modeling of social networks	2003	-12.750090042899961	6.3684300684092445	279271
279373	Theory	bartholdi zeta functions of fractal graphs	2009	-14.393295007854805	6.327360514850124	279400
279377	Vision	on the facial structure of the set of correlation matrices	1996	-14.784360637905232	6.789727553412018	279404
279642	ML	some characterizations for soc-monotone and soc-convex functions	2009	-14.466025545704575	3.636425980667698	279669
279773	Theory	partially ball weakly inf-compact saddle functions	2005	-14.69617892049069	4.043578419520928	279800
279991	Theory	computing algebraic numbers of bounded height	2015	-13.619925463367018	7.063952336555009	280018
279996	Logic	algebraic languages and polyominoes enumeration	1984	-14.892798966598413	7.162942198368483	280023
280037	Robotics	complexity of computation of embedded resolution of algebraic curves	1987	-14.748205265029034	5.17881749448612	280064
280264	Theory	a majorization theorem for the number of distinct outcomes in n independent trials	1973	-12.224066278130788	4.125991439761776	280291
280272	Theory	percolation of hard disks	2014	-13.154145781819155	7.263597648387394	280299
280322	HPC	a bandwidth reduction algorithm for l-shaped and z-shaped grid structured graphs	2011	-12.261673357320175	6.2173713225840475	280349
280367	Theory	adjoint crystals and young walls for up(sl2)	2010	-14.779252576452262	6.353284841969411	280394
280462	Theory	erratum: the simplex and projective scaling algorithms as iteratively reweighted least squares methods	1991	-14.425539780485515	3.719451427776325	280489
280481	Theory	a proof of simmons' conjecture	2004	-12.828027132675247	6.871019613973492	280508
280487		differential cryptanalysis of q	2001	-11.716541391870546	5.816360663000465	280514
280558	Theory	common fixed points for suzuki-generalized nonexpansive maps	2013	-13.94339199231285	4.368540273439794	280585
280586	EDA	integer variable chi-based cross twisted ate pairing and its optimization for barreto-naehrig curve	2009	-12.140870413234609	5.984296958958992	280613
280701	Theory	refinement equations for generalized translations	2004	-14.901584915749936	4.26798460088019	280728
280858	Theory	on the girth of digraphs with high connectivity	2001	-11.959689639888802	6.806503146421035	280885
281004	Theory	a description of the resonance variety of a line combinatorics via combinatorial pencils	2009	-14.93893595528715	6.823520592414672	281031
281264	Logic	computable neighbourhoods of points in semicomputable manifolds	2017	-13.894326881311132	7.096831146836593	281291
281542	Theory	common fixed point theorems for a pair of weakly compatible mappings in fuzzy metric spaces	2011	-13.976751236150633	4.284458226749554	281569
281718	Theory	nonlinear codes defined by quadratic forms over gf(2)	1976	-13.96555106993444	5.772052987962731	281745
281754	Theory	properties and mis applications of combinatorial distribution functions	1985	-11.649985837871634	5.1531547205496935	281781
281909	Theory	dividing a polygon into two similar polygons	2011	-11.787125596072714	5.764456969409668	281936
282089	SE	a universal symmetry detection algorithm	2014	-12.056712015980608	5.826749005978909	282116
282144	Theory	properties of total restrained domination vertex critical graphs	2015	-11.871818333332437	6.759157387103692	282171
282245	EDA	quantifying nonclassicality of correlations based on the concept of nondisruptive local state identification	2016	-12.582381975883743	4.676412065129372	282272
282273	Theory	the theory of multidimensional persistence	2007	-13.630344500928755	5.4257939815348415	282300
282336	Theory	radicals of ore polynomials	2015	-11.350536180787433	6.215633379150693	282363
282382	EDA	on kirkman packing designs kpd({3, 4*, 5*}, v)s	2009	-11.864482523913654	6.261175731970749	282409
282427	Theory	a proof of a conjecture of buck, chan, and robbins on the expected value of the minimum assignment	2005	-14.612087602036002	4.095649037073081	282454
282457	Logic	bell's primeness criterion for w(2n + 1)	1997	-14.01545122451952	5.646115922109419	282484
282535	Theory	vectorial approximation by restricted rationals	1969	-14.567569221837408	4.402997350817105	282562
282746	Theory	solving polynomial systems over semialgebraic sets represented by cylindrical algebraic formulas	2012	-13.555403569726934	7.124583489859762	282773
282890	AI	minimised geometric buchberger algorithm for integer programming	2001	-13.524674551153524	3.8798688504840086	282917
282998	Vision	subroutines for computing normal probabilities of sets - computer experiences	2000	-14.23175077694581	6.811267997484013	283025
283387	Theory	the ith ramsey number for matchings	1986	-13.384005410003883	7.21590193223155	283414
283421	EDA	the ordering of experimental designs. a hilbert space approach	1974	-11.430104827606925	4.274657113636688	283448
283498	Theory	fundamental circuits and a characterization of binary matroids	1980	-11.337174963185115	5.766637806972923	283525
283591	Vision	"""generalized sequencing problem """"towers of hanoi"""""""	1985	-14.355508444246947	7.104297477511933	283618
283684	Theory	the bose-hubbard model is qma-complete	2015	-14.613818268363296	6.818529735737887	283711
283720	Logic	embedding and genus of intuitionistic fuzzy graphs on spheres	2018	-11.646684655791395	5.9321421611537755	283747
283736	Theory	a determinant with polynomial entries: 10714	2001	-11.277208137077716	4.9797850924657485	283763
283833	Theory	some inequalities via probabilistic method	2010	-12.36032955427462	4.200922413797372	283860
283941	ML	the irreducible six-dimensional complex representations of aut(f2) that are nontrivial-on f2	2000	-11.76384175822039	5.073013208932751	283968
284032	Theory	ternary and binary codes for a plane of order 12	1984	-11.894764131022963	5.9222254132708505	284059
284208	Theory	coding objects related to catalan numbers	2001	-12.067156783995411	6.1390695638262684	284235
284235	Robotics	invariant algebraic surfaces of the chen system	2011	-13.648306694752119	5.136579894849811	284262
284719	Logic	some results on theorem proving in geometry over finite fields	1993	-13.021034607221589	5.827858573415142	284746
284880	Theory	"""corrections to """"finding dominators via disjoint set union"""" [j. discrete algorithms 23 (2013) 2-20]"""	2014	-11.860585817164823	6.97434239506465	284907
284985	Visualization	physical uncertainty and information	1977	-11.237682448633835	4.143402068801999	285012
285026	Theory	the flaw in euler's proof of his polyhedral formula	2007	-12.300521887208056	5.519630499485612	285053
285254	Theory	graph encoding of 2d-gon tilings	2005	-14.105155697931323	7.4394154115870474	285281
285374	Vision	"""corrigendum to """"em enhancement of 3d head pose estimated by point at infinity"""" [image vis. comput. 25(2007) 1864-1874]"""	2008	-12.977806935441698	4.937005696141831	285401
285398	Theory	approximation of common fixed points of two quasi-nonexpansive multi-valued maps in banach spaces	2011	-14.332786344414446	3.751409925312581	285425
285400	Theory	on totally monotonic families of sequences	1999	-14.548858163604233	6.262038574845688	285427
285487	Crypto	approximating generators for integral arithmetic groups	2014	-13.443240532249865	4.986296894292646	285514
285498	Theory	generation of random objects	1992	-12.470586702536727	3.786064898551536	285525
285649	Theory	generalized vector mixed general quasi-variational-like inequalities in hausdorff topological vector spaces	2013	-14.085397522038836	4.397558857689671	285676
285821	Robotics	revisit of minimum-area enclosing rectangle of a convex polygon	2018	-14.265372184360075	7.000468311491045	285848
285862	AI	on quantitative-qualitative measure of inaccuracy and reversible symmetry	1993	-11.531306005607552	4.59846173682217	285889
285901	DB	a stochastic poisson structure	2009	-14.044024920543276	4.241921988381119	285928
285919	Theory	improved complexity bounds for counting points on hyperelliptic curves	2017	-14.939612796117466	6.637347377785084	285946
286334	Theory	constructions for cyclic sieving phenomena	2011	-14.51137499541358	6.75016704225548	286361
286354	Theory	quantum computing, error correcting quantum codes and algebraic curves	2015	-11.263463422541404	5.665404178600736	286381
286472	ML	binary trees, exploration processes, and an extended ray-knight theorem	2012	-12.643293065667635	5.025405613607892	286499
286493	NLP	two extensions of results of archimedes	2011	-11.166487100906377	4.967812550486802	286520
286532	Theory	a bijective proof of garsia's q-lagrange inversion theorem	1998	-14.62309523173208	6.754773607646091	286559
287167	Theory	a note on broom number and maximum edge-cut of graphs	2017	-11.778448827818522	6.697055308881417	287194
287436	Theory	the logarithmic average of sinai's walk in random environment	2000	-12.115739879949038	3.8241734403414	287463
287468	ML	edge-pairing isometries and counting dirichlet domains on the densest tessellation {12g-6, 3} for signal set design	2012	-14.38704339696038	7.195574221381652	287495
287489	ECom	self-dual tilings with respect to star-duality	2008	-14.867328831212802	6.978307168047878	287516
287532	Robotics	topology-oriented implementation—an approach to robust geometric algorithms	2000	-13.651211147320618	5.152952245189706	287559
287541	Theory	polynomial factorization sharp bounds, efficient algorithms	1993	-14.767970997937551	5.948193796935366	287568
287585	Theory	pulling back stability with applications to out ( f n ) and relatively hyperbolic groups	2017	-14.77148237049391	6.190356006398647	287612
287603	Theory	some elementary inequalities for distance-regular graphs	1993	-12.239650125197661	6.065756896454344	287630
287696	Theory	computer assisted solution of an equality problem of mean values	2012	-14.875582231790972	4.436905757733249	287723
287938	PL	quantum recursion and second quantisation: basic ideas and examples	2014	-11.341130704888112	4.286065059655364	287965
288173	Theory	circular chromatic index of generalized blanusa snarks	2008	-13.912950147608427	6.677533590827619	288200
288204	Theory	the space of solutions of coupled xorsat formulae	2013	-12.596221905789545	5.788245205460268	288231
288360	ML	discrete dynamical system framework for construction of connections between critical regions in lattice height data	2007	-13.052568808815833	6.6681514639788935	288387
288737	Theory	on the analysis of linear systems with algebraic and exponential time-varying parameters	1969	-11.883794975658526	3.8040660520453167	288764
288845	Crypto	plateaudness of kasami apn functions	2017	-14.868221601093461	6.644355359741841	288872
288927	Crypto	maximal domains of quasi-convexity and pseudo-convexity for quadratic functions	1972	-13.460481841580904	3.682874595617908	288954
289209	ML	light on the infinite group relaxation	2014	-14.667766984249148	6.194070463983373	289236
289314	AI	dispersive order of lifetimes of series systems in multiple-outlier weibull models	2016	-14.186501294049167	4.0952987897350255	289341
289576	Theory	an application of almost increasing sequences	2011	-13.36438218886514	4.615524418627586	289603
289716	Robotics	fuzzy permutation graph and its complements	2018	-11.574249645329473	6.4541511021834985	289743
289787	AI	quantum theory from rules on information acquisition	2017	-11.948895794655096	4.611821848259192	289814
289924	Theory	generating discrete planes with substitutions	2013	-14.90573618452252	6.7299114777871525	289951
290002	ML	parametric bisubmodular function minimization and its associated signed ring family	2017	-14.618845043899356	4.068252661836044	290029
290098	ML	symmetries of equivelar 4-toroids	2012	-14.661129643131027	6.994129868784758	290125
290111	ML	three algorithms for estimating the domain of validity of feedforward neural networks	1994	-13.47421893601046	5.229243355407747	290138
290233	ML	eureka: euler spiral splines	2007	-13.940067252393645	6.0148768676581215	290260
290268	EDA	on a problem on generalised fibonacci cubes	2003	-11.41930170395101	5.7443888950676705	290295
290473	ML	fiesta 3: cluster-parallelizable multiloop numerical calculations in physical regions	2014	-12.469623904362974	3.622045444226327	290500
290731	ML	entropy, combinatorial dimensions and random averages	2002	-13.172647931066106	7.153806672603857	290758
290835	Logic	equilibration and pivoting in linear algebraic systems	1968	-11.334121624904554	4.4017821929369125	290862
290862	DB	a note on measuring overlap	2007	-12.756783983806873	5.603032889475629	290889
290998	Graphics	proposal for a geometric algebra software package	1989	-14.917201775242347	5.0836263849953465	291025
291145	ML	selecting base points for the schreier-sims algorithm for matrix groups	1995	-12.591371973588846	6.11052034076425	291172
291164	Robotics	existence of positive solutions to p-kirchhoff-type problem without compactness conditions	2014	-14.730986210570293	4.044899744857387	291191
291188	ML	as you like it: localization via paired comparisons	2018	-12.21566646922521	3.824155576690136	291215
291365	ML	a computational algorithm for queue distributions via the pólya theory of enumeration	1979	-11.29575420789372	5.256027089793658	291392
291378	Logic	calculating presentations for certain kinds of quotient groups	1976	-13.24681177677328	6.320306167432814	291405
291421	Logic	pairings on lambda algebras	1991	-11.140650221437893	5.465003765308701	291448
291633	HCI	on the limitations of multivariate phase-type families	1990	-12.609344334715777	3.736909885351032	291660
291637	Theory	on triangle-free random graphs	2000	-11.859072461925841	6.773682246770635	291664
291841	Theory	a new entropy power inequality for integer-valued random variables	2014	-12.62074877034151	3.670883734568508	291868
291899	PL	software for enumerative and analytic combinatorics	2016	-12.996035374551553	6.7263693182701205	291926
292003	Theory	asymptotic expression of the linear discrete best lp-approximation	2006	-14.666543417994854	4.698063584234016	292030
292143	Vision	a divide and conquer algorithm for computing the singular value decomposition	1987	-11.357032977717244	3.8609250575050384	292170
292269	PL	on an algorithmic optimization in computation of involutive bases	2002	-12.719536162944253	5.4462891681827985	292296
292367	Theory	groupwise density cannot be much bigger than the unbounded number	2008	-13.101987943095047	6.730313601805492	292394
292398	Logic	invariant zeros of series connections of linear systems	1990	-11.647296549969498	4.0099248927320525	292425
292609	Theory	super connectivity of kronecker products of some graphs	2015	-11.58197114376472	5.931822699693179	292636
292722	Theory	the space of anosov diffeomorphisms	2014	-14.611627813467068	7.444302041715392	292749
292751	Visualization	parametric generalized linear system based on the notion of the t-norm	2013	-13.64755541641571	3.964173953080656	292778
293061	Theory	completely independent spanning trees in k-th power of graphs	2018	-11.571472422935146	7.248601838006076	293088
293071	Theory	domino tiling graphs	2013	-11.21310056486212	6.104732437215128	293098
293152	AI	a new, convexity based, necessary and sufficient vertex solution for robust stability check of linear interval parameter matrix families	2015	-14.170886915630406	3.6361261576880937	293179
293295	Theory	binary trees, left and right paths, wkb expansions, and painleve transcendents	2006	-13.276176863895087	5.1234161787993635	293322
293428	Theory	on (+1, -1)-matrices with vanishing permanent	1983	-13.370052979027099	6.619991147403484	293455
293462	Theory	an omega(n/lg n)1/2 lower bound on the number of additions necessary to compute 0-1 polynomials over the ring of integer polynomials	1979	-11.969896825665588	6.637842288257063	293489
293476	HPC	partial decoherence of histories and the diósi test	2009	-12.18497881085012	4.752463225017581	293503
293574	Theory	on the effective existence of schauder bases	2009	-14.872808837914778	4.393873489526464	293601
293587	Metrics	properties of some approaches to test observability of o–d flows based on link-volume counts	2010	-11.281038706626019	4.065927057795337	293614
293622	ML	entanglement of formation from optimal decomposition	2010	-12.743200413846733	4.707850167143404	293649
293743	Logic	planar cayley graphs with regular dual	1996	-11.90580096918041	6.345030384119657	293770
293747	ECom	erratum to: a nonstandard characterization of sequential equilibrium, perfect equilibrium, and proper equilibrium	2017	-11.805050927192823	4.397735651992089	293774
293755	Theory	improvements on generalized hamming weights of some trace codes	2006	-13.648824189111648	6.749716296429888	293782
294014	Crypto	some remarks on chung's law	2000	-12.351946460294617	5.151623255685339	294041
294030	Vision	selecting the roots of a small system of polynomial equations by tolerance based matching	2005	-13.579608062084752	4.796608422849657	294057
294564	Theory	characterizations of wreath products of one-class association schemes	2011	-13.062310391747566	6.315460737033459	294591
294719	Theory	unitary solutions to the yang-baxter equation in dimension four	2003	-11.676520143377633	4.8165629268374195	294746
294957	Theory	existence status of some previously open abelian difference sets	2003	-14.013222161021812	6.755004142096431	294984
295054	Logic	autoconjugate representers for linear monotone operators	2010	-14.822333618008525	3.680700237531096	295081
295145	Theory	a unified class of k-uniformly convex functions defined by the dziok-srivastava linear operator	2007	-14.468161964716199	4.153612231427527	295172
295307	Crypto	dilated floor functions that commute	2016	-12.8328574641471	6.613519444981972	295334
295338	Logic	surveyor's forum: the real costs of software	1979	-13.492858090112556	5.341594787640911	295365
295345	Robotics	a new dsatur-based algorithm for the equitable coloring problem	2013	-11.658209785397535	6.606364652536027	295372
295428	Metrics	quantum computing and quantum communications	1998	-12.458329760689011	4.634399744185443	295455
295474	Robotics	"""erratum to """"pseudo-triangulations, rigidity and motion planning"""""""	2006	-12.216469666732644	6.109881609234117	295501
295592	ML	symmetric iterative proportional fitting	2015	-13.418318205926893	3.616863372494127	295619
295643	EDA	interval analysis on directed acyclic graphs for global optimization	2005	-14.704468541313055	3.986626489245877	295670
295826	Crypto	ergodicity of noisy cellular automata: the coupling method and beyond	2016	-12.105846421610243	4.013322975427587	295853
295914	Theory	on matrices related with fibonacci and lucas numbers	2008	-13.57132976839242	6.19204913892817	295941
295978	Theory	on the covering of pairs by quadruples ii	1973	-13.810240000784686	6.163342729098122	296005
295988	Theory	successive edge-connectivity augmentation problems	1999	-12.177576375059983	7.236876383236197	296015
295996	Theory	independent transversals for countable set systems	1975	-14.085458394760998	6.738904935819051	296023
296039	Theory	inexact geometry	1980	-11.255536136966573	4.20541599879772	296066
296079	Theory	on rank two channels	2005	-11.829437011468439	5.320440521667485	296106
296087	Theory	average lower independence in trees and outerplanar graphs	2003	-11.792767257345483	6.620934471597048	296114
296294	EDA	a note on the cycle structures of automorphisms of 2-(v, k, 1) designs	1999	-12.186313271187315	6.160536492984782	296321
296295	Crypto	endomorphisms and cores of quadratic forms graphs in odd characteristic	2019	-13.364545936302367	6.036010652060247	296322
296591	Crypto	closure, complement, and union: 11059	2006	-11.128892067931806	5.878092960411643	296618
296630	HPC	evaluation of a new method to compute signs of determinants	1995	-14.548699583458252	5.16860739538119	296657
296666	Crypto	an elementary proof of the group law for elliptic curves	2017	-14.086311167298698	5.870758352458643	296693
296930	ML	graph polynomials and approximation of partition functions with loopy belief propagation	2009	-14.756681597112005	5.116970656605966	296957
296977	Theory	sharp upper bounds for the largest laplacian eigenvalue of mixed graphs	2013	-12.637227717924256	5.100290598103364	297004
297079	DB	a family of transformed copulas with a singular component	2019	-13.499196489242532	3.93620638309982	297106
297171	Theory	a classification of the six-point prime metrics	2000	-12.895946987779856	6.550492970528474	297198
297182	EDA	special cases of division	1995	-14.482361720835176	6.347939520607032	297209
297293	Theory	extensions of pg(3, 2) with bases	2002	-13.264915834697593	6.334319339607674	297320
297303	Metrics	correlation structure of landscapes of np-complete optimization problems at finite temperatures	2004	-12.217010720320893	5.0963727032180355	297330
297868	Vision	a boolean characterization of three-dimensional simple points	1996	-12.661061553812216	6.806028487270307	297895
297876	AI	on approximating planar metrics by tree metrics	2001	-11.952024155096312	6.555637392765696	297903
297929	AI	computing halfspace depth and regression depth	2014	-13.360124826035936	4.745957676785512	297956
297997	Logic	on the two-dimensional marcinkiewicz means with respect to walsh-kaczmarz system	2006	-14.722022165412627	4.373185392077237	298024
298121	Vision	on connection between second-degree exterior and symmetric derivations of kähler modules	2018	-11.823858132031527	4.4015221848726505	298148
298263	Robotics	h-exceptional family, (phi, phi, psi)-exceptional family and the solution for vip	2010	-14.386067928396466	4.474436653033294	298290
