id	area	title	year	x	y	ix
877068	Theory	algebraic structure of chromatic graphs associated with the ramsey number n(3, 3, 3;2)	1971	-12.335148100875175	6.8874222722709	877095
877081	Theory	an alternative approach to comprehensive gröbner bases	2003	-14.377766492589572	5.743568472486122	877108
877209	Theory	semidefinite programming, multivariate orthogonal polynomials, and codes in spherical caps	2009	-14.797837559719806	5.2349062694600015	877236
877241	Vision	using a finite projective plane with a duality for decentralized consensus protocols	1992	-14.571035910263273	7.3061512732367095	877268
877262	Theory	linearization of a specific family of bézout matrices	2017	-12.498590985774973	5.127937774349699	877289
877324	Theory	separating topological noise from features using persistent entropy	2016	-13.239109395752028	5.9481266428418715	877351
877414	Theory	solving polynomial strict inequalities using cylindrical algebraic decomposition	1993	-14.41344879396826	5.028772082176264	877441
877506	Theory	the class of functions spirallike with respect to a boundary point	2004	-11.739404229618607	4.926110441569562	877533
877967	Theory	lower bounds based on the exponential time hypothesis: edge clique cover	2016	-11.701457796359515	7.146827738007749	877994
878165	Logic	an extension of the erdös - szekeres theorem on large angles	1987	-14.284342652398818	7.219003649423213	878192
878255	Robotics	an analysis of the map seeking circuit and monte carlo extensions	2009	-11.523347463396954	3.884075074297142	878282
878267	Theory	an explicit formula for the number of permutations with a given number of alternating runs	2012	-14.612950344139788	7.200710059889783	878294
878299	ML	neuro-spike communications with multiple synapses under inter-neuron interference	2018	-12.693610233204463	5.129378660209003	878326
878359	Theory	a correct proof of the heuristic gcd algorithm	2002	-12.667896948894501	5.939864793160122	878386
878797	DB	letter to the editor - note on the letter by morávek and vlach	1967	-12.986653640334413	4.934193334066069	878824
878832	Theory	blocking sets of almost rédei type	1997	-13.456489852121036	6.867010083104402	878859
879070	ML	a note on the hermite interpolation	2014	-13.210746252819304	4.693047793111777	879097
879653	Theory	erratum to: tight bound for matching	2013	-11.59263762698148	6.018080132527644	879680
879655	AI	an adaptive approach to cube-based quasi-monte carlo integration on rd	2010	-13.925167481823694	4.788136106302698	879682
879669	Theory	sandwich bounds for joint entropy	2007	-12.381933092366678	7.419127378849478	879696
879711	ML	permanents, transport polytopes and positive definite kernels on histograms	2007	-14.80483609192082	7.221140814739816	879738
880051	Theory	ghys's theorem and semi-osculating conics of planar curves	2007	-11.644078777826733	5.045128395600746	880078
880167	Theory	r68-35 optimal generation of arbitrary functions	1968	-12.927937709838885	5.0576220428053915	880194
880200	Theory	a bijection for ordered factorizations	1990	-12.118546396863325	6.1800777746321724	880227
880245	Theory	characterizing polynomial time computability of rational and real functions	2009	-13.189989162738852	5.9902360140784605	880272
880274	Theory	the right angle to look at orthogonal sets	2016	-14.635946115950446	6.676113029064047	880301
880386	Embedded	on intersecting ifs fractals with lines	2013	-14.636095397724425	6.009428893103093	880413
880471	Theory	a general hungarian method for the algebraic transportation problem	1978	-11.388495100539371	6.869506202353785	880498
880525	Logic	transformation systems for incidence structures	1999	-14.360893365964374	7.063844539337523	880552
880745	Theory	when scott is weak on the top	1997	-14.833375521757246	4.641401486256329	880772
880870	ML	smo lattices for the parallel training of support vector machines	2015	-11.580046160497911	4.437517528076577	880897
881466	ECom	ein satz über die entropie von untermonoiden (a theorem on the entropy of submonoids)	1988	-14.187951802292375	6.344632319831559	881493
881940	Theory	a standard proof of andrews' conjecture for 4φ3-series	2015	-11.80793508215402	5.6384307233692725	881967
882025	Theory	denesting by bounded degree radicals	2000	-11.785544501437066	7.141396992289491	882052
882246	Logic	inequalities for code pairs	1988	-12.997998591447725	6.900577618869345	882273
882404	Theory	computing bounds for the probability of the union of events by different methods	2012	-12.593432267767215	3.816490169212588	882431
882465	Vision	computing partial walsh transform from the algebraic normal form of a boolean function	2003	-13.637536114959508	5.989798521911963	882492
882468	Theory	stability of switched linear systems and the convergence of random products	2009	-14.190451974261627	4.211360253957491	882495
882604	Theory	on generalized some integral inequalities for local fractional integrals	2016	-14.926630120221036	4.3501986025400114	882631
882709	Crypto	sufficient conditions for carathéodory functions	2006	-14.2191419978904	4.497448393376615	882736
882791	Crypto	cyclic and negacyclic codes of length 2m over finite fields	2015	-11.972314387069805	5.861168059700919	882818
882982	Theory	equations for the modular curve x1(n) and models of elliptic curves with torsion points	2010	-12.818054363026555	5.510257597667012	883009
883195	Logic	extremal trees with respect to dominance order	2005	-11.61406743368053	5.816141898654736	883222
883266	Theory	probabilistic algorithm for computing the dimension of real algebraic sets	2015	-14.52996437381136	6.345938329320807	883293
883542	Theory	on quantum information	2001	-11.102232479859726	4.501684530667626	883569
883623	AI	some new results for multi-valued fractional evolution equations	2015	-14.61779428118442	4.0056449761326585	883650
883674	Theory	on the link of some semi-bent functions with kloosterman sums	2011	-12.49814613414206	6.107969193349577	883701
883693	Graphics	the surface/surface intersection problem by means of matrix based representations	2012	-14.871851308639991	5.156518918765912	883720
883835	Theory	a note on condition numbers for generalized inverse a(2)t, s and constrained linear systems	2010	-11.70112672993104	3.824747933221423	883862
884060	Theory	an identity for the divisor generating function arising from sorting theory	1981	-13.959998179256072	6.260406800369368	884087
884246	ML	violation of clauser-horne-shimony-holt inequality and teleportation enhanced for a class of two-qubit x-states resulting from entanglement swapping	2015	-12.358534907594494	4.827171740587269	884273
884643	Theory	the spectrum for three-times repeated blocks in a s3(2, 3, v)	1988	-13.946289934744414	7.195522559698232	884670
885018	Theory	on the p-version of the schwab-borchardt mean	2014	-14.471761004997926	4.450558934894547	885045
885061	Theory	on a characterization of convexity-preserving maps, davidon's collinear scalings and karmarkar's projective transformations	2001	-14.850656745553913	7.119284949646517	885088
885137	Theory	distance independence domination in graphs	1995	-11.617650563625492	6.397965631779965	885164
885241	Theory	hybrid classification: using axis-parallel and oblique subdivisions of the attribute space (extended abstract)	1995	-12.426915831383019	6.511107865909134	885268
885254	PL	integer affine transformations of parametric ℤ-polytopes and applications to loop nest optimization	2012	-13.057479874497595	6.874311168013536	885281
885366	Theory	on the strong convergence for weighted sums of asymptotically almost negatively associated random variables	2014	-12.909354527075875	3.7058964849921257	885393
885957	ML	multiple kronecker covering graphs	2008	-13.927513936391867	6.483941041827321	885984
886195	NLP	forking and dividing in ntp₂ theories	2012	-11.14495800888906	5.960318983213668	886222
886205	Theory	the negativity of wigner function as a measure of quantum correlations	2016	-12.216729458885027	4.7307092234446655	886232
886206	NLP	grobner bases - a computational approach to commutative algebra (thomas becker and volker weispfenning)	1994	-13.58716542271002	5.50213168651607	886233
886307	Theory	byte weight enumerators of codes over p and modular forms over a totally real field	2017	-12.06142243819591	5.902644095774421	886334
886380	Theory	twisted zastava and q-whittaker functions	2017	-14.578367706222785	6.1825161467551295	886407
886519	Robotics	monte carlo extension of quasi-monte carlo	1998	-12.022675922386346	4.124902885562925	886546
886719	Theory	on a certain duality for segmented minmax problems	1998	-13.526691192336486	3.762561469661879	886746
886902	DB	constructing canonical bases of quantized enveloping algebras	2002	-13.667813061726505	4.648981319778166	886929
887213	Theory	the capacity region of a class of deterministic interference channels	1982	-12.1692754069375	3.7208453938684367	887240
887424	Theory	certification of algorithm 30: numerical solution of the polynomial equation	1967	-11.600433616457787	4.175246042684402	887451
887444	Theory	minimum degree, independence number and (a, b, k)-critical graphs	2013	-12.443423459013813	7.160361126612713	887471
887657	Theory	polynomial approximation for the number of all possible endpoints of a random walk on a metric graph	2018	-11.323221795409506	5.329646055669164	887684
887695	Embedded	doing quantum mechanics with control theory	2000	-14.597308314081356	4.2751194118707625	887722
887852	Theory	a fast heuristic for approximating the minimum weight triangulation (extended abstract)	1996	-11.327599473532867	7.140612052032381	887879
887974	Theory	on the discrete version of picone's identity	2008	-14.131519210792463	6.248630894113858	888001
888100	ML	exact characterization for subdifferentials of a special optimal value function	2018	-14.22964634897388	4.00413942850241	888127
888181	Theory	well-formed set representations of solids	1999	-13.313970171739433	5.59876444082925	888208
888392	Theory	on the comparison of volumes of quantum states	2010	-13.956519095958635	4.3262452757261896	888419
888460	HPC	polynomial operations: numerical performance in matrix diophantine equation	1994	-11.734642077934067	4.700042662148271	888487
888500	Theory	symmetries in the entropy space	2016	-14.706900380828376	7.338201419512079	888527
888620	Logic	automorphisms of models of true arithmetic: recognizing some basic open subgroups	1994	-12.058467883514428	6.103935060414695	888647
888726	Theory	the goodness of path or cycle with respect to multiple copies of complete graphs of order three	2016	-11.129190474058476	6.277930769482462	888753
889216	Theory	differential in cartesian product graphs	2016	-11.397895427631678	5.842930264244827	889243
889347	AI	on separable self-complementary graphs	2002	-13.11351807797468	6.7169922429230775	889374
889371	ML	(3, 2)-track layout of bipartite graph subdivisions	2007	-11.79967793708603	6.854543241215539	889398
889639	Logic	all 2-regular leaves of partial 6-cycle systems	2005	-11.795520800782905	6.44964617645121	889666
889694	DB	matroids with nine elements	2008	-13.204009008988173	6.310696327023907	889721
889875	Theory	davenport-schinzel sequences and their geometric applications (micha sharir and pankaj k. agarwal)	1996	-12.140723310114733	7.015524923019544	889902
890074	Security	high fidelity ghz generation within nearby nodes	2018	-11.628197679768537	4.491856822603556	890101
890080	Theory	fixed points for w-contractive multimaps	2009	-13.77984818963551	5.101131057056481	890107
890241	ML	comparison of cad-based methods for computation of rational function limits	2018	-14.295969907120172	4.534992403383304	890268
890468	Theory	a-tint: a polymake extension for algorithmic tropical intersection theory	2014	-14.489283715889163	6.358845923062412	890495
890892	Vision	genus and dimension of digital images and their time- and space-efficient computation	2008	-13.764138111304517	7.2441839930400445	890919
891227	Logic	on the complexity of solving bivariate systems: the case of non-singular solutions	2013	-14.297013916419195	5.082893321051508	891254
891361	Theory	inequalities for means of restricted first-passage times in percolation theory	1999	-14.669720507697756	4.390244655968984	891388
891510	Theory	hidden symmetry subgroup problems	2013	-14.020719767685005	6.004685892457715	891537
891521	ML	validated special functions software	2010	-12.021071514183841	4.8913767287257235	891548
891638	Crypto	quantum key distribution with combined conjugate coding and information overloading	2016	-11.569316054764117	4.703120213899476	891665
891682	Robotics	steiner minimum trees for equidistant points on two sides of an angle	1996	-12.101657049013133	6.677305173202765	891709
891965	Theory	universality in short-time critical gluodynamics with heat-bath-inspired algorithms	2010	-11.80759793204457	3.6703072077731935	891992
892107	Robotics	simplicial algorithm to find zero points of a function with special structure on a simplotope	1991	-14.222918796237595	3.974180204959294	892134
892122	Theory	hamiltonian κ-factors in graphs	1997	-11.4831407389191	5.71961877219815	892149
892148	Theory	a complete and simple parametrization of controllers for a nonstandard h∞ control problem	1998	-14.70678095184736	4.554059043798662	892175
892294	Theory	graph equivalence and characterization via a continuous evolution of a physical analog	2002	-13.750372181714187	7.314890358237463	892321
892478	Theory	subcritical sevastyanov branching processes with nonhomogeneous poisson immigration	2017	-11.523260958311386	4.24842868718918	892505
892632	Crypto	a lower bound on the complexity of polynomial multiplication over finite fields	2005	-14.752270085020704	5.590662223543415	892659
892891	Vision	characterizing the entropy function region via extreme rays	2012	-13.198756839417346	5.4542401018432605	892918
893958	Theory	asymptotic enumeration of tournaments with a given score sequence containing a specified digraph	2000	-12.747917990952265	7.240714219479036	893985
894019	ML	quantum fisher information matrix for unitary processes: closed relation for su(2)	2018	-12.929025081201816	4.51030195064656	894046
894194	Theory	a cyclically 6-edge-connected snark of order 118	1996	-14.354460887767885	7.102163813580284	894221
894279	Vision	on the embedding of complements of some hyperbolic planes	2006	-11.448122436739993	5.029025171536366	894306
894289	EDA	a lattice path equality: 11106	2006	-11.559668084412902	5.818799519052558	894316
894311	Theory	random generation of 2 times 2 times ... times 2 times j contingency tables	2004	-12.727642962416546	4.278583266684335	894338
894343	DB	a non-hamiltonian, nondegenerate delaunay triangulation	1987	-12.348616483745232	6.6269265646416695	894370
894522	NLP	second order asymptotics of optimal approximate conversion for probability distributions and entangled states and its application to locc cloning	2013	-12.443897956606305	3.6737814258544006	894549
894687	Theory	classroom note: hoffman's circle untangled	1997	-13.426205123218875	5.986712672041082	894714
894775	Theory	harder-narasimhan theory for linear codes	2016	-14.209545508168032	4.688522355282661	894802
894782	Theory	-equitable b-coloring of graphs	2018	-11.713531558011002	6.632208249099747	894809
894831	Theory	characterization of rotation words generated by homeomorphisms on a circle	2015	-14.801121486625464	6.962784745101375	894858
894846	Logic	improving interpolants of non-convex polyhedra with linear arithmetic and probably approximatley correct learning for bounded linear arrangements	2018	-11.498269105426338	4.7056215960819205	894873
894926	NLP	dimension quotients of metabelian lie rings	2017	-14.314277674960326	6.3986641047800505	894953
895160	Theory	on special kinds of involute and evolute curves in 4-dimensional minkowski space	2018	-11.800441622092706	5.18919326445425	895187
895209	Crypto	existence of ground state solutions of nehari-pohozaev type for fractional schrödinger-poisson systems with a general potential	2018	-11.460326151121595	4.378112572551098	895236
895252	Theory	distance and discrete space	2005	-14.2463906517026	6.855888721852662	895279
895462	Crypto	function evaluation in unnormalized arithmetic	1964	-14.896542837831204	4.956538293010753	895489
895952	Theory	stereo numbers, cosets, and the configuration symmetry group	1986	-11.830861773843234	5.597197085134672	895979
896006	AI	hybrid coincidence and common fixed point theorems in menger probabilistic metric spaces under a strict contractive condition with an application	2014	-14.360251747926743	4.051188157751964	896033
896092	Theory	efficient protocols of generating bipartite classical distributions and quantum states	2013	-11.346609078999107	5.853886953667884	896119
896249	Graphics	note on blended linear multistep formulas	1986	-13.946085078368355	4.735862470902294	896276
896256	AI	generalization: one technique of computational and applied mathematical methodology	2008	-13.79847564347241	4.336911937574887	896283
896384	Logic	"""addendum to: """"the bolzano-weierstrass theorem is the jump of weak kőnig's lemma"""" [ann. pure appl. logic 163 (6) (2012) 623-655]"""	2017	-13.226690063102305	5.205174201623323	896411
896675	DB	asymptotic expressions of certain type of matrix integrals	2001	-14.629099443747805	3.9809380421985185	896702
896728	Theory	fixed point theorems for multivalued mappings in probabilistic metric spaces	1997	-13.531295280855062	4.42533320164258	896755
896934	Theory	accurate computation of the moore-penrose inverse of strictly totally positive matrices	2019	-12.895974832172385	4.833448471529791	896961
896974	Theory	a fast algorithm for computing order-k fibonacci numbers	1983	-12.226793963390213	6.462430429980585	897001
897003	Theory	satisfaction of polynomial constraints over finite domains using function values	2017	-14.67057137664836	7.213981006664917	897030
897034	AI	matrices of fidelities for ensembles of quantum states and the holevo quantity	2012	-12.581178415168937	4.411484767531536	897061
897269	SE	minimal time function with respect to a set of directions: basic properties and applications	2016	-14.232189849712313	3.913556592975878	897296
897594	ECom	winquist and the atkin-swinnerton-dyer partition congruences for modulus 11	2000	-12.427118136518546	5.957727588790044	897621
897608	Theory	the intersection problem for twin bowtie and near bowtie systems	2001	-11.77455949879907	6.016870614832077	897635
897661	Logic	cellular automata with vanishing particles	2003	-12.108378714455034	4.676806135141984	897688
897720	Theory	entanglement distillation from greenberger-horne-zeilinger shares	2016	-13.196719920283527	6.254033210967241	897747
897940	Theory	on evaluation codes coming from a tower of function fields	2018	-13.782903931226775	6.3343406150107455	897967
897999	Logic	possible primitive notions for geometry of spine spaces	2010	-13.754762859953127	6.0997479492868205	898026
898273	Theory	criticality of switching classes of reversible 2-structures labeled by an abelian group	2017	-11.314964936065063	5.997230076712258	898300
898682	DB	are unique subgraphs not easier to find?	2018	-11.281515221311894	6.305894654970354	898709
898827	Graphics	landau symbols	2015	-12.475776250644515	5.441142840374148	898854
899077	Theory	an information-theoretic method in combinatorial theory	1977	-11.3315741259764	4.701204720174987	899104
899190	Theory	on approximating arbitrary metrices by tree metrics	1998	-12.716845491862344	6.340937535933051	899217
899261	Logic	geometric representation in the theory of pseudo-finite fields	2017	-14.944471982094965	7.067502619982773	899288
899421	Theory	a characterization of weighted approximations by the post-widder and the gamma operators, ii	2010	-14.056276729092405	4.034349939795887	899448
899493	Theory	a short proof of the 3d distance theorem	1979	-11.25139009758996	5.6272369936365285	899520
899702	Vision	a simple gasket derived from the logistic parabola	1990	-14.411163249790896	7.005757638003512	899729
899729	Logic	quantifier elimination over finite fields using gröbner bases	2011	-13.851727262739985	5.855237295776166	899756
900040	Theory	recursive statistics on words	1996	-12.377300060256855	5.984077860543977	900067
900093	Theory	a short proof of moll's minimal conjecture	2017	-12.924472899475589	6.010121897692807	900120
900326	Logic	square and non-reflection in the context of pk lambda	2006	-11.44149421335468	5.423502110286359	900353
900402	ML	some operations on quaternion numbers	2009	-13.655446240264867	5.740172937900711	900429
900477	ML	bounding the expectation of a saddle function with application to stochastic programming	1994	-13.916609353699705	3.6566106878899967	900504
900484	Theory	log-concavity and the spectral gap of stochastic matrices	1997	-14.885202425560575	5.110134360205033	900511
900847	Vision	approximative fast nearest-neighbour recognition	1983	-11.121223594965887	7.143014669928832	900874
900924	ML	on the number of minimal partitions of a box into boxes	2006	-11.673836124467869	6.1350460050135815	900951
900972	Theory	the growth of polynomials outside of a compact set - the bernstein-walsh inequality revisited	2017	-11.126134635207668	5.091538490776282	900999
901051	Theory	remark on algorithm 337 [c1]: calculation of a polynomial and its derivative values by horner scheme	1969	-12.864405327643187	5.2057254729769715	901078
901076	Theory	complexity in some physical systems	2001	-12.866990790224223	4.676165082127583	901103
901296	Theory	on the number of iterations required by von neumann addition	2001	-14.761670818683806	4.38301317323884	901323
901390	Theory	holographic algorithms: the power of dimensionality resolved	2007	-12.639834063492902	6.041094230849769	901417
901396	AI	"""a note on """"approximate solution of dual fuzzy matrix equations"""""""	2017	-11.990500387632569	3.800467312997287	901423
901472	Logic	multi-dimensional sets recognizable in all abstract numeration systems	2012	-13.864295305709767	6.198782261925026	901499
901538	Theory	the crossing number of c(3k+1;{1, k})	2007	-12.400321414957958	7.081272416878351	901565
901906	Theory	index calculus in class groups of plane curves of small degree	2005	-14.890696736833869	6.939770686595622	901933
901919	HPC	on embedding various networks into the hypercube using matrix transformations	1996	-13.507565657142026	7.396466724460629	901946
902303	Theory	on constrained 2-partitions of monochromatic sets and generalizations in the sense of erdos-ginzburg-ziv	2005	-11.604480078254333	6.0841140360140935	902330
902493	Robotics	a new kind of fuzzy relation equations	2009	-14.172297483058696	4.06973420127263	902520
902668	Theory	best proximity point for generalized proximal weak contractions in complete metric space	2014	-14.228277940076804	3.764522350029252	902695
902835	Theory	polynomial time quantum algorithm for the computation of the unit group of a number field	2005	-14.843375315279241	6.3531471838828315	902862
903025	Vision	heuristics for minimum edge length rectangular partitions of rectilinear figures	1983	-12.009626212033286	7.4329325614054795	903052
903199	Theory	a hypergeometric problem	2009	-14.745907603182433	5.665187673857805	903226
903278	AI	loomis-sikorski representation of monotone sigma-complete effect algebras	2006	-14.476324157328866	4.280496504663838	903305
903497	Theory	a sufficient condition for graphs to be super k-restricted edge connected	2017	-11.720030547258814	6.555441239293449	903524
903658	Theory	more on embedding partial totally symmetric quasigroups	1996	-11.778626418358192	5.943909959163006	903685
903980	PL	on matroids which have precisely one basis in common	1988	-11.32632565255763	5.853985288229686	904007
904427	Theory	quantum walks on the hypercube	2002	-12.522006738592673	4.762277115417306	904454
904497	Theory	new criteria for the semiconvergence of interval matrices	2005	-12.734304900619373	5.694703928676555	904524
904595	Theory	the circular chromatic index of graphs of high girth	2007	-12.669080373184887	7.199630907924878	904622
904717	ML	quantization for uniform distributions on equilateral triangles	2015	-13.93277028437943	4.880702664374447	904744
904797	NLP	the derivative of the conjugacy between skew tent maps	2018	-12.010469706725807	5.6395768538231685	904824
904839	Theory	substitutive structure of jeandel-rao aperiodic tilings	2018	-14.55412028122914	7.423951300228912	904866
904924	AI	automated and readable simplification of trigonometric expressions	2006	-14.811862477403615	4.747168518907996	904951
905018	Theory	initial segments of the σ20 enumeration degrees	2016	-11.185630727736518	5.960648985781513	905045
905164	Theory	the wide diameters of regular hyper-stars and folded hyper-stars	2018	-11.478598939360454	6.096147572979772	905191
905186	Theory	new bounds for circulant johnson-lindenstrauss embeddings	2013	-14.308823721391215	4.293282756763046	905213
905319	Vision	on the projection-based commuting solutions of the yang-baxter matrix equation	2018	-12.344662871328518	3.890683968608843	905346
905580	ML	a relationship between the second derivatives of a convex function and of its conjugate	1977	-14.173198537219125	3.9517733396070267	905607
905655	ML	improved recovery guarantees for phase retrieval from coded diffraction patterns	2014	-12.43569409360816	4.514599297707949	905682
905664	EDA	a geometric approach to maximum-speed n-dimensional continuous linear interpolation in rectangular grids	1998	-14.244542560470336	4.583253635474108	905691
905852	Crypto	matrix representation of a solution of a combinatorial problem of the group theory	2012	-14.869267599512296	6.876222707277018	905879
905916	Theory	a spectral order for infinite dimensional quantum spaces: a preliminary report	2007	-12.808480114447176	4.278044581838062	905943
906249	EDA	novel method for parameter estimation of newton's rings based on cfrft and er-wca	2018	-11.681342808094485	3.62495451118542	906276
