id	area	title	year	x	y	ix
656287	DB	on the generalized fibonacci matrix of order 2^k sequence {g^(2k)n}	2001	-11.52718187917012	5.535464591296448	656314
656338	Vision	a tetrahedron with all faces congruent: 10934	2003	-12.010240278218225	5.650231080573982	656365
656620	Vision	an evolutionary measure for image matching	1998	-11.279182364138034	6.2246866330326105	656647
656731	Theory	generalized tricobsthal and generalized tribonacci polynomials	2018	-14.496887767983267	5.807093893755328	656758
656947	Vision	numerical residues	2007	-12.867623253163874	5.684261301893949	656974
656949	Theory	generation of cluster-type entangled coherent states using weak nonlinearities	2011	-11.404546666012658	4.475489082686543	656976
656987	DB	a unifying approach to evaluating block accesses in database organizations	1988	-12.034300215775044	5.76912730726062	657014
657063	DB	look - a lazy object-oriented kernel for geometric computation	2000	-13.694883213066143	5.216152834219987	657090
657175	Robotics	a robust controller based on fractional structure for mimo plant with multiple delays	2012	-11.10515483543517	3.632032867902351	657202
657214	ML	divergence functions in dually flat spaces and their properties	2018	-14.447409179956026	4.178522745341585	657241
657228	Robotics	toric ideals, real toric varieties, and the moment map	2002	-14.638038280132847	5.218296486095963	657255
657860	EDA	the use of plackett-burman designs to construct split-plot designs	2005	-12.226809497550388	6.128625417953353	657887
658021	Theory	a lower bound for hellbronn's triangle problem in d dimensions	1999	-13.30514002867874	7.415270222105986	658048
658059	Theory	random projections of regular simplices	1992	-14.825286652520115	4.993890212630152	658086
658136	SE	regular ordering and applications in control policies	2002	-12.022739923158419	4.964456767447487	658163
658459	Theory	curves in $\mathbb{r}^4$ and two-rich points	2017	-14.5137449847955	7.264329801525598	658486
658731	Crypto	a remark on spherical equations in free metabelian groups	2017	-11.70008952593626	5.003583722765319	658758
658824	AI	asymptotic behavior of müntz-christoffel functions at the endpoints	2010	-14.287188614021185	5.224337316218929	658851
658853	EDA	a fast and robust reliability evaluation algorithm for generalized multi-state $k$ -out-of-$n$  systems	2009	-12.860821489667265	5.557885685594404	658880
658937	Metrics	the limiting behavior of non-cylindrical elementary cellular automata	1992	-11.144071723068215	5.13419552644798	658964
659031	PL	post unimodular transformations and isomorphisms for linear behaviors	2017	-14.442082061793235	6.3441226382788924	659058
659111	Theory	an algorithmic regularity lemma for lp regular sparse matrices	2017	-11.471748258583686	6.815355125163921	659138
659443	Theory	"""errata to """"on the largest prime factor of x2-1"""""""	2014	-11.658685387194266	5.560065432174133	659470
659465	Theory	polynomial ideals for sandpiles and their gröbner bases	2002	-14.634110479928887	6.288642836315365	659492
659536	Theory	noise stable halfspaces are close to very small juntas	2016	-14.573785722567624	5.031848530758265	659563
659545	DB	how to compare the incomparable	1987	-11.177879453035848	6.4508958639695475	659572
659736	Robotics	the numerical inversion of functions from the plane to the plane	1996	-12.048334851430994	4.412520563514833	659763
659756	Crypto	the discrete logarithm in logarithmic -class groups and its applications in k-theory	2004	-13.74197548841285	6.438928645365845	659783
659883	PL	panda: a software for polyhedral transformations	2015	-13.238779867694873	5.593330258130672	659910
659935	Crypto	weierstrass semigroups on the giulietti-korchmáros curve	2018	-12.023516943255911	5.105296499080188	659962
660095	Vision	an alternating sum involving unsigned stirling numbers: 10863	2003	-12.628071164256971	5.802740988956738	660122
660476	Theory	smooth and sharp thresholds for random k-xor-cnf satisfiability	2003	-14.318390054185837	4.256654719683042	660503
660596	Theory	computational complexity of two-dimensional regions	1995	-13.284831300572598	6.993031365027071	660623
660656	Theory	an existence theorem for nonlinear complementarity problems	2009	-14.007316357549794	3.8197170916798	660683
660804	Crypto	almost desarguesian maximal partial spreads	2001	-13.115083989689099	6.711739389187338	660831
660826	Theory	some characterizations of lower probabilities and other monotone capacities through the use of möbius inversion	2008	-13.776881470749945	5.716427509100008	660853
660889	Logic	ortholinear and paralinear semi-copulas	2014	-14.175177138242665	6.06602610233459	660916
660990	Theory	multilevel adaptive methods for partial differential equations (stephen f. mccormick)	1991	-12.085992375283167	3.785343944905436	661017
661133	AI	well separated pair decomposition for unit-disk graph	2016	-11.479523874136634	6.651478691819516	661160
661177	Theory	selecting polynomials for the function field sieve	2013	-14.846038209674521	6.293045049654287	661204
661211	Theory	determination of all possible orders of weight 16 circulant weighing matrices	2006	-12.823899362600566	5.4731771916832175	661238
661276	EDA	optimal algorithms of minimization in the class of functions with the lipschitz condition	1971	-12.482618097321186	3.666100054245329	661303
661453	Theory	colored stochastic dominance problems	2016	-14.023581236470175	7.44047471497676	661480
661527	NLP	an adaptive document generation based on matrix of contents	2000	-11.115760601123625	5.036680021923014	661554
661566	Theory	classifying clustering schemes	2013	-13.491815630762364	4.468837470877754	661593
661776	AI	a new result on high energy solutions for schrödinger-kirchhoff type equations in rn	2014	-12.775202151340757	4.940728286366007	661803
662840	Logic	verification of hybrid systems with linear differential inclusions using ellipsoidal approximations	2000	-14.243192465946953	3.8904279263249775	662867
662856	Logic	existence of weak solutions for a class of (p, q)-laplacian systems on resonance	2015	-14.178074195660932	4.9446686510328695	662883
662874	Robotics	matching extendability of balanced hypercubes	2016	-11.781091620052687	6.81044842588046	662901
663490	Robotics	two measures of dependence	2016	-12.065361391990445	4.2477396071509235	663517
663575	Theory	symbolic computation with sequences	2006	-11.626737546277713	4.69036556885149	663602
663681	Theory	poisson-dirichlet and gem invariant distributions for split-and-merge transformations of an interval partition	2002	-12.806494376352775	4.024033263662694	663708
663763	Vision	a note on lagrangians of 4-uniform hypergraphs	2015	-12.144304939559273	6.608152035153428	663790
663852	Theory	homotopies and the universal fixed point property	2015	-14.469544335333874	4.747301802362991	663879
664476	Robotics	non-modular computation of polynomial gcd's using trial division	1979	-11.412445867792725	5.292599507563829	664503
664568	Theory	extremal f-trees and embedding spaces for molecular graphs	1983	-13.47710659981609	5.996121267792151	664595
664770	Theory	a deterministic algorithm for isolating real roots of a real polynomial	2011	-14.353531699920394	5.92525210029675	664797
665686	Logic	exponential functional equation on spheres	2010	-14.145220571739895	4.687469295819073	665713
666214	EDA	abstract hyperovals and hadamard designs	1997	-11.95802220924626	5.374187703287358	666241
666280	Logic	multiple factorizations of words and defect effect	2002	-12.98754269120984	5.885085578872897	666307
666347	Theory	univalence of a new general integral operator associated with the q-hypergeometric function	2013	-14.75840524125645	4.416112595284644	666374
666590	Theory	φ-entropic measures of correlation	2018	-13.031943447837426	4.822857078962484	666617
666647	Theory	central limit theorem for the horton-strahler bifurcation ratio of general branch order	2017	-12.3609755660119	3.8924700644320778	666674
666672	Theory	expected value of the minimal basis of random matroid and distributions of q-analogs of order statistics	2006	-13.779528535083491	6.4345931124366045	666699
666716	Theory	graph-theoretical analysis of the fractal transform	1995	-13.337227083164382	7.335860901675151	666743
667025	Theory	a generalized sampling theorem for reconstructions in arbitrary bases	2010	-11.454508102767008	4.0187129950534635	667052
667203	DB	the henstock-stieltjes integral for fuzzy-number-valued functions	2012	-13.826872868727062	4.1673605483527405	667230
667464	Theory	algorithms for symbolic polynomials	2006	-14.486724496257406	5.4608847331790775	667491
667575	Theory	a short proof of minc's conjecture	1978	-13.596979623910835	6.404518647784787	667602
667644	Theory	monic polynomials in z[x] with roots in the unit disc	2001	-13.002097758433981	5.29137459284825	667671
667881	Theory	copnumber of graphs with strong isometric dimension two	2001	-11.31807219222404	5.299758531496591	667908
667882	Theory	when is the direct product of generalized mycielskians a cover graph?	2014	-11.493672882712069	5.979454417558728	667909
667894	Crypto	boolean functions with maximum algebraic immunity: further extensions of the carlet-feng construction	2018	-11.276052231887245	5.90791020923885	667921
668252	Theory	an involution on derangements	2001	-14.45809607189014	6.621005089285041	668279
668299	Theory	a five color zero-sum generalization	2006	-12.075629594236801	6.751062488631871	668326
668495	EDA	minimum-energy multi-wavelets tight frames associated with two scaling functions	2010	-14.183981091639815	4.854295903569686	668522
668648	AI	side lengths of pseudoconvex fullerene patches	2012	-14.43279248504134	7.2827903705029025	668675
668943	Theory	a helly theorem for intersections of sets starshaped via staircase n-paths	2006	-12.036862444072346	6.487534113300308	668970
669035	ECom	on some results for the l(2, 1)-labeling on cartesian sum graphs	2016	-11.91222308428436	6.387814847016988	669062
669115	Theory	minimal solutions of the isometry equation	2018	-13.695407158544233	5.679697280989044	669142
669189	Theory	on chung-teicher type strong law for arrays of vector-valued random variables	2004	-13.905141158419115	4.2584969272148046	669216
669208	HPC	systolic designs for bernoulli's method	1990	-11.594494298406634	3.673116298236072	669235
669338	Theory	a note on quantum correlations in werner states under two collective noises	2014	-12.282979693944464	4.642202833566152	669365
669368	Theory	a scaling limit for the degree distribution in sublinear preferential attachment schemes	2016	-12.804268629730402	5.277190433951012	669395
669712	Logic	computing the torsion of the p-ramified module of a number field	2015	-14.833499434790568	6.212874455343231	669739
669759	Networks	on the physical design of receiver for molecular communications	2015	-12.669413641122064	5.060319818755452	669786
669901	Robotics	cauchy criterion for the henstock-kurzweil integrability of fuzzy number-valued functions	2014	-13.976405493557179	4.220967276781832	669928
670020	ML	some inequalities for differentiable convex mapping with application to weighted midpoint formula and higher moments of random variables	2014	-13.929858931350205	4.0717687819214055	670047
670023	Theory	minus edge domination in graphs	2009	-11.988279594364407	6.830687439748671	670050
670302	Arch	fast computation of gröbner bases of ideals of f[x, y]	2009	-13.99087211192074	5.666122598308122	670329
670327	Vision	matching of affine transformed images by using similarity based on local concentric features	1997	-11.6292463842391	5.0230382944170255	670354
670515	Theory	constructive non-commutative rank computation is in deterministic polynomial time	2017	-14.122843599321824	6.551892990032476	670542
670532	Theory	increasing the size of a network by a constant factor can increase performance by more than a constant factor	1988	-12.479836401043	5.7558652021169125	670559
670548	ML	on a strange recursion of golomb	1996	-14.751451050318055	6.057947319573071	670575
670899	Graphics	using program transformations to derive line-drawing algorithms	1982	-13.056765697754207	5.1781170523773135	670926
670941	Theory	state-independent uncertainty relations and entanglement detection	2018	-12.611135421277895	4.249418659987292	670968
671150	Arch	the entanglement level and the detection of quantum data transfer correctness in short qutrit spin chains	2017	-12.084597232400872	5.076964611845646	671177
671167	Logic	efficient algorithms for the algebraic analysis of system reliability	2009	-13.96182777640351	5.918761717040126	671194
671202	Theory	applications of finite fields to dynamical systems and reverse engineering problems	2004	-13.665957634385267	5.539298474937077	671229
671375	ML	on asymmetric (0, 1)-matrices with given row and column sum vectors	1995	-12.417901987144187	6.178742911235268	671402
671424	Robotics	the conditions of solvability of the inverse problem of operator equation for a pattern recognition neurooperator model	2014	-13.768196652964413	3.9229585504303177	671451
671512	Theory	an inequality between intersection numbers of a distance-regular graph	1987	-14.473443913162287	7.341822916880624	671539
671574	Theory	a method to refine the discrete jensen's inequality for convex and mid-convex functions	2011	-13.867285885529474	3.8304195480298735	671601
671624	ML	on maximal curves related to chebyshev polynomials	2018	-14.23410253600682	5.087171284269624	671651
671708	Crypto	when a boolean function can be expressed as the sum of two bent functions	2014	-14.95471364221931	6.407858066640942	671735
671787	Crypto	elliptic curves with a given number of points	2004	-13.915286424347437	6.199875928874585	671814
672195	Theory	incidence numbers of complexes and polytopes	1976	-11.745539557969124	5.8919888705353305	672222
672228	Theory	a new method of nodal numbering for cyclic and acyclic structures	1992	-11.595527002943278	6.737549372196398	672255
672365	DB	modelling waves with computer algebra	1991	-14.131136365765135	4.616773837761506	672392
672421	Theory	pro-p completions of groups of cohomological dimension 2	2016	-14.715267665070266	6.802340643464754	672448
672499	ML	computing homfly polynomials of 2-bridge links from 4-plat representation	2014	-11.389409324122525	5.623520724529356	672526
672789	Theory	the role of covering matroid in covering-based rough set and matroid	2012	-11.167698896068533	5.992713133272519	672816
672957	Theory	worm colorings of planar graphs	2017	-11.94130566774375	6.8895131611650475	672984
673007	ML	duality of ends	2010	-14.284843886999235	7.372113224687816	673034
673457	PL	border basis representation of a general quotient algebra	2012	-13.42084542210136	5.680924444654753	673484
673542	Theory	fixed point theorems of multivalued monotone mappings in ordered metric spaces	2010	-13.774745643076074	4.455147591071023	673569
673755	Robotics	the characterization of some groups in terms of fuzzy orders	2011	-13.659763422284147	6.609754486367664	673782
673816	Theory	necessary conditions for discontinuities of multidimensional size functions	2008	-13.733013495345448	4.61761719729444	673843
674019	Logic	an improved completion theorem of fuzzy metric spaces	2011	-13.590115936427717	4.838113211122924	674046
674109	NLP	complexity of shift spaces on semigroups	2018	-13.792032004884264	5.2855915746299535	674136
674258	Theory	strong convergence theorem for nonexpansive mappings on star-shaped sets in hilbert spaces	2012	-14.600586424838236	3.7179202402574862	674285
674399	Theory	on orthonormal bases and translates	2016	-13.065544432952485	4.29750661719051	674426
674537	ML	hadamard matrices, baumert-hall units, four-symbol sequences, pulse compression, and surface wave encodings	1974	-14.247481513612955	6.955257552449588	674564
674619	Theory	on graceful and cordial labeling of shell graphs	2011	-11.809166085284724	6.5250327088408575	674646
674718	Theory	multivariate stochastic dominance and moments	1991	-12.942486148673787	4.017787720665845	674745
674756	Arch	three dimensional integer rotation transform and improvement of its compatibility	2009	-14.208671617884276	6.865923331603719	674783
674767	Vision	when abc is equilateral: 10838	2002	-11.452189906448192	5.38943819738369	674794
674819	ML	creating repeating hyperbolic patterns	1981	-13.229975745804278	7.210450861826747	674846
674883	NLP	tilings by 1 × 1 and 2 × 2	2016	-11.884614153460078	5.927982706885456	674910
675181	NLP	a generalization of hh f-divergence	2018	-12.236386529824493	3.9403633790184247	675208
675342	EDA	bubble: relationship diagrams using iterative vector approximation	1978	-11.323197436433274	7.341549775660328	675369
675426	EDA	"""correction to """"multiple constrained folding of programmable logic arrays: theory and applications"""""""	1984	-13.65123085091533	5.638441430309624	675453
675536	Crypto	relation between discrete and continuous teleportation using linear elements	2004	-12.459743640969995	4.560265703622678	675563
675627	NLP	fractional permissions without the fractions	2011	-11.405852325285904	7.058450073000237	675654
675871	Vision	finding optimal non-overlapping subset of extracted image objects	2008	-11.574586253897893	3.7721554844407374	675898
675896	Logic	sharp upper bounds on the clar number of fullerene graphs	2018	-12.521914894742606	7.025994277618028	675923
675920	ML	calculation of the obstruction ideals of morin maps	2011	-14.381443763234484	6.777354693070415	675947
676088	Theory	the formulas of the solution for linear-order random fuzzy differential equations	2015	-14.687752207827034	4.380017493568446	676115
676190	AI	multipartite entanglement in grover’s search algorithm	2014	-12.606905953372134	5.147239906638593	676217
676203	HPC	load balancing for virtual worlds by splitting and merging spatial regions	2018	-12.886337474457974	6.060707026770433	676230
676437	DB	a new method to obtain series for 1/π and 1/π2	2006	-14.791807443363304	6.003268117651611	676464
676745	Theory	new linear codes of dimensions 5 and 6 over gf(8)	2002	-12.006050941480375	6.047016040186527	676772
676747	ML	homology computations via acyclic subspace	2012	-11.273062907017733	7.36150621376733	676774
677001	ML	algorithms for drawing media	2004	-13.46531686530343	7.280751394022236	677028
677034	ML	mid size cliques are more common in real world networks than triangles	2014	-11.844135864610118	6.817608152790967	677061
677137	ML	classification of finite dynamical systems	2001	-12.732547547258411	4.579825774422166	677164
677524	Theory	proof of a conjecture on hadamard 2-groups	1993	-11.832617388887124	5.712825168808387	677551
677705	Theory	holographic transformation, belief propagation and loop calculus for quantum information science	2015	-13.799488508356953	5.043807952724245	677732
677863	Theory	monte carlo integration with small random bits	2010	-13.903822935024314	4.851001052231606	677890
677926	Theory	a holevo-type bound for a hilbert schmidt distance measure	2015	-12.568147333492439	4.473100126118523	677953
677955	Theory	nonexistence of certain planes of order 10 and 12	1973	-13.630837694334108	6.699642790746303	677982
678165	Theory	general vertex-distinguishing total coloring of complete bipartite graphs	2016	-12.122579071351597	6.9996819271596475	678192
678264	Theory	composing power series over a finite ring in essentially linear time	1998	-14.335729888798266	5.537614882428424	678291
678416	Theory	existence of hsolssoms of type 2nu1	2008	-13.025048912290938	6.566706098179259	678443
678536	Theory	cupping delta20 enumeration degrees to 0 e'	2009	-13.010989671725099	7.03137488707488	678563
678594	Vision	on the codeword length distribution of t-codes	2012	-11.504238019534444	5.900985723709664	678621
678644	Logic	comparing acceleration techniques for the dixon and macaulay resultants (abstract only)	2008	-14.011082979783984	4.751244764911184	678671
678893	ML	approximation by complex phillips-stancu operators in compact disks under exponential growth conditions	2014	-14.549343635268114	4.560904445763882	678920
678961	ML	noncrossing partitions with fixed points having specific properties	2015	-11.813175133096859	6.153681184491688	678988
679026	Theory	the generalizations of hilbert's inequality	2008	-12.630644422230516	4.7979261568941824	679053
679059	Theory	an upper bound of the number of tests in pooling designs for the error-tolerant complex model	2008	-11.498706043690085	6.465888981839459	679086
679080	NLP	finite unions of closed subgroups of the n-dimensional torus	1990	-13.494612286911464	7.210851827810884	679107
679168	Theory	extended lorentz cones and mixed complementarity problems	2015	-14.568317505357685	3.880063750934253	679195
679182	Crypto	from gem back to dirichlet via hoppe's urn	1997	-11.93322746291526	3.892815874541838	679209
679195	NLP	invited paper: computable partial solids and voxels sets	1999	-12.937251325146358	5.624049755832691	679222
679196	HPC	majorization and extremal ph-distributions (abstract only)	2012	-12.702160716086864	3.795040003971312	679223
679298	Theory	yet another approach to the extended ternary golay code	2002	-13.573601333341315	6.426792247620393	679325
679333	OS	on the nonexistence of perfect codes in j(2w+p2, w)	2005	-11.368957305001345	5.3862856964202885	679360
679662	Crypto	a type ii lattice of norm 8 in dimension 72	2010	-14.62084941511904	6.692690031096133	679689
679730	Theory	separation theorems for simplicity 26-surfaces	2002	-14.040584073542359	6.211541176798844	679757
680027	Theory	a linear bound on the diameter of the transportation polytope	2006	-12.400261332420664	7.403095081853107	680054
680125	HPC	a six-color procedure for the parallel solution of elliptic systems using the finite quadtree structures	1989	-11.698784780163518	5.1109608730747444	680152
680199	Theory	on the construction of boolean functions with optimal algebraic immunity based on factorization of numbers of variables	2013	-11.683215414852068	5.9831466977803265	680226
680309	AI	the eigenvalue problem in configuration interaction calculations: a computer program based on a new derivation of the algorithm of davidson	1980	-11.91155520745702	3.9657552984257465	680336
680358	Crypto	a modified non-sieving quadratic sieve for factoring simple blur integers	2007	-14.866824719542725	5.837317408101437	680385
680375	Theory	on a subclass of the class of rapidly varying sequences	2015	-14.075248230063105	4.380179710475523	680402
680753	Theory	factoring cartesian-product graphs at logarithmic cost per edge	1990	-12.405385930864048	7.15877301842304	680780
680765	Theory	fast reconstruction of high-qubit quantum states via low rate measurements	2017	-11.765649122871276	4.509683668195359	680792
680995	Theory	on finite cn-geometries with thick lines	1996	-11.682777908724553	5.470232049203902	681022
681028	EDA	coreduction homology algorithm	2009	-12.679616453857205	7.271358704207808	681055
681078	Robotics	general entropy of general measures	2002	-12.189216673137953	4.241102655134483	681105
681147	EDA	direct analogues of the sheffer stroke in m-valued logic	1976	-11.328833828392035	5.338831456656693	681174
681154	Theory	a new framework for solving the spatial network problems based on line graphs	2014	-11.530207943930874	7.343811175316797	681181
681160	Crypto	domination & separation applied to the quadratic assignment proglem	1993	-11.37664255773209	6.3948386481655435	681187
681504	AI	bounds for degree-based network entropies	2015	-12.370712499814196	5.026561518885097	681531
681670	Theory	edge-magic labelings of petersen graphs p(n, 2)	2001	-11.829646390187794	6.594688112535969	681697
682161	Theory	an inequality on laplacian eigenvalues of connected graphs	2012	-12.452989547975047	5.243057279277076	682188
682188	AI	iteration algorithm for solving ax	2006	-14.182950895353882	4.092432827846977	682215
682366	Theory	"""correction to """"a unified approach for the stability robustness of polynomials in a convex set"""""""	1997	-11.772339680784784	4.204163861301545	682393
682458	Theory	horospherical contraction and hamiltonian functions on an algebraic group	2015	-11.517328826241245	5.4448710639004645	682485
682555	Theory	channels with additive asymptotically mean stationary noise	1981	-11.588242566856618	3.684161110051386	682582
682569	Logic	limit reliability functions of some homogeneous regular series-parallel and parallel-series systems of higher order	2001	-13.276082661930976	4.3831517385717795	682596
682597	AI	criteria for generalized invex monotonicities without condition c	2006	-14.263815862790365	3.861065004894625	682624
682721	Theory	explicit error bounds for lazy reversible markov chain monte carlo	2009	-12.809963960347694	3.7748000312116634	682748
682859	Theory	density matrix formalism of duality quantum computer and the solution of zero-wave-function paradox	2012	-12.018600538972676	4.8704779487207315	682886
682932	Theory	a large deviation rate and central limit theorem for horton ratios	1991	-12.146095567060886	4.943995143806385	682959
682962	Logic	on the long-range dependence of fractional poisson and negative binomial processes	2016	-12.655069593118448	3.888830479570101	682989
683109	Theory	computing minimum 2-edge-connected steiner networks in the euclidean plane	2019	-12.214713427383131	7.3652794572919555	683136
683175	HPC	a comparative study of gauge fixing procedures on the connection machines cm2 and cm5	1994	-12.086685900976748	5.6964789223175565	683202
683479	Theory	large matrix, small rank	2009	-14.75073834346552	5.81365861344387	683506
683512	EDA	a modified simplicial algorithm for convex maximization based on an extension of ω-subdivision	2018	-11.438014573133733	4.4033010292506365	683539
683532	Crypto	linear diophantine equation discrete log problem, matrix decomposition problem and the aa-beta-cryptosystem	2011	-11.961801716581054	4.060093843809538	683559
683688	Theory	exact equiconsistency results for δ31-sets of reals	1992	-14.219423064370256	5.922807100079798	683715
