id	area	title	year	x	y	ix
465122	Theory	an omega(n-4/3) lower bound on the monotone network complexity of the n-th degree convolution	1985	-13.094843467748447	6.431527140377699	465149
465441	Theory	groups of morley rank 4	2016	-14.389081577019109	6.952017143300178	465468
465490	Theory	simulation of a quantum algorithm for phase estimation	2015	-13.969617377682045	5.328696071603301	465517
465565	Vision	counting minimal paths in digital geometry	1991	-13.151049079599627	7.018004470385567	465592
465599	Theory	a lower bound for the sturm-liouville eigenvalue problem on a quantum computer	2006	-14.220303627626869	5.563919477829302	465626
465713	Theory	discrete morse theory for free chain complexes	2005	-13.499689041767596	6.362233343976344	465740
465725	Vision	new families of binary sequence pairs with three-level correlation and odd composite length	2016	-12.11069933558774	6.182736435646503	465752
465921	Theory	computing expected transition events in reducible markov chains	2009	-11.930790488668466	3.8616721187214087	465948
466043	Theory	problem 47 : posed by aviezri s. fraenkel	1983	-11.206592784281318	5.662328552800065	466070
466250	Theory	"""erratum to """"an improved randomized approximation algorithm for maximum triangle packing"""" [discrete appl. math. 157 (2009) 1640-1646]"""	2010	-13.390647241846487	6.422653451785939	466277
466314	Theory	ascending runs of sequences of geometrically distributed random variables: a probabilistic analysis	2003	-12.445671990734498	3.7387862978167004	466341
466328	Logic	maximum subsets of (0, 1] with no solutions to x+y = kz	1996	-12.165764089600346	6.41800386938524	466355
466530	Graphics	algorithm 714: celefunt: a portable test package for complex elementary functions	1993	-13.440699916515722	4.600508362235421	466557
466625	Theory	weighted sampling of outer products	2014	-13.704942793343179	3.9005919650832577	466652
466751	Theory	an improved bound for the size of the set a/a+a	2018	-12.295384504696493	6.320404958105419	466778
466827	Theory	fusion relation in products of association schemes	2002	-13.768859642579052	6.6253539570565785	466854
466830	PL	the bloch-grüneisen integrals. some analytic expressions	1999	-12.810452838792274	3.710588126144649	466857
466895	ML	structured estimation with atomic norms: general bounds and applications	2015	-14.27349591805563	3.9122340584133064	466922
466934	ML	minimal and canonical images	2017	-14.182621355916115	6.86418709251256	466961
467037	Theory	why ellipsoid constraints, ellipsoid clusters, and riemannian space-time: dvoretzky's theorem revisited	2014	-12.94422373487416	3.6483305067187284	467064
467066	Theory	a construction of distance-regular graphs from subspaces in d-bounded distance-regular graphs	2011	-12.100387351072223	6.0242323045130215	467093
467358	AI	sexi: an expert identification package	1990	-13.524560141690312	5.115879311688835	467385
467414	Theory	recent progress and open problems in algorithmic convex geometry	2010	-12.931718158023006	6.662198838802898	467441
468014	DB	some applications of differential subordination	2007	-14.80173767346292	4.650938488977296	468041
468060	Theory	methods of search for solving polynomial equations	1970	-14.12006878305088	4.424569831521515	468087
468192	DB	a case study in comparison based complexity: finding the nearest value(s)	1991	-11.135279364495045	6.5927685978050805	468219
468280	Theory	ν-tamari lattices via subword complexes	2017	-14.5013061928708	7.086278950914898	468307
468317	Crypto	closed paths in the coset diagrams for < y, t : y6 = t6 = 1 > acting on real quadratic fields	2004	-11.767519639750445	5.841852491499533	468344
468833	Theory	on functions with the cauchy difference bounded by a functional. part ii	2005	-14.306293238135993	5.133576615532398	468860
468835	EDA	integer farkas lemma	2015	-14.557362278096196	3.868811397323197	468862
468981	Theory	shadows and shifting	1991	-11.22870281364948	5.852381432892942	469008
468989	Logic	on templeman averages and variation functions	2012	-14.417557659629367	6.411350755650946	469016
469111	Logic	the arithmetic precision of ray-polygon intersection testing	2001	-13.008037920696015	5.597405351159795	469138
469186	Crypto	constructing a diversified fcsr with a given connection integer	2011	-11.31477685533058	5.742215990039455	469213
469487	Theory	repeated edges in 2-factorizations	1990	-13.406001036869993	6.8480024464688105	469514
469499	Theory	a test problem generator for discrete linear l1 approximation problems	1980	-13.358486352761053	4.299964189154755	469526
469836	ML	typicality graphs:large deviation analysis	2010	-11.192269827669136	7.018502674574914	469863
469932	Theory	on instability of the ergodic limit theorems with respect to small violations of algorithmic randomness	2011	-12.30835080186626	4.533883667265241	469959
470222	NLP	computing in the 3nls domain using first order solitons	2009	-11.507254909004526	3.947500502027228	470249
470410	Theory	gröbner bases in function rings - a guide for introducing reduction relations to algebraic structures	2005	-13.768232109742131	5.560195085289867	470437
470513	Theory	tiling space with the aid of the holomorph	1973	-12.202766943600016	6.05611351604533	470540
470579	ML	fast implementation of waterfall based on graphs	2005	-11.302551377036837	6.9723688136833974	470606
470643	Theory	non-hamiltonian cubic planar maps	1974	-12.300258343893109	6.155802526120113	470670
470678	ML	simplification of real elementary functions	1989	-14.592806419809909	5.0283923027530255	470705
470770	Theory	on ℓ4: ℓ2 ratio of functions with restricted fourier support	2018	-14.52706181548558	5.373923823843092	470797
471310	Theory	stochastic models in queueing theory (j. medhi)	1993	-14.167232124693422	5.587413290806381	471337
471414	Theory	on distance function among finite set of points	2012	-12.972168922723386	7.3718108025741405	471441
471418	Robotics	fully dynamic higher connectivity for planar graphs	2016	-11.680523217873526	6.594448023704983	471445
471646	Theory	understanding branch cuts of expressions	2013	-14.093459872096208	5.192795049653493	471673
471651	Theory	on forming committees	2011	-12.169190101940513	6.908936879744827	471678
471750	Embedded	generalized hölder's inequality for g-integral	2016	-14.225691070676278	4.226281133676508	471777
472170	Theory	laplacian matrices of weighted digraphs represented as quantum states	2017	-13.054944432828117	5.383419793493061	472197
472275	NLP	burrows' zeta: exploring and evaluating variants and parameters	2018	-11.490714242955336	5.582497108455915	472302
472397	EDA	the graphical asymmetric traveling salesman polyhedron	1990	-11.65216046195786	6.901747477878437	472424
472490	Arch	a duality relation connecting different quantum generalizations of the conditional rényi entropy	2014	-12.388392339976184	4.187684154336935	472517
472599	DB	nonlinear recurrences and arithmetic codes	1977	-14.05778472328817	5.3910847090210785	472626
472631	Theory	comparison of convex hulls and box hulls	2005	-12.013722404682445	6.013157899138854	472658
472699	Theory	on 3-degeneracy of some c7-free plane graphs with application to choosability	2009	-11.90134348157177	6.619800522129687	472726
472753	Theory	frankl's conjecture is true for modular lattices	1998	-12.27563010827776	6.201055503649855	472780
472806	ML	bent functions in c and d outside the completed maiorana-mcfarland class	2017	-11.601838508351655	5.781814555393174	472833
472881	Theory	the nonnegative rank of a matrix: hard problems, easy solutions	2017	-14.385403956611698	6.354364971361783	472908
472967	Theory	the crossing number of c5 × cn	1996	-11.447983765771694	6.220949580178959	472994
473384	Theory	new methods providing high degree polynomials with small mahler measure	2003	-14.899707228918912	5.296746990641922	473411
473431	Vision	a graph theoretic approach to the grouping of ordering data	1972	-11.224434485419156	6.335622789360436	473458
473708	Theory	stable border bases for ideals of points	2008	-14.7749006445801	4.84291587790814	473735
473758	AI	on the equivalence of b-rigidity and c-rigidity for quasitoric manifolds	2014	-14.111730951187791	6.3281116042959695	473785
473843	Theory	some remarks on hajo's' conjecture	2005	-11.146774522263856	5.526657761657089	473870
474376	Theory	computation of powers of multivariate polynomials over the integers	1972	-12.943021812487506	5.439466230433217	474403
474455	Theory	strongly spanning trailable graphs with short longest paths	2018	-11.483204724641025	6.7324042554364825	474482
474537	Crypto	computing isogenies between elliptic curves over fpn using couveignes's algorithm	2000	-14.722941925557576	6.142309036026294	474564
474550	Visualization	jim blinn's corner-uppers and downers	1992	-13.613273272404337	5.291398181862429	474577
475106	Theory	a note on quadratic sigma-polynomials	1988	-13.366905170242932	6.436266155585834	475133
475178	AI	"""erratum to """"blackwell's theorem for t-related fuzzy variables"""""""	2013	-12.24968384434978	4.820563784836113	475205
475548	Crypto	some estimates for character sums and applications	2001	-14.959602695317464	6.048348919055697	475575
475645	Theory	quantum markov chains and logarithmic trace inequalities	2017	-12.50735569747662	4.696683686419894	475672
475874	Theory	on the adjacent vertex distinguishing edge chromatic number of graphs	2016	-12.048364896249357	6.790358276521541	475901
476065	Theory	a note on level-2 condition numbers	2005	-13.823939924721156	4.799280287942176	476092
476122	HCI	inequalities for medians of two simplices	2004	-13.862728155766225	6.234690532506584	476149
476157	Theory	on the d-complexity of strings	2010	-13.218391807492495	6.421091673615487	476184
476420	Theory	some new classes of upper embeddable graphs	2010	-11.650282419775197	6.083737208360224	476447
476485	Theory	dualistic hessian structures among the thermodynamic potentials in the κ-thermostatistics	2015	-12.527244185542841	3.906939602138325	476512
476540	Theory	nc algorithms for computing the number of perfect matchings in k3, 3-free graphs and related problems	1988	-11.806532174763209	6.753735945632684	476567
476731	Theory	stability of persistence diagrams	2005	-13.490535818081062	5.726711094396273	476758
476845	Theory	inference about the tail of a distribution: improvementon the hill estimator	2010	-12.269239937285626	3.8031190410976277	476872
476927	Crypto	using symmetric functions to describe the solution set of a zero dimensional ideal	1995	-13.299589173342955	5.134926958775568	476954
476985	Crypto	domain extenders for uowhf: a finite binary tree algorithm	2003	-11.112414854220257	5.9131739214178625	477012
477190	Robotics	copula-based universal integrals	2013	-13.45225595199014	4.72599598876091	477217
477265	Logic	generalized homogeneous polynomials for efficient template-based nonlinear invariant synthesis	2018	-12.390156567146098	5.5961302607042684	477292
477401	Theory	bounded linear regularity of convex sets in banach spaces and its applications	2006	-14.759452072378163	4.248375899158267	477428
477666	Logic	orthogonal functionals of independent-increment processes	1976	-14.706015373529825	4.939346912730977	477693
477866	Theory	notes on deterministic programming of quantum observables and channels	2015	-12.788470285646731	5.614500592732654	477893
477913	ECom	on the strict, uniform and compact-open topologies on an algebra	2018	-14.478979426735258	3.99312072055558	477940
478035	Theory	optimal bounds on functions of quantum states under quantum channels	2016	-12.661458081912059	4.651303299254407	478062
478047	NLP	performance of the hqrii1 diagonalization routine	1988	-11.400499116175153	4.151327403291842	478074
478122	Crypto	modular forms and elliptic curves over the field of fifth roots of unity	2013	-14.466191777101846	6.280580820293517	478149
478375	Visualization	a corner-finding algorithm for chain-coded curves	1977	-11.990207675514307	5.175584327770005	478402
478495	Theory	distributional results for costs of partial match queries in asymmetric k-dimensional tries	2004	-12.62506923978508	5.087331171161167	478522
478635	EDA	worst-case identification of nonlinear fading memory systems	1992	-12.849850694313115	3.8315390490986205	478662
478749	Vision	efficient computation of 3-d moments in terms of an object's partition	2002	-13.31943679253752	5.633423424203316	478776
478870	Vision	helly spaces and radon measures on complete lines	2012	-14.674361540710322	7.192656941806424	478897
478953	Theory	an improved lower bound on polynomial multiplication	1980	-14.914672269947195	5.326618900411594	478980
478999	Theory	a primitive trinomial of degree 6972593	2005	-13.760771231234925	6.295771329576524	479026
479046	Theory	irreducible triangulations of surfaces	1996	-11.823252436323733	5.79226476419672	479073
479297	Vision	an analytical approach to a class of battles	1974	-11.657179975391408	4.1493822242186615	479324
479391	Theory	edge colorings of embedded graphs	2000	-11.850362564216757	6.5541153362101285	479418
479525	Theory	eigenvalue confinement and spectral gap for random simplicial complexes	2017	-14.781065707833802	4.945162186142229	479552
479835	Theory	equality conditions for the quantum f-relative entropy and generalized data processing inequalities	2010	-13.147705080707452	4.290105033730103	479862
480069	Theory	criss-cross methods: a fresh view on pivot algorithms	1997	-11.954056898063884	7.053161146025577	480096
480276	Theory	lower bounds on sizes of cutting plane proofs for modular coloring principles	1996	-11.478360525747238	6.953181936321861	480303
481304	Vision	voronoï diagrams in projective geometry and sweep circle algorithms for constructing circle-based voronoï diagrams	2001	-13.694085610949529	7.38161403648798	481331
481365	ML	supplements to a class of logarithmically completely monotonic functions associated with the gamma function	2008	-14.029113102096328	4.4309287803955275	481392
481591	Theory	entanglement of formation and concurrence for mixed states	2008	-12.458661261997404	4.871898926985997	481618
481625	Theory	on replica placement in high-availability storage under correlated failure	2015	-13.414197424577287	6.703341945775311	481652
481814	AI	kukles revisited: advances in computing techniques	2010	-13.738322634238187	4.876461117366055	481841
481821	Theory	refinements on the hermite-hadamard inequalities for r-convex functions	2013	-13.55396326942282	3.874047745087605	481848
481960	Theory	rainbow restrained domination numbers in graphs	2016	-11.934673276811322	6.778653035672759	481987
482082	Theory	a kantorovich variant of a new type bernstein-stancu polynomials	2012	-14.251018869897823	4.322077865958355	482109
482104	Logic	an arithmetic of complete permutations with constraints, ii: case studies	1988	-13.925524148452961	6.122280076789376	482131
482602	Theory	an extension of foster's network theorem	1994	-12.752322706937964	5.259670038103369	482629
482764	AI	unified (r, s)-entropy and its bivariate measures	1991	-12.324714050049241	3.657356372382506	482791
482879	Theory	deriving some expansion theorems for nonlinear functional equations by an algorithm	1987	-14.906707903229616	4.489024323238469	482906
482955	DB	classification and enumeration of finite semigroups	2010	-14.6599023391873	6.0907305966802765	482982
483116	Theory	universal group with twenty-one defining relations	1977	-11.239340259648817	5.779433388918407	483143
483726	DB	certain subclasses of meromorphically multivalent functions associated with the linear operator	2011	-14.853979010180616	4.4636500180916885	483753
483786	Theory	simulating arbitrary pair-interactions by a given hamiltonian: graph-theoretical bounds on the time-complexity	2002	-14.123926583114939	6.3876168762342695	483813
483982	ML	some new classes of integral trees with diameters 4 and 6	2000	-12.806399310740838	7.007523047826318	484009
483996	Crypto	a construction of vh-sequences and its application to binary asymmetric error-correcting codes	2019	-11.45326630326918	5.913640088580356	484023
484252	AI	a class of convex fuzzy mappings	2002	-13.542131900488474	3.9637569180674035	484279
484272	HPC	computing persistent homology with various coefficient fields in a single pass	2014	-14.221997394461892	6.675996424809903	484299
484317	ML	a class of bistochastic positive optimal maps in md(ℂ)	2015	-14.17691882559079	6.390316529329968	484344
484362	Theory	an improvement of the boshier-nomura bound	1994	-13.671239869258635	7.16935929499506	484389
484663	ECom	on certain sufficient conditions for close-to-convexity	2007	-14.335383931689506	4.455951252171925	484690
484670	Theory	the number of solutions of a class of linear complementarity problems	1979	-11.210277582624052	3.634506779739688	484697
484841	Theory	certain subclasses of meromorphically multivalent functions associated with generalized hypergeometric function	2008	-14.682598281132426	4.628321797942216	484868
484875	Theory	asymptotic properties of triangular arrays of numbers	1973	-11.755752740647829	4.467310715825012	484902
484917	AI	some families of z4-cyclic codes	2004	-13.791646969295291	6.517914180034489	484944
485030	Graphics	introduction to gauss	1994	-14.551953217150052	4.7986745122253405	485057
485287	Theory	a note on a paper by m. mignotte	1987	-14.604380229951275	5.246881857726817	485314
485313	Theory	a note on the hardness of the characteristic polynomial	2000	-11.45746079974164	6.310719721682969	485340
485416	Visualization	a fast least squares qrd-based algorithm for complex data	1994	-11.642901554163366	4.253162865658313	485443
485521	Graphics	optimizing the double description method for normal surface enumeration	2010	-13.035196342072384	7.138765229461478	485548
485670	ML	probability distributions	2014	-12.677828411195916	3.9764955501059975	485697
486155	ML	on linearity of pan-integral and pan-integrable functions space	2017	-14.29566949515986	4.457793100061597	486182
486197	AI	mathematics of social choice - voting, compensation, and division	2010	-14.36210677725341	4.139982829311655	486224
486282	Robotics	powers of matrices over distributive lattices--a review	2003	-11.990994232451381	6.503057440783678	486309
486300	Theory	erratum: numer. math. (1998) 79: 371-396	2001	-13.273323061293347	4.853297424695622	486327
486663	ML	about gordan's algorithm for binary forms	2017	-14.301561716618664	6.037587017058683	486690
486686	Theory	gamma-algebra algorithms for canonical hyper complex representations	1979	-14.41603190630808	5.706038437007539	486713
486718	Theory	markov bases of conditional independence models for permutations	2009	-12.703863393622685	4.2506874787510185	486745
486775	Crypto	mildness and the density of rational points on certain transcendental curves	2011	-14.962474639596115	5.64030641164022	486802
486849	Theory	double-dual types over the banach space c(k)	2005	-14.08495901949266	4.907144023925505	486876
486912	Theory	hamilton cycles in regular graphs	1978	-11.731191901618734	6.5403250176954035	486939
486969	ML	optimization of structured mean field objectives	2009	-12.621045170815833	4.608069807442933	486996
487028	Graphics	building an orthonormal basis from a unit vector	1999	-12.710495640044165	5.0013214655416265	487055
487048	ML	asymptotic bias in information estimates and the exponential (bell) polynomials	2000	-14.79007363187235	4.508419125363547	487075
487369	Theory	the many proofs of an identity on the norm of oblique projections	2006	-14.750380443998713	4.680769100995564	487396
487512	Theory	four new bibds with block size seven	1993	-13.754738547274368	6.729408083163116	487539
487882	Theory	a pólya approximation to the poisson-binomial law	2012	-11.187720594902267	4.9036150603523785	487909
487947	Theory	smoothing for the zakharov and klein-gordon-schrödinger systems on euclidean spaces	2017	-11.930019042831864	4.240940558584578	487974
487998	ML	thinning of cluster processes: convergence of sums of thinned point processes	1984	-12.876120895941794	3.798649383356613	488025
488153	HPC	two-dimensional pattern matching with combined scaling and rotation	2008	-13.28726130856326	7.1944434443317355	488180
488293	Theory	algorithmic phase diagrams	1987	-14.584125301478062	5.3836299435356185	488320
488467	Theory	concentration inequalities	2003	-12.380691539124047	3.865735445585565	488494
488520	ECom	quasi-copulas and copulas on a discrete scale	2006	-13.269112250873446	4.036936262503408	488547
488521	Theory	a criterion for weak controllability	1968	-14.635790146447274	3.895783956082627	488548
488545	Theory	on the parameter v2(h)<=6h for l2-coloured graphs	1988	-11.76623658223164	6.101937447052376	488572
488778	Theory	a lower bound on the number of triangulations of planar point sets	2004	-12.630345867171908	6.9829816018412885	488805
488814	AI	binary sequences iii. complexity versus homogeneity and symmetry	1983	-12.307723010091529	5.88883030949191	488841
488834	Theory	characters of finite quasigroups vi: critical examples and doubletons	1990	-12.986265577002525	6.511941770309273	488861
488878	ML	new graceful familes of bipartite graphs	2004	-11.63390621053693	6.537662040323102	488905
488882	Theory	sharp probability bounds for the binomial moment problem with symmetry	2018	-12.743664907879724	3.69043443198058	488909
488899	Theory	reexamination of an information geometric construction of entropic indicators of complexity	2010	-12.05934124871785	3.909804379842088	488926
489030	Robotics	classification by reflective convex hulls	2008	-13.045399879731288	6.70651285738768	489057
489210	AI	"""comment on """"on the extended applications of homogeneous balance method"""""""	2004	-13.436384382793346	4.273947992413143	489237
489416	Theory	existence and approximation of fixed points of firmly nonexpansive-type mappings in banach spaces	2008	-14.82653905239222	3.7772841801344192	489443
489455	DB	erratum to: $$l^{2}$$ l 2 -norm transformation for improving k-means clustering	2017	-11.698341120519807	4.020371160015899	489482
489456	Logic	an algorithm for the solution of certain tridiagonal systems of linear equations	1972	-11.61061020417316	3.6621290588151036	489483
489556	Theory	fast computation of a class of running filters	1998	-14.571229134669695	5.478718688988737	489583
489588	Crypto	the number of multiplications involved in computing certain functions	1968	-11.246773616099873	4.979858092152125	489615
489660	Theory	semisimplicity of adjacency algebras of coherent configurations	2014	-14.026491384311006	6.856639640281012	489687
489678	DB	a characterization of the lines external to a hyperbolic quadric in pg(3, q)	2012	-12.995422171751585	5.932869374785633	489705
489807	Theory	integral sum graphs from a class of trees	2004	-11.214500466092431	5.289438877303956	489834
489884	AI	some theta-function identities	2007	-13.362819418972366	5.954112437674322	489911
489900	NLP	central limit theorems for a hypergeometric randomly reinforced urn	2016	-12.553454676210633	4.1252029551114	489927
490180	Theory	end-point results for multivalued mappings in partially ordered metric spaces	2012	-13.973781152036883	4.416867772236935	490207
490355	Theory	the koch curve: a geometric proof	2007	-11.503047907177324	5.170180991525831	490382
490360	PL	"""remark on """"algorithm 580: qrup: a set of fortran routines for updating qr factorizations"""""""	1982	-14.514204501853698	5.378918494113091	490387
490395	Vision	circulant weighing matrices	1998	-12.640721937082471	6.424892953926332	490422
490396	Theory	pie-sums: a combinatorial tool for partition theory	1981	-14.010243260260347	6.298260295235133	490423
491048	Robotics	going for large scale with nano-wireless simulations	2015	-12.544059410168078	4.9215601790826025	491075
491101	Crypto	minimum linear complexity approximation of sequences with period qn-1 over fq	2014	-12.224873439845188	5.920960692429969	491128
491177	Theory	a jump inversion theorem for the degree spectra	2007	-13.267523589721575	5.5486331984268835	491204
491278	AI	the homological reduction method for computing cocyclic hadamard matrices	2009	-14.899835330179524	5.8262951707443555	491305
491873	HPC	recurrences in vector mode: recursive (cyclic) reduction and recursive doubling	1986	-11.72674235451894	5.10516560535591	491900
492167	Theory	the sequential generation of random f-graphs. distributions and predominant types of edge maximal f-graphs with f>;4	1993	-13.424344663567906	6.628649167182053	492194
492324	Theory	planar graphs without cycles of length 4, 5, 8, or 9 are 3-choosable	2010	-12.439522057605776	7.352620733184353	492351
492363	Theory	forbidden subgraph conditions for hamilton cycles in implicit claw-heavy graphs	2016	-12.321065330380303	7.0436922373631905	492390
492378	Theory	the limit of a stanley-wilf sequence is not always rational, and layered patterns beat monotone patterns	2005	-13.870450103697008	6.7034529927752065	492405
492406	Theory	bounds among $f$-divergences	2015	-12.702962339425499	3.704892941067872	492433
492512	HPC	relay entanglement and clusters of correlated spins	2018	-12.344410863711307	4.810839938863211	492539
492715	Theory	a short proof of a 'strange' combinatorial identity conjectured by gosper	1991	-14.843001498398188	6.209383404047997	492742
492868	Theory	monotone edge sequences in line arrangements and applications (extended abstract)	1984	-11.275580484975993	6.395385541604752	492895
493154	Theory	using representation theorems for proving polynomials non-negative	2014	-14.443444887400053	5.421797268213668	493181
493256	Theory	towards a polynomial equivalence between k -packing functions and k-limited packings in graphs	2016	-11.476809709011368	6.9301677400936486	493283
493259	Theory	a new generalization of the erdös-ko-rado theorem	1986	-11.941771082523413	6.073746952306682	493286
493354	Visualization	a note on conditional-sum addition for base - 2 systems	1973	-11.655047123119855	5.263326888422168	493381
